title	journal_name	year	issue	author	keywords	summary	pdf_filename	article_url
高中信息技术课程的有效教学策略	信息系统工程	2016	2016年06期	【作者】 朱庆 ； 【机构】 贵州省铜仁市教学设备管理中心 ；	信息技术 ； 有效教学 ； 教学策略 ；	随着信息技术的不断发展,信息时代的到来赋予了教育更高的使命——培养学生的信息素养。高中作为学生接收信息知识最快时期,信息技术知识的掌握在一定程度上影响着学生未未来能力。那么如何提升信息技术课程教学有效性也就成为一个值得探讨的问题,本文从实际出发,提出了高中信息技术课程的有效教学策略,希望为高中信息技术课程的开展提供可借鉴经验。	2016年06期_高中信息技术课程的有效教学策略.pdf	http://sso.cdclib.org/interlibSSO/goto/6/=06190596Z93/kcms/detail/detail.aspx?dbCode=cjfq&filename=XXXT201606107&dbname=CJFDLAST2016
手势识别在教学中的应用	信息系统工程	2016	2016年06期	【作者】 朱娟 ； 【机构】 苏州大学计算机科学与技术学院 ； 江苏省海门中等专业学校 ；	手势识别 ； KINECT ； 计算机交互 ； 课堂教学 ；	本文主要讨论了手势识别的主要内容以及在教学中手势识别的作用。从教师的教和学生的学两个角度阐述了以手势识别为主要技术的教学平台对于这两项活动的辅助作用。最后对本文的内容作了总结,并提出了一些展望,希望有更多的教学资源能够加入手势识别的技术以更好的辅助教学过程。	2016年06期_手势识别在教学中的应用.pdf	http://sso.cdclib.org/interlibSSO/goto/6/=06190596Z93/kcms/detail/detail.aspx?dbCode=cjfq&filename=XXXT201606108&dbname=CJFDLAST2016
提高初中计算机信息课的实效性研究	信息系统工程	2016	2016年06期	【作者】 吴险峰 ； 【机构】 苏州市吴中区光福中学 ；	初中计算机 ； 实效性 ； 研究 ；	随着社会经济的发展,计算机技术应用逐渐广泛起来。计算机作为初中的一项重要课程,对于学生未来的计算机认知以及使用具有重要的作用。为了提高学生的学习能力以及应用计算机技能的能力,提高其综合能力,需要教师就实际情况对学生进行有别于传统教学观念的教学。这就要求教师除了能够拥有丰富的计算机类理论知识,熟练的计算机上机能力,还要能够充分地发挥本课程的趣味性,带领学生有兴趣地进行计算机课程,掌握更多的计算机知识。	2016年06期_提高初中计算机信息课的实效性研究.pdf	http://sso.cdclib.org/interlibSSO/goto/6/=06190596Z93/kcms/detail/detail.aspx?dbCode=cjfq&filename=XXXT201606109&dbname=CJFDLAST2016
高职android系统开发教学与人才培养模式研究	信息系统工程	2016	2016年06期	【作者】 朱蕾蕾 ； 【机构】 长春职业技术学院 ；	android系统 ； 软件专业 ； 高职院校 ； 教学 ； 实训 ；	随着3G时代的来临,手机已经普及,手机系统开发逐渐完善,现在普遍的手机系统是android系统,其次是一些大品牌特定的系统,例如三星、苹果等。android系统的迅速发展,带动android系统中软硬件开发人才的需求,尤其是初级开发人员。目前有很多学校开设软件开发专业,但是真正做到专业培养的依旧是高职院校,本文对高职院校培养人才的方式进行简要介绍,以期望对其他专业也有所帮助。	2016年06期_高职android系统开发教学与人才培养模式研究.pdf	http://sso.cdclib.org/interlibSSO/goto/6/=06190596Z93/kcms/detail/detail.aspx?dbCode=cjfq&filename=XXXT201606110&dbname=CJFDLAST2016
中职机制专业数控技术教学策略探析	信息系统工程	2016	2016年06期	【作者】 张兵 ； 【机构】 沈阳市装备制造工程学校 ；	中职机制专业 ； 数控技术 ； 教学策略 ；	数控技术作为现代化制造技术,其在社会中具有广泛的应用,同时也是中职机制专业重点教学内容。在机械制造与自动化专业教学中,教师需结合中职学校的办学特点、机制学生的发展需求采取有效的教学策略,提高数控技术教学的质量,为社会培养更多应用型数控人才。	2016年06期_中职机制专业数控技术教学策略探析.pdf	http://sso.cdclib.org/interlibSSO/goto/6/=06190596Z93/kcms/detail/detail.aspx?dbCode=cjfq&filename=XXXT201606111&dbname=CJFDLAST2016
计算思维与计算机课程改革的思路分析	信息系统工程	2016	2016年06期	【作者】 刘昶 ； 【机构】 江西财经职业学院 ；	计算思维 ； 计算机课程 ； 改革思路 ；	计算机教育改革必须要明确改革思维,要积极进行教育内容,技巧和方式的转变,要积极进行教育理念的改革创新,能够围绕计算思维进行改革才能保障计算机教育的效果。	2016年06期_计算思维与计算机课程改革的思路分析.pdf	http://sso.cdclib.org/interlibSSO/goto/6/=06190596Z93/kcms/detail/detail.aspx?dbCode=cjfq&filename=XXXT201606112&dbname=CJFDLAST2016
高校图书馆阅读推广策略与案例研究——以贵州理工学院“世界读书日”阅读推广活动为例	信息系统工程	2016	2016年06期	【作者】 徐新红 ； 刘瑞 ； 【机构】 贵州理工学院图书馆 ；	高校图书馆 ； 阅读推广 ； 世界读书日 ；	论文通过对高校开展的阅读推广活动进行总结,以贵州理工学院图书馆开展的"世界读书日"阅读推广活动为例,发现阅读推广部分问题,并提出了一些改进的建议。各高校图书馆应重视阅读推广的实效性,对所策划项目有所侧重。	2016年06期_高校图书馆阅读推广策略与案例研究——以贵州理工学院“世界读书日”阅读推广活动为例.pdf	http://sso.cdclib.org/interlibSSO/goto/6/=06190596Z93/kcms/detail/detail.aspx?dbCode=cjfq&filename=XXXT201606113&dbname=CJFDLAST2016
《现代国企研究》理论版论文征稿函	信息系统工程	2016	2016年06期	【机构】 《现代国企研究》编辑部 ；	征稿函 ； 理论版 ； 国内统一刊号 ；	<正>《现代国企研究》杂志是由中国兵器工业集团公司主管、主办的国家级经济期刊,中国核心期刊(遴选)数据库入选期刊、CSSCI数据库全文收录期刊、CNKI中国期刊全文数据库收录期刊。国内外公开发行,国内统一刊号:CN11-5992/F;国际刊号:ISSN2095-0322,经国家新闻出版广电总局和北京市新闻出版广电局(京新广函[2014]150号)批准,自2014年8月起由月刊变更为半月刊。	2016年06期_《现代国企研究》理论版论文征稿函.pdf	http://sso.cdclib.org/interlibSSO/goto/6/=06190596Z93/kcms/detail/detail.aspx?dbCode=cjfq&filename=XXXT201606114&dbname=CJFDLAST2016
食品安全信息化:构建食品安全最坚实的堡垒	信息系统工程	2016	2016年05期		食品安全信息 ； 美日 ； 追溯体系 ； 信息监管 ； 追溯系统 ； 标准体系建设 ； 信息不对称 ； 全产业链 ； 中国食品安全 ； 国内外食品 ；	<正>我国近年来发生了众多食品安全事故,触目惊心,食品安全问题一直难以绝迹。根据对欧美日等发达国家经验的借鉴,通过健全政府信息监管体系、实施食品追溯及检测等信息化手段将能有效解决食品安全中信息不对称的问题,食品安全信息化将是必然趋势。2016年1月27日发布的中央"一号文件"提出,实施食品安全战略,要加快健全从农田到餐桌的农产品质量和食品安全监管体系,建立全程可追溯、互联共享的信息平台,加	2016年05期_食品安全信息化:构建食品安全最坚实的堡垒.pdf	http://sso.cdclib.org/interlibSSO/goto/6/=06190596Z93/kcms/detail/detail.aspx?dbCode=cjfq&filename=XXXT201605001&dbname=CJFDLAST2016
厦门市加强食品安全信息化追溯体系建设	信息系统工程	2016	2016年05期		食品安全信息 ； 监管信息系统 ； 追溯体系 ； 生鲜食品 ； 市场监督管理 ； 高科技手段 ； 监管模式 ； 产品检验 ； 交易流程 ； 预包装食品 ；	<正>厦门市市场监督管理局高度重视食品安全监管工作,逐步建成了"两系统一平台"食品安全信息化监管网络,实现了"来源可溯、去向可追、监管高效、全员参与"的监管模式,基本达到了"运用高科技手段,实现高效能监管"的工作目标。第一,在生鲜食品监管方面。2005年,牵头建成了"厦门市生鲜食品安全监管信息系统"。该系统从生鲜食品批发源头抓起,通过将市场申报、产品检验、打印凭证、索证索票、市场查验等食品交易流程转化为数据流传输,使食品安	2016年05期_厦门市加强食品安全信息化追溯体系建设.pdf	http://sso.cdclib.org/interlibSSO/goto/6/=06190596Z93/kcms/detail/detail.aspx?dbCode=cjfq&filename=XXXT201605002&dbname=CJFDLAST2016
浙江筑梦食品药品质量安全大省以创新思维保舌尖安全	信息系统工程	2016	2016年05期		药品质量 ； 电子监管网 ； 药品监督 ； 监管框架 ； 主动防控 ； 风险防控 ； 社会监督 ； 药审中心 ； 认证检查 ； 不良反应信息 ；	<正>为保障舌尖上的安全,浙江在食品药品监管中不断探索着自己的思维。这种思维体现于整体监管框架的搭建。2015年,浙江省食品药品监督管理局提出并全面推进"三网六体系"建设。通过安全责任网、电子监管网、社会共治网的构建,和监管执法、风险防控、应急处置、技术支撑、标准法规、社会监督六大体系的建立健全,逐步推动食品药品质量安全监管工作从"被动整治"走向"主动防控",从"人海战术"走向	2016年05期_浙江筑梦食品药品质量安全大省以创新思维保舌尖安全.pdf	http://sso.cdclib.org/interlibSSO/goto/6/=06190596Z93/kcms/detail/detail.aspx?dbCode=cjfq&filename=XXXT201605003&dbname=CJFDLAST2016
用好人工智能,关键还在人类自身	信息系统工程	2016	2016年05期	【作者】 万宇 ； 余建斌 ； 廖政军 ； 冯雪珺 ； 贾文婷 ；	霍普菲尔德 ； 神经网络模型 ； 人工神经网络 ； 人类智能 ； 计算机科学 ； 知识工程 ； 沃森 ； 鲍曼 ； 斯坦福 ； 加州理工学院 ；	<正>人工智能一般被认为是通过模拟、延伸和扩展人类智能,产生具有类人智能的计算系统。经过半个多世纪的努力,人工智能技术在诸多领域取得了一连串重要突破。1968年,斯坦福大学计算机科学教授爱德华·费根鲍曼设计出第一个专家系统,拉开了知识工程的序幕;1982年,加州理工学院物理学家约翰·霍普菲尔德提出了新的神经网络模型,开创人工神经网络新局面;1997年,IBM"深蓝"电脑战胜国际象棋世界冠军卡斯帕罗夫;2011年,IBM超级计算机"沃森"在美国电视答	2016年05期_用好人工智能,关键还在人类自身.pdf	http://sso.cdclib.org/interlibSSO/goto/6/=06190596Z93/kcms/detail/detail.aspx?dbCode=cjfq&filename=XXXT201605004&dbname=CJFDLAST2016
新能源汽车:“新经济”领域的一个标志性行业	信息系统工程	2016	2016年05期		系统性工程 ； 工业排放 ； 节能环保产业 ； 便捷化 ； 污染治理 ； 政府工作报告 ； 京津冀区域 ； 城市交通 ； 高速公路服务区 ； 纯电动车 ；	<正>"十三五"期间,国家强力推进污染治理以及大力发展节能环保产业,雾霾治理是一项系统性工程,要在源头上采取有力措施,而汽车尾气将成为比工业排放更严重、更难以治理的源头。2016年,国务院总理李克强在第十二届全国人民代表大会第四次会议的《政府工作报告》提出,"大力发展和推广以电动汽车为主的新能源汽车,加快建设城市停车场和充电设施"。"新能源汽车"实现城市交通便捷化、清	2016年05期_新能源汽车:“新经济”领域的一个标志性行业.pdf	http://sso.cdclib.org/interlibSSO/goto/6/=06190596Z93/kcms/detail/detail.aspx?dbCode=cjfq&filename=XXXT201605005&dbname=CJFDLAST2016
一种前向神经网络定值子集训练算法	信息系统工程	2016	2016年05期	【作者】 刘江 ； 李淼 ； 【机构】 国家知识产权局专利局专利审查协作天津中心 ；	子集训练算法 ； QR分解 ； 独立神经元 ； 神经网络 ；	本文在LM算法的基础上,提出一种定值子集神经网络训练算法(FSBT)。其实质是对神经网络隐神经元输出矩阵进行QR分解,确定独立神经元。只对独立神经元的连接权值进行LM训练,非独立神经元的连接权值保持不变。仿真实验结果表明,本文给出的神经网络训练算法的训练速度明显优于LM算法,在拟合精度方面,该算法明显优于归零子集训练算法(ZSBT)。	2016年05期_一种前向神经网络定值子集训练算法.pdf	http://sso.cdclib.org/interlibSSO/goto/6/=06190596Z93/kcms/detail/detail.aspx?dbCode=cjfq&filename=XXXT201605006&dbname=CJFDLAST2016
自动控制在污水处理中的有效应用策略探讨	信息系统工程	2016	2016年05期	【作者】 吴朋化 ； 【机构】 西京学院 ；	自动控制 ； 污水处理 ； 智能控制 ； 应用 ；	本文就污水处理自动控制系统组成进行分析,介绍了当前污水处理中常用的自动化技术,提出了自动控制在污水处理中的应用策略。	2016年05期_自动控制在污水处理中的有效应用策略探讨.pdf	http://sso.cdclib.org/interlibSSO/goto/6/=06190596Z93/kcms/detail/detail.aspx?dbCode=cjfq&filename=XXXT201605007&dbname=CJFDLAST2016
大学生数字化学习能力培养探索	信息系统工程	2016	2016年05期	【作者】 李森 ； 【机构】 上海电机学院 ；	数字化学习 ； 数字化学习能力 ； 信息素养 ； 数字素养 ；	随着网络和通信工具的发展,高校的学习环境悄然变革,社会和大学生对数字化学习能力的需求有了新境界,为培养未来的人才高等教育者要重新思考大学生数字化学习能力的培养。本研究定义了数字化学习的概念,探讨了数字化学习能力的相关研究并结合实践构建了大学生数字化学习能力层级框架,提出了大学生数字化学习能力培养的实施策略。	2016年05期_大学生数字化学习能力培养探索.pdf	http://sso.cdclib.org/interlibSSO/goto/6/=06190596Z93/kcms/detail/detail.aspx?dbCode=cjfq&filename=XXXT201605008&dbname=CJFDLAST2016
浅析油田企业构建开源云之路	信息系统工程	2016	2016年05期	【作者】 苗恕宾 ； 【机构】 中国石油大港油田信息中心 ；	云计算 ； 开源 ； 闭源 ； OpenStack ；	云计算从概念到成熟,经历了较长的时间,闭源的商业云产品已经不能满足企业日益深化的云应用,少量客户的个性化定制,由于无法为闭源厂商提供满意的利益,导致云化改革的举步维艰。幸运的是,基于Open Stack的开源云的出现,能够有效解决当前油田企业的云化改革,实现云计算的灵活扩展和个性化定制。	2016年05期_浅析油田企业构建开源云之路.pdf	http://sso.cdclib.org/interlibSSO/goto/6/=06190596Z93/kcms/detail/detail.aspx?dbCode=cjfq&filename=XXXT201605009&dbname=CJFDLAST2016
关于数字化油田的研究	信息系统工程	2016	2016年05期	【作者】 王紫薇 ； 【机构】 大庆钻探工程公司测井公司信息中心 ；	油田建设 ； 数字化油田 ； 存在问题 ； 改进措施 ；	在油田建设当中建立数字油田可以实现科学化的管理和生产,从而使我国的油田事业得到更大的发展。文章从数字化油田概述出发,结合数字化油田建设过程中存在的问题,对如何做好数字化油田建设做了有关论述,旨在为做好数字化油田建设提供参考。	2016年05期_关于数字化油田的研究.pdf	http://sso.cdclib.org/interlibSSO/goto/6/=06190596Z93/kcms/detail/detail.aspx?dbCode=cjfq&filename=XXXT201605010&dbname=CJFDLAST2016
“大数据”技术在工控行业中的应用研究	信息系统工程	2016	2016年05期	【作者】 孙长江 ； 谢欣岳 ； 【机构】 新疆金牛能源物联网科技股份有限公司 ；	“大数据”技术 ； 工控行业 ； 应用 ；	工控行业主要是指工业自动化控制行业,具有极其广泛的涉及面,能够积极地推动社会进步和经济发展。将"大数据"技术应用到工控行业中,能够有效地提高工控行业的控制能力,促使自动化控制更加智能化。以下本文就"大数据"技术在工控行业中的应用展开探讨,并着重对"大数据"技术在工控行业应用的涵义进行阐述,旨在为相关技术人员提供参考,促进"大数据"技术应用质量的提升,实现工控行业的持续健康发展。	2016年05期_“大数据”技术在工控行业中的应用研究.pdf	http://sso.cdclib.org/interlibSSO/goto/6/=06190596Z93/kcms/detail/detail.aspx?dbCode=cjfq&filename=XXXT201605011&dbname=CJFDLAST2016
Flash动画制作中声音的处理与控制方法研究	信息系统工程	2016	2016年05期	【作者】 付为军 ； 【机构】 黄石艺术学校 ；	Flash动画制作 ； 声音处理 ； 控制方法 ；	在Flash动画制作过程中对声音的处理与控制需要一些实用的方式与技巧。如果在处理过程中选择图层或关键帧处理出现错误,那么将会导致声音无法正常播放。文章主要针对Flash动画制作中声音的处理与控制方法技巧进行探析,以期能够对Flash动画制作过程中对声音的控制处理起到移动的帮助作用。	2016年05期_Flash动画制作中声音的处理与控制方法研究.pdf	http://sso.cdclib.org/interlibSSO/goto/6/=06190596Z93/kcms/detail/detail.aspx?dbCode=cjfq&filename=XXXT201605012&dbname=CJFDLAST2016
通信技术与网络技术对广播电视发展的影响	信息系统工程	2016	2016年05期	【作者】 徐振 ； 【机构】 国家新闻出版广电总局五七三台 ；	通信技术和网络技术 ； 广播电视 ； 影响 ；	近几年来,我国通信技术和网络技术获得迅速的发展,极大地影响了人类社会的生活和生产方式,以信息技术手段为核心的新媒体也应运而生。新媒体时代的到来给人们的生活带来了更多的便利,但也给传统媒介-广播电视的发展带来了巨大的挑战。本文就新形势下通信技术与网络技术的发展对广播电视发展的影响进行了简要的分析,并阐述了广播电视在新形势下应该采取的具体措施。	2016年05期_通信技术与网络技术对广播电视发展的影响.pdf	http://sso.cdclib.org/interlibSSO/goto/6/=06190596Z93/kcms/detail/detail.aspx?dbCode=cjfq&filename=XXXT201605013&dbname=CJFDLAST2016
论云数据时代对智能化校园建设的影响	信息系统工程	2016	2016年05期	【作者】 罗伟 ； 【机构】 河南财政税务高等专科学校 ；	云数据时代 ； 智能化校园 ；	在当前信息技术飞速发展的情况下,充分利用云数据时代所能提供的强大的资源优势,可以更好发挥智能化校园的灵活性和自主性,更好地完成智能化校园建设。因此,文章选择基于云数据时代的智能化校园建设进行探究,挖掘云时代对智能化校园建设的影响。	2016年05期_论云数据时代对智能化校园建设的影响.pdf	http://sso.cdclib.org/interlibSSO/goto/6/=06190596Z93/kcms/detail/detail.aspx?dbCode=cjfq&filename=XXXT201605014&dbname=CJFDLAST2016
机载网络电台在试飞遥测监控中的应用	信息系统工程	2016	2016年05期	【作者】 支高飞 ； 尹川 ； 谷士鹏 ； 【机构】 中国飞行试验研究院 ；	网络电台 ； 遥测技术 ； 机载测试 ；	遥测技术是确保飞行安全监控的关键技术手段,可有效提高试验效率、降低试飞技术风险的有效措施。近年来得益于新技术的发展和完善,其对遥测等相关技术也起到了促进作用。在有些特殊要求的试飞领域,出现了网络电台作为遥测技术手段并实时传输机载测试参数,形成了一种独特的遥测监控技术途径。	2016年05期_机载网络电台在试飞遥测监控中的应用.pdf	http://sso.cdclib.org/interlibSSO/goto/6/=06190596Z93/kcms/detail/detail.aspx?dbCode=cjfq&filename=XXXT201605015&dbname=CJFDLAST2016
关于大数据与计算机信息处理技术的发展辨析	信息系统工程	2016	2016年05期	【作者】 陈成业 ； 【机构】 河南省南阳市宛城区河南油田信息管理中心 ；	大数据 ； 计算机信息处理技术 ； 发展 ；	伴随计算机网络技术的发展,大量的数据信息产生,当今的世界也逐渐从数据时代向大数据时代转变发展。大数据时代的产生和发展对计算机信息处理技术带来了冲击,导致现有的计算机技术很难满足大量数据信息的处理需求,同时由于网络环境缺少监管,也出现了一些数据安全问题。文章在阐述大数据、计算机信息处理技术内涵的基础上,根据近几年计算机信息处理技术的发展情况,为如何利用大数据实现计算机处理技术的发展进行分析。	2016年05期_关于大数据与计算机信息处理技术的发展辨析.pdf	http://sso.cdclib.org/interlibSSO/goto/6/=06190596Z93/kcms/detail/detail.aspx?dbCode=cjfq&filename=XXXT201605016&dbname=CJFDLAST2016
基于数据统计的4G网络切换自优化方法研究	信息系统工程	2016	2016年05期	【作者】 周维 ； 【机构】 湖北邮电规划设计有限公司 ；	网络管理 ； 4G网络 ； 自优化 ；	4G网络环境逐渐的到了普及,目前移动通信业务已经进入到了一个全新阶段,通信技术也得到了快速的进步和发展,网络结构也变的更加复杂。因此,也对网络运行管理提出了新要求,因此加强网络优化配置的意义重大。	2016年05期_基于数据统计的4G网络切换自优化方法研究.pdf	http://sso.cdclib.org/interlibSSO/goto/6/=06190596Z93/kcms/detail/detail.aspx?dbCode=cjfq&filename=XXXT201605017&dbname=CJFDLAST2016
浅议PDA在高校图书馆的实践应用	信息系统工程	2016	2016年05期	【作者】 王诗涵 ； 【机构】 长春师范大学图书馆 ；	PDA(读者决策采购) ； 高校图书馆 ； 技术实践 ；	高校图书馆藏书体系的不合理、重文轻理导致大量图书闲置,图书馆利用率不高是困扰很多高校图书馆的问题。过去以图书馆采访员为中心,追求大而全的图书馆藏书模式已经落后,取而代之的是更为有针对性、与用户服务对接的PDA(即读者决策采购)模式。很多高校图书馆开始逐步进行PDA可行性实践,除了改变传统高校图书馆采购政策和制度外,还需在技术层面进行一系列的改革。笔者从PDA的概念及发展、PDA对比传统采购的优势、及PDA在高校图书馆的实践应用三个方面对PDA在高校图书馆的实践及成效进行分析。	2016年05期_浅议PDA在高校图书馆的实践应用.pdf	http://sso.cdclib.org/interlibSSO/goto/6/=06190596Z93/kcms/detail/detail.aspx?dbCode=cjfq&filename=XXXT201605018&dbname=CJFDLAST2016
构建基于“职业发展树”生态系统的职业生涯规划创新实践	信息系统工程	2016	2016年05期	【作者】 童文凤 ； 张冰冰 ； 詹大威 ； 【机构】 浙江省电力实业总公司 ；	职业发展树 ； 青年骨干 ； 职业生涯规划 ；	作为省公司直属集体企业,实业公司积极构建以产业集团为支撑的设计管控型发展新战略,而作为其落地承载主体的人力资源条线,如何打造与之相匹配的动态战略人力资源支撑体系便成为当务之急。紧跟电力改革发展趋势,依托省公司职业发展手册,结合实业公司现状实际,创造性地提出并系统构建"1+7"职业发展树生态系统。通过"五立足"实施"五大工程",为青年骨干量身定制了职业生涯规划书,从岗位履职、任职资格晋级、技能提升培训、绩效薪酬激励、员工关爱等诸多方面为公司员工搭建科学化、多元化、广度化的职业发展平台,为公司发展提供强有力人才支撑。	2016年05期_构建基于“职业发展树”生态系统的职业生涯规划创新实践.pdf	http://sso.cdclib.org/interlibSSO/goto/6/=06190596Z93/kcms/detail/detail.aspx?dbCode=cjfq&filename=XXXT201605019&dbname=CJFDLAST2016
地级市智慧环保平台建设的思路和体会	信息系统工程	2016	2016年05期	【作者】 严兴祥 ； 【机构】 泰州市环境监测中心站 ；	政府公共管理 ； 城市建设 ； 产业转型升级 ； 数据交换平台 ； 物联网 ； 监控对象 ； 环境管理 ； 感应器 ； 监控系统 ； 信息技术 ；	<正>加快智慧城市建设是我市突破城乡经济社会发展瓶颈制约、促进产业转型升级的客观需要,也是提升政府公共管理效能和城乡居民生活品质的有效途径。智慧城市建设的实质是利用先进的信息技术,实现城市智慧式管理和运行,进而为城市中的人创造更美好的生活,促进城市的和谐、可持续成长。而"智慧环保"作为智慧城市的重要组成部分,是"数字环保"概念的延伸和拓展,它是借助物联网技术,把感应器和装备嵌入到各种环境监控对象中,通过云计算和大数据	2016年05期_地级市智慧环保平台建设的思路和体会.pdf	http://sso.cdclib.org/interlibSSO/goto/6/=06190596Z93/kcms/detail/detail.aspx?dbCode=cjfq&filename=XXXT201605020&dbname=CJFDLAST2016
