title	journal_name	year	issue	author	keywords	summary	pdf_filename	article_url
探讨计算机主机隐秘信息取证技术	信息系统工程	2016	2016年03期	【作者】 章伟 ； 【机构】 贵州财经大学信息学院 ；	计算机 ； 主机隐秘信息 ； 取证技术 ； 探究 ；	在随着计算机网络时代的到来,计算机犯罪的发生率也在逐年增高,同时网络环境下的计算机犯罪其犯罪手段更加隐秘、危害性也更大。在这样的背景下,在近些年来计算机隐秘信息取证技术就得到了广泛的关注,其逐渐成为了解决争议、打击计算机犯罪的重要途径之一。	2016年03期_探讨计算机主机隐秘信息取证技术.pdf	http://sso.cdclib.org/interlibSSO/goto/6/=06190596Z93/kcms/detail/detail.aspx?dbCode=cjfq&filename=XXXT201603026&dbname=CJFDLAST2016
基于CAN总线的汽车网络控制研究	信息系统工程	2016	2016年03期	【作者】 彭铁牛 ； 席自强 ； 【机构】 湖北工业大学电气与电子工程学院 ； 湖北工业大学 ；	CAN总线 ； 智能 ； 节点 ；	随着汽车技术在近些年的不断发展,汽车的技术含量越来越高,但由于电路的增多、也导致了汽车的可靠性出现了问题,同时生产成本也略有提升。为了解决这一问题,本文使用基于CAN总线技术来实现汽车网络控制。利用CAN、LIN节点和CAN网关完成相应的设计,从而提升车内的通信质量,这样就很好地提升了车内的网络通信质量,也优化了车内相关布局。	2016年03期_基于CAN总线的汽车网络控制研究.pdf	http://sso.cdclib.org/interlibSSO/goto/6/=06190596Z93/kcms/detail/detail.aspx?dbCode=cjfq&filename=XXXT201603027&dbname=CJFDLAST2016
屏蔽室应用波导管的实用设计	信息系统工程	2016	2016年03期	【作者】 黄海 ； 【机构】 中国航空规划设计研究总院有限公司 ；	给水管 ； 排污管 ； 截止波导管 ； 截止频率 ； 截止波长 ； 电磁屏蔽室 ；	在某些特殊要求工程中设置的屏蔽室,给排水设计往往采用通液截止波导作为屏蔽室上下水的通道,文中对实际应用中的通液波导屏蔽效能进行了分析,对波导管中存在介质带来屏蔽效能降低给出了解决方法。	2016年03期_屏蔽室应用波导管的实用设计.pdf	http://sso.cdclib.org/interlibSSO/goto/6/=06190596Z93/kcms/detail/detail.aspx?dbCode=cjfq&filename=XXXT201603028&dbname=CJFDLAST2016
大型通用CFD软件体系结构与数据结构研究	信息系统工程	2016	2016年03期	【作者】 李懿 ； 武建新 ； 【机构】 内蒙古工业大学 ；	大型通用CFD软件 ； 体系结构 ； 数据结构 ； 研究 ；	从国内外CFD软件研究的现状看,因国内在CFD软件的研究上起步较晚,因此,与国外存在着一定的差距,基于目前市场对大型通用CFD软件实际需求的现状看,需要从CFD软件体系结构与数据结构上进行进一步的完善,以在提升这一软件性能的基础上,强化软件件数据的共享性。本文在阐述大型通用CFD软件体系结构与数据结构需求的基础上,对相应的体系结构与数据结构进行了具体的研究与分析,以供参考。	2016年03期_大型通用CFD软件体系结构与数据结构研究.pdf	http://sso.cdclib.org/interlibSSO/goto/6/=06190596Z93/kcms/detail/detail.aspx?dbCode=cjfq&filename=XXXT201603029&dbname=CJFDLAST2016
互联网+背景下黑龙江省信息服务外包产业发展对策研究	信息系统工程	2016	2016年03期	【作者】 霍云艳 ； 才智 ； 张学金 ； 【机构】 哈尔滨金融学院 ； 黑龙江科技大学 ；	互联网+ ； 黑龙江省 ； 信息服务外包 ；	软件是信息产业的核心,直接关系国家经济和社会的发展和进步,在"互联网+"的行动纲领指导下,黑龙江省老工业基地加快信息和软件服务外包行业发展,以信息化促进工业化,走新型工业化道路,对软件产业发展提出新的要求。	2016年03期_互联网+背景下黑龙江省信息服务外包产业发展对策研究.pdf	http://sso.cdclib.org/interlibSSO/goto/6/=06190596Z93/kcms/detail/detail.aspx?dbCode=cjfq&filename=XXXT201603030&dbname=CJFDLAST2016
浅谈计算机数据库技术的应用	信息系统工程	2016	2016年03期	【作者】 邓静 ； 【机构】 重庆航天职业技术学院 ；	计算机 ； 数据库技术 ； 计算机信息 ；	随着科学技术的高速发展,计算机的应用范围已经逐步渗透到了各行各业。所以,计算机技术的应用已经成为社会发展的重要组成部分,计算机数据库技术是计算机技术中重要的分支技术,计算机数据库技术的发展和创新是更好的发挥计算机处理相关数据信息技术的关键。本文从计算机数据库技术的应用角度,多方面论述了计算机数据库技术的特征、应用现状和创新发展,希望通过本文的阐述内容,能给计算机工作人员的研究拓展一些思路。	2016年03期_浅谈计算机数据库技术的应用.pdf	http://sso.cdclib.org/interlibSSO/goto/6/=06190596Z93/kcms/detail/detail.aspx?dbCode=cjfq&filename=XXXT201603031&dbname=CJFDLAST2016
浅析云计算在电子政务系统中的应用研究	信息系统工程	2016	2016年03期	【作者】 黄佳 ； 【机构】 江西省财政厅 ； 思创数码科技股份有限公司 ；	云计算 ； 电子政务系统 ； 应用 ； 研究 ；	随着现代信息技术的发展,电子政务系统会遇到多种难题,为了能提高政务系统工作效率而引入了云计算模式,其强大的功能也在各个领域中发挥着重要作用。本文首先阐述云计算的相关概念及特点,其次着重探讨了电子政务系统中云计算的应用,以期对政务工作的顺利运转而有所裨益。	2016年03期_浅析云计算在电子政务系统中的应用研究.pdf	http://sso.cdclib.org/interlibSSO/goto/6/=06190596Z93/kcms/detail/detail.aspx?dbCode=cjfq&filename=XXXT201603032&dbname=CJFDLAST2016
Olap技术在钛铁合金生产工艺参数分析中的应用实践	信息系统工程	2016	2016年03期	【作者】 孙汝超 ； 顾平 ； 【机构】 广西大学计算机与电子信息学院 ；	钛铁合金 ； 联机分析处理(OLAP) ； OWC11 ； DELPHI 7 ；	结合某特种合金企业目前已有的基于联机事务处理(OLTP)技术的数据库管理系统,针对钛铁合金生产数据实际采集情况,应用先进的联机分析处理(OLAP)技术,采用微软Office Web Components 11.0(OWC11)组件和DELPHI 7可视化编程工具实现对存储在SQL Server2005数据库中的数据进行分析,为企业有效决策提供依据。	2016年03期_Olap技术在钛铁合金生产工艺参数分析中的应用实践.pdf	http://sso.cdclib.org/interlibSSO/goto/6/=06190596Z93/kcms/detail/detail.aspx?dbCode=cjfq&filename=XXXT201603033&dbname=CJFDLAST2016
公共服务平台的移动服务系统研究	信息系统工程	2016	2016年03期	【作者】 何伯祥 ； 【机构】 南通市人力资源和社会保障信息中心 ；	公共服务平台 ； 移动服务系统 ； 信息化 ；	目前政府在人力资源和社会保障方面正在不断健全其体制,推动了业务中跨部门和跨区域的发展,并且在业务的流动性、可持续性等方面也有了更高的要求,为了与人民群众不断增长的公共服务需求相适应,构建公共服务平台的移动服务系统是非常有必要的,本文从其构建的目标和思路两个方面进行了研究。	2016年03期_公共服务平台的移动服务系统研究.pdf	http://sso.cdclib.org/interlibSSO/goto/6/=06190596Z93/kcms/detail/detail.aspx?dbCode=cjfq&filename=XXXT201603034&dbname=CJFDLAST2016
油田勘探开发数据汇交系统	信息系统工程	2016	2016年03期	【作者】 刘万伟 ； 荣海亮 ； 【机构】 大庆油田勘探开发研究院 ；	勘探开发 ； 数据汇交 ； 计划任务 ； 质量控制 ；	通过对油田勘探开发各领域产生数据范围、类型、格式的汇总分析,明确油田数据汇交标准及原则,提出油田数据汇交结合油田实际生产进度,按计划任务管理的模式。系统通过准确描述油田井、单位、数据内容之间的关系,采用灵活的定制技术,解决了油田数据多源、多格式,数据汇交无法控制的难题。系统在油田实际运行取得良好的数据汇交效果,提升了油田数据汇交及时性、齐全性与准确性。	2016年03期_油田勘探开发数据汇交系统.pdf	http://sso.cdclib.org/interlibSSO/goto/6/=06190596Z93/kcms/detail/detail.aspx?dbCode=cjfq&filename=XXXT201603035&dbname=CJFDLAST2016
基于核心能力的企业战略网络——网络经济时代的企业战略管理模式	信息系统工程	2016	2016年03期	【作者】 朱靖 ； 【机构】 中国铁通集团有限公司乌鲁木齐分公司 ；	核心能力 ； 网络经济时代 ； 企业战略管理模式 ；	网络时代的到来,改变了以往的众多企业各自为战,独立运营的局面。在信息社会中,各行各业需要联合起来,共同组建成商业圈的生态系统。各个企业根据各自的差异都有分工,扮演好各自的角色,形成价值共享的一种生存模式。本文将对网络时代的企业战略构建存在哪些问题一一进行分析,并对如何解决这些问题提出一些措施方法,希望对新时代的企业如何构建战略有所借鉴。	2016年03期_基于核心能力的企业战略网络——网络经济时代的企业战略管理模式.pdf	http://sso.cdclib.org/interlibSSO/goto/6/=06190596Z93/kcms/detail/detail.aspx?dbCode=cjfq&filename=XXXT201603036&dbname=CJFDLAST2016
医院信息系统安全风险管理对策研究	信息系统工程	2016	2016年03期	【作者】 胡名坚 ； 【机构】 广东省佛山市第一人民医院 ；	医院信息系统 ； 安全 ； 风险 ；	随着医院规模的日渐增大,医院的各类数据不断增多,信息系统在医院的日常管理中发挥着越来越重要作用。信息系统的安全稳定是实现医院业务发展以及患者信息安全的重要保障。本文分析了医院管理信息系统的所面临的问题,同时探讨了构建医院管理信息系统安全的有效策略。	2016年03期_医院信息系统安全风险管理对策研究.pdf	http://sso.cdclib.org/interlibSSO/goto/6/=06190596Z93/kcms/detail/detail.aspx?dbCode=cjfq&filename=XXXT201603037&dbname=CJFDLAST2016
管理运营领域中计算机自动化的应用实践略述	信息系统工程	2016	2016年03期	【作者】 秦彦铭 ； 【机构】 大连江申计算机网络科技有限公司 ；	企业 ； 管理运营 ； 计算机自动化 ；	随着信息时代的到来,企业要更新管理运营手段,积极引入计算机自动化技术,加快企业管理信息化建设,提高企业管理运营效率,降低企业运营成本,增强企业竞争实力。本文对管理运营领域中计算机自动化的应用优势及应用实践策略进行论述,期望对企业建立起科学的信息化管理模式有所帮助。	2016年03期_管理运营领域中计算机自动化的应用实践略述.pdf	http://sso.cdclib.org/interlibSSO/goto/6/=06190596Z93/kcms/detail/detail.aspx?dbCode=cjfq&filename=XXXT201603038&dbname=CJFDLAST2016
信息管理中计算机数据库的安全应用	信息系统工程	2016	2016年03期	【作者】 汪文娟 ； 岳恒 ； 【机构】 成都双流国际机场 ；	计算机数据库 ； 安全性 ； 应用 ；	信息技术目前已应用于各行各业,计算机数据库的应用也更加广泛,这对于促进我国企业经济的发展起着重要的作用。计算机数据库具有灵活、可控、结构、独立等特征,但在安全性方面还存在一定的缺陷,必须要进一步提高其安全性能,使计算机数据库技术在信息管理中发挥更为重要的作用。	2016年03期_信息管理中计算机数据库的安全应用.pdf	http://sso.cdclib.org/interlibSSO/goto/6/=06190596Z93/kcms/detail/detail.aspx?dbCode=cjfq&filename=XXXT201603039&dbname=CJFDLAST2016
利用数据挖掘管理客户分析	信息系统工程	2016	2016年03期	【作者】 金歌 ； 【机构】 北京政法职业学院 ；	数据挖掘 ； 客户分析 ； 企业利润 ； 管理系统 ； 客户信息 ； 数据分析软件 ； 专业人才 ； 客户资料 ； 能力分析 ； 数据重组 ；	随着时代的发展和社会的进步,科学技术在不断的创新和提高。企业在迎来更多机遇的同时,也面临着巨大压力和挑战。客户是企业的生存根本,对企业发展起着决定性作用,管理好客户可以给企业增加利润和竞争力。而数据挖掘作为一种理性的方法,对人文和感性管理客户关系起到了非常必要的补充作用,更具有科学性。但数据挖掘管理客户目前还存在着选择来源缺乏、信息不完整、管理系统更新换代慢和专业人才缺乏的问题。本文通过对数据挖掘技术和客户关系管理进行了分析,企业可有效提升客户管理效率,全面企业利润和竞争力。	2016年03期_利用数据挖掘管理客户分析.pdf	http://sso.cdclib.org/interlibSSO/goto/6/=06190596Z93/kcms/detail/detail.aspx?dbCode=cjfq&filename=XXXT201603040&dbname=CJFDLAST2016
浅谈模块化的软件开发项目中的质量管理	信息系统工程	2016	2016年03期	【作者】 施培培 ； 【机构】 中国海洋石油总公司 ；	质量管理 ； 软件开发 ； 模块化 ；	随着信息技术项目的增多,项目管理工作越发的引人重视,质量管理工作是其中的一部分,其贯穿整个项目过程。过去的软件开发很少考虑功能复用,通常是每个功能需求都需要通过代码开发来完成,而现在更多的是模块化开发,本文就模块化的软件开发项目质量管理过程中一些注意点加以阐述。	2016年03期_浅谈模块化的软件开发项目中的质量管理.pdf	http://sso.cdclib.org/interlibSSO/goto/6/=06190596Z93/kcms/detail/detail.aspx?dbCode=cjfq&filename=XXXT201603041&dbname=CJFDLAST2016
基于SQL注入暴力猜解获取ASP网站账号的方法与防范对策研究	信息系统工程	2016	2016年03期	【作者】 赵北庚 ； 【机构】 中国刑事警察学院网络犯罪侦查系 ；	SQL注入 ； 暴力猜解 ； ASP ； 网络攻防 ；	为研究通过SQL注入暴力猜解的方式获取ASP网站账号的原理和技巧,设计了一个实验,搭建了一个包含SQL注入漏洞的ASP网站,并通过SQL注入工具对其进行SQL注入攻击,并在此基础上总结了此类攻击的工作流程和防范思路。实验思路和过程对研究SQL注入相关的网络攻防技术有积极意义。	2016年03期_基于SQL注入暴力猜解获取ASP网站账号的方法与防范对策研究.pdf	http://sso.cdclib.org/interlibSSO/goto/6/=06190596Z93/kcms/detail/detail.aspx?dbCode=cjfq&filename=XXXT201603042&dbname=CJFDLAST2016
超低渗透油田增压点原油外输控制改造探索	信息系统工程	2016	2016年03期	【作者】 惠彬 ； 【机构】 中国石油长庆油田分公司通信处 ；	增压点 ； 原油外输 ； 模糊控制 ； 改造 ；	长庆油田所属区块大多为低渗透油藏地层结构,开发难度更大,适宜于超前注水开发。为降低员工劳动强度,本文根据连续平稳输油的要求,并结合现场采油的间歇性,基于数字化建设理念提出了一种基于模糊控制的增压点原油外输控制方案,并将其应用在生产现场,使输油的稳定性得到了提高,同时在电能损耗方面也得到了降低。	2016年03期_超低渗透油田增压点原油外输控制改造探索.pdf	http://sso.cdclib.org/interlibSSO/goto/6/=06190596Z93/kcms/detail/detail.aspx?dbCode=cjfq&filename=XXXT201603043&dbname=CJFDLAST2016
论信息系统项目进度管理	信息系统工程	2016	2016年03期	【作者】 陈湘辉 ； 【机构】 清远职业技术学院 ；	信息系统 ； 进度 ；	××发展股份有限公司作为系统集成项目的总包商承接了××市公路客运联网售票系统建设项目。我作为项目经理负责全程管理该项目。该项目是××市交通信息化建设的重点工程,也是××市方便百姓出行,提高交通服务质量的"民心工程"。该项目主要业务是实现市内14个客运站的联网售票,在市内、郊区以及附近城市建立若干个代售网点,开展售票业务,实现乘客通过互联网进行查询、订票、购票等业务。该项目工期较长,历时一年多,涉及的项目干系人多,并且属于××市政府折子工程,要求必须在年底完成,因而该项目的时间管理是项目成功的关键。	2016年03期_论信息系统项目进度管理.pdf	http://sso.cdclib.org/interlibSSO/goto/6/=06190596Z93/kcms/detail/detail.aspx?dbCode=cjfq&filename=XXXT201603044&dbname=CJFDLAST2016
变电站运行通信管理信息系统的设计及实现	信息系统工程	2016	2016年03期	【作者】 李永双 ； 【机构】 唐山供电公司 ；	变电站 ； 运行通信管理系统 ； 质量评价 ；	本文针对变电站通信系统受自然条件和人为因素影响较大的问题,设计了由管理模块、文件存储模块、数据定量计算模块以及通信通道的定量分析和质量评价模块组成的变电站运行通信管理系统,实现了对工程相关资料的统一存储和管理,简化了数据的存储和处理过程,克服了自然环境条件的干扰和人为因素的影响,实现了人机交互的计算机智能质量评价,提高了工作效率。为通信运行的进行提供了重要参考。	2016年03期_变电站运行通信管理信息系统的设计及实现.pdf	http://sso.cdclib.org/interlibSSO/goto/6/=06190596Z93/kcms/detail/detail.aspx?dbCode=cjfq&filename=XXXT201603045&dbname=CJFDLAST2016
基于智能交通中的数字化停车管理系统的研究	信息系统工程	2016	2016年03期	【作者】 高阳 ； 【机构】 吉林师范大学 ；	数字化 ； 停车场管理 ； 停车诱导 ； 停车位预订 ；	随着我国大中城市的不断发展,城市车辆不断增加,与城市急剧扩大的停车位需求相比,现代社会存在着停车难得严重问题。数字化停车场实现了数字化、智能化、网络化管理。利用计算机技术来控制载车器工作,具有不停车收费,停车诱导,停车位预订,收取管理费用、管理车辆安全等功能。整个过程方便、简单、可靠、安全、存取快捷。	2016年03期_基于智能交通中的数字化停车管理系统的研究.pdf	http://sso.cdclib.org/interlibSSO/goto/6/=06190596Z93/kcms/detail/detail.aspx?dbCode=cjfq&filename=XXXT201603046&dbname=CJFDLAST2016
核电厂电缆老化管理系统组成内容与搭建	信息系统工程	2016	2016年03期	【作者】 乌晓燕 ； 汪琳 ； 钟志民 ； 【机构】 国核电站运行服务技术有限公司 ；	电缆 ； 老化管理 ； 信息系统 ； 状态监测 ；	提出并搭建了包括工程板块、科研板块和管理板块的核电厂电缆老化管理系统。介绍了各模块的组成内容与搭建实现方式。该系统的搭建与应用提高了核电厂电缆老化管理的管理方法、技术能力。	2016年03期_核电厂电缆老化管理系统组成内容与搭建.pdf	http://sso.cdclib.org/interlibSSO/goto/6/=06190596Z93/kcms/detail/detail.aspx?dbCode=cjfq&filename=XXXT201603047&dbname=CJFDLAST2016
谈我院信息安全等级保护建设工作	信息系统工程	2016	2016年03期	【作者】 王磊 ； 【机构】 蚌埠医学院第二附属医院 ；	医院信息安全 ； 等级保护工作 ； 等级测评 ；	随着信息安全等级保护工作的不断深化,已延伸到医疗卫生行业。卫计委要求三级医院核心业务系统定级不低于第三级。本文结合医院实际,介绍了医院信息安全等级保护工作的建设,阐明了信息系统的定级、备案、整改、测评四个实施步骤,以供大家探讨。	2016年03期_谈我院信息安全等级保护建设工作.pdf	http://sso.cdclib.org/interlibSSO/goto/6/=06190596Z93/kcms/detail/detail.aspx?dbCode=cjfq&filename=XXXT201603048&dbname=CJFDLAST2016
社区网接入安全解决方案	信息系统工程	2016	2016年03期	【作者】 孙琳 ； 【机构】 天津市大港油田信息中心 ；	出口链路负载均衡 ； 端口复用 ； 会话维护 ； 策略路由 ；	随着用户数量的增加,在上网高峰时段,用户反应网络速度慢的声音越来越强烈。社区网络的安全和优化已经摆在了我们的面前,如何保障链路的稳定运行,如何提升链路的利用率,如何在有效管理链路的前提下降低运维成本等,是我们普遍关注的问题。对此,本论文着重论述了社区网络接入安全解决方案,就是针对上述三个方面的需求,提供包含多出口链路负载均衡、端口复用、会话维护、策略路由、应用引流、可追溯日志等多个方面的安全技术,实现对社区网络信息资源的有效保护。	2016年03期_社区网接入安全解决方案.pdf	http://sso.cdclib.org/interlibSSO/goto/6/=06190596Z93/kcms/detail/detail.aspx?dbCode=cjfq&filename=XXXT201603049&dbname=CJFDLAST2016
信息化项目开发安全研究	信息系统工程	2016	2016年03期	【作者】 马全斌 ； 【机构】 天津市住房公积金管理中心 ；	信息化 ； 系统开发 ； 开发安全 ；	随着我国信息化产业的不断发展,信息化项目的不断立项,其开发的安全问题越来越棘手,稍有不慎便会造成系统无法服务或者是私密数据被窃取,因此,安全问题的重要性和迫切性已不容忽视。本文通过对信息化项目开发安全问题的研究,提出了加强安全性的几种途径,并针对各个途径给出相关建议。	2016年03期_信息化项目开发安全研究.pdf	http://sso.cdclib.org/interlibSSO/goto/6/=06190596Z93/kcms/detail/detail.aspx?dbCode=cjfq&filename=XXXT201603050&dbname=CJFDLAST2016
战术通信网可靠性与抗毁性综合评估方法及应用研究	信息系统工程	2016	2016年03期	【作者】 崔哲 ； 【机构】 浙江省宁波市公安海警学院电子技术系 ；	战术通信网 ； 综合评估方法 ； 可靠性 ；	随着科学技术和通信网络的发展,如今通信网的发展越来越完善。战术通信网主要是为作战部队服务,即作战部队在战场上运用各种通信手段的基础,其对作战部队在如今信息化战争中,具有非常重要的作用,因此注重战术通信网可靠性与抗毁性进行评估,能够有效取得战场信息权的胜利。本文主要针对战术通信网可靠性与抗毁性综合评估方法和综合评估应用进行了研究和探讨,以期促进战术通信网资源配置的优化,从而加强信息化战争的防范。	2016年03期_战术通信网可靠性与抗毁性综合评估方法及应用研究.pdf	http://sso.cdclib.org/interlibSSO/goto/6/=06190596Z93/kcms/detail/detail.aspx?dbCode=cjfq&filename=XXXT201603051&dbname=CJFDLAST2016
企业信息安全风险及控制策略探究	信息系统工程	2016	2016年03期	【作者】 刘志勋 ； 【机构】 中国石化销售有限公司山东石油分公司 ；	信息安全 ； 风险 ； 控制 ； 信息系统 ；	随着我国信息化的发展,如今企业在管理工作中对信息技术的运用越来越广泛,由此大大提高了企业管理效率的同时,也造成信息安全的隐藏风险,这对企业造成的危害不可小视。基于此,本篇文章就企业安全风险管理的内容出发,阐述了企业信息安全风险管理存在的问题,并提出了解决措施。	2016年03期_企业信息安全风险及控制策略探究.pdf	http://sso.cdclib.org/interlibSSO/goto/6/=06190596Z93/kcms/detail/detail.aspx?dbCode=cjfq&filename=XXXT201603052&dbname=CJFDLAST2016
新时期高校网络安全问题与防范对策研究	信息系统工程	2016	2016年03期	【作者】 柳华 ； 【机构】 陕西中医药大学 ；	高校 ； 网络安全 ； 问题 ； 防范对策 ；	网络的快速发展给高校的科研、管理、办公等各方面带来了便利,但也面临着多方面的威胁。文中分析了高校网络安全存在的一些问题,从软硬件配备、人为因素及网络管理等方面,提出了相应的防范对策。	2016年03期_新时期高校网络安全问题与防范对策研究.pdf	http://sso.cdclib.org/interlibSSO/goto/6/=06190596Z93/kcms/detail/detail.aspx?dbCode=cjfq&filename=XXXT201603053&dbname=CJFDLAST2016
企业计算机防病毒企业统一管控体系建设	信息系统工程	2016	2016年03期	【作者】 田硕 ； 【机构】 中国机械设备工程股份有限公司综合管理部信息化办公室 ；	防病毒 ； 网络准入 ； 企业信息安全 ；	计算机终端安全是保障企业信息安全的基本要求。防病毒软件是能够满足企业计算机终端安全要求。企业终端安全水平取决于防病毒软件的部署率。网络准入产品可用于辅助防病毒部署实施,确保接入公司网络的计算机终端防处于合规的病毒软件保护状态。我司开展企业计算机防病毒企业统一管控体系建设,结合防病毒软件SEP和网络准入产品SNAC实现办公终端防病毒和统一管控,本文介绍了项目建设经验供参考。	2016年03期_企业计算机防病毒企业统一管控体系建设.pdf	http://sso.cdclib.org/interlibSSO/goto/6/=06190596Z93/kcms/detail/detail.aspx?dbCode=cjfq&filename=XXXT201603054&dbname=CJFDLAST2016
