title	journal_name	year	issue	author	keywords	summary	pdf_filename	article_url
教育信息化的基石 远程教育网络平台构架	信息系统工程	2001	2001年07期	【作者】 钟宏 ； 【机构】 本刊记者 ；	平台构架 ； 网络系统 ； 远程教育 ； 网络层 ； 网络大学 ； 网络平台 ； 软件配置 ； 计算机互联网 ； 必先 ； 信息网络 ；	俗话说:“工欲善其事,必先利其器。”要建设网络大学这样大的系统工程,网络平台的构建是所有系统的墓础和关键所在,其最终的目标是要建成一个先进高效、统一联动、合乎自己需求的网络系统。	2001年07期_教育信息化的基石+远程教育网络平台构架.pdf	http://sso.cdclib.org/interlibSSO/goto/6/=06190596Z93/kcms/detail/detail.aspx?dbCode=cjfq&filename=XXXT200107020&dbname=CJFD9902
城域教育网:从分散到融合	信息系统工程	2001	2001年07期	【作者】 孙宇靖 ；	网络技术 ； 应用服务 ； 网络应用环境 ； 城域网 ； 全面解决方案 ； 培训平台 ； 设计方案 ； 智能管理 ； 硬件基础设施 ； 在线培训 ；	城域教育网就是以网络技术为依托,以各种信息设施为支持,以教育资源和软件为基础,以实现信息化教育和管理为目的,为区域教育提供全方位应用服务的信息化环境的全面解决方案。	2001年07期_城域教育网:从分散到融合.pdf	http://sso.cdclib.org/interlibSSO/goto/6/=06190596Z93/kcms/detail/detail.aspx?dbCode=cjfq&filename=XXXT200107021&dbname=CJFD9902
数字图书馆自由遨游的“信息空间”	信息系统工程	2001	2001年07期	【作者】 苏宾 ；	数字图书馆 ； 信息空间 ； 图书馆自动化 ； 综合实力竞争 ； 基础结构 ； 电子图书馆 ； 传递网络化 ； 信息服务模式 ； 共享化 ； 信息时代 ；	数字图书馆建设近十年来正在日益被受到重视,各主要发达国家将其列为头号国家信息基础结构项目,并成为国家综合实力竞争的焦点之一。	2001年07期_数字图书馆自由遨游的“信息空间”.pdf	http://sso.cdclib.org/interlibSSO/goto/6/=06190596Z93/kcms/detail/detail.aspx?dbCode=cjfq&filename=XXXT200107022&dbname=CJFD9902
图书馆数字化建设的实施方案	信息系统工程	2001	2001年07期	【作者】 苏宾 ；	数字图书馆系统 ； 中国数字图书馆 ； 图书馆自动化 ； 网上图书馆 ； 文献数字化 ； 元数据标准 ； 实施方案 ； 数字资源库 ； 用户服务 ； 集成解决方案 ；	<正>图书馆数字化的建设是一个浩大的系统工程。 中国数字图书馆有限责任公司提出了一个适合国内用户的数字图书馆系统集成解决方案。	2001年07期_图书馆数字化建设的实施方案.pdf	http://sso.cdclib.org/interlibSSO/goto/6/=06190596Z93/kcms/detail/detail.aspx?dbCode=cjfq&filename=XXXT200107023&dbname=CJFD9902
网络存储促进网上教学资源共享	信息系统工程	2001	2001年07期	【作者】 高宏 ； 徐学雷 ； 【机构】 清华大学光盘国家工程研究中心 ； 清华大学光盘国家工程研究中心 ；	教学资源共享 ； 校园网环境 ； 并发用户 ； 并发访问 ； 数据流量 ； 多媒体教学资源 ； 镜像服务器 ； 磁盘阵列 ； 资源共享服务 ； 资金条件 ；	<正> 信息技术的飞速发展和广泛应用,为我国教育的发展提供了难得的机遇,通过信息化来加速带动教育现代化的发展成为可能。网络教学的核心是实现多媒体教学资源的全面共享,由于多媒体教学资源的数据量很大,而且同时接受网络教学的学生数量较多,因此校园网强的数据流量和并发访问人数均要比一般的局域网高很多。中小学校受资金条件的限制,在组建校园网、多媒体教室和电子阅览室时,通常采用安装WindowsNT操作系统的PC机作为网络服务器。随着多媒体网络教学的逐步深入,校园网中的数据流量和并发用户数迅猛增长,各个学校开始面临网络服务器超载的问	2001年07期_网络存储促进网上教学资源共享.pdf	http://sso.cdclib.org/interlibSSO/goto/6/=06190596Z93/kcms/detail/detail.aspx?dbCode=cjfq&filename=XXXT200107024&dbname=CJFD9902
3Com校园网络系统解决方案	信息系统工程	2001	2001年07期		校园网络系统 ； 以太网数据 ； 拨号方式 ； 系统自动化 ； 全双工 ； 防火墙系统 ； 核心交换机 ； 线传输 ； 校园网网络 ； 用户节点 ；	<正> 校园网涉及到学校内所有连接到网络的建筑物。对于一些不便于进行综合布线的区域,3COM公司给出独特的使用电话线传输以太网数据的10Base技术加以解决,速率突破传统拨号方式33.6K或者56K的极限,达到全双工10M速率。 网络系统在实现学校办公系统自动化的同时还是进行多媒体教学的重要工具。因此在具体方案配置时,既要把握好网络整体结构,还要对多媒体教室网络系统有具体专门的配置方案。 此外,还要考虑校园网Internet接入	2001年07期_3Com校园网络系统解决方案.pdf	http://sso.cdclib.org/interlibSSO/goto/6/=06190596Z93/kcms/detail/detail.aspx?dbCode=cjfq&filename=XXXT200107025&dbname=CJFD9902
方正e-school“电子校园”解决方案	信息系统工程	2001	2001年07期		e-school ； 信息化教学环境 ； 规划安排 ； 网络设施 ； 管理系统 ； 服务系统 ； 软件架构 ； 广播教学 ； 人员素质 ； 宽带多媒体 ；	<正> 方正认为校园网不只是技术方面的设计,而是包括网络设施、应用平台、信息资源、专业应用、人员素质等众多成分的综合化以及信息化教学环境系统。因此,在总体上如何筹划、组织网络建设和开发应用的设计思想是校园网建设中的最重要的问题。因此,方正e-school“电子校园”解决方案的设计原则从整体规划安排、先进性、开放性和标准化相结	2001年07期_方正e-school“电子校园”解决方案.pdf	http://sso.cdclib.org/interlibSSO/goto/6/=06190596Z93/kcms/detail/detail.aspx?dbCode=cjfq&filename=XXXT200107026&dbname=CJFD9902
联想校园网方案	信息系统工程	2001	2001年07期		千兆以太网 ； 快速以太网 ； 园区网 ； 网络主干 ； 方案设计 ； 专用服务器 ； 网络管理软件 ； 交换能力 ； 以太网卡 ； 文件服务器 ；	<正> 联想校园网全体方案设计,采用联想的LS-5608G智能型8口机箱式千兆以太网交换机作为校园网的中心主交换机,其提供了千兆位的交换能力。 校园网是一个园区网,因此网络主干采用光纤,通过中心交换机的千兆模块或快速以太网模块连接到几个主要建筑的二级交换机上。二级交换机选用联想的LS—5625智能型24+1口10/100M	2001年07期_联想校园网方案.pdf	http://sso.cdclib.org/interlibSSO/goto/6/=06190596Z93/kcms/detail/detail.aspx?dbCode=cjfq&filename=XXXT200107027&dbname=CJFD9902
惠普“校校通”整体解决方案	信息系统工程	2001	2001年07期		校校通 ； 主干交换机 ； 千兆 ； 建设平台 ； 学校教育 ； 子环 ； 成绩管理 ； 网络管理软件 ； 教师信息 ； 校产 ；	<正> “校校通”整体解决方案的目标是建立学校计算机网络,为学校教育教学提供信息化建设平台,实现现代化教育。惠普设施为主体的解决之道 主干环上的主干节点和子环上的主干节点,选择路由交换机 二级骨干交换机提供两个千兆	2001年07期_惠普“校校通”整体解决方案.pdf	http://sso.cdclib.org/interlibSSO/goto/6/=06190596Z93/kcms/detail/detail.aspx?dbCode=cjfq&filename=XXXT200107028&dbname=CJFD9902
创造明天——SUN拓伸中大校园	信息系统工程	2001	2001年07期	【作者】 商洪 ；	中大 ； SUN ； 网络学院 ； 大欲 ； 广州珠江 ； 二期建设 ； 目录服务 ； 学生宿舍区 ； 教育技术中心 ； 建设总投资 ；	<正> 早听说SUN的服务器在中国的大学里很流行,近闻中山大学网络学院正在扩招,记者于是来到了中大欲一探其信息化建设。 位于广州珠江边的中山大学是一座历史悠久而又美丽的著名学府。为了弘扬学术,中山大学还把其学风延伸到了珠海,建立了珠海分校。建立一所学校易,然而怎样沟通两个学校的文化氛围,保持著名学府的学风? “是网络解决了这个难题”,中山大	2001年07期_创造明天——SUN拓伸中大校园.pdf	http://sso.cdclib.org/interlibSSO/goto/6/=06190596Z93/kcms/detail/detail.aspx?dbCode=cjfq&filename=XXXT200107029&dbname=CJFD9902
方正圆明服务器在西安交大的应用	信息系统工程	2001	2001年07期		西安交大 ； 主干网 ； 建设项目 ； 互联设备 ； 中国教育网 ； 二期工程 ； 交通大学 ； 信息服务 ； 网络与信息 ； 思源 ；	<正> 西安交通大学计算机网络与信息中心(简称网络中心)成立于1996年4月,中国教育网西北网络中心就设在该中心,网络中心主要承担西安交通大学的校园网的建设和管理工作,为交大的广大师生教学、科研、管理提供信息服务。 西安交通大学校园网从1994年起建设,采用FDDI主干网。主干网通过架空光纤连通校园主要建筑物,互联设备采用DEC公司产品,共计三个一级节点(HUB900)和九个二级节点(HUB90)。根据“211”工程校园网建设项目的要求,目前主干网的规模和性能还不能满足要求,因此,二期工程将对校园网全面升	2001年07期_方正圆明服务器在西安交大的应用.pdf	http://sso.cdclib.org/interlibSSO/goto/6/=06190596Z93/kcms/detail/detail.aspx?dbCode=cjfq&filename=XXXT200107030&dbname=CJFD9902
神州数码D_Link全力架构东阳市教育网	信息系统工程	2001	2001年07期		D_Link ； 自动化水平 ； 计算机教育 ； 综合信息系统 ； 计算机信息网络 ； 信息交流 ； 骨干网络 ； 新模 ； 主管单位 ； 资源共享 ；	<正> 东阳市教育系统计算机骨干网络用来连接东阳市数十所教育单位,运用先进计算机信息网络技术,致力于提高教育自动化水平,为教育主管单位实施宏观调控以及学校间的信息交流、资源共享提供依据和现代化手段,是面向21世纪大型多媒体Internet计算机综合信息系统。 东阳市教育网建设的目标是:建成一个高速互连的计算机网络,创造一种以计算机教育、教学、管理为主的新模	2001年07期_神州数码D_Link全力架构东阳市教育网.pdf	http://sso.cdclib.org/interlibSSO/goto/6/=06190596Z93/kcms/detail/detail.aspx?dbCode=cjfq&filename=XXXT200107031&dbname=CJFD9902
应用CRM推动电信行业管理	信息系统工程	2001	2001年07期	【作者】 李文宇 ；	CRM ； 铁通公司 ； 业务市场 ； 中国移动 ； 多元化竞争 ； 固定电话业务 ； 移动电话业务 ； 移动业务 ； 呼叫中心 ； 寻呼业务 ；	国内电信运营商经过一段调整和重新定位后,在不同业务领域正初步形成多元化竞争的格局。据统计,目前我国的电信运营企业有3000多家,其中主要有中国电信、中国移动、联通、网通、铁通公司等,另外广电、电力等潜在竞争者也跃跃欲试,待“证”而发。各运营商正在大力新建或改造线路,以巩固已有市场,进而抢占新业务市场。电信运营商必须“以客户为中心”部署自己的整体战略,才能立于不败之地。	2001年07期_应用CRM推动电信行业管理.pdf	http://sso.cdclib.org/interlibSSO/goto/6/=06190596Z93/kcms/detail/detail.aspx?dbCode=cjfq&filename=XXXT200107032&dbname=CJFD9902
拓展企业通信业务新途径——无线通信连网技术	信息系统工程	2001	2001年07期	【作者】 蒋树春 ；	无线通信 ； 通信业务 ； 视频点播 ； 传送速率 ； 接入设备 ； 通信技术 ； 数据传输 ； 无线联网 ； 连网 ； 远程接入 ；	通信技术与网络的飞速发展,所要求的带宽与传送速率大幅度提高,相应地,网络核心设备、传输设备尤其是接入设备的发展具有广阔的市场前景。无论哪种接入,目的都是为了应用。本期围绕远程无线联网所涉及的相关的技术,从远程接入、数据传输、身份认证、视频点播等不同环节对远程连网的实现及产生的效果进行了报道。	2001年07期_拓展企业通信业务新途径——无线通信连网技术.pdf	http://sso.cdclib.org/interlibSSO/goto/6/=06190596Z93/kcms/detail/detail.aspx?dbCode=cjfq&filename=XXXT200107033&dbname=CJFD9902
视频点播技术传递通信新理念	信息系统工程	2001	2001年07期	【作者】 吴兆旭 ；	视频点播技术 ； 数字压缩技术 ； 电视技术 ； 传媒方式 ； 交叉结合 ； 多媒体技术 ； 视频服务器 ； 视讯会议 ； 管理系统 ； 客户端应用程序 ；	VOD是近年来新兴的传媒方式。该技术是计算机技术、网络通信技术、多媒体技术、电视技术和数字压缩技术等多学科、多领域融合交叉结合的产物。	2001年07期_视频点播技术传递通信新理念.pdf	http://sso.cdclib.org/interlibSSO/goto/6/=06190596Z93/kcms/detail/detail.aspx?dbCode=cjfq&filename=XXXT200107034&dbname=CJFD9902
宽带接入的技术选择	信息系统工程	2001	2001年07期	【作者】 李敏 ；	宽带接入 ； 视频点播 ； 宽带网 ； 有线电视网 ； 最后一公里 ； 在线教育 ； 技术选择 ； 用户端设备 ； 网络设备 ； 接入带宽 ；	<正> 目前,互联网遭遇寒流,电子商务也从神坛上骤然跌落,但是国内市场宽带建设依然火爆。从经济学角度看,需求是发展的唯一动力,在国内,因为宽带小区建设和在线教育日渐升温,带动了视频点播、多媒体在线传播的发展,促使宽带迅速普及。 宽带建设将带来整个电信业和网络业的大洗牌,在未来的两年内,宽带网的竞争将会从社区转移到办公室,新电信时代也许就由此开始。国内众商家关注“最后一公里”的宽带接入市场,构画了众多宽带接入方	2001年07期_宽带接入的技术选择.pdf	http://sso.cdclib.org/interlibSSO/goto/6/=06190596Z93/kcms/detail/detail.aspx?dbCode=cjfq&filename=XXXT200107035&dbname=CJFD9902
“宽带城域网”建设思考	信息系统工程	2001	2001年07期	【作者】 赵健峰 ；	中国联通 ； 中国电信 ； 宽带城域网 ； 中国移动 ； 出口带宽 ； 网络带宽 ； 带宽瓶颈 ； 主要参与者 ； 计费功能 ； 视频业务 ；	<正> 目前中国国内的互联网骨干建设市场基本瓜分完毕,主要参与者是中国电信、中国联通(2000年4月开通)和中国移动(正在兴建)三家大运营商。骨干网的改善极大地提高了国内网络带宽和国际出口带宽,并使边缘网络成为带宽瓶颈。因此理所当然地,包括上述三家在内的所有运营商都瞄准了下一个IP网络建设热点:即目前基本还是空白点的“城域网”。	2001年07期_“宽带城域网”建设思考.pdf	http://sso.cdclib.org/interlibSSO/goto/6/=06190596Z93/kcms/detail/detail.aspx?dbCode=cjfq&filename=XXXT200107036&dbname=CJFD9902
身份认证搭建远程连网之桥	信息系统工程	2001	2001年07期	【作者】 卢斌 ；	连网 ； 双因子 ； 电子商务时代 ； 网络传递 ； 红盖头 ； Novell ； 认证系统 ； 指纹识别系统 ； 用户认证 ； 资源访问控制 ；	<正> 点动鼠标能够买到美国的钢铁、中东的石油,查询行业资讯;坐在家中就能享受在线高等教育,用VOD点播大片……。今天实现这一切并不难,但要首先通过身份认证这一关。电子商务时代的特点是一切交易都通过远程联网进行,身份认证关系到资金的网络传递,尤显关键重要,好的身份认证系统是电子商务的安全屏障,是远程联网之桥。掀开身份认证的“红盖头” 身份认证并不神秘,以Novell单点	2001年07期_身份认证搭建远程连网之桥.pdf	http://sso.cdclib.org/interlibSSO/goto/6/=06190596Z93/kcms/detail/detail.aspx?dbCode=cjfq&filename=XXXT200107037&dbname=CJFD9902
电子商务推动传统银行变革	信息系统工程	2001	2001年07期	【作者】 马蔚华 ； 【机构】 招商银行 ；	支付体系 ； 支付服务 ； 媒介功能 ； 业务体系 ； 金融业务 ； 金融体制 ； 物质技术基础 ； 中间业务 ； 金融衍生业务 ； 人民币储蓄 ；	<正> 网络经济为传统银行功能的转变奠定了物质技术基础,商业银行在由传统的金融媒介主体向社会支付体系主体转变过程中,电子商务为传统银行开辟了更为广阔的发展空间。商业银行的基本功能主要有两项:一是资金媒介功能;二是支付服务功能。90年代以来,随着经济金融的全球化和网络技术的发展,银行提供支付服务的手段和技术更为先进多样,速度也更加快捷,从而使银行作为社会支付体系的功能不断得到加强,银行开始由传统的资金媒介主体向社会支付体系主体转变。	2001年07期_电子商务推动传统银行变革.pdf	http://sso.cdclib.org/interlibSSO/goto/6/=06190596Z93/kcms/detail/detail.aspx?dbCode=cjfq&filename=XXXT200107038&dbname=CJFD9902
突破发展瓶颈——交行深圳分行网络拓扑改造见成效	信息系统工程	2001	2001年07期	【作者】 梁科 ； 【机构】 交通银行深圳分行 ；	交通银行 ； 银行业务 ； 集中式数据处理 ； 数据处理机 ； 前置机 ； 网络构架 ； 金融同业 ； 处理业务 ； 星形 ； Motorola ；	<正> 互联网的迅速发展给银行带来无限商机,同时又对银行业务网络提出了更高的要求。在业务量和营业网点不断增加的情况下,原有的计算机网络构架可能成为银行业务发展的瓶颈。交通银行深圳分行通过合理的网络改造,给分行业务注入了新的生机和活力。 原有计算机网络 交通银行深圳分行现有营业网点近50个,网络结构为星形拓扑,采用集中式数据处理模式。AS/400-730小型机作为中央数据处理机,安置在分行电脑中心。	2001年07期_突破发展瓶颈——交行深圳分行网络拓扑改造见成效.pdf	http://sso.cdclib.org/interlibSSO/goto/6/=06190596Z93/kcms/detail/detail.aspx?dbCode=cjfq&filename=XXXT200107039&dbname=CJFD9902
行家谈经验 投资论热点	信息系统工程	2001	2001年07期	【作者】 赵军 ；	创业冲动 ； 风险投资家 ； 操作环节 ； 感知度 ； 销售渠道 ； 投人产出比 ； 发展潜力 ； 通信设备 ； 通信工具 ； 行业投入 ；	新经济的发展同时带来了一个崭新的概念;风险投资。但囿于技术的门槛和对新经济思维方式的感知度,风险投资还只是专业圈子里的一个话题。无论是从投资理念还是从具体的操作环节上,风险投资对于怀有创业冲动的有志之士还是有段距离。	2001年07期_行家谈经验+投资论热点.pdf	http://sso.cdclib.org/interlibSSO/goto/6/=06190596Z93/kcms/detail/detail.aspx?dbCode=cjfq&filename=XXXT200107040&dbname=CJFD9902
模糊教育	信息系统工程	2001	2001年07期	【作者】 周冰 ；	进攻型 ； 教育内容 ； 接受者 ； 信息技术 ； 中国教育 ； 网络大学 ； 被教育者 ； 传统教育 ； 网上教育 ； 防御型 ；	<正> 教育与学习 在我们所有的行业中,只有“教育行业”是一个很富有意味的动词结构。看到“教育”这个词我们会想到什么?学校、培训机构、资源(知识),当然还有学生(接受者)。在这个思维定势中,受教育的对象或获取知识的主体处在思维的底层,是被动和防御型的。同样,看到“学习”一词我们会联系到的首先是我们自己,然后是资源,最后可能是学校或机构。而我们自己——获得知识的主体,则处在我们思维的前方,它是主动和进攻型的。	2001年07期_模糊教育.pdf	http://sso.cdclib.org/interlibSSO/goto/6/=06190596Z93/kcms/detail/detail.aspx?dbCode=cjfq&filename=XXXT200107041&dbname=CJFD9902
助中小企业腾飞	信息系统工程	2001	2001年06期	【作者】 范向琪 ；	电子商务战略 ； 信息化市场 ； 信息化趋势 ； 共同难题 ； 商务服务 ； 技术服务公司 ； 运营维护 ； 市场信息 ； 物料管理 ； 财务电算化 ；	<正> 我国信息化建设发展速度很快,尤其是面向企业的互联网还有电子商务更是引起了人们的广泛关注。国内外许多知名的IT厂商纷纷推出自己的电子商务战略,且全国各地相关的研讨会、展销会更是此起彼	2001年06期_助中小企业腾飞.pdf	http://sso.cdclib.org/interlibSSO/goto/6/=06190596Z93/kcms/detail/detail.aspx?dbCode=cjfq&filename=XXXT200106000&dbname=CJFD9902
中小企业的信息与信息化——访国家经贸委中小企业司	信息系统工程	2001	2001年06期	【作者】 周冰 ； 谢世诚 ； 【机构】 本刊记者 ； 本刊记者 ；	中小企业司 ； 国家经贸委 ； 企业信息化工程 ； 信息产业 ； 信息不对称 ； 中国企业 ； 信息化平台 ； 信息消费 ； 应用服务提供商 ； 战略过程 ；	<正> 去年1月国家经贸委和信息产业部共同发起了“企业信息化工程”,同年7月中国企业上网工程启动,经过近一年的发展,企业信息化和电子商务将开始步入稳步发展阶段。在取得巨大成绩的同时,也出现了一些新问题、新情况。为促进中小企业信息化,我们对国家经贸委中小企业司进行了专访和交流。 问:企业信息化现在是一个很热的话题,从政府到行业到企业自身,	2001年06期_中小企业的信息与信息化——访国家经贸委中小企业司.pdf	http://sso.cdclib.org/interlibSSO/goto/6/=06190596Z93/kcms/detail/detail.aspx?dbCode=cjfq&filename=XXXT200106001&dbname=CJFD9902
对话中小企业现状	信息系统工程	2001	2001年06期	【作者】 周冰 ； 谢世诚 ； 【机构】 本刊记者 ； 本刊记者 ；	发展阶段 ； 发展前景 ； 资金短缺问题 ； 应变能力强 ； 融资途径 ； 社会服务体系 ； 激励和约束机制 ； 政策扶持 ； 从一 ； 业务收人 ；	<正> 中小企业的“大”与“小” 无论是在“市场经济”或是在特定的“计划经济”的经济形态中,中小企业在任何空间似乎都被理解为经济发展阶段的“补充”存在。在所有的大型企业眼中,中小企业是什么?互联网的出现抹消了规模的差别,电子商务带给我们对速度和发展前景(即成长性)的震撼感觉。事实上所有的消费者都明白中小企业在自己生活中的重要作用,只不过它没有得到足够的理解和关注。事实上,没有哪一家大型企业不是从最初的“三五个人、几万元钱”发展而成。 甲:我国的很多企业都是计划经济的产物,大中型企业从一开始到今天,构成了事实上的经济主体,是国民经济的躯干。而	2001年06期_对话中小企业现状.pdf	http://sso.cdclib.org/interlibSSO/goto/6/=06190596Z93/kcms/detail/detail.aspx?dbCode=cjfq&filename=XXXT200106002&dbname=CJFD9902
中小企业信息化扫描	信息系统工程	2001	2001年06期	【作者】 范向琪 ； 【机构】 本刊记者 ；	东南沿海城市 ； 基础设施 ； 虚拟网 ； 产业结构 ； 经济发展 ； 刘经理 ； 商业网站 ； 用才 ； 主要决策权 ； 运营维护 ；	<正> 直视中小企业信息化 自2000年7月7日我国正式启动企业上网工程以来,推动企业上网的进程成为了各地政府的首要任务,尤其在各方面都具有优势的东南沿海城市,一些中小企业纷纷触网,极大地加强了企业的整体实力和产业结构的深入变革。然而对于经济发展相对滞后、基础设施仍不完善的西部来说,中小企业触网依旧还是一个可望不可及的梦想。 近年来在市场经济的冲击下,越来越多的企业借助网络的手段,带动了经济的高速发展。据统计,海南省数据通信局自1997年起就大力宣传“虚拟网站”业务,	2001年06期_中小企业信息化扫描.pdf	http://sso.cdclib.org/interlibSSO/goto/6/=06190596Z93/kcms/detail/detail.aspx?dbCode=cjfq&filename=XXXT200106003&dbname=CJFD9902
调查实录	信息系统工程	2001	2001年06期		企业经营 ； 北京郊区 ； 市场竞争 ； 百家 ； 库存积压 ； 项目招标 ； 物资计划 ； 运转方式 ； 统计指标 ； 柴油机厂 ；	<正> 中小企业1: 这是一家位于北京郊区中等规模的造纸厂,在北京,这样规模的造纸厂有几百家。面临着激烈的市场竞争,如何生存和发展,成为摆在企业经营者面前的一道难题。 公司的负责人说:“现在最头疼的问题是,搜集信息比较难,大家都在想方设法抢单子,得想方设法的搜集信息,效率低不说成本也很高。现在国家在倡导电子商务,网	2001年06期_调查实录.pdf	http://sso.cdclib.org/interlibSSO/goto/6/=06190596Z93/kcms/detail/detail.aspx?dbCode=cjfq&filename=XXXT200106004&dbname=CJFD9902
