title	journal_name	year	issue	author	keywords	summary	pdf_filename	article_url
电信运营商如何面对新形势	信息系统工程	2001	2001年12期	【作者】 赵恒礼 ； 【机构】 北京电信营业局大客户部 副经理 ；	支撑系统 ； 管理能力 ； 国际竞争力 ； 通信平台 ； 中国联通 ； 运营公司 ； BOSS ； 中国公司总裁 ； 客户管理 ； 电力公司 ；	<正> 我国加入WTO后,电信运营商面对新的机遇与挑战,而完善自己、全面提升竞争力是发展的关键。作为电信运营商,大多在运营方面存在一些困惑,希望能够采用一套适合中国国情的,具有国际竞争力的产品或者解决方案,以面对国际电信巨头的竞争。 四个象限分格局 对于电信的新形势。近来很多电信专家都在多方交流。有一个专家的见解很有特色,他画了一个坐标,一个横坐标,一个纵坐标,分成四个象限。横坐标是代表管理水平、管理能力,是对运营商评价的一个指标。纵坐标是代表资本、资金,也就是运营商所拥有的流动资金和	2001年12期_电信运营商如何面对新形势.pdf	http://sso.cdclib.org/interlibSSO/goto/6/=06190596Z93/kcms/detail/detail.aspx?dbCode=cjfq&filename=XXXT200112000&dbname=CJFD9902
感悟新电信时代	信息系统工程	2001	2001年12期	【作者】 范向琪 ； 【机构】 本刊记者 ；	移动通信业务 ； 通信革命 ； 有线电视技术 ； 悟新 ； 电话普及率 ； 中国联通 ； 基础电信业务 ； 移动电话用户 ； 增值电信业务 ； 变革过程 ；	<正> 目前,电信业正处在一个快速变化的时代。互联网技术的迅猛发展引发了一场深刻的通信革命。在这个历史性的变革过程中,企业运作模式发生根本性转变,电信产业格局产生结构性变革,电信、计算机、有线电视技术逐步走向融合,尤其是随着数据和移动通信业务及应用需求的逐步上升,电信市场正在成为增长最快、潜力最大的市场,一个崭新的电信时代已经来临。	2001年12期_感悟新电信时代.pdf	http://sso.cdclib.org/interlibSSO/goto/6/=06190596Z93/kcms/detail/detail.aspx?dbCode=cjfq&filename=XXXT200112001&dbname=CJFD9902
“诸子百家”话电信	信息系统工程	2001	2001年12期		中国电信行业 ； 资本投入 ； 注压 ； 网络有限公司 ； 业务解决方案 ； 业务竞争 ； 产品提供商 ； 网络解决方案 ； 综合网络 ； 爱立信公司 ；	<正> 中国电信行业所蕴藏的巨大市场空间不禁让厂商们怦然心动,随着中国的入世,国内外的厂商更是不约而同地把目光聚集于中国电信市场。 通信三巨头 重注压宝 国外的电信设备供应商如摩托罗拉、诺基亚、爱立信等凭借其雄厚的资本投入和技术实力,占据了很大的市场。 2001年8月,摩托罗拉中国区又一次迎来了摩托罗拉全球董事会,这次董事会通过了一系列带有布局性质的决议。投资方面,摩托罗拉在未来5年内将累计从中国采购价值100亿美元的零配件和服务;	2001年12期_“诸子百家”话电信.pdf	http://sso.cdclib.org/interlibSSO/goto/6/=06190596Z93/kcms/detail/detail.aspx?dbCode=cjfq&filename=XXXT200112002&dbname=CJFD9902
信息工程动态	信息系统工程	2001	2001年12期		工程动态 ； 北电网络 ； 共性技术 ； 国家经贸委 ； 中国移动 ； 中国联通 ； 海贝尔 ； 生产过程自动化 ； 制造业领域 ； 移动通信 ；	<正> 政府 我国将改造提升18个传统行业 国家经贸委副主任谢旭人日前在国务院新闻办召开的中外记者招待会上表示,“十五”期间,我国将用高新技术、先进适用技术改造提升冶金、机械、煤炭、轻纺等18个传统行业。他指出,国家将以电子信息技术应用为重点,提高传统产业生产过程自动化,控制智能化和管理信息化水平;以先进制造技术应用为重点,推进制造业领域的优质高效生产,振兴装备制造;改造提升重点产业的关键技术、共性技术和相关配套技术水平、工	2001年12期_信息工程动态.pdf	http://sso.cdclib.org/interlibSSO/goto/6/=06190596Z93/kcms/detail/detail.aspx?dbCode=cjfq&filename=XXXT200112003&dbname=CJFD9902
杨元庆:我们这样推进企业信息化	信息系统工程	2001	2001年12期	【作者】 杨元庆 ； 【机构】 联想集团有限公司 总裁 ；	企业管理软件 ； 杨元 ； 企业效率 ； 业务流程 ； 物料清单 ； 供应链体系 ； 企业竞争 ； 企业经营运作 ； 网络办公 ； 供应链运作 ；	<正> 为什么需要企业信息化 信息化能够帮助企业加强管理,控制和减少各种漏洞。今年中国加入了WTO,最值得关心的是加入WTO以后中国企业的竞争力,尤其是从计划经济转向市场经济企业的适应力。中国的IT业可以说是迎接这种挑战最早的行业。没有信息化就没有真正的市场化,这是联想切身的体会。 企业信息化就是企业竞争力的需要。它从对市场(客户)需求的快速满足、客户满意度的提升、管理成本的降低、企业效率提高等几个侧面得到体现。	2001年12期_杨元庆:我们这样推进企业信息化.pdf	http://sso.cdclib.org/interlibSSO/goto/6/=06190596Z93/kcms/detail/detail.aspx?dbCode=cjfq&filename=XXXT200112004&dbname=CJFD9902
用信息技木提升企业竞争力	信息系统工程	2001	2001年12期	【作者】 高潮 ； 【机构】 巨化集团 ；	计算机应用系统 ； 过程控制领域 ； 氟化工产品 ； 巨化集团公司 ； 电力监测 ； 企业门户 ； 企业生存环境 ； 生产调度 ； 生产基地 ； 管理业务流程 ；	<正> 巨化集团公司创建于1958年,是国内最大的氟化工产品生产基地。从上个世纪80年代中期开始,巨化就开展了信息化工作。当前,面对企业生存环境和激烈的竞争局面,巨化集团提出了要用信息技术提升企业的竞争力要求,开始了一系列的项目建设。 信息化已取得的成就和存在的不足 通过近20年的努力,巨化信息化也取得了一定的成绩,下属单位均使用了规模不等的计算机应用系统。 1.生产过程控制领域 巨化新建的生产装置,均采用DCS进行全工艺过程的自动化控制,传统生产装置、环保监控和电力监测等系统,也	2001年12期_用信息技木提升企业竞争力.pdf	http://sso.cdclib.org/interlibSSO/goto/6/=06190596Z93/kcms/detail/detail.aspx?dbCode=cjfq&filename=XXXT200112005&dbname=CJFD9902
市场聚焦	信息系统工程	2001	2001年12期		铁通公司 ； 市场聚焦 ； 高速宽带 ； 光纤通信网 ； 多媒体通信业务 ； 京沪穗 ； 显示器市场 ； 松下电器 ； 通信建设 ； 宝成 ；	<正> 记者明志 继7月12日铁通公司开通亚洲最大的通信光纤400G高速环——京沪穗高速环之后,以华为DWDM、SDH技术为基础、历时两个月兴建的中国铁通西南高速宽带环11月20日在京正式开通。这意味着铁通公司在国内高速宽带光纤通信网由原来的覆盖14个省直辖市增加到了22个省直辖市,覆盖面积约366万Km~2;也标志铁通公司面向社会提供包括话音、数据、图象等多媒体通信业务达到了相当的规模和水平。 据了解,铁通西南高速宽带环是该公司今年投资扩容、改造的五大高速宽带环之一。该环以武汉、成都为中心,沿京广、陇海、宝成、成昆、南昆、湘桂、成	2001年12期_市场聚焦.pdf	http://sso.cdclib.org/interlibSSO/goto/6/=06190596Z93/kcms/detail/detail.aspx?dbCode=cjfq&filename=XXXT200112006&dbname=CJFD9902
要闻回顾	信息系统工程	2001	2001年12期		要闻回顾 ； 康柏 ； 服务器技术 ； 工业标准 ； 用户大会 ； 体系结构 ； 数据中心 ； 陕西移动 ； 战略合作伙伴 ； 副总裁 ；	<正> 康柏举办ProLiant服务器技术论坛 日前,康柏公司在京举办了“优势无与伦比——康柏ProLiant工业标准服务器技术论坛”。在论坛上,康柏专家从满足不同用户需求的完整产品系列、开放技术到智能化管理、软件集成和优质服务方面做了介绍,并分专场详细介绍了ProLiant服务器技术研发和投入应用的最新成果,如IA—64架构ProLisni DL590/64服务器和年底推出的全新体系结构的超密度“刀片式”服务器、康柏与微软合作的数据中心解决方案等。	2001年12期_要闻回顾.pdf	http://sso.cdclib.org/interlibSSO/goto/6/=06190596Z93/kcms/detail/detail.aspx?dbCode=cjfq&filename=XXXT200112007&dbname=CJFD9902
清晰映像,投你所好 松下新推系列投影机	信息系统工程	2001	2001年12期		影机 ； 高端市场 ； 产品质量 ； 皇建 ； 薰蒸 ；	<正> 目前投影机市场品牌众多,世界上所有的投影机品牌在国内都可以找到。品牌竞争异常激烈,投影机的价格也直线下降,市场价格几乎每月下调,而且这种降价趋势可能在短期内不会改变。市场上一些知名品牌如松下、爱普生、索尼等虽然以较高的产品质量、良好的售后服务蠃得了大部分市场,国产品牌(OEM)在市场上已形成了一定的影响,有了一些知名度。随着国家治理整顿市场力度的加大,国产品牌会越来越多,由于它的价格很低,正在或已经占有了部分低端市场,并且向高端市场推进。这种	2001年12期_清晰映像,投你所好+松下新推系列投影机.pdf	http://sso.cdclib.org/interlibSSO/goto/6/=06190596Z93/kcms/detail/detail.aspx?dbCode=cjfq&filename=XXXT200112008&dbname=CJFD9902
ASP应用营造新服务	信息系统工程	2001	2001年12期	【作者】 展鹏 ； 【机构】 永泰软件工程(深圳)有限公司 ；	应用服务提供商 ； Provider ； 发展演化 ； 定制化 ； 工业发展 ； 软件应用 ； 应用系统 ； 应用服务系统 ； 身份认证技术 ； 分布式应用 ；	<正> ASP,伴随着工业发展的脚步而不断地发展演化,是装在新瓶子中的陈酒。ASP(Application Service Provider,应用服务提供商)的概念诞生于ISP、ICP之后,其目的是为Internet用户提供定制化的软件应用服务。ASP通过Internet来共享标准软件,以低成本(租金)和易维护来吸引大量用户,然后从每个用户提取少量的佣金。ASP一诞生就被认为是Internet极具前途的一个发展方向,它费用低廉,不需维护,是传统企业迈向信息化的捷径。	2001年12期_ASP应用营造新服务.pdf	http://sso.cdclib.org/interlibSSO/goto/6/=06190596Z93/kcms/detail/detail.aspx?dbCode=cjfq&filename=XXXT200112009&dbname=CJFD9902
构筑企业信息化ASP解决之道	信息系统工程	2001	2001年12期	【作者】 钟宏 ； 【机构】 本刊记者 ；	分销管理 ； 信息系统 ； 应用服务提供商 ； 管理子系统 ； 系统集成 ； 增长速度 ； 业务管理 ； 软件开发 ； 系统主要功能 ； 应用系统 ；	<正> 1999年ASP模式推出后,ASP市场发展非常迅速。据Gartner Group估计,到2003年,全球ASP市场将达到220亿美元,ASP市场每年的增长率将高达70.3％,从而使ASP服务成为IT服务领域增长速度最快的部分。 2000年ASP概念进入中国后受到IT界的广泛关注,业内多家公司(包括ISP、ICP、ISV、SI等)纷纷根据自己的优势针对ASP提出自己的定位、产品及解决方案。对企业而言如何适应快速发展变化的Internet,快速有效地建立基于	2001年12期_构筑企业信息化ASP解决之道.pdf	http://sso.cdclib.org/interlibSSO/goto/6/=06190596Z93/kcms/detail/detail.aspx?dbCode=cjfq&filename=XXXT200112010&dbname=CJFD9902
中国ASP发展策略与市场分析	信息系统工程	2001	2001年12期	【作者】 李娟 ； 【机构】 IDC分析员 ；	应用软件 ； 系统集成 ； 应用服务提供商 ； 应用程序 ； 软件开发商 ； 企业级应用 ； 市场分析 ； 大中国 ； 可复用性 ； 网络会议 ；	<正> 1999年11月,ASP在美国的Comdex上唱起了主角。从那时起,中国的IT精英们开始认真考虑ASP在中国的发展。2000年,将ASP做为重要发展方向的公司和专业ASP公司纷纷亮相,包括在应用软件技术方面占据优势的传统独立软件开发商以及深谙互联网发展的ISP、ICP公司,还有在服务方面见长的系统集成公司、咨询公司等等。 要研究ASP首先要弄清什么样的公司才能被称为ASP公司,他们有哪些共性。	2001年12期_中国ASP发展策略与市场分析.pdf	http://sso.cdclib.org/interlibSSO/goto/6/=06190596Z93/kcms/detail/detail.aspx?dbCode=cjfq&filename=XXXT200112011&dbname=CJFD9902
产品与方案	信息系统工程	2001	2001年12期		以太网交换机 ； 管系统 ； 自主知识产权 ； 科利 ； 中文界面 ； 硬件防毒墙 ； 彩色激光打印机 ； 彩色打印机 ； 威盛电子 ； 打印速度 ；	<正> 华为发布新品新战略 11月27日,华为在京发布了具有自主知识产权的Quidway S全线以太网交换机,这是继华为在IP产品领域成功推出Quidway A8010接入服务器、Quidway A8010 IP电话、Quidway系列路由器之后又一重大突破,同时也是国内厂商在IP技术领域全面与国际接轨的重要标志。Quidway S全线以太网交换机采用华为统一的VRP操作系统;采用统一的iManager网管系统,该网管系统支持中文界面、采用标准协议和开	2001年12期_产品与方案.pdf	http://sso.cdclib.org/interlibSSO/goto/6/=06190596Z93/kcms/detail/detail.aspx?dbCode=cjfq&filename=XXXT200112012&dbname=CJFD9902
IDC背后的力量——Cisco搭建广东电信IDC	信息系统工程	2001	2001年12期		广东电信 ； Cisco ； IDC ； 网络安全服务 ； 数据中心 ； 气体消防 ； 网站系统 ； 数据备份 ； 增值业务 ； 客户中心 ；	<正> 中国电信广州数据中心(以下简称广东电信IDC)面积为3000平方米,按甲级电信机房规格建设,超高速的2G带宽接入ChinaNET骨干网,机房还安装有目前最为先进的FM200气体消防系统和保安系统,并通过严格的管理流程保证客户设备的安全。广州数据中心依靠优质的硬件环境及雄厚的维护和支持力量,可以为客户的网站系统提供网络安全服务、VPN、数据备份、电子商务加速等增值服务。 广东电信IDC项目采用了Cisco公司高速的、大容量的千兆比交换路由器(GSR)和Catalyst 6500系列局域网骨干交换产品和服务,使广东电信IDC成为一家可以提供高档次、全方位服务的互	2001年12期_IDC背后的力量——Cisco搭建广东电信IDC.pdf	http://sso.cdclib.org/interlibSSO/goto/6/=06190596Z93/kcms/detail/detail.aspx?dbCode=cjfq&filename=XXXT200112013&dbname=CJFD9902
曲靖市广电宽带多媒体网凯创公司解决方案	信息系统工程	2001	2001年12期		宽带多媒体 ； 凯创公司 ； 信息通信网络 ； Networking ； 城域网 ； 网络设备 ； 云南省东部 ； 宽带网 ； 核心网 ； 国土面积 ；	<正> 曲靖市位于云南省东部,毗邻贵州、广西、四川,距昆明135km;现辖7县1区1市,国土面积2.8万km~2。人口520万;居住着汉、彝、回等8个主体民族。目前,曲靖市已初步形成有线、无线;微波、载波等多种手段并存的通体讯系:市区县都开通程控和移动电话,可以直拨国内外,无线寻呼实现了联网。在此基础上,曲靖市广电采用美国凯创公司的智能网络(Smart Networking)解决方案,建设覆盖全市的新一代信息通信网络——曲靖市广电宽带多媒体城域网(简称IP宽带网)。	2001年12期_曲靖市广电宽带多媒体网凯创公司解决方案.pdf	http://sso.cdclib.org/interlibSSO/goto/6/=06190596Z93/kcms/detail/detail.aspx?dbCode=cjfq&filename=XXXT200112014&dbname=CJFD9902
工欲善其事 必先利其器——网捷承建广东电信城域网	信息系统工程	2001	2001年12期		广东电信 ； 电信集团 ； 城域网 ； 数据业务 ； 必先 ； 汇接 ； 路由策略 ； 网上游戏 ； 接入层 ； 虚拟专用网 ；	<正> 随着近几年中国数据业务的飞速增长,用户数量的急剧增加,流量的成倍递加,以前单一的窄带接入已经难以满足用户的需要,2000年起,全国各地逐步开始了宽带业务的进程。 中国电信集团广东省电信公司(以下简称广东电信),现有22个地级市电信局、78个县级电信局,电信支局(所)4502个,覆盖广东各乡镇。 遵循“迎接宽带的新趋势、面对其他运营商的新挑战、满足用户的新需求”的三新原则,广东电信开始着手在广东省各地进行大规模的宽带城域网的建设。在此大背景之下,广东省11个城市城域	2001年12期_工欲善其事+必先利其器——网捷承建广东电信城域网.pdf	http://sso.cdclib.org/interlibSSO/goto/6/=06190596Z93/kcms/detail/detail.aspx?dbCode=cjfq&filename=XXXT200112015&dbname=CJFD9902
BPR促进ERP的成功	信息系统工程	2001	2001年12期	【作者】 赵文昕 ；	企业流程重组 ； 流程模型 ； 最终用户 ； BPR ； ERP ； 中央集权制 ； 意度 ； 响应能力 ； 经营环境 ； 实时管理 ；	<正> 许多企业在实施ERP时遇到的最大困难来自于管理方式的变革。在传统管理模式下,多层次的汇报阻碍了信息的快速传递;各部门的独立机能和条块运作阻碍了跨部门作业流程的顺利进行;企业流程过程与最终用户之间缺乏沟通,影响了服务质量和客户的满意度;中央集权制无法为第一线人员提供及时的应变响应能力;作业中过多部门和环节的设置以及人员间的牵制和多层审核,更使得效率难以提高等等。这些都已无法适应当前市场和经营环境的变化,必须在实施ERP的过程中加以调整和改造,即对其进行企业流程重组。	2001年12期_BPR促进ERP的成功.pdf	http://sso.cdclib.org/interlibSSO/goto/6/=06190596Z93/kcms/detail/detail.aspx?dbCode=cjfq&filename=XXXT200112016&dbname=CJFD9902
宽带的现实与未来	信息系统工程	2001	2001年12期	【作者】 徐祖哲 ； 【机构】 通信产业协会 秘书长 ；	无线移动 ； 技术特点 ； 中说 ； 移动信道 ； 斯蒂 ； 移动业务 ； 时间比例 ； 直播节目 ； 新闻提要 ； 网络有限公司 ；	<正> 英国人斯蒂芬·霍金在他的著作《想象与变革》中说:我们所看到的几乎所有关于未来的想象,在本质上都是静态的。在现在和未来之间,必定会有巨大的变革。但是在媒体上我们现在所看到的关于未来的科学、技术发展和社会应用,都被描述成达到了接近完美的程度。 的确,现在所描述的许多包括“宽带”在内的信息化的未来前景,都是十分美好的预测。因为“宽带”是指传输的频带有更大的容量,一是信息的传输速度加快,二是因此图像信息可以有更细微的表现。上述两个技术特点合起来,就使	2001年12期_宽带的现实与未来.pdf	http://sso.cdclib.org/interlibSSO/goto/6/=06190596Z93/kcms/detail/detail.aspx?dbCode=cjfq&filename=XXXT200112017&dbname=CJFD9902
无线射频识别拓展新世界	信息系统工程	2001	2001年12期	【作者】 蒋树春 ；	射频识别 ； 电子标签 ； 挂签 ； 收费人员 ； 信息编码 ； 电子系统 ； 双岗 ； 条码技术 ； 射频技术 ； 无线识别 ；	<正> 每天上班途经京昌高速公路的出口处都会看到7个收费口的双岗收费人员在紧张地忙碌,有时管理人员对于车流拥堵还是束手无策。而在新加坡的高速公路出口却只有一两个工作人员,就能使所有汽车快速通过并且通过自动电子系统收缴高速费用。这一切依赖无线射频识别技术(RFID)的支持。 无线射频识别技术(RFID) RFID基本上是一种标签形式,将特殊的信息编码进电子标签(或挂签),标签被粘贴在需要识别或追踪的物品上,	2001年12期_无线射频识别拓展新世界.pdf	http://sso.cdclib.org/interlibSSO/goto/6/=06190596Z93/kcms/detail/detail.aspx?dbCode=cjfq&filename=XXXT200112018&dbname=CJFD9902
GSM定位现商机	信息系统工程	2001	2001年12期	【作者】 刘毅敏 ；	无线定位技术 ； GSM ； 移动定位 ； 定位精度 ； 无线定位系统 ； 移动终端 ； 公众服务 ； 世界经济 ； 无线移动 ； 双曲线定位 ；	<正> 上期我们探讨了GPS卫星定位的话题,这一技术对政府及行业信息通连意义深远。但从成本上考虑,GPS定位的全面普及尚有待时日。那么有没有更简捷的解决问题手段呢?有,这就是基于GSM的无线定位技术。 “9.11”恐怖事件留下的思考 美国“9.11”恐怖事件给世界经济带来沉重的打击,同时带给人们对于公共安全更多的思考。公共安全和公众服务成为政府部门一个非常富有挑战性的工	2001年12期_GSM定位现商机.pdf	http://sso.cdclib.org/interlibSSO/goto/6/=06190596Z93/kcms/detail/detail.aspx?dbCode=cjfq&filename=XXXT200112019&dbname=CJFD9902
电子商务 物流决胜	信息系统工程	2001	2001年12期	【作者】 李红 ；	进销存 ； 软件产品 ； 现代物流管理 ； 加速资金周转 ； 现代物流体系 ； 成长时期 ； 组装测试 ； 定制产品 ； 现代物流系统 ； 信息系统 ；	<正> 物流一词最早出现于美国,1915年阿奇·萧在《市场流通中的若干问题》一书中首先提出了“实物配送(Physical Distribution)”的概念。现在欧美一些国家通常把物流称作“Logistics”,具体是指商品在空间和时间上的位移,包括采购配送、生产加工和仓储包装等流通环节中的物流情况。 今天,中国企业已接触和应用了很多电子商务软件产品,从财务软件、进销存软件到ERP系统、CRM系统。全面接轨互联网,揭开了电子商务崭新的一页。而构建这一切的基础是现代物流,它涉及到企业营销的方方面面。	2001年12期_电子商务+物流决胜.pdf	http://sso.cdclib.org/interlibSSO/goto/6/=06190596Z93/kcms/detail/detail.aspx?dbCode=cjfq&filename=XXXT200112020&dbname=CJFD9902
当孙丕恕讲故事	信息系统工程	2001	2001年12期	【作者】 周冰 ；	管理心得 ； 一条线 ； 发展战略 ； 互联网产业 ； 可替代性 ； 传志 ； 王恕 ； 案例分析 ； 互联网基础设施 ； 技术导向 ；	<正> “讲故事”是孙丕恕的管理心得之一,像论据,很有说服力的论据。 毫无疑问,我们都是喜欢听故事的,因为它简单,并且随意。 而毫无疑问,当孙丕恕开口讲故事,我们却需要认真倾听。 在倾听的过程中,我们发现孙丕恕的故事有三个重点:专注化发展战略是贯穿始终的一条线,看样子浪潮是要咬定这条线不放松了;关于创新,孙丕恕提出“科学+艺术”的不俗见解;另外是企业管理,按照他的经验,是“给员工讲故事的方式”。如果有机会,建议“讲故事”的管理方式可以收入哈佛MBA案例。	2001年12期_当孙丕恕讲故事.pdf	http://sso.cdclib.org/interlibSSO/goto/6/=06190596Z93/kcms/detail/detail.aspx?dbCode=cjfq&filename=XXXT200112021&dbname=CJFD9902
区域经济组织直面数字经济	信息系统工程	2001	2001年12期	【作者】 叶秋霞 ； 【机构】 中国(海南)改革发展研究院WTO信息查询中心 ；	区域经济组织 ； 区域集团化 ； 谈判机制 ； 多边贸易体制 ； 数字经济 ； 经济全球化 ； 经济发展 ； 经济合作 ； 经济区域化 ； 经济一体化组织 ；	<正> WTO与区域经济组织 世界经济全球化和区域集团化是当今世界经济发展的两大趋势。这种趋势表现为两股力量,即以世界贸易组织(WTO)及其前身关贸总协定(GATT)为代表的全球范围的贸易谈判机制与在特定区域范围内的相邻国家之间通过协议组成的区域经济合作组织的同时并存,互相推进。 自1947年关贸总协定成立以来,到1995年其后续者WTO所代表的世界多边贸易体制已经存在和运行了50多年。这	2001年12期_区域经济组织直面数字经济.pdf	http://sso.cdclib.org/interlibSSO/goto/6/=06190596Z93/kcms/detail/detail.aspx?dbCode=cjfq&filename=XXXT200112022&dbname=CJFD9902
2001年总目录	信息系统工程	2001	2001年12期		中国银行卡 ； 网上证券交易 ； 互联网产业 ； 移动生活 ； 世界电信日 ； 业务网络 ； 通信展 ； 存储市场 ； 企业经营能力 ； 信息产品出口 ；	领鳃颤蓝牙:驱动新经济的引擎P43新经济时代的另类投资P47深层次广视角交流行业信息化PS企业需要信息决策支持系统P19利用IT技术扩大企业经营能力PZI把握风险与机遇、信息与决策的关键P22ERP企业迈向新经济的起点P35大集中模式下的银行效应P39新经济在哪里P45清醒面对数字鸿沟P46 纂馨蘸石油行业:倾心e路见实效P7移动互联渐人佳境PZI移动IP技术P24布线电话网计算机网不i亥全一样P37电P商务重塑企业价值链P39新经济中的竞争策略卫45 {鬓蒙羹勒 爵i驹期“十五”国民经济和社会信息化展望P3三网融合市场说了算PS透过政策看机遇电子信息产品出口打拼到国外P10数字式机顶及其网络	2001年12期_2001年总目录.pdf	http://sso.cdclib.org/interlibSSO/goto/6/=06190596Z93/kcms/detail/detail.aspx?dbCode=cjfq&filename=XXXT200112023&dbname=CJFD9902
