title	journal_name	year	issue	author	keywords	summary	pdf_filename	article_url
浅谈国家开放大学实施“助力计划”试点项目	信息系统工程	2016	2016年08期	【作者】 曹雷 ； 孙志娟 ； 【机构】 国家开放大学 ；	开放大学 ； 产业工人 ； 助力计划 ；	在我国经济社会发展和产业结构调整升级的关键时期,国家开放大学提出了"新型产业工人培养和发展助力计划"。不仅需要充分认识实施"助力计划"试点的重要意义,而且还要聚焦该项目实施过程中的重点难点,探索体现终身教育思想和开放大学特色的职业教育人才培养模式及质量保证机制。	2016年08期_浅谈国家开放大学实施“助力计划”试点项目.pdf	http://sso.cdclib.org/interlibSSO/goto/6/=06190596Z93/kcms/detail/detail.aspx?dbCode=cjfq&filename=XXXT201608075&dbname=CJFDLAST2016
从专利分析百度和谷歌的技术发展	信息系统工程	2016	2016年08期	【作者】 夏礼 ； 陈园 ； 【机构】 国家知识产权局专利局专利审查协作湖北中心 ；	专利 ； google ； 百度 ； 技术发展 ；	百度和谷歌作为在全球搜索引擎领域的绝对优势的占有者,他们的技术发展在一定程度上反映了搜索领域的技术发展态势。本文从专利的角度对百度和谷歌的技术发展做一个简单的比较,并对这两家业界的巨头的发展作简要的分析。	2016年08期_从专利分析百度和谷歌的技术发展.pdf	http://sso.cdclib.org/interlibSSO/goto/6/=06190596Z93/kcms/detail/detail.aspx?dbCode=cjfq&filename=XXXT201608076&dbname=CJFDLAST2016
移动端二维条码识别器系统的研究	信息系统工程	2016	2016年08期	【作者】 韩海雁 ； 【机构】 大庆油田有限责任公司第二采油厂信息中心 ；	移动端 ； 二维条码识别器系统 ； 二维条码的研究 ；	二维码技术作为一种智能标签技术,在现代社会中的应用可谓是越来越广泛,已经成为了现在社会的一种流行趋势。二维码技术较以前的条形码等技术,具有更高的安全可靠性,另外在信息的完善度上也更优秀,利用特殊的识别仪器可以用来传递很多特殊的数据信息。	2016年08期_移动端二维条码识别器系统的研究.pdf	http://sso.cdclib.org/interlibSSO/goto/6/=06190596Z93/kcms/detail/detail.aspx?dbCode=cjfq&filename=XXXT201608077&dbname=CJFDLAST2016
高职计算机专业学生职业能力问题与对策研究	信息系统工程	2016	2016年08期	【作者】 薛溯凯 ； 【机构】 苏州高等职业技术学校 ；	高等职业教育 ； 计算机专业 ； 学生职业能力 ；	高职计算机专业从开始建设到现在的稳定发展为社会提供很多的计算机人才,推动社会的发展,但是目前高职院校学生的能力和素质与社会的需求不符合,造成高职院校学生就业率低下的现状。本文简要介绍职业能力的相关信息和我国目前高职院校计算机专业教育现状,分析我国高职计算机专业学生职业能力下降的原因和改善措施。	2016年08期_高职计算机专业学生职业能力问题与对策研究.pdf	http://sso.cdclib.org/interlibSSO/goto/6/=06190596Z93/kcms/detail/detail.aspx?dbCode=cjfq&filename=XXXT201608078&dbname=CJFDLAST2016
RGS和DCV技术在远程三维可视化应用中的比较分析	信息系统工程	2016	2016年08期	【作者】 樊晋明 ； 【机构】 辽河油田勘探开发研究院 ；	RGS ； DCV ； 远程操作 ； 三维可视化 ； 云桌面 ；	在当今各行业中,远程三维可视化应用已经成为一种趋势,其应用效果影响了企业的技术发展水平和工作效率。本文通过对适用于各大中小企业、领域最前沿的RGS和DCV两种远程三维可视化解决方案的对比分析,探讨了其各自的应用优势,为各行业信息化建设和生产提供有力帮助。	2016年08期_RGS和DCV技术在远程三维可视化应用中的比较分析.pdf	http://sso.cdclib.org/interlibSSO/goto/6/=06190596Z93/kcms/detail/detail.aspx?dbCode=cjfq&filename=XXXT201608079&dbname=CJFDLAST2016
天津市建设项目社会稳定风险涉及利益相关方权重讨论	信息系统工程	2016	2016年08期	【作者】 卢妍妍 ； 【机构】 天津市政府投资项目评审中心 ；	建设项目 ； 群体性事件 ； 四川什邡 ； 启东 ； 国家发展改革委 ； 风险评估 ； 生活成本 ； 社会网络分析 ； 中共天津市委 ； 分析资源 ；	<正>随着我国经济建设快速发展,近年来,厦门PX事件、湖南嘉禾血铅事件、四川什邡事件、江苏启东事件等建设项目所引发的社会不稳定事件层出不穷,在此背景下,建设项目社会稳定风险研究逐步被各级政府和学术界关注。上述项目建设过程中,之所以会发生群体性事件,很大程度上是因为建设项目利益相关方的诉求信息没有被充分倾听、考虑和理解。为此,自2012年起,党中央、国务院、国家发展改革委先后下发文件,针对在全国范围内建立健全	2016年08期_天津市建设项目社会稳定风险涉及利益相关方权重讨论.pdf	http://sso.cdclib.org/interlibSSO/goto/6/=06190596Z93/kcms/detail/detail.aspx?dbCode=cjfq&filename=XXXT201608080&dbname=CJFDLAST2016
山地观光农业车载真彩屏收音娱乐系统	信息系统工程	2016	2016年08期	【作者】 朱高伟 ； 余耀烽 ； 吴伟斌 ； 【机构】 华南农业大学工程学院 ； 华南农业大学工程学院广东省农情信息监测工程技术研究中心广东省农情信息获取与应用重点实验室 ；	山地观光 ； 收音机 ； 真彩屏 ； 娱乐系统 ；	随着山地观光农业的快速发展,山地观光车的需求量也越来越大,对山地观光车的配置有了更高的要求。针对目前国内外山地观光车载收音机的收音技术成熟但娱乐性能发展缓慢的状况,本文采用NXP的专用车载收音芯片TEF6606构建电动车真彩屏车载收音娱乐系统。系统代替传统大规模电子元件搭建收音电路,在不加操作系统的前提下利用低成本优质用户体验的理念进行了系统设计,添加了真彩串口屏显示,并利用Cortex-M0架构的LPC1114统筹系统运行。系统利用串行传输协议UART进行串口屏的控制,并利用I2C进行收音芯片及存储芯片与主控中心LPC1114的数据传输,实现了全触控系统化操作、自动搜台、手动调台和手动输入等基本功能,还利用分时复用任务调度算法实现了扩展电子书、系统设置、相片浏览、游戏娱乐、实时时钟等功能。	2016年08期_山地观光农业车载真彩屏收音娱乐系统.pdf	http://sso.cdclib.org/interlibSSO/goto/6/=06190596Z93/kcms/detail/detail.aspx?dbCode=cjfq&filename=XXXT201608081&dbname=CJFDLAST2016
Java反射机制的研究	信息系统工程	2016	2016年08期	【作者】 林围强 ； 【机构】 福建省泉州师范学院软件学院 ；	反射机制 ； 编程人员 ； 程序运行 ； 动态性 ； 动态获取 ； 静态方法 ； 实例化 ； 类中 ； 编程过程 ； 开发过程 ；	<正>一、Java反射机制简介Java反射机制指的是在Java程序运行状态中,对于任何一个类,都可以获得这个类的所有属性和方法;对于给定的一个对象,都能够调用它的任意一个属性和方法。这种动态获取类的内容以及动态调用对象的方法称为反射机制[1]。Java的反射机制允许编程人员在对类未知的情况下,获取类相关信息的方式变得更加多样灵活,调用类中相应方法,是Java增加其灵活性与动态性的一种机制。	2016年08期_Java反射机制的研究.pdf	http://sso.cdclib.org/interlibSSO/goto/6/=06190596Z93/kcms/detail/detail.aspx?dbCode=cjfq&filename=XXXT201608082&dbname=CJFDLAST2016
RS232串口通信在PC机与单片机通信中的应用	信息系统工程	2016	2016年08期	【作者】 邢庭炜 ； 【机构】 安徽省池州学院机电工程学院 ；	RS232 ； MAX232 ； 单片机 ； PC机 ； 计算 ；	并行通讯和串行通讯是计算机与终端或者计算机与计算机之间传输数据的两种方式。串行通讯具有成本低廉、线路使用少等优势,在远程传输中,能有效避免多条线路不一致,目前应用较为广泛。单片机和工控机分别作为自动控制系统的下位机和上位机,二者连接的桥梁就是RS232串口通信。RS232电平和TTL逻辑电平需要通过转换才能实现信息传输,实现这一关键的传输纽带就是MAX232。此连接方式具有以下优势:(1)实际操作中,单片机的灵活性和控制性得到充分发挥;(2)最大程度地激发PC机的各项功能,特别是显示和计算,使信号能快速的采集和处理,确保良好的人机交互UI。	2016年08期_RS232串口通信在PC机与单片机通信中的应用.pdf	http://sso.cdclib.org/interlibSSO/goto/6/=06190596Z93/kcms/detail/detail.aspx?dbCode=cjfq&filename=XXXT201608083&dbname=CJFDLAST2016
关于综合通信系统的设计与实现	信息系统工程	2016	2016年08期	【作者】 孙立 ； 张东林 ； 【机构】 中国电信吉林分公司 ； 中国移动通信集团吉林有限公司 ；	综合通信系统 ； 卫星宽带 ； 语音通话 ； 关键技术 ；	宽带网络技术的迅速发展,移动通信系统成为了当前研究的热点,并且卫星通信技术的发展,使其产业规模和业务范围也大幅度扩大。本文首先对移动通信技术进行了简单的分析,并进一步探讨综合通信系统设计与实现。	2016年08期_关于综合通信系统的设计与实现.pdf	http://sso.cdclib.org/interlibSSO/goto/6/=06190596Z93/kcms/detail/detail.aspx?dbCode=cjfq&filename=XXXT201608084&dbname=CJFDLAST2016
浅谈军校硕士研究生信息能力培养	信息系统工程	2016	2016年08期	【作者】 黄玉华 ； 【机构】 后勤学院后勤指挥模拟训练中心 ；	军校硕士研究生 ； 信息能力 ； 培养模式 ；	指挥军官的信息能力是决定现代战争成败的关键,明确指挥军官应具备的信息能力,多途径、多手段地加强硕士研究生在校学习期间的信息能力培养,对提高指挥军官的岗位任职能力、推进部队信息化建设具有重要的现实意义。	2016年08期_浅谈军校硕士研究生信息能力培养.pdf	http://sso.cdclib.org/interlibSSO/goto/6/=06190596Z93/kcms/detail/detail.aspx?dbCode=cjfq&filename=XXXT201608085&dbname=CJFDLAST2016
基于ASP.NET的学生社区信息化管理系统的设计与实现	信息系统工程	2016	2016年08期	【作者】 江赐龙 ； 【机构】 福建省莆田学院 ；	社区信息管理系统 ； 学生宿舍管理 ； ASP.NET ；	基于ASP.NET开发的B/S结构的学生社区信息管理系统的设计和实现,主要分为后台数据库的建立和前台浏览器的开发两部分。文章从系统功能分析,框架思维及数据库设计等方面进行阐述。	2016年08期_基于ASP.NET的学生社区信息化管理系统的设计与实现.pdf	http://sso.cdclib.org/interlibSSO/goto/6/=06190596Z93/kcms/detail/detail.aspx?dbCode=cjfq&filename=XXXT201608086&dbname=CJFDLAST2016
基于OA平台的放射性物质系统设计与开发	信息系统工程	2016	2016年08期	【作者】 孟粉霞 ； 王越 ； 郑江玲 ； 【机构】 西北核技术研究所 ；	放射性物质 ； 数据库 ； OA模块 ； 全生命周期 ；	放射性物质的规范管理是质量安全工作的重要组成部分。本文介绍了放射性物质管理系统的设计实现和工作方式。系统以OA平台为依托,采用电子化方式,对数量繁多、种类复杂的放射性物质进行封闭式全生命周期管理,实现了海量数据的高效检索、提取和后期维护管理。	2016年08期_基于OA平台的放射性物质系统设计与开发.pdf	http://sso.cdclib.org/interlibSSO/goto/6/=06190596Z93/kcms/detail/detail.aspx?dbCode=cjfq&filename=XXXT201608087&dbname=CJFDLAST2016
SAP HANA技术研究与应用实施	信息系统工程	2016	2016年08期	【作者】 高天 ； 【机构】 大港油田信息中心 ；	SAP HANA ； 内存计算 ； 报表加速 ； ERP应用 ；	通过对SAP HANA存储结构和工作原理的分析,结合大港油田ERP系统运行实际,论述了SAP报表加速技术、方案设计与实现方法,分析利用SAP HANA实施提升重要报表访问速度,支持企业决策;SAP HANA技术改变了传统数据应用模式,为企业ERP深化应用提供了典型案例。	2016年08期_SAP+HANA技术研究与应用实施.pdf	http://sso.cdclib.org/interlibSSO/goto/6/=06190596Z93/kcms/detail/detail.aspx?dbCode=cjfq&filename=XXXT201608088&dbname=CJFDLAST2016
利用云技术搭建企业高可用信息门户	信息系统工程	2016	2016年08期	【作者】 张千 ； 苏大伟 ； 田刚 ； 【机构】 独山子石化公司信息中心 ；	HYPER-V ； 故障转移群集 ； DPM ； SCVMM ； 域控 ；	本文通过利用微软System-Center云平台,搭建独山子石化公司信息门户系统高可用平台为列,详细阐述了独山子石化高可用信息门户平台的基础架构设计、环境搭建、备份设计以及应用效果等。	2016年08期_利用云技术搭建企业高可用信息门户.pdf	http://sso.cdclib.org/interlibSSO/goto/6/=06190596Z93/kcms/detail/detail.aspx?dbCode=cjfq&filename=XXXT201608089&dbname=CJFDLAST2016
基于WebService的Android客户端与Web服务端数据交互实现	信息系统工程	2016	2016年08期	【作者】 王云锦 ； 赵志宏 ； 【机构】 中国石油兰州石化公司自动化院 ；	Android ； 数据交互 ； WebService ；	本文介绍了基于Web Service的Android客户端与Web服务器端的通信模型,并详细描述该模型的数据流转过程。该模型使用了Web Service,Json,Ksoap技术、协议。该通信模型简捷有效,使用方便,配置简单,为众多Android客户端与Web端数据交互开发提供了参考。	2016年08期_基于WebService的Android客户端与Web服务端数据交互实现.pdf	http://sso.cdclib.org/interlibSSO/goto/6/=06190596Z93/kcms/detail/detail.aspx?dbCode=cjfq&filename=XXXT201608090&dbname=CJFDLAST2016
文档信息管理平台的开发及应用	信息系统工程	2016	2016年08期	【作者】 白云 ； 王兵 ； 【机构】 大庆油田天然气分公司 ； 大庆油田第六采油厂 ；	MongoDB ； MySQL ； 技术架构 ；	为摒弃原有的纸质、电子版文档带来的弊端,提高公司文档的保密性、唯一性、共享性,利用jquery、javascript等先进的前台技术,与应用广泛的分布式文件存储数据库Mongo DB结合,开发了文档管理信息平台,提高了公司文档信息的管理水平和利用率,促进了公司管理的提升。	2016年08期_文档信息管理平台的开发及应用.pdf	http://sso.cdclib.org/interlibSSO/goto/6/=06190596Z93/kcms/detail/detail.aspx?dbCode=cjfq&filename=XXXT201608091&dbname=CJFDLAST2016
地震前兆Oracle数据库UNDO表空间持续增长修复	信息系统工程	2016	2016年08期	【作者】 王军 ； 【机构】 中国地震台网中心 ；	Oracle ； UNDO表空间 ； 数据库恢复 ；	Oracle数据库以其强悍的性能、强大的功能和稳定性得到广大用户的认可,作为存储数据的首选商业数据库。本文介绍了在一次存储阵列故障后,数据库出现了持续性的UNDO表空间增长现象,通过对数据库日志和系统视图的分析,逐步解决错误,最终将UNDO表空间的占用恢复正常。	2016年08期_地震前兆Oracle数据库UNDO表空间持续增长修复.pdf	http://sso.cdclib.org/interlibSSO/goto/6/=06190596Z93/kcms/detail/detail.aspx?dbCode=cjfq&filename=XXXT201608092&dbname=CJFDLAST2016
浅析基于PLC控制的AGV技术研究及其应用	信息系统工程	2016	2016年08期	【作者】 李林琛 ； 【机构】 北京工业职业技术学院机电工程学院 ；	PLC控制 ； AGV技术 ； 研究 ； 应用 ；	AGV技术是指制动导引运输车技术,是一种沿着既定路线制动的行驶能力的运输装置,可以被称之为无人搬运车技术,结合现代信息技术,可以在无人驾驶的情况下,实现对中午的搬运,不需要主动进行轨道的敷设,可以在不同的环境下完成自动运输,符合现代生产的需求,可以广泛地应用到制造业、仓储业、食品、危险区域作业等,具有良好的应用前景。以下为本就基于PLC控制的AGV技术展开探讨,并着重对其系统构建和具体应用展开探讨,旨在为相关技术人员提供参考,促使AGV技术的可控制性,提高AGV技术的应用范围和能力,推动相关产业的持续健康发展。	2016年08期_浅析基于PLC控制的AGV技术研究及其应用.pdf	http://sso.cdclib.org/interlibSSO/goto/6/=06190596Z93/kcms/detail/detail.aspx?dbCode=cjfq&filename=XXXT201608093&dbname=CJFDLAST2016
医保档案管理信息化建设要点分析	信息系统工程	2016	2016年08期	【作者】 于红红 ； 【机构】 山东省胸科医院医保办 ；	医保档案管理 ； 信息化建设 ； 问题 ； 建设要点 ；	医保档案管理信息化建设工作对于促进医保事业的健康快速发展具有积极的作用。在医保档案管理信息化建设中还存在一些问题,这里分析了存在的问题,并提出医保档案管理信息化建设的要点,对于提升医保档案管理工作质量具有积极的意义。	2016年08期_医保档案管理信息化建设要点分析.pdf	http://sso.cdclib.org/interlibSSO/goto/6/=06190596Z93/kcms/detail/detail.aspx?dbCode=cjfq&filename=XXXT201608094&dbname=CJFDLAST2016
基于Windows系统并行集群的实现与应用研究	信息系统工程	2016	2016年08期	【作者】 吴俊锋 ； 【机构】 电子科技大学资源与环境学院 ；	Windows ； 并行 ； 集群 ；	基于当前大数据量的处理请求,而一些处理软件依赖于Windows平台,同时传统的Linux集群使用门槛高,且需要单独购置机器,本文考虑到大数据处理的需求以及方便用户使用的目的,实现了Windows并行集群,充分利用已有的资源,降低使用门槛,并通过遥感数据的处理验证了集群的有效性。	2016年08期_基于Windows系统并行集群的实现与应用研究.pdf	http://sso.cdclib.org/interlibSSO/goto/6/=06190596Z93/kcms/detail/detail.aspx?dbCode=cjfq&filename=XXXT201608095&dbname=CJFDLAST2016
一种快速预测叠层焊点随机振动疲劳寿命的方法	信息系统工程	2016	2016年08期	【作者】 韦何耕 ； 【机构】 广西河池学院物理与机电工程学院 ；	叠层焊点 ； BP神经网络 ； 随机振动 ；	利用BP神经网络可以无限逼近非线性函数的特点,选择焊点直径,焊点高度,铜箔厚度和PCB厚度为变量,采用正交试验法设计实验,利用有限元仿真分析法获得叠层焊点在随机振动条件下的疲劳寿命作为样本数据训练BP神经网络,所建立的叠层焊点随机振动疲劳寿命模型能快速和较为准确预测叠层焊点随机振动疲劳寿命。	2016年08期_一种快速预测叠层焊点随机振动疲劳寿命的方法.pdf	http://sso.cdclib.org/interlibSSO/goto/6/=06190596Z93/kcms/detail/detail.aspx?dbCode=cjfq&filename=XXXT201608096&dbname=CJFDLAST2016
指控组织鲁棒性理论的研究	信息系统工程	2016	2016年08期	【作者】 季艺伟 ； 任学军 ； 杨济华 ； 【机构】 武警工程大学研究生管理大队12队 ； 武警工程大学信息工程系 ；	指控组织 ； 组织结构 ； 鲁棒性优化 ；	简要介绍指控组织及其组织结构,重点对组织结构的鲁棒性优化问题进行详述。提出了两种优化方法:基于三阶段法和分组遗传算法的组织结构鲁棒性优化、基于粒度计算的组织结构鲁棒性优化。鲁棒性优化的指控组织的优点在于组织对外界环境的不敏感性,即组织在外界环境发生变化的情况下依旧可以维持较好的运作效能。	2016年08期_指控组织鲁棒性理论的研究.pdf	http://sso.cdclib.org/interlibSSO/goto/6/=06190596Z93/kcms/detail/detail.aspx?dbCode=cjfq&filename=XXXT201608097&dbname=CJFDLAST2016
浅析信息传播载体的衍变	信息系统工程	2016	2016年08期	【作者】 詹欣 ； 【机构】 广西大学 ；	李白 ； 交游诗 ； 自我传播 ； 人际传播 ； 大众媒介 ；	作为中国自古重要的信息传播载体,诗歌就以一种独特且重要的方式存在。属于诗歌形式的一种,交往诗在李白的诗作中占有很大比例。本文重点区别了李白交往诗与交游诗的概念,并尝试以传播学的视角与方法,探究李白交往诗在传播学层面上的意义和功用。	2016年08期_浅析信息传播载体的衍变.pdf	http://sso.cdclib.org/interlibSSO/goto/6/=06190596Z93/kcms/detail/detail.aspx?dbCode=cjfq&filename=XXXT201608098&dbname=CJFDLAST2016
浅谈高校实验室的管理与防范	信息系统工程	2016	2016年08期	【作者】 郝文婷 ； 【机构】 山西大学商务学院 ；	实验室管理 ； 教学质量 ； 人才培养 ； 项目研发 ； 技术发展 ； 工作职责 ； 正常教学秩序 ； 管理实验室 ； 实习实训 ； 实验室环境 ；	<正>高校实验室作为人才培养、科研、生产和技术发展的重要基地,其重要性不言而喻。实验室对于保证一些重点项目研发的顺利实施,提高教师的教学质量,培养学生动手和解决问题的能力,培养具有实践能力的人才,具有重要的理论和现实意义。随着科技的发展和高等教育规模的扩大,如何加强对高校实验室的管理,以适应高等教育的快速发展,适应高等教育的新形势,充分发挥实验室在高校教学、科研中的作用,提高实验室的使用效率都具有重要的意义。	2016年08期_浅谈高校实验室的管理与防范.pdf	http://sso.cdclib.org/interlibSSO/goto/6/=06190596Z93/kcms/detail/detail.aspx?dbCode=cjfq&filename=XXXT201608099&dbname=CJFDLAST2016
应急处置综合集成研讨厅体系设计研究	信息系统工程	2016	2016年08期	【作者】 毕于慧 ； 赖新 ； 曾熠 ； 程芳 ； 【机构】 61139部队信息中心 ； 61917部队信息中心 ；	应急处置 ； 综合集成 ； 研讨厅 ； 体系设计 ；	本文以应急突发事件处置为研究对象,以提高处置决策的科学性、高效性为目的,结合应急处置的具体业务流程,提出了应急处置综合集成研讨厅的基本框架,设计了研讨厅的功能结构,分析了研讨厅实现需要解决的几个关键问题,为研讨厅的构建奠定了基础。	2016年08期_应急处置综合集成研讨厅体系设计研究.pdf	http://sso.cdclib.org/interlibSSO/goto/6/=06190596Z93/kcms/detail/detail.aspx?dbCode=cjfq&filename=XXXT201608100&dbname=CJFDLAST2016
板坯连铸技术的自动化控制研究	信息系统工程	2016	2016年08期	【作者】 谭建宇 ； 【机构】 唐钢检修分公司 ；	板坯 ； 连铸自动化 ；	本文通过介绍板坯连铸含义及其板坯连铸机的种类,提出了钢铁行业中使用连铸技术的必要性和优越性,通过连铸发展史来对其自动化的控制和研究。	2016年08期_板坯连铸技术的自动化控制研究.pdf	http://sso.cdclib.org/interlibSSO/goto/6/=06190596Z93/kcms/detail/detail.aspx?dbCode=cjfq&filename=XXXT201608101&dbname=CJFDLAST2016
地方院校计算机类专业毕业生择业成本	信息系统工程	2016	2016年08期	【作者】 黄敏 ； 【机构】 江西建设职业技术学院 ；	地方院校 ； 计算机类专业 ； 择业成本 ；	近些年来随着高校大学生就业压力的增加,毕业生择业成本日益提高,给毕业生带来了繁重的就业压力,如何能够进一步降低择业成本,帮助毕业生找到理想的工作,成为地方各院校必须要考虑的内容。本文就现阶段我国地方院校计算机类专业毕业生择业成本的现状为切入点,系统的阐述了计算机专业作业成本降低的有效路径。	2016年08期_地方院校计算机类专业毕业生择业成本.pdf	http://sso.cdclib.org/interlibSSO/goto/6/=06190596Z93/kcms/detail/detail.aspx?dbCode=cjfq&filename=XXXT201608102&dbname=CJFDLAST2016
基于我校微博数据的统计分析及其可视化	信息系统工程	2016	2016年08期	【作者】 任勇 ； 程玉胜 ； 黎康 ； 王一宾 ； 【机构】 安庆师范学院计算机与信息学院 ；	文本挖掘 ； 微博 ； 文字云 ； 统计分析 ；	微博在网民中快速增长,已经成为一个重要的公众媒介,它不仅是网民从中获取新闻热点和结交朋友的重要工具,而且成为社会公共舆论的重要平台之一。然而,微博每天产生大量的短文本数据,如何高效的从这些文本数据中进行统计分析,挖掘出有效信息,也是新媒体时代统计工作者的重要课题。本文以安庆师范学院学生会在新浪微博平台上发布的信息为例,利用R语言等工具,进行了相关统计分析,并改进了高频词的文字云显示方式,最后将主题词以更加直观的文字云形式展示出来。	2016年08期_基于我校微博数据的统计分析及其可视化.pdf	http://sso.cdclib.org/interlibSSO/goto/6/=06190596Z93/kcms/detail/detail.aspx?dbCode=cjfq&filename=XXXT201608103&dbname=CJFDLAST2016
