title	journal_name	year	issue	author	keywords	summary	pdf_filename	article_url
下一代网络:多业务网络和光纤技术	信息系统工程	2001	2001年05期	【作者】 Trisha Streilein ； JoeJohn ； 【机构】 朗讯科技互联网络系统部 ； 朗讯科技光网络部 ；	下一代网络 ； 光纤技术 ； 业务网络 ； 流量工程 ； 业务交换 ； 光纤网络 ； 网络层 ； 光纤链路 ； 传输链路 ； 点到点协议 ；	多业务交换机/路由器提供的流量工程和QoS功能,与最新的智能光纤技术相结合,将实现一系列的IP服务。	2001年05期_下一代网络:多业务网络和光纤技术.pdf	http://sso.cdclib.org/interlibSSO/goto/6/=06190596Z93/kcms/detail/detail.aspx?dbCode=cjfq&filename=XXXT200105033&dbname=CJFD9902
波分复用技术前景光明	信息系统工程	2001	2001年05期	【作者】 彭明宇 ； 彭承柱 ；	波分复用技术 ； 全光网络 ； 光通信网 ； 光纤通信系统 ； 业务信息 ； 光纤技术 ； 多模光纤 ； 中继线路 ； 光技术 ； 光缆通信 ；	数据和互联网业务量的爆炸式增长对网络容量的需求,只有靠全光网络才能适应;目前则依赖于WDM技术的不断进步与成熟,它是走向全光网络的第一步,也是决定性的一步。随着光交换、光处理等技术的成熟,信息的传送、分析处理将全部采用光技术,那就是全光通信网;它对任何宽带业务信息都是透明的,具有极大带宽的、智能化的综合宽带业务数字网。	2001年05期_波分复用技术前景光明.pdf	http://sso.cdclib.org/interlibSSO/goto/6/=06190596Z93/kcms/detail/detail.aspx?dbCode=cjfq&filename=XXXT200105034&dbname=CJFD9902
电子商务助推传统经济	信息系统工程	2001	2001年05期	【机构】 蓝田市场研究公司 ；	互联网基础设施 ； 经济全球化 ； 电子交易 ； 网上商店 ； 购物模式 ； 网上购买 ； 购物网站 ； 销售渠道 ； 货到付款 ； 网络应用 ；	随着互联网基础设施的完善和网络应用的普及,基于网络的电子商务将成经济全球化很潮的润滑剂和助推器。	2001年05期_电子商务助推传统经济.pdf	http://sso.cdclib.org/interlibSSO/goto/6/=06190596Z93/kcms/detail/detail.aspx?dbCode=cjfq&filename=XXXT200105035&dbname=CJFD9902
首都电子商务平台建设	信息系统工程	2001	2001年05期	【作者】 陆首群 ； 【机构】 首都信息发展股份有限公司 ；	电子商务平台 ； 支撑系统 ； 在线交易 ； 电子商务营销 ； 电子商务市场 ； 软件环境 ； 硬件集成 ； 系统集成 ； 在线支付 ； 多对多 ；	首都电子商务平台以优秀的软硬件集成作为其支撑系统,是能为广大用户提供电子商务全过程个性化服务的在线交易活动场所	2001年05期_首都电子商务平台建设.pdf	http://sso.cdclib.org/interlibSSO/goto/6/=06190596Z93/kcms/detail/detail.aspx?dbCode=cjfq&filename=XXXT200105036&dbname=CJFD9902
世纪之交的中国银行卡业务发展	信息系统工程	2001	2001年05期	【作者】 范之波 ；	中国银行卡 ； 银联 ； 联网通用 ； 规模效益 ； 社会经济发展 ； 贷记 ； 联合经营 ； 小额支付系统 ； 个人信用记录 ； 预授权 ；	中国银行卡业务实践证明,从分散经营到联合经营是银行卡业务发展的必然趋势,是当前社会经济发展的迫切要求,有利于社会资源共享,有利于实现银行卡业务的规模效益,有利于为居民生活质量提高服务。	2001年05期_世纪之交的中国银行卡业务发展.pdf	http://sso.cdclib.org/interlibSSO/goto/6/=06190596Z93/kcms/detail/detail.aspx?dbCode=cjfq&filename=XXXT200105037&dbname=CJFD9902
广东金融电子发展状况及其影响	信息系统工程	2001	2001年05期	【作者】 刘芬华 ；	金融电子化 ； 同城票据交换 ； 金融机构 ； 清算系统 ； 生活水平 ； 银联 ； 资金清算 ； 万事达 ； 网络银行发展 ； 直联 ；	金融电子化的迅速发展正推动着广东金融系统经营体制和经营理念、工作方式和内容的变革,并对广东经济的再次腾飞和居民生活水平的继续提高产生着极为深远的影响。	2001年05期_广东金融电子发展状况及其影响.pdf	http://sso.cdclib.org/interlibSSO/goto/6/=06190596Z93/kcms/detail/detail.aspx?dbCode=cjfq&filename=XXXT200105038&dbname=CJFD9902
迎接跨媒体信息传播	信息系统工程	2001	2001年05期	【作者】 韩钢 ；	中国概念股 ； 跨媒体 ； 信息源 ； 时代华纳 ； 美国在线 ； 网络媒体发展 ； 宽带技术 ； 媒介购买公司 ； 中国香港 ； 专业信息 ；	<正> 从新经济说起…… 去年,新经济几乎成了国内风靡的话题,所以笔者也附庸风雅:它真的很象一瓶质量上乘的啤酒。当新经济是全球的宠儿时,所有的人都不断地摇晃它,期望一夜间从中摇出满地的黄金,结果摇出来的是越来越多的泡沫……而当发现新经济有这样多的泡沫时,它一夜之间又成了人人避之不及的魔瓶,以至于恨不得将泡沫连同啤洒一同倒掉……于是有了纳斯达克上中国概念股的尴尬,有了“新经济泡沫的破裂”。 与新经济一样被大家翻来覆去炒作的还有一个词是“互联网”,对它的诠释可以说是千变万化,PC机供应商告诉我们互联网就是计算机,所以人们起初以为买计算机就可以感受互联网上新生活,后来人们逐渐队识到光有计算机是不够的,要上网	2001年05期_迎接跨媒体信息传播.pdf	http://sso.cdclib.org/interlibSSO/goto/6/=06190596Z93/kcms/detail/detail.aspx?dbCode=cjfq&filename=XXXT200105039&dbname=CJFD9902
外“优”内“患”——中国互联网产业的市场绩效	信息系统工程	2001	2001年05期	【作者】 王步芳 ；	市场绩效 ； 互联网产业 ； 市场结构 ； 内部不经济性 ； 市场行为 ； 外部经济性 ； 资源配置 ； 技术进步 ； 评价指标 ； 外部性 ；	互联网产业的市场绩效,是指互联网企业在既定的市场结构下,其市场行为所导致或形成的互联网产业的资源配置效率和利益分配状态。是反映互联网产业运行效率的综合性概念。通过研究互联网产业的市场绩效能够准确地判断市场结构和市场行为的合理性和有效性程度。其评价指标主要有资源配置效率(成本—收益比较)、技术进步状况、规模经济效率、X非效率、管理价格等等。外部经济性和内部不经济性是当前中国互联网产业市场绩效的普遍特征。	2001年05期_外“优”内“患”——中国互联网产业的市场绩效.pdf	http://sso.cdclib.org/interlibSSO/goto/6/=06190596Z93/kcms/detail/detail.aspx?dbCode=cjfq&filename=XXXT200105040&dbname=CJFD9902
传统媒体挑战者	信息系统工程	2001	2001年05期	【作者】 郑华芝 ；	网络新闻 ； 未来网络 ； 新闻图片 ； 独家新闻 ； 激光照排系统 ； 解释性 ； 传播领域 ； 辽沈晚报 ； 就是你 ； 报道员 ；	互联网是用钱堆出来的事业。许多网上媒体处于不计成本的“花钱阶段”,网络媒体的日子目前都不好过。也许在未来网络媒体能够取代传统媒体,但目前还没有哪种传统媒体被取代。 从长远来看,传统媒体与网络媒体之间的地位会有所转变。传统媒体不会消失,但它会退缩到一定的市场份额并开始寻求新的出路。	2001年05期_传统媒体挑战者.pdf	http://sso.cdclib.org/interlibSSO/goto/6/=06190596Z93/kcms/detail/detail.aspx?dbCode=cjfq&filename=XXXT200105041&dbname=CJFD9902
扬起电子商务之帆	信息系统工程	2001	2001年04期	【作者】 周冰 ；	互联网经济 ； 美国道琼斯 ； 指数稳定 ； 高科技时代 ； 蓄势 ； 青岛海尔 ； 国民经济增长 ； 电子信息 ； 全球经济一体化 ； 高新技术产业 ；	也是在去年这个时候,网络经济的代表纳斯达克指数一度突破5000点大关,由此掀起全球范围内的电子商务狂潮,国民也纷纷效尤,惟恐落后于网络高科技时代。而几乎是转瞬间,纳指暴跌并徘徊在1900点左右,缩水一半以上。与此相对应,砖头+水泥的代表——美国道琼斯指数稳定在10000点上下,交易沉稳波澜不惊。电子商务蜷缩在互联网的寒冬里,蓄势何时待发?	2001年04期_扬起电子商务之帆.pdf	http://sso.cdclib.org/interlibSSO/goto/6/=06190596Z93/kcms/detail/detail.aspx?dbCode=cjfq&filename=XXXT200104000&dbname=CJFD9902
中国电子商务的现状与发展	信息系统工程	2001	2001年04期	【作者】 杨卫东 ； 【机构】 中国电子商务协会 秘书长 ；	上网费用 ； 发展阶段 ； 基础设施 ； 主干网 ； 网络服务 ； 总体发展战略 ； 交易网站 ； 电信业务 ； 经济发展 ； 信息产业 ；	我国电子商务的基础设施建设取得了很大成绩,国内主干网带宽有了较大的扩展,个人和企业上网费用多次下调,网民和企业对网络环境已经从速度慢和价格高等要求提高到保障服务质量,网络服务开始进入具体和务实的发展阶段。	2001年04期_中国电子商务的现状与发展.pdf	http://sso.cdclib.org/interlibSSO/goto/6/=06190596Z93/kcms/detail/detail.aspx?dbCode=cjfq&filename=XXXT200104001&dbname=CJFD9902
Cisco三年内中国市场长成全球第二	信息系统工程	2001	2001年04期	【作者】 昱冰 ；	Cisco ； 三大支柱 ； 钱伯斯 ； 客户支持 ； 创新业务模式 ； cisco ； 经济发展 ； 区域发展 ； 大史 ； 人才投资 ；	Cisco宣称中国市场将在3年内从亚太市场的三大支柱之一成长为全球第二大市场,其中的玄机,让我们与Cisco一起去品味。	2001年04期_Cisco三年内中国市场长成全球第二.pdf	http://sso.cdclib.org/interlibSSO/goto/6/=06190596Z93/kcms/detail/detail.aspx?dbCode=cjfq&filename=XXXT200104002&dbname=CJFD9902
LG发布2001市场策略	信息系统工程	2001	2001年04期		市场策略 ； 显示器市场 ； LG ； 平面显示器 ； 市场占有率 ； 电子显示器 ； 市场排名 ； 八位 ； 发展战略思想 ； 强伽 ；	<正> 据CBI调查结果显示,2000年中国显示器市场总销量为710万台,其中品牌显示器销最达到350万台,OEM为360万台,比1999年增长了44.31％。 在完全平面显示器和显示器行业整体市场发展的推动下,LG电子显示器产品存2000年取得了突出的进步。去年LG电子显示器产品总销量为50万台,市场占有率达到了14％的份额,与1999年相比销量增长了近30万台,市场占有率增长了近10个百分点。而从市场排名上来看,也从1999年的第八位上升到第三位,是去年中国显示器市场上进步最快的厂商之一。 从显示器类型上来看,LG显示器去年市场份额增长的一个主要因素来自于未来窗完全平面显示器的走红。由于2000年完全下面显示器渐渐走上了主流的位置,而	2001年04期_LG发布2001市场策略.pdf	http://sso.cdclib.org/interlibSSO/goto/6/=06190596Z93/kcms/detail/detail.aspx?dbCode=cjfq&filename=XXXT200104003&dbname=CJFD9902
捷报频传 阿尔卡特在华又获双单	信息系统工程	2001	2001年04期	【作者】 雷涛 ；	中国电信 ； 江苏移动 ； 接入速度 ； 宽带接入网络 ； 长期合作协议 ； 爆炸性增长 ； 视频点播 ； 应用服务 ； 互连网络 ； 远程工作 ；	<正> 连获德国电信和中国台湾省“中华电信”ADSL两个大单之后,3月22日,阿尔卡特又在北京宣布了其与中国电信合作,提供ADSL宽带接入网络和业务拓展长期合作协议,并宣布赢得江苏移动价值1.8亿美元的GSM网络扩容项目。这不仅为今年由于互连网络发展趋缓而低迷的电信市场带来了一缕春风,也为阿尔卡特要在中国市场获得70％的增长奠定了基础。 大规模拓展市场,部署 DSL宽带接入网络 近年来,我国的互联网用户不仅数量呈爆炸性增长,对接入速度和应用服务也有了很多新的要求,包括视频点播(VOD)、	2001年04期_捷报频传+阿尔卡特在华又获双单.pdf	http://sso.cdclib.org/interlibSSO/goto/6/=06190596Z93/kcms/detail/detail.aspx?dbCode=cjfq&filename=XXXT200104004&dbname=CJFD9902
面向未来的柯达彩色影像扫描技术	信息系统工程	2001	2001年04期		扫描图像 ； 联合公司 ； 电子文档 ； 最终用户 ； 商务咨询 ； 采菊 ；	<正> 峥嵘初显的彩色影像扫描时代 自世界第一台价格适宜的高速彩色文档扫描仪问世以来,迄今已有许多重要社会机构相继采用了彩色影像扫描技术。1998年,由David Wood联合公司、电子文档采集管理和电子商务咨询公司进行的研究表明,如果出现价格适宜的产品,30％的市场可以迅速转向彩色。另外,最终用户认为100dpi的彩色扫描图像较之200dpi和300dpi的双色和灰度“更容易接受”。 进入1999年,1999年度最佳AIIM得主——柯达Digital Science3590C型彩色扫描仪的出现使这一市场出现转机。此过渡产品提供彩色、正面/黑白背面、黑白背面和黑白双面,以及与黑白扫描仪速度	2001年04期_面向未来的柯达彩色影像扫描技术.pdf	http://sso.cdclib.org/interlibSSO/goto/6/=06190596Z93/kcms/detail/detail.aspx?dbCode=cjfq&filename=XXXT200104005&dbname=CJFD9902
开辟IT行业租赁新天地——访多维互动网络技术公司CEO弋沛杰	信息系统工程	2001	2001年04期	【作者】 魏晓杰 ；	应用服务提供商 ； 互联网数据中心 ； 系统集成 ； CEO ； 设备生产商 ； 赢利点 ； 中间件产品 ； 防病毒 ； 企业数据库 ； 着陆点 ；	<正> 硬件可以租用,软件可以租用,多个硬件加多个软件可以一起租用吗? 2000年初,就在dot com公司如日中天时,Internet领域的另一轮跑马圈地开始了,这就是互联网数据中心(IDC)、应用服务提供商(ASP)和虚拟部门提供商(VDP)们,它们迅即成为我国网络界最时髦的用语,相关建设也如火如荼地大规模启动,网络运营商、系统集成商、网络设备生产商、应用软件开发商以及ISP和ICP等各路人马四处寻找资金纷纷加入到这一浪潮之中。 时隔一年,当时一掷千金的dot com已是强弩之末,有些已经灰飞烟灭,侥幸留下的那些dot com们终于明白飘在天上是一件多么可怕的事而渐渐地走向务实,寻找自己的赢利点,也就是现在的时髦用	2001年04期_开辟IT行业租赁新天地——访多维互动网络技术公司CEO弋沛杰.pdf	http://sso.cdclib.org/interlibSSO/goto/6/=06190596Z93/kcms/detail/detail.aspx?dbCode=cjfq&filename=XXXT200104006&dbname=CJFD9902
用户眼中的多功能一体机	信息系统工程	2001	2001年04期		多功能一体机 ； 家庭办公 ； 单项功能 ； 价格敏感 ； 功能质量 ； 彩色输出 ； 传真功能 ； 创业阶段 ； 维护服务 ； 喷墨打印机 ；	<正> 对于中小企业、个人及家庭办公来说,使用多功能一体机既省钱,又高效。多功能一体机“小而全”的特性及其相对较低的总体拥有成本,吸引了处于创业阶段的商务用户以及对价格敏感、对使用与维护服务要求高的个人及家庭用户。 目前市场上的多功能一体机可谓琳琅满目,有激光型的、有喷墨型的,不同的厂家为用户设计了各种各样组合方式的一体机。但是从实际应用的角度看,用户眼中的多功能一体机应该是什么样子呢? 单项功能要精 多功能不是简单的将各种功能堆积在一起,而应当以用户需求为基础,将各种功能进行最佳配比。 多功能的功能集成,不能以功能质量降低为代价,每项指标都必须看齐或者超过单一功能的同类主流产品,才真正能够	2001年04期_用户眼中的多功能一体机.pdf	http://sso.cdclib.org/interlibSSO/goto/6/=06190596Z93/kcms/detail/detail.aspx?dbCode=cjfq&filename=XXXT200104007&dbname=CJFD9902
中晶描绘新世纪——中晶科技2001年会在上海举行	信息系统工程	2001	2001年04期	【作者】 雷涛 ；	知识经济时代 ； 策略发展 ； 数码影像 ； 渠道合作伙伴 ； 产品多元化 ； 多元化产品 ； 林宗 ； 剪彩仪式 ； 本地化生产 ； 办公产品 ；	<正> 新世纪的第一个早春,似乎万物都不同凡响而勃发着无限的生机,而此时的上海电更显得典雅迷人。3月28日,MICROTEK公司在中国大陆的全资子公司——上海中晶科技有限公司隆重举行“飞跃世纪新中晶——中晶科技2001年会”,对21世纪知识经济时代来自全球的机遇与挑战,企业如何在这种浪潮中健康成长,中晶科技新的发展策略和经营思路做了全新的诠释。 立足中国,策略发展 会上,MICROTEK公司董事长兼全球总裁许正勋先生发表了主题演讲,全面阐述知识经济时代的机遇与挑战,再次重申了MICROTEK积极开拓中国市场、长期服务	2001年04期_中晶描绘新世纪——中晶科技2001年会在上海举行.pdf	http://sso.cdclib.org/interlibSSO/goto/6/=06190596Z93/kcms/detail/detail.aspx?dbCode=cjfq&filename=XXXT200104008&dbname=CJFD9902
MPLS前景广阔——访马可尼公司IP/MPLS技术主管Daniel Proch先生	信息系统工程	2001	2001年04期	【作者】 谢世诚 ；	马可尼公司 ； Daniel Proch ； IP/MPLS技术 ； MPLS ； 国内电信市场 ； 技术主管 ； 多协议标记交换 ； 技术优势 ； 标准化进展 ； 发展战略 ；	<正> 3月14日在北京举办的一次技术研讨会上,马可尼通信公司展示了多协议标记交换(MPLS)技术广阔的应用前景。马可尼公司IP/MPLS技术主管Daniel Proch先生详细介绍了MPLS标准化进展、未来趋势及马可尼的MPLS技术,并在现场演示了马可尼MPLS解决方案、技术优势和发展战略,为国内电信市场注入新的理念。 在接受本刊记者的专访时Daniel Proch先生蜕,马可尼新的解决方案能把不同的功能“集合”到一个平台上,使公司10年内所生产的交换机通过软件能简单、平	2001年04期_MPLS前景广阔——访马可尼公司IP+MPLS技术主管Daniel+Proch先生.pdf	http://sso.cdclib.org/interlibSSO/goto/6/=06190596Z93/kcms/detail/detail.aspx?dbCode=cjfq&filename=XXXT200104009&dbname=CJFD9902
信息工程动态	信息系统工程	2001	2001年04期		工程动态 ； 信息港 ； 互联互通 ； 信息产业基地 ； 三网融合 ； 全球用户 ； 大城市 ； 主干网 ； 移动通信用户 ； 跨越式发展 ；	<正> 上海将建一流国际信息港 上海将用五年时间建成亚太地区重要信息产业基地和最先进的国际信息港。“十五”期间上海将建设由大容量国际出口宽带互联互通多媒体交换的通信主干网和多种宽带接入网,形成全球用户最大的“三网融合”和“手机上网”区域市场,并且拥有全球各大城市中发行量最大的社会保	2001年04期_信息工程动态.pdf	http://sso.cdclib.org/interlibSSO/goto/6/=06190596Z93/kcms/detail/detail.aspx?dbCode=cjfq&filename=XXXT200104010&dbname=CJFD9902
要闻回顾	信息系统工程	2001	2001年04期		数据备份 ； 网上注册 ； 网络安全 ； 销售热线 ； 要闻回顾 ； 存储解决方案 ； 网上证券 ； 康柏 ； 存储网络 ； 内容管理 ；	<正> HP傲群215磁带机再造热点 HP SureStore傲群(Ultrium)215磁带机在国内数据备份市场崭露头角仅半个月,就以其出色的性价比吸引了许多用户的关注。为方便用户的购买,从3月19日起的一个月内,用户可以通过惠普网上注册(www.hp.com.cn/storage.htm)和免费销售热线(8008202255)购买惠普傲群215和230磁带机,并可获赠	2001年04期_要闻回顾.pdf	http://sso.cdclib.org/interlibSSO/goto/6/=06190596Z93/kcms/detail/detail.aspx?dbCode=cjfq&filename=XXXT200104011&dbname=CJFD9902
百年老厂奔上“信息网”——大连机车车辆厂企业网建设与应用	信息系统工程	2001	2001年04期	【作者】 张永春 ； 赵广慧 ；	机车车辆厂 ； 企业网 ； 销售一体化 ； 生产计划 ； 制造一体化 ； 产品设计 ； 网络一体化 ； 物资供应 ； 工作效率 ； 需求用户 ；	“新企业网”实现了产品设计、工艺、制造一体化;生产计划、成本核算、物资供应、经营销售一体化;全厂计算机网络一体化。三个一体化明显提升了工作效率,百年老厂发生了深刻的变化,收到了很好的经济效益和社会效益。	2001年04期_百年老厂奔上“信息网”——大连机车车辆厂企业网建设与应用.pdf	http://sso.cdclib.org/interlibSSO/goto/6/=06190596Z93/kcms/detail/detail.aspx?dbCode=cjfq&filename=XXXT200104012&dbname=CJFD9902
个性化的电子商务——青岛海尔电子商务特点	信息系统工程	2001	2001年04期	【作者】 王昌辉 ；	青岛海尔 ； 竞争平台 ； 业务代表 ； 销售体系 ； 企业与消费者 ； 制造业务 ； 采购系统 ； 利润最大化 ； 管理方向 ； 物料管理 ；	海尔最大的特点就是个性化。在由网络搭建的全球化竞争平台上,海尔又会有怎样的精彩?	2001年04期_个性化的电子商务——青岛海尔电子商务特点.pdf	http://sso.cdclib.org/interlibSSO/goto/6/=06190596Z93/kcms/detail/detail.aspx?dbCode=cjfq&filename=XXXT200104013&dbname=CJFD9902
XML技术和电子商务的发展	信息系统工程	2001	2001年04期	【作者】 齐华宁 ； 贾俊贤 ；	XML ； 网络商务 ； 客户管理 ； 业务伙伴 ； 供应链 ； 数据交换标准 ； 数据集成 ； 电子银行业务 ； 商业规则 ； 应用模式 ；	现实中的电子商务发展并不完善,当B2C发展到一定程度发现B2B发展的滞后性阻碍了电子商务的进一步发展,B2B的发展又受到现有电子商务技术和标准的束缚。比如EDI应用的局限性、行业缺乏数据交换标准等。因此发展B2B将是一个战略性的转变,企业网络将向外延伸,与外界建立广泛的交流合作。企业不仅可利用Intranet/internet向广大用户公布信息,为客户提供信息查询、货物追踪服务,还能与供应商、销售商、服务商等业务伙伴随时随地保持联系并展开合作。这一阶段,在XML技术的推动下,B2B、XML/EDI、供应链、客户管理等技术将得到迅速的发展。	2001年04期_XML技术和电子商务的发展.pdf	http://sso.cdclib.org/interlibSSO/goto/6/=06190596Z93/kcms/detail/detail.aspx?dbCode=cjfq&filename=XXXT200104014&dbname=CJFD9902
中国电子商务的新机遇cnXML	信息系统工程	2001	2001年04期	【作者】 王炜 ；	cnXML ； 底层技术 ； 发布系统 ； 信息管理 ； 数据标准 ； 业务逻辑 ； 数据交换 ； 硬件设施 ； 子商 ； 语言标准 ；	在探索和实践的过程中,随着向深层的发展我们发现,底层技术是电子商务发展的基础。从目前硬件设施的水平来说,基本上已经可以满足企业间数据的交互的需求,信息管理和接收发布系统也达到了相当的水平,当前企业间电子商务的根本性障碍在于缺乏统一的数,据标准。	2001年04期_中国电子商务的新机遇cnXML.pdf	http://sso.cdclib.org/interlibSSO/goto/6/=06190596Z93/kcms/detail/detail.aspx?dbCode=cjfq&filename=XXXT200104015&dbname=CJFD9902
XML技术及其他	信息系统工程	2001	2001年04期		标记语言 ； 资讯网 ； 延伸性 ； XML ； 可扩展性 ； Netscape ； 网络软件 ； 技术数据 ； 面向对象 ； 内容管理 ；	<正> 随着计算机及互联网的广泛应用与普及,HTML架构的Web技术纷纷暴露出来。为此,1996年,由Sun Microsystems的Jon Bosak所领导的一个专家小组开始研制一个新的标准,该小组为全球资讯网协会(W3C)所支持。这个新的标准应该简单、具有可延伸性,同时电是人类及计算机都可阅读的。1998年2月,可诞伸性标记语言(eXtensiable Markup Language),问世,同年进入商业领域。XML也称作可扩展性标记语言,Zona Research的报告显示,从1998年第二季度到第三季度,网页	2001年04期_XML技术及其他.pdf	http://sso.cdclib.org/interlibSSO/goto/6/=06190596Z93/kcms/detail/detail.aspx?dbCode=cjfq&filename=XXXT200104016&dbname=CJFD9902
3Com现代电子商务的网络基础	信息系统工程	2001	2001年04期		网络基础 ； 管理应用系统 ； 现代电子商务 ； 商务应用系统 ； 电子交易 ； commerce ； 供应链 ； 企业资源规划 ； 多媒体远程教育 ； 三个组成部分 ；	<正> 面对全球化的Internet经济浪潮,3Com公司将以其电子网络解决方案为基础,帮助客户建立现代电子商务体系,它包括以下三个组成部分: ● 电子商务应用系统 建立面向Internet的e-commerce电子交易应用系统以拓展企业业务;建立面向消费者与商家或商家与商家的客户关系管理应用系统以支持其客户;建立面向供应商/分销商的供应链管理应用系统以协	2001年04期_3Com现代电子商务的网络基础.pdf	http://sso.cdclib.org/interlibSSO/goto/6/=06190596Z93/kcms/detail/detail.aspx?dbCode=cjfq&filename=XXXT200104017&dbname=CJFD9902
