title	journal_name	year	issue	author	keywords	summary	pdf_filename	article_url
月度信息化要闻	信息系统工程	2016	2016年10期		网络安全 ； 辩证关系 ； 国家主权 ； 信息安全 ； 国家安全 ； 政治安全 ； 基础设施安全 ； 安之 ；	<正>习近平谈网络安全和信息化的辩证关系习近平总书记对网络安全做出了重要论断:"没有网络安全就没有国家安全,没有信息化就没有现代化。"其深刻阐述了网络安全信息化发展的辩证关系,"网络安全和信息化是一体之两翼,驱动之双轮,必须统一谋划,统一部署,统一推进,统一实施。"建设网络强国,首先要把好"安全关",守好"底线",打好这场没有硝烟的"战争"。要警惕那些直接进行看得见的破坏的"黑客",更要警惕那些进行着看不见的破坏但影响更为恶劣的"黑手",不仅要守护个人的信息安全、财产安全,更要捍卫国家关键基础设施安全,甚至是国家主权和政治安全。以安全保发展,建久安之势、成长治之业。	2016年10期_月度信息化要闻.pdf	http://sso.cdclib.org/interlibSSO/goto/6/=06190596Z93/kcms/detail/detail.aspx?dbCode=cjfq&filename=XXXT201610001&dbname=CJFDLAST2016
保护个人信息,踏出网络安全第一步	信息系统工程	2016	2016年10期	【作者】 尚丹 ；	银行交易 ； 安全第一 ； 社会毒瘤 ； 升学就业 ； 个人信息保护 ； 互联网安全 ； 山东临沂 ； 群众财产 ； 广东揭阳 ； 数据保护 ；	<正>山东临沂两个年轻的生命因电信诈骗离世事件余波未平,清华大学教师被骗1760万元的新闻震撼仍劲,广东揭阳又有一女孩儿疑因电信诈骗而轻生。电信诈骗已成为移动互联网时代的社会毒瘤,严重威胁人民群众财产安全,危及国家金融与经济秩序甚至社会稳定。在信息时代,尤其是移动互联网时代,我们每一个人的身份、消费、通信等关键信息都正在在升学就业、买房买车、银行交易,饮食就餐、网络购物等过程中流通甚至是交换。这些涉及关键信息的流通固然会在这个智能化的时代通	2016年10期_保护个人信息,踏出网络安全第一步.pdf	http://sso.cdclib.org/interlibSSO/goto/6/=06190596Z93/kcms/detail/detail.aspx?dbCode=cjfq&filename=XXXT201610002&dbname=CJFDLAST2016
安全是互联网金融的第一关	信息系统工程	2016	2016年10期	【作者】 姚玉秀 ；	互联网安全 ； 数据安全 ； 移动支付 ； 社会经济发展 ； 手机银行 ； 钓鱼网站 ； 降低成本 ； 征信体系建设 ； 监管框架 ； 存款保险 ；	<正>近年来,随着"互联网+"行动计划的推动实施,互联网金融等融合产业蓬勃发展,对提高效率、降低成本和改善服务发挥了积极作用,给社会经济发展注入了新的动力。大数据成为互联网金融的核心,数据安全更是受到前所未有的重视,严格规范是互联网金融发展的前提。互联网金融蓬勃发展互联网金融行业,顺应了时代的发展趋势,在近几年得到了迅猛的发展。从网上购物到移动支付、网上投资理财等,不仅方便了我们的生活还成为了经济发展的新的引擎。互联网金融是互联网与金融的结合,是借助于互联网技	2016年10期_安全是互联网金融的第一关.pdf	http://sso.cdclib.org/interlibSSO/goto/6/=06190596Z93/kcms/detail/detail.aspx?dbCode=cjfq&filename=XXXT201610003&dbname=CJFDLAST2016
全球首颗量子卫星:无条件安全通信成可能	信息系统工程	2016	2016年10期		无条件安全 ； 网络信息系统 ； 网络安全 ； 量子通信 ； 信息基础设施 ； 全局性作用 ； 关键基础设施 ； 量子密钥分发 ； 量子保密通信 ； 潘建伟 ；	"没有网络安全就没有国家安全。"随着网络信息技术的迅猛发展和广泛应用,特别是我国国民经济和社会信息化建设进程的全面加快,网络信息系统的基础性、全局性作用日益增强。网络已经成为实现国家稳定、经济繁荣和社会进步的关键基础设施。建设网络强国,要有自己的技术,有过硬的技术;要有良好的信息基础设施。	2016年10期_全球首颗量子卫星:无条件安全通信成可能.pdf	http://sso.cdclib.org/interlibSSO/goto/6/=06190596Z93/kcms/detail/detail.aspx?dbCode=cjfq&filename=XXXT201610004&dbname=CJFDLAST2016
华为光接口单元故障可诊断度分析	信息系统工程	2016	2016年10期	【作者】 童菲 ； 李铁强 ； 马渊 ； 【机构】 63939部队 ；	光接口单元 ； 离散事件系统 ； 故障可诊断度 ；	华为光传输设备作为有线数据传输骨干网的重要承载接入设备,在试验任务通信和部队日常通信保障中发挥着重要的作用。本文针对该类设备的光接口单元进行研究,首先根据网管维护信息对故障进行分类,然后基于离散事件系统模型对此进行了故障可诊断度分析,以提高设备维护和总体分析能力。	2016年10期_华为光接口单元故障可诊断度分析.pdf	http://sso.cdclib.org/interlibSSO/goto/6/=06190596Z93/kcms/detail/detail.aspx?dbCode=cjfq&filename=XXXT201610005&dbname=CJFDLAST2016
生技医药产业策略联盟模式与趋势研究	信息系统工程	2016	2016年10期	【作者】 欧朝铨 ； 【机构】 南开大学经济学院 ；	生技医药 ； 策略联盟 ； 专利授权 ； 共同开发 ；	本文分析生技医药企业参与策略联盟的模式与动机,探讨以授权、共同开发及销售协议为主的策略联盟模式,并研究基于产业特性而产生的商业条款,进而构成行业特殊的合作模式。此外,运用国外数据库分析全球策略联盟案件数量渐多且金额渐大的趋势,建议国内企业应积极对外寻求合作伙伴,并培养熟悉产业特性的专业评估人才以协助商业谈判。监管当局则应鼓励生技医药企业积极进行策略联盟以整合资源,促进产业升级。	2016年10期_生技医药产业策略联盟模式与趋势研究.pdf	http://sso.cdclib.org/interlibSSO/goto/6/=06190596Z93/kcms/detail/detail.aspx?dbCode=cjfq&filename=XXXT201610006&dbname=CJFDLAST2016
数字化工厂三维建模方法研究	信息系统工程	2016	2016年10期	【作者】 许建玉 ； 王鹏 ； 【机构】 兰州石化公司自动化研究院 ；	数字化工厂 ； 三维建模 ； 手工建模法 ； 导入模型法 ； 激光扫描建模法 ；	近年来,数字化工厂的普及和应用越来越广泛,三维建模作为数字化工厂的技术基础和支柱,得到了不断改进和提高,本文对数字化工厂的国内应用案例做了简要介绍,研究了数字化工厂三维建模的主要方法,并进行对比分析,找出了不同实施条件下更加适合和有效的建模方法。	2016年10期_数字化工厂三维建模方法研究.pdf	http://sso.cdclib.org/interlibSSO/goto/6/=06190596Z93/kcms/detail/detail.aspx?dbCode=cjfq&filename=XXXT201610007&dbname=CJFDLAST2016
超宽带无线通信技术及其应用	信息系统工程	2016	2016年10期	【作者】 黄林 ； 【机构】 中国船舶重工集团公司第七二二研究所 ；	超宽带无线通信 ； 无线通信技术 ； 优势局限 ； 应用发展前景 ；	随着科学技术的快速发展,高科技无线通信技术也取得了长足的进步,越来越深入到人们的日常生活中,超宽带无线通信技术低成本、高速度的优势充分满足适应了人们对于无线通信的要求。本文在阐述无线通信技术内涵概念的基础上,重点分析了超宽带无线通信技术的优势和发展局限,研究了超宽带无线通信技术的具体应用以及发展前景,对于相关工作人员的研究提供了一定的借鉴经验。	2016年10期_超宽带无线通信技术及其应用.pdf	http://sso.cdclib.org/interlibSSO/goto/6/=06190596Z93/kcms/detail/detail.aspx?dbCode=cjfq&filename=XXXT201610008&dbname=CJFDLAST2016
探析安卓系统的手机防盗设计与实现	信息系统工程	2016	2016年10期	【作者】 李俊 ； 【机构】 江西先锋软件职业技术学院 ；	安卓系统 ； 手机防盗设计 ； 广播机制 ；	为了使安卓系统的手机具备良好的防盗功能,本设计为其配备了安卓广播机制与后台监听机制,这将使用户能在较远的距离外通过短信对手机进行操控。用户一方面可以利用这一设计对手机内的内容进行删除,保证个人信息的安全和隐秘,另一方面也能通过监听功能以及通话记录获取功能,对丢失的手机进行定位。实验证明,这一设计有较好的实用性,适合应用于安卓系统的手机。本文主要对具体的设计进行了简单的介绍,并对实际的操作方案进行了介绍。	2016年10期_探析安卓系统的手机防盗设计与实现.pdf	http://sso.cdclib.org/interlibSSO/goto/6/=06190596Z93/kcms/detail/detail.aspx?dbCode=cjfq&filename=XXXT201610009&dbname=CJFDLAST2016
基于云计算机的虚拟化技术分析	信息系统工程	2016	2016年10期	【作者】 周建军 ； 【机构】 九江职业大学 ；	云计算机 ； 虚拟化技术 ；	互联网技术不断发展以及应用范围的日渐扩展,促使数据处理相关技术具有越来越很重要的作用,同时,在数据实时控制方面具有越来越高的要求。因此,更加注重开发信息服务技术以及业务管理技术,为计算机网络信息共享提供更好的平台,因此,云计算机虚拟化技术成为了人们重点关注的技术。本文首先对虚拟化技术作了分析,提出了虚拟化技术存在的安全隐患以及解决对策,提升虚拟化技术实际的运行效率。	2016年10期_基于云计算机的虚拟化技术分析.pdf	http://sso.cdclib.org/interlibSSO/goto/6/=06190596Z93/kcms/detail/detail.aspx?dbCode=cjfq&filename=XXXT201610010&dbname=CJFDLAST2016
分层技术在计算机软件开发中的应用效果分析	信息系统工程	2016	2016年10期	【作者】 罗红梅 ； 【机构】 江西先锋软件职业技术学院 ；	分层技术 ； 计算机软件开发 ； 应用效果分析 ；	本文基于分层技术在计算机软件开发中的应用效果展开分析,着眼于分层技术开发使用的历史沿革,仅就双层技术的应用,三层技术的应用,四层技术的应用分别展开讨论,旨在推动分层技术在计算机软件开发中的应用。	2016年10期_分层技术在计算机软件开发中的应用效果分析.pdf	http://sso.cdclib.org/interlibSSO/goto/6/=06190596Z93/kcms/detail/detail.aspx?dbCode=cjfq&filename=XXXT201610011&dbname=CJFDLAST2016
延安数字化城市管理模式推行的实践效果与改进对策	信息系统工程	2016	2016年10期	【作者】 庞文 ； 【机构】 延安市城市管理局 ；	延安 ； 数字化城市管理 ； 模式 ； 分析 ； 对策 ；	延安数字城管监督指挥平台的建成,提升了城市管理的效率。目前,该模式的仅停留在每天发现问题、处理问题阶段,如何用网格化城市管理平台更有效的预防问题发生、指导城市设施建设和规划,这就需要进行数据多维度分析,本文旨在探讨如何在现有体制上改革,利用Arc GIS强大的数据处理与分析工具进行统计分析,获取预防问题、城市设施建设和规划决策所需的科学、准确、直观和详细的信息,以期为西部城市更加科学推进数字化城管提供依据。	2016年10期_延安数字化城市管理模式推行的实践效果与改进对策.pdf	http://sso.cdclib.org/interlibSSO/goto/6/=06190596Z93/kcms/detail/detail.aspx?dbCode=cjfq&filename=XXXT201610012&dbname=CJFDLAST2016
数字集群无线覆盖距离估算	信息系统工程	2016	2016年10期	【作者】 崔伟 ； 段广青 ； 梁洪源 ； 【机构】 武警石家庄士官学校 ；	数字集群 ； 距离估算 ；	本文主要针对数字集群无线覆盖距离如何估算的问题,依次从无线电波覆盖距离估算的基本方法、无线电播传播空中损耗的估算、基于Okumura-Hata模型估算覆盖距离三个方面进行分析解决。	2016年10期_数字集群无线覆盖距离估算.pdf	http://sso.cdclib.org/interlibSSO/goto/6/=06190596Z93/kcms/detail/detail.aspx?dbCode=cjfq&filename=XXXT201610013&dbname=CJFDLAST2016
基于IFIX组态软件的低压电流互感器检定流水线运行监控系统的设计与实现	信息系统工程	2016	2016年10期	【作者】 葛福菀 ； 王兆军 ； 张曼 ； 【机构】 潍坊市坊子区龙山建筑工程公司 ； 国网山东省电力公司电力科学研究院 ； 潍坊鑫帝都置业有限公司 ；	IFIX ； 运行监控 ； 低压电流互感器 ；	低压电流互感器检定流水线运行监控系统系统能够实时而生动地监控互感器检定流水线的作业过程,同时对检定数据进行全方位的分析和管理。系统能自动完成与计量生产调度平台、流水线的交互工作,并完成低压电流互感器误差、磁饱和裕度的检定、工频耐压等测试结论的实时监控。	2016年10期_基于IFIX组态软件的低压电流互感器检定流水线运行监控系统的设计与实现.pdf	http://sso.cdclib.org/interlibSSO/goto/6/=06190596Z93/kcms/detail/detail.aspx?dbCode=cjfq&filename=XXXT201610014&dbname=CJFDLAST2016
基于MCS-51单片机的车内防窒息报警智能控制系统	信息系统工程	2016	2016年10期	【作者】 毛亮 ； 胡健 ； 杨繁庆 ； 【机构】 南京农业大学 ；	窒息 ； 温度和CO2浓度检测 ； 短信提醒 ； 汽车报警 ；	解决儿童等弱势群体在车内窒息身亡的问题,设计出一套汽车内温度检测和气体检测的智能报警系统。通过分析隐患发生的条件,对汽车内温度和二氧化碳浓度进行实时检测,当汽车内温度达到预先设定温度或者二氧化碳浓度超过一定限度后,该系统将发短信给车主,并且触发车内报警装置提醒车内人员,同时强制启动天窗通风换气。经过实物模型的制作和实际实验,证明了本装置的可行性与可靠性。	2016年10期_基于MCS-51单片机的车内防窒息报警智能控制系统.pdf	http://sso.cdclib.org/interlibSSO/goto/6/=06190596Z93/kcms/detail/detail.aspx?dbCode=cjfq&filename=XXXT201610015&dbname=CJFDLAST2016
关于软件架构中的关键因素分析	信息系统工程	2016	2016年10期	【作者】 朱文娟 ； 【机构】 阜宁县人民医院 ；	软件架构 ； 关键因素 ； 软件工程 ；	随着现代计算机技术以及信息技术在人类社会生活中的普遍使用,软件成为社会发展必不可少的因素,不断创新软件对我国经济增长具有积极影响。软件架构是我国工程师研究的重要领域,文章主要针对软件架构中的关键因素进行分析。	2016年10期_关于软件架构中的关键因素分析.pdf	http://sso.cdclib.org/interlibSSO/goto/6/=06190596Z93/kcms/detail/detail.aspx?dbCode=cjfq&filename=XXXT201610016&dbname=CJFDLAST2016
CARIS HPD多类型数据解析引擎的设计与实现	信息系统工程	2016	2016年10期	【作者】 卫国兵 ； 杨龙 ； 石金榜 ； 王守国 ； 【机构】 天津海事测绘中心 ；	CARIS HPD海道产品数据库 ； OpenJUMP ； HPD源数据 ； 电子海图数据 ； 纸海图数据 ；	交通运输部海事局于2007年引进了国际上用于标准海图生产的CARIS HPD海道产品数据库,已用于海事序列图和专题图生产。CARIS HPD可利用同源数据同步生产传统INT 1纸海图和S-57标准电子海图,显著提高了海图产品生产效率和质量。但是,HPD数据结构复杂,对海图数据的空间分析以及基于网络平台的发布缺乏足够支持,因此有必要解析其数据组织结构,以构建HPD数据结构与外部数据关联的通道,进一步提高海图数据的利用率。本文在分析HPD数据库结构基础上,基于Java开源GIS项目OpenJUMP设计实现了HPD源、电子海图和纸海图等多类数据的解析引擎,经实验验证,可有效解析和显示三种类别的海图数据。	2016年10期_CARIS+HPD多类型数据解析引擎的设计与实现.pdf	http://sso.cdclib.org/interlibSSO/goto/6/=06190596Z93/kcms/detail/detail.aspx?dbCode=cjfq&filename=XXXT201610017&dbname=CJFDLAST2016
在线疲劳寿命计算服务程序健壮性增强研究	信息系统工程	2016	2016年10期	【作者】 甘国华 ； 秦贯洲 ； 耿明丰 ； 张娜妮 ； 【机构】 中核武汉核电运行技术股份有限公司 ； 江苏核电有限公司 ； 紫光(北京)智控科技有限公司 ；	疲劳监测 ； 计算服务 ； 健壮性 ； LINQ to XML ；	国内某核电站的在线疲劳监测系统的后台以Windows服务方式实现并运行。电厂潜在各种各样的突发场景均能导致该Windows计算服务宕掉,软件前台的疲劳损伤监测结果的实时性和可用性受到严重挑战。本文运用LINQ to XML技术设计了一个状态跟踪器,通过功能整合及常见场景的测试及验证,有效提升了疲劳寿命计算服务的健壮性,从而进一步保障了在线疲劳监测系统的可用性。	2016年10期_在线疲劳寿命计算服务程序健壮性增强研究.pdf	http://sso.cdclib.org/interlibSSO/goto/6/=06190596Z93/kcms/detail/detail.aspx?dbCode=cjfq&filename=XXXT201610018&dbname=CJFDLAST2016
分析分层技术在计算机软件开发中的应用	信息系统工程	2016	2016年10期	【作者】 杨霞 ； 【机构】 黔南民族师范学院 ；	分层技术 ； 应用 ； 计算机软件开发 ；	分层技术对于计算机领域中的应用范围比较广泛。因此,本文从计算机软件的分层技术出发,研究分层技术对于计算机软件开发的相关理论知识,以期为计算机软件的应用做好充足的准备。	2016年10期_分析分层技术在计算机软件开发中的应用.pdf	http://sso.cdclib.org/interlibSSO/goto/6/=06190596Z93/kcms/detail/detail.aspx?dbCode=cjfq&filename=XXXT201610019&dbname=CJFDLAST2016
基于计算机图像技术的系统识别技术应用研究	信息系统工程	2016	2016年10期	【作者】 周林妹 ； 【机构】 长沙商贸旅游职业技术学院信息与汽车工程系 ；	计算机图像技术 ； 系统识别技术 ； 图像技术应用 ； 智能图像识别 ；	计算机图像技术随着计算机运算能力的增强和网络信息传递的便捷性强化得到了很大的发展,在理论和实践阶段都有了较强的进步,可以应用于大部分实际的系统识别技术之中。本文从计算机图像技术的优点及其技术的突破口出发,探讨在系统识别技术当中计算机图像技术的进步所带来的跨越。	2016年10期_基于计算机图像技术的系统识别技术应用研究.pdf	http://sso.cdclib.org/interlibSSO/goto/6/=06190596Z93/kcms/detail/detail.aspx?dbCode=cjfq&filename=XXXT201610020&dbname=CJFDLAST2016
一种网络虚拟技术的软件开发技术研究	信息系统工程	2016	2016年10期	【作者】 周天文 ； 【机构】 山东科技职业学院信息工程系 ；	网络虚拟化技术 ； 软件开发 ； 技术研究 ；	文章首先对网络虚拟技术中开展软件开展技术应用的技术性基础进行论述,并对所进行的软件功能完善方法进行简要介绍。在此基础上重点探讨基于网络虚拟计划中开展软件开发的具体技术方法,以及网络虚拟技术应用后所带来的优势,促进软件管理可以更高效的进行。	2016年10期_一种网络虚拟技术的软件开发技术研究.pdf	http://sso.cdclib.org/interlibSSO/goto/6/=06190596Z93/kcms/detail/detail.aspx?dbCode=cjfq&filename=XXXT201610021&dbname=CJFDLAST2016
基于计算机网络系统的数据分析应用研究	信息系统工程	2016	2016年10期	【作者】 刘静 ； 【机构】 喀什大学计算机科学与技术学院 ；	大数据 ； 数据分析 ； 计算能力 ；	时代的进步和发展促使网络走进千家万户,并为人们的生活生产发展提供了强大的动力。究其根本原因,则是因为计算机网络系统具有强大的数据分析能力,通过对复杂数据的收集和分析,注意探索出相应的应对之策。基于此,本文对基于计算机网络系统的数据分析应用进行研究,以期能够促进相关领域的进一步发展。	2016年10期_基于计算机网络系统的数据分析应用研究.pdf	http://sso.cdclib.org/interlibSSO/goto/6/=06190596Z93/kcms/detail/detail.aspx?dbCode=cjfq&filename=XXXT201610022&dbname=CJFDLAST2016
基于PC集群性能特征分析软件的研发及应用	信息系统工程	2016	2016年10期	【作者】 王景德 ； 付喜春 ； 李家俊 ； 【机构】 大庆油田物探研究院 ；	应用特征文件 ； 性能分析 ； 并行作业 ； 性能瓶颈 ；	随着地震勘探技术的飞速发展,叠前时间偏移等技术越来越多地应用到石油勘探领域。但是,这些大规模、多节点协同参与的并行运算,需要连续占用大量的系统资源和机时。当个别运算节点运行异常时,将延迟整个并行作业的运行时间。通过研究,开发了"PC集群性能特征分析软件",对集群并行运算节点进行实时监控和性能分析,及时发现和解决异常节点,提高大规模PC集群整体运算能力和工作效率。	2016年10期_基于PC集群性能特征分析软件的研发及应用.pdf	http://sso.cdclib.org/interlibSSO/goto/6/=06190596Z93/kcms/detail/detail.aspx?dbCode=cjfq&filename=XXXT201610023&dbname=CJFDLAST2016
浅析城市配电网规划理论研究与应用	信息系统工程	2016	2016年10期	【作者】 康利平 ； 王绍钧 ； 叶海龙 ； 【机构】 巴彦淖尔电业局 ；	城市 ； 配电网规划理论 ； 应用 ；	配电网规划是电力企业发展中的重要工作内容,加强对城市配电网规划理论与其应用研究,对城市配电网合理规划与建设发挥着重要作用。目前,城市配电网规划中存在一定的不足,影响电力企业发展。对此,本文主要阐述城市配电网规划的重要性及其规划中存在的问题,并提出其具体应用。	2016年10期_浅析城市配电网规划理论研究与应用.pdf	http://sso.cdclib.org/interlibSSO/goto/6/=06190596Z93/kcms/detail/detail.aspx?dbCode=cjfq&filename=XXXT201610024&dbname=CJFDLAST2016
卡伦塞尔卷取机转盘抱闸多系统控制的研究	信息系统工程	2016	2016年10期	【作者】 毕向东 ； 【机构】 河钢集团唐钢公司 ；	卡伦塞尔卷取机 ； 抱闸 ； 系统控制 ；	卡伦塞尔卷取机又被称为转盘式卷取机,它是将两个卷取芯轴装在一个可旋转的转盘上,同时两个卷取芯轴也可以独立旋转。它是通过转盘旋转180°来实现两个卷取芯轴位置交换,完成穿带和卸卷操作,从而实现带钢连续卷取功能。	2016年10期_卡伦塞尔卷取机转盘抱闸多系统控制的研究.pdf	http://sso.cdclib.org/interlibSSO/goto/6/=06190596Z93/kcms/detail/detail.aspx?dbCode=cjfq&filename=XXXT201610025&dbname=CJFDLAST2016
分布式计算机网络结构分析与优化探讨	信息系统工程	2016	2016年10期	【作者】 魏涛 ； 【机构】 通辽职业学院 ；	分布式计算机网络 ； 吞吐量 ； 利用率 ； 可靠性 ；	本文主要探讨分布式计算机网络结构分析与优化,通过分析分布式计算机网络结构性能指标、吞吐量、利用率、可靠性等多方面因素,给出分布式计算机网络结构的优化方案。	2016年10期_分布式计算机网络结构分析与优化探讨.pdf	http://sso.cdclib.org/interlibSSO/goto/6/=06190596Z93/kcms/detail/detail.aspx?dbCode=cjfq&filename=XXXT201610026&dbname=CJFDLAST2016
电子信息工程中计算机技术运用及相关问题阐述	信息系统工程	2016	2016年10期	【作者】 袁帅 ； 【机构】 河南省地质高级技工学校 ；	计算机技术 ； 电子信息工程 ； 相关问题 ；	伴随现阶段科技的不断发展,电子信息工程中已经广泛的应用计算机技术。伴随计算机网络技术的不断发展,人们的生活、工作以及学习方式发生了极大的转变,电子信息工程中应用计算机技术极为重要。本文主要对电子信息工程中运用计算机技术期间相关问题进行了研究,其目的在于确保计算机技术在电子信息工程中应用更加有效,其作用能够被充分地发挥出来。	2016年10期_电子信息工程中计算机技术运用及相关问题阐述.pdf	http://sso.cdclib.org/interlibSSO/goto/6/=06190596Z93/kcms/detail/detail.aspx?dbCode=cjfq&filename=XXXT201610027&dbname=CJFDLAST2016
中波三频共塔发射技术的天调网络设计分析	信息系统工程	2016	2016年10期	【作者】 肖帅 ； 【机构】 国家新闻出版广电总局四九一台 ；	三频共塔 ； 发射技术 ； 天调网络 ；	传统的单频单塔的中波发射模式,占用土地面积较大,建设周期较长,建设费用较高,不能满足时代的需求,而中波三频共塔发射技术的天调网络设计能够实现三频中波同时发射,解决了目前中波发射的窘境,极大地满足了人民群众对于文化的需求。本文简要的阐述了中波三频共塔发射技术的天调网络设计的方法步骤,阐述了系统设计的技术细节,旨在进一步提升我国中波三频共塔发射能力。	2016年10期_中波三频共塔发射技术的天调网络设计分析.pdf	http://sso.cdclib.org/interlibSSO/goto/6/=06190596Z93/kcms/detail/detail.aspx?dbCode=cjfq&filename=XXXT201610028&dbname=CJFDLAST2016
