title	journal_name	year	issue	author	keywords	summary	pdf_filename	article_url
新经济:鲜花还是陷阱	信息系统工程	2001	2001年10期	【作者】 张国云 ； 【机构】 浙江省计委 ；	新经济时代 ； 信息革命 ； 市场全球化 ； 高新技术产业 ； 新经济发展 ； 首相布莱尔 ； 高技术产业 ； 新技术产业化 ； 投资基金 ； 人才竞争 ；	<正> 最先提出“新经济”概念的,是美国《商业周刊》经济编辑迈克尔小曼德尔,他在1996年12月30日的一篇文章中首次把新经济界定为“以信息革命和市场全球化为基础的经济”,并认为美国20世纪90年代出现的经济繁荣是“新经济的胜利”,表明美国已进入新经济时代。 但专家学者对新经济一直存在不同见解,特别是去年下半年起,美国经济增长明显放慢,质疑新经济的声音自此不绝于耳。英国首相布莱尔在为启动“英国在线”战略发表的讲话中,直截了当地否	2001年10期_新经济:鲜花还是陷阱.pdf	http://sso.cdclib.org/interlibSSO/goto/6/=06190596Z93/kcms/detail/detail.aspx?dbCode=cjfq&filename=XXXT200110029&dbname=CJFD9902
开放 协商 自主——我国对APEC的立场与基本政策	信息系统工程	2001	2001年10期	【作者】 魏延 ；	主题会议 ； 全球经济活动 ； 经济发展速度 ； 经济技术合作 ； 利益所在 ； 投资自由化 ； 机制化 ； 亚太地区经济 ； 所持 ； 区域经济集团化 ；	<正> APEC 2001年会各项主题会议已经相继结束,主题会议的成功举行为10月20～21日第九次领导人非正式会议打下了良好的基础。在领导人非正式会议即将举行之际,我们有必要回顾一下我国对APEC的一些基本立场和相关政策,以便能更好地理解APEC 2001主题会议所取得的各项成果。 基本立场 中国是亚太地区的重要成员,同时亚太地区也是我国对外开放最重要的地区。1991年我国加入APEC以来,一直以积极、负责和合作的态度参与活动,特别是近几年我国社会和经济发展速度为世所瞩目,我国在亚太乃至全球经济活动中扮演着越来越重要的作用。我国即将加入WTO,对亚太经合组织的立场与基本政策与我国在WTO中所持的态度与努力相辅相成,共同构成我国对外贸易的基本体系。 亚太地区是我国的主要利益所在。目	2001年10期_开放+协商+自主——我国对APEC的立场与基本政策.pdf	http://sso.cdclib.org/interlibSSO/goto/6/=06190596Z93/kcms/detail/detail.aspx?dbCode=cjfq&filename=XXXT200110030&dbname=CJFD9902
新时代的银行业	信息系统工程	2001	2001年09期	【作者】 范向琪 ； 【机构】 本刊记者 ；	网上银行业务 ； 网上银行服务 ； 人民银行总行 ； 支付工具 ； 网上证券 ； 国内电子商务 ； 南方航空 ； 网上商城 ； 财务管理 ； 工商银行总行 ；	<正> 早在1997年4月,招商银行就推出“一网通”服务,成为国内首家推出网上银行业务的银行。1999年9月,招商银行率先在国内全面启动网上银行服务,建立了由网上企业银行、网上个人银行、网上证券、网上商城、网上支付组成的较为完善的网络银行服务体系。搜狐、新浪、8848和南方航空等80%的国内电子商务网站将“一网通”列为首选或唯一的网上支付工具,累计在B2C方面已超过30万个客户。在网上企业银行方面,交通部、中国人民银行总行众多国内外厂商和政府单位、知名企业均使用各种网上企业银行进行财务管理,交易金额超过了上万亿元人民币。	2001年09期_新时代的银行业.pdf	http://sso.cdclib.org/interlibSSO/goto/6/=06190596Z93/kcms/detail/detail.aspx?dbCode=cjfq&filename=XXXT200109000&dbname=CJFD9902
入世后,中国银行业路在何方	信息系统工程	2001	2001年09期	【作者】 子石 ；	外资银行 ； 中资银行 ； 《银行家》 ； 外国银行分行 ； 运作经验 ； 金融机构 ； 全球性竞争 ； 经营网点 ； 金融业务创新 ； 客户多元化 ；	<正> 中国加入WTO后,对外资银行的许多限制将逐步取消,比如对中资企业和居民的外汇及人民币业务、人民币业务的地域范围等限制。此后,中资银行将不得不直接面对资产动辄以万亿美元计算且有丰富运作经验的外资银行的全方位挑战。中国大大小小的银行,将在全球性竞争中比拼生命力。 至2000年底,我国共有中资银行109家,外国银行分行156家,中外合资或外商独资商业银行13家,总资产约12.41万亿元,占包括证券、保险在内的全部金融机构总资产的70%。中国14家银行跻身世界千强 英国《银行家》杂志一年一度推出的“世界1000家大银行”排名,历来被公认为评估世界银行业和各家银行综合实力的展现。近日,《银行家》公布了2001年度“世界1000家大银行”排行榜,中国	2001年09期_入世后,中国银行业路在何方.pdf	http://sso.cdclib.org/interlibSSO/goto/6/=06190596Z93/kcms/detail/detail.aspx?dbCode=cjfq&filename=XXXT200109001&dbname=CJFD9902
证券行业信息化与外包	信息系统工程	2001	2001年09期	【作者】 夏晖 ； 【机构】 华安证券 ；	网上证券交易 ； 股票交易 ； 中国证券市场 ； 传统交易方式 ； 总交易量 ； 第四季度 ； 第三次浪潮 ； 信息技术 ； 投资部 ； 市场增长率 ；	<正> 随着信息技术在证券业的应用越来越广泛和深入,中国证券市场正在迎来第三次浪潮:证券市场信息化。而券商网络化和证券电子商务的开展是证券市场信息化的重要特征。我国证券行业信息化的发展态势证券行业信息化发展迅速 在网上证券交易最活跃的美国,网上股票交易成本仅为传统交易方式的15%甚至更低,低廉的交易成本促进了美国网上证券交易的迅猛发展。资料显示,美国去年第四季度在线交易的市场增长率已高达49%;今年一季度,美国的网上证券交易已经超过总交易量的25%,	2001年09期_证券行业信息化与外包.pdf	http://sso.cdclib.org/interlibSSO/goto/6/=06190596Z93/kcms/detail/detail.aspx?dbCode=cjfq&filename=XXXT200109002&dbname=CJFD9902
信息工程动态	信息系统工程	2001	2001年09期		工程动态 ； 移动通信业务 ； 业务总量 ； 运营业 ； 信息产业 ； 数据业务 ； 利润总额 ； 热点产品 ； 北电网络 ； 话音业务 ；	<正> 我国信息产业“十五”开局良好 今年以来,我国信息产业保持了全行业持续、快速、健康发展的势头,为实现“十五”计划的良好开局奠定了基础。据介绍,今年1～6月,我国通信业业务量预计完成2700亿元,比上年同期增长25.6%;业务收入完成1800亿元,比上年同期增长9.4%;完成利润总额295亿元,比上年同期增长19.9%。据预计,今年我国通信运营业全年业务总量可完成6000亿元,比上年增长27%;业务收入将达到4000亿元,比上年增长12%。移动通信业务将保持高速增长,数据业务发展仍快于话音业务,固定电话平稳发展。电子信息产品市场总体规模大约为1.4万亿元,投资类热点产品如移动通信、计算机、软件、微电子、网络产品等的市场增长保持在35～40%;元器件类产品保持在20～25%,消费类产品平稳增长,增速约为10～15%。	2001年09期_信息工程动态.pdf	http://sso.cdclib.org/interlibSSO/goto/6/=06190596Z93/kcms/detail/detail.aspx?dbCode=cjfq&filename=XXXT200109003&dbname=CJFD9902
中小企业建网需求多业务纽带——访神州数码网络公司产品部副总经理钟成	信息系统工程	2001	2001年09期	【作者】 蒋树春 ； 【机构】 本刊记者 ；	产品部 ； 行业销售 ； 网络行业 ； 国家信息化 ； 国内中小企业 ； 全面解决方案 ； 产品开发 ； 全系列产品 ； 忙时 ； 网络设备 ；	随着国家信息化建设的深入,国内中小企业信息化建设的开展日益红火,但是这些企业由于人才、经验的匮乏,在对信息化系统的技术、产品、系统规划等方面都需要学习。因此建网最大的需求是什么尤其值得关注。为此我们特意拜访了神州数码网络公司产品部副总经理钟成,探讨准确的答案。钟成在网络行业工作近10年,先后做过产品开发、行业销售等工作,对中小企业建需求的见解客观而且实际。	2001年09期_中小企业建网需求多业务纽带——访神州数码网络公司产品部副总经理钟成.pdf	http://sso.cdclib.org/interlibSSO/goto/6/=06190596Z93/kcms/detail/detail.aspx?dbCode=cjfq&filename=XXXT200109004&dbname=CJFD9902
惠普,立于百万激打成功之时	信息系统工程	2001	2001年09期		中国惠普 ； 孙振耀 ； 陈冲 ； 群雄纷争 ； 信息产业 ； 渠道伙伴 ； 败走麦城 ； 司副 ； 春天来了 ； 打印需求 ；	<正> 4年价格保持不变的HP Laser Jet6L,单机销售却突破了100万台,这不能不说是在中国IT市场的一个奇迹;而在群雄纷争、竞争激烈、沉浮变化莫测的中国IT市场,惠普持续5年以60%以上的市场份额位居中国激打市场第一,就更是一个奇迹;所以在今天普遍对IT市场低迷而徘徊之时,中国惠普总裁孙振耀却已充满了“中国市场的春天来了”的豪迈。 8月6日,中国惠普举行“百万信赖,光荣选择”庆典活动,邀请了信息产业部计算机司副司长陈冲、神州数码总裁郭为等业界友人共同分享成功的喜悦、回顾艰辛的历程。活动中,一个个百万后面	2001年09期_惠普,立于百万激打成功之时.pdf	http://sso.cdclib.org/interlibSSO/goto/6/=06190596Z93/kcms/detail/detail.aspx?dbCode=cjfq&filename=XXXT200109005&dbname=CJFD9902
一道丰盛的信息技术大餐——亚洲信息技术展览会登陆上海	信息系统工程	2001	2001年09期		信息技术 ； 光大会展中心 ； 当代电子 ； 技术展览会 ； 通信产品 ； 技术论坛 ； 光大国际 ； 经济衰退 ； 通信产业 ； 资讯科技 ；	<正> 8月8日,亚洲信息技术展览会(CeBIT Asia 2001)暨亚洲信息技术论坛(2001 CeBIT Asia Forum)在上海光大会展中心及上海光大国际酒店拉开帷幕,来自世界各个国家和地区以及中国各个地区的500多家参展商携当代电子信息技术领域最前沿的信息、通信产品驾临展会,为我们展现了一道丰盛的信息技术大餐。 关于亚洲信息技术展览会 在过去的二十年中,中国已成为世界上发展最快的信息技术市场,并且在今后几年中依然是最有活力的市场。在地区经济衰退时,中国的信息技术市场发展引人注目,业内人士估计,在今后5年内,中国将成为世界第二大信息技术市场,并致力于在信息技术中变得更加独立。毋庸置疑,中国将有巨大的潜力和机会有待开发和探索。	2001年09期_一道丰盛的信息技术大餐——亚洲信息技术展览会登陆上海.pdf	http://sso.cdclib.org/interlibSSO/goto/6/=06190596Z93/kcms/detail/detail.aspx?dbCode=cjfq&filename=XXXT200109006&dbname=CJFD9902
康柏激荡中国市场	信息系统工程	2001	2001年09期		康柏 ； 大中国 ； 副总裁 ； 卡普拉斯 ； 发展前景 ； 发展战略 ； 产品研发中心 ； 特定行业 ； 软件开发商 ； 渠道信息 ；	<正> 面对高速发展的中国IT市场以及瞬息万变的用户需求,康柏电脑公司副总裁兼大中国区总裁俞新昌博士向中国用户全面阐释了康柏公司的最新发展战略,并郑重承诺向中国市场投资1亿美元。 服务和方案唱主角 自从康柏公司首席执行官麦克.卡普拉斯先生1999年上任以来,成功带领康柏从引人注目的PC霸主顺利转型为全球领先的企业级技术与方案供应商,并牢牢把握住了公司发展的核心竞争力——创新的产品、集成的方案以及全球一流的服务。面对用户不断变换的应用趋势以及IT技术的发展前景,康柏制定了下一个目标:向服务与方案全面转型,以服务为先导,以方案为核心,以客户需求为中心,发展康	2001年09期_康柏激荡中国市场.pdf	http://sso.cdclib.org/interlibSSO/goto/6/=06190596Z93/kcms/detail/detail.aspx?dbCode=cjfq&filename=XXXT200109007&dbname=CJFD9902
联想引领数字化办公	信息系统工程	2001	2001年09期		数字化办公 ； 多功能一体机 ； 办公设备 ； 现代办公 ； 产品推广 ； 起步时间 ； 数字化设备 ； 输出功能 ； 新型产品 ； SOHO ；	<正> 多功能一体机在国内的起步时间是1997年,四年多的发展证明,多功能一体机给人们的办公带来了多方面的明显改变。随着市场的不断发展,多功能一体机的诞生和发展,正是适应了广大用户对现代办公数字化、集成化与网络化的迫切需求。最大的特点就是代表了办公设备集成化、数字化的发展方向,扮演着中小企业、集团级用户以及SOHO用户办公数字化先锋的角色。 对于什么是多功能一体机,目前业界有着大体一致的看法,而联想则做出的更明确的定义:多功能一体机是将两种以上的办公输入/输出功能集成在一起,可直接地与计算机或网络相连,从而实现高质、高效数字化办公的设备。根据这一定义,联想规划了产品,并预测了未来多功能一体机市场的发展趋势:取代部分单一功能以及非数字化设备,解放办公室生产力;用户需	2001年09期_联想引领数字化办公.pdf	http://sso.cdclib.org/interlibSSO/goto/6/=06190596Z93/kcms/detail/detail.aspx?dbCode=cjfq&filename=XXXT200109008&dbname=CJFD9902
市场聚焦	信息系统工程	2001	2001年09期		市场聚焦 ； 高端服务器 ； 高端计算 ； 服务器产品 ； 商用电脑 ； 计算任务 ； 这个世界 ； EPIC ； 安腾处理器 ； 信息载体 ；	<正> 今年5月,HP在新加坡发布了基于安腾(Itanium)的服务器产品,吸引了更多的目光关注安腾、关注惠普、关注高端服务器。安腾是HP和Intel历7年之久研发的结果,也是第一块IA-64芯片,它采用显示并行指令计算(EPIC)设计,速度更快。它带给这个世界的第一印象是:高端计算设备市场从此迎来第一个开放的硬件平台。由于当今计算任务越来越繁重,并且需要越来越高的能力,因此老式的32位体系的限制也越来越明显。Itanium体系可以提供现在和将来应用所需的全部能力并与现有的IA-32在硬件上完全兼容。 在安腾诞生后不久,国内外厂商对Itanium普遍表现出了支持的态势,纷纷	2001年09期_市场聚焦.pdf	http://sso.cdclib.org/interlibSSO/goto/6/=06190596Z93/kcms/detail/detail.aspx?dbCode=cjfq&filename=XXXT200109009&dbname=CJFD9902
要闻回顾	信息系统工程	2001	2001年09期		Athlon ； 虚拟磁带 ； 存储服务器 ； 电脑硬盘 ； Tivoli ； 双端口 ； 存储产品 ； 赛普拉斯 ； 要闻回顾 ； Toolkit ；	<正> 新品方案IBM推出48G8笔记本电脑硬盘选件及企业存储产品。迄今为止IBM推出的容量最大速度最快的ThinkPad笔记本电脑硬盘用于装备ThinkPad A、T和X系列。后者包括TotalStorage企业存储服务器的FICON支持和两款首次采用IBM专利铜芯技术的虚拟磁带服务器。Zarlink推出本行业最高密度的信息包处理器。用于TDM到ATM间的转化的最高密度AAL1分段和重组芯片。赛普拉斯推出4M位双端口存储器样品。是针对WAN和SAN应用推出高密度、高性能的专用存储器。Tivoli推出光盘工具包。Tivoli Knowledge Toolkit可显著减少技术支持电话,并且可不依赖于Web实现Tivoli应用在全球范围内的标准化部署。流媒体技术的“中国芯”。领先对手半年,汉唐和它的MPEG-4让中国抓住宽带的机会。AMD推出1.1GHz移动式AMD Athlon4处理器。康柏已决定采用AMD新推出的1.1GHz移动式AMD Athlon4及900MHz移动式AMD Duron等两款处理器。	2001年09期_要闻回顾.pdf	http://sso.cdclib.org/interlibSSO/goto/6/=06190596Z93/kcms/detail/detail.aspx?dbCode=cjfq&filename=XXXT200109010&dbname=CJFD9902
城域网建设开启宽带之路	信息系统工程	2001	2001年09期	【作者】 钟宏 ； 【机构】 本刊记者 ；	城域网建设 ； 公共信息服务 ； 种下的 ； 接入网建设 ； 设备提供商 ； 数据业务 ； 上网速度 ； 市场容量 ； 中国联通 ； 互联网接入 ；	早在九十年代初的国外教科书上就有了城域网MAN(MetropolisArea Network)的概念。在国内,城域网是连接政府机关、教育科研等企事业单位、公司和家庭用户的宽带接入网以及和国外连接的Internet接口。它既是Internet网在本地的延伸,又是本地的公共信息服务平台。而之所以直到今天还来谈城域网,可以说城域网这颗前人种下的硕果终于到了收获的时机。一是在技术上网络发展的越发成熟为城域网建设奠定了坚实的基础。二则是各种网络应用,尤其是宽带应用和服务的蓬勃兴起对宽带的迫切需求,这也是城域网建设日举国受到重视的更为重要的原因。	2001年09期_城域网建设开启宽带之路.pdf	http://sso.cdclib.org/interlibSSO/goto/6/=06190596Z93/kcms/detail/detail.aspx?dbCode=cjfq&filename=XXXT200109011&dbname=CJFD9902
宽带城域网 建设思考	信息系统工程	2001	2001年09期	【作者】 赵健峰 ；	宽带城域网 ； 中国电信 ； 中国联通 ； 中国移动 ； 出口带宽 ； 网络带宽 ； 主要参与者 ； 拓扑结构 ； 光纤入户 ； 接入带宽 ；	<正> 目前中国国内的互联网骨干建设市场基本瓜分完毕,主要参与者是中国电信、中国联通(2000年4月开通)和中国移动(正在兴建)三家大运营商。骨干网的改善极大地提高了国内网络带宽和国际出口带宽,并使边缘网络成为带宽为自己打了很深的一个印记:宽带。我们因而也普遍称之为:宽带城域网。城域网典型网络拓扑结构 对于宽带城域网用户(PC)来讲,中间采取的多种接入方式对其是透明的,用户无须知道自己是采用哪种方式接入	2001年09期_宽带城域网+建设思考.pdf	http://sso.cdclib.org/interlibSSO/goto/6/=06190596Z93/kcms/detail/detail.aspx?dbCode=cjfq&filename=XXXT200109012&dbname=CJFD9902
IP光纤城域网	信息系统工程	2001	2001年09期	【作者】 陆明 ； 【机构】 中国建设银行北京分行 ；	城域网 ； IP ； 光互联网 ； 业务发展需求 ； 光网络技术 ； 网络带宽 ； 光纤网络 ； 接入能力 ； 网络基础设施 ； 网络服务商 ；	随着Internet应用需求出现爆炸性增长,Internet网上的业务流量越来越大,网络带宽和容量的急剧增长使服务供应商正面临着前所未有的挑战,他们迫切需要一整套网络基础设施解决方案,以便从容面对未来的市场成长;采用IP优化的光互联网络责满足网络服务商和用户的要求。光网络技术的飞速发展为人们带来了几乎无限的带宽以及透明的接入能力。然而,为真正利用光技术的优势,服务供应商还需要将其针对IP业务进行优化和整合,最终构建一个适合未来业务发展需求的光互联网。	2001年09期_IP光纤城域网.pdf	http://sso.cdclib.org/interlibSSO/goto/6/=06190596Z93/kcms/detail/detail.aspx?dbCode=cjfq&filename=XXXT200109013&dbname=CJFD9902
应用宽带增值服务 拓展城域网建设新时代	信息系统工程	2001	2001年09期	【作者】 刘明 ；	城域网建设 ； 应用服务 ； 侯自强 ； 信息网络 ； 信息服务 ； 网络传送 ； 通信网络 ； 传送技术 ； 业务质量 ； 上行数据 ；	<正> 国家863首席科学家侯自强曾这样评价宽带网:“由于目前的应用、管理等还有很多问题,企业要赢利就会有困难,可能投下去2年甚至3年都未必会赢利,从这个角度上说,光扩张不赢利,像.COM。”业界虽然对宽带网是否会成为下一个泡沫认识不一,但有一点却达成了共识:即宽带的应用和内容服务是至关重要的,如果铺好了网而没有相应的服务和内容跟上,就像花缺了水而失去了赖以成长的土壤。通信网络虽是信息网络的基础,享受信息服务和应用服务却是用户上网的最终目的。 现在宽带在“宽”的技术实现上已经不是关键问题了。在电脑界有个著名的摩尔定理认为每	2001年09期_应用宽带增值服务+拓展城域网建设新时代.pdf	http://sso.cdclib.org/interlibSSO/goto/6/=06190596Z93/kcms/detail/detail.aspx?dbCode=cjfq&filename=XXXT200109014&dbname=CJFD9902
速度与文档管理完美结合——松下数字多功能机介绍	信息系统工程	2001	2001年09期		文档管理 ； 办公设备 ； 功能键 ； 打印方式 ； 自动送纸器 ； 应用软件 ； 文字识别 ； 生产厂商 ； 驱动程序 ； 扫描方式 ；	<正> 近年来,人们的办公观念不断更新,对具有多种功能的集成办公设备的需求量逐步扩大,生产厂商根据自己的特长,也适时推出了多种集扫描、复印、打印和传真于一体的多功能办公设备。这些产品有的以打印机为核心,有的以复印机为原型,也有的以传真机为原型。 在品种众多的多功能打印机中,松下(www.panasonic.com.cn)WorkioDP-150FP是一台集数字复印、扫描、传真和激光打印于一身的多功能办公设备,它的体积相当于一台中型激光打印机,蓝色的控制面板使它带有些许时尚的信息,各种不同功能的按健分别安排在各自的区域里,操作方便,从外形上看,我们可以感觉到一些数字复印机的影子。 与常见的小型多功能打印机不同,DP-150FP的打印部分使用的是激光打印机芯,因而它的打印和复印速度也就	2001年09期_速度与文档管理完美结合——松下数字多功能机介绍.pdf	http://sso.cdclib.org/interlibSSO/goto/6/=06190596Z93/kcms/detail/detail.aspx?dbCode=cjfq&filename=XXXT200109015&dbname=CJFD9902
一月精品	信息系统工程	2001	2001年09期		多功能一体机 ； 识别软件 ； 高速传真 ； 无绳电话 ； 真彩色 ； 高分辨率彩色 ； 扫描功能 ； 网络安全 ； 全彩色 ； 软件平台 ；	<正> 联想喷墨多功能一体机新品M5400上市 近日,联想推出了一款新型喷墨多功能一体机M5400,它集成了全彩色高速传真、连续复印、高质打印以及馈纸式扫描等出色功能,并且标配无绳电话,满足用户对办公的多方面要求。 M5400采用了一黑一彩双墨头,可进行2400×1200dpi的高分辨率彩色打印,达到了12页/分的速度;设置了连续复印功能,可以复印长达几十页的文件;M5400采用了国内最高的36.6K的传真速率;具备了高达9600dpi的24位真彩色扫描功能,可以进行多页连续扫描功能,配合联想独有的中文识别软件OCR,能将文件一次扫入电脑并进行识别,省去大量录入的麻烦。	2001年09期_一月精品.pdf	http://sso.cdclib.org/interlibSSO/goto/6/=06190596Z93/kcms/detail/detail.aspx?dbCode=cjfq&filename=XXXT200109016&dbname=CJFD9902
CISCO呼叫中心解决方案——锻造服务尖刀	信息系统工程	2001	2001年09期		呼叫中心 ； CISCO ； 客户服务中心 ； 国外银行 ； 外拨 ； 其它金融机构 ； 语音应答系统 ； 服务形象 ； 服务系统 ； 金融卡 ；	银行间的竞争已经从国内银行支行、分理处之间的竞争扩大到分行、总行之间和竞争及国有银行和涉足中国市场的国外银行之间的竞争。提高工作效率、降低员工成本、寻求快捷高效、优质的服务方式以提高服务品质和服务形象已是竞争必需。呼叫中心和建立将为银行或其它金融机构提供强有力的竞争。	2001年09期_CISCO呼叫中心解决方案——锻造服务尖刀.pdf	http://sso.cdclib.org/interlibSSO/goto/6/=06190596Z93/kcms/detail/detail.aspx?dbCode=cjfq&filename=XXXT200109017&dbname=CJFD9902
数字化运营:CISCO基金管理之道	信息系统工程	2001	2001年09期		CISCO ； 网络系统 ； 基金管理 ； 数字业务 ； 客户服务系统 ； 证券市场 ； 数据仓库 ； 智能分析 ； 定期定额投资 ； 信息服务系统 ；	开放式基金是公认的一种为个人提供理财服务的理想方式。基金管理公司如果不具备快速、安全、灵活的数字业务网络系统,最终会因无法满足客户需求而退出市场。	2001年09期_数字化运营:CISCO基金管理之道.pdf	http://sso.cdclib.org/interlibSSO/goto/6/=06190596Z93/kcms/detail/detail.aspx?dbCode=cjfq&filename=XXXT200109018&dbname=CJFD9902
惠普保函打印 低成本高品质	信息系统工程	2001	2001年09期		网络打印 ； 应用系统 ； 针式打印机 ； 保函 ； 二十一世纪 ； 打印系统 ； 双面打印 ； 动态表 ； 软件系统 ； 转换工具 ；	进入二十一世纪,信息化的浪潮席卷商业领域已是一项不争的事实,而它走进大众的生活也将成为一个不可阻挡的趋势。当越来越多的人开始接触网络时,网络将在人们的生活中扮演愈发重要的角色。当传统产业纷纷与网络亲密接触后,越来越多的网上学校、网上银行、网上购物如雨后春笋般涌现,为我们的生活提供了更便利的选择空间。而保险业,在这股不可阻挡的e化大潮中,也悄悄登陆到互联网上。	2001年09期_惠普保函打印+低成本高品质.pdf	http://sso.cdclib.org/interlibSSO/goto/6/=06190596Z93/kcms/detail/detail.aspx?dbCode=cjfq&filename=XXXT200109019&dbname=CJFD9902
