title	journal_name	year	issue	author	keywords	summary	pdf_filename	article_url
C/S模式综合大型业务系统中安全系统的设计	计算机工程	1996	1996年S1期	【作者】 吕尧联 ； 张静 ； 【Author】       Lu Yaolian Zhang Jing(CITIC Industrial Bank Beijing 100004) 【机构】 中信实业银行电脑部!北京100004 ；	安全 ； 权限 ； 客户服务器模式 ； security/authority/C/S(client/server) ；	在企业级以上规模的综合业务系统设计中,特别是在金融领域,保证数据安全的存储与使用是一个极为敏感的重要问题,是系统可用性的先决条件.为了以较低的代价实现大型复杂C/S模式系统的安全系统设计,文中提出了有关安全系统设计的具体步骤和一种实用方法的建议,并且讨论了应用系统本身及运行的软件环境中与安全有关的一些问题.	1996年S1期_C+S模式综合大型业务系统中安全系统的设计.pdf	http://sso.cdclib.org/interlibSSO/goto/6/=06190596Z93/kcms/detail/detail.aspx?dbCode=cjfq&filename=JSJC1996S1047&dbname=CJFD9498
OSI目录服务技术	计算机工程	1996	1996年S1期	【作者】 姜放 ； 【Author】       Jiang Fang (North China Institute of Computing Technology P.O.Box 619, Ext.69, Beijing 100083) 【机构】 华北计算技术研究所!北京100083 ；	标准 ； 目录服务 ； X500 ； CCITT ； OSI ； standards/directory services/X.500/CCITT/OSI ；	介绍了ISO/CCITT目录服务标准1988版和1993版的概况.目录是一个专用的分布式信息数据库.在分布式计算环境中,目录服务标准为管理不经常变化的信息提供了分布式服务.可以从OSI目录服务中获得命名客体的信息.文中描述了目录服务的功能模型,目录信息库的逻辑结构,以及目录的分布、管理、使用、安全及开发等各个方面.	1996年S1期_OSI目录服务技术.pdf	http://sso.cdclib.org/interlibSSO/goto/6/=06190596Z93/kcms/detail/detail.aspx?dbCode=cjfq&filename=JSJC1996S1048&dbname=CJFD9498
计算机信息系统的验证与确认	计算机工程	1996	1996年S1期	【作者】 刘润杰 ； 薛锦云 ； 童兆丰 ； 吴世兴 ； 【Author】       Liu Runjie Xue Jinyun Tong Zhaofeng(Computer Software Institute, Jiangxi Normal University Nanchang 330027)Wu Shixing(Computer Technique Institute of Jiangxi Province Nanchang 330002) 【机构】 江西师范大学计算机软件研究所!南昌330027 ； 江西省计算技术研究所!南昌330002 ；	系统的验证与确认 ； 计算机信息系统 ； 软件规范 ； 系统测试 ； system verification and validation/computer information system/software specification/system test ；	计算机信息系统的验证与确认是提高系统正确性和可靠性的有效技术,然而人们对验证与确认的含义尚无统一、明确的认识.文中给出了验证与确认的明确定义,阐述了它们之间的区别与联系,并分别介绍了各种流行的验证与确认技术.验证与确认(简称V ＆ V)是计算机信息系统中一个重要概念,它们是贯穿信息系统生产每一步的一个持续的过程.验证与确认是测试程序是否符合其需求以及需求是否满足用户的需要这一过程的总称.它们的目的是通过动态和静态的系统分析测试技术提高计算机信息系统的正确性和可靠性.静态技术包括程序的静态检查、分析以及形式化证明.动态技术就是运行一个实现的系统来进行测试和分析.在许多献中验证与确认的含义模糊不清.我们认为:验证指的是证明软件(程序)符合其规范;确认指的是证实软件(程序)符合其用户的要求.区分验证与确认的关键在于验证是确保程序与其规范一致的行为,而确认则是确保程序与用户要求一致.在验证和确认的技术中,验证的技术大多数是理论的推导,确认的技术大多数是测试.验证的目的是确保程序与其规范一致.软件生产过程中,从软件规范到程序实现之间的每一步都要有验证.我们提出的分划递推法可以提高计算机信息系统的正确性和可靠性,用该方法设计和证明算法程序的步骤如下:a 将	1996年S1期_计算机信息系统的验证与确认.pdf	http://sso.cdclib.org/interlibSSO/goto/6/=06190596Z93/kcms/detail/detail.aspx?dbCode=cjfq&filename=JSJC1996S1049&dbname=CJFD9498
客户机—服务器计算环境及其在单元测试中的应用	计算机工程	1996	1996年S1期	【作者】 范明 ； 钱松荣 ； 杨明 ； 张根度 ； 【Author】       Fan Ming Qian Songrong Yang Ming Zhang Gendu (Conformance Testing Lab, Fudan University Shanghai 200433) 【机构】 复旦大学计算机系!上海200433 ；	客户机—服务器系统 ； 网络互连接口 ； 单元测试 ； 开放计算环境 ； client - server system/connectivity interface/unit testing/open computing environment ；	该文分析了客户机-服务器系统的结构体系,并着重介绍几种高级网络互连接口,同时将分布式单元测试系统(简称DUTS系统)作为实例进行了详细的剖析.DUTS系统是一个可测试多种不同被测软件的通用测试平台,它所采用的体系结构充分体现了客户机-服务器系统的巨大优越性.	1996年S1期_客户机—服务器计算环境及其在单元测试中的应用.pdf	http://sso.cdclib.org/interlibSSO/goto/6/=06190596Z93/kcms/detail/detail.aspx?dbCode=cjfq&filename=JSJC1996S1050&dbname=CJFD9498
交通银行上海分行计算机应用及网络	计算机工程	1996	1996年S1期	【作者】 谢卫国 ； 【Author】       Xie Weiguo(Bank of Communications Shanghai Branch Shanghai 200002) 【机构】 交通银行上海分行!上海200002 ；	交行 ； 计算机应用 ； 网络 ； BOCM/computer application/network ；	该文简要介绍了交行上海分行计算机应用和网络的发展过程及其现状,对已取得的成绩和存在的问题进行了探讨.并提出了今后的设想.	1996年S1期_交通银行上海分行计算机应用及网络.pdf	http://sso.cdclib.org/interlibSSO/goto/6/=06190596Z93/kcms/detail/detail.aspx?dbCode=cjfq&filename=JSJC1996S1051&dbname=CJFD9498
上海市城市金融网建设	计算机工程	1996	1996年S1期	【作者】 周斌耀 ； 施建东 ； 【Author】       Zhou Binyao Shi Jiandong(The People’s Bank of China Shanghai Branch Technology & Science Division Shanghai 200120) 【机构】 中国人民银行上海市分行科技处!上海200120 ；	金融 ； 城市网 ； 建设 ； financial/city network/construction ；	中国国家金融网建设是中国银行总行确定的“九·五”期间重点建设工程.城市金融网是整个国家金融网建设的基础.文中结合上海市目前的网络建设情况,提出了符合上海实际情况的城市金融网的组建方案.	1996年S1期_上海市城市金融网建设.pdf	http://sso.cdclib.org/interlibSSO/goto/6/=06190596Z93/kcms/detail/detail.aspx?dbCode=cjfq&filename=JSJC1996S1052&dbname=CJFD9498
图书馆智能化管理与决策支持系LIMDS	计算机工程	1996	1996年S1期	【作者】 胡运发 ； 葛家翔 ； 于玉 ； 蒋瓅 ； 朱立 ； 刘耀东 ； 钱放 ； 【机构】 复旦大学计算机科学系!上海200433 ； 空军政治学院信息管理系!上海200433 ；	图书馆管理 ； 自动标引 ； 智能检索 ； 专家系统 ；	主要介绍用人工智能专家系统技术开发的LIMDS系统的构成、功能和主要特点,及其自动标引原理、分类技术、智能检索的原理和各种方法等.	1996年S1期_图书馆智能化管理与决策支持系LIMDS.pdf	http://sso.cdclib.org/interlibSSO/goto/6/=06190596Z93/kcms/detail/detail.aspx?dbCode=cjfq&filename=JSJC1996S1053&dbname=CJFD9498
管理信息系统与自动化立体仓库集成技术	计算机工程	1996	1996年S1期	【作者】 李莞菁 ； 【Author】       Lee Jane(Beijing RIAMB Information Technology Co.,Ltd. Beijing 100011) 【机构】 机械部北京机械工业自动化研究所!北京100011 ；	计算机集成制造技术 ； 计算机辅助生产管理信息系统 ； 自动化立体仓库管理系统 ； 在线 ； 实时 ； computer integrated manufaturing/computer aided porduction management system/automaticstorage and retrieval system/on - line/real - time ；	制造业技术发展方向是实现计算机集成制造技术(CIM).计算机辅助生产管理信息系统(MIS)是计算机集成制造系统(CIMS)实现信息管理的核心,主要管理在线信息;自动化立体仓库系统(AS/RS)是采用先进的控制技术实现物流的实时控制,利用MIS与AS/RS的集成技术将企业的信息流和物流集成起来,在企业中实现高效实时的闭环系统将给企业带来巨大的经济效益.	1996年S1期_管理信息系统与自动化立体仓库集成技术.pdf	http://sso.cdclib.org/interlibSSO/goto/6/=06190596Z93/kcms/detail/detail.aspx?dbCode=cjfq&filename=JSJC1996S1054&dbname=CJFD9498
基于Internet的交互式远程教学系统	计算机工程	1996	1996年S1期	【作者】 丁锂 ； 王克宏 ； 【Author】       Ding Li Wang Kehong(Computer Science Department of Tsinghua University Beijing 100084) 【机构】 清华大学计算机系!北京100084 ；	互联网络 ； 交互式远程教学 ； 超文本置标语言 ； 共用网关接口 ； Java ； Internet/interactive remote instruction/HTML(hypertext markup language)/CGI(common gatewayInterface)/Java ；	介绍了远程教学系统的基本概念,将Internet与远程教学结合起来的可能性与必要性及其发展前景,交互式远程教学系统应提供的功能及其初步的系统设计.最后给出了作者所编写的小型实验性交互远程教学系统的实现方法和访问途径.	1996年S1期_基于Internet的交互式远程教学系统.pdf	http://sso.cdclib.org/interlibSSO/goto/6/=06190596Z93/kcms/detail/detail.aspx?dbCode=cjfq&filename=JSJC1996S1055&dbname=CJFD9498
基于局域网的多媒体教学系统的设计与实现	计算机工程	1996	1996年S1期	【作者】 张行功 ； 吴中海 ； 叶澄清 ； 【Author】       Zhang Xiangong Wu Zhonghai Ye Chengqing (Computer Architecture Institute of Zhejiang University Hangzhou 310027) 【机构】 浙江大学计算机系统工程研究所!杭州310027 ；	计算机辅助教学 ； 局域网 ； 多媒体 ； 流量控制 ； CAI/LAN/multimedia/flow control ；	介绍了局域网的多媒体教学系统的设计方法,着重讨论了基于Novell网络环境下的多媒体通讯和远程网络监控的实现技术.还提出了一种新的自适应网络流量控制方法,并将其嵌入到多媒体网络教学系统MENIS的接口协议中.MENIS是作者自行设计的商品化软件,目前已应用于各类教学和培训.	1996年S1期_基于局域网的多媒体教学系统的设计与实现.pdf	http://sso.cdclib.org/interlibSSO/goto/6/=06190596Z93/kcms/detail/detail.aspx?dbCode=cjfq&filename=JSJC1996S1056&dbname=CJFD9498
IPX与TCP/IP协议在校园网中的集成	计算机工程	1996	1996年S1期	【作者】 杨波 ； 曲守宁 ； 孙奕奇 ； 【Author】       Yang Bo Qu Shouning Sun Yiji(Shandong Inst. of Building Materials Industry Jinan 250022) 【机构】 山东建材学院网络中心!济南250022 ；	计算机网络 ； 系统集成 ； IPX ； TCP/IP ； computer network/system integration/IPX/TCP/IP ；	用于Internet的TCP/IP协议和基于Novell局域网的IPX协议是当前主要的两种网络协议,文中分析了TCP/IP和IPX两个网络协议在校园网中的应用情况及其共存的必要性,并对两种协议在校园网中的集成方法进行了讨论,介绍了基于Netware服务器和网关软件的多协议集成方案.	1996年S1期_IPX与TCP+IP协议在校园网中的集成.pdf	http://sso.cdclib.org/interlibSSO/goto/6/=06190596Z93/kcms/detail/detail.aspx?dbCode=cjfq&filename=JSJC1996S1057&dbname=CJFD9498
一个应用中的多媒体教学网络系统	计算机工程	1996	1996年S1期	【作者】 黄维金 ； 【Author】       Huang Weijin(The People’s Public Security University Beijing 100038) 【机构】 中国人民公安大学!北京100038 ；	多媒体 ； 网络 ； 教学系统 ； multimedia/network/teaching system ；	一种集多种媒体于一身,能对文字、图像、声音等媒体信息进行同步播送、监看和控制的多媒体教学网络系统正在走进教室,并已成为现代计算机教学发展的新趋势.	1996年S1期_一个应用中的多媒体教学网络系统.pdf	http://sso.cdclib.org/interlibSSO/goto/6/=06190596Z93/kcms/detail/detail.aspx?dbCode=cjfq&filename=JSJC1996S1058&dbname=CJFD9498
企业网络的建设及其应用	计算机工程	1996	1996年S1期	【作者】 曾智灵 ； 【Author】       Zeng Zhiling(Shanghai Erfangji Co.,Ltd. Shanghai200434) 【机构】 上海二纺机股份有限公司!上海200434 ；	企业网络 ； 信息集成 ； 计算机集成制造系统 ； enterprise etwork/information integrated/CIMS ；	企业计算机网络系统是支持企业生产经营一体化和信息集成的重要支撑环境.文中以上海二纺机CIMS网络为实例,阐述企业网络的设计与建设;介绍了在企业网络之上,开发全局数据管理系统,实现企业生产经营活动应用集成的方法.	1996年S1期_企业网络的建设及其应用.pdf	http://sso.cdclib.org/interlibSSO/goto/6/=06190596Z93/kcms/detail/detail.aspx?dbCode=cjfq&filename=JSJC1996S1059&dbname=CJFD9498
基于可视化编程技术的财务管理系统的设计与实现	计算机工程	1996	1996年S1期	【作者】 郭君平 ； 张忠国 ； 陈子辰 ； 【Author】       Guo Junping Zhang ZhongguoChen Zichen(Ningbo Securities Company Ningbo 315000)(Zhejiang University Hangzhou 310027) 【机构】 宁波证券公司!宁波315000 ； 浙江大学!杭州310027 ；	可视化编程技术 ； 财务管理系统 ； 数据库 ； visual programming technology/Financial Management System/database ；	会计电算化工作在我国己经取得了很大的发展,可以说它是目前计算机应用最成功的领域之一,尤其是1993年和1994年间发展更为迅速.尽管我国目前会计电算化工作发展趋势很好,但存在的问题是由于开发时间早,大多采用DOS开发平台和FOX系列数据库,存在人机界面不理想、数据库安全性差等弱点.作者在比较当前几种流行的编程技术的基础上,考虑到财务系统的应用环境和使用对象等因素,选择可视化编程技术,其主要思想是用图形工具和可重用部件来交互编制程序.Visual Basic是第一个实用可视化编程工具,采用完全交互和反复开发过程.Visual Basic提供了图形环境,另外还有Microsoft Access Engine1.1功能强大的数据库管理工具,使Visual Basic能方便地创建数据库应用程序.该财务系统的功能主要包括(1)要完成平日常规的会计处理业务;(2)要完成平日和期未的帐务数据的查询和打印业务;(3)财务分析;(4)财务保密系统.在设计过程中启动系统后,每次把一个图形对象加到窗体时,VB解释程序就创建一组新的过程框架.在这些过程框架中,可以富有创造性地加入定义和控制对象操作的指令,尤其是图形界面设计只不过是举手之劳,设计时所见即所得,从而方便地设计出生动的人机界面,有效地实现财务管理系统的各项功能.而且Visual Basic支持多用户	1996年S1期_基于可视化编程技术的财务管理系统的设计与实现.pdf	http://sso.cdclib.org/interlibSSO/goto/6/=06190596Z93/kcms/detail/detail.aspx?dbCode=cjfq&filename=JSJC1996S1060&dbname=CJFD9498
计算机多媒体技术在医学院校管理中的发展与应用	计算机工程	1996	1996年S1期	【作者】 孙永斌 ； 【Author】       Sun Yongbin (Dept.of BME.Shandong Medical University Jinan 250012) 【机构】 山东医科大学医学工程系!济南250012 ；	计算机 ； 多媒体技术 ； 图文数据库 ； 多媒体管理系统 ； computer/multimedia/muti database/indexing ；	医学院校自1987年卫生部部属院校引进美国DEC公司VAX系列小型机开始,已有近20年的时间,期间在计算机专业人员、管理人员的共同努力下,在学校人事、科研、档案、财务等部门计算机管理已经实现,并取得较好的效果,但总体上与国外医学院校的应用水平有较大差距.特别近年来多媒体技术的普及与应用;使原有简单文字管理及信息传递显得满足不了管理上的需要.而具有声、像、图文为一体的多媒体教学、管理系统将逐步得到应用.如学校学籍管理、职工档案管理中将个人图像、声音录入多媒体管理系统,结合原有文字库中的信息,为院校现代化管理、卫生部属院校信息网络的互连等具有重要意义.光电技术的飞速发展使多媒体技术所需设备如4倍速光驱、大容量硬盘、音、视频卡等在性能价格比方面具备了普及的条件,而先进的多媒体开发平台又为管理人员提供了良好的开发、生成管理系统的工具.各部门管理人员由于本身计算机知识掌握水平的差异,使得他们独立开发综合性管理系统有相当大难度,这就要求计算机专业人员必须深人到应用部门实地开发与设计适合于应用的多媒体管理系统.使管理部门中管理人员通过菜单或图像提示进行操作,提高他们使用计算机管理日常工作的能力,也使各部门间利用计算机进行信息检索与传递提供了现代化手段.多	1996年S1期_计算机多媒体技术在医学院校管理中的发展与应用.pdf	http://sso.cdclib.org/interlibSSO/goto/6/=06190596Z93/kcms/detail/detail.aspx?dbCode=cjfq&filename=JSJC1996S1061&dbname=CJFD9498
Fortran90语言中辅程序交叉返回的编译技术	计算机工程	1996	1996年06期	【作者】 徐赤斌 ； 程虎 ； 【机构】 中国科学院软件研究所 ；	Fortran90 ； 编译技术 ； 辅程序 ； 交叉返回 ；	Ｆｏｒｔｒａｎ９０是Ｆｏｒｔｒａｎ语言的最新国际标准。出于对语言兼容性方面的考虑，Ｆｏｒｔｒａｎ９０语言中的辅程序可以有多个出口。该编译系统的目标语言是程序设计语言Ｃ。根据Ｃ语言的语义，在一个函数中只能有一个出口。源语言与目标语言之间存在的语义差距，给编译程序的实现增加了难度。文中着重介绍了Ｆｏｒｔｒａｎ９０语言中辅程序交叉返回的特征及其编译实现的技术。	1996年06期_Fortran90语言中辅程序交叉返回的编译技术.pdf	http://sso.cdclib.org/interlibSSO/goto/6/=06190596Z93/kcms/detail/detail.aspx?dbCode=cjfq&filename=JSJC606.000&dbname=CJFD9498
一种集成异构分布式数据库的有效途径：超文本方法	计算机工程	1996	1996年06期	【作者】 李霖 ； 周兴铭 ； 【机构】 国防科技大学计算机系 ；	分布式数据库 ； 异构 ； 超文本 ； 集成 ； 分布式超文本 ；	异构分布式数据库是近年来发展起来的一个研究领域，如何解决它的异构性和自治性仍然是尚未完全解决的难题．提出一种采用超文本概念集成异构分布式数据库的方法，建立了分布式超文本（ＤＨＴ）的体系结构，并对其优越性和应用范围作了讨论。	1996年06期_一种集成异构分布式数据库的有效途径：超文本方法.pdf	http://sso.cdclib.org/interlibSSO/goto/6/=06190596Z93/kcms/detail/detail.aspx?dbCode=cjfq&filename=JSJC606.001&dbname=CJFD9498
客户／服务器体系构数据库应用系统的前期开发技术	计算机工程	1996	1996年06期	【作者】 王璞 ； 王雷 ； 刘斌 ； 【机构】 中国航空计算技术研究所 ；	客户／服务器 ； 实体一联系图 ； 数据库管理系统 ； 正反向工程 ；	首先给出了客户／服务器体系结构的基本概念，并在此基础上提出了客户／服务器体系结构的数据库应用系统的前期开发模式。最后，结合作者的实际经验给出了一个前期设计的具体实例。	1996年06期_客户／服务器体系构数据库应用系统的前期开发技术.pdf	http://sso.cdclib.org/interlibSSO/goto/6/=06190596Z93/kcms/detail/detail.aspx?dbCode=cjfq&filename=JSJC606.002&dbname=CJFD9498
装配信息模型及原型系统的设计	计算机工程	1996	1996年06期	【作者】 向艳萍 ； 张申生 ； 步丰林 ； 【机构】 上海交通大学计算机系 ；	计算机辅助设计 ； 并行工程 ； 产品装配模型 ；	在对装配模型的数据结构进行描述的基础上，详细描述该模型所支持系统的功能，最后以具体实例对装配模型及其原型系统进行形象化解释。	1996年06期_装配信息模型及原型系统的设计.pdf	http://sso.cdclib.org/interlibSSO/goto/6/=06190596Z93/kcms/detail/detail.aspx?dbCode=cjfq&filename=JSJC606.003&dbname=CJFD9498
图形数据库与关系数据库链结方法研究	计算机工程	1996	1996年06期	【作者】 田伟涛 ； 任爱珠 ； 方鄂华 ； 【机构】 清华大学土木工程系 ；	计算机辅助设计 ； 数据库 ； 图文链结 ；	文中对ＣＡＤ图形数据库与关系数据库的链结方法进行了研究，总结分析了现有方法，提出了一种分散的链结数据库方法。	1996年06期_图形数据库与关系数据库链结方法研究.pdf	http://sso.cdclib.org/interlibSSO/goto/6/=06190596Z93/kcms/detail/detail.aspx?dbCode=cjfq&filename=JSJC606.004&dbname=CJFD9498
CIMS环境下自动化车间立体仓库物流计算机控制系统	计算机工程	1996	1996年06期	【作者】 葛元 ； 王林泉 ； 【机构】 上海海运学院计算机系 ；	计算机集成制造系统 ； 立体仓库 ； 物流 ； 线程 ；	论述了ＣＩＭＳ环境下自动化车间的物流控制和立体仓库计算机控制系统的结构和功能，介绍了在实现系统过程中的异构网络的通信、多线程管理等关键技术。	1996年06期_CIMS环境下自动化车间立体仓库物流计算机控制系统.pdf	http://sso.cdclib.org/interlibSSO/goto/6/=06190596Z93/kcms/detail/detail.aspx?dbCode=cjfq&filename=JSJC606.005&dbname=CJFD9498
电脑商情计算机信息系统	计算机工程	1996	1996年06期	【作者】 陈启军 ； 王月娟 ； 【机构】 同济大学电气工程系 ；	信息中心 ； 用户 ； 文件传输 ；	该文介绍的信息系统为电脑行业提供信息服务。系统由信息中心和用户两部分组成，信息中心是ＮＯＶＥＬＬＮＥＴＷＡＲＥ构成的局域网，用户通过普通电话线以文件传输的方式与信息中心进行信息交换。信息的检索在用户本地进行。	1996年06期_电脑商情计算机信息系统.pdf	http://sso.cdclib.org/interlibSSO/goto/6/=06190596Z93/kcms/detail/detail.aspx?dbCode=cjfq&filename=JSJC606.006&dbname=CJFD9498
分布式容错系统ECI—DFTS的设计与实现	计算机工程	1996	1996年06期	【作者】 朱育清 ； 吴荣泉 ； 汤慧媛 ； 王加红 ； 【机构】 华东计算技术研究所 ；	分布式系统 ； 容错 ； 断点保留 ； 一致性恢复 ； 诊断 ；	详细介绍了由普通微机和双局域网构成的分布式容错系统ＥＣＩ－ＤＦＴＳ的设计与实现技术	1996年06期_分布式容错系统ECI—DFTS的设计与实现.pdf	http://sso.cdclib.org/interlibSSO/goto/6/=06190596Z93/kcms/detail/detail.aspx?dbCode=cjfq&filename=JSJC606.007&dbname=CJFD9498
总线主设备及其设计	计算机工程	1996	1996年06期	【作者】 张春元 ； 胡守仁 ； 张晨曦 ； 戴葵 ； 【机构】 国防科学技术大学计算机学院 ；	总线 ； 总线主设备 ； 82355接口芯片 ； EISA总线主设备设计 ；	讨论一种重要的总线设备工作方式─总线主设备。在介绍和分析２Ｃ微机总线的进化过程后，讨论了ＥＩＳＡ总线主设备的特点及其主要信号，然后分析了Ｉｎｔｅｌ８２３５５ＢＭＩＣ总线主设备接口芯片，并且介绍了用８２３５５芯片完成的一个总线主设备的设计，最后对总线主设备进行了小结。	1996年06期_总线主设备及其设计.pdf	http://sso.cdclib.org/interlibSSO/goto/6/=06190596Z93/kcms/detail/detail.aspx?dbCode=cjfq&filename=JSJC606.008&dbname=CJFD9498
通用网络协议自动监视分析系统的实现	计算机工程	1996	1996年06期	【作者】 虞红英 ； 江南 ； 张根度 ； 刘秀虹 ； 【机构】 复旦大学计算机系网络与信息工程中心 ；	网络协议 ； 监视机制 ； 自动监视与分析 ； 形式描述语言 ；	初步论述了计算机通信网络协议自动监视与分析的概念、方法和意义，着重叙述了一种专门设计的、能精确描述各类通信协议ＰＤＵ结构及其时序的ＬＸＨ形式描述语言的功能特点，并描述了一种基于ＬＸＨ语言的通用协议自动监视分析系统的实现，对该能用协议监视分析系统的系统结构作了详细的介绍。	1996年06期_通用网络协议自动监视分析系统的实现.pdf	http://sso.cdclib.org/interlibSSO/goto/6/=06190596Z93/kcms/detail/detail.aspx?dbCode=cjfq&filename=JSJC606.009&dbname=CJFD9498
