title	journal_name	year	issue	author	keywords	summary	pdf_filename	article_url
一种改进的基于模板匹配的集装箱字符识别方法	计算机工程	2000	2000年12期	【作者】 阚伟 ； 朱秋煜 ； 【Author】       KAN Wei，ZHU Qiuyu (School of Communication and Information Engineering，Shanghai University，Shanghai 201800) 【机构】 上海大学通信与信息工程学院!上海 201800 ；	字符识别 ； 模板匹配 ； 二值化 ； Character identification ； Template matching ； Binarization ；	字符识别是计算机模式识别中较为常见的问题。对于印刷体的字符来说，经常采用二值化和模板匹配方法进行识别。在实际应用中，为了提高识别率，减少计算量和运行时间，解决正确识别二值化后的正反不同图象的问题，提出一种改进的自适应的模板匹配方法，理论与实验结果表明具有较高的识别率和坚韧性。	2000年12期_一种改进的基于模板匹配的集装箱字符识别方法.pdf	http://sso.cdclib.org/interlibSSO/goto/6/=06190596Z93/kcms/detail/detail.aspx?dbCode=cjfq&filename=JSJC200012045&dbname=CJFD9902
基于X76F100的软件系统加密	计算机工程	2000	2000年12期	【作者】 李清宝 ； 白燕 ； 李国平 ； 【Author】       LI Qingbao，BAI Yian，LI Guoping  （PLA Information Engineering University，Zhengzhou 450002) 【机构】 解放军信息工程大学!郑州 450002 ；	加密 ； 读密码 ； 写密码 ； 密钥 ； 软件狗 ； Encryption ； Read encryption ； Write encryption ； Secret key ； Software dog ；	软件狗是软件系统加密最常用的方法之一，该文在介绍美国Xicor公司生产的具有密码访问的X76F100芯片内、外部结构特点的基础上，重点论述了利用该芯片设计加密软件狗的优点和具体实现方法。	2000年12期_基于X76F100的软件系统加密.pdf	http://sso.cdclib.org/interlibSSO/goto/6/=06190596Z93/kcms/detail/detail.aspx?dbCode=cjfq&filename=JSJC200012046&dbname=CJFD9902
基于DCT变换的图象中的数据隐藏技术及理论	计算机工程	2000	2000年12期	【作者】 张璟 ； 刘云超 ； 陈一民 ； 王炜杰 ； 【Author】       ZHANG Jing, LIU Yunchao, CHEN Yimin, WANG Weijie （School of Computer Engineering and Science, Shanghai University，Shanghai 200072） 【机构】 上海大学计算机工程与科学学院!上海200072 ；	数据隐藏 ； 离散余弦变换 ； LSB ； 掩码 ； 强壮性 ； 调制 ； Data-hiding ； DCT ； LSB ； Mask ； Robust ； Modulate€ ；	该文主要介绍了如何利用离散余弦变换（DCT）实现对于图象文件的数据隐藏技术，详细说明了该技术的基本原理和实现方法，以及对现有算法的改进。并具体描述了如何通过计算机程序实现该算法，使数据隐藏技术能付于实际应用。	2000年12期_基于DCT变换的图象中的数据隐藏技术及理论.pdf	http://sso.cdclib.org/interlibSSO/goto/6/=06190596Z93/kcms/detail/detail.aspx?dbCode=cjfq&filename=JSJC200012047&dbname=CJFD9902
企业网络安全性机制的建立	计算机工程	2000	2000年12期	【作者】 刘其奇 ； 赵翠霞 ； 【Author】       LIU Qiqi , ZHAO Cuixia (Dept. of Computer Science, Southeast Univ.,Nanjing 210096) 【机构】 东南大学计算机系!南京 210096 ；	Domino ； Intranet ； 网络安全 ； 安全性机制 ； Domino ； Intranet ； Network security ； Security mechanism ；	企业网络Intranet应用软件平台的选择，必须考虑先进、安全、经济等各方面的因素。基于Lotus Notes的Domino Web服务器是一个很好的选择。该文从Domino极具个性化的安全性机制入手，探讨了企业应用Domino平台建立网络安全性机制的问题。	2000年12期_企业网络安全性机制的建立.pdf	http://sso.cdclib.org/interlibSSO/goto/6/=06190596Z93/kcms/detail/detail.aspx?dbCode=cjfq&filename=JSJC200012048&dbname=CJFD9902
基于自治Agent的入侵检测系统模型	计算机工程	2000	2000年12期	【作者】 陈波 ； 于泠 ； 【Author】       CHEN Bo，YU Ling （Dept. of Computer Science,Nanjing Normal University，Nanjing 210097） 【机构】 南京师范大学计算机科学系!南京  210097 ；	安全 ； 入侵检测 ； Agent ； Security ； Intrusion detection ； Agent ；	利用自治Agent的良好特性，提出了一个基于自治多Agent入侵检测系统模型。讨论了结构中各组件的功能以及多Agent系统中关键的通信机制问题，并分析了一个实例。	2000年12期_基于自治Agent的入侵检测系统模型.pdf	http://sso.cdclib.org/interlibSSO/goto/6/=06190596Z93/kcms/detail/detail.aspx?dbCode=cjfq&filename=JSJC200012049&dbname=CJFD9902
k元n方体互联网络性能分析与研究	计算机工程	2000	2000年12期	【作者】 王与力 ； 杨晓东 ； 【Author】       WANG Yuli，YANG Xiaodong (Department of Computer,National University of Defense Technology,Changsha 410073) 【机构】 国防科技大学计算机学院!长沙 410073 ；	k元n方体 ； 性能 ； 路由器 ； 通道 ； 拓朴 ； k-ary n-cube ； Performance ； Router ； Channel ； Topology ；	从网络的拓朴、路由器、通道3方面分析了k元n方体互联网络的体系结构特征,建立了网络性能模型,并讨论了网络体系结构,应用程序和运行环境对网络性能的影响,以及网络性能的改进措施。	2000年12期_k元n方体互联网络性能分析与研究.pdf	http://sso.cdclib.org/interlibSSO/goto/6/=06190596Z93/kcms/detail/detail.aspx?dbCode=cjfq&filename=JSJC200012050&dbname=CJFD9902
关于移动代理的通信模型的研究	计算机工程	2000	2000年12期	【作者】 唐进 ； 万燕 ； 孙永强 ； 【Author】       TANG Jin，WANG Yan，SUN Yongqiang  (Department of Computer Science and Engineering, Shanghai Jiaotong University，Shanghai 200030) 【机构】 上海交通大学计算机科学与工程系!上海 200030 ；	移动代理 ； 定位 ； 通信模型 ； 协作模型 ； Mobile agent ； Locating ； Communication model ； Coordination model ；	讨论了移动代理中通信技术的基本概念及相关问题。在此基础上引入了一个移动代理系统的基本原型，并对该原型进行了改进。在改进过的移动代理系统上，设计了相应通信模型，提出了相应算法。	2000年12期_关于移动代理的通信模型的研究.pdf	http://sso.cdclib.org/interlibSSO/goto/6/=06190596Z93/kcms/detail/detail.aspx?dbCode=cjfq&filename=JSJC200012051&dbname=CJFD9902
Linux下基于Web的目录服务系统的设计与实现	计算机工程	2000	2000年12期	【作者】 王燕 ； 谢金宝 ； 【Author】       WANG Yan，XIE Jinbao (Dept. of Computer Science and Engineering, Shanghai Jiaotong Univ., Shanghai 200030) 【机构】 上海交通大学计算机科学与工程系!上海 200030 ；	目录服务 ； Web访问 ； LDAP ； PHP ； Directory service ； Web access ； LDAP ； PH? ；	目录服务是下一代网络管理的核心技术之一。文章首先介绍了目录服务的概念及特性，提出了在Linux操作系统下一种新型的基于Web访问的目录服务系统方案，并结合实际工作介绍了利用OpenLDAP，Apache和PHP等自由软件建立一个基于Web的目录服务系统的实现过程。	2000年12期_Linux下基于Web的目录服务系统的设计与实现.pdf	http://sso.cdclib.org/interlibSSO/goto/6/=06190596Z93/kcms/detail/detail.aspx?dbCode=cjfq&filename=JSJC200012052&dbname=CJFD9902
基于CORBA的Web系统构建	计算机工程	2000	2000年12期	【作者】 邢昭 ； 余新颖 ； 袁长河 ； 【Author】       XING Zhao1，YU Xingying1，YUAN Changhe2 (1.Dept. of Computer Science and Engineering Shanghai Jiaotong Univ., Shanghai 200030；2. Tongji University, Shanghai 200092) 【机构】 上海交通大学计算机科学与工程系!上海200030 ； 同济大学!上海200092 ；	分布对象技术 ； 互操作性 ； Web ； CORBA ； IDL ； HTTP ； IIOP ； Distributed object ； Interoperability ； Web ； CORBA ； IDL ； HTTP ； IIOP? ；	讨论了Web 和分布对象技术CORBA的互操作性问题，将CORBA技术引入Web, 构建出一个基于CORBA的Web模型。	2000年12期_基于CORBA的Web系统构建.pdf	http://sso.cdclib.org/interlibSSO/goto/6/=06190596Z93/kcms/detail/detail.aspx?dbCode=cjfq&filename=JSJC200012053&dbname=CJFD9902
C2构架风格在通信软件中的应用	计算机工程	2000	2000年12期	【作者】 潘明耀 ； 夏宽理 ； 汪洋 ； 林娟 ； 【Author】       PAN Mingyao, XIA Kuanli, WANG Yang, LIN Juan (Computer Department,Fudan University，Shanghai 200433; Shanghai Bell Company，Shanghai 201206) 【机构】 复旦大学计算机系!200433 ； 上海贝尔公司,201206,复旦大学计算机系!200433 ； 上海贝尔公司,201206 ；	构架 ； 构件 ； 连接器 ； 包装器 ； 模块 ； Architecture ； Component ； Connector ； Wrapper ； Module ；	该文以C2构架风格在电话交换机呼叫控制模块中的应用为例，提出了用该风格实现通信软件动态演化的一种方法。	2000年12期_C2构架风格在通信软件中的应用.pdf	http://sso.cdclib.org/interlibSSO/goto/6/=06190596Z93/kcms/detail/detail.aspx?dbCode=cjfq&filename=JSJC200012054&dbname=CJFD9902
扫描线种子填充算法的改进	计算机工程	2000	2000年12期	【作者】 孙燮华 ； 【Author】       SUN Xiehua （Department of Computer Science and Technology，China Institute of Metrology,Hangzhou 310034） 【机构】 中国计量学院计算机科学与技术系!杭州310034 ；	计算机图形学 ； 种子填充算法 ； 扫描线 ； Computer graphics ； Seed fill algorithm ； Scan  line ；	提出了一种扫描线种子填充算法的改进算法, 其填充速度得到很大提高。	2000年12期_扫描线种子填充算法的改进.pdf	http://sso.cdclib.org/interlibSSO/goto/6/=06190596Z93/kcms/detail/detail.aspx?dbCode=cjfq&filename=JSJC200012055&dbname=CJFD9902
基于Web的虚拟现实辅助看图系统的设计方法	计算机工程	2000	2000年12期	【作者】 冯开平 ； 左宗义 ； 刘玉 ； 【Author】       FENG Kaiping，ZUO Zongyi，LIU Yu      (1.Guangdong University of Technology, Guangzhou 510090；2.Zhongshan University, Guangzhou 510275) 【机构】 广东工业大学!广州510090 ； 中山大学!广州510275 ；	Web ； VRML ； HTML ； 远程教育 ； Web ； VRML ； HTML ； Remote education ；	介绍了基于Web的虚拟现实辅助看图系统的结构模型,并讨论了实现该系统的有关Web与VRML的关键技术。该系统的研制成功为开发与动画和图象有关的远程教育软件提供了范例。	2000年12期_基于Web的虚拟现实辅助看图系统的设计方法.pdf	http://sso.cdclib.org/interlibSSO/goto/6/=06190596Z93/kcms/detail/detail.aspx?dbCode=cjfq&filename=JSJC200012056&dbname=CJFD9902
PowerBuilder与Excel结合在动态随机模拟决策系统中的实现	计算机工程	2000	2000年12期	【作者】 康世瀛 ； 【Author】       KANG Shiying (Dept. of Computer,Zhongqing Commercial Institute,Zhongqing 400067) 【机构】 重庆商学院计算机系!重庆 400067 ；	动态随机模拟 ； PowerBuilder ； Excel ； 决策支持 ； 决策分析 ； Dynamic stochnastic simulation ； PowerBuilder ； Excel ； Decision support ； Decision analyses ；	通过对复杂型一次性订货销售动态随机模拟决策支持系统的设计的介绍，较具体地阐明了PowerBuilder和Excel相结合在动态随机模拟决策系统中的应用的设计方法和技术。	2000年12期_PowerBuilder与Excel结合在动态随机模拟决策系统中的实现.pdf	http://sso.cdclib.org/interlibSSO/goto/6/=06190596Z93/kcms/detail/detail.aspx?dbCode=cjfq&filename=JSJC200012057&dbname=CJFD9902
数据库关键条件属性集确定方法及应用	计算机工程	2000	2000年12期	【作者】 谢印宝 ； 张佑生 ； 【Author】       XIE Yinbao1，ZHANG Yousheng2 ) (1.Zibo Institute，Zibo 255091；2.Department of Computer,Hefei University of Technology，Hefei 230009) 【机构】 淄博学院!淄博255091 ； 合肥工业大学计算机与信息系!合肥230009 ；	知识发现 ； 数据挖掘 ； 集合论 ； 模糊聚类算法 ； KDD (Knowledge Discovery in Databases) ； Data mining ； Sets theory ； Fuzzy clustering algorithm ；	在大数据库中确定关键条件属性集，是使用基于粗集理论的集合论生成分类规则算法的重要步骤。该文在简述分类规则形成算法的基础上，对确定关键条件属性集的模糊聚类算法进行了较详细的讨论，并给出该方法应用的一个实例。	2000年12期_数据库关键条件属性集确定方法及应用.pdf	http://sso.cdclib.org/interlibSSO/goto/6/=06190596Z93/kcms/detail/detail.aspx?dbCode=cjfq&filename=JSJC200012058&dbname=CJFD9902
Visual C++下强大的科学运算函数库--MATCOM之Matrix<LIB>	计算机工程	2000	2000年12期	【作者】 罗蛟龙 ； 张鹏 ； 张维竞 ； 【Author】       LUO Jiaolong, ZHANG Peng, ZHANG Weijing (School of Power and Energy, Shanghai Jiaotong University, Shanghai 200030) 【机构】 上海交通大学动力与能源学院!上海  200030 ；	MATCOM ； Matrix<LIB> ； VC ； 科学运算函数库 ； MATCOM ； Matrix<LIB> ； VC ； Scientific library ；	主要介绍了一个可在Visual C++环境下使用的科学运算库-MATCOM的Matrix<LIB>，并给出了一些具体使用该函数库的例子。	2000年12期_Visual+C++下强大的科学运算函数库--MATCOM之Matrix<LIB>.pdf	http://sso.cdclib.org/interlibSSO/goto/6/=06190596Z93/kcms/detail/detail.aspx?dbCode=cjfq&filename=JSJC200012059&dbname=CJFD9902
生产管理系统的开发方法--Petri网模型及实现	计算机工程	2000	2000年12期	【作者】 沈志宏 ； 翁琦 ； 张根度 ； 【机构】 复旦大学计算机科学系!上海 220433 ；	Petri网 ； 仿真 ； 库所 ； 变迁 ； 模型 ； COM ；	利用Petri网的成熟理论，对制造业的生产管理过程进行建模，在计算机中利用CPN（Colored Petri Net）模型对生产过程进行模拟分析，监控生产过程中的效率以及可能存在的瓶颈。同时，在实际的开发系统中，利用COM技术对Petri网模型进行实现。	2000年12期_生产管理系统的开发方法--Petri网模型及实现.pdf	http://sso.cdclib.org/interlibSSO/goto/6/=06190596Z93/kcms/detail/detail.aspx?dbCode=cjfq&filename=JSJC200012060&dbname=CJFD9902
基于Web Mining的智能化、个性化的远程教育模型研究	计算机工程	2000	2000年12期	【作者】 汪启军 ； 申瑞民 ； 【Author】       WNG Qijun，SHEN  Ruimin （Dept. of  Computer Science and Technology，Shanghai Jiaotong University, Shanghai 200030) 【机构】 上海交通大学计算机科学与工程系!上海 200030 ；	WWW ； Web挖掘 ； 远程教育 ； 课件树 ； WWW ； Web mining ； Distance-learning ； Course tree ；	该文提出了一个新的基于Web Mining的远程教育模型，它能够充分利用站点上积累下来的信息，更好地用于远程教学。	2000年12期_基于Web+Mining的智能化、个性化的远程教育模型研究.pdf	http://sso.cdclib.org/interlibSSO/goto/6/=06190596Z93/kcms/detail/detail.aspx?dbCode=cjfq&filename=JSJC200012061&dbname=CJFD9902
智能集成系统在抽油井故障诊断中的研究	计算机工程	2000	2000年12期	【作者】 梁鸿 ； 史永宏 ； 向逐聪 ； 孙明 ； 【Author】       LIANG Hong，SHI Yonghong，XIANG Zhuchong，SUN Ming (1. Computer Science Depatrtment,UPC，Dongying, 257062；2. Shengli Oil Management  Bureau，Dongying 257237) 【机构】 石油大学计算机系!东营 257062 ； 胜利石油管理局海洋开发公司! 257237 ； 胜利石油管理局海洋开发公司! 257237 ；	专家系统 ； 神经网络 ； 集成 ； 故障诊断 ； 抽油进 ； Expert system ； Neural network ； Integration ； Fault diagnosis ； Pumping oil well ；	通过对抽油井故障诊断智能集成系统的研究，提出并实现了一种抽油井故障诊断松耦合集成的模型。通过实验证明这种松耦合集成模型优于单一人工智能方法的实现。	2000年12期_智能集成系统在抽油井故障诊断中的研究.pdf	http://sso.cdclib.org/interlibSSO/goto/6/=06190596Z93/kcms/detail/detail.aspx?dbCode=cjfq&filename=JSJC200012062&dbname=CJFD9902
VB跨表查询的设计与实现	计算机工程	2000	2000年12期	【作者】 李德启 ； 陈涵生 ； 【Author】       LI Deqi, CHEN Hanshen （East-China Institute of Computer Technology，Shanghai 201800） 【机构】 华东计算技术研究所!上海201800 ；	跨表查询 ； VB6.0 ； MS SQLServer7.0 ； 信息管理系统 ； General query ； VB6.0 ； MS SQLServer7.0 ； MIS ；	在用VB开发信息管理系统中，对MS SQLServer7.0 的数据库进行跨表查询（又称为组合查询）是开发中的一个难点。该文就此提供一个通用的解决方案。	2000年12期_VB跨表查询的设计与实现.pdf	http://sso.cdclib.org/interlibSSO/goto/6/=06190596Z93/kcms/detail/detail.aspx?dbCode=cjfq&filename=JSJC200012063&dbname=CJFD9902
VC与MATLAB的接口及其实现	计算机工程	2000	2000年12期	【作者】 储开颜 ； 严利民 ； 王朔中 ； 【Author】       CHU Kaiyan, YAN Limin, WANG Shuozhong (School of Communication & Information Engineering, Shanghai University, Shanghai 200072) 【机构】 上海大学通信与信息工程学院!上海 200072 ；	MATLAB ； VC ； 动态连接库 ； 图象处理 ； MATLAB ； VC ； DLL ； Image processing ；	通过VC和MATLAB的动态接口，在应用软件研制过程中既能发挥VC用户界面开发功能强大和运行效率高等优点，又充分利用了MATLAB的复杂运算和处理能力。这一技术已成功地用于档案图象处理系统的研制，有利于软件功能的提高和开发周期的缩短。	2000年12期_VC与MATLAB的接口及其实现.pdf	http://sso.cdclib.org/interlibSSO/goto/6/=06190596Z93/kcms/detail/detail.aspx?dbCode=cjfq&filename=JSJC200012064&dbname=CJFD9902
基于WWW的文档上传机制	计算机工程	2000	2000年12期	【作者】 泮海敏 ； 汤碧杰 ； 【Author】       PAN Haimin1，TANG Bijie2 (1.Dept.of  Journalism,Zhejiang  University，Hangzhou 310028; 2.Shuren University of Zhejiang， Hangzhou 310018 ) 【机构】 浙江大学新闻系!杭州310028 ； 浙江树人大学!杭州310018 ；	WWW ； 线程 ； 文档 ； WWW ； Thread ； Documen` ；	随着电脑的普及，Internet网络的兴起，网上电子交易的普及，在网上办公已逐步走向成熟，各个公司都在开发基于WWW模式的应用。该文主要解决开发WWW应用时经常会遇到的问题：文档上传，提出了对用户提高响应时间、而不重写原有系统的办法，并引进多线程机制。	2000年12期_基于WWW的文档上传机制.pdf	http://sso.cdclib.org/interlibSSO/goto/6/=06190596Z93/kcms/detail/detail.aspx?dbCode=cjfq&filename=JSJC200012065&dbname=CJFD9902
MS SQL Server数据库锁技术研究	计算机工程	2000	2000年12期	【作者】 谢安明 ； 邵美珍 ； 李冬海 ； 【Author】       XIE Anming，SHAO Meizheng，LI Donghai (Dept. of Information Science, PLA Information Engineering University，Zhengzhou 450002) 【机构】 解放军信息工程大学信息科学系!郑州 450002 ；	数据库锁 ； 数据安全 ； 死锁 ； Database lock ； Data security ； Deadlock ；	数据库锁是保证网络数据库中的数据安全的重要手段。文章通过对Microsoft SQL Server的锁管理机制的分析，讨论了锁的多粒度性和锁的多模式性，以及由此引出的锁升级和锁的兼容性，还有减少死锁可能性的几种方法。之后给出了手工加锁的方法，以保证应用程序的正确运行及保持数据的一致性和正确性。	2000年12期_MS+SQL+Server数据库锁技术研究.pdf	http://sso.cdclib.org/interlibSSO/goto/6/=06190596Z93/kcms/detail/detail.aspx?dbCode=cjfq&filename=JSJC200012066&dbname=CJFD9902
基于XML技术的电子目录解决方案的研究	计算机工程	2000	2000年12期	【作者】 李颖 ； 马朝 ； 田蔚风 ； 【Author】       LI Ying, MA Chao, TIAN Weifeng (Department of Information Measurement and Instrument Engineering, Shanghai Jiaotong University,Shanghai 200030) 【机构】 上海交通大学信息检测与仪器工程系81研究室! 上海 200030 ； 上海交通大学信息检测与仪器工程系81研究室! 上海 200030 ；	电子商务 ； HTML ； XML ； 电子目录 ； 模板 ； 数据库 ； E-commerce ； HTML ； XML ； E-catalogue ； Template ； Database ；	在基于HTML的电子目录应用系统开发的基础上，提出了采用XML技术取代 HTML建立电子目录应用的设想，并进行了基于XML技术的电子目录系统解决方案的设计，将电子目录应用提高到解决方案层次上。	2000年12期_基于XML技术的电子目录解决方案的研究.pdf	http://sso.cdclib.org/interlibSSO/goto/6/=06190596Z93/kcms/detail/detail.aspx?dbCode=cjfq&filename=JSJC200012067&dbname=CJFD9902
基于ADO数据库系统的图象处理技术	计算机工程	2000	2000年12期	【作者】 王永会 ； 宋晓宇 ； 【Author】       WANG Yonghui，SONG Xiaoyu (Department of Computer Science，Shenyang Arch. and Civ. Eng. Inst., Shenyang 110015) 【机构】 沈阳建筑工程学院计算机系!沈阳 110015 ；	图象 ； 数据库 ； Active数据对象 ； Images ； Database ； ADO（ActiveX Data Object)? ；	介绍了一种基于ADO数据库系统中的图象处理技术，包括图象的输入、保存、显示与打印，给出了其设计与实现方法。该方法已成功应用于某车辆照片管理信息系统，可作为基于ADO的数据库系统中的通用图象处理方法。	2000年12期_基于ADO数据库系统的图象处理技术.pdf	http://sso.cdclib.org/interlibSSO/goto/6/=06190596Z93/kcms/detail/detail.aspx?dbCode=cjfq&filename=JSJC200012068&dbname=CJFD9902
多线程模拟3D射击类游戏的设计与实现	计算机工程	2000	2000年12期	【作者】 谢志鹏 ； 陈锻生 ； 【Author】       XIE Zhipeng, CHEN Duansheng (Computing Science Department,National Huaqiao University,Quanzhou 362011) 【机构】 国立华侨大学计算机系!泉州 362011 ；	多线程 ； 回调定时器 ； DirectSound ； 三维视觉引擎 ； Multithread ； Callback timer ； DirectSound ； 3D visual engine ；	以VisualC++开发3D射击类游戏为背景,介绍多线程和回调定时器技术及DirectSound的应用，最后阐述交互式三维视觉引擎的设计。	2000年12期_多线程模拟3D射击类游戏的设计与实现.pdf	http://sso.cdclib.org/interlibSSO/goto/6/=06190596Z93/kcms/detail/detail.aspx?dbCode=cjfq&filename=JSJC200012069&dbname=CJFD9902
电话语音卡在高速公路应急电话系统中的应用	计算机工程	2000	2000年12期	【作者】 胡钢 ； 张金波 ； 张学武 ； 【Author】       HU Gang，ZHANG Jinbo，ZHANG Xuewu    （College of Computer and Information Engineering, Hohai University, Changzhou 213022） 【机构】 河海大学常州分校计算机及信息工程学院!常州 213022 ；	高速公路应急电话系统 ； 电话语音卡 ； 实时录音 ； Highroad emergency telephone system ； Telephone phonic card ； Real time record ；	结合高速公路应急电话系统的研究课题，重点介绍该系统中采用电话语音卡实时录音、放音的软件设计。	2000年12期_电话语音卡在高速公路应急电话系统中的应用.pdf	http://sso.cdclib.org/interlibSSO/goto/6/=06190596Z93/kcms/detail/detail.aspx?dbCode=cjfq&filename=JSJC200012070&dbname=CJFD9902
PDM环境下快速产品技术报价的设计与实现	计算机工程	2000	2000年12期	【作者】 胡敏 ； 石教英 ； 【Author】       HU Min，SHI Jiaoying  (State Key Laboratory of CAD & CG, Zhejiang University, Hangzhou 310027) 【机构】 浙江大学CAD&CG国家重点实验室! 杭州  310027 ；	产品成本 ； 技术报价 ； PDM ； 物料清单 ； Product costs ； Technical quoted price ； PDM ； BOM ；	随着客户的个性化需求越来越高，企业在与客户的洽谈过程中，面临着如何在较短的时间内比较准确地估算出产品成本的问题。针对这种情况，该文对快速产品技术报价进行尝试，分析了中小型企业中的产品技术报价的工作流程，提出了在PDM环境下基于物料清单BOM的产品技术报价基础数据模型，并给出了相应的快速报价实现算法。	2000年12期_PDM环境下快速产品技术报价的设计与实现.pdf	http://sso.cdclib.org/interlibSSO/goto/6/=06190596Z93/kcms/detail/detail.aspx?dbCode=cjfq&filename=JSJC200012071&dbname=CJFD9902
