title	journal_name	year	issue	author	keywords	summary	pdf_filename	article_url
基于事件驱动的并行及分布式计算机的性能分析系统的设计	计算机工程	1996	1996年06期	【作者】 陈波 ； 王海洪 ； 彭澄廉 ； 【机构】 复旦大学计算机科学系 ；	并行及分布式系统 ； 事件驱动技术 ； 面向问题的分析 ；	介绍了复旦大学研制开发的并行及分布式计算机的分析评估系统的设计方法。为实现系统的通用性并支持面向问题的源相关性，设计了描述事件流的结构、表示方式及语义的事件流描述语言，并设计了面向问题的分析评估工具的通用函数接口．从而使建立在此基础上的分析评估工具完全不依赖于监测方式，真正实现了性能分析评估系统的通用性、面向问题及易扩充性等特性．此技术也适用于任何基于事件驱动的监测分析系统。关键词	1996年06期_基于事件驱动的并行及分布式计算机的性能分析系统的设计.pdf	http://sso.cdclib.org/interlibSSO/goto/6/=06190596Z93/kcms/detail/detail.aspx?dbCode=cjfq&filename=JSJC606.010&dbname=CJFD9498
参数样条曲面OFFSET的BP算法	计算机工程	1996	1996年06期	【作者】 陈俐 ； 王承翔 ； 郑军 ； 【机构】 湖南大学机械与汽车学院 ；	参数样条曲面 ； 非均匀有理B样条曲面 ； 神经网络 ； 等距面 ；	提出了用ＢＰ神经网络计算参数样条曲面ＯＦＦＳＥＴ曲面的新方法．该方法能保证对于每一组给定的参数、参数样条曲面及其ＯＦＦＳＥＴ曲面上的点一一与之对应。文章以非均匀有理Ｂ样条曲面为例，给出计算实例。结果表明，该方法可行、稳定，具有实际应用价值。	1996年06期_参数样条曲面OFFSET的BP算法.pdf	http://sso.cdclib.org/interlibSSO/goto/6/=06190596Z93/kcms/detail/detail.aspx?dbCode=cjfq&filename=JSJC606.011&dbname=CJFD9498
高速网络新技术讲座之三──高速计算机局域网	计算机工程	1996	1996年06期	【作者】 高传善 ； 贺琦 ； 【机构】 复旦大学计算机系 ；	计算机局域网 ； 高速网络 ； 新技术讲座 ； 办公自动化 ； 管理信息系统 ； 工业控制 ； 数据速率 ； 总线网 ； 子网 ； 信息传输 ；	高速网络新技术讲座之三──高速计算机局域网高传善，贺琦（复旦大学计算机系上海２００４３３）计算机局域网在管理信息系统、办公自动化、工业控制和教育等领域已得到广泛的应用。虽然到目前为止实际安装运行的局域网仍以１０ＭｂＰＳ的以大网（ＣＳＭ／ＣＤ总线网）和...	1996年06期_高速网络新技术讲座之三──高速计算机局域网.pdf	http://sso.cdclib.org/interlibSSO/goto/6/=06190596Z93/kcms/detail/detail.aspx?dbCode=cjfq&filename=JSJC606.012&dbname=CJFD9498
Access数据库程序设计中的俘错处理程序设计技巧	计算机工程	1996	1996年06期	【作者】 李群丽 ； 王思贤 ； 廖孟扬 ； 王文伟 ； 【机构】 武汉大学电子信息工程系 ；	运行时错误 ； 错误代码 ； 错误处理程序设计 ；	针对Ａｃｃｅｓｓ２．０数据库程序设计中常见且又至关重要的运行时错误分类型进行了讨论，并结合实例给出了相应的俘错处理程序设计方法．此外，文章还提出了一种简易有效的俘获Ａｃｃｅｓｓ保留错误代码的方法，并对包含子表单的复杂表单的错误处理给出了解决方案。	1996年06期_Access数据库程序设计中的俘错处理程序设计技巧.pdf	http://sso.cdclib.org/interlibSSO/goto/6/=06190596Z93/kcms/detail/detail.aspx?dbCode=cjfq&filename=JSJC606.013&dbname=CJFD9498
数据通信压缩器的系统设计	计算机工程	1996	1996年06期	【作者】 王晓鹏 ； 郑建兵 ； 吴时霖 ； 【机构】 复旦大学计算机系 ；	压缩／解缩 ； 动态在线处理 ； 输入／输出 ；	着重介绍了数据通信压缩器系统的硬件结构及工作流程。硬件部分以数据处理芯片ＴＭＳ３２０Ｃ２５作为数据通信压缩器的核心，进行动态在线处理。软件部分由主程序控制压缩／解缩子程序和Ｉ／Ｏ子程序两大模块的工作流程。压缩／解缩子程序负责对数据进行压缩、编码／解码和解缩。Ｉ／Ｏ子程序负责端口的数据交换。	1996年06期_数据通信压缩器的系统设计.pdf	http://sso.cdclib.org/interlibSSO/goto/6/=06190596Z93/kcms/detail/detail.aspx?dbCode=cjfq&filename=JSJC606.014&dbname=CJFD9498
网卡的管理使用中需要注意的三个环节	计算机工程	1996	1996年06期	【作者】 王理 ； 【机构】 北京总参５７３１８部队 ；	网络管理 ； 网络开发 ； 同卡 ； 软件故障 ； 传输媒体 ； 主机名 ； 网络实践 ； 硬盘控制器 ； 协处理器 ； 软件选择 ；	网卡的管理使用中需要注意的三个环节王理（北京总参５７３１８部队１０００９４）作为网络开发人员和网络管理维护人员，需要经常和网卡打交道，同卡是外界与网络打交道的第一道关口，是与用户开发使用网络有着密切关系的插件，如果能处理好网卡使用中的若干环节，那么将...	1996年06期_网卡的管理使用中需要注意的三个环节.pdf	http://sso.cdclib.org/interlibSSO/goto/6/=06190596Z93/kcms/detail/detail.aspx?dbCode=cjfq&filename=JSJC606.015&dbname=CJFD9498
新的开发环境─协调设计和协调模拟	计算机工程	1996	1996年06期		开发环境 ； 硬件问题 ； 嵌人式设备 ； 产品生命周期 ； 符合规格 ；	新的开发环境─协调设计和协调模拟产品生命周期缩短，如不领先于其他公司投的工时和成本。因此，在硬件的原型完成之前，人新产品就很难生存下去。嵌人式设备。往往开如进行硬件和软件的协调检验，硬件问题能早期发用ＩＣ等硬件，因此需要在完成硬件原型之前发现，就不会...	1996年06期_新的开发环境─协调设计和协调模拟.pdf	http://sso.cdclib.org/interlibSSO/goto/6/=06190596Z93/kcms/detail/detail.aspx?dbCode=cjfq&filename=JSJC606.016&dbname=CJFD9498
高级语言成为嵌入式应用开发的主流	计算机工程	1996	1996年06期		嵌人式设备 ； 代码量 ； 嵌入式设备 ；	高级语言成为嵌入式应用开发的主流在嵌人式设备的应用开发领域，汇编程序是出对应于用汇编程序记述的程序的产品。主流，但随着采用处理能力特别强的ｍ５Ｃ处理但汇编语育也有不足之处：助忆码很难理器和３２位的ＣＩＳＣ处理器的事例增加，正逐步解，不适合编程，非得用...	1996年06期_高级语言成为嵌入式应用开发的主流.pdf	http://sso.cdclib.org/interlibSSO/goto/6/=06190596Z93/kcms/detail/detail.aspx?dbCode=cjfq&filename=JSJC606.017&dbname=CJFD9498
MSC小巨型机设计	计算机工程	1996	1996年05期	【作者】 刘应学 ； 【机构】 华东计算技术研究所 ；	小巨型机 ； 结构 ； 流水线 ； 兼容 ； 一致性 ； 交叉开关 ；	该文主要阐述ＭＳＣ小巨型机的设计思想、方法及关键技术．	1996年05期_MSC小巨型机设计.pdf	http://sso.cdclib.org/interlibSSO/goto/6/=06190596Z93/kcms/detail/detail.aspx?dbCode=cjfq&filename=JSJC605.000&dbname=CJFD9498
MSC小巨机微码生成系统	计算机工程	1996	1996年05期	【作者】 李淞江 ； 周颖 ； 王文利 ； 唐毅 ； 【机构】 上海大学计算机学院 ；	MSC小巨机 ； 微程序 ； 模拟器 ； 微汇编器 ；	ＭＳＣ小巨机是我国自主开发的、具有国际先进水平的小巨型计算机系统，文章介绍了该机的微码生成系统。它由两部分组成，通过微汇编能方便地进行微程序设计，使用模拟器来验证微程序的正确性，使机器的逻辑设计与微程序设计能同步进行。	1996年05期_MSC小巨机微码生成系统.pdf	http://sso.cdclib.org/interlibSSO/goto/6/=06190596Z93/kcms/detail/detail.aspx?dbCode=cjfq&filename=JSJC605.001&dbname=CJFD9498
可视程序设计语言形式化规范的研究	计算机工程	1996	1996年05期	【作者】 施小英 ； 庄伟波 ； 胡环荣 ； 【机构】 上海交通大学计算机系 ；	可视程序设计 ； 广义图标 ； 形式化现范 ；	在计算机领域引入程序可视化技术，把图形技术融进程序设计中，其目的在于减少人与机器交流的障碍。首先简述可视程序设计的基本概念，然后介绍可视程序设计语言的形式化描述，如图形系统的形式化规范、图标操作符、图标语句的语法与语义分析描述。	1996年05期_可视程序设计语言形式化规范的研究.pdf	http://sso.cdclib.org/interlibSSO/goto/6/=06190596Z93/kcms/detail/detail.aspx?dbCode=cjfq&filename=JSJC605.002&dbname=CJFD9498
OOMDB及存储和检索技术	计算机工程	1996	1996年05期	【作者】 徐寿怀 ； 胡美琛 ； 【机构】 复旦大学计算机科学系 ；	面向对象多媒体数据库 ； 面向对象数据库 ； 存储 ； 检索 ；	多媒体信息系统的核心无疑是多媒体数据库系统．传统的数据库技术不能高效地存储和处理多媒体数据。文中介绍了扩展面向对象数据库（ＯＯＤＢ）成为面向对象多媒体数据库（ＯＯＤＢ）时应考虑的问题，然后介绍了ＯＯＭＤＢ的体系结构，最后讨论了其存储和检索技术．	1996年05期_OOMDB及存储和检索技术.pdf	http://sso.cdclib.org/interlibSSO/goto/6/=06190596Z93/kcms/detail/detail.aspx?dbCode=cjfq&filename=JSJC605.003&dbname=CJFD9498
软件开发范例的选择策略	计算机工程	1996	1996年05期	【作者】 陈志渊 ； 丁宝康 ； 【机构】 复旦大学计算机科学系 ；	软件开发 ； 软件质量 ； 软件生产率 ； 面向对象 ；	对现在流行的过程性软件开发范例和面向对象范例进行了比较，并指出面向对象范例对软件质量与生产率的影响以及采用该范例的制约因素，最后提出一个选择软件开发范例的决策模型。	1996年05期_软件开发范例的选择策略.pdf	http://sso.cdclib.org/interlibSSO/goto/6/=06190596Z93/kcms/detail/detail.aspx?dbCode=cjfq&filename=JSJC605.004&dbname=CJFD9498
图形用户界面开发环境XWIN	计算机工程	1996	1996年05期	【作者】 席裕庚 ； 【机构】 上海交通大学自动化研究所 ；	图形用户界面 ； 窗口 ； 消自驱动 ； 资源文件 ；	介绍了中文图形用户界面开发环境ＸＷＩＮ的实现ＸＷＩＮ系统便于用户在适合ＤＯＳ操作系统的场合快速开发具有Ｗｉｎｄｏｗｓ图形界面的应用程序。	1996年05期_图形用户界面开发环境XWIN.pdf	http://sso.cdclib.org/interlibSSO/goto/6/=06190596Z93/kcms/detail/detail.aspx?dbCode=cjfq&filename=JSJC605.005&dbname=CJFD9498
Z缓存扫描线算法的三维裁剪功能	计算机工程	1996	1996年05期	【作者】 张谦 ； 卢振荣 ； 肖忠晖 ； 【机构】 西安交通大学机械工程学院 ；	Z缓存扫描线 ； 三维裁剪 ； 算法 ；	文中提出的算法可使扫描过程在完成隐面消除和浓淡处理的同时具有三维裁剪的功能。这种算法可免去单独的三维裁剪环节，从三维图形显示的整体过程上简化处理步骤，并提高执行效率。	1996年05期_Z缓存扫描线算法的三维裁剪功能.pdf	http://sso.cdclib.org/interlibSSO/goto/6/=06190596Z93/kcms/detail/detail.aspx?dbCode=cjfq&filename=JSJC605.006&dbname=CJFD9498
基于NOVELL网的CAI教学平台的设计与实现	计算机工程	1996	1996年05期	【作者】 张华忠 ； 韩芳溪 ； 刘永盛 ； 【机构】 山东工业大学计算机系 ；	计算机辅助教学 ； 局域网 ； 教学平台 ； 事件控制块 ； 任务控制块 ；	通过对ＮＯＶＥＬＬ网实时点－点通讯和网络ＣＡＩ的研究，作者在ＮＯＶＥＬＬ网上构造了一个网络实时ＣＡＩ教学监控平台，借助该平台，可实现教师机监控学生机、在线教学示范及测试等功能，较单机ＣＡＩ具有教师与学生交互、监控等优点。该平台提供了接口，一般ＣＡＩ经改进即可安装于ＮＯＶＥＬＬ网上。	1996年05期_基于NOVELL网的CAI教学平台的设计与实现.pdf	http://sso.cdclib.org/interlibSSO/goto/6/=06190596Z93/kcms/detail/detail.aspx?dbCode=cjfq&filename=JSJC605.007&dbname=CJFD9498
第四代语言下的专家系统工具4GEST的研究	计算机工程	1996	1996年05期	【作者】 琚春华 ； 凌云 ； 陈玉明 ； 【机构】 杭州商学院管理信息系 ；	专家系统 ； 知识表示 ； 推理机 ； 第四代语言 ；	介绍一种基于第四代语言的专家系统工具４ＧＥＳＴ的研究，包括其知识的表示方法，推理机和解释器等的实现过程。该工具采用了ＤＢ＋ＥＳ的技术，运用于与／或条件的知识领域。	1996年05期_第四代语言下的专家系统工具4GEST的研究.pdf	http://sso.cdclib.org/interlibSSO/goto/6/=06190596Z93/kcms/detail/detail.aspx?dbCode=cjfq&filename=JSJC605.008&dbname=CJFD9498
用DSP芯片实现的指纹识别系统	计算机工程	1996	1996年05期	【作者】 宋彬 ； 吴刚 ； 李宗葛 ； 【机构】 复旦大学计算机系 ；	特征提取 ； 神经网络 ； DSP芯片 ；	介绍了一个指纹识别实验系统。该系统采用一种模式识别传统技术和神经网络模型相结合的方法，即在抽取指纹样本模式有效特征的基础上，训练神经网络判别器来进行指纹识别。最后用ＴＩ公司的ＤＳＰ芯片ＴＭＳ３２０Ｃ３０加以实现。该系统为９６国际ＤＳＰ设计大赛参赛作品。	1996年05期_用DSP芯片实现的指纹识别系统.pdf	http://sso.cdclib.org/interlibSSO/goto/6/=06190596Z93/kcms/detail/detail.aspx?dbCode=cjfq&filename=JSJC605.009&dbname=CJFD9498
一种基于信息熵的神经网络规则表示	计算机工程	1996	1996年05期	【作者】 吴新根 ； 吕维雪 ； 【机构】 浙江大学生物医学研究所 ；	神经网络 ； 专家系统 ； 脆弱性 ； 信息熵 ； 裁剪 ；	把信息熵引入到边向传播神经网络的代价函数中，通过对分类规则的学习，在隐层获得有组织的激励模式，并据此裁剪多余的隐节点和连接，使得每条分类规则能够与唯一的隐层节点、输出节点对应，因此网络中的每一个节点有了明确的意义，并可以跟踪解释网络的推理过程．由于采用这种规则表示和推理过程的神经网络具有较好的泛化能力，因此克服了传统专家系统的脆弱性。应用这种方法还可以压缩规则库，在大量规则存在时效果尤其明显．	1996年05期_一种基于信息熵的神经网络规则表示.pdf	http://sso.cdclib.org/interlibSSO/goto/6/=06190596Z93/kcms/detail/detail.aspx?dbCode=cjfq&filename=JSJC605.010&dbname=CJFD9498
UNIXV3．2．0系统磁带机安装版本的生成	计算机工程	1996	1996年05期	【作者】 刘丹 ； 【机构】 上海交通大学计算机系 ；	UNIX操作系统 ； 磁带机 ； 系统安装 ；	主要介绍了用系统安装盘生成磁带安装版本的方法，并介绍了用生成的安装磁带安装系统的具体方法。它较以前用软盘安装大大节省了安装时间，同时也不易出现误操作．	1996年05期_UNIXV3．2．0系统磁带机安装版本的生成.pdf	http://sso.cdclib.org/interlibSSO/goto/6/=06190596Z93/kcms/detail/detail.aspx?dbCode=cjfq&filename=JSJC605.011&dbname=CJFD9498
目录在网络管理中的应用及其实现	计算机工程	1996	1996年05期	【作者】 孟军 ； 高传善 ； 【机构】 复旦大学计算机系 ；	目录 ； 网络管理 ； 远程过程调用 ；	目录为管理较大范围的网络信息提供了一种有效机制，它是由各个目录服务代理依靠几种搜索知识信息相互合作来完成的．该文最后讨论了目录服务的动态过程在远程过程调用上的实现。	1996年05期_目录在网络管理中的应用及其实现.pdf	http://sso.cdclib.org/interlibSSO/goto/6/=06190596Z93/kcms/detail/detail.aspx?dbCode=cjfq&filename=JSJC605.012&dbname=CJFD9498
NOVELL局域网数据通信安全的研究	计算机工程	1996	1996年05期	【作者】 宋东平 ； 邢卫 ； 廖闻彬 ； 【机构】 浙江大学工业控制技术国家重点实验室 ；	Novell局域网 ； 数据通信 ； 加密 ； 解密 ；	以Ｎｏｖｅｌｌ局域网为背景探讨了网络数据安全通信的问题，提出了两种软件实现安全通信的模型，它能达到较快的加密、解密速度，又可以方便地进行密钥管理，并能在网络中的工作站之间、工作站和服务器之间做到对等安全通信。	1996年05期_NOVELL局域网数据通信安全的研究.pdf	http://sso.cdclib.org/interlibSSO/goto/6/=06190596Z93/kcms/detail/detail.aspx?dbCode=cjfq&filename=JSJC605.013&dbname=CJFD9498
基于黑板模型的智能决策系统的自动生成	计算机工程	1996	1996年05期	【作者】 黄波 ； 梁骏 ； 倪重匡 ； 【机构】 复旦大学计算机系 ；	生成器 ； 智能决策系统 ； 事件驱动 ； 黑板 ；	介绍了一个智能决策系统的自动生成器，此生成器以黑板系统为模型，通过内置的黑板结构、知识源结构及推理控制策略，此生成器可为用户提供一个简易、友好的智能决策系统生成平台。事件驱动的概念贯穿了整个设计的始终。在内置的决策推理控制策略中，由于不精确推理算法的使用，使得由此生成器生成的智能决策系统能决策快速而准确。此生成器能满足普遍的智能决策系统的设计需求。	1996年05期_基于黑板模型的智能决策系统的自动生成.pdf	http://sso.cdclib.org/interlibSSO/goto/6/=06190596Z93/kcms/detail/detail.aspx?dbCode=cjfq&filename=JSJC605.014&dbname=CJFD9498
高速网络新技术讲座之二─—高速分组交换技术	计算机工程	1996	1996年05期	【作者】 高传善 ； 孟军 ； 【机构】 复旦大学计算机系 ；	高速网络 ； 分组交换技术 ； 新技术讲座 ； 公用数据网 ； 远程数据通信 ； 帧中继技术 ； 信元头 ； 通信子网 ； 路由表 ； 网络层 ；	高速网络新技术讲座之二─—高速分组交换技术高传善，孟军（复旦大学计算机系上海２００４３３）在远程数据通信中，可以使用专用电路ＱｅｄｉｃａｔｅｄＣｉｒｃｕｉｔｓ）、数字数据网ＤＤＮ（ＤｉｇｉｔａｌＤａｔａＮｅｔｗｏｒｋ用公用数据网。数字数据网虽然其内部...	1996年05期_高速网络新技术讲座之二─—高速分组交换技术.pdf	http://sso.cdclib.org/interlibSSO/goto/6/=06190596Z93/kcms/detail/detail.aspx?dbCode=cjfq&filename=JSJC605.015&dbname=CJFD9498
环球信息	计算机工程	1996	1996年04期		环球信息 ； 个人机 ； 集成软件 ； 网络集成 ； 字节码 ； 应用软件 ； 通信技术 ； 软件库 ； 面向对象的 ； 软件开发人员 ；	环球信息Ｗｉｎｔｅｌ时代宣告结束，网络集成时代拉开序幕有人认为，Ｍｉｃｒｏｓｏｆｔ和Ｉｎｔｅｌ（通称Ｗｉｎｔｅｌ）时代已于１９９５年结束。而由于Ｉｎｔｅｒｎｅｔ的扩大和通信技术的发展，信息技术（ＩＴ）产业从以个人机为中心的时代迈人以网络为中心的时代。...	1996年04期_环球信息.pdf	http://sso.cdclib.org/interlibSSO/goto/6/=06190596Z93/kcms/detail/detail.aspx?dbCode=cjfq&filename=JSJC604.000&dbname=CJFD9498
关于图像色彩压缩的一种新聚类算法	计算机工程	1996	1996年04期	【作者】 凌卫新 ； 凌玲 ； 【机构】 华南理工大学应用数学系 ； 广东工业大学 ；	聚类算法 ； 概率 ； 距离准则 ； 色彩压缩 ；	提出一种用于图像色彩压缩的概率聚类算法。该算法从统计图像的颜色出现概率来寻找最佳初始聚类中心，然后，采用距离准则进行聚类，最后，用重心法原理确定聚类域中心的向量值。理论和实验结果分析表明。该算法具有简单、色彩压缩效果好、处理速度快的特点。	1996年04期_关于图像色彩压缩的一种新聚类算法.pdf	http://sso.cdclib.org/interlibSSO/goto/6/=06190596Z93/kcms/detail/detail.aspx?dbCode=cjfq&filename=JSJC604.001&dbname=CJFD9498
从二维草绘到三维变量化设计	计算机工程	1996	1996年04期	【作者】 邓益民 ； 李川奇 ； 凌忠社 ； 【机构】 中国科技大学精密机械与精密仪器系 ； 合肥叉车总厂计算中心 ；	二维草绘 ； 变量化设计 ； 扫描体 ； 组合体 ；	该文提出了一个从二维草绘开始的三维变量化几何模型的建立方法，详细介绍了变量约束。关系布尔运算的机理与方法，并进一步分析了针对已建立的几何模型进行变量化设计的途径及有关注意事项。	1996年04期_从二维草绘到三维变量化设计.pdf	http://sso.cdclib.org/interlibSSO/goto/6/=06190596Z93/kcms/detail/detail.aspx?dbCode=cjfq&filename=JSJC604.002&dbname=CJFD9498
基于进化计算的Halftoning算法	计算机工程	1996	1996年04期	【作者】 李建国 ； 王峥 ； 李介谷 ； 【机构】 上海第一纺织医院信息科 ； 上海交通大学模式识别与图像处理所 ；	进化计算 ； halftoning算法 ； 图像处理 ；	描述了进化计算在ｈａｌｆｔｏｎｉｎｇ算法中的应用，在保真显示或打印机上输出图像时，需要用ｈａｌｆｔｏｎｉｎｓ技术将多灰度图像转换为二值图像。一般来讲，保真满意的图像必定有高的立体和灰度级质量。在研究中，ｈａｌｆｔｏｎｉｎｇ算法被看作一个优化问题，即在ｈａｌｆｔｏｎｉｎｇ图像中搜索黑色像素的位置，以使图像具有较好的视觉效果。为解决这个问题，一个简单ＧＡ（ＳＧＡ）和一个单一群体的ＧＡ（ＳＰＧ）被用于ｈａｌｆｔｏｎｉｎｇ算法中。文中显示了一些由进化计算获得ｈａｌｆｔｏｎｉｎｇ图像，并演示它们的搜索效率。	1996年04期_基于进化计算的Halftoning算法.pdf	http://sso.cdclib.org/interlibSSO/goto/6/=06190596Z93/kcms/detail/detail.aspx?dbCode=cjfq&filename=JSJC604.003&dbname=CJFD9498
几何关联体及其数学模型	计算机工程	1996	1996年04期	【作者】 俞勇 ； 管敏仁 ； 【机构】 上海交通大学计算机科学与工程系 ；	几何关联体 ； 属性 ； 相似 ； 变换 ；	提出了一种利用几何关联体描述物体和物体间相互关系的方法。给出了几何关联体的定义及其性质，并建立了它的数学模型。从关联体集的相似导出了关联体间的变换过程及其计算方法。	1996年04期_几何关联体及其数学模型.pdf	http://sso.cdclib.org/interlibSSO/goto/6/=06190596Z93/kcms/detail/detail.aspx?dbCode=cjfq&filename=JSJC604.004&dbname=CJFD9498
远程文件管理系统	计算机工程	1996	1996年04期	【作者】 俞勇 ； 孙斐 ； 张文波 ； 【机构】 上海交通大学计算机科学与工程系 ；	文件系统 ； 树型 ； 时间复杂性 ； 缓冲区 ；	提出了一个在家用电脑联网信息系统中远程文件管理系统的实现方法，对一个树型结构的文件系统分析了其操作的时间复杂性，以及给出了一个如何有效地选择系统缓冲区大小的方法．	1996年04期_远程文件管理系统.pdf	http://sso.cdclib.org/interlibSSO/goto/6/=06190596Z93/kcms/detail/detail.aspx?dbCode=cjfq&filename=JSJC604.005&dbname=CJFD9498
非标准数据库中的类型和运算	计算机工程	1996	1996年04期	【作者】 范志新 ； 左万历 ； 周长林 ； 范希武 ； 施伯乐 ； 崔享洙 ； 【机构】 吉林大学计算机科学系 ；	数据库 ； 非标准数据库 ； 类型系统 ；	扩展了ＮＦ２（ＮｏＦｉｒｓｔＮｏｒｍａｌＦｏｒｍ）关系模型的类型系统并探讨了各类型的运算操作，使扩充后的类型系统符合第三代数据库的原则．	1996年04期_非标准数据库中的类型和运算.pdf	http://sso.cdclib.org/interlibSSO/goto/6/=06190596Z93/kcms/detail/detail.aspx?dbCode=cjfq&filename=JSJC604.006&dbname=CJFD9498
分布式面向对象数据库的方法查找及其实现	计算机工程	1996	1996年04期	【作者】 许振斌 ； 周广声 ； 【机构】 上海海运学院计算机科学系 ；	分布式数据库 ； 面向对象数据库 ； 方法查找 ；	分析了面向对象的多继承模式带来的方法查找问题，利用标号法给出了面向对象数据库的方法查找的算法．最后利用多层数据结构的并行维护给出了在分布式环境下的一个有效实现。	1996年04期_分布式面向对象数据库的方法查找及其实现.pdf	http://sso.cdclib.org/interlibSSO/goto/6/=06190596Z93/kcms/detail/detail.aspx?dbCode=cjfq&filename=JSJC604.007&dbname=CJFD9498
