title	journal_name	year	issue	author	keywords	summary	pdf_filename	article_url
建设跨城域高速宽带校园网络──新浙大校园网络介绍	计算机工程	2000	2000年S1期	【作者】 朱淼良 ； 【Author】       Zhu Miaoliang  (Campus Network Center of Zhejiang University Hangzhou 310027 ) 【机构】 浙江大学校园网络中心!杭州310027 ；	高速宽带网络 ； 城域网 ； 光纤网 ； ATM ； 千兆网 ； QoS ； Broad bandwidth network ； City-area network ； Fiber cable ； ATM, Gigabit Ethernet: QoS ；	本文提出一种跨城区的高速宽带校园网络系统的结构方案，并且结合在浙江大学校园中的实际应用，讨论了建设高速宽带校园网络的一些经验和体会。	2000年S1期_建设跨城域高速宽带校园网络──新浙大校园网络介绍.pdf	http://sso.cdclib.org/interlibSSO/goto/6/=06190596Z93/kcms/detail/detail.aspx?dbCode=cjfq&filename=JSJC2000S1000&dbname=CJFD9902
略论我国骨干网的发展趋势	计算机工程	2000	2000年S1期	【作者】 陈庶樵 ； 黄文胜 ； 邬江兴 ； 【Author】       Chen Shuqiao, Huang Wensheng, Wu Jiangxing (National Digital Switching Center, Zhengzhou 450002 ) 【机构】 国家数字交换系统工程技术研究中心!郑州450002 ；	信息 ； 骨干网络 ； 互联网 ； Information ； Backbone network ； Internet ；	本文在详细讨论了我国骨干网络现状的基础上，以不同的角度论述了我国未来骨干网络的发展方向，并且指出了我国所应该采取的发展方针和政策。	2000年S1期_略论我国骨干网的发展趋势.pdf	http://sso.cdclib.org/interlibSSO/goto/6/=06190596Z93/kcms/detail/detail.aspx?dbCode=cjfq&filename=JSJC2000S1001&dbname=CJFD9902
宽带跨网集成高速因特网接入应用分析	计算机工程	2000	2000年S1期	【作者】 马卫东 ； 【Author】       Ma Weidong (Institute of Computer Application, China Academy of Engineering Physics, Mianyang 621900) 【机构】 中国工程物理研究院计算机应用研究所!绵阳621900 ；	有线电视 ； 因特网 ； TCP/IP ； 跨网集成 ； CATV: Internet: TCP/IP: Overnet ；	宽带跨网集成因特网接入是基于将ＣＡＴＶ与ＰＳＴＮ网这两种不同类型的网络相互结合实现的跨网集成的高速因特网接入方式。将之应用于ＣＡＴＶ网和电信ＰＳＴＮ网，不需要改造现有的网络系统，就可以廉价实现高速的因特网接入。在ＣＡＴＶ网采用６４ＱＡＭ调制技术，每个８ＭＨｚ带宽的电视频道可提供高达３２Ｍｂｐｓ的净下行速率。单用户使用的最高下载速率可高达２．５Ｍｂｐｓ。因此该系统是一种已经实用化的、低成本、高效率的高速因特网接入解决方案。本文对该系统设计应用方面的一些关键技术进行了探讨。	2000年S1期_宽带跨网集成高速因特网接入应用分析.pdf	http://sso.cdclib.org/interlibSSO/goto/6/=06190596Z93/kcms/detail/detail.aspx?dbCode=cjfq&filename=JSJC2000S1002&dbname=CJFD9902
SHERNET城域网建设与研究	计算机工程	2000	2000年S1期	【作者】 李家滨 ； 汪为农 ； 【Author】       Li Jiabin, Wang Weinong (Network & Information Center of Shanghai Jiaotong University, Shanghai 200030) 【机构】 上海交通大学网络信息中心!上海200030 ；	城域网 ； 动态包传输 ； 上海教育与科研计算机网 ； MAN: DPT: SHERNET ；	本文简单回顾了上海教育与科研计算机网（ＳＨＥＲＮＥＴ）三期建设和发展过程，着重介绍上海教育系统城域网建设涉及的主要技术，还讨论了ＳＨＥＲＮＥＴ城域网运行管理问题。	2000年S1期_SHERNET城域网建设与研究.pdf	http://sso.cdclib.org/interlibSSO/goto/6/=06190596Z93/kcms/detail/detail.aspx?dbCode=cjfq&filename=JSJC2000S1003&dbname=CJFD9902
基于交换式路由技术的网络设计	计算机工程	2000	2000年S1期	【作者】 黄河 ； 【Author】       Huang He (Wuhan Transportation University,Wuhan 430063 ) 【机构】 武汉交通科技大学!武汉430063 ；	第三层交换 ； 路由表 ； 客户/服务 ； Layer 3 switching: Router table: Client/Server ；	交换式路由是基于网络层的交换技术，是一种在局域网内部替代传统路由器的理想设备。本文着重描述了第三层交换式路由的技术原理并给出建设校园骨干网的设计思想。	2000年S1期_基于交换式路由技术的网络设计.pdf	http://sso.cdclib.org/interlibSSO/goto/6/=06190596Z93/kcms/detail/detail.aspx?dbCode=cjfq&filename=JSJC2000S1004&dbname=CJFD9902
普通高校天地多平台高速网络研究	计算机工程	2000	2000年S1期	【作者】 顾一中 ； 【Author】       Gu Yizhong (Shandong Architecture Institute, Jinan 250014) 【机构】 山东建筑工程学院!济南250014 ；	天地多平台 ； 高速网络 ； 研究 ； Many platforms of heaven and earth: High speed network ； Research ；	根据国家教育部制定的建设天地结合的现代远程教育网络规划，结合固有环境，研究、建设了有卫星等多个外连高速线路平台、具备多媒体远程教学功能的校园计算机网。为普通高校网络建设探索出了一条新路。	2000年S1期_普通高校天地多平台高速网络研究.pdf	http://sso.cdclib.org/interlibSSO/goto/6/=06190596Z93/kcms/detail/detail.aspx?dbCode=cjfq&filename=JSJC2000S1005&dbname=CJFD9902
基于网络设计总体目标的路由设备选型策略	计算机工程	2000	2000年S1期	【作者】 薛兵 ； 宋志刚 ； 王昌盛 ； 【Author】       Xue Bing, Song Zhigang, Wang Changsheng (Network Administrative Center, Ordnance Engineering College, Shijiazhuang 050003) 【机构】 军械工程学院网管中心!石家庄050003 ；	网络设计 ； 总体目标 ； 路由器设备 ； 选型策略 ； Network design ； General target ； Router equipment ； Type selection strategy ；	本文从网络设计的总体目标出发，从三个方面讨论了路由器设备的选型策略。首先从路由协议、路由设备的互操作性等方面探讨了路由设备选型的功能因素。然后从可靠性、可维护性、吞吐量指标、延时指标等方面探讨了路由器设备选型的性能因素。最后从配置参数、配置方式和扩展接口等方面探讨了路由器设备选型的灵活性因素。	2000年S1期_基于网络设计总体目标的路由设备选型策略.pdf	http://sso.cdclib.org/interlibSSO/goto/6/=06190596Z93/kcms/detail/detail.aspx?dbCode=cjfq&filename=JSJC2000S1006&dbname=CJFD9902
西京医院信息化建设及应用	计算机工程	2000	2000年S1期	【作者】 高东怀 ； 骆晔 ； 蔡宏伟 ； 【Author】       Gao Donghuai, Luo Hua, Cai Hongwei (1.Network Center of Fourth Military Medical University, Xi’an 710032; Network Centre of Xijing Hospital. Xi’an 710032) 【机构】 第四军医大学网络中心!西安710032 ； 西京医院网络中心!西安710032 ；	校园网 ； 局域网 ； 医院信息系统 ； Campus information system: Local area network: Hospital information systems ；	本文从一般医科院校附属医院承担的医疗、教学和科研任务出发，介绍在此类医院建立综合信息管理网和教学、科研网两套网络的必要性，着重介绍了西京医院两套网络的建设方案、结构和应用情况。	2000年S1期_西京医院信息化建设及应用.pdf	http://sso.cdclib.org/interlibSSO/goto/6/=06190596Z93/kcms/detail/detail.aspx?dbCode=cjfq&filename=JSJC2000S1007&dbname=CJFD9902
重庆医科大学校园网规划与建设	计算机工程	2000	2000年S1期	【作者】 曾庆 ； 陈思秀 ； 【Author】       Zeng Qing, Chen Sixiu (Network Center of Chongqing University of Medical Sciences, Chongqing 400016) 【机构】 重庆医科大学网络中心!重庆400016 ；	校园网 ； 网络安全 ； 千兆以太网 ； Compus network ； Network safety ； Gigabit ethernet ；	本文介绍了重庆医科大学运用千兆以太网技术建设校园的经验，介绍了在网络建设中网络中心地理位置变迁的解决方法，讨论了在校园网环境下保证网络安全可靠运行的技术手段及方法。	2000年S1期_重庆医科大学校园网规划与建设.pdf	http://sso.cdclib.org/interlibSSO/goto/6/=06190596Z93/kcms/detail/detail.aspx?dbCode=cjfq&filename=JSJC2000S1008&dbname=CJFD9902
具有可扩展性的IP地址分配策略	计算机工程	2000	2000年S1期	【作者】 黄雪斌 ； 汪为农 ； 【Author】       Huang Xuebin, Wang Weinong (Department of Computer Science and Engineering,Shanghai Jiaotong University, Shanghai 200030 ) 【机构】 上海交通大学计算机科学与工程系!上海200030 ；	IP地址分配 ； 可扩展性 ； 地址空间折半分配算法 ； IP address allocation ； Extensibility: Middle point allocation algorithm ；	本文就在目前ＩＰ地址日趋紧张的情况下，如何对有限的ＩＰ地址进行分配，在保证网络效率、可扩展性和方便管理的前提下，尽量提高地址的利用率，进行了有益的探讨，并给出了具有可扩展特性的ＩＰ地址分配策略——地址空间折半分配算法。	2000年S1期_具有可扩展性的IP地址分配策略.pdf	http://sso.cdclib.org/interlibSSO/goto/6/=06190596Z93/kcms/detail/detail.aspx?dbCode=cjfq&filename=JSJC2000S1009&dbname=CJFD9902
千兆以太网加ATM网技术在校园网设计方案中的应用	计算机工程	2000	2000年S1期	【作者】 刘正勇 ； 钱焕延 ； 【Author】       Liu Zhengyong, Qian Huanyan (The Network Center of Nanjing University of Science and Technology, Nanjing 210094) 【机构】 南京理工大学网络中心!南京210094 ；	千兆以太网 ； ATM ； 子网 ； 虚网 ； 视频会议系统 ； Gigabit Ethernet ； ATM ； Subnet ； VLAN ； Video conference ；	本文通过采用千兆以太网加精干ＡＴＭ网技术设计的校园网的一个案例，说明了千兆以太网与ＡＴＭ网技术的有效结合，使校园网的功能更加完美。具体从千兆以太与ＡＴＭ互连和视频会议系统等几个方面加以分析。	2000年S1期_千兆以太网加ATM网技术在校园网设计方案中的应用.pdf	http://sso.cdclib.org/interlibSSO/goto/6/=06190596Z93/kcms/detail/detail.aspx?dbCode=cjfq&filename=JSJC2000S1010&dbname=CJFD9902
IP网络地址转换技术及其在校园网内部的实现	计算机工程	2000	2000年S1期	【作者】 汪燕 ； 贺聿志 ； 秦山秀 ； 黎耀 ； 【Author】       Wang Yan, He Yuzhi, Qin Shanxiu, Li Yao (Huazhong University of Sci. & Tech., Wuhan 430074 ) 【机构】 华中科技大学网络中心!武汉430074 ；	NAT ； 私有IP ； 动态转换 ； 静态转换 ； NAT Private IP ； Dynamic ； Static ；	Ｉｎｔｅｒｎｅｔ网两个最引人注目的问题是ＩＰ地址将要耗尽和路由表的膨胀，一个长远的和短期的解决方案正在开发之中。本文结合校园网的实际建设介绍了ＩＰ地址的转换技术，它有效地解决了ＩＰ地址空间不够用及私有ＩＰ地址计费的问题。	2000年S1期_IP网络地址转换技术及其在校园网内部的实现.pdf	http://sso.cdclib.org/interlibSSO/goto/6/=06190596Z93/kcms/detail/detail.aspx?dbCode=cjfq&filename=JSJC2000S1011&dbname=CJFD9902
江苏高校城域网的规划与建设	计算机工程	2000	2000年S1期	【作者】 曹争 ； 陈明 ； 【Author】       Cao Zheng, Chen Ming (1.Southeast University, Computer Science Dept., Nanjing 210096; 2. Information Center of Jiangsu Education Bureau, Nanjing 210024) 【机构】 东南大学计算机系!南京210096 ； 江苏省教育厅信息中心!南京210024 ；	JSERNET ； 城域网 ； 网络管理 ； JSERNET ； MAN ； Network management ；	高校城域网是教育信息化和现代化的重要方面之一，它为提高网络应用水平提供了必不可少的基础设施。本文就江苏省教育科研网的城域网规划与建设问题，阐述了城域网建设模式、城域网管理方式及进一步的计划等。	2000年S1期_江苏高校城域网的规划与建设.pdf	http://sso.cdclib.org/interlibSSO/goto/6/=06190596Z93/kcms/detail/detail.aspx?dbCode=cjfq&filename=JSJC2000S1012&dbname=CJFD9902
北京医科大学校园网的设计和实现	计算机工程	2000	2000年S1期	【作者】 郝宇红 ； 【Author】       Hao Yuhong (Beijing Medical University, Beijing 100083) 【机构】 北京医科大学信息中心!北京100083 ；	ATM ； VLAN ； 防火墙 ； 代理服务器 ； ATM ； VLAN ； Firewall ； Proxy server ；	本文从校园网体系结构、服务器的选择、网络的应用、网络安全的实施等角度，谈谈北京医科大学校园网的设计和实现。	2000年S1期_北京医科大学校园网的设计和实现.pdf	http://sso.cdclib.org/interlibSSO/goto/6/=06190596Z93/kcms/detail/detail.aspx?dbCode=cjfq&filename=JSJC2000S1013&dbname=CJFD9902
抚顺石油学院校园网络建设及扩建工程规划与设计	计算机工程	2000	2000年S1期	【作者】 吴承猛 ； 邹翔 ； 赵丹丹 ； 【Author】       Wu Chengmeng, Zou Xiang, Zhao Dandan (Net Center of Fushun Petroleum Institute, Fushun 113001) 【机构】 抚顺石油学院网络中心!抚顺113001 ；	校园网络建设 ； ATM技术 ； 校园网设计 ； Campus network construction:. ATM technology: Campus network desigm ；	本文介绍了抚顺石油学院校园网络建设和改造扩建工程的规划与设计，介绍了该院的建网指导思想，以及经验和体会。	2000年S1期_抚顺石油学院校园网络建设及扩建工程规划与设计.pdf	http://sso.cdclib.org/interlibSSO/goto/6/=06190596Z93/kcms/detail/detail.aspx?dbCode=cjfq&filename=JSJC2000S1014&dbname=CJFD9902
校园网络建设及网络安全	计算机工程	2000	2000年S1期	【作者】 袁景 ； 汪赫瑜 ； 【Author】       Yuan Jing, Wang Heyu (Liaoning Technical University, Fuxin, 123000) 【机构】 辽宁工程技术大学!阜新123000 ；	校园网 ； 网络安全 ； 办公自动化 ； University’s campus network: Safe network: Office automation ；	本文介绍了我校校园网的总体结构和功能，以及管理信息系统在我校的发展。因为网络能够及时收集、整理、发布学校有关的信息，实现信息的交流和共享，从而推动了我校办公网给自动化，提高了管理水平。同时还介绍了网络安全的重要性。	2000年S1期_校园网络建设及网络安全.pdf	http://sso.cdclib.org/interlibSSO/goto/6/=06190596Z93/kcms/detail/detail.aspx?dbCode=cjfq&filename=JSJC2000S1015&dbname=CJFD9902
应用Cable Modem技术创建天津大学宽带网	计算机工程	2000	2000年S1期	【作者】 姜琳 ； 金志刚 ； 鹿凯宁 ； 【Author】       Jiang Lin, Jin Zhigang, Lu Kaining (Network Center of Tianjin University, Tianjin 300072) 【机构】 天津大学网络中心!天津300072 ；	CableModem ； HFC ； ADSL ； S-CDMA ； 宽带 ； Cable modem ； HFC ； ADSL ； S-CDMA ； Broadband ；	本文讨论了两种宽带接入技术，ＡＤＳＬ技术和Ｃａｂｌｅ Ｍｏｄｅｍ技术，着重介绍了Ｃａｂｌｅ Ｍｏｄｅｍ的第二代调制技术Ｓ－ＣＤＭＡ；并以天津大学宽带网为例，介绍了利用 Ｃａｂｌｅ Ｍｏｄｅｍ技术改建现有 ＣＡＷ网，构建高速宽带综合信息网的设计与实现。	2000年S1期_应用Cable+Modem技术创建天津大学宽带网.pdf	http://sso.cdclib.org/interlibSSO/goto/6/=06190596Z93/kcms/detail/detail.aspx?dbCode=cjfq&filename=JSJC2000S1016&dbname=CJFD9902
虚拟网络技术(VLAN)在贵州大学校园网中的应用	计算机工程	2000	2000年S1期	【作者】 高鸿峰 ； 傅光轩 ； 【Author】       Gao Hongfeng, Fu Guangxuan (Network Center Guizhou University, Guiyang 550025) 【机构】 贵州大学计算机网络中心!贵阳550025 ；	TCP/IP ； VLAN ； 校园网 ； TCP/IP ； VLAN ； Campus network ；	ＶＬＡＮ是指网络中的站点不拘泥于所处的物理位置，而可以根据需要灵活地加入不同的逻辑子网中的一种网络技术。ＶＬＡＮ技术在校园网中的应用，提高了校园网的可管理性、灵活性、安全性。	2000年S1期_虚拟网络技术(VLAN)在贵州大学校园网中的应用.pdf	http://sso.cdclib.org/interlibSSO/goto/6/=06190596Z93/kcms/detail/detail.aspx?dbCode=cjfq&filename=JSJC2000S1017&dbname=CJFD9902
中专学校校园网规划建设和管理	计算机工程	2000	2000年S1期	【作者】 曹钧尧 ； 【Author】       Cao Junyao (Nantong Agricultural College, Jiangsu, Nantong 226007) 【机构】 江苏省南通农业学校!南通226007 ；	中专学校 ； 校园网 ； 规划 ； 建设 ； 管理 ； Technical secondary school ； Campus network ； Program ； Building ； Management ；	随着信息技术的发展，网络技术正逐步进入校园，由于ＣＥＲＮＥＴ的发展，教育网络化的需要，全国有数千所中专学校将建立校园网，如何建立先进的计算机校园信息网络，管好、用好校园网，使其充分发挥作用，这是摆在每个中专学校面前的重要问题。本文叙述了规划建设和管理校园网的体会看法，供一些欲建设校园网的学校借鉴。	2000年S1期_中专学校校园网规划建设和管理.pdf	http://sso.cdclib.org/interlibSSO/goto/6/=06190596Z93/kcms/detail/detail.aspx?dbCode=cjfq&filename=JSJC2000S1018&dbname=CJFD9902
VLAN技术在提高网络传输中的应用	计算机工程	2000	2000年S1期	【作者】 付海涛 ； 彭雷震 ； 乔华 ； 【Author】       Fu Haitao, Peng Leizhen, Qiao Hua (The Chigang School of First Military Medical University, Guangzhou 510315) 【机构】 第一军医大学分校!广州510315 ；	VLAN ； 多媒体 ； IP ； VLAN ； Multimedia ； IP ；	为了减少该校多媒体教学子网的网络拥塞，提高网络传输速率，采用了基于交换端口的ＶＬＡＮ技术，配合相关网络操作系统的设置，对该校多媒体教学子网进行了ＶＩＡＮ划分，实现了超级并联，更好地保证了网络教学的顺利进行。	2000年S1期_VLAN技术在提高网络传输中的应用.pdf	http://sso.cdclib.org/interlibSSO/goto/6/=06190596Z93/kcms/detail/detail.aspx?dbCode=cjfq&filename=JSJC2000S1019&dbname=CJFD9902
电子选举系统的基本框架与信息流程	计算机工程	2000	2000年S1期	【作者】 谢金宝 ； 刘晖波 ； 【Author】       Xie Jinbao, Liu Huibo (Network Information Center, Shanghai Jiaotong University, Shanghai 200030 ) 【机构】 上海交通大学网络信息中心!上海200030 ；	电子选举模型 ； 管理机构 ； 匿名性 ； 公正人群体 ； Electronic vole model ； Administrative organization: Anonymous ； Justice person group ；	本文分析现有电子选举模型的基本框架和信息流程，指出了它的安全漏洞，在此基础上提出了一个新的电子选举模型的基本框架和信息流程。	2000年S1期_电子选举系统的基本框架与信息流程.pdf	http://sso.cdclib.org/interlibSSO/goto/6/=06190596Z93/kcms/detail/detail.aspx?dbCode=cjfq&filename=JSJC2000S1020&dbname=CJFD9902
DSS类数字签名方案的软件开发	计算机工程	2000	2000年S1期	【作者】 张玉清 ； 吴建平 ； 李星 ； 肖国镇 ； 【Author】       Zhang Yuqing, Wu Jianping, Li Xing, Xiao Guozhen (1.Network Research Center of Tsinghua University, Beijing 100084; 2.Information Security Institute, Xidian University, Xi’an 710071) 【机构】 清华大学CERNET网络中心!北京100084 ； 西安电子科技大学信息保密研究所!西安710071 ；	软件开发 ； 数字签名 ； DSS ； Software developing: Digital signature ； DSS ；	本文以数字签名标难ＤＳＳ改进方案为基础，进行了改进数字签名方案的软件开发。作者构造了数字签名软件的数据结构，并设计和实现了数字签名软件的各种算法，同时就加快算法实现速度进行了改进。	2000年S1期_DSS类数字签名方案的软件开发.pdf	http://sso.cdclib.org/interlibSSO/goto/6/=06190596Z93/kcms/detail/detail.aspx?dbCode=cjfq&filename=JSJC2000S1021&dbname=CJFD9902
网络信息监听器的设置模型及求解	计算机工程	2000	2000年S1期	【作者】 许勇 ； 张凌 ； 汤立群 ； 张平 ； 【Author】       Xu Yong, Zhang Ling, Tang Liqun, Zhang Ping (Information Network Engineering and Research Center, SCUT Guangzhou 510640) 【机构】 华南理工大学信息网络工程研究中心!广州510640 ；	网络 ； 信息流 ； meter ； 最小覆盖问题 ； Network ； Traffic flow ； Meter: Minimum-cover problem ；	本文研究了大型网络信息流测量中信息监听器ｍｅｔｅｒ的优化设置问题。应用图论知识描述了网络的拓扑结构及行为，引入了最小覆盖问题，建立了信息监听器ｍｅｔｅｒ设置问题的数学模型，结合网络结构的特点，给出了有效的优化算法。本文的工作为ｍｅｔｅｒ的优化设置问题提供了一种新方法。	2000年S1期_网络信息监听器的设置模型及求解.pdf	http://sso.cdclib.org/interlibSSO/goto/6/=06190596Z93/kcms/detail/detail.aspx?dbCode=cjfq&filename=JSJC2000S1022&dbname=CJFD9902
网络应用系统统一口令认证的研究与实现	计算机工程	2000	2000年S1期	【作者】 刘启新 ； 蒋东兴 ； 石碞 ； 沈锡臣 ； 【Author】       Liu Qixin, Jiang Dongxing, Shi Yan, Shen Xichen (Computer and Information Management Center, Tsinghua Univ., Beijing 100084) 【机构】 清华大学计算机与信息管理中心!北京100084 ；	口令 ； 认证 ； 认证服务器 ； Kerberos ； RADIUS ； Password ； Authentication ； Authentication server ； Kerberos ； RADIUS ；	随着网络的发展，网络应用系统不断增加，迫切要求能够提供一个安全、可靠、高效的口令认证系统。本文研究了认证系统的需求，提出了一套安全、可靠、高效的口令认证算法，并着重介绍了统一口令认证系统的设计与实现的关键技术。	2000年S1期_网络应用系统统一口令认证的研究与实现.pdf	http://sso.cdclib.org/interlibSSO/goto/6/=06190596Z93/kcms/detail/detail.aspx?dbCode=cjfq&filename=JSJC2000S1023&dbname=CJFD9902
一个新的群签名方案	计算机工程	2000	2000年S1期	【作者】 陈恺 ； 祝世雄 ； 【Author】       Chen Kai, Zhu Shixiong (1.State Key Lab on ISN, Institute of Information Security and Privacy, Xidian Univ., Xi’an 710071; 2.National Lab for Secure Communications, Southwest Communications Institute, Chengdu 610041 ) 【机构】 西安电子科技大学ISN国家重点实验室 ； 信息保密研究所!西安710071 ； 信息产业部电子第30研究所国家安全通信实验室!成都610041 ；	群签名 ； 离散对数问题 ； 密码学 ； Group signature: Discrete logarithm problem: Cryptography ；	文中提出了一个新的群签名方案，该方案的安全性基于离散对数困难问题，其运行效率比已有的同类方案高。	2000年S1期_一个新的群签名方案.pdf	http://sso.cdclib.org/interlibSSO/goto/6/=06190596Z93/kcms/detail/detail.aspx?dbCode=cjfq&filename=JSJC2000S1024&dbname=CJFD9902
Windows NT安全性模型及其应用	计算机工程	2000	2000年S1期	【作者】 秦拯 ； 吴中福 ； 廖晓峰 ； 李华 ； 邹建军 ； 王康 ； 【Author】       Qin Zheng, Wu Zhongfu, Liao Xiaofeng, Li Hua, Zou Jianjun, Wang Kang (1 .Network Research Center of Chongqing University, Chongqing 400044; 2.School of Business Administration of Chongqing University, Chongqing 400044) 【机构】 重庆大学网络中心!重庆400044 ； 重庆大学管理学院!重庆400044 ；	网络安全 ； WindowsNT ； 安全模型 ； Network security ； Windows NT Security model ；	首先给出了Ｗｉｎｄｏｗｓ ＮＴ安全性模型，然后基于该模型，提出了一些提高Ｗｉｎｄｏｗｓ ＮＴ网络安全性的技术措施。这些技术措施的可行性已在企业和高校中得以验证。	2000年S1期_Windows+NT安全性模型及其应用.pdf	http://sso.cdclib.org/interlibSSO/goto/6/=06190596Z93/kcms/detail/detail.aspx?dbCode=cjfq&filename=JSJC2000S1025&dbname=CJFD9902
基于审计的入侵检测系统	计算机工程	2000	2000年S1期	【作者】 刘美兰 ； 南相浩 ； 姚京松 ； 【Author】       Liu Meilan, Nan Xianghao, Yao Jingsong (Beijing North Computation Center, Beijing 100091 ) 【机构】 北京北方计算中心!北京100091 ；	审计 ； 审计跟踪 ； 入侵检测系统 ； Audit: Audit trail: Intrusion detection system ；	大多数操作系统、数据库系统及应用系统都提供了某种审计机制，但通常情况下审计信息仅被作为一种事后的证据。这样便浪费了这些对于保障信息系统安全具有重大意义的宝贵资源。因此，将审计跟踪与入侵检测结合起来，实现基于主机的实时入侵检测是非常有意义的。分析了审计跟踪遇到的问题及基本原理，探讨了基于审计的入侵检测系统的目标及关键技术。	2000年S1期_基于审计的入侵检测系统.pdf	http://sso.cdclib.org/interlibSSO/goto/6/=06190596Z93/kcms/detail/detail.aspx?dbCode=cjfq&filename=JSJC2000S1026&dbname=CJFD9902
