title	journal_name	year	issue	author	keywords	summary	pdf_filename	article_url
多媒体在ATM网上的应用	计算机工程	1996	1996年S1期	【作者】 陈淑君 ； 马新才 ； 于毅民 ； 金尊和 ； 周勇 ； 张良杰 ； 【机构】 IBM中国研究中心!北京100085 ；	媒体应用 ； 带宽要求 ； 电视会议系统 ； 视频会议 ； 广播技术 ； 网络带宽 ； 视频存储 ； ATM ； 可视化应用 ； RSVP ；	<正>多媒体应用通常指的是视频广播和视频会议.它被认为是安装ATM从现存的LAN和WAN迁移到ATM的关键因素.这是因为多媒体应用对网络有特殊要求的一些特性.(1)带宽要求第一个特性是高带宽要求.当前出现的多媒体技术、视频存储和广播技术以及用户不断增加的对高速信息获取的期望正在产生一种应用环境,这种应用环境利用高速ATM网的好处是显而易见的.当服务器是超级计算机,它的输出是巨大的,用户在客户机上获取数据需要更多的网络带宽.超级计算机支持的可视化应用出现在许多早期的ATM网上,如分子研究、天气图案以及动画产品.在上面的许多情况下,在客户机上的用户是高薪水和高技能的专家.时间的有效利用既对专家有益又对他们的雇主有益.节省他们的时间成为安装ATM的一个理由.“时间就是金钱”在今天的全球金融市场已变得十分明显.另外缩短开发时间能够节省	1996年S1期_多媒体在ATM网上的应用.pdf	http://sso.cdclib.org/interlibSSO/goto/6/=06190596Z93/kcms/detail/detail.aspx?dbCode=cjfq&filename=JSJC1996S1000&dbname=CJFD9498
Intranet—下个世纪信息技术的热潮	计算机工程	1996	1996年S1期	【作者】 马永亨 ； 郭雪梅 ； 【机构】 DEC电脑中国有限公司!上海200001 ；	Internet/Intranet ； 产品 ； 技术 ； Digital解决方案 ； :Internet/Intranet/product/technology/Digital ； solution ；	详细论述了Internet的历史演变过程.目前Internet/Intranet全世界的应用状况及Digital公司在Internet/Intranet上所提供的先进技术及产品.	1996年S1期_Intranet—下个世纪信息技术的热潮.pdf	http://sso.cdclib.org/interlibSSO/goto/6/=06190596Z93/kcms/detail/detail.aspx?dbCode=cjfq&filename=JSJC1996S1001&dbname=CJFD9498
SGI的Internet/Intranet能为上海信息港做什么	计算机工程	1996	1996年S1期		图形技术 ； 网络融合 ； 计算技术 ； 宽带通信 ； 数字信号处理 ； SGI ； 信息港 ； 历史时代 ； 计算机系统 ； 三维图形 ；	<正>近年来,宽带通信、数字信号处理、多媒体图形技术、高性能CPU及超级计算机系统等关键技术的发展,使计算技术进入了以“网络为中心”的崭新历史时代,SGI的计算机与通讯网络融合在一起,成为通往信息高速公路的一座桥梁——SGI的魅力何在?WWW与Internet的最大区别在于它能以完美的方式处理声音、图像、图形、动画等多媒体	1996年S1期_SGI的Internet+Intranet能为上海信息港做什么.pdf	http://sso.cdclib.org/interlibSSO/goto/6/=06190596Z93/kcms/detail/detail.aspx?dbCode=cjfq&filename=JSJC1996S1002&dbname=CJFD9498
Trend of Network Services and NEC’s Approach	计算机工程	1996	1996年S1期	【作者】 NaoshiShima ； 【机构】 VicePresident ； MultimediaServices ； NECCorporation ；	s Approach ； Trend ；	<正>1 A Decade of Experience in Offering Network Services in Japan2 Why Internet Now?2.1 The Internet as the Standard.bearer of Multimedia2.2 The Internet up to Now2.3 PC Online Services vs.Internet2.4 Intranct and Electronic Commerce Services to Come2.5 Commercial Internet Services as Business	1996年S1期_Trend+of+Network+Services+and+NEC’s+Approach.pdf	http://sso.cdclib.org/interlibSSO/goto/6/=06190596Z93/kcms/detail/detail.aspx?dbCode=cjfq&filename=JSJC1996S1003&dbname=CJFD9498
信息港建设中的上海邮电	计算机工程	1996	1996年S1期	【作者】 张维华 ； 【机构】 上海邮电管理局!副局长上海信息港领导小组办公室副主任 ； 上海200085 ；	信息港 ； 通信建设 ； 通信平台 ； 城市发展战略 ； 世界先进水平 ； 应用系统 ； 酝酿阶段 ； 应用信息系统 ； 传送平台 ； 信息枢纽 ；	<正>酝酿已久的上海信息港工程已正式启动.在市委市府的领导下为建设信息港,实现上海城市发展战略的宏伟目标,包括上海邮电在内的各行各业都已经行动起来,这大大加速了上海的信息化进程.近年来,上海邮电在政府和社会各界的支持下,通信建设取得了一些成绩,而积极参与上海信息港建设是上海邮电面向21世纪的希望工程.在信息港工程酝酿初期,上海邮电就积极地参与了信息港工作规划的起草,在酝酿阶段,上海邮电起了积极的作用.上海邮电在今后信息港建设中的使命是:跟踪世界先进水平,加速信息通信平台建设,为社会应用信息系统和公众信息服务系统打下坚实的基础.积极参与社会应用系统和公众信息服务系统的开发和建设,加速上海信息化进程.	1996年S1期_信息港建设中的上海邮电.pdf	http://sso.cdclib.org/interlibSSO/goto/6/=06190596Z93/kcms/detail/detail.aspx?dbCode=cjfq&filename=JSJC1996S1004&dbname=CJFD9498
网络互连与信息集成的方法综述	计算机工程	1996	1996年S1期	【作者】 张根度 ； 高传善 ； 张世永 ； 【Author】       Zhang Gendu Gao Chuanshan Zhang Shiyong (Networking and Infromation Engineering Centre,Fudan University Shanghai 200433) 【机构】 复旦大学网络与信息工程中心!上海200433 ；	国际互连网 ； 环球网 ； 内部网 ； 防火墙 ； 代理 ； 缓存 ； 开放系统互连 ； : ； Internet/WWW/Intranet/firewall/proxy/cache/OSI ；	90年代以来,Internet得到了神速发展,网上用户与信息以几何级数增长,近年来Intranet崛起,所有这些标志着网络时代的开始.文章论述了作者在Internet和Intranet的体系结构、防火墙、代理与缓存、信息管理、Intranet互连、安全机制以及在TCP/IP上扩展OSI网络功能等方面的研究、开发和工程应用方面的成果.	1996年S1期_网络互连与信息集成的方法综述.pdf	http://sso.cdclib.org/interlibSSO/goto/6/=06190596Z93/kcms/detail/detail.aspx?dbCode=cjfq&filename=JSJC1996S1005&dbname=CJFD9498
上海教育与科研网的建设	计算机工程	1996	1996年S1期	【作者】 马范援 ； 汪为农 ； 李家滨 ； 【Author】       Ma Fanyuan Wang Weinong Li Jiabin (Shanghai Jiao Tong University Shanghai 200030) 【机构】 上海交通大学!上海200030 ；	Internet ； 网络拓扑 ； 自治系统 ； 远程教育 ； 远程医疗 ； Internet/network topology/autonomous system/distance learning/telemedicine ；	上海教育与科研网按照中国教育和科研网(CERNET)总体规划进行设计,第一期工程于1996年1月正式开通.该网与CE-RNET和Internet相连,是上海信息港的组成部份.该网的建成将极大地推进上海教育和科研的现代化进程.该文介绍SHE-RNET的设计思想,总体结构,网络中心的建设,主要的应用系统和第二期工程规划.	1996年S1期_上海教育与科研网的建设.pdf	http://sso.cdclib.org/interlibSSO/goto/6/=06190596Z93/kcms/detail/detail.aspx?dbCode=cjfq&filename=JSJC1996S1006&dbname=CJFD9498
The Business of Managing Risk and Network Security:An Exploration of Knowledge Transfer Issues within the Context of Data Security and Countermeasure Trade Offs	计算机工程	1996	1996年S1期	【Author】       Jim MorrisVice President(Trident Data Systems 12701 Fairlakes Circle.Suite 350 Fairfax,VA22033 USA)Jim SnaithPrincipal Lecturer In Business Information Systems(Area of Finance Accounting and Business Information SystemsSouth Bank University Business Schoo	Value - The perceived or intrinsic worth of an asset based on purchase or development costs ； operations costs ； worth of information processed ； recovery expenes ； or any combination thereof. Value is relative to point- of- view.Threat- An cvent ； Value - The perceived or intrinsic worth of an asset based on purchase or development costs ； operations costs ； worth of information processed ； recovery expenes ； or any combination thereof. Value is relative to point- of- view.Threat- An cvent ；	<正>The contemporary environment within which command,control,communications,computers and intelligence (C4I platforms exist, have a number of characteristics. These characteristics may be most obviously identified as interconnectivity, international networking, speed of data transfer, the compact nature of electronic information and rapidly changing technology. Information security professionals employ a variety of approaches in order to counter risks within this complex and fluid environment. The gamut of potential security activities ranges form access control through a variety of auditing techniques to secure data communications. This field is broad and well documented. Indeed, the discipline of network risk management and data security is both well developed and sophisticated.This paper addresses twin themes:i.The fundamental issue of the method by which specific approaches are employed. This is a precursor to the adoption of an eventual strategy.ii.The crucial issues revolving around the fac	1996年S1期_The+Business+of+Managing+Risk+and+Network+Security:An+Exploration+of+Knowledge+Transfer+Issues+within+the+Context+of+Data+Security+and+Countermeasure+Trade+Offs.pdf	http://sso.cdclib.org/interlibSSO/goto/6/=06190596Z93/kcms/detail/detail.aspx?dbCode=cjfq&filename=JSJC1996S1007&dbname=CJFD9498
Virtual University/FernUniversitat—Online	计算机工程	1996	1996年S1期	【作者】 Firoz Kaderali ；	multimedia ； German ； university ； consequently ； Online ； Hagen ；	<正>1 IntroductionIn this paper a concept is presented for the implementation of the FernUniversitat (German University for distance teaching at university level)as a Virtual University viacomputer networks.The Virtual University offers new ways of teaching and learningand enables place and time independent,individual and need oriented,flexible learningby using new multimedia and communications technologies consequently.Unlike knownimplementations.this project concept offers all functions of a university on a computerscreen.	1996年S1期_Virtual+University+FernUniversitat—Online.pdf	http://sso.cdclib.org/interlibSSO/goto/6/=06190596Z93/kcms/detail/detail.aspx?dbCode=cjfq&filename=JSJC1996S1009&dbname=CJFD9498
A Trace-state Based Approach to Specification and Design of Parallel Programs	计算机工程	1996	1996年S1期	【Author】       He Jifeng Oxford University Computing LaboratoryProgramming Research Group Parks Road, Oxford OXl 3QD, England	decompose ； hierarchical ； specification ； refinement ； concurrent ； communicating ； programs ； modular ； verification ； behaviour ；	<正> In this paper they deal with the issue of specification and design of parallel communicatingprocesses. A trace-state based model is introduced to describe the behaviour of concurrent programs. They presenta formal system based on that model to achieve hierarchical and modular development and verification methods. Anumber of refinement rules are used to decompose the specification into smaller ones and calculate program fromthe specification	1996年S1期_A+Trace-state+Based+Approach+to+Specification+and+Design+of+Parallel+Programs.pdf	http://sso.cdclib.org/interlibSSO/goto/6/=06190596Z93/kcms/detail/detail.aspx?dbCode=cjfq&filename=JSJC1996S1010&dbname=CJFD9498
Some Practical Issues Regarding Java Programming	计算机工程	1996	1996年S1期	【Author】       Ming-fang Wang Department of Computer Science, University of Central ArkansasConway, Arkansas 72035 wangm @ panda.cs.uca.eduWu JieShanghai Institute of Computing Tech. Shanghai, China 200040 Telephone: 62520070	Java programming/object- oriented programming/multi - thread ； Java programming/object- oriented programming/multi - thread ；	<正> Java programming language is a major . new development which involves object-oriented programming and computer networking. Here, several examples of Java programs are presented. These examples show some major features that Java language provides, such as multi-thread, exception handling, network application writing, and the usage of Java applets. This article also shows some ways of setting up a Java language programming environment. All these examples are correct and ready to run.	1996年S1期_Some+Practical+Issues+Regarding+Java+Programming.pdf	http://sso.cdclib.org/interlibSSO/goto/6/=06190596Z93/kcms/detail/detail.aspx?dbCode=cjfq&filename=JSJC1996S1011&dbname=CJFD9498
上海信息港工程与网络	计算机工程	1996	1996年S1期	【作者】 彭铮良 ； 【Author】       Peng Zhengliang(East - China Institute of Computer Technology Shanghai 200233) 【机构】 华东计算技术研究所!上海200233 ；	信息资源 ； 应用服务 ； 网络 ； information resources/application service/network ；	讨论了信息港工程的特点、构成和对通信网络的需求.	1996年S1期_上海信息港工程与网络.pdf	http://sso.cdclib.org/interlibSSO/goto/6/=06190596Z93/kcms/detail/detail.aspx?dbCode=cjfq&filename=JSJC1996S1012&dbname=CJFD9498
用户分组数据网网络管理的设计与实现	计算机工程	1996	1996年S1期	【作者】 凌力 ； 张过路 ； 【Author】       Ling Li Zhang Guolu (Network and Information Engineering Centre, Fudan University Shanghai 200433) 【机构】 复旦大学网络与信息工程中心!上海200433 ；	网络管理 ； 网络管理协议 ； 平台 ； network management/ network management protocol / platform ；	文中主要讨论了用户分组数据网网络管理的设计原理和实现方法,包括网管协议的结构和内容、网管体系的基本框架以及与标准网络管理系统的接口方案.文中侧重于阐述网络管理系统的平台、协议、构造和实施等关键技术问题.	1996年S1期_用户分组数据网网络管理的设计与实现.pdf	http://sso.cdclib.org/interlibSSO/goto/6/=06190596Z93/kcms/detail/detail.aspx?dbCode=cjfq&filename=JSJC1996S1013&dbname=CJFD9498
Research of Queuing Disciplines and Their Performances in ATM Switch	计算机工程	1996	1996年S1期	【Author】       Zhao Youjian Luan Guixing Hou Dong Zhang Lu Fu Lizheng(Shenyang Computing Technology Institute, Chinese Academy of Sciences Shenyang 110003)	ATM switch/ queueing discipline/ mean waiting time/ input load ； ATM switch/ queueing discipline/ mean waiting time/ input load ；	<正>This paper introduces the principle of ATM switch, and discusses queueing disciplines and their performances. Authors describe the method of input queueing, output queueing, central queueing, combined input/output queuing, combined input/shared queueing, and multistage queueing in detail. They also present the relations between mean waiting time and input load. The queueing disciplines can be used to design the architecture of Asynchronous Transfer Mode (ATM) switch.	1996年S1期_Research+of+Queuing+Disciplines+and+Their+Performances+in+ATM+Switch.pdf	http://sso.cdclib.org/interlibSSO/goto/6/=06190596Z93/kcms/detail/detail.aspx?dbCode=cjfq&filename=JSJC1996S1014&dbname=CJFD9498
ATM网络中的业务建模	计算机工程	1996	1996年S1期	【作者】 候东 ； 赵有健 ； 栾贵兴 ； 付立政 ； 张路 ； 吴会龙 ； 【Author】       Hou Dong Zhao Youjian Luan Guixing Fu LizhengZhang Lu Wu Huilong (Institute of Shenyang Computing Technology, Chineac Academy of Sciences Shenyang 110003) 【机构】 中科院沈阳计算技术研究所!沈阳110003 ；	异步转移模式 ； 业务建模 ； 随机过程 ； asynchronous transfer mode (ATM)/traffic modeling/stochastic proceses ；	目前,ATM作为一种新的基于信元的传输和交换技术.已被ITU—T选定为实现BISDN的最终转移模式.文章针对BISDN网络中所存在的具有各种特性的业务源,提出了业务建模的基本方法及作为业务模型选择标准的一个理想模型所应具备的特点.进而,系统地分析和总结了当前在ATM网络分析和模拟中所使用的典型业务模型的主要特性.	1996年S1期_ATM网络中的业务建模.pdf	http://sso.cdclib.org/interlibSSO/goto/6/=06190596Z93/kcms/detail/detail.aspx?dbCode=cjfq&filename=JSJC1996S1015&dbname=CJFD9498
网络虚拟计算机—World Wide Computer	计算机工程	1996	1996年S1期	【作者】 杜跃进 ； 方滨兴 ； 【Author】       Du Yuejin, Fang Binxing(The Industrial University of Haerbin.PACT Laboratory of Computer and Engineering Haerbin 150001) 【机构】 哈尔滨工业大学计算机科学与工程系PACT实验室!哈尔滨150001 ；	Internet ； Web ； 环球计算机 ； 超级计算 ； 数据流描述协议 ； Internet/Web/WWC/super computing/data flow descriptor protocol(DFDP) ；	以网络为中心的计算机被认为是计算技术的下一代重大发展阶段,用户希望他们的计算机能够很容易地联合工作,实现比单机强大得多的计算功能,由此产生了WWC(World Wide Computer)的概念.该文介绍了的一些关于WWC的描述、WWC的工作模式、WWC的应用价值、WWC的协议、实现WWC面临的技术难点等,并给出了一个简单演示程序的URL.	1996年S1期_网络虚拟计算机—World+Wide+Computer.pdf	http://sso.cdclib.org/interlibSSO/goto/6/=06190596Z93/kcms/detail/detail.aspx?dbCode=cjfq&filename=JSJC1996S1016&dbname=CJFD9498
支持用户业务的ATM网络适配层协仪	计算机工程	1996	1996年S1期	【作者】 胡文华 ； 朱世传 ； 陈雷 ； 陈锦江 ； 【Author】       Hu Wenhua Zhu Shiwei Chen Lei Chen Jingjiang (Huazbong University of Science and Technology Wuhan 430074) 【机构】 华中理工大学!武汉430074 ；	ATM适配层 ； 分段与重装子层 ； 汇聚子层 ； 协议数据单元 ； ATM adaptation layer/segnentation and reassembly(SAR)/ convergence sublayer(CS)/protocoldata unit ；	ATM适配层(AAL)在ATM网络上支持语音、视频、数据等通信业务,基本功能是高层协议数据单元和ATM信元的转换.文中详细讨论了AAL1～AAL5协议及支持的业务,包括SAR子层、CS子层的协议数据单元格式、操作方式.最后,提出了AAL协议存在的问题和需研究的课题.	1996年S1期_支持用户业务的ATM网络适配层协仪.pdf	http://sso.cdclib.org/interlibSSO/goto/6/=06190596Z93/kcms/detail/detail.aspx?dbCode=cjfq&filename=JSJC1996S1017&dbname=CJFD9498
Novell局域网与Internet的连接方法	计算机工程	1996	1996年S1期	【作者】 刘穷宇 ； 【Author】       Liu Qiongyu(Department of Computer Science, Shanghai Jiao Tong University Shanghai 200030) 【机构】 上海交通大学计算机系!上海200030 ；	传输控制协议/网际协议 ； 开放式数据链路接口 ； 协议栈 ； 网关 ； TCP/IP/ODI(Open Datalink Interface)/stack/gateway ；	文中介绍了两种把Novell局域网连入Internet的方法,一种为双协议栈方法,另一种为单地址网关方法,并给出实例加以说明.	1996年S1期_Novell局域网与Internet的连接方法.pdf	http://sso.cdclib.org/interlibSSO/goto/6/=06190596Z93/kcms/detail/detail.aspx?dbCode=cjfq&filename=JSJC1996S1018&dbname=CJFD9498
Internet网络信息检索模式	计算机工程	1996	1996年S1期	【作者】 朱战备 ； 【Author】       Zhu Zhanbei(China Europe International Business School Shanghai 200240) (E- mail, ceibsa@public.sta.net.cn) 【机构】 中欧国际工商学院!上海200240 ；	Internet ； WWW ； 信息检索 ； 检索工具 ； internet/WWW/infomation retrieval/searching tool ；	Internet信息检索模式作为一种新型网络检索方式.其本质是最终的联机检索形式.文中分析这种检索模式的特点,指导用户如何使用WWW检索工具,以及如何选择最有效的工具检索出最理想的结果,最后还对各种检索工具进行了分析和评价.	1996年S1期_Internet网络信息检索模式.pdf	http://sso.cdclib.org/interlibSSO/goto/6/=06190596Z93/kcms/detail/detail.aspx?dbCode=cjfq&filename=JSJC1996S1019&dbname=CJFD9498
基于大中型企业的网络拓扑建设	计算机工程	1996	1996年S1期	【作者】 宋革联 ； 俞蒙槐 ； 胡上序 ； 【Author】       Song Gelian Yu Menghuai Hu Shangxu(Chemical Engineering Department, Zhejiang University Hangzhou 310027) 【机构】 浙江大学化工系!杭州310027 ；	MIS系统 ； 网络拓扑 ； 树型结构 ； Mis/network topology/level- tree structure ；	从大中型企业MIS(Management Information System)系统的实际需要出发,将软件工程的方法引入到网络工程建设中去,提出了多种网型并存的分层树型结构和企业MIS网络分层逻辑模型.分层树型结构和模型综合了网络的开放性、互操作性、可用性、可伸缩性以及网络的经济性.	1996年S1期_基于大中型企业的网络拓扑建设.pdf	http://sso.cdclib.org/interlibSSO/goto/6/=06190596Z93/kcms/detail/detail.aspx?dbCode=cjfq&filename=JSJC1996S1020&dbname=CJFD9498
信息高速公路与中文信息处理技术	计算机工程	1996	1996年S1期	【作者】 胡宜课 ； 【Author】       Hu Yike(Jiangxi Institute of Computer Technology Nanchang 330002) 【机构】 江西省计算技术研究所!南昌330002 ；	信息高速公路 ； 中文信息处理 ； 国际互连网络 ； Information Super - Hightway/Chinese information processing/Internet ；	随着信息时代的来临,汉字与计算机之间的固有矛盾更显尖锐,中文信息处理技术面临新的挑战与机遇.自从Internet(国际互连网络)在美国国防部ARPANet网的基础上逐步形成,近年来在国际上迅速发展起来.据有关报导.预计2000年用户数将高达10亿.网上的各类信息资源如浩瀚的汪洋大海,对于一个国家的科学技术的进步和国民经济的发展具有举足轻重的战略意义.90年代以来,随着Internet国际化的进程,Internet的本土化也成为非英语国家,特别是非拼音文字国家面临的一大问题.这个问题解决不好,即使有了先进的网络技术,信息流通渠道不畅的问题仍然可能存在.在建设中国的信息高速公路时,中文信息处理技术也必将面临新的挑战和机遇.中文信息处理技术在中国信息高速公路的建设中不但是完全必要的,而且是大有可为的.说到中文信息处理技术.有人可能会说:这个问题不是早已解决了吗?不错.现在汉字不但可以进入计算机,而且可以利用计算机来进行编辑、排版、打印等各种处理.然而中文信息处理技术仍然存在一系列有待解决的特殊问题.当汉字进入Internet时,这些问题或矛盾更加尖锐化了.虽然Internet网上并非绝对不能处理汉字.但处理效率和质量都很差强人意,与信息高速公的要求很不相称.主要表现在:(1)汉字的输入;(2)汉字的机内存储及	1996年S1期_信息高速公路与中文信息处理技术.pdf	http://sso.cdclib.org/interlibSSO/goto/6/=06190596Z93/kcms/detail/detail.aspx?dbCode=cjfq&filename=JSJC1996S1021&dbname=CJFD9498
TOPLINK——银行卡网络交换中心应用软件	计算机工程	1996	1996年S1期	【作者】 云德华 ； 余永进 ； 刘生 ； 沈侃民 ； 史建翔 ； 李伟 ； 【Author】       Yun Dehua Yu Yongjin Liu Seng Shen Kanmin Shi Jianxiang Li Wei(Shanghai Tandem Software Systems Co.Ltd. Shanghai 200233) 【机构】 上海华腾软件系统有限公司!上海200233 ；	金融电子化 ； ATM/POS交易交换中心 ； 远程网络通讯 ； 联机事务处理 ； financial electronics/ATM/POS transaction switch system/wide area network communication/on- line transaction processing ；	TOPLINK是第一个在我国大陆投入运行的ATM/POS交换中心应用软件系统,该系统由华腾软件系统有限公司自主开发,用于交换和控制一个省/市范围内不同银行之间的自动柜员机(ATM)或销售点终端(POS)上的交易.TOPLINK的设计和开发所包括的技术有:远程网络通讯、联机事务处理、客户机/服务器、数据安全保密、图形用户界面、多线程进程等.TOPLINK的开发过程贯彻了软件工程管理规范,诸如:组织机构和职责、软件测试、版本及修改控制、仿真及模拟等.	1996年S1期_TOPLINK——银行卡网络交换中心应用软件.pdf	http://sso.cdclib.org/interlibSSO/goto/6/=06190596Z93/kcms/detail/detail.aspx?dbCode=cjfq&filename=JSJC1996S1022&dbname=CJFD9498
联邦式多数据库系统的设计和实现	计算机工程	1996	1996年S1期	【作者】 吉增瑞 ； 【Author】       Ji Zengrui (Jangnan Instifute of Computer Technology Wuxi 214083) 【机构】 江南计算技术研究所!无锡214083 ；	数据库 ； 数据库系统 ； 联邦式数据库系统 ； database/database system/federated database system ；	该文首先给出联邦式数据库系统的系统结构,并对联邦式数据库系统命令处理流程作了简要介绍.然后,围绕ZHXX系统的设计,讨论了设计和实现联邦式多数据库系统要考虑的主要问题.	1996年S1期_联邦式多数据库系统的设计和实现.pdf	http://sso.cdclib.org/interlibSSO/goto/6/=06190596Z93/kcms/detail/detail.aspx?dbCode=cjfq&filename=JSJC1996S1023&dbname=CJFD9498
