title	journal_name	year	issue	author	keywords	summary	pdf_filename	article_url
自然树木形状的分形模拟	计算机工程	2000	2000年09期	【作者】 张有会 ； 李秀丽 ； 王志巍 ； 王艳君 ； 【Author】       ZHANG Youhui, LI Xiuli, WANG Zhiwei, WANG Yanjun (Department of Computer Science, Hebei Teachers University, Shijiazhuang 050016;  Shijiazhuang College of Advanced Studies for Science & Technology Cadre, Shijiazhuang 050031) 【机构】 河北师范大学计算机系!石家庄050016 ； 石家庄市科技干部进修学院!石家庄050031 ；	分形 ； 树 ； 随机 ； Turbo C ； Fractal ； Tree ； Random ； Turbo C ；	分形树是分形的一个重要分支，是一个典型的具有自相似特点的分形问题．为了更好地描述自然界中树木的形状，实现更加接近于自然树木的模拟，文章给出了在分形的递归过程中，调用随机函数来模拟自然界中树木的方法和用Ｔｕｒｂｏ Ｃ编写的源程序．在使用递归方法画分形树的过程中，每当需要画出新生技之前，对新生枝的倾斜角度和长度分别乘以一个在某范围内随机生成的因子，使树枝的倾斜角度和长度在某确定的范围内随机生成，由此得到更加接近于自然界中树木形状的图形．	2000年09期_自然树木形状的分形模拟.pdf	http://sso.cdclib.org/interlibSSO/goto/6/=06190596Z93/kcms/detail/detail.aspx?dbCode=cjfq&filename=JSJC200009043&dbname=CJFD9902
事件驱动面向对象的软件白盒测试法初探	计算机工程	2000	2000年09期	【作者】 张钢 ； 葛卫民 ； 王永铭 ； 陈立新 ； 彭华慧 ； 储林生 ； 【Author】       ZHANG Gang, GE Weimin, WANG Yongming, CHEN Lixin, PENG Huahui, CHU Linsheng (Computer Department of Information College, Tianjin University, Tianjin 300072; Computer Section of Enterprise Management Department Guangdong Kelon Corp.. Guangdong 528303) 【机构】 天津大学信息学院计算机系!天津 300072 ； 广东科龙集团企管部电脑科!广东 528303 ；	白盒测试 ； 事件驱动 ； 测试用例设计 ； White box method ； Event-driven ； Test example design ；	分析了面向过程的白盒测试方法在应用于事件驱动面向对象的软件测试时存在的不足，提出了事件覆盖、事件－语句覆盖、事件－判定覆盖等６个覆盖准则，对面向过程的白盒测试方法进行了扩充，使白盒测试法能够有效地对事件驱动面向对象软件进行测试．给出了结合ＰＥＡＤ图设计测试用例的方法．	2000年09期_事件驱动面向对象的软件白盒测试法初探.pdf	http://sso.cdclib.org/interlibSSO/goto/6/=06190596Z93/kcms/detail/detail.aspx?dbCode=cjfq&filename=JSJC200009044&dbname=CJFD9902
一种新型NVOD系统的研究与实现	计算机工程	2000	2000年09期	【作者】 潘洪波 ； 张大力 ； 【Author】       PAN Hongbo, ZHANG Dali (Department of Automation, Tsinghua University, Beijing 100084) 【机构】 清华大学自动化系!北京 100084 ；	准视频点播 ； 有线电视 ； 公共电话网 ； NVOD ； CATV ； PSTN ；	近来的技术发展使视频按需服务成为可能．提出了一种基于有线电视网（ ＣＡＴＶ）和公共电话网（ＰＳＴＮ）的ＮＶＯＤ系统，并阐述了该系统的设计思想与关键技术．	2000年09期_一种新型NVOD系统的研究与实现.pdf	http://sso.cdclib.org/interlibSSO/goto/6/=06190596Z93/kcms/detail/detail.aspx?dbCode=cjfq&filename=JSJC200009045&dbname=CJFD9902
在局域网中应用会议电视的一些探讨	计算机工程	2000	2000年09期	【作者】 邬争春 ； 胡芝华 ； 周舒 ； 【Author】       WU Zhengchun, HU Zhihua, ZHOU Shu (Dept. of Computer Science, Fudan University, Shanghai 200433) 【机构】 复旦大学计算机系!上海200433 ；	会议电视 ； 局域网 ； H.323 ； 网络设计 ； Video conference ； LAN ； H.323 ； Network design ；	介绍了在局域网中传送会议电视的国际标准及相关设备的功能．对在局域网中使用会议电视可能会遇到的问题和应该注意的事项进行了讨论，并用实际的例子加以阐述．最后，文章对局域网中会议电视的发展前景作出了乐观的评价．	2000年09期_在局域网中应用会议电视的一些探讨.pdf	http://sso.cdclib.org/interlibSSO/goto/6/=06190596Z93/kcms/detail/detail.aspx?dbCode=cjfq&filename=JSJC200009046&dbname=CJFD9902
ATM E1用户-网络接口适配器的设计和实现	计算机工程	2000	2000年09期	【作者】 陈则盛 ； 蔡晓华 ； 诸鸿文 ； 顾尚杰 ； 【Author】       CHEN Zesheng, CAI Xiaohua, ZHU Hongwen, GU Shangjie (Modern Communication Technology Institute, Shanghai Jiaotong University, Shanghai 200030) 【机构】 上海交通大学现代通信研究所!上海 200030 ；	ATM用户-网络接口 ； E1 ； 适配器 ； 传输汇聚子层 ； 物理媒质子层 ； ATM UNI ； E1 ； Adapter ； TC ； PM ；	ＡＴＭ网络接口适配器是用户计算机与 ＡＴＭ网络进行交互所必须的网络接口设备．Ｅ１是现有通信网中广泛使用的一种接口．该文就ＡＴＭ Ｅ１用户－网络接口适配器的相关协议、系统硬件结构及功能实现进行了较为详细的讨论，并给出逻辑分析仪实测的结果．	2000年09期_ATM+E1用户-网络接口适配器的设计和实现.pdf	http://sso.cdclib.org/interlibSSO/goto/6/=06190596Z93/kcms/detail/detail.aspx?dbCode=cjfq&filename=JSJC200009047&dbname=CJFD9902
万兆以太网10GBASE-WX PHY研究	计算机工程	2000	2000年09期	【作者】 杨明 ； 【Author】       YANG Ming (Department of Computer Science, East China Normal University, Shanghai 200062) 【机构】 华东师范大学计算机系!上海200062 ；	万兆以太网 ； 物理层 ； 物理编码子层 ； 物理附件子层 ； Gigabit Ethernet ； PHY ； PCS ； PMA ；	对万兆以太网１０ＧＢＡＳＥ－ＷＸ物理层技术进行了介绍，包括了物理编码子层、物理附件子层功能描述，并对关键的ＰＣＳ子层技术的实现进行详细的讨论，对有关的算法进行了分析．	2000年09期_万兆以太网10GBASE-WX+PHY研究.pdf	http://sso.cdclib.org/interlibSSO/goto/6/=06190596Z93/kcms/detail/detail.aspx?dbCode=cjfq&filename=JSJC200009048&dbname=CJFD9902
基于XML技术的电子数据交换	计算机工程	2000	2000年09期	【作者】 肖富军 ； 陈文鏖 ； 胡运发 ； 【Author】       XIAO Fujun, CHEN Wenao, HE Yunfa (Computer Department of Fudan University, Shanghai 200433) 【机构】 复旦大学计算机系!上海200433 ；	扩展标志语言 ； 扩展样式语言 ； 电子数据交换 ； XML技术与EDI结合模型 ； 增值网 ； XML (Extensible Markup Language) ； XSL(Extensible Style Language) ； EDI(Electronic Data Exchange) ； XML/EDI ； VAN (Value-added Network) ；	比较了传统ＥＤＩ与基于ＸＭＬ的ＥＤＩ之间的异同，探讨了ＸＭＬ与ＥＤＩ结合的技术基础；详细地讨论了在Ｉｎｔｅｒｎｅｔ环境下通过ＸＭＬ技术来实现ＥＤＩ的方法，以及具体的实施步骤；同时指出了ＥＤＩ与ＸＭＬ结合能够有效地推动全球电子商务的发展。	2000年09期_基于XML技术的电子数据交换.pdf	http://sso.cdclib.org/interlibSSO/goto/6/=06190596Z93/kcms/detail/detail.aspx?dbCode=cjfq&filename=JSJC200009049&dbname=CJFD9902
基于智能代理的网络监测系统	计算机工程	2000	2000年09期	【作者】 徐再庆 ； 张尧弼 ； 【Author】       XU Zaiqing, ZHANG Yaobi (Department of Computer Science, Shanghai Jiaotong University, Shanghai 200030) 【机构】 上海交通大学计算机系!上海 200030 ；	内部网 ； 智能代理 ； 网络监测系统 ； 访问控制策略 ； 模糊逻辑 ； Intranet ； Intelligent agent ； Network monitoring system ； Access control policy ； Fuzzy logic ；	提出了一个基于智能代理的网络监测系统．智能代理采用模糊逻辑方法对连接数据库中的数据进行初步处理，把不能处理的连接信息交给管理员，根据管理员的反馈，修改访问控制策略库和模糊非法词库，并把非法连接记录下来．	2000年09期_基于智能代理的网络监测系统.pdf	http://sso.cdclib.org/interlibSSO/goto/6/=06190596Z93/kcms/detail/detail.aspx?dbCode=cjfq&filename=JSJC200009050&dbname=CJFD9902
面向对象技术在电信综合网管中的应用	计算机工程	2000	2000年09期	【作者】 周舒 ； 胡芝华 ； 邬争春 ； 【Author】       ZHOU Shu, HU Zhihua, WU Zhengchun (Dept.of Computer Science, Fudan University, Shanghai 200433) 【机构】 复旦大学计算机系!上海200433 ；	面向对象技术 ； 综合网络管理系统 ； 网元 ； Object-oriented technology ； Integrated network management ； Network element ；	论述了面向对象技术方法，以及如何在分析和设计电信综合网络管理中运用．	2000年09期_面向对象技术在电信综合网管中的应用.pdf	http://sso.cdclib.org/interlibSSO/goto/6/=06190596Z93/kcms/detail/detail.aspx?dbCode=cjfq&filename=JSJC200009051&dbname=CJFD9902
基于知识库的BDAR分析方法研究	计算机工程	2000	2000年09期	【作者】 石全 ； 李建平 ； 康建设 ； 【Author】       SHI Quan, LI Jianpin, KANG Jianshe (Department of Management Engineering, Ordnance Engineering College, Shijiazhuang 050003) 【机构】 军械工程学院管理工程系!石家庄050003 ；	战场损伤评估与修复 ； 知识库 ； 知识库方法 ； BDAR ； Knowledge base ； Knowledge base method. ；	该文在综述ＢＤＡＲＡ方法的基础上，提出了应用知识库与ＢＤＡＲＡ的集成的思路与实施方法、及ＩＢＤＡＲＡ知识库研制开发的关键技术．	2000年09期_基于知识库的BDAR分析方法研究.pdf	http://sso.cdclib.org/interlibSSO/goto/6/=06190596Z93/kcms/detail/detail.aspx?dbCode=cjfq&filename=JSJC200009052&dbname=CJFD9902
定理证明辅助工具PVS剖析	计算机工程	2000	2000年09期	【作者】 廖宇 ； 杨大军 ； 【Author】       LIAO Yu, YANG Dajun (Department of Computer Science and Technology, Nanjing University, Nanjing 210093) 【机构】 南京大学计算机科学与技术系!南京210093 ；	规约语言 ； 定理证明器 ； 形式化方法 ； Specification language ； Theorem prover ； Formal method ；	ＰＶＳ是斯坦福研究机构开发的强大的规约、验证系统，它的适用领域广泛。在概要介绍ＰＶＳ的构成、功能后，着重分析了ＰＶＳ的规约语言、验证系统的特点，以及使得ＰＶＳ灵活、强大的设计决策和内在机制．	2000年09期_定理证明辅助工具PVS剖析.pdf	http://sso.cdclib.org/interlibSSO/goto/6/=06190596Z93/kcms/detail/detail.aspx?dbCode=cjfq&filename=JSJC200009053&dbname=CJFD9902
基于神经网络的城市供水智能管理系统	计算机工程	2000	2000年09期	【作者】 曾光 ； 梁慧冰 ； 【Author】       ZENG Guang, LIANG Huibing (Dept. of Electrical Engineering, Guangdong Univ. of Technology, Guangzhou 510090) 【机构】 广东工业大学电气工程系!广州510090 ；	神经网络 ； 供水管理 ； 预测 ； 优化调度 ； 地理信息系统 ； Neural network ； Management of water supply: Prediction: Optimize-dispatch: GIS ；	用神经网络，为城市供水管理提供科学可靠分析，进行供水负荷预测和优化调度，是有效的城市供水管理的科学依据．此系统基于地理信息系统（ＧＩＳ）和神经网络，做到了良好的动态图形界面和人机对话环境，具有高度的人工智能，为各级供水和政府部门提供了科学参考，有着巨大的社会和经济利益．	2000年09期_基于神经网络的城市供水智能管理系统.pdf	http://sso.cdclib.org/interlibSSO/goto/6/=06190596Z93/kcms/detail/detail.aspx?dbCode=cjfq&filename=JSJC200009054&dbname=CJFD9902
协作式入侵监测框架及应用实例	计算机工程	2000	2000年09期	【作者】 曹玮 ； 李家滨 ； 【Author】       CAO Wei, LI Jiabin (Computer Department, Shanghai Jiaotong University, Shanghai 200030 ) 【机构】 上海交通大学计算机系!上海200030 ；	协作式入侵监测和反应框架 ； 网络安全 ； 入侵监测 ； Cooperative intrusion detection framework(CIDF) ； Network security ； Intrusion ；	在对网络安士和入侵监测分析的基础上，提出了协作式入侵监测和反应框架（ＣＩＤＦ），它为入侵监测系统提供开放的、灵活可靠的协作手段．最后介绍了一个ＣＩＤＦ应用实例．	2000年09期_协作式入侵监测框架及应用实例.pdf	http://sso.cdclib.org/interlibSSO/goto/6/=06190596Z93/kcms/detail/detail.aspx?dbCode=cjfq&filename=JSJC200009055&dbname=CJFD9902
用OAKLEY密钥确定协议在Internet2上建立安全通信连接	计算机工程	2000	2000年09期	【作者】 张健 ； 熊天放 ； 杨宇航 ； 【Author】       ZHANG Jian, XIONG Tianfang, YANG Yuhang (Shanghai Jiaotong University, Shanghai 200030) 【机构】 上海交通大学!上海200030 ；	OAKLEY协议 ； 网络安全 ； 密钥交换 ； OAKLEY Protocol ； Network security ； Key exchange ；	该文论述了用ＯＡＫＬＥＹ密钥确定协议在Ｉｎｔｅｒｎｅｔ上建立安全通信密钥的方法．ＯＡＫＬＥＹ密钥确定协议使得经过身份认证的双方可以通过一定的协商建立起安全的保密连接，包括采用何种加密算法、保密通信协议和通信密钥等．这个协议的核心是基于Ｄｉｆｆｉｅ－Ｈｅｌｌｍａｎ密钥交换算法的．	2000年09期_用OAKLEY密钥确定协议在Internet2上建立安全通信连接.pdf	http://sso.cdclib.org/interlibSSO/goto/6/=06190596Z93/kcms/detail/detail.aspx?dbCode=cjfq&filename=JSJC200009056&dbname=CJFD9902
用电管理信息系统的数据库设计与优化	计算机工程	2000	2000年09期	【作者】 陈和平 ； 李军 ； 【Author】       CHEN Heping, LI Jun (College of Mechanical Science & Engineering, HUST, Wuhan 430074 ) 【机构】 华中理工大学机械科学与工程学院!武汉 430074 ；	用电MIS ； E-R模型 ； 数据库优化 ； Power supply MIS ； E-R model ； Database optimization ；	针对目前电力企业用电与营业运行和管理体制的特点，并结合广东某电力工业局基于Ｉｎｔｒａｎｅｔ的用电ＭＩＳ的建设开发实例，提出了用电ＭＩＳ的系统结构和系统数据库的设计方法，在此基础上，进一步对数据库设计和优化的相关技术进行了分析．	2000年09期_用电管理信息系统的数据库设计与优化.pdf	http://sso.cdclib.org/interlibSSO/goto/6/=06190596Z93/kcms/detail/detail.aspx?dbCode=cjfq&filename=JSJC200009057&dbname=CJFD9902
一种全新的网上教育存储服务器的设计与实现	计算机工程	2000	2000年09期	【作者】 韩德志 ； 易法令 ； 【Author】       HAN Dezhi, YI Hualing (Col. of Computer, HUST,WH 430074) (Dep. of Computer, Xinyang Teacher College, XY 464000) (Dep.of Computer, Jinzhou Teacher College ) 【机构】 华中理工大学计算机学院!武汉 430074河南省信阳师范学院计算机系!信阳 464000 ； 荆州师范学院计算机系 ；	附网存储服务器 ； 输入/输出优化 ； 核心操作系统 ； Web管理 ； Network attached storage server ； Input/output optimize ； Core operating system ； Web manage ；	介绍了一种全新的网络教育存储体系结构－－附网存储服务器技术，提出了一种网上教育存储服务器的设计方案，并对其软件、硬件构成及Ｗｅｂ管理进行了详细论述．	2000年09期_一种全新的网上教育存储服务器的设计与实现.pdf	http://sso.cdclib.org/interlibSSO/goto/6/=06190596Z93/kcms/detail/detail.aspx?dbCode=cjfq&filename=JSJC200009058&dbname=CJFD9902
基于MPEG2标准的音象资料实时刻录存储系统的设计与实现	计算机工程	2000	2000年09期	【作者】 李智芳 ； 【Author】       LI Zhifang (Electronics Department of Zhongshan University, Guangzhou 510275) 【机构】 中山大学电子系!广州510275 ；	MPEG2 ； 编码器 ； 解码器 ； DVD-RAM ； 可读写光盘 ； MPEG2 ； Encoder ； Decoder ； DVD-RAM ； R/W compact disc ；	讨论了基于ＭＰＥＧ２压缩标准的音象资料实时采集刻录存储系统的设计与实现。该系统是一个完整的视音频来集、压缩、回放和ＤＶＤ－ＲＡＭ光盘刻录、节目管理。节目采用国际标准ＭＰＥＧ２数字格式存储，与数字电视具有相同的格式。	2000年09期_基于MPEG2标准的音象资料实时刻录存储系统的设计与实现.pdf	http://sso.cdclib.org/interlibSSO/goto/6/=06190596Z93/kcms/detail/detail.aspx?dbCode=cjfq&filename=JSJC200009059&dbname=CJFD9902
在VB环境下分布式测控系统多机通信的实现	计算机工程	2000	2000年09期	【作者】 邓文浪 ； 【Author】       DENG Wenlang (Department of Automation and Electronic Engineering of Xiangtan University, Xiangtan 411105) 【机构】 湘潭大学自动化与电子工程系!湘潭411105 ；	Visual Basic(VB) ； 分布式测控系统 ； 动态链接库(DLL) ； Visual Basic ； Distributed testing control system ； Dynamic linked library ；	针对用Ｖｉｓｕａｌ Ｂａｓｉｃ编程实现分布式测控系统多机通信所出现的问题，提出了采用动态链接库技术扩展ＶＢ功能、实现多机通信的解决方案，并给出了实例．	2000年09期_在VB环境下分布式测控系统多机通信的实现.pdf	http://sso.cdclib.org/interlibSSO/goto/6/=06190596Z93/kcms/detail/detail.aspx?dbCode=cjfq&filename=JSJC200009060&dbname=CJFD9902
利用ASP技术开发基于Web的电话号码查询系统	计算机工程	2000	2000年09期	【作者】 袁方 ； 刘海波 ； 【Author】       YUAN Fang, LIU Haibo (College of Computer Science, Hebei University, Baoding 071002 ) 【机构】 河北大学计算机科学学院!保定071002 ；	动态服务器网页(ASP) ； Web ； 电话号码查询 ； InterDev6.0 ； Active server page (ASP ) ； Web ； Telephone number query ； InterDev6.0 ；	利用ＡＳＰ技术开发出了一个基于Ｗｅｂ的电话号码查询系统，介绍了ＡＳＰ技术的基本原理及系统开发中解决的主要问题．	2000年09期_利用ASP技术开发基于Web的电话号码查询系统.pdf	http://sso.cdclib.org/interlibSSO/goto/6/=06190596Z93/kcms/detail/detail.aspx?dbCode=cjfq&filename=JSJC200009061&dbname=CJFD9902
XML在HIS中的应用	计算机工程	2000	2000年09期	【作者】 丁崧 ； 黄上腾 ； 【Author】       DING Song, HUANG Shangteng (Department of Computer Science & Engineering, Shanghai Jiaotong University, Shanghai 200030) 【机构】 上海交通大学计算机科学与工程系!上海200030 ；	可扩展标记语言 ； 医院信息集成系统 ； 标准通用标记语言 ； 文本类型定义 ； XML(extensible markup language) ； HIS ； SGML(standard generalized markup language) ； DTD(document type definition) ；	探讨了新一代Ｗｅｂ的基础ＸＭＬ的体系结构及特点，并对ＸＭＬ与ＨＴＭＬ进行比较。提出了一个基于ＸＭＬ的ＨＩＳ系统设计框架。	2000年09期_XML在HIS中的应用.pdf	http://sso.cdclib.org/interlibSSO/goto/6/=06190596Z93/kcms/detail/detail.aspx?dbCode=cjfq&filename=JSJC200009062&dbname=CJFD9902
基于模糊理论的干部考核方法	计算机工程	2000	2000年09期	【作者】 张景元 ； 【Author】       ZHANG Jingyuan (Dept. of Computer Science & Engineering. Zibo University. Zibo 255000) 【机构】 淄博大学计算机科学与工程系!淄博255200 ；	干部 ； 工作业绩 ； 模糊评判 ； Cadre ； Work achievement ； Fuzzy iudgement ；	对中、基层干部工作业绩评价问题作了研究，将模糊评判方法应用于干部考核．提出了一种数据模型，并结合实例进行了讨论，该方法是有效的，可以给组织、人事部门提供一种较科学的干部考核方法和客观的人事变动依据．	2000年09期_基于模糊理论的干部考核方法.pdf	http://sso.cdclib.org/interlibSSO/goto/6/=06190596Z93/kcms/detail/detail.aspx?dbCode=cjfq&filename=JSJC200009063&dbname=CJFD9902
剖析VC++与Oracle数据库连接的几种方法	计算机工程	2000	2000年09期	【作者】 颜如祥 ； 【Author】       YAN Ruxiang (28th Research Institute of MEI, Nanjing 210014 ). 【机构】 信息产业部电子第28研究所!南京210014 ；	OO4O ； ODBC ； Pro*C ； 部件对象模型自动化 ； OO4O ； ODBC ； Pro C ； COM(Component Object Model)automation ；	该文就Ｖｉｓｕａｌ Ｃ＋＋与Ｏｒａｃｌｅｔ数据库连接的３种主要方式（ＯＯ４Ｏ、 ＯＤＢＣ和ＰｒｏＣ）阐述了各自的工作原理和技术特点，比较了３种方法的差别，剖析各自的优缺点，并给出３种方法实现过程中的关键步骤．	2000年09期_剖析VC++与Oracle数据库连接的几种方法.pdf	http://sso.cdclib.org/interlibSSO/goto/6/=06190596Z93/kcms/detail/detail.aspx?dbCode=cjfq&filename=JSJC200009064&dbname=CJFD9902
网卡地址的识别和Windows 95IP地址的自动设置	计算机工程	2000	2000年09期	【作者】 邹永林 ； 沈健 ； 【Author】       ZOU Yonglin, SHEN Jian (Dept. of Computer , Changshu College, Changshu 215500) 【机构】 常熟高等专科学校计算机系!常熟215500 ；	网卡物理地址 ； NETBIOS ； 注册表 ； IP地址 ； NIC physical address ； NETBIOS ； Registry ； IP address ；	该文结合在学校公共机房管理中遇到的具体问题，提出了通过网卡物理地址的唯一性来设置计算机的ＩＰ地址的方法．	2000年09期_网卡地址的识别和Windows+95IP地址的自动设置.pdf	http://sso.cdclib.org/interlibSSO/goto/6/=06190596Z93/kcms/detail/detail.aspx?dbCode=cjfq&filename=JSJC200009065&dbname=CJFD9902
用UML和Rational Rose实现面向对象的三层C/S结构设计	计算机工程	2000	2000年09期	【作者】 周达仁 ； 张昱 ； 陈意云 ； 【Author】       ZHOU Daren, AHANG Yu, CHEN Yiyun (Dept. of Computer Science, University of Science & Technology of China, Hefei 200037) 【机构】 中国科学技术大学计算机科学技术系!合肥 230027 ；	面向对象 ； 客户机/服务器 ； 软件工程 ； Object oriented ； Clienu/Server: Software engineering ；	该文用一实例详细介绍了用ＵＭＬ和Ｒａｔｉｏｎａｌ Ｒｏｓｅ实现面向对象的三层Ｃ／Ｓ结构设计的方法．	2000年09期_用UML和Rational+Rose实现面向对象的三层C+S结构设计.pdf	http://sso.cdclib.org/interlibSSO/goto/6/=06190596Z93/kcms/detail/detail.aspx?dbCode=cjfq&filename=JSJC200009066&dbname=CJFD9902
使用XML构建协作式Web解决方案	计算机工程	2000	2000年09期	【作者】 王华麟 ； 杨煜普 ； 毛伟 ； 【Author】       WANG Hualin, YANG Yupu, MAO Wei (Automation Institute of Shanghai Jiaotong University, Shanghai 200030) 【机构】 上海交通大学自动化研究所!上海200030 ；	可扩展标记语言 ； 协作 ； 3层结构 ； XML ； Collaboration ； 3-tier Architecture ；	该文提出２１世纪是Ｗｅｂ站点彼此协作的时代，核心技术是ＸＭＬ，然后探讨了将ＸＭＬ应用到３层结构中的方法，最后给出了ＸＭＬ的编程界面	2000年09期_使用XML构建协作式Web解决方案.pdf	http://sso.cdclib.org/interlibSSO/goto/6/=06190596Z93/kcms/detail/detail.aspx?dbCode=cjfq&filename=JSJC200009067&dbname=CJFD9902
PowerBuilder实现的图象数据库动态检索	计算机工程	2000	2000年09期	【作者】 阎伟 ； 钱晓锋 ； 【Author】       YAN Wei, QIAN Xiaofeng (Computation Center of Huaihai Institute of Technology, Lianyungang 222005; Institute of Mech. & Elec., Nanjing University of Aero. and Astro., Nanjing 210016) 【机构】 淮海工学院计算中心!连云港222005 ； 南京航空航天大学机电工程学院!南京210016 ；	PowerBuilder ； 图象 ； 检索 ； 预览 ； PowerBuilder ； Picture ； Retrieve ； Preview ；	提出了一种实现基于字段的图象数据库的动态检索、图象预览等功能的方法。 ＰｏｗｅｒＢｕｉｌｄｅｒ中窗口信息的传递、 Ｗｉｎｄｏｗｓ ＡＰＩ调用、动态ＳＱＬ语句及用户对象等用法及其设计实例在本文中作了一些探讨。	2000年09期_PowerBuilder实现的图象数据库动态检索.pdf	http://sso.cdclib.org/interlibSSO/goto/6/=06190596Z93/kcms/detail/detail.aspx?dbCode=cjfq&filename=JSJC200009068&dbname=CJFD9902
如何在数据库应用中存取和使用Excel对象	计算机工程	2000	2000年09期	【作者】 李伟 ； 张春芽 ； 白庆华 ； 【Author】       LI Wei, ZHANG Chuya, BAI Qinghua (Economic Management Institute, Tongji University, Shanghai 200092) 【机构】 同济大学经济管理学院!上海200092 ；	数据库 ； Excel ； SQLServer ； 对象 ； 数据表 ； OLE对象 ； Database ； Excel ； SQLServer ； Object ； Datatable ； OLE object ；	介绍了如何使用ＶＢ编程语言在ＳＱＬＳｅｒｖｅｒ中存取和使用Ｅｘｃｅｌ对象，包括前后台的配置以及程序中的一些值得注意的主要关键点．	2000年09期_如何在数据库应用中存取和使用Excel对象.pdf	http://sso.cdclib.org/interlibSSO/goto/6/=06190596Z93/kcms/detail/detail.aspx?dbCode=cjfq&filename=JSJC200009069&dbname=CJFD9902
