title	journal_name	year	issue	author	keywords	summary	pdf_filename	article_url
当前我国电子政务发展的突破口——实施科学决策、结合创新特色	信息化建设	2006	2006年07期	【作者】 沈懿 ； 【机构】 北京大学网络经济研究中心 ；	电子政务 ； 门户网 ； 服务型转变 ； 网站建设 ； 研究导向 ； 组织建设 ； 方向问题 ； 管制型 ； 电子服务 ； 项目评价 ；	<正>电子政务的发展在中国早已不是一个新鲜的议题,但却一直是各方关注的焦点。经过几年的发展,公众对电子政务了解不断加深,认识也逐渐真实起来,开始向电子政务要效果,要效率,要效益。中国电子政务在功能上的欠缺逐渐凸显出来。多年来各级政府在电子政务方面做出了很多有益的探索,但是距离全社会的一致认可还有一定的差距,公众对电子政务的评价可谓是“毁誉	2006年07期_当前我国电子政务发展的突破口——实施科学决策、结合创新特色.pdf	http://sso.cdclib.org/interlibSSO/goto/6/=06190596Z93/kcms/detail/detail.aspx?dbCode=cjfq&filename=XXJS200607012&dbname=CJFD0608
为政务信息化培训班叫好！	信息化建设	2006	2006年07期	【作者】 胡显谋 ； 【机构】 贵州省毕节地区行政公署 秘书长 ；	政务信息化 ； 办公室工作人员 ； 凸显期 ； 综合版 ； 业务能力 ； 发展时期 ； 边干边学 ； 学有所得 ； 领导干部队伍 ； 改进作风 ；	<正>2006年4月27日,《人民日报》综合版刊登了《全国政府系统政务信息化首期培训班结业》的消息,政府系统办公室工作人员为此叫好,这是多年来未见的消息,更是多年来未见的举措。当前,政府系统办公室的工作既处于一个发展机遇期、“黄金期”,又处于一个发展的矛盾挑战期、“凸显期”,既面	2006年07期_为政务信息化培训班叫好！.pdf	http://sso.cdclib.org/interlibSSO/goto/6/=06190596Z93/kcms/detail/detail.aspx?dbCode=cjfq&filename=XXJS200607013&dbname=CJFD0608
解读宏观经济 护航央网建设——国家发展改革委央网内容保障工作侧记	信息化建设	2006	2006年07期	【作者】 吴倚天 ；	国家发展改革委 ； 门户网 ； 和谐之路 ； 人民代表 ； 专题栏目 ； 网站管理 ； 价格监督检查 ； 产能过剩 ； 国务院办公厅 ； 网站信息 ；	<正>2006年3月,对今后五年我国经济社会发展转入科学发展轨道、走上社会和谐之路,进而实现全面建设小康社会的宏伟目标,具有十分重大意义的《中华人民共和国国民经济和社会发展第十一个五年规划纲要》经第十届全国人民代表大	2006年07期_解读宏观经济+护航央网建设——国家发展改革委央网内容保障工作侧记.pdf	http://sso.cdclib.org/interlibSSO/goto/6/=06190596Z93/kcms/detail/detail.aspx?dbCode=cjfq&filename=XXJS200607014&dbname=CJFD0608
浅谈海关门户网站如何进一步深入发展	信息化建设	2006	2006年07期	【作者】 赵雨佳 ；	门户网 ； 国务院信息办 ； 赛迪顾问 ； 评估中心 ； 政务信息公开 ； 企业和社会 ； 网站管理 ； 公众参与 ； 电子口岸 ； 在线办事 ；	<正>政府网站是我国各级政府履行职能、面向社会提供服务的官方网站,是政府实现政务信息公开、服务企业和社会公众、方便公众参与的重要渠道。2006年1月,受国务院信息办委托,赛迪顾问股份有限公司和中国信息化绩效评估中心联合发布了	2006年07期_浅谈海关门户网站如何进一步深入发展.pdf	http://sso.cdclib.org/interlibSSO/goto/6/=06190596Z93/kcms/detail/detail.aspx?dbCode=cjfq&filename=XXJS200607015&dbname=CJFD0608
“任务导向、应用共享”的整合型电子政务平台规划和建设——浙江省省级机关事务管理局电子政务建设带给我们的启示	信息化建设	2006	2006年07期	【作者】 刘兆平 ； 【机构】 浙江省省级机关事务管理局 ；	电子政务 ； 事务管理局 ； 应用共享 ； 政务公开制度 ； 整合型 ； 公务活动 ； 政务活动 ； 整合度 ； 政务信息化 ； 门户网 ；	<正>在我国政府大力倡导“服务政府理念、政务公开制度、工作效能建设”的今天,浙江省省级机关事务管理局(简称管理局)起着承上启下的桥梁作用。“事务管理的科学性、基础信息的整合度、应用共享的高要求”等方面是管理局展开信息化建设过程的重点,而“公务活动的信息化、网络化、智能化”则是其电子政务具体表现形式。管理局为提	2006年07期_“任务导向、应用共享”的整合型电子政务平台规划和建设——浙江省省级机关事务管理局电子政务建设带给我们的启示.pdf	http://sso.cdclib.org/interlibSSO/goto/6/=06190596Z93/kcms/detail/detail.aspx?dbCode=cjfq&filename=XXJS200607016&dbname=CJFD0608
以网络之桥 通民生社情 建和谐天津	信息化建设	2006	2006年07期	【作者】 邓波 ；	信访工作 ； 信访事项 ； 政务信息 ； 信访人 ； 政府电子政务 ； 网络资源 ； 互联互通 ； 系统建设方案 ； 来访接待 ； 信息办 ；	《信访条例》第十一条,国家信访工作机构充分利用现有政务信息网络资源,建立全国信访信息系统,为信访人在当地提出信访事项、查询信访事项办理情况提供便利。县级以上地方人民政府应当充分利用现有政务信息网络资源,建立或者确定本行政区域的信访信息系统,并与上级人民政府、政府有关部门、下级人民政府的信访信息系统实现互联互通。	2006年07期_以网络之桥+通民生社情+建和谐天津.pdf	http://sso.cdclib.org/interlibSSO/goto/6/=06190596Z93/kcms/detail/detail.aspx?dbCode=cjfq&filename=XXJS200607017&dbname=CJFD0608
浅议计算机网络的安全隐患及防御策略	信息化建设	2006	2006年07期	【作者】 吴建伟 ； 【机构】 浙江省松阳县科技信息中心 ；	防御策略 ； 联结形式 ； 分布不均匀性 ； 互连性 ； 恶意软件 ； 网络安全策略 ； 爱虫病毒 ； 信息交换手段 ； 网络安全机制 ； 用户安全意识 ；	<正>现代计算机系统功能日渐复杂,网络体系日渐强大,正在对社会产生巨大深远的影响,但同时由于计算机网络具有联结形式多样性、终端分布不均匀性和网络的开放性、互连性等特征,致使网络易受黑客、恶意软件和其他不轨的攻击,所以使得安全问题越来越突出。这就要求我们耍不断提高计算机网络的防御能力,加强网络的安全措施,否则计算机网	2006年07期_浅议计算机网络的安全隐患及防御策略.pdf	http://sso.cdclib.org/interlibSSO/goto/6/=06190596Z93/kcms/detail/detail.aspx?dbCode=cjfq&filename=XXJS200607018&dbname=CJFD0608
我们需要什么样的医疗信息资源整合	信息化建设	2006	2006年07期	【作者】 黄以宽 ； 【机构】 上海市互联网经济咨询中心 ；	信息资源整合 ； 卫生服务质量 ； 信息系统 ； 信息交换平台 ； 项目咨询 ； 业务协同 ； 临床医疗 ； 需求分析 ； 综合管理系统 ； 医疗信息化 ；	<正>前言笔者最近参加了一个医疗信息资源整合相关的项目咨询工作,感觉到医疗信息资源整合的紧迫性已经得到了相当的重视;但同时,有关方面对整合的目标、应达到的深度和步骤又不甚了了。目前,医疗卫生服务质量差已经成为被广泛诟病的社会焦点,旨在	2006年07期_我们需要什么样的医疗信息资源整合.pdf	http://sso.cdclib.org/interlibSSO/goto/6/=06190596Z93/kcms/detail/detail.aspx?dbCode=cjfq&filename=XXJS200607019&dbname=CJFD0608
浙江电信:抓好信息化应用助推新农村建设	信息化建设	2006	2006年07期	【作者】 冯洁 ；	浙江电信 ； 农村建设 ； 号码百事通 ； 战略决策 ； 社会主义新农村 ； 雪域高原 ； 七里乡 ； 提供商 ； 北方草原 ； 对内对外 ；	<正>党中央、国务院作出的全面“建设社会主义新农村”重大战略决策,犹如一股暖暖的春风吹遍中华大地。从东海之滨到雪域高原,从南国水乡到北方草原,举国上下,各行各业纷纷掀起了社会主义新农村建设的热潮。前不久,浙江省电信有限公司党	2006年07期_浙江电信:抓好信息化应用助推新农村建设.pdf	http://sso.cdclib.org/interlibSSO/goto/6/=06190596Z93/kcms/detail/detail.aspx?dbCode=cjfq&filename=XXJS200607020&dbname=CJFD0608
选择路由器须考虑的要点	信息化建设	2006	2006年07期	【作者】 张亚鹏 ；	组播路由协议 ； 端口数 ； 软件方式 ； 接口类型 ； 设备互联 ； 主流配置 ； 冗余设计 ； 千兆以太网 ； 非专业人士 ； 网段 ；	<正>因为笔者所在的单位要进行网络改造,其中的一项工作就是选择路由器,在这方面,虽然已有不少前人的经验可以借鉴,但因为路由器的发展很快,加上各单位都有其自身的特殊性,所以笔者还是对目前路由器的选择要点进行了分析,在此基础上完成了选型任务。本文就来介绍一下笔者在选型时对选择路由器须考虑要	2006年07期_选择路由器须考虑的要点.pdf	http://sso.cdclib.org/interlibSSO/goto/6/=06190596Z93/kcms/detail/detail.aspx?dbCode=cjfq&filename=XXJS200607021&dbname=CJFD0608
政策	信息化建设	2006	2006年07期		国家电子政务 ； 中国电子政务 ； 域名注册 ； 单位规范 ； 机构编制 ； 中文域名 ； 管理机构 ； 中央编办 ； 门户网 ； 信息产业 ；	<正>[政策]国家机关将规范网上名称为推进国家电子政务和信息化建设,维护国家机关及事业单位网上名称的严肃性,我国域名注册管理机构中国互联网络信息中心于近日在京举行新闻发布会,公布了关于落实国家机关事业单位规范注册使用通用网址	2006年07期_政策.pdf	http://sso.cdclib.org/interlibSSO/goto/6/=06190596Z93/kcms/detail/detail.aspx?dbCode=cjfq&filename=XXJS200607022&dbname=CJFD0608
动态	信息化建设	2006	2006年07期		农村建设 ； 公益型 ； 专题网站 ； 电子政务 ； 农业部门 ； 持续农业 ； 大亚湾区 ； 公文管理 ； 农业发展 ； 审批服务中心 ；	<正>[政府]农业部开通公益型政府网站“中国新农村建设信息网”记者从农业部新闻办公室获悉,中国新农村建设信息网(www．xinnongcun．gov．cn)6月8日正式开通,这是农业部推进社会主义新农村建设的又一重要举措。中国新农村建设信息网是我国推进社会主义新农村建设的专题网站。	2006年07期_动态.pdf	http://sso.cdclib.org/interlibSSO/goto/6/=06190596Z93/kcms/detail/detail.aspx?dbCode=cjfq&filename=XXJS200607023&dbname=CJFD0608
数据	信息化建设	2006	2006年07期		网站维护 ； 持续增长 ； 信息资源数量 ； 城市管理 ； 个人网站 ； 网上办事 ； 商业网站 ； 管理数字化 ； 资源数 ； 震灾预防 ；	<正>[50％]政府网站投资额小断加大,利用率却小足50％最近国务院信息化工作办公室发布了《2005年中国互联网络信息资源数量调查报告》。报告显示,中国的政府网站投入呈持续增长,但利用率却不足50％。从整体数量上,政府网站较2004	2006年07期_数据.pdf	http://sso.cdclib.org/interlibSSO/goto/6/=06190596Z93/kcms/detail/detail.aspx?dbCode=cjfq&filename=XXJS200607024&dbname=CJFD0608
竞技体育与电子政务	信息化建设	2006	2006年06期	【作者】 边吉布 ；	电子政务 ； 方法模式 ； 有氧健身 ； 足球世界杯 ； 竞技精神 ； 竞技性 ； 综合性运动会 ； 运会 ； 受众面 ； 中国特色 ；	<正>六月是一个体育的季节,我们不妨将电子政务与体育作一番比对。体育运动按其发展的方法模式来看,可以分为两种:一是以提高整体水平为目标,定位长期发展,“重在参与”的	2006年06期_竞技体育与电子政务.pdf	http://sso.cdclib.org/interlibSSO/goto/6/=06190596Z93/kcms/detail/detail.aspx?dbCode=cjfq&filename=XXJS200606001&dbname=CJFD0608
名刊摘要	信息化建设	2006	2006年06期		中国科技界 ； 造假事件 ； 长江学者 ； 迷局 ； 电子政务 ； 上海交通大学 ； 电子政府建设 ； 杂志封面 ； 四部委 ； 知识产权成果 ；	<正>高科技造假迷局2006年5月12日下午4时,汉芯造假事件调查终于宣布处理结果。上海交大决定,撤销陈进上海交大微电子学院院长等一切职务,同时科技部也向陈进追缴相关经费。上海交通大学的网站上,长江学者陈进的名字从	2006年06期_名刊摘要.pdf	http://sso.cdclib.org/interlibSSO/goto/6/=06190596Z93/kcms/detail/detail.aspx?dbCode=cjfq&filename=XXJS200606002&dbname=CJFD0608
抓住机遇 创新发展 全面推动“十一五”期间广东省信息化建设	信息化建设	2006	2006年06期	【作者】 黄华华 ；	信息产业 ； 大珠三角 ； 产业核心竞争力 ； 加快现代化 ； 产业附加值 ； 全球产业分工 ； 电子政务 ； 社会事业 ； 制造业水平 ； 新经济增长点 ；	<正>“十五”时期,是广东省加快推进信息化,并以信息化促进经济社会发展取得重要成绩的五年。五年来,全省各级党委、政府坚持以“三个代表”重要思想和科学发展观为指导,切实加强对信息化工作的领导,与时俱进,开拓创新,敢于突破,积极发展信息产业,大力推进信息化建设,各项工	2006年06期_抓住机遇+创新发展+全面推动“十一五”期间广东省信息化建设.pdf	http://sso.cdclib.org/interlibSSO/goto/6/=06190596Z93/kcms/detail/detail.aspx?dbCode=cjfq&filename=XXJS200606003&dbname=CJFD0608
拓宽视野 创新思路 全面推进江苏省电子政务建设	信息化建设	2006	2006年06期	【作者】 张桃林 ；	电子政务 ； 信息资源整合 ； 服务职能 ； 门户网 ； 社会管理 ； 公众服务 ； 经济联系 ； 数据交换 ； 现代信息网络 ； 信息产业 ；	<正>2005年,是江苏省全省电子政务工作取得丰硕成果的一年。现代信息基础设施建设不断推进,一批重点业务系统建成使用,电子政务应用水平不断提高,信息资源整合共享取得进展,促进了政务公开,增强	2006年06期_拓宽视野+创新思路+全面推进江苏省电子政务建设.pdf	http://sso.cdclib.org/interlibSSO/goto/6/=06190596Z93/kcms/detail/detail.aspx?dbCode=cjfq&filename=XXJS200606004&dbname=CJFD0608
提高认识水平 了解前沿技术 交流先进经验 第二期全国政府系统政务信息化培训班在杭州开训	信息化建设	2006	2006年06期		政务信息化 ； 电子政务 ； 前沿技术 ； 副主任 ； 日至 ； 技术主管 ； 仲达 ； 日卜 ； 毛段 ； 汪古 ；	<正>本刊讯第二期全国政府系统政务信息化培训班5月24日至30日在杭州举行,参加这一期培训班的对象主要是来自国家部、委、办和各省、市、自治区、计划单列市政府办公厅从事政务信息化建设的技术主管。国务院办公厅电子政务中心副主任段国华、浙江省政府办公厅主任俞仲达、浙江大学公共管理学院陈国权出席了开班仪式。	2006年06期_提高认识水平+了解前沿技术+交流先进经验+第二期全国政府系统政务信息化培训班在杭州开训.pdf	http://sso.cdclib.org/interlibSSO/goto/6/=06190596Z93/kcms/detail/detail.aspx?dbCode=cjfq&filename=XXJS200606005&dbname=CJFD0608
系统观指导下的电子政务——访“中国电子政务应用示范工程”专家组专家王延章教授	信息化建设	2006	2006年06期	【作者】 吴倚天 ；	电子政务 ； 政务信息化 ； 王延章 ； 专家组专家 ； 王博士 ； 应用示范工程 ； 信息产业 ； 工程建设 ； 信息化部门 ； 研究中心 ；	王延章,国务院办公厅、科技部“电子政务应用试点示范工程”专家组专家,大连理工大学信息与决策技术研究所所长、电子政务工程研究中心主任,博士生导师。是我国电子政务领域的著名专家,身兼信息产业部电子政务应用推进中心顾问、国家电子政务工程建设评审委员会专家等多项社会职务,对我国政务信息化建设有着长期的研究和独到的认识。日前,就当前我国电子政务发展中的热点问题,本刊记者对王博士进行了一次专访。在采访中,精于管理理论与系统论的王博士自始至终表达着一个观点即电子政务要用一种系统化、全局化的系统科学思想来指导。	2006年06期_系统观指导下的电子政务——访“中国电子政务应用示范工程”专家组专家王延章教授.pdf	http://sso.cdclib.org/interlibSSO/goto/6/=06190596Z93/kcms/detail/detail.aspx?dbCode=cjfq&filename=XXJS200606006&dbname=CJFD0608
树立正确绩效观 建设节约型电子政务	信息化建设	2006	2006年06期	【作者】 孙国锋 ；	电子政务 ； 资源节约型社会 ； 政务活动 ； 子政 ； 蔚成风气 ； 政府业务 ； 政务绩效 ； 网站群 ； 我国政府职能 ； 在线办事 ；	<正>2006年3月5日,温家宝总理在十届人大四次会议上提出,要在全社会广泛持久地开展资源节约活动,使建设资源节约型社会深入人心,蔚成风气。节约型电子政务是节约型社会的重要组成部分,节约型电子政	2006年06期_树立正确绩效观+建设节约型电子政务.pdf	http://sso.cdclib.org/interlibSSO/goto/6/=06190596Z93/kcms/detail/detail.aspx?dbCode=cjfq&filename=XXJS200606007&dbname=CJFD0608
利用IPSec建立政务专网厅局纵向VPN 构建江西政务统一网络平台	信息化建设	2006	2006年06期	【作者】 何黎明 ； 黄振 ； 【机构】 江西省信息中心网络部 ； 江西省信息中心网络部 ；	网络平台 ； VPN ； 政务信息网 ； 虚拟专用网络 ； 虚拟专网 ； 闭合用户群 ； 身份验证 ； 加密机制 ； 密钥交换 ； 传输模式 ；	<正>2004年3月,覆盖省、市、县三级党政机关的全省电子政务统一网络平台-江西省政务信息网顺利建成开通,构筑了全省党政机关的内部“信息高速公路”,实现了	2006年06期_利用IPSec建立政务专网厅局纵向VPN+构建江西政务统一网络平台.pdf	http://sso.cdclib.org/interlibSSO/goto/6/=06190596Z93/kcms/detail/detail.aspx?dbCode=cjfq&filename=XXJS200606008&dbname=CJFD0608
数据整合技术在人事劳动社会保障信息系统中的运用	信息化建设	2006	2006年06期	【作者】 徐建民 ； 【机构】 义乌市人劳社保信息中心 ；	数据整合 ； 信息系统 ； 劳动社会保障 ； 业务信息 ； 金保工程 ； 整合平台 ； 资源库 ； 结构定义 ； 浙江省义乌市 ； 异构数据源 ；	<正>浙江省义乌市人事劳动社会保障局依托有利的经济条件、社会环境等方面的优势,在“金保工程”信息化建设中取得了显著进步,养老、医保、就业、人才四大数据资源的建设成为整个“金保工程”信息化建设的核心。为了全面、准确、及时地收集整个义乌人事劳动社会保障业务信息,需	2006年06期_数据整合技术在人事劳动社会保障信息系统中的运用.pdf	http://sso.cdclib.org/interlibSSO/goto/6/=06190596Z93/kcms/detail/detail.aspx?dbCode=cjfq&filename=XXJS200606009&dbname=CJFD0608
推进浙江省科技文献共享平台建设的若干设想	信息化建设	2006	2006年06期	【作者】 李励 ； 【机构】 浙江省科技信息研究院 ；	科技文献 ； 条件平台建设 ； 共享平台建设 ； 资源共享平台 ； 网络技术 ； 信息研究院 ； 镜像站 ； 上海市科技 ； 服务系统 ； 化工信息中心 ；	<正>科技基础条件平台建设是科技创新体系建设的基础性和关键性工作。作为科技基础条件平台建设的重要组成部分,利用网络技术构建浙江省科技文献信息资源共建共享平台,已成为我们有效组织和开展科技文献信息服务的主要形式。如何有	2006年06期_推进浙江省科技文献共享平台建设的若干设想.pdf	http://sso.cdclib.org/interlibSSO/goto/6/=06190596Z93/kcms/detail/detail.aspx?dbCode=cjfq&filename=XXJS200606010&dbname=CJFD0608
e-FEMA对我国应急管理体系建设的启示	信息化建设	2006	2006年06期	【作者】 黄以宽 ； 【机构】 上海市互联网经济咨询中心 ；	应急管理体系 ； 应急管理系统 ； e-FEMA ； 电子政务 ； 应用系统 ； 决策机构 ； 信息化管理系统 ； 层次的 ； 联邦机构 ； 信息系统 ；	<正>建设多层次的综合应急管理系统,是我国当前所面临的新的经济建设和社会目标对政府提出的要求;也是我国电子政务建设史上最大规模和深度的一次全国性的统一动员。要建成一个多层次的高效、实用和可操	2006年06期_e-FEMA对我国应急管理体系建设的启示.pdf	http://sso.cdclib.org/interlibSSO/goto/6/=06190596Z93/kcms/detail/detail.aspx?dbCode=cjfq&filename=XXJS200606011&dbname=CJFD0608
加强政府门户网站建设 不断推进政务公开	信息化建设	2006	2006年06期	【作者】 吴向东 ； 【机构】 贵州省政府办公厅信息中心 主任 ；	门户网 ； 政务信息 ； 网站建设 ； 人民群众 ； 信息报送 ； 发布机制 ； 网站信息 ； 部门信息 ； 服务中心 ； 领导责任 ；	<正>贵州省人民政府门户网站于1999年正式建成以来,始终把网站作为省政府政务公开的一个窗口来建设,通过不断完善和更新栏目,增强	2006年06期_加强政府门户网站建设+不断推进政务公开.pdf	http://sso.cdclib.org/interlibSSO/goto/6/=06190596Z93/kcms/detail/detail.aspx?dbCode=cjfq&filename=XXJS200606012&dbname=CJFD0608
对创建政府网站管理机制的思考	信息化建设	2006	2006年06期	【作者】 黄谰 ； 【机构】 济南市信息中心 副主任 ；	网站管理 ； 电子政务 ； 结构要素 ； 网站绩效 ； 网上办事 ； 在线办事 ； 业务协同 ； 政务工作 ； 行政业务 ； 政务信息 ；	<正>随着我国信息化建设的深入发展,政府网站成为推进电子政务建设的主要抓手。近几年,全国从中央到基层各级政府和部门机构大部分都建立了政府网站,已形成了群体建设规模,而且越做越大。面对政府网站的发展态势,联系当前政府网站存在的问题,引发我们关注的是政府网站建设发展能否进入良性轨道,如何保持可持续发展,并由此产生了对创建政府网站管理机制的思考。	2006年06期_对创建政府网站管理机制的思考.pdf	http://sso.cdclib.org/interlibSSO/goto/6/=06190596Z93/kcms/detail/detail.aspx?dbCode=cjfq&filename=XXJS200606013&dbname=CJFD0608
运用政府网站加强效能监察的探索与策略	信息化建设	2006	2006年06期	【作者】 黄永庆 ； 【机构】 上海宝山政府门户网站 站长、总编辑 ；	效能监察 ； 网站建设 ； 国家公务员 ； 电子政务 ； 审批制度 ； 门户网 ； 国家行政机关 ； 行政管理 ； 政务信息 ； 公务人员 ；	<正>效能监察是监察机关依法对国家行政机关和国家公务员的各种失职、渎职行为和事件进行监督、纠举和惩戒的一种职能活动。近年来,各级政府建设和应用政府网站发展电子政务,取得成效。上海宝山区政府自2001年底开通政府门户网站,通过网站推行政务公开、进行行政审批制度改革、改善行政管理,提高行政效能等效能监察方面作了有益探索,实践表明政府网站是效能监察的有效助手。	2006年06期_运用政府网站加强效能监察的探索与策略.pdf	http://sso.cdclib.org/interlibSSO/goto/6/=06190596Z93/kcms/detail/detail.aspx?dbCode=cjfq&filename=XXJS200606014&dbname=CJFD0608
核心的价值不仅仅是技术	信息化建设	2006	2006年06期	【作者】 吴信一 ；	技术创新 ； 市场导向 ； Novell ； 市场人员 ； 产品性能 ； 网络操作系统 ； 人力资源 ； 超越技术 ； 常规思维 ； 要囚 ；	<正>对于不少以技术为支柱的企业来说(特别是那些软件企业),如果提及自主创新,人们首先想到的往往是技术创新、自主研发等。当然,技术上的创新能够推动企	2006年06期_核心的价值不仅仅是技术.pdf	http://sso.cdclib.org/interlibSSO/goto/6/=06190596Z93/kcms/detail/detail.aspx?dbCode=cjfq&filename=XXJS200606015&dbname=CJFD0608
别让宝贵的政府资源变成“海市蜃楼”	信息化建设	2006	2006年06期	【作者】 张艳琳 ；	我国政府部门 ； 八十年代 ； 信息资源 ； 政府资源 ； 商业决策 ； 开发利用水平 ； 中国农业信息网 ； 微观信息 ； 资源总数 ； 政务信息 ；	<正>我国政府部门的信息资源相当丰富,据专家们估计,上个世纪的七、八十年代我国政府部门的信息资源就占了全社会信息资源总数的百分之八十以上,虽然现在所占比重已经	2006年06期_别让宝贵的政府资源变成“海市蜃楼”.pdf	http://sso.cdclib.org/interlibSSO/goto/6/=06190596Z93/kcms/detail/detail.aspx?dbCode=cjfq&filename=XXJS200606016&dbname=CJFD0608
