title	journal_name	year	issue	author	keywords	summary	pdf_filename	article_url
建设电子政务是落实科学发展观的战略举措	信息化建设	2008	2008年09期	【作者】 熊新光 ； 【机构】 上海市人民政府办公厅信息技术处 ；	电子政务 ； 十七大报告 ； 国家战略 ； 管理体制改革 ； 经济发展 ； 公众认知 ； 政务信息公开 ； 勤政高效 ； 人民群众 ； 现代化建设 ；	电子政务是国民经济和社会信息化的重要组成部分,在推动全社会信息化工作全面发展方面起着举足轻重的作用。党的十七大报告对加快信息化、特别是电子政务建设提出了明确要求,促使信息化工作上升到国家战略的高度。在经济社会快速发展的今天,必须准确认识电子政务,科学把握发展规律,使之成为加快经济发展、促进社会和谐、推动科技进步的发动机和助推器。	2008年09期_建设电子政务是落实科学发展观的战略举措.pdf	http://sso.cdclib.org/interlibSSO/goto/6/=06190596Z93/kcms/detail/detail.aspx?dbCode=cjfq&filename=XXJS200809006&dbname=CJFD0608
电子政务 如何度量	信息化建设	2008	2008年09期		电子政务 ； 代表性观点 ； 政务绩效 ； 非理性因素 ； 绩效管理 ； 不良社会影响 ； 网站建设 ； 当前绩效 ； 国家财力 ； 业务培训 ；	<正>"一切皆可度量",这是管理学发展史上"科学主义"学派的代表性观点。科学主义崇尚定量分析,认为数量化是科学的最高境界;与之相对应的"人文主义"则注重定性分析,在分析过程中十分注重一些非理性因素,如人的情感、意志、习惯、无意识等。现代管理学注重两者的结合,认为只有定量分析和定性分析糅合在一起,才能作出正确的判断,得出最佳的结果。	2008年09期_电子政务+如何度量.pdf	http://sso.cdclib.org/interlibSSO/goto/6/=06190596Z93/kcms/detail/detail.aspx?dbCode=cjfq&filename=XXJS200809007&dbname=CJFD0608
电子政务项目绩效评估:实现项目精细化闭环管理之道	信息化建设	2008	2008年09期	【作者】 彭细正 ； 【机构】 ITGov中国IT治理研究中心 ；	电子政务 ； 政务绩效 ； 招投标阶段 ； 立项评审 ； 绩效评估指标 ； 闭环管理 ； 概要设计 ； 验收交付 ； 设计阶段 ； 生命周期模型 ；	<正>当前,我国电子政务项目建设管理流程基本上包括五个阶段,即立项阶段(包括项目建议书、项目可行性分析和项目立项评审),招投标阶段,设计阶段(包括概要设计和详细设计),项目实施阶段(包括项目实施方案设计、项目实施),验收交付使用阶段,如表1所示。	2008年09期_电子政务项目绩效评估:实现项目精细化闭环管理之道.pdf	http://sso.cdclib.org/interlibSSO/goto/6/=06190596Z93/kcms/detail/detail.aspx?dbCode=cjfq&filename=XXJS200809008&dbname=CJFD0608
中国电子政务绩效评估实践现状	信息化建设	2008	2008年09期	【作者】 于施洋 ；	政务绩效 ； 评估实践 ； 评估主体 ； 第三方机构 ； 网站绩效 ； 绩效评估体系 ； 中国电子政务 ； 门户网 ； 网站管理 ； 产业发展研究 ；	<正>目前,我国一些第三方机构和不同层级的政府部门都已经开展了电子政务绩效评估,在绩效评估方面进行了有益的尝试,积累了不少实践经验。从评估主体上分,可以分为以下两大类:第一,第三方机构及其开展的评估1.中国电子信息产业发展研究院	2008年09期_中国电子政务绩效评估实践现状.pdf	http://sso.cdclib.org/interlibSSO/goto/6/=06190596Z93/kcms/detail/detail.aspx?dbCode=cjfq&filename=XXJS200809009&dbname=CJFD0608
世界主要电子政务评估指标比较——以联合国、埃森哲公司、布朗大学、早稻田大学相关评估为中心	信息化建设	2008	2008年09期	【作者】 郭洁敏 ； 【机构】 上海社会科学院信息研究所 ；	电子政务 ； 早稻田大学 ； 布朗大学 ； 埃森哲公司 ； 政务绩效 ； 客户服务 ； 定性评估 ； 评估范围 ； 指数和 ； 审批制度 ；	<正>一、世界电子政务的评估与排名随着电子政务在全球范围内的大力推进,对它的绩效评估也引起世界各国政府和各机构的高度关注。时至今日,电子政务绩效评估名目繁多,既有政府内的评估,也有政府外的评估;既有全球性的评估,也有地区性的和国别性的评估。政府内评估是由政府自身开展的评估,如联合国、欧盟、	2008年09期_世界主要电子政务评估指标比较——以联合国、埃森哲公司、布朗大学、早稻田大学相关评估为中心.pdf	http://sso.cdclib.org/interlibSSO/goto/6/=06190596Z93/kcms/detail/detail.aspx?dbCode=cjfq&filename=XXJS200809010&dbname=CJFD0608
电子政务应用软件开发的思路与技巧	信息化建设	2008	2008年09期	【作者】 刘彦凯 ； 【机构】 天津市府办公厅 ；	应用软件开发 ； 电子政务领域 ； 政务系统建设 ； 业务流程 ； 软件功能 ； 软件缺陷 ； 回归测试 ； 可靠性测试 ； 白盒测试 ； 黑盒测试 ；	<正>我国改革开放已进入第三十个年头,举国上下有一个共识,即发展是硬道理,在电子政务领域里有没有硬道理呢?我个人认为也是存在的,那就是——应用。因为应用既是电子政务系统建设的出发点,同时也是归宿,没有应用的系统是劳民伤财的花架子工程。众所周知,电子政务领域里的各项业务系统,是依托于应用软件来实现的,因此,应用软件的	2008年09期_电子政务应用软件开发的思路与技巧.pdf	http://sso.cdclib.org/interlibSSO/goto/6/=06190596Z93/kcms/detail/detail.aspx?dbCode=cjfq&filename=XXJS200809011&dbname=CJFD0608
政府网站建设新机遇及发展策略	信息化建设	2008	2008年09期	【作者】 黄永庆 ； 【机构】 上海宝山政府门户网站 ；	政府网站建设 ； 电子政务 ； 中国电信 ； 国家信息中心 ； 网上办事 ； 管理型政府 ； 网民互动 ； 政民互动 ； 互动栏目 ； 问政 ；	从1999年1月,国家经贸委和中国电信牵头,启动了"政府上网"工程。近几年,随着电子政务的推广应用,政府网站建设发展较快,据国家信息中心编撰写的2007年电子政务蓝皮书披露,至2006年底,部委、省级、地方、县级政府网站平均拥有率超过85.6%。政府网站的开通运行,为转变政府职能,推进政务公开、电子政务应用等方面发挥了积极作用。	2008年09期_政府网站建设新机遇及发展策略.pdf	http://sso.cdclib.org/interlibSSO/goto/6/=06190596Z93/kcms/detail/detail.aspx?dbCode=cjfq&filename=XXJS200809012&dbname=CJFD0608
浅议我国信息标准体系的完善	信息化建设	2008	2008年09期	【作者】 杨辉 ； 【机构】 河南省信阳市质量技术监督局 ；	信息技术 ； 信息标准化 ； 技术标准 ； 互联互通 ； 标准化工作 ； 信息化政策 ； 信息应用 ； 复杂系统工程 ； 发达国家标准 ； 基础标准 ；	<正>信息化是一项既依赖于信息技术又与信息应用直接关联的复杂系统工程。协调技术和应用之间的关系,保证信息的共享和互联互通,很关键的条件是信息化的相关技术标准。信息化体系主要由六要素组成,即:信息技术应用、信息资源、信息网络、信息技术和产业、信息技术人才、信息化政策法规和标准规范。这六要素有着	2008年09期_浅议我国信息标准体系的完善.pdf	http://sso.cdclib.org/interlibSSO/goto/6/=06190596Z93/kcms/detail/detail.aspx?dbCode=cjfq&filename=XXJS200809013&dbname=CJFD0608
江苏省安全生产信息化建设现状与对策	信息化建设	2008	2008年09期	【作者】 孙明义 ； 【机构】 江苏省安全生产科学研究院安全信息工程研究所 ；	生产信息化 ； 网络工程 ； 安监系统 ； 管理工作任务 ； 应急信息 ； 国家安全 ； 应用系统 ； 工作手段 ； 计算机软件 ； 信息系统 ；	<正>随着我国经济建设的高速发展,监督管理工作任务日益繁重,安全生产数据信息急剧增加,传统的安全生产监督管理工作手段已经难以满足新的安全生产监督管理工作的发展需要。将现代通讯、网络工程和计算机软件融合于安全生产工作,创新安全生产监督管理方式和手段,提高安全监管自动化水平和工作效率,完善安全生产应急业务体系建设,全面推进安全生产信息化建设具有十分重	2008年09期_江苏省安全生产信息化建设现状与对策.pdf	http://sso.cdclib.org/interlibSSO/goto/6/=06190596Z93/kcms/detail/detail.aspx?dbCode=cjfq&filename=XXJS200809014&dbname=CJFD0608
环保信息化呼唤运维外包	信息化建设	2008	2008年09期	【作者】 林宣雄 ； 【机构】 西安交大计算机技术研究所 ； 西安交大软件学院 ；	环境统计 ； 减排指标 ； 国控 ； 节能减排 ； 自动监控 ； 环境监控 ； 监督性 ； 监测能力 ； 信息化道路 ； 业务网络 ；	<正>改革开放30年,中国最高决策当局审势度势,不失时机地发动了史无前例的全民节能减排行动,与这场不分行业、不分地区、声势浩大、自东而西、由南向北的环保风暴相呼应,环保部及时部署了主要污染物减排指标、监测和考核体系建设,启动了四个项目:国控污染源自动监控能力建设;执法监察标准化建设;环境统计与信息能	2008年09期_环保信息化呼唤运维外包.pdf	http://sso.cdclib.org/interlibSSO/goto/6/=06190596Z93/kcms/detail/detail.aspx?dbCode=cjfq&filename=XXJS200809015&dbname=CJFD0608
基于J2EE的“网上党建”探索	信息化建设	2008	2008年09期	【作者】 王瑛 ； 【机构】 浙江省衢州市电力局 ；	党务工作 ； 党的组织 ； 时代任务 ； 衢州电力局 ； 供电企业 ； 动态管理 ； J2EE ； 工作研究 ； 信息分析 ； 信息科学 ；	<正>网络信息时代,在互联网上实现党的组织管理和工作流程的优化重组,使企业党务工作方式在网络技术和网络文化方面进行优化完善,对完成党的时代任务至关重要。为构建适合于现代供电企业自身应用特点的党务工作模式,浙江衢州电力局吸收信息科学的新观念、新技术,设计开发了集工作研究、动态管理、信息分析	2008年09期_基于J2EE的“网上党建”探索.pdf	http://sso.cdclib.org/interlibSSO/goto/6/=06190596Z93/kcms/detail/detail.aspx?dbCode=cjfq&filename=XXJS200809016&dbname=CJFD0608
政府网站的社会责任	信息化建设	2008	2008年09期	【作者】 苏欣娜 ；	互联网媒体 ； 人生阅历 ； 人生道路 ； 网络形象 ； 不自觉 ； 西方敌对势力 ； 信息工作 ； 社会影响 ； 引入歧途 ； 赈灾物资 ；	<正>2.3亿这个数字,使中国网民的数量已然跃居世界之首。其中,25岁以下的年轻人占51%。勿庸置疑,中国的互联网不仅是年轻的互联网,更是年轻人的互联网。在成长的人生道路上,他们几乎都自觉或不自觉地选择了通过互联网去见识、去感受、去获取更广阔世界中的信息,从而极快速地丰富其人生阅历。然而国内新兴的互联网媒体由于缺失社会责任	2008年09期_政府网站的社会责任.pdf	http://sso.cdclib.org/interlibSSO/goto/6/=06190596Z93/kcms/detail/detail.aspx?dbCode=cjfq&filename=XXJS200809017&dbname=CJFD0608
前期的规划设计很重要	信息化建设	2008	2008年09期	【作者】 时向一 ；	政府办事效率 ； 业务模块 ； 网站建设 ； 规划设计 ； 预先设计 ； 政务信息化 ； 电子政务 ； 实际工作流程 ； 汶川地震 ； 预留资源 ；	<正>记得有专家在一次讲课中提到:网站是人为预先设计的,不断进化的生命体;政府网站不仅要做好,还要服务好社会大众,以提升政府办事效率和政府决策的能力。自参加工作的两年里,接触过不少业务模块或业务系统需要在现有的网站上进行变更(包括添加、修改或删除)的事情,但通常变更后,要么这	2008年09期_前期的规划设计很重要.pdf	http://sso.cdclib.org/interlibSSO/goto/6/=06190596Z93/kcms/detail/detail.aspx?dbCode=cjfq&filename=XXJS200809018&dbname=CJFD0608
服务:加拿大国家网络的主题词	信息化建设	2008	2008年09期	【作者】 李德升 ； 【机构】 信息产业部电子科学技术情报研究所 ；	加拿大人 ； 电子政务 ； 政府业务 ； 私人组织 ； 公众服务 ； 加拿大政府 ； 在线方式 ； 国家网络 ； 在线处理 ； 日常服务 ；	<正>经过多年的建设和发展,加拿大的电子政务已达到相当高的水平。到2005年底,30%的政府业务可通过在线方式办理,63%的常用信息和67%的日常服务都可在线获得和在线处理。在推进电子政务建设的过程中,加拿大政府一直在跟踪研究加拿大人希望从公共部门获取什么样的服务,并对其他公共部门和私人组织的做法和经验进行评估,以寻求进一步改进和提高政府对公众服务的水平。	2008年09期_服务:加拿大国家网络的主题词.pdf	http://sso.cdclib.org/interlibSSO/goto/6/=06190596Z93/kcms/detail/detail.aspx?dbCode=cjfq&filename=XXJS200809019&dbname=CJFD0608
NHK电视直升机灾害信息系统建设及启示	信息化建设	2008	2008年09期	【作者】 姚国章 ； 【机构】 南京邮电大学经管学院 ；	灾害信息 ； NHK ； 抗险救灾 ； 生命财产损失 ； 汶川大地震 ； SDTV ； 灾情信息 ； 空白带 ； 微波传输 ； 电视屏幕 ；	<正>刚刚过去的汶川大地震给中华民族带来了无法抹去的历史创痛,灾害造成的巨大的生命财产损失和抗险救灾过程中暴露出来的种种问题值得我们进行严肃和深刻的反思。如何突破在重大灾害发生时灾害信息在时间和空间分布上的"空白",对降低灾害所带来的生命财产损失有着决定性的意义。	2008年09期_NHK电视直升机灾害信息系统建设及启示.pdf	http://sso.cdclib.org/interlibSSO/goto/6/=06190596Z93/kcms/detail/detail.aspx?dbCode=cjfq&filename=XXJS200809020&dbname=CJFD0608
浅议信息技术在国有商业银行内部审计中的运用	信息化建设	2008	2008年09期	【作者】 李健 ； 【机构】 建设银行浙江省分行 ；	内部审计 ； 审计信息化 ； 审计手段 ； 审计方式 ； 内部控制 ； 计算机审计 ； 现场审计 ； 审计人员 ； 审计项目 ； 计算机辅助审计 ；	<正>随着我国加入世贸组织及国有商业银行陆续改制上市,资本市场和外部监管对国有商业银行的内部控制和风险管理提出了更高的要求,作为商业银行内部风险控制手段之——审计监督工作必须得到进一步加强;同时金融业计算机应用领域的广泛深入,对国有商业银行的内部审计工作也提出了新的和更高的要求,采用传统的审计方式和审计手段已经不能适应新形势的发展需要,这就使得信息化技术在国有商业银行内部审计中的运用成为必然。	2008年09期_浅议信息技术在国有商业银行内部审计中的运用.pdf	http://sso.cdclib.org/interlibSSO/goto/6/=06190596Z93/kcms/detail/detail.aspx?dbCode=cjfq&filename=XXJS200809021&dbname=CJFD0608
信息化在水上交通指挥中的综合应用——浙江湖州的水上交通管理实践	信息化建设	2008	2008年09期	【作者】 洪雨农 ； 【机构】 湖州市港航管理局 ；	水上交通 ； 水运业 ； 湖州港 ； 航道建设 ； 干线航道 ； 航区 ； 港航管理局 ； 浙江湖州 ； 浙江省北部 ； 浙江省交通厅 ；	<正>湖州市地处浙江省北部,东临上海,南连杭州,北濒太湖,西与安徽省接壤,区内河网密布、航道纵横交错,近年来水运业发展迅猛。目前,湖州市有内河航道1166公里,营运船舶12000多艘,境内长湖申线、京杭运河等干线航道船舶日均交通量3000多艘次,成为我国内河运输最繁忙的航道之一。内河运输的迅速发展,	2008年09期_信息化在水上交通指挥中的综合应用——浙江湖州的水上交通管理实践.pdf	http://sso.cdclib.org/interlibSSO/goto/6/=06190596Z93/kcms/detail/detail.aspx?dbCode=cjfq&filename=XXJS200809022&dbname=CJFD0608
电子政务网络信息安全问题分析与建议	信息化建设	2008	2008年09期	【作者】 段伟 ； 朱作杰 ； 【机构】 黑龙江省政务信息化管理服务中心 ；	电子政务网络 ； 信息安全 ； 不可否认性 ； 信息泄漏 ； 政府电子政务 ； 网络层 ； 信息污染 ； 漏洞检测 ； 电子政务信息 ； 问题分析 ；	<正>电子政务网络安全是指信息安全和控制安全两部分。国际标准化组织把信息安全定义为"信息的完整性、可用性、保密性和可靠性";控制安全则指身份认证、不可否认性、授权和访问控制。网络环境为信息共享、信息交流、信息服务创造了理想空间,同时也产生了许多安全问题如信息泄漏、信息污染、信息不易受控等。网络运用的	2008年09期_电子政务网络信息安全问题分析与建议.pdf	http://sso.cdclib.org/interlibSSO/goto/6/=06190596Z93/kcms/detail/detail.aspx?dbCode=cjfq&filename=XXJS200809023&dbname=CJFD0608
多重组合 综合防御——免费个人网络安全“套装”及使用策略	信息化建设	2008	2008年09期	【作者】 袁艺 ；	多重组合 ； 综合防御 ； 网络安全 ； 在线杀毒 ； 病毒木马 ； 技术对抗 ； 互联网安全 ； 映像劫持 ； 查杀 ； 软件功能 ；	<正>当前,互联网安全状况日趋恶劣,新型病毒和木马层出不穷,防不胜防,并呈现出传播手段多样化、攻击机制底层化、编写目的趋利化、病毒木马一体化的发展趋势。它们采取加壳处理、线程插入与进程守护等技术躲避杀毒软件的查杀,采取病毒自动升级、病毒制造机等技术对抗杀毒软件的升级,采取"映像劫持"、中断进程等技术阻	2008年09期_多重组合+综合防御——免费个人网络安全“套装”及使用策略.pdf	http://sso.cdclib.org/interlibSSO/goto/6/=06190596Z93/kcms/detail/detail.aspx?dbCode=cjfq&filename=XXJS200809024&dbname=CJFD0608
沟通无“线”制 固话随身行 中国电信浙江公司“一号双机”业务受青睐	信息化建设	2008	2008年09期	【作者】 冯洁 ；	中国电信 ； 双机 ； 孙先生 ； 联系方式 ； 被叫方 ； 一号通 ； 任度 ； 来电显示 ； 朋友家 ； 办公电话 ；	<正>从事居室装潢业务的孙先生,通过几年的打拼,生意越做越红火,每天都在外面忙着与客户接洽业务,一些客户打到公司找他的电话老是接不到,于是孙先生就担心客户的信任度问题:"用户非常相信固定电话,接不到电话,用户会认为我是在打游击。虽然联系不成问题,但是固定电话是做生意必不可少的联系方式,再说我的这部电	2008年09期_沟通无“线”制+固话随身行+中国电信浙江公司“一号双机”业务受青睐.pdf	http://sso.cdclib.org/interlibSSO/goto/6/=06190596Z93/kcms/detail/detail.aspx?dbCode=cjfq&filename=XXJS200809025&dbname=CJFD0608
固网支付,开启“新刷卡”时代 中国电信杭州分公司推出电话POS支付业务	信息化建设	2008	2008年09期	【作者】 胡文怡 ； 冯洁 ；	中国电信 ； POS ； 固网支付 ； 支付业务 ； 太子龙 ； 公用事业单位 ； 食品集团 ； 家庭客户 ； 集团客户 ； 供应链 ；	<正>现在,杭州有多家大型企业用上了中国电信固网支付业务,"足不出户"就能完成企业供应链交易、公用事业单位账单支付等操作,避免了来往银行排队等候之苦,同时还能对企业内部的资金流进行管理。目前,中国电信杭州分公司在——佑康食品集团、太子龙控股、浙江建华集团等多家大型企业布放的50多台终端,仅在4个多月里就完成了360多万元的交易额。据悉,固网支付,是指在固定电话	2008年09期_固网支付,开启“新刷卡”时代+中国电信杭州分公司推出电话POS支付业务.pdf	http://sso.cdclib.org/interlibSSO/goto/6/=06190596Z93/kcms/detail/detail.aspx?dbCode=cjfq&filename=XXJS200809026&dbname=CJFD0608
自己亲人的奥运比赛看了还想看 中国电信为奥运选手亲友提供免费上网和宽带电视	信息化建设	2008	2008年09期	【作者】 顾瑾 ； 永红 ； 家琦 ；	中国电信 ； 免费上网 ； 奥运选手 ； 宽带电视 ； 黄海强 ； 宽带网络 ； 中国田径协会 ； 资格赛 ； 免费安装 ； 上盘镇 ；	<正>"黄海强将在8月17日参加跳高资格赛。"8月7日下午,当电信公司社区经理刚把宽带网络接通,黄海强的姐姐黄峰芳就马上登陆中国田径协会官方网站,查询黄海强的比赛时间。虽然远隔千山万水,临海的父母时刻牵挂着在北京比赛的儿子。为了让奥运选手家人在家畅快、方便地了	2008年09期_自己亲人的奥运比赛看了还想看+中国电信为奥运选手亲友提供免费上网和宽带电视.pdf	http://sso.cdclib.org/interlibSSO/goto/6/=06190596Z93/kcms/detail/detail.aspx?dbCode=cjfq&filename=XXJS200809027&dbname=CJFD0608
打造环保全天候、实时检测监控网——污染源在线检测监控解决方案	信息化建设	2008	2008年09期		废水污染物 ； 企业废水 ； 在线检测 ； 漏排 ； 检测监控 ； 实时变化 ； 排放数据 ； 监控系统 ； 视频监控设备 ； 污染物排放 ；	<正>一、前言鼠标轻轻一点,20多公里之外的造纸厂污水处理车间就跃上大屏幕,通过拉伸旋转监控镜头,可以清楚地看到企业废水排放的每道处理工序,污水ph值、瞬间废水污染物的排放数据、24小时实时变化曲线图、全年累计排放总量等一目了然,当前或以往是否存在偷排漏排等情况也难以逃脱"火眼金睛"。	2008年09期_打造环保全天候、实时检测监控网——污染源在线检测监控解决方案.pdf	http://sso.cdclib.org/interlibSSO/goto/6/=06190596Z93/kcms/detail/detail.aspx?dbCode=cjfq&filename=XXJS200809028&dbname=CJFD0608
IToIP护航平安海南	信息化建设	2008	2008年09期		应急平台建设 ； IToIP ； 地质灾害 ； 南部地区 ； 应急联动 ； 指挥平台 ； 视频会议 ； 数据共享 ； 应急指挥系统 ； 系统建设方案 ；	<正>海南是个自然灾害多发省份,2005年中南部地区共发生地质灾害296起,07年重油泄漏,西海岸70多公里海面被重油污染,经济损失无法估量,08年台风"浣熊"致海南131万人受灾损失3.37亿。在这种情况下,海南省根据《国家应急平台建设指导意见》要求,积极开展省级应急平台的规划和设计工作。2006年3月发布了《海南省人民政府突发公共事件总体应急预	2008年09期_IToIP护航平安海南.pdf	http://sso.cdclib.org/interlibSSO/goto/6/=06190596Z93/kcms/detail/detail.aspx?dbCode=cjfq&filename=XXJS200809029&dbname=CJFD0608
McAfee万兆网络安全平台保障IDC网络安全	信息化建设	2008	2008年09期	【作者】 张宏明 ； 【机构】 迈克菲公司 ；	IDC网络 ； McAfee ； 网络安全 ； 应用服务提供商 ； 互联网数据中心 ； 服务器托管 ； 万兆网络 ； 系统集成 ； 拒绝服务 ； 互联网安全 ；	<正>互联网数据中心,又称IDC(InternetData Center),是伴随着互联网发展的需求而发展起来的,为企业、应用服务提供商、内容服务提供商、系统集成商、ISP等提供大规模、高质量、安全可靠的服务器托管、租用以及ASP等增值服务的业务。由于IDC用户的数据及信息的敏感性,一直以来一直是黑客侵入、盗取信息的主要目标,IDC内部的信息和数据一旦发生	2008年09期_McAfee万兆网络安全平台保障IDC网络安全.pdf	http://sso.cdclib.org/interlibSSO/goto/6/=06190596Z93/kcms/detail/detail.aspx?dbCode=cjfq&filename=XXJS200809030&dbname=CJFD0608
巧让Word“查找内容”参与“替换”(一)	信息化建设	2008	2008年09期	【作者】 贾培武 ；	查找内容 ； Word ； 复选框 ； 半角字符 ； 英文状态 ； 全角 ； 出场人物 ； 自动功能 ； 输入状态 ； 将略 ；	<正>Word的"替换"命令功能之强大确实不容小觑。在进行"替换"操作时,其"替换为"的内容和"查找内容"总是有着千丝万缕的联系。今笔者以三个实例说明如何在"替换"时使用"查找内容"。一、直接引用"查找内容"框的内容在介绍出场人物时,通常主持人都会加上"著名的"这三个字,于是在你编辑完成了一篇Word文档后,突然感到	2008年09期_巧让Word“查找内容”参与“替换”(一).pdf	http://sso.cdclib.org/interlibSSO/goto/6/=06190596Z93/kcms/detail/detail.aspx?dbCode=cjfq&filename=XXJS200809031&dbname=CJFD0608
宏观	信息化建设	2008	2008年09期		组织机构代码 ； 法人单位 ； 基础信息库 ； 商用网络 ； 电信业务经营 ； 工业和信息化部 ； 中国移动 ； 移动计划 ； 虚假宣传 ； 后续演进 ；	<正>【标准】法人单位基础信息库建设国家标准即将出台从全国组织机构代码管理中心获悉,由该中心提出的全国法人单位基础信息标准体系的构建工作正在进行,初步确定的标准体系构架中已有4项重要的国家标准正在起草。法人单位基础信息库建设由国家质检总局牵头,多部门	2008年09期_宏观.pdf	http://sso.cdclib.org/interlibSSO/goto/6/=06190596Z93/kcms/detail/detail.aspx?dbCode=cjfq&filename=XXJS200809032&dbname=CJFD0608
