title	journal_name	year	issue	author	keywords	summary	pdf_filename	article_url
“商务领航”之“安防门户”——ExpressV中小企业信息化平台解决方案	信息化建设	2008	2008年05期		ExpressV ； 信息化平台 ； 商务领航 ； 信息系统 ； 市场竞争 ； 硬件产品 ； 周界 ； 监控现场 ； 信息化产品 ； 生产成本 ；	<正>在激烈的市场竞争中,中小企业需要构建开放的、可管理的信息系统,并提供"一揽子"的解决方案,以此来提高企业的经营效率、降低企业的生产成本。而运营商为其搭建共用的信息化平台是提高中小企业信息化程度的最为经济、适宜的方法。	2008年05期_“商务领航”之“安防门户”——ExpressV中小企业信息化平台解决方案.pdf	http://sso.cdclib.org/interlibSSO/goto/6/=06190596Z93/kcms/detail/detail.aspx?dbCode=cjfq&filename=XXJS200805033&dbname=CJFD0608
Windows XP防火墙你用好了吗	信息化建设	2008	2008年05期	【作者】 英子 ；	WindowsXP ； 内网用户 ； 下载工具 ； Windows XP ； 下载速度 ； 网络访问 ； 本地网络 ； 连接请求 ； 复选框 ； 弹出窗口 ；	<正>WindowsXP防火墙是微软公司为加强安全性而在SP2中添加的一个实用功能,许多用户觉得该功能实在不够强大而将其关闭,改用其他的产品。其实,微软的产品应该说本身还是有一定的特色的,只要能设置好,运用得	2008年05期_Windows+XP防火墙你用好了吗.pdf	http://sso.cdclib.org/interlibSSO/goto/6/=06190596Z93/kcms/detail/detail.aspx?dbCode=cjfq&filename=XXJS200805034&dbname=CJFD0608
宏观	信息化建设	2008	2008年05期		印发通知 ； 卫生信息 ； 全国网络 ； 国家秘密 ； 说明理由 ； 保护办法 ； 电子商务税收 ； 卫生行政部门 ； 商业数据 ； 工业和信息化部 ；	<正>【通知】卫生部要求做好政府信息公开《中华人民共和国政府信息公开条例》已于2008年5月1日起实施。卫生部为做好《条例》施行工作,明确了卫生部信息公开的内容、分类、方式和有关要求,并于近日印发通知。	2008年05期_宏观.pdf	http://sso.cdclib.org/interlibSSO/goto/6/=06190596Z93/kcms/detail/detail.aspx?dbCode=cjfq&filename=XXJS200805035&dbname=CJFD0608
动态	信息化建设	2008	2008年05期		国民经济核算 ； 统计数据库 ； 国家统计局 ； 固定资产投资 ； 统计信息 ； 国家外汇管理局 ； 中国电信 ； 网络行业 ； 无线上网 ； 无线宽带 ；	<正>【政府】统计局:"国家统计数据库"对外试运行为了满足社会各界对统计信息查询的需要,由国家统计局研制的"国家统计数据库"于4月30日开始对外试运行。数据库包括国民经济核算、人口、就业、固定资产投资、能源、价	2008年05期_动态.pdf	http://sso.cdclib.org/interlibSSO/goto/6/=06190596Z93/kcms/detail/detail.aspx?dbCode=cjfq&filename=XXJS200805036&dbname=CJFD0608
数据	信息化建设	2008	2008年05期		产业收入 ； 信息产业 ； 社会发展信息 ； 视听节目 ； 国内生产总值 ； 销售收入 ； 外贸出口总额 ； 自律公约 ； 信息技术领域 ； 产品出口额 ；	<正>【10万亿元】中国信息产业收入2010年将达到10万亿元据近日出台的《国民经济和社会发展信息化"十一五"规划》,到2010年,中国信息产业总收入将达到10万亿元人民币,增加值超过2.8万亿元,占GDP的比重将提高到10	2008年05期_数据.pdf	http://sso.cdclib.org/interlibSSO/goto/6/=06190596Z93/kcms/detail/detail.aspx?dbCode=cjfq&filename=XXJS200805037&dbname=CJFD0608
杭州要成为世界的办公室	信息化建设	2008	2008年04期	【作者】 阿良 ；	高端服务业 ； 新型企业 ； 国家领导人 ； 经济发展 ； 专栏作家 ； 地区经济 ； 里德曼 ； 社会经济 ； 生产经营成本 ； 案头必备 ；	<正>杭州要成为世界的办公室?乍一看这题目,好多人会情不自禁发问,什么意思?可这确确实实是杭州市政府前不久在一次会上提出的口号。从当地的一家报纸上看到这则新闻,我真是由衷地感叹:杭州市的领导太有才	2008年04期_杭州要成为世界的办公室.pdf	http://sso.cdclib.org/interlibSSO/goto/6/=06190596Z93/kcms/detail/detail.aspx?dbCode=cjfq&filename=XXJS200804000&dbname=CJFD0608
名刊摘要	信息化建设	2008	2008年04期		信息产业 ； 创新型国家 ； 互联网文化 ； 电话用户总数 ； 电信用户 ； 电子信息 ； 政策法规 ； 通信发展 ； 行业转型 ； 生物医药 ；	<正>构建和完善信息产业政策法规今后几年信息产业仍将保持持续快速发展。"十一五"乃至今后更长时期内,我们将按照建设创新型国家、推进信息化与工业化融合的	2008年04期_名刊摘要.pdf	http://sso.cdclib.org/interlibSSO/goto/6/=06190596Z93/kcms/detail/detail.aspx?dbCode=cjfq&filename=XXJS200804001&dbname=CJFD0608
求真务实 开拓创新 深入推进新形势下“数字浙江”建设	信息化建设	2008	2008年04期	【作者】 金德水 ；	优化环境 ； 八八战略 ； 投融资机制 ； 信息技术 ； 历史机遇 ； 战略重点 ； 金德水 ； 信息服务业 ； 经济发展方式 ； 经济合作 ；	"数字浙江"建设是一项长期的任务,也是一项全局性的系统工程。各级政府及有关部门要把"数字浙江"建设摆到更加突出的位置,加强领导,统筹规划,优化环境,协调推进,切实把"数字浙江"建设的各项目标任务落到实处,全面提高我省信息化水平。	2008年04期_求真务实+开拓创新+深入推进新形势下“数字浙江”建设.pdf	http://sso.cdclib.org/interlibSSO/goto/6/=06190596Z93/kcms/detail/detail.aspx?dbCode=cjfq&filename=XXJS200804003&dbname=CJFD0608
四年回眸看郑州	信息化建设	2008	2008年04期	【作者】 吴倚天 ；	电子政务 ； 政务信息化 ； 中部省区 ； 门户网 ； 网上审批系统 ； 现代化大都市 ； 审批业务 ； 部门间 ； 意见征询 ； 郑汴一体化 ；	<正>2004年,本刊曾对河南省郑州市的电子政务建设状况作过专门报道(见"郑州电子政务印象",2004年5月刊),当时郑州市处于政务信息化发展初期,但其对电子政务的重视以及投入已俨然走在中部省区的前列。	2008年04期_四年回眸看郑州.pdf	http://sso.cdclib.org/interlibSSO/goto/6/=06190596Z93/kcms/detail/detail.aspx?dbCode=cjfq&filename=XXJS200804004&dbname=CJFD0608
信息共享 让税收走入“精细化”时代——记郑州市税务信息化建设	信息化建设	2008	2008年04期	【作者】 吴倚天 ；	税务信息化 ； 国税局 ； 地税局 ； 地产开发商 ； 涉税信息 ； 城建税 ； 依法治税 ； 国地税 ； 教育费附加 ； 国家税务总局 ；	<正>无论是在郑州市国税局还是地税局,记者听到最多的一个词都是"精细化"。两边税务局的同志还给记者举了很多"精细化"的实例:"以前在郑州市的房地产开发商来我们国税局报	2008年04期_信息共享+让税收走入“精细化”时代——记郑州市税务信息化建设.pdf	http://sso.cdclib.org/interlibSSO/goto/6/=06190596Z93/kcms/detail/detail.aspx?dbCode=cjfq&filename=XXJS200804005&dbname=CJFD0608
网上审批呼唤“整体”战略——从郑州实践看我国网上审批的现状及发展	信息化建设	2008	2008年04期	【作者】 吴倚天 ；	电子政务工作 ； 门户网 ； 行政许可 ； 在线办事 ； 办事流程 ； 审批业务 ； 在线处理 ； 部门利益 ； 审批服务中心 ； 电子政务领域 ；	<正>2006年6月12日"全国电子政务工作会"提出:"到2010年,政府门户网站成为政府信息公开的重要渠道,50%以上的行政许可项目能够实现在线处理",	2008年04期_网上审批呼唤“整体”战略——从郑州实践看我国网上审批的现状及发展.pdf	http://sso.cdclib.org/interlibSSO/goto/6/=06190596Z93/kcms/detail/detail.aspx?dbCode=cjfq&filename=XXJS200804006&dbname=CJFD0608
发展电子政务 建设服务型政府	信息化建设	2008	2008年04期	【作者】 王长胜 ； 【机构】 国家信息中心 常务副主任 ；	电子政务 ； 政务信息公开 ； 网站发展 ； 在线办事 ； 部门信息 ； 社会管理 ； 主体服务 ； 传递网络化 ； 在线化 ； 服务导向 ；	早在2004年,温家宝总理就指出:"我们要把政府办成一个服务型的政府,为市场主体服务,为社会服务,最终是为人民服务。"由此拉开了我国建设服务型政府的序幕。今年2月,胡锦涛主席在中共中央政治局第四次集体学习中指出:"要扎扎实实推进服务型政府建设,全面提高为人民服务能力和水平"。建设服务型政府,关键是推进政府职能转变、完善社会管理和公共服务,重点是保障和改善民生。电子政务是实施政府改造战略的一个重要步骤,也是建设服务型政府和信息社会的重要切入点。将政府的管理与服务建立在现代信息技术、网络技术和通讯技术基础之上,实现政府办公自动化,部门信息传递网络化,公共服务在线化,实现政府管理的资源高度共享,是当前电子政务的主要任务。而作为电子政务面向社会主要形式的政府网站,"政务信息公开、在线办事和公众参与"的三大功能定位,是一切政府网站工作的出发点和落脚点。可以说,服务型政府改革目标的确定,为电子政务的发展提供了广阔的空间,也为政府网站发展指明了方向。为进一步深化"服务导向"的电子政务发展理念,本期"专家试点"特约一组有关文章以供广大读者交流探讨。	2008年04期_发展电子政务+建设服务型政府.pdf	http://sso.cdclib.org/interlibSSO/goto/6/=06190596Z93/kcms/detail/detail.aspx?dbCode=cjfq&filename=XXJS200804007&dbname=CJFD0608
服务型政府网站的本质特征与表现形式	信息化建设	2008	2008年04期	【作者】 杨冰之 ； 郑爱军 ；	网站群 ； 网站总数 ； 拥有率 ； 在线办事 ； 服务对象 ； 网站资源 ； 政务网 ； 处理逻辑 ； 绩效评估结果 ； 界面图 ；	<正>据中国互联网信息中心统计,截止2007年底,拥有."gov.cn"域名的政府网站总数已达3.5万个。随着去年西藏自治区政府网站的开通,全国省级政府网站拥有率达到了100%。	2008年04期_服务型政府网站的本质特征与表现形式.pdf	http://sso.cdclib.org/interlibSSO/goto/6/=06190596Z93/kcms/detail/detail.aspx?dbCode=cjfq&filename=XXJS200804008&dbname=CJFD0608
以“顾客”需求为导向 强化政府网站服务意识	信息化建设	2008	2008年04期	【作者】 曹国瑞 ； 【机构】 陕西省政府政务信息化办公室 ；	电子政务 ； 主要着力点 ； 顾客要求 ； 现代公共管理 ； 管理体制改革 ； 信息化办公室 ； 公众利益 ； 群体建设 ； 绩效管理 ； 指标设计 ；	<正>随着我国信息化建设的深入发展,政府网站已成为推进电子政务建设的主要着力点。近几年,全国从中央到基层各级政府和部门大都建立了政府网站,形成了群体建设规模,而且越做越大。	2008年04期_以“顾客”需求为导向+强化政府网站服务意识.pdf	http://sso.cdclib.org/interlibSSO/goto/6/=06190596Z93/kcms/detail/detail.aspx?dbCode=cjfq&filename=XXJS200804009&dbname=CJFD0608
网上行政审批之“困”与“破”	信息化建设	2008	2008年04期	【作者】 吴勇毅 ；	政府信息化建设 ； 审批系统 ； 电子政务 ； 政府体制改革 ； 软件开发商 ； 渠道合作伙伴 ； 电子签章 ； 咨询服务 ； 身份认证机制 ； 审批服务中心 ；	<正>随着我国政府体制改革的深入,在软件开发商、系统咨询服务商和渠道合作伙伴的支持下,我国政府信息化建设快速发展,我国电子政务建设取得显著的成就。这其中最能代表的就是以网上行政审批为重点的行政	2008年04期_网上行政审批之“困”与“破”.pdf	http://sso.cdclib.org/interlibSSO/goto/6/=06190596Z93/kcms/detail/detail.aspx?dbCode=cjfq&filename=XXJS200804010&dbname=CJFD0608
上海市政务外网建设谈(六) 政务外网数字证书认证体系的建设——从“上海市政务外网数字证书应用示范”谈起	信息化建设	2008	2008年04期	【机构】 上海市政府公众信息网管理中心 ；	政务外网 ； 数字证书 ； 应用支撑平台 ； 网上办事 ； 电子政务 ； 网络信任 ； 应用系统 ； 信息公开规定 ； 政府机构 ； 服务中心 ；	<正>2006年,上海市政务外网实施了"上海市政务外网数字证书应用示范"项目,借助于上海市统一的网络信任体系,以上海市政务外网网上办事应用支撑平台(以下简称"应用支撑平台")的应用系统	2008年04期_上海市政务外网建设谈(六)+政务外网数字证书认证体系的建设——从“上海市政务外网数字证书应用示范”谈起.pdf	http://sso.cdclib.org/interlibSSO/goto/6/=06190596Z93/kcms/detail/detail.aspx?dbCode=cjfq&filename=XXJS200804011&dbname=CJFD0608
深入实施信息化 助推“第三次跨越”——提高温州城市信息化水平的对策研究	信息化建设	2008	2008年04期	【作者】 汪振坚 ； 【机构】 温州市信息化管理办公室 ；	温州城市 ； 市正 ； 信息服务业 ； 六大以来 ； 农民信箱 ； 优化环境 ； 电子政务 ； 引导力度 ； 社区信息化 ； 组织机构 ；	<正>"信息化是工业化的必由之路、覆盖现代化全局的战略举措"是党的十六大以来所形成的共识。当前,温州市正处在产业发展转型期和"第三次跨越"的战略机遇期,企业管理逐步规范化,	2008年04期_深入实施信息化+助推“第三次跨越”——提高温州城市信息化水平的对策研究.pdf	http://sso.cdclib.org/interlibSSO/goto/6/=06190596Z93/kcms/detail/detail.aspx?dbCode=cjfq&filename=XXJS200804012&dbname=CJFD0608
基于电子印章和文件版式的政府电子公文传输系统的设计及应用	信息化建设	2008	2008年04期	【作者】 徐颖 ； 【机构】 浙江省政府办公厅 ；	电子公文 ； 电子印章 ； 无缝结合 ； 传输系统 ； 公文传输 ； 易用性 ； 数字证书 ； 身份认证服务器 ； 认证体系 ； 验证功能 ；	本文设计的电子公文传输系统,充分利用了PKI/CA体系的安全功能、电子印章技术、文件版式技术,在保证安全性的同时,很好地兼顾了易用性和通用性。而且,能与政府现有的OA系统无缝结合,能低成本地适应政府电子公文将来发展的需要。	2008年04期_基于电子印章和文件版式的政府电子公文传输系统的设计及应用.pdf	http://sso.cdclib.org/interlibSSO/goto/6/=06190596Z93/kcms/detail/detail.aspx?dbCode=cjfq&filename=XXJS200804013&dbname=CJFD0608
积极探索招标投标电子化进程	信息化建设	2008	2008年04期	【机构】 浙江海宁市招标采购服务中心 ；	招标投标 ； 电子化进程 ； 招标采购 ； 建设工程 ； 挂牌出让 ； 国有土地使用权 ； 招投标管理 ； 交易场所 ； 国土资源 ； 投标工作 ；	<正>海宁市招标采购服务中心,是全市集中统一的招标采购交易场所和服务平台。中心的主要职能是实施建设工程和政府采购各项招标采购活动,并负责配合市国土资源局组织实施国有土地使用权招标拍卖挂牌出让工作。	2008年04期_积极探索招标投标电子化进程.pdf	http://sso.cdclib.org/interlibSSO/goto/6/=06190596Z93/kcms/detail/detail.aspx?dbCode=cjfq&filename=XXJS200804014&dbname=CJFD0608
规划的学问	信息化建设	2008	2008年04期	【作者】 高复先 ；	技术系统 ； 总体数据 ； 共享数据库 ； 企事业单位 ； 数据流分析 ； 应用系统集成 ； 需求分析 ； 数据标准化 ； 信息中心 ； 系统建模 ；	<正>目前,无论政府部门还是企事业单位的信息化工作领导、信息中心负责人和信息化建设骨干们,都已经普遍认识到信息化建设是复杂的社会——技术系统工程,要获得成功,	2008年04期_规划的学问.pdf	http://sso.cdclib.org/interlibSSO/goto/6/=06190596Z93/kcms/detail/detail.aspx?dbCode=cjfq&filename=XXJS200804015&dbname=CJFD0608
政府网站没必要一律“有问必答”	信息化建设	2008	2008年04期	【作者】 方家平 ；	浏览者 ； 公众服务 ； 准考证号码 ； 电子政务 ； 矮灌木 ； 管理故事 ； 剑走偏锋 ； 服务职责 ； 网络恶搞 ； 职责范围 ；	<正>科技部官方网站开设的一个供浏览者咨询问题的栏目"公众问答",近来出现很多与科技部工作职能无关的问题,诸如从狗生病如何医治到永动机专利如何申报,从孕前调理到中	2008年04期_政府网站没必要一律“有问必答”.pdf	http://sso.cdclib.org/interlibSSO/goto/6/=06190596Z93/kcms/detail/detail.aspx?dbCode=cjfq&filename=XXJS200804016&dbname=CJFD0608
美国政府及军方对网络安全采取的政策措施	信息化建设	2008	2008年04期	【作者】 王飞 ； 宋玮 ；	网络安全 ； 美国国防部 ； 信息安全 ； 美国海军 ； 信息战 ； 信息系统 ； 信息网络 ； 网络战 ； 国土安全部 ； 美国空军 ；	<正>美国作为全球信息化程度最高的国家,拥有世界上最先进和最庞大的信息系统,对信息网络的依赖性最大,对信息安全的关注也最多。据统计,美国每年因网络安全造成的损失达170亿美元以上,金融界计算机犯	2008年04期_美国政府及军方对网络安全采取的政策措施.pdf	http://sso.cdclib.org/interlibSSO/goto/6/=06190596Z93/kcms/detail/detail.aspx?dbCode=cjfq&filename=XXJS200804017&dbname=CJFD0608
九江市财政综合业务系统数据的安全防范	信息化建设	2008	2008年04期	【作者】 张南 ； 【机构】 九江市财政局信息中心 ；	综合业务系统 ； 工资统发 ； 集中支付系统 ； 会计系统 ； 指标管理 ； 支付中心 ； 支付金额 ； 网络防病毒 ； 横向联网 ； 网络安全 ；	<正>随着九江市财政改革的不断深入,九江市财政综合业务系统通过近一年的使用,已经相继启用了数据业务中心、指标管理系统、国库集中支付系统、工资统发系统以及政府会计系统。	2008年04期_九江市财政综合业务系统数据的安全防范.pdf	http://sso.cdclib.org/interlibSSO/goto/6/=06190596Z93/kcms/detail/detail.aspx?dbCode=cjfq&filename=XXJS200804018&dbname=CJFD0608
世界电子政务发展趋势预测	信息化建设	2008	2008年04期	【机构】 兰科研究中心 ；	电子政务 ； 政府效率 ； 影响因素 ； 发展趋势预测 ； 公共服务建设 ； 公众服务 ； 智力支持系统 ； 决策科学化 ； 信息安全 ； 公共行政管理 ；	<正>电子政务是社会发展的必然,其发展同诸多方面紧密关联,受多方面的因素促进和制约。这些促进和制约电子政务发展的因素成为电子政务发展的影响因素。对电子政务发展趋势的预测,	2008年04期_世界电子政务发展趋势预测.pdf	http://sso.cdclib.org/interlibSSO/goto/6/=06190596Z93/kcms/detail/detail.aspx?dbCode=cjfq&filename=XXJS200804019&dbname=CJFD0608
国外政府信息官制度解读	信息化建设	2008	2008年04期	【作者】 张佶 ；	电子政务 ； 首席信息官 ； 上海市信息委 ； 管理能力 ； 管理体制 ； 中层管理者 ； 业务领导 ； 部门间 ； 工作方式 ； 委办局 ；	<正>近年来,我国电子政务建设进程发展迅速,但与国外同等规模的城市相比,即使在全国已处于领先地位的北京、上海等城市,其电子政务的应用及管理水平确实还存在着一定的差距。通过研究,不难发现,英国、新加坡、美国	2008年04期_国外政府信息官制度解读.pdf	http://sso.cdclib.org/interlibSSO/goto/6/=06190596Z93/kcms/detail/detail.aspx?dbCode=cjfq&filename=XXJS200804020&dbname=CJFD0608
信息时代国际人才交流的机遇与挑战	信息化建设	2008	2008年04期	【作者】 钟延光 ； 李海 ； 【机构】 国家外国专家局国外人才信息研究中心 ； 国家外国专家局国外人才信息研究中心 ；	国际人才交流 ； 人才网 ； 人才信息 ； 用人单位 ； 中国就业 ； 人才招聘 ； 信用度 ； 门户网 ； 外国专家 ； 国家外国专家局 ；	<正>伴随中国经济的飞速发展,中国对外籍人才的需求急剧增加,同时国际人才交流的需求、领域和渠道都发生了很大变化。互联网已经成为国内用人单位,尤其是获得普通外籍人才信息的主要渠道,	2008年04期_信息时代国际人才交流的机遇与挑战.pdf	http://sso.cdclib.org/interlibSSO/goto/6/=06190596Z93/kcms/detail/detail.aspx?dbCode=cjfq&filename=XXJS200804021&dbname=CJFD0608
信息化促进江苏区域经济发展	信息化建设	2008	2008年04期	【作者】 水家耀 ； 【机构】 江苏省信息中心 ；	区域经济 ； 区域发展 ； 区域信息化 ； 总体发展水平 ； 不平衡 ； 基础设施水平 ； 现代化建设 ； 战略定位 ； 社会经济发展 ； 水平指标 ；	<正>区域发展不平衡问题,长期以来一直困扰和制约着江苏省总体发展水平和整体竞争力的提高,既影响现代化建设的全局,也不利于社会的长	2008年04期_信息化促进江苏区域经济发展.pdf	http://sso.cdclib.org/interlibSSO/goto/6/=06190596Z93/kcms/detail/detail.aspx?dbCode=cjfq&filename=XXJS200804022&dbname=CJFD0608
Word快捷键的妙用	信息化建设	2008	2008年04期	【作者】 贾培武 ；	文档窗口 ； 单元格 ； 小写字母 ； Word ； 插入点 ； 起始位置 ； 大时 ； 鼠标左键 ； 编辑工作 ； 英文编辑 ；	<正>在使用鼠标就几乎能够完成全部操作的今天,大家似乎对快捷键并不那么热衷了。其实,在Word的快捷键中,可谓是藏龙卧虎。因为,对有些任务来说,使用快捷键可以简单完成,而如果放弃快捷键不用,那么	2008年04期_Word快捷键的妙用.pdf	http://sso.cdclib.org/interlibSSO/goto/6/=06190596Z93/kcms/detail/detail.aspx?dbCode=cjfq&filename=XXJS200804023&dbname=CJFD0608
信息化在线	信息化建设	2008	2008年04期		信息网络 ； 安全应急 ； 信息安全 ； 应急体系 ； 安全防护体系 ； 信息产业 ； 信息化体系 ； 国家安全 ； 信息交换平台 ； 服务系统 ；	<正>宏观【两会呼吁】促进我国网络和信息化体系建设一、将信息网络应急纳入国家应急体系中我国当前的国家安全和基础设施的安全应急体系中,并没有把信息网络应急纳入国家应急体系之中。但是,我国政	2008年04期_信息化在线.pdf	http://sso.cdclib.org/interlibSSO/goto/6/=06190596Z93/kcms/detail/detail.aspx?dbCode=cjfq&filename=XXJS200804024&dbname=CJFD0608
为书记省长欢迎网民“灌水”“拍砖”叫好!	信息化建设	2008	2008年03期	【作者】 边炽 ；	黄华 ； 一封信 ； 冰冻灾害 ； 高新民 ； 网络舆情 ； 网络素质 ； 舆论监督 ； 暴民 ； 畏之如虎 ； 省部级高官 ；	<正>春节期间,中共中央政治局委员、广东省委书记汪洋和广东省省长黄华华,通过省内主要新闻网站,发布了《致广东网民朋友的一封信》,向网民拜年。信中表示,面对近期罕见的雨雪冰冻灾害天气,许多网民提供了很好	2008年03期_为书记省长欢迎网民“灌水”“拍砖”叫好!.pdf	http://sso.cdclib.org/interlibSSO/goto/6/=06190596Z93/kcms/detail/detail.aspx?dbCode=cjfq&filename=XXJS200803001&dbname=CJFD0608
名刊摘要	信息化建设	2008	2008年03期		新建场馆 ； 行业软件 ； 信息服务 ； 信息通信业 ； 源讯公司 ； 宽带接入服务 ； 生活搜索 ； 生活服务 ； 通信产品 ； 中国软件企业 ；	<正>探秘奥运场馆信息化建设2008年8月,人类历史上第一届"科技奥运"筑起的信息化桥梁将使得奥运赛场上有更多的精彩呈现。北京移动在每个新建场馆提供的区域性信息服务,除了欢迎短信,观众还将收到观赛指南、	2008年03期_名刊摘要.pdf	http://sso.cdclib.org/interlibSSO/goto/6/=06190596Z93/kcms/detail/detail.aspx?dbCode=cjfq&filename=XXJS200803002&dbname=CJFD0608
深化应用 优化环境 促进我国旅游信息化发展	信息化建设	2008	2008年03期	【作者】 杜江 ； 【机构】 国家旅游局 副局长 ；	旅游信息化 ； 优化环境 ； 国家旅游局 ； 地方旅游 ； 金旅工程 ； 公共服务质量 ； 旅游资讯 ； 行政管理机构 ； 行业管理 ； 形象宣传 ；	<正>自国家旅游局决定在全行业实施"金旅工程",全面推进旅游信息化建设以来,各地方旅游行政管理机构积极响应,电子政务应用逐步普及,有效地提升了行业管理效率和公共服务质量;电子商务在探索中发展,在发展中创新和壮大。旅游信息化从无到有,从薄弱零散的应用到今天的	2008年03期_深化应用+优化环境+促进我国旅游信息化发展.pdf	http://sso.cdclib.org/interlibSSO/goto/6/=06190596Z93/kcms/detail/detail.aspx?dbCode=cjfq&filename=XXJS200803004&dbname=CJFD0608
