title	journal_name	year	issue	author	keywords	summary	pdf_filename	article_url
浅谈政务外网的安全防范和管理	信息化建设	2006	2006年09期	【作者】 王路 ； 【机构】 杭州市政府办公信息处理中心 ；	政务外网 ； 安全保密工作 ； 办公网 ； 逻辑隔离 ； 物理隔离 ； 主机安全 ； 非法用户 ； 终端安全 ； 防病毒网关 ； 安全保护措施 ；	中办发[2002]17号文件明确了我国电子政务建设的指导思想和发展方向,特别对于电子政务的基础工程(政务网络)的建设明确规划如下“我国电子政务网络由政务内网和政务外网构成,两网之间物理隔离,政务外网与互联网之间逻辑隔离。政务内网主要是副省级以上政务部门的办公网,与副省级以下政府部门的办公网物理隔离。政务外网是政府的业务专网,主要运行政府部门面向社会的专业性服务和不需要在内网上运行的业务。”应该说17号文件清楚地界定了电子政务网络的划分,特别是文件对政务外网的明确定义扫清了政务外网发展的障碍。随着这几年政务外网在网络规模和上网应用方面的长足发展,各地对政务外网的安全保密工作的关注也越来越高。在这	2006年09期_浅谈政务外网的安全防范和管理.pdf	http://sso.cdclib.org/interlibSSO/goto/6/=06190596Z93/kcms/detail/detail.aspx?dbCode=cjfq&filename=XXJS200609017&dbname=CJFD0608
西子湖畔 华为3Com演绎“服务”精品	信息化建设	2006	2006年09期		西子湖畔 ； 业务解决方案 ； 精品服务 ； 信息化市场 ； 上网用户 ； 浙江经济 ； 自我突破 ； 浙江地区 ； 信息化发展水平 ； 网络升级 ；	素有“文物之邦”美誉的浙江,历史悠久,积蕴深厚。印象中,西子湖畔的美丽,似乎代表了整个地域一种温婉、优雅的姿态。同时,这里人才辈出,大名鼎鼎的范蠡既是名臣良相,同时始创商训,成为儒商的鼻祖。可以说,这里正是出精品的地方。现在,浙江经济随着信息化发展的加速而蒸蒸日上,在信息化建设的里程中,厂家能否提供足够精致的服务,将成为能否获得浙江客户认可的关键。在国内IT服务行业中,华为3Com备受瞩目。如果不是亲眼目睹,可能一般人想象不到这个诞生仅两年多的企业,2005年签订合同金额7亿美金,同比增长70%,客户遍及全球90多个国家和地区……从最初确定的“网络应用创造价值、网络服务为先”,到今天H3Car	2006年09期_西子湖畔+华为3Com演绎“服务”精品.pdf	http://sso.cdclib.org/interlibSSO/goto/6/=06190596Z93/kcms/detail/detail.aspx?dbCode=cjfq&filename=XXJS200609018&dbname=CJFD0608
实用 高效 便捷——北大方正技术研究院公文档案一体化解决方案	信息化建设	2006	2006年09期	【机构】 北大方正技术研究院 ；	公文处理 ； 北大方正 ； 一体化解决方案 ； 电子公文 ； 数据交换平台 ； 档案处 ； 公文管理 ； 功能需求 ； 数字档案馆 ； 可集成性 ；	公文档案一体化管理的困局在政府部门“办公”的一个重要内容就是日常的收文、办文和发文,公文处理是政府机关处理公务和行政管理的重要工具。政府部门依靠网络信息技术对公文进行高效有序的电子化处理,是当今电子政务建设重要组成部分。随着信息化建设迅猛发展,办公自动化系统和档案管理系统都已日趋成熟,国内外流行很多平台级技术产品,很多厂商依据现实需求推出不同的无纸化办公产品、档案管理产品。很多政府机关都已经建立起公文流转、公文传输及电子文件中心等公文应用,但是作为公文处理另一环节——档案管理正面临着如何与时俱进问题。这些产品技术功能可扩展性,公文档案之间无缝衔接的可集成性等弱点日渐凸显。当前,各厂商虽然拥有非	2006年09期_实用+高效+便捷——北大方正技术研究院公文档案一体化解决方案.pdf	http://sso.cdclib.org/interlibSSO/goto/6/=06190596Z93/kcms/detail/detail.aspx?dbCode=cjfq&filename=XXJS200609019&dbname=CJFD0608
寻找钢铁行业信息化的“最佳实践”	信息化建设	2006	2006年09期	【作者】 吴倚天 ；	钢铁工业 ； 钢铁企业 ； 业务实践 ； 钢铁强国 ； 钢铁生产国 ； 集中度 ； 支柱型产业 ； 分布实施 ； 软件巨头 ； 铁业 ；	2006年7月24日,国际软件巨头SAP公司正式对外发布了针对钢铁行业信息化的解决方案——最佳业务实践(BestPractices)。在此之前,SAP公司已经在20多个行业中推出过类似的方案,但与以往不同的是,这次的“最佳业务实践”首次以中国为蓝本,在中国率先推出。这一事件,折射出当前中国“世界第一钢铁大国”的地位,更映衬了我国钢铁行业信息化的巨大发展空间。从钢铁大国到钢铁强国中国钢铁行业保持着许多“世界之最”棗自1996年钢产量首次超过1亿吨大关并跃居世界第一位以后,中国钢产量便已连续10年居世界第一,同时还是世界上最大的钢铁生产国、最大的钢铁消费国、最大的钢铁净进口国和最大的铁矿石进口国。	2006年09期_寻找钢铁行业信息化的“最佳实践”.pdf	http://sso.cdclib.org/interlibSSO/goto/6/=06190596Z93/kcms/detail/detail.aspx?dbCode=cjfq&filename=XXJS200609020&dbname=CJFD0608
国门配上“全球眼”——浙江电信助推国检监管信息化纪实	信息化建设	2006	2006年09期	【作者】 应剑涛 ；	浙江电信 ； 监管信息化 ； 中国电信 ； 电子口岸 ； 检验检疫监管 ； 严密监管 ； 视频监控系统 ； 经济繁荣发展 ； 检疫机构 ； 信息港 ；	位于东海之滨的宁波是我国重要的港口城市,近年来,外贸企业发展迅速,并以每年20%的速度增长,出入境检验检疫工作量随之迅猛增加。浙江电信发挥优势,成功地将中国电信“全球眼”业务应用于检验检疫领域,使出入境检验检疫施检人员不出门就能办公,也使宁波率先在全国实施电子检验检疫,实现“提速、减负、增效和严密监管”的大通关建设目标。此举,不仅为检验检疫带来新的监管模式,成为宁波口岸建设的一个重要亮点,同时,在构建“数字宁波”,促进地方经济繁荣发展中,走出了一条探索价值链合作共赢的业务拓展模式之路。今年7月“,宁波国检‘全球眼’电子监管应用项目”被第六届中国信息港论坛组委会、中国信息化应用市场调查组委会评为	2006年09期_国门配上“全球眼”——浙江电信助推国检监管信息化纪实.pdf	http://sso.cdclib.org/interlibSSO/goto/6/=06190596Z93/kcms/detail/detail.aspx?dbCode=cjfq&filename=XXJS200609021&dbname=CJFD0608
用存储技术监管网络行为	信息化建设	2006	2006年09期	【作者】 李莉莉 ；	网络编辑 ； 技术监管 ； 非法信息 ； 物理存储 ； 数据覆盖 ； 连续数据保护 ； 维权成本 ； 天下文章 ； 快照技术 ； 专业工具 ；	网络在给人们的生活带来方便的同时,也为一些人通过网络大搞违法活动创造了新的条件。某犯罪嫌疑人用新浪邮箱在网上狂散非法信息。此人做的非常诡秘,每次发完信后都把信件从邮箱中删除。在确认这个犯罪嫌疑人使用的邮箱后,警察开始行动了。警察首先找到了存放此嫌疑人邮件的服务器,然后为该服务器单独配置了一台容量很大的存储设备。之所以这样做,是希望此嫌疑人在删除了邮件后,存放其邮件的那段物理存储空间不会立即被其他数据覆盖,为恢复邮件创造前提。这招果然有了效果,不久后,当该嫌疑人又一次用邮箱从事非法活动并删除了邮件后,警察迅速从服务器上恢复了那些邮件,拿到了铁的证据。警察找到犯罪嫌疑人后,他还疑惑被删除的网邮件是	2006年09期_用存储技术监管网络行为.pdf	http://sso.cdclib.org/interlibSSO/goto/6/=06190596Z93/kcms/detail/detail.aspx?dbCode=cjfq&filename=XXJS200609022&dbname=CJFD0608
信息化在线	信息化建设	2006	2006年09期		电子政务 ； 政务信息 ； 审批服务中心 ； 信息化办公室 ； 门户网 ； 金算盘 ； 灾难恢复中心 ； 跟踪问效 ； 信息安全 ； 国税局 ；	政策Policies【政策】陕西省出台电子政务建设专项资金管理暂行办法近日,陕西省出台《陕西省电子政务建设专项资金管理暂行办法》,此办法经省信息化领导小组批准,并正式印发执行。《资金管理办法》明确了专项资金的主要用途、审核程序,以及对专项资金的监督管理和跟踪问效。同时省政府原则同意了《陕西省信息化领导小组办公室关于电子政务重点建设项目和资金概算的意见(》陕信化办字【2006】2号)所确定的建设项目。按照省信息化领导小组会议有关决定,由省信息化领导小组办公室会同省发改委、省财政厅认真抓好电子政务项目建设工作的落实,保证各项建设任务的按期完成。【政策】湖南常德出台《政务信息网上公开暂行办法》为加强	2006年09期_信息化在线.pdf	http://sso.cdclib.org/interlibSSO/goto/6/=06190596Z93/kcms/detail/detail.aspx?dbCode=cjfq&filename=XXJS200609023&dbname=CJFD0608
行百里者半九十	信息化建设	2006	2006年08期	【作者】 边吉布 ；	政务信息化 ； 电子政务 ； 我国政府部门 ； 常设性 ； 领域信息化 ； 网站安全 ； 困难度 ； 网站内容 ； 小组讨论 ； 反馈信息 ；	全国政府系统政务信息化培训班开办至今,已顺利地完成了九期普训班、四期专训班的培训,来自国务院各部门、各省、市(直辖市、自治区)、副省级城市和新疆生产建设兵团办公厅政务信息化的分管领导、技术主管和技术骨干,以及全国27个省市(区)地市级人民政府办公室政务信息化分管领导,共计700多人参加了学习。作为我国政府系统第一个常设性的政务信息化培训班,它的设立,不仅为我国政府领域信息化建设提供了一个宝贵的交流平台,更是成为一个培育政务信息化人才的摇篮。这个班刚刚开设的时候,曾招致一些怀疑的目光。毕竟,在我国政府系统内,如此大规模、常规化的政务信息化培训班从来没办过,它的对象有省部、地市、县级等不同级别,培	2006年08期_行百里者半九十.pdf	http://sso.cdclib.org/interlibSSO/goto/6/=06190596Z93/kcms/detail/detail.aspx?dbCode=cjfq&filename=XXJS200608000&dbname=CJFD0608
名刊摘要	信息化建设	2006	2006年08期		有线局域网 ； 信息安全性 ； 新奇独特 ； 高速传输技术 ； 风趣幽默 ； 就业形势 ； 信息时代 ； 现实生活 ； 世界经济格局 ； 汉语词典 ；	网络语言的前世今生网络语言因其自身具有的缩略简约、新奇独特和风趣幽默而受到部分网民的热捧,但仍然存在一定的问题。问题之一是少数网民使用的网络语言不道德、不文明;问题之二是网络语言一味追求简洁,追求新奇独特,造出了大量的生造词语;问题之三是当前网络语言已不甘心只在网络上生存,开始走出虚拟的网络进入现实生活。比如用“东东”代替“东西”,用“886”代替“拜拜了”。为此,对待网络语言要有一个正确的态度。在接受它存在的事实的同时,要用发展的眼光来看待它。要加强宣传,适当引导。要提高语言修养,加强语言规范意识。要加强研究,合理吸收运用。在此基础上,再合理地吸收运用,那些生动的、有群众基础和一定理据的网络	2006年08期_名刊摘要.pdf	http://sso.cdclib.org/interlibSSO/goto/6/=06190596Z93/kcms/detail/detail.aspx?dbCode=cjfq&filename=XXJS200608001&dbname=CJFD0608
充分发挥信息化作用 加快江西崛起进程	信息化建设	2006	2006年08期	【作者】 吴新雄 ；	国家信息化 ； 信息产业 ； 发展战略 ； 电子政务 ； 业务应用系统 ； 跨越式发展 ； 信息化发展水平 ； 欠发达地区 ； 信息基础设施 ； 城乡数字鸿沟 ；	在省委省政府的领导和高度重视下,“十五”时期,江西省信息化步伐进一步加快,信息基础设施快速发Informatiza展,信息产业发展加快,政务信息化取得重大进展,企业信息化初见成效,服务业信息化稳步发展。这些成绩的取得,为“十一五”期间进一步提升我省信息化水平、促进我省经济社会又快又好地发展打下了坚实的基础。去年年底,温家宝总理主持召开了国家信息化领导小组第五次会议,审议并原则通过了2006-2020国家信息化发展战略。对于这次会议的精神,我们要认真学习、深刻领会,增强抓好信息化工作的责任感和主动性。要充分认识信息化对江西发展的重要意义,江西已经进入了加快发展的新阶段,但是作为经济欠发达地区的地	2006年08期_充分发挥信息化作用+加快江西崛起进程.pdf	http://sso.cdclib.org/interlibSSO/goto/6/=06190596Z93/kcms/detail/detail.aspx?dbCode=cjfq&filename=XXJS200608002&dbname=CJFD0608
加快信息化建设 打造“智能型”天津	信息化建设	2006	2006年08期	【作者】 杨栋梁 ；	信息服务业 ； 电子政务 ； 中心城市 ； 历史机遇 ； 信息产业 ； 新型元器件 ； 信息技术 ； 电子信息 ； 整体信息化 ； 信息基础设施 ；	“十五”时期,在市委、市政府正确领导下,天津市上下全面落实科学发展观,牢固树立“高水平是财富,低水平是包袱”的发展理念,顽强拼搏,扎实工作,信息化建设取得了非常显著的成绩。突出表现在以下几个方面:第一,信息基础设施建设实现跨跃发展。第二,初步建成具有天津特点的信息技术推广应用体系。第三,电子信息产业保持了持续快速发展。第四,城市整体信息化水平在国内外产生重要影响。此外,通过多年的不懈努力,天津信息化发展环境也得到明显改善。信息化法制建设取得新进展,信息安全建设得到明显加强,信息化人才建设体系初步形成,对外宣传与合作交流取得新成绩,形成了产业政策优势明显、配套水平一流、集聚效应显著、具有较强辐射	2006年08期_加快信息化建设+打造“智能型”天津.pdf	http://sso.cdclib.org/interlibSSO/goto/6/=06190596Z93/kcms/detail/detail.aspx?dbCode=cjfq&filename=XXJS200608003&dbname=CJFD0608
以公众为中心的电子政务趋势研究	信息化建设	2006	2006年08期	【作者】 胡小明 ；	电子政务 ； 公众服务 ； 政务信息公开 ； 趋势研究 ； 政务信息化 ； 地区经济 ； 官僚机构 ； 网站信息 ； 创新导向 ； 欠发达地区 ；	一、电子政务的全球趋势1“.以公众为中心”是发达国家电子政务的共同特点研究发达国家电子政务的规划、报告可以清楚看到“以公众为中心”是其制定电子政务战略的重要出发点,美国2002年电子政务战略的报告中明确提出电子政务三原则:(1)以公民为中心,而不是以官僚机构为中心;(2)以结果为导向,大大改善为公民服务的质量;(3)以市场为基础,积极推动创新。报告指出:“过去以政府机构为中心的做法已经制约政府生产力的提高,限制为公民服务的能力”,必须代之“以公民为中心”的新模式。英国2000年PIU报告《21世纪政务》以及联合国2002年报告《从全球角度检视电子政务》也表达了同样的观点,充分显示出电子政务越成	2006年08期_以公众为中心的电子政务趋势研究.pdf	http://sso.cdclib.org/interlibSSO/goto/6/=06190596Z93/kcms/detail/detail.aspx?dbCode=cjfq&filename=XXJS200608004&dbname=CJFD0608
我们需要怎样的“一把手工程”?	信息化建设	2006	2006年08期	【作者】 吴倚天 ；	政务信息化 ； 电子政务 ； 客观环境因素 ； 角色定位 ； 机构设置 ； 顶层设计 ； 部门间 ； 门户网 ； 网站信息 ； 西子湖畔 ；	参加了几期“全国政务信息化培训班”感触良多。在西子湖畔,来自天南海北的代表们针对当前我国政务信息化建设中遇到的问题开怀畅言,各抒己见,提供了很多电子政务第一线的宝贵信息。综合各方意见,最具典型意义的问题包括以下几个:领导重视不够、信息化机构设置不合理、系统平时运行维护缺乏制度保障、信息化资金不能及时到位、缺乏监督与评估、缺乏充足的人员保障等。在讨论中,笔者还发现一个有意思的现象:假如追本溯源,分析上述问题形成原因的话,除了某些客观环境因素,几乎所有矛头都指向第一条——领导重视不够。也就是说,领导因素成了导致其他问题出现的源头。最近几年信息化在各地的发展,也确能证明领导重视和地方信息化发展存在着密切的正相关关系。这种现象就是我们耳熟能详的“一把手工程”。按理说这一现象由来已久,并不新鲜,但参加完这些讨论会,笔者留下的一个深刻感受是:在我国的政务信息化建设中,“一把手”们所发挥的作用正与日俱增,其能量不断膨胀,有时甚至个人之力便能左右整个信息化建设的全局。由此,探讨“一把手”在电子政务建设中的角色定位已成为一个非常重要而紧迫的问题。	2006年08期_我们需要怎样的“一把手工程”?.pdf	http://sso.cdclib.org/interlibSSO/goto/6/=06190596Z93/kcms/detail/detail.aspx?dbCode=cjfq&filename=XXJS200608005&dbname=CJFD0608
浅谈政府门户网站建设中的公共服务 全国政府系统政务信息化培训班第三组讨论报告	信息化建设	2006	2006年08期	【作者】 王红 ； 黄定贵 ； 【机构】 贵州省人民政府信息管理中心 ； 青海省人民政府信息技术办公室 ；	政务信息化 ； 门户网 ； 网站建设 ； 电子政务 ； 公共服务模式 ； 公共服务建设 ； 发布机制 ； 网站信息 ； 公共服务制度 ； 领导责任 ；	全国政府系统政务信息化第三期培训班从2006年6月1日开班以来,我们学习了《互联互通的应用平台建设》、《电子政务概论》、《政府门户网站的建设与管理》等课程,学员通过学习,开阔了思路,了解到了电子政务建设需要掌握的基本知识、基本思路和方法,电子政务知识得到了不同程度的提高。6月6日下午,按照培训班安排,来自安徽、贵州、四川、青海、西藏的学员参加了第三小组的讨论会,学员们针对政府门户网站的服务功能、服务方向、服务模式等方面谈了本地区的成功做法、当前存在的问题和应采取的措施。一、对政府门户网站建设中公共服务的认识建设公共服务型政府是加强党的执政能力建设的重要任务,对于落实科学发展观、实现经济的长期稳	2006年08期_浅谈政府门户网站建设中的公共服务+全国政府系统政务信息化培训班第三组讨论报告.pdf	http://sso.cdclib.org/interlibSSO/goto/6/=06190596Z93/kcms/detail/detail.aspx?dbCode=cjfq&filename=XXJS200608006&dbname=CJFD0608
加强信息安全建设的几点认识	信息化建设	2006	2006年08期	【作者】 董振国 ； 【机构】 河北省政府办公厅技术处 处长 ；	信息安全建设 ； 安全标准体系 ； 网络信息系统 ； 安全技术手段 ； 网络与信息 ； 政务网络 ； 信息网络安全 ； 网络互联 ； 政务信息化 ； 病毒入侵 ；	参加这次全国政府系统政务信息化培训班,通过听取信息网络安全方面的专家授课,结合近几年的实际工作进行交流研讨,使我对加强信息安全建设又有了一些新的认识。一、强化安全保密意识,高度重视信息安全,是确保政务网络信息系统安全运行的前提条件信息安全建设是电子政务建设不可缺少的重要组成部分。电子政务信息系统承载着大量事关国家政治安全、经济安全、国防安全和社会稳定的数据和信息;网络与信息安全不仅关系到电子政务的健康发展,而且已经成为国家安全的重要组成部分。缺乏安全保障的电子政务信息系统,不可能实现真正意义上的电子政务。目前电子政务信息系统大都是采用开放式的操作系统和网络协议,存在着先天的安全隐患。网络攻击、	2006年08期_加强信息安全建设的几点认识.pdf	http://sso.cdclib.org/interlibSSO/goto/6/=06190596Z93/kcms/detail/detail.aspx?dbCode=cjfq&filename=XXJS200608007&dbname=CJFD0608
论我国电子政务发展的策略	信息化建设	2006	2006年08期	【作者】 宋庆蓉 ； 【机构】 广西壮族自治区政府办公厅技术处 ；	电子政务 ； 政府业务 ； 信息系统工程 ； 管理信息系统 ； 市场占有份额 ； 考勤管理 ； 项目组织实施 ； 项目分解 ； 项目管理 ； 总体结构 ；	在信息时代,就像管理信息系统是管理企业必备的手段一样、电子政务已成为治国不可或缺的工具。信息化使许多政府原来不可能做到的事情不仅可以做到,而且可以做得更快、更好,帮助政府实现对国家的有效管理。今天,无论经济与社会的发展或者国家安全的保障,都离不开电子政务的支持。在经济和信息全球化快速发展的情况下,一个信息化的政府已经成为一个国家或地区在全球竞争中的一个竞争力要素,也是提升国家和地区全球竞争力,争得经济和社会发展“先机”的关键。电子政务的发展对我国的经济和社会发展,特别是信息产业的发展将有着十分重要的影响。电子政务的发展还将对我国各行各业信息化的发展,包括电子商务和电子社区的发展,起着示范作用。	2006年08期_论我国电子政务发展的策略.pdf	http://sso.cdclib.org/interlibSSO/goto/6/=06190596Z93/kcms/detail/detail.aspx?dbCode=cjfq&filename=XXJS200608008&dbname=CJFD0608
网络环境下的科技研发管理系统建设	信息化建设	2006	2006年08期	【作者】 吕明理 ； 【机构】 中国科学院研究生院管理学院 ；	管理系统建设 ； 研发管理 ； 体系结构设计 ； 功能模块 ； 管理子系统 ； 管理工作效率 ； 系统体系结构 ； 系统管理模块 ； 用户界面 ； 软件体系结构 ；	二十一世纪信息技术的发展日新月异,特别是网络环境的不断改进,为各种信息系统的建设提供了先进的技术环境保障。目前,网络环境下的科技研发管理系统建设已经成为电子政务系统和大型企业信息化的重要组成部分,本文结合作者多年对科技研发管理的研究以及多个科技研发管理系统的建设实践经验,探讨一下网络环境下的科技研发管理系统建设问题。一、问题的提出作为国内主要政府部门、大型企业和研发机构的科技研发管理,往往具有技术性要求高、研发项目多、项目研发周期长、管理不够规范和不能实时监控等特点,具体科技研发管理内容一般包括:科技项目、科技成果、科技信息和科技奖励等,而作为核心的科技项目管理内容包括:项目申报、项目评审、签	2006年08期_网络环境下的科技研发管理系统建设.pdf	http://sso.cdclib.org/interlibSSO/goto/6/=06190596Z93/kcms/detail/detail.aspx?dbCode=cjfq&filename=XXJS200608009&dbname=CJFD0608
网络信任体系建设现状所带来的思考	信息化建设	2006	2006年08期	【作者】 谢东辉 ； 【机构】 上海市人民政府办公信息处理中心 ；	网络信任 ； 授权管理 ； 信息安全 ； 公钥基础设施 ； 管理基础设施 ； 应用系统 ； 责任认定 ； 电子政务安全 ； 安全管理体制 ； 数字证书认证 ；	随着计算机信息技术的飞速发展,信息网络国际化、社会化、开放化和个人化的特点在给人们带来方便、高效和信息共享的同时,也给信息安全带来许多问题。中办、国办印发《2006━2020年国家信息化发展战略》中提到:全面加强国家信息安全保障体系建设。坚持积极防御、综合防范,探索和把握信息化与信息安全的内在规律,主动应对信息安全挑战,实现信息化与信息安全协调发展。此举标志着国家在大力倡导政府部门信息化建设的同时,已经充分意识到信息安全的重要性和紧迫性。如何保证网络的安全性已经成为电子政务建设过程中亟待解决的问题。现今,在网络信息交互的应用环境中,除了信息加密等措施以外,还需解决信任问题,网络的信任体系是保证	2006年08期_网络信任体系建设现状所带来的思考.pdf	http://sso.cdclib.org/interlibSSO/goto/6/=06190596Z93/kcms/detail/detail.aspx?dbCode=cjfq&filename=XXJS200608010&dbname=CJFD0608
