title	journal_name	year	issue	author	keywords	summary	pdf_filename	article_url
“千里眼”与“顺风耳”	信息化建设	2006	2006年Z1期	【作者】 边吉布 ；	门户网 ； 电子政务 ； 总体应急预案 ； 政民互动 ； 我国政府部门 ； 应急管理系统 ； 政务信息 ； 网络民意 ； 网上服务 ； 网站建设 ；	<正>新年伊始,有两件大事牵动着我们的心。一是2006年1月1日零时,在经过了三个月的试运行之后,中华人民共和国“中央政府门户网站”(以下简称“央网”)正式开通,互联网上从此出现了国家名义的“政府之窗”;二是2006年1月8日,《国家突发公共事件总体应急预案》正式发布,我国对突发公共事件的处理有了一份全国性的“总纲”。	2006年Z1期_“千里眼”与“顺风耳”.pdf	http://sso.cdclib.org/interlibSSO/goto/6/=06190596Z93/kcms/detail/detail.aspx?dbCode=cjfq&filename=XXJS2006Z1001&dbname=CJFD0608
名刊摘要	信息化建设	2006	2006年Z1期		卫生信息化 ； 公共卫生 ； 传染病报告 ； 统计信息中心 ； 信息系统 ； 电子病历 ； 医生工作站 ； 安全等级保护 ； 信息安全保护 ； 中国政府网站 ；	<正>“金卫工程”呼之欲出卫生信息化驶入快车道 2003年非典过后,国家加强了传染病报告信息系统建设。不到3年时间,就实现了党中央关于公共卫生“纵向”到底的要求,即从乡卫生院到中央一级,全部照国家规定在线报告。这在国际、国内均是惊人之举．	2006年Z1期_名刊摘要.pdf	http://sso.cdclib.org/interlibSSO/goto/6/=06190596Z93/kcms/detail/detail.aspx?dbCode=cjfq&filename=XXJS2006Z1002&dbname=CJFD0608
中国电子政务建设一个里程碑式的标志 中国政府网新年精彩亮相	信息化建设	2006	2006年Z1期	【作者】 边炽 ；	中国电子政务 ； 门户网 ； 政务信息 ； 网站建设 ； 地质工作 ； 中国政府网站 ； 国家行政学院 ； 网上办事 ； 网络民意 ； 汪玉凯 ；	<正>新华社消息:2005年12月28日, 国务院总理温家宝主持召开国务院常务会议,研究部暑加强地质工作,听取中央政府门户网站建设情况汇报。……会议听取了国务院办公厅关于中央政府门户冈站建设情况的汇报,同意中央政府门户网站于2006年1月1日正式开通。会议指出,建设并开通中央政府门户网站,是推进政府管理方	2006年Z1期_中国电子政务建设一个里程碑式的标志+中国政府网新年精彩亮相.pdf	http://sso.cdclib.org/interlibSSO/goto/6/=06190596Z93/kcms/detail/detail.aspx?dbCode=cjfq&filename=XXJS2006Z1003&dbname=CJFD0608
2006:中国电子政务发展展望	信息化建设	2006	2006年Z1期	【作者】 汪玉凯 ； 【机构】 国家行政学院公共管理教研部 教授、北京大学政府管理学院博士生导师、国务院电子政务示范工程总体专家组成员 ；	中国电子政务 ； 发展展望 ； 政务信息化 ； 行政环境 ； 门户网 ； 政府网站建设 ； 顶层设计 ； 公众服务 ； 部门利益 ； 政府专网 ；	<正>对中国电子政务来说,2005年无论如何都是值得关注的一年。这不仅表现在经过几年的建设和发展． 2005年,就全国而言,各方面对于电子政务建设的认识更加理性,同时还表现出以下一些特征:一是以中央两办的34号文件为契机,信息资源的开发、利用得到了各方面的普遍重视;二	2006年Z1期_2006:中国电子政务发展展望.pdf	http://sso.cdclib.org/interlibSSO/goto/6/=06190596Z93/kcms/detail/detail.aspx?dbCode=cjfq&filename=XXJS2006Z1004&dbname=CJFD0608
推进农业信息化进程 提高服务“三农”工作水平	信息化建设	2006	2006年Z1期	【作者】 宋恩华 ； 【机构】 河北省人民政府 副省长 ；	农业信息化建设 ； 信息网络建设 ； 农业信息网 ； 信息服务水平 ； 信息资源开发 ； 农业信息资源 ； 基层农业 ； 高效农业 ； 信息化专家 ； 信息办 ；	<正>解决好“三农”问题是当前党和政府工作的重中之重。近年来, 河北省坚持以提高信息服务水平为目标．以需求为导向,以应用为目的,以信息网络建设为支撑,以信息资源开发和共享为核心,大力推进农业信息化进程,取得了一些成效。	2006年Z1期_推进农业信息化进程+提高服务“三农”工作水平.pdf	http://sso.cdclib.org/interlibSSO/goto/6/=06190596Z93/kcms/detail/detail.aspx?dbCode=cjfq&filename=XXJS2006Z1005&dbname=CJFD0608
中国制造业信息化的现状与发展	信息化建设	2006	2006年Z1期	【作者】 马颂德 ； 【机构】 科技部 副部长 ；	中国工业 ； 中国制造 ； 软硬件产品 ； 单位产品能耗 ； 制造装备 ； 国产数控机床 ； 新产品开发周期 ； 数控装备 ； 市场占有率 ； 网上采购 ；	<正>众所周知,中国制造业在中国经济总量和中国出口总量中占很高比例。2003年中国制造业工业增加值占中国GDP的36％,占中国工业增加值的81。2%。但中国制造业与发达国家相比仍有很大差距,表现在:	2006年Z1期_中国制造业信息化的现状与发展.pdf	http://sso.cdclib.org/interlibSSO/goto/6/=06190596Z93/kcms/detail/detail.aspx?dbCode=cjfq&filename=XXJS2006Z1006&dbname=CJFD0608
全面落实科学发展观 加快推进企业信息化 增强中央企业 竞争力	信息化建设	2006	2006年Z1期	【作者】 李伟 ； 【机构】 国务院国有资产监督管理委员会 副主任 ；	世界经济 ； 信息技术 ； 资产经营 ； 资金使用效率 ； 首席信息官 ； 资产损失 ； 预算管理 ； 战略规划 ； 竞争能力 ； 信息沟通 ；	<正>一、强化信息化建设是国民经济发展及中央企业整体素质提高的迫切需要 (一)加快信息化建设是党的十六大作出的重要部署信息技术是当今世界经济和社会发展的重要驱动力。党的十六大明确提出:“坚持以信息化带动工业化,以	2006年Z1期_全面落实科学发展观+加快推进企业信息化+增强中央企业+竞争力.pdf	http://sso.cdclib.org/interlibSSO/goto/6/=06190596Z93/kcms/detail/detail.aspx?dbCode=cjfq&filename=XXJS2006Z1007&dbname=CJFD0608
电子政务前台——后台服务体系与地方电子政务顶层设计	信息化建设	2006	2006年Z1期	【作者】 李广乾 ； 【机构】 国务院发展研究中心技术经济研究部 博士 ；	电子政务 ； 顶层设计 ； 后台服务 ； 政府绩效管理 ； 业务网 ； 参考模型 ； 管理模块 ； 帐户管理 ； 数据交换 ； 互操作性 ；	<正>近两年来．有关电子政务或信息化的“顶层设计”这个概念用得非常频繁。但时至今日,人们对此却仍然没有一个权威的定义与说法。其实,简单地说,所谓项层设计即是就某个对象进行全面系统的规划与设计。电子政务的顶层设计应该是就电子政	2006年Z1期_电子政务前台——后台服务体系与地方电子政务顶层设计.pdf	http://sso.cdclib.org/interlibSSO/goto/6/=06190596Z93/kcms/detail/detail.aspx?dbCode=cjfq&filename=XXJS2006Z1008&dbname=CJFD0608
应急联动系统规划与部门信息资源建设	信息化建设	2006	2006年Z1期	【作者】 黄以宽 ；	应急联动系统 ； 办公自动化 ； 部门化 ； 管理信息系统 ； 信息资源 ； 八十年代 ； 政府信息化建设 ； 资源调度 ； 软件系统 ； 资源共享 ；	<正>从八十年代的“办公自动化”开始到现在,我国在信息化上的投入累计接近万亿元。这其中,政府信息化建设占整个中国行业IT投入的 20％以上。这些投入中,有大量的信息化基础设施和应用成果逐渐积淀在各个政府管理部门中．成为一种部门化的设施,由此也形成了一种“部门化”的格局。	2006年Z1期_应急联动系统规划与部门信息资源建设.pdf	http://sso.cdclib.org/interlibSSO/goto/6/=06190596Z93/kcms/detail/detail.aspx?dbCode=cjfq&filename=XXJS2006Z1009&dbname=CJFD0608
以统一网络平台建设为契机 推动欠发达地区电子政务发展	信息化建设	2006	2006年Z1期	【作者】 张勇进 ； 【机构】 北京大学政府管理学院 ；	电子政务 ； 欠发达地区 ； 网络平台建设 ； 政务信息化 ； 政务外网 ； 政府信息资源 ； 地区经济 ； 政务部门 ； 政府信息化建设 ； 政府机构改革 ；	<正>近年来,我国的电子政务建设取得了长足进展,但随之也产生了经济发达地区与经济欠发达地区“数字鸿沟”日益拉大的现象,如长此以往,势必将阻碍我国政务信息化综合效益的提高,有违电子政务服务于民的宗旨,同时加剧地区间本已存在的发展不平衡。如何帮助经济欠发达地区找到一条适合自身实际的电子政务之路,使电子政务成为弭合而不是	2006年Z1期_以统一网络平台建设为契机+推动欠发达地区电子政务发展.pdf	http://sso.cdclib.org/interlibSSO/goto/6/=06190596Z93/kcms/detail/detail.aspx?dbCode=cjfq&filename=XXJS2006Z1010&dbname=CJFD0608
“小步快跑”的石家庄电子政务	信息化建设	2006	2006年Z1期	【作者】 吴倚天 ；	平原腹地 ； 电子政务 ； 西连 ； 小步快跑 ； 交通通讯 ； 网站集群 ； 门户网 ； 信息中心主任 ； 空白领域 ； 府副 ；	<正>河北省会石家庄,地处华北平原腹地,东临渤海、西连太行、南接中原、北靠京津。这里自然资源丰富,交通通讯便利,往来于北京之间的火车每隔几分钟就有一趟。	2006年Z1期_“小步快跑”的石家庄电子政务.pdf	http://sso.cdclib.org/interlibSSO/goto/6/=06190596Z93/kcms/detail/detail.aspx?dbCode=cjfq&filename=XXJS2006Z1011&dbname=CJFD0608
创新的动力 源于超越的梦想——SEP文档库技术使中国企业在软件核心领域首次取得“零”的突破	信息化建设	2006	2006年Z1期	【作者】 邓波 ；	软件核心 ； SEP ； 文档库 ； 文档格式 ； 电脑使用者 ； 操作方法 ； 超越的 ； 文档处理 ； 革命性影响 ； 产业分工 ；	<正>使用电脑撰写制作各种文件、报表,是每一个电脑使用者最常用的功能,而面对各种不同格式的文档,使用不同的软件进行操作也是大家习以为常的事。Word有自己的文档格式和操作方法,Excel有自己的文档格式和操作方法,AutoCAD也有	2006年Z1期_创新的动力+源于超越的梦想——SEP文档库技术使中国企业在软件核心领域首次取得“零”的突破.pdf	http://sso.cdclib.org/interlibSSO/goto/6/=06190596Z93/kcms/detail/detail.aspx?dbCode=cjfq&filename=XXJS2006Z1012&dbname=CJFD0608
立足应用 整合资源 创新机制 努力提高政府网站运行管理水平——浙江省政府秘书长冯顺桥在中国浙江政府门户网站新版开通一周年座谈会上的讲话	信息化建设	2006	2006年Z1期		门户网 ； 中国浙江 ； 运行管理水平 ； 网站建设 ； 国际排名 ； 国务院信息办 ； 上报工作 ； 网站内容 ； 网上服务 ； 组织体系 ；	<正>浙江省政府门户网站工作一直以来得到了省政府领导尤其是吕省长的重视和关心。新版开通一年来, 中国浙江政府门户网站在各地、各部门的密切配合和社会各界的大力支持下,保持了正常、稳定、上升的运行态势,主网站访问量增加,国际排名上升。在2005年3月国务院信息办公布的评估报告中．网站名列省级第三;9	2006年Z1期_立足应用+整合资源+创新机制+努力提高政府网站运行管理水平——浙江省政府秘书长冯顺桥在中国浙江政府门户网站新版开通一周年座谈会上的讲话.pdf	http://sso.cdclib.org/interlibSSO/goto/6/=06190596Z93/kcms/detail/detail.aspx?dbCode=cjfq&filename=XXJS2006Z1013&dbname=CJFD0608
政务信息化建设的有效组织与管理——“我与政务信息化建设共舞”(五)	信息化建设	2006	2006年Z1期	【作者】 刘泉宝 ； 【机构】 广州市政府办公厅政务信息中心 主任 ；	政务信息化 ； 信息办 ； 部门职责 ； 部门信息化 ； 应用系统 ； 系统集成 ； 承建方 ； 个人机 ； 应用软件 ； 绩效评估方法 ；	<正>在政务信息化建设走过了10多个年头后,当我们分享其带给我们工作和生活等方面便利的同时, 有必要认真总结和探索一下政务信息化建设的有效组织与管理这一问题, 而且现在也到了该认真思考这个问题的时候了。当前,我国政务信息化建设的组织和管理我认为正处于“从无	2006年Z1期_政务信息化建设的有效组织与管理——“我与政务信息化建设共舞”(五).pdf	http://sso.cdclib.org/interlibSSO/goto/6/=06190596Z93/kcms/detail/detail.aspx?dbCode=cjfq&filename=XXJS2006Z1014&dbname=CJFD0608
以门户网站为支撑 全面推进政府信息公开	信息化建设	2006	2006年Z1期	【作者】 江东 ； 【机构】 宁波市江东区政府信息化建设办公室 ；	门户网 ； 政民互动 ； 网站管理 ； 互动栏目 ； 办事流程 ； 电子政务 ； 网上办事 ； 义务主体 ； 公众监督 ； 网站建设 ；	<正>列宁曾说,“没有公开性而谈民主制是很可笑的”。人民行使管理国家的权力,是以对公共事务的了解为前提的。而对公共事务的了解,必须建立在信息公开的基础上。政府作为是信息公开的义务主体,对此责无旁贷。幸运的是,信息时代为政府信息公开提供了一个具有及时性、广泛性、完整性等等优点的平台．那就是政府门户网站。创立于2001年的“宁波·江东”政府网站,就是这样一个政府信息公开	2006年Z1期_以门户网站为支撑+全面推进政府信息公开.pdf	http://sso.cdclib.org/interlibSSO/goto/6/=06190596Z93/kcms/detail/detail.aspx?dbCode=cjfq&filename=XXJS2006Z1015&dbname=CJFD0608
以电子政务之翼 助民航事业腾飞 ——强化应用成为中国民航 电子政务一期项目最大特色	信息化建设	2006	2006年Z1期	【作者】 邓波 ；	电子政务 ； 运营管理 ； 现代化建设 ； 信息技术 ； 地区管理局 ； 航空协定 ； 应用信息化 ； 基础网络 ； 政务信息资源 ； 网上管理 ；	民航是我国最早应用信息化手段进行运营管理的行业之一。随着信息技术发展的日新月异,以及民航管理体制改革的深化,如何更好地应用现代信息技术,促进我国民航事业现代化建设,成为民航信息化建设的重要使命。我们欣喜的看到,以应用为立足点的民航电子政务建设取得了阶段性成果,而“应用”也成为民航电子政务建设所有参与者、使用者最重要、最深刻的体会。	2006年Z1期_以电子政务之翼+助民航事业腾飞+——强化应用成为中国民航+电子政务一期项目最大特色.pdf	http://sso.cdclib.org/interlibSSO/goto/6/=06190596Z93/kcms/detail/detail.aspx?dbCode=cjfq&filename=XXJS2006Z1016&dbname=CJFD0608
重在便民——浙江省衢州市“网上办事大厅”建设感想	信息化建设	2006	2006年Z1期	【作者】 徐中华 ； 李振华 ； 【机构】 浙江省衢州市行政服务中心 ； 浙江省衢州市行政服务中心 ；	网上办事 ； 电子政务工程 ； 政务信息化 ； 门户网 ； 核心课题 ； 服务中心 ； 浙江省衢州市 ； 试点市 ； 政务网 ； 审批系统 ；	<正>浙江省衢州市是2000年被列为浙江省政务信息化建设试点市。2004年7月,衢州政务网获2004 中国优秀政府门户网站(地市级)第4 名;同年9月,在2003-2004年中国城市政府门户网站的排行中,居300个普通城市的第10名。作为衢州市电子政务工程的核心课题网上办事大厅,是2002年11月通过公开招投标,在衢州市行政服务中心(以下简称“中心”)内进行开发,	2006年Z1期_重在便民——浙江省衢州市“网上办事大厅”建设感想.pdf	http://sso.cdclib.org/interlibSSO/goto/6/=06190596Z93/kcms/detail/detail.aspx?dbCode=cjfq&filename=XXJS2006Z1017&dbname=CJFD0608
对“十一五”时期信息资源开发利用和共享的思考	信息化建设	2006	2006年Z1期	【作者】 胡坚勇 ； 【机构】 江西省信息中心 高级工程师 ；	政府信息资源 ； 电子信息资源 ； 政务信息 ； 开发利用 ； 资源共享 ； 信息机构 ； 文化信息资源 ； 共享平台建设 ； 信息服务 ； 空间地理 ；	<正>党的十六届五中全会通过的中共中央关于制定“十一五”规划的建议中强调,要加强信息资源的开发和共享。其中政府信息资源的管理、开发、应用和共享更为重中之重,如何为社会、企业、公民提供有效、便捷的全方位、宽领域、跨时空的一站式政务信息服务,成为当前建设透明政府, 责任政府、服务型政府的当务之急。	2006年Z1期_对“十一五”时期信息资源开发利用和共享的思考.pdf	http://sso.cdclib.org/interlibSSO/goto/6/=06190596Z93/kcms/detail/detail.aspx?dbCode=cjfq&filename=XXJS2006Z1018&dbname=CJFD0608
打造“数字柯城” 顺应信息化潮流	信息化建设	2006	2006年Z1期	【作者】 朱国华 ； 【机构】 浙江省衢州市柯城区人民政府办公室 主任 ；	柯城 ； 信息化潮流 ； 信息技术 ； 网络基础 ； 电子政务办公 ； 网上管理 ； 社区信息化 ； 科技信息化 ； 政务信息 ； 终端用户 ；	<正>近年来,衢州市柯城区委、区政府以科学发展观为统领,以统筹城乡发展为主线．以规划为龙头,以155 工程”为抓手,以应用促建设,顺应信息技术的发展趋势, 大力开展“数字柯城”建设,在省、市、区各级领导的重视和关心,全区信息化建设取得了长足发展。	2006年Z1期_打造“数字柯城”+顺应信息化潮流.pdf	http://sso.cdclib.org/interlibSSO/goto/6/=06190596Z93/kcms/detail/detail.aspx?dbCode=cjfq&filename=XXJS2006Z1019&dbname=CJFD0608
黑洞是怎样“炼”成的	信息化建设	2006	2006年Z1期	【作者】 西北窗 ；	电子政务项目 ； 信息化项目 ； 财务预算 ； 经费申请 ； 管理人员 ； 系统运行维护 ； 信息系统 ； 中报 ； 维护费用 ； 服役期 ；	<正>以前虽然作为研发和管理人员亲自参与过一些电子政务项目的建设,但没有经历过诸如经费申请等“后面”的事情。因此对于所谓电子政务的“黑洞现象”,只是听说而已,并无切身体会。从去年起开始试行的市财务预算改革,使我有幸参加了第一次市级信息化项目预算评审,也让我对“黑洞”有了一个感性的认识。	2006年Z1期_黑洞是怎样“炼”成的.pdf	http://sso.cdclib.org/interlibSSO/goto/6/=06190596Z93/kcms/detail/detail.aspx?dbCode=cjfq&filename=XXJS2006Z1020&dbname=CJFD0608
“指”点信息化	信息化建设	2006	2006年Z1期	【作者】 吴会松 ；	电信增值业务 ； 短信业务 ； 互联网新闻 ； 信息终端 ； 播出时间 ； 旋后 ； 水性化 ； 口耳相传 ； 信息获取方式 ； 信息沟通 ；	<正>最“傻瓜”的方式往往最能造就最多的受众和最大的市场。写上几行每个人都认识的汉字, 加上最简便的操作,短信业务就成为了电信增值业务领域最大的市场。而在网络媒体成为“第四媒体”之后,短	2006年Z1期_“指”点信息化.pdf	http://sso.cdclib.org/interlibSSO/goto/6/=06190596Z93/kcms/detail/detail.aspx?dbCode=cjfq&filename=XXJS2006Z1021&dbname=CJFD0608
打造“金安”工程 逐步提高安全生产监管水平	信息化建设	2006	2006年Z1期	【作者】 成炳国 ； 【机构】 山东省安全生产监督管理局 ；	死亡人数 ； 重点监控企业 ； 信息网络 ； 危险源监控 ； 监控系统 ； 资源调度 ； 远程监控 ； 安全质量标准 ； 应急救援预案 ； 决策支持系统 ；	<正>山东省安监局自2001年成立以来,在省委、省政府的正确领导下,各级安监部门扎实工作,开拓创新,稳步推进,使山东省安全生产形势在经济高速发展的情况下逐年好转, 事故死亡人数逐年下降。但是,山东省各类事故死亡人数绝对数仍然排在全国的前列,形势依然严峻。只有不	2006年Z1期_打造“金安”工程+逐步提高安全生产监管水平.pdf	http://sso.cdclib.org/interlibSSO/goto/6/=06190596Z93/kcms/detail/detail.aspx?dbCode=cjfq&filename=XXJS2006Z1022&dbname=CJFD0608
医院信息系统的建立与升级改造探讨	信息化建设	2006	2006年Z1期	【作者】 董祖琰 ； 徐春华 ；	信息系统 ； 系统需求分析 ； 医疗业务 ； 卫生医疗机构 ； 数据准备 ； 软件配置 ； 基础数据 ； 工作流 ； 设计说明书 ； 流程规范 ；	<正>近几年来,随着我国各级卫生医疗机构对医疗卫生行业的信息化建设日趋重视,投资力度不断加大．作为医院信息化基础的医院信息系统(HIS)已在国内50％以上的医疗机构得到广泛的应用,取得了良好的效果。但由于HIS 系统建设初期缺乏统一的规划和规范,很多开发商缺乏对医院业务需求的深入研究,因而忽略了在医疗业务目标、管理思想等环节上的体现,导致了系统“有形无神”。本文就HIS系统的建设与升级改造过程中应注意的问题等作一探讨。	2006年Z1期_医院信息系统的建立与升级改造探讨.pdf	http://sso.cdclib.org/interlibSSO/goto/6/=06190596Z93/kcms/detail/detail.aspx?dbCode=cjfq&filename=XXJS2006Z1023&dbname=CJFD0608
入侵检测系统现状分析	信息化建设	2006	2006年Z1期	【作者】 张光远 ； 【机构】 吉林长春海关技术处 ；	入侵检测系统 ； 应用程序 ； 事件分析器 ； 神经网 ； 内部威胁 ； 系统调用序列 ； snort ； 事件产生器 ； 抓包工具 ； NIDS ；	<正>一、入侵检测系统简介入侵检测(Intrusion Detection,ID)通过监测计算机网络系统的某些信息,加以分析,检测入侵行为,并作出反应。入侵检测系统所检测的系统信息包括系统记录,网络流量,应用程序目志等。入侵定义为未经授权的计算机使用	2006年Z1期_入侵检测系统现状分析.pdf	http://sso.cdclib.org/interlibSSO/goto/6/=06190596Z93/kcms/detail/detail.aspx?dbCode=cjfq&filename=XXJS2006Z1024&dbname=CJFD0608
澄清杀毒软件的几个使用误区	信息化建设	2006	2006年Z1期	【作者】 金颖云 ；	病毒库 ； 专杀工具 ； 查杀 ； 宏病毒 ； 特征码 ； 蠕虫病毒 ； 删除操作 ； 蠕虫类 ； 传播速度 ； 病毒类型 ；	<正>很多人谈到电脑病毒就会想到用杀毒软件杀毒,但是在使用杀毒软件的过程中也存在着种种误区。误区一:杀毒软件是万能的我们经常会听到这样的说法:某款杀毒软件无法查出的病毒,而其他	2006年Z1期_澄清杀毒软件的几个使用误区.pdf	http://sso.cdclib.org/interlibSSO/goto/6/=06190596Z93/kcms/detail/detail.aspx?dbCode=cjfq&filename=XXJS2006Z1025&dbname=CJFD0608
美国电子政务中的民本思想	信息化建设	2006	2006年Z1期	【作者】 余建平 ； 【机构】 抚州市政府 副秘书长、办公室主任 ；	电子政务 ； 网上服务 ； 政务信息网 ； 网上办公系统 ； 门户网 ； 机构臃肿 ； 工商业者 ； 管理体制 ； 办公手段 ； 办公效率 ；	<正>美国是一个资本主义国家．其意识形态与我国完全不同,但其电子政务的发展充分体现了民本思想。虽然美国市民户均电脑拥有量在 80％以上且使用率很高,但多数州、市、郡政府还在本区域内开设网上服务中心,配备数十台电脑．以方便买不起电脑的穷人上网。其电子政务的发展普遍	2006年Z1期_美国电子政务中的民本思想.pdf	http://sso.cdclib.org/interlibSSO/goto/6/=06190596Z93/kcms/detail/detail.aspx?dbCode=cjfq&filename=XXJS2006Z1026&dbname=CJFD0608
欧洲的EGERIS系统	信息化建设	2006	2006年Z1期	【作者】 邵瑜 ；	应急救助 ； 基础结构 ； 人的生命 ； 危机管理 ； 信息技术 ； 终端用户 ； 公共突发事件 ； 导航工具 ； 态势信息 ； 指挥控制中心 ；	<正>在人口密集的欧洲,环境和产业灾害每天威胁着成千上万人的生命,给城市基础结构带来了巨大的破坏。应急救助服务机构经常需要竭力做到及时反应,控制住迅猛发展的局势。IST(Information Society Technologies／信息技术社会组织)的 EGERIS方案的目的就在于提高城市保卫机构和专业人员在危机管理活动中的效率,增加城市的安全性。	2006年Z1期_欧洲的EGERIS系统.pdf	http://sso.cdclib.org/interlibSSO/goto/6/=06190596Z93/kcms/detail/detail.aspx?dbCode=cjfq&filename=XXJS2006Z1027&dbname=CJFD0608
