title	journal_name	year	issue	author	keywords	summary	pdf_filename	article_url
迎接挑战,知难而上	中国计算机用户	2008	2008年12期	【作者】 邱婷 ； 【机构】 北京国能伏安节能科技有限公司 HR经理原北京北大青鸟教育HR经理 ；	员工薪酬 ； 人力资源管理 ； 管理咨询公司 ； 企业竞争 ； 知识工作者 ； 员工忠诚度 ； 需求层次 ； 自主能动性 ； 丰富化 ； 工作环境 ；	<正>案例中的公司是一家管理咨询公司。知识型员工占绝大多数。决定了他在人力资源管理方面特有的一些规则。中国有句古语云:不患寡而患不均虽然目前很多企业都强调员工薪酬保密,但世上没有不透风的	2008年12期_迎接挑战,知难而上.pdf	http://sso.cdclib.org/interlibSSO/goto/6/=06190596Z93/kcms/detail/detail.aspx?dbCode=cjfq&filename=YHJS200812033&dbname=CJFD0608
先规划好知识型企业的HR战略	中国计算机用户	2008	2008年12期	【作者】 刘云峰 ； 【机构】 埃森哲咨询(中国) 高级咨询顾问 ；	知识型企业 ； HR ； 知识密集型企业 ； 员工管理 ； 内部沟通 ； 激励体系 ； 绩效导向 ； 一个问题 ； 考核指标 ； 项目时间 ；	<正>和汇智环球咨询公司一样,很多知识密集型企业都是人才流失的重灾区,对于日益被催生出来的大量的"知识型企业"而言,"知识型员工"是企业的核心资产和资源,因此,如何有效管理知识型员工,最大化且长期有效的激发其	2008年12期_先规划好知识型企业的HR战略.pdf	http://sso.cdclib.org/interlibSSO/goto/6/=06190596Z93/kcms/detail/detail.aspx?dbCode=cjfq&filename=YHJS200812034&dbname=CJFD0608
律师的心理转折	中国计算机用户	2008	2008年12期	【作者】 喻明 ；	公司利益 ； 我不知道 ； 秘书工作 ；	<正>做事与做人应当分论。如果不能理智地处理工作"冲突",矛盾就容易从对事变为对人。因事废人最终只能给公司利益带来伤害。乔治·罗纳在维也纳当了多年律师,小有名气。二战期间他逃到了瑞典。此时,他已经不名一文,非常需要一份工	2008年12期_律师的心理转折.pdf	http://sso.cdclib.org/interlibSSO/goto/6/=06190596Z93/kcms/detail/detail.aspx?dbCode=cjfq&filename=YHJS200812035&dbname=CJFD0608
破解机器翻译	中国计算机用户	2008	2008年12期	【作者】 万缨 ； 【机构】 北京西城经济科学大学 ；	科技难题 ； 信息产业 ； 翻译技术 ； 翻译处理 ； 语言翻译 ； 电子信息 ； 高潮阶段 ； 门户网 ； 翻译记忆 ； 目标语言 ；	<正>随着北京奥运会的日益临近,机器翻译受到广泛关注,目前正是它发展的最好时期。器翻译技术被列为21世纪世界十大科技难题第一位,但近来世界最大的搜索引擎Google公司在之机	2008年12期_破解机器翻译.pdf	http://sso.cdclib.org/interlibSSO/goto/6/=06190596Z93/kcms/detail/detail.aspx?dbCode=cjfq&filename=YHJS200812036&dbname=CJFD0608
负载均衡的体验式发展	中国计算机用户	2008	2008年12期	【作者】 黄昆 ；	访问流量 ； 并发访问 ； 网络设备 ； 用户体验 ； 网络拥塞问题 ； 体验式 ； 负载均衡技术 ； 服务器负载 ； 交换功能 ； 计算强度 ；	<正>负载均衡已经发展到第三阶段,一切的推动力源于用户体验。随着Web2.0时代的到来,博客、播客日益普及,网络流量日趋增加。这给大规模并发访问的网站造成了网络访问流量瓶颈的严重问题。如何提高网络的效率,优化用户	2008年12期_负载均衡的体验式发展.pdf	http://sso.cdclib.org/interlibSSO/goto/6/=06190596Z93/kcms/detail/detail.aspx?dbCode=cjfq&filename=YHJS200812037&dbname=CJFD0608
构筑安全“木桶”	中国计算机用户	2008	2008年12期	【作者】 雷赫 ；	企业信息中心 ； 业务中断 ； 终端设备 ； 防病毒 ； 系统安全 ； 管理系统 ； 防御系统 ； 应用程序 ； 故障修 ； 网络管理 ；	<正>缺乏对终端设备系统的强有力控制与管理,各种安全设备构筑的其实只是一个"木筐",而非"木桶"。最近,某企业信息中心的管理员小王遭遇了一场折磨。好好的	2008年12期_构筑安全“木桶”.pdf	http://sso.cdclib.org/interlibSSO/goto/6/=06190596Z93/kcms/detail/detail.aspx?dbCode=cjfq&filename=YHJS200812038&dbname=CJFD0608
CAD从二维到三维	中国计算机用户	2008	2008年12期	【作者】 黄昆 ；	电视广告 ； CAD ； 朝阳产业 ； 主流软件 ； 系统集成方案 ； 产品价格 ； 设计中心 ； 应用体系 ； 绘图工具 ； 欧特克 ；	<正>CAD技术已经由二维转向三维,人才的培养也成为关键。目前,作为朝阳产业的影视、动漫产业在我国发展的速度很快,例如在电视广告、动画片、电影中经常能看到三维动画设计的元素。并且,在广告、影视、游戏等行业中,三维动画创	2008年12期_CAD从二维到三维.pdf	http://sso.cdclib.org/interlibSSO/goto/6/=06190596Z93/kcms/detail/detail.aspx?dbCode=cjfq&filename=YHJS200812039&dbname=CJFD0608
IT的创新基因	中国计算机用户	2008	2008年12期	【作者】 黄昆 ；	创新基因 ； 政府首购 ； 进口产品管理 ； 订购管理 ； 高性能计算机 ； 自主知识产权 ； 中科院计算所 ； 自主创新技术 ； 销售总监 ； 底层技术 ；	<正>"自主创新"是一条必走之路,国内IT企业已在正视这个问题。近日《,自主创新产品政府首购和订购管理办法》和《政府采购进口产品管理办法》开始实施,在IT业内,"自主创新"再次成为关注焦点。	2008年12期_IT的创新基因.pdf	http://sso.cdclib.org/interlibSSO/goto/6/=06190596Z93/kcms/detail/detail.aspx?dbCode=cjfq&filename=YHJS200812040&dbname=CJFD0608
新科技·新玩意	中国计算机用户	2008	2008年12期		iSCSI ； 笔记本产品 ； 网络安全 ； 中型企业 ； 硬盘容量 ； 安全网关 ； 安全架构 ； 笔记本电脑 ； 新一代网络 ； 专用处理器 ；	<正>中型企业的环保存储HP Storage Works MAS2000是惠普针对中型企业推出的存储新品,它率先推出包括单控制器和双控制器FC和iSCSI的阵列,年底还将推出基于SAS的阵列。	2008年12期_新科技·新玩意.pdf	http://sso.cdclib.org/interlibSSO/goto/6/=06190596Z93/kcms/detail/detail.aspx?dbCode=cjfq&filename=YHJS200812041&dbname=CJFD0608
什么样的生长需要野蛮	中国计算机用户	2008	2008年12期	【作者】 胡泳 ；	冯仑 ； 规模经济 ； 企业精英 ； 牟其中 ； 金字塔式 ； 机会成本 ； 企业经营 ； 字字珠玑 ； 市场经济秩序 ； 时间精力 ；	<正>经历过"野蛮生长",冯仑无疑希望自己和其他民营企业家强化道德伦理,追求阳光下的利润。话说古代有一位齐国姑娘,到了出嫁的年龄。她的东邻很富裕,可惜富家之子很丑陋;西邻家境贫寒,但年轻人却生得仪表堂堂。母亲左右为难,便对女儿说道:两家各有	2008年12期_什么样的生长需要野蛮.pdf	http://sso.cdclib.org/interlibSSO/goto/6/=06190596Z93/kcms/detail/detail.aspx?dbCode=cjfq&filename=YHJS200812042&dbname=CJFD0608
移动应用的机遇和挑战	中国计算机用户	2008	2008年12期	【作者】 胡珊珊 ；	移动应用 ； 旅游消费品 ； 旅游网站 ； 营销战略 ； 互联网站 ； 移动营销 ； 移动信息服务 ； 域名注册 ； 在线营销 ； 移动终端 ；	<正>对于爱尔兰都柏林旅游产业而言,2008年是充满了希望的一年。在都柏林的旅游网站上,都柏林旅游局公布了为该地区推出的振兴旅游发展的"移动营销战略"新计划,把"都柏林:真实、疯狂、热情"的口号纳入了旅游消费品	2008年12期_移动应用的机遇和挑战.pdf	http://sso.cdclib.org/interlibSSO/goto/6/=06190596Z93/kcms/detail/detail.aspx?dbCode=cjfq&filename=YHJS200812043&dbname=CJFD0608
国家的命脉	中国计算机用户	2008	2008年12期	【作者】 李晓慧 ；	货币贵族 ； 货币危机 ； 中央银行 ； 政府控制 ； 证券市场 ； 绿币 ； 证券交易所 ； 纽约交易所 ； 最终结论 ； 悲观情绪 ；	<正>货币对于国家统治至关重要,美国每次货币危机都有一批货币贵族挺身而出。货币并不像我们看到的那样简单,仅仅是购买商品的替代品。它对于国家的重要性无与伦比,美国金融家汉密尔顿曾说:"政府控制了货币的供给也就掌握了国家的命运。"	2008年12期_国家的命脉.pdf	http://sso.cdclib.org/interlibSSO/goto/6/=06190596Z93/kcms/detail/detail.aspx?dbCode=cjfq&filename=YHJS200812044&dbname=CJFD0608
成功源自自信	中国计算机用户	2008	2008年12期		相信自己 ； 丘吉尔 ； 前半生 ； 自信程度 ； 离家出走 ； 人生经验 ； 人生奋斗目标 ； 行业知识 ； 九招 ； 社会经验 ；	<正>自信也许不会直接导致成功,但没有自信则一定不会成功丘吉尔的前半生充满了坎坷和曲折,直到62岁才当上首相。丘吉尔在回忆录中这样写道:"相信自己,才会成功。"获得成功的要素很多,但发现自我,相信自己才是最根本的。在年	2008年12期_成功源自自信.pdf	http://sso.cdclib.org/interlibSSO/goto/6/=06190596Z93/kcms/detail/detail.aspx?dbCode=cjfq&filename=YHJS200812045&dbname=CJFD0608
呆伯特连载漫画	中国计算机用户	2008	2008年12期	【作者】 史考特·亚当斯 ；	连载漫画 ；		2008年12期_呆伯特连载漫画.pdf	http://sso.cdclib.org/interlibSSO/goto/6/=06190596Z93/kcms/detail/detail.aspx?dbCode=cjfq&filename=YHJS200812046&dbname=CJFD0608
要闻速览	中国计算机用户	2008	2008年11期		电子显示屏 ； 凌讯 ； 芯片商 ； 上海高清 ； 要闻速览 ； 奥运门票 ； 自主产权 ； 数字电视 ； 电子门票 ； 商业数据 ；	<正>沈阳启用政务公开电子显示屏沈阳街头建筑物上的政务公开电子显示屏,将全天播出中央和省市的重大决策部署和各类法律法规,让广大市民充分享有知情权、参与权、表达权和监督权。	2008年11期_要闻速览.pdf	http://sso.cdclib.org/interlibSSO/goto/6/=06190596Z93/kcms/detail/detail.aspx?dbCode=cjfq&filename=YHJS200811001&dbname=CJFD0608
封面秀	中国计算机用户	2008	2008年11期		绝佳时机 ； 业务环境 ； 网络应用 ； 封面秀 ； 应用时机 ； 缺乏流动性 ； 中小企业主 ； 筹资来源 ； 城冲 ； 财政收入 ；	<正>网络应用时机到来网络应用产品越来越成熟,使得它成为任何业务的聪明选择。你可以在世界上任何地方协作、存储。利用一些网络应用可以极大地降低企业的预算。在一个快速增长的业务环境下,你正处于一个利用这些成熟网络应用的绝佳时机,它可以极大地提高员工的效率、降低IT	2008年11期_封面秀.pdf	http://sso.cdclib.org/interlibSSO/goto/6/=06190596Z93/kcms/detail/detail.aspx?dbCode=cjfq&filename=YHJS200811003&dbname=CJFD0608
约束力的“墙”	中国计算机用户	2008	2008年11期	【作者】 王超 ；	尔玛 ； 小条 ； 网络实名制 ； 网络安全 ； 大禹治水 ； 网络伦理道德 ； 网络道德 ； 网络虚拟 ； 法律约束 ； 素质问题 ；	<正>有这样一件事情:某家国内的沃尔玛商店并没有让顾客强制存包,只是顾客在进入之前,卖场工作人员会在顾客的包上贴上一条小不干胶,贴完之后卖场顾客便可以带着自己的包进入卖场。但是这家沃尔玛商店被偷窃商品的概率却是最低的。有心人想去了解这一小条不干胶到底有什么秘密,卖场的工作人员笑着解释道,这条不干胶并没有什么特别的,只是用户在被贴上这条不干胶后,自己便会产生一点小"压力",特别注意自己的行为,这便是这家沃尔玛卖场成功防偷窃的秘诀之一。	2008年11期_约束力的“墙”.pdf	http://sso.cdclib.org/interlibSSO/goto/6/=06190596Z93/kcms/detail/detail.aspx?dbCode=cjfq&filename=YHJS200811004&dbname=CJFD0608
互联网时代计算机视觉为王	中国计算机用户	2008	2008年11期	【作者】 老杳 ；	高清视频 ； 计算机视觉 ； 计算机配置 ； 图像处理 ； 集成显卡 ； 独立显卡 ； 领先优势 ； 显示卡 ； 运算功能 ； 网络带宽 ；	<正>面对日益发展的3D、游戏、高清视频领域,图像处理技术的重要性越来越明显,GPU大有和CPU一争天下的态势。不久前与朋友讨论为什么国外如此火爆的"Second Life"却得不到国内网民的青睐,朋友的观点是国内计算机配置太低,大多使用集成显卡,根本无法满足运行"Second Life"的完美	2008年11期_互联网时代计算机视觉为王.pdf	http://sso.cdclib.org/interlibSSO/goto/6/=06190596Z93/kcms/detail/detail.aspx?dbCode=cjfq&filename=YHJS200811005&dbname=CJFD0608
商业搜索的价值体现在哪里	中国计算机用户	2008	2008年11期	【作者】 火凤凰 ；	互联网市场 ； 业务支撑 ； 网络市场 ； 网商 ； 在线搜索 ； 生活搜索 ； 精准化 ； 未来业务 ； 资本市场 ； 中小企业主 ；	<正>能够为客户创造价值的企业才能够活得长久。商业搜索刚好具备这个特质。中国网民数量激增接近2.3亿,已经超过美国成为名副其实的全球第一,中国网络市场因此成为全球最大的互联网市场。其中,在线搜索成为中国互联网最重要的业务支撑。由于电子商务在国内的快速推进和大量普及,加上网商概念受到市场高热度的追捧,企业对搜索需求的精准化要求提高,由此带来了垂直类商业搜索在中小企业中的广泛应用和快速发展。	2008年11期_商业搜索的价值体现在哪里.pdf	http://sso.cdclib.org/interlibSSO/goto/6/=06190596Z93/kcms/detail/detail.aspx?dbCode=cjfq&filename=YHJS200811006&dbname=CJFD0608
中国创业板将登陆	中国计算机用户	2008	2008年11期		中国创业板 ； 中国证监会 ； 意见修改 ； 企业规模 ； 股票市场 ； 管理办法 ； 资本市场结构 ； 境内资本市场 ； 日向 ； 上市门槛 ；	<正>事件2008年3月21日,中国证监会正式发布了《首次公开发行股票并在创业板上市管理办法(征求意见稿)》(以下简称《意见稿》)。这意味着创业板开板日期已近。按照流程,21日向社会公开征求《意见稿》后,在接下来的两周内将广泛听取社会意见。两周后,证监会将根据反馈意见修改《管理办法》并最终颁布与宣布实行正式的《管理办法》,而后,相关部门将陆续受理并审查各企业上报的材料,审查周期最长不会超过3个月的时间。也就是说,最早今年6月底前将有首批公司登陆创业板,首批规模将为60至70家企业。考虑到创业企业规模小的特点,创业板的标准在主板市场基础	2008年11期_中国创业板将登陆.pdf	http://sso.cdclib.org/interlibSSO/goto/6/=06190596Z93/kcms/detail/detail.aspx?dbCode=cjfq&filename=YHJS200811007&dbname=CJFD0608
大事	中国计算机用户	2008	2008年11期		行业网站 ； 网站总数 ； 从业人数 ； 总营业收入 ； 域名注册 ； 网络品牌 ； 运营能力 ； 互联网经济 ； 信息化专家 ； 企业化运营 ；	<正>我国行业网站增长47%有调查显示,2007年我国具备运营能力的行业网站达2300家,总营业收入147亿元,较2006年的100亿元增长47%,从业人数超过19万人。2007年企业化运营B2B网站总数超过4500家,而2006年是2000家,实现了一年翻一番的发展。	2008年11期_大事.pdf	http://sso.cdclib.org/interlibSSO/goto/6/=06190596Z93/kcms/detail/detail.aspx?dbCode=cjfq&filename=YHJS200811008&dbname=CJFD0608
谁在窃取我们的隐私?	中国计算机用户	2008	2008年11期	【作者】 徐立洋 ；	学历证明 ； 公司贷款 ； 分众无线 ； 电话咨询 ； 家庭住址 ； 车辆牌照 ； 办公地址 ； 毫无察觉 ； 内容五花八门 ； 不知道 ；	<正>窃取隐私者固然可耻,而更该查抄的是获取这些隐私的渠道。"本公司贷款并出售枪支、假钞、迷药、黑车、窃听器,代办各种学历证明、驾驶证、车牌、发票,拨打XX电话咨询。""公证处通知:香港XX集团为庆祝成立三十周年,特举办手机摇奖,你已获得18万,请咨询XX电话或登陆XX网站查询。"	2008年11期_谁在窃取我们的隐私?.pdf	http://sso.cdclib.org/interlibSSO/goto/6/=06190596Z93/kcms/detail/detail.aspx?dbCode=cjfq&filename=YHJS200811009&dbname=CJFD0608
偶像的倒塌	中国计算机用户	2008	2008年11期	【作者】 石菲 ；	谷歌 ； 李开复 ； 完美无暇 ； 埃里克 ； 青年学子 ； 风暴中心 ； 危机公关 ； 彼得 ； 马化腾 ； 李彦宏 ；	<正>形象越是完美无暇,公众对你的苛求就越多,这些是在成为偶像之前就应该明白的。谷歌全球董事长兼CEO埃里克·施密特今年的高调访华之旅刚刚落幕不久,谷歌就尴尬地遭遇着一桩令其恼火的"丑闻"。这次被动卷入风暴中心的,是一贯形象儒雅、被视为广大青年学子心目中偶像的李开复。	2008年11期_偶像的倒塌.pdf	http://sso.cdclib.org/interlibSSO/goto/6/=06190596Z93/kcms/detail/detail.aspx?dbCode=cjfq&filename=YHJS200811010&dbname=CJFD0608
给职业经理人的十点忠告	中国计算机用户	2008	2008年11期	【作者】 佚名 ；	职业经理人 ； 公司门口 ； 企业利益 ； 管理角色 ； 请示汇报 ； 时见 ； 三招 ； 名人轶事 ；	<正>如何当好职业经理人?一名猎头依据几年来的经验给出了10点忠告,希望有助于职业经理人的成长。打工无尊卑。无论你今天是普通工程师,还是贵为总经理,心态上都要保持平衡一致。如果你当工程师时见了门卫会打招呼,当了总裁后也要依然,切不可鼻孔朝天,否则死得很快。	2008年11期_给职业经理人的十点忠告.pdf	http://sso.cdclib.org/interlibSSO/goto/6/=06190596Z93/kcms/detail/detail.aspx?dbCode=cjfq&filename=YHJS200811011&dbname=CJFD0608
八招帮你做个好老板	中国计算机用户	2008	2008年11期	【作者】 Anne Fisher ； 夏冰 ；	区域经理 ； 自我激励 ； 管理风格 ； 业余爱好 ； 格林利夫 ； 描述方式 ；	<正>公司管理需要经理人更多地充当教练的角色,Frankel博士对如何当个好老板提出了8条建议。Gipper(一位困惑的经理):我刚得到区域经理的新工作,管理技术销售人员团队,他们经验丰富有能力并能自我激励,我的前任到了公司的另一部门。一天一位职务比我高	2008年11期_八招帮你做个好老板.pdf	http://sso.cdclib.org/interlibSSO/goto/6/=06190596Z93/kcms/detail/detail.aspx?dbCode=cjfq&filename=YHJS200811012&dbname=CJFD0608
天下	中国计算机用户	2008	2008年11期		主权财富基金 ； 国际金融市场 ； 政府控制 ； 评论人士 ； 投资策略 ； 私人公司 ； 资本市场 ； 国际旅游业 ； 世界遗产地 ； 克卢格 ；	<正>国际货币基金组织加大监管主权财富基金鉴于全球主权财富基金对国际金融市场的影响力日渐增加,国际货币基金组织(IMF)表示将加大对由各国政府控制的这类基金的监管。	2008年11期_天下.pdf	http://sso.cdclib.org/interlibSSO/goto/6/=06190596Z93/kcms/detail/detail.aspx?dbCode=cjfq&filename=YHJS200811013&dbname=CJFD0608
贝佐斯,亚马逊辉煌依旧?	中国计算机用户	2008	2008年11期		网络零售商 ； 杰夫 ； Amazon ； 美国证券交易所 ； 网购 ； 董事会主席 ； 《时代》周刊 ； 电子商务行业 ； 网上零售 ； 库里 ；	<正>1995年7月,在一个车库里,Amazon.com悄悄开张了,以杰夫·贝佐斯为主角的互联网新网购时代就此诞生。2月份,据提交美国证券交易所(SEC)的资料显示,网络零售商Amazon.com(亚马逊)公司董事会主席、总裁兼CEO杰夫瑞·贝佐斯出售了185万股公司股票,他现在想换点现金花花了。	2008年11期_贝佐斯,亚马逊辉煌依旧?.pdf	http://sso.cdclib.org/interlibSSO/goto/6/=06190596Z93/kcms/detail/detail.aspx?dbCode=cjfq&filename=YHJS200811014&dbname=CJFD0608
“深蓝”背后	中国计算机用户	2008	2008年11期	【作者】 李晓慧 ；	许峰雄 ； 计算机科学 ； 王卡 ； 芯片测试 ； 管芯 ； 评价函数 ； 计算机协会 ； 评价软件 ； 伯利纳 ； 物理布局 ；	<正>"深蓝"击败了人类棋王卡斯帕罗夫,开创了人工智能的新时代,为此目标,许峰雄努力了十几年。1997年5月11日,一台计算机战胜了欲捍卫世界冠军称号的卡斯帕罗夫,此举震惊了国际象棋界。这台计算机被命名为"深蓝",在它的设计中,有一个华裔工程师在其中起到了关键作用,他就是"深蓝"的系统设计师许峰雄。	2008年11期_“深蓝”背后.pdf	http://sso.cdclib.org/interlibSSO/goto/6/=06190596Z93/kcms/detail/detail.aspx?dbCode=cjfq&filename=YHJS200811015&dbname=CJFD0608
电脑国际象棋前史	中国计算机用户	2008	2008年11期		弈棋 ； 坎普 ； 土耳其人 ； 计算机下棋 ； 沃尔夫冈 ； 计算机科学家 ； 图灵 ； ENIAC ； 阿伦 ； 香农 ；	<正>1769年,匈牙利工程师沃尔夫冈·冯·坎普仑男爵发明的弈棋机—"土耳其人(Turk)"首次在奥地利宫廷里亮相。这台弈棋机的手下败将中最著名的要算是拿破仑了。不过,这台弈棋机是假的—有一个人藏在里面替他下棋。	2008年11期_电脑国际象棋前史.pdf	http://sso.cdclib.org/interlibSSO/goto/6/=06190596Z93/kcms/detail/detail.aspx?dbCode=cjfq&filename=YHJS200811016&dbname=CJFD0608
又到清明“扫墓”时	中国计算机用户	2008	2008年11期	【作者】 陈姝燕 ；	网络化时代 ； 休假制度 ； 李小燕 ； 喃喃低语 ； 消防隐患 ； 逝者 ； 燃烛 ； 李小龙 ； 接待工作 ； 张国荣 ；	<正>清明扫墓是中国传承了千年的传统,在网络化时代,有多少人选择到网上去"扫墓"?和往年不一样,今年的清明节将是国务院法定休假制度调整后的第一个"小假"。不过,正因为这样,	2008年11期_又到清明“扫墓”时.pdf	http://sso.cdclib.org/interlibSSO/goto/6/=06190596Z93/kcms/detail/detail.aspx?dbCode=cjfq&filename=YHJS200811017&dbname=CJFD0608
扁平化来了	中国计算机用户	2008	2008年11期	【作者】 郑悦 ；	金字塔式 ； 扁平化组织 ； 管理模式 ； 组织变革 ； 公文流转 ；	以分层和集权为特征的金字塔式管理模式,为工业时代带来空前繁荣。海星代表的扁平化组织出现,难道宣布金字塔时代的终结?在信息化与工业化融合的时代,金字塔和海星是上演生死对决的"冤家对头",还是换汤不换药的把戏?	2008年11期_扁平化来了.pdf	http://sso.cdclib.org/interlibSSO/goto/6/=06190596Z93/kcms/detail/detail.aspx?dbCode=cjfq&filename=YHJS200811018&dbname=CJFD0608
金字塔,还是海星?	中国计算机用户	2008	2008年11期	【作者】 徐立洋 ；	金字塔结构 ； 韦尔奇 ； 扁平化组织 ； 组织管理 ； 拜访客户 ； 斜向沟通 ； 公司财务管理 ； 渠道扁平化 ； 副总裁 ； 渠道冲突 ；	<正>分层结构的金字塔、扁平化的海星,究竟哪个能治好企业的痼疾呢?会开会吗?看了这个问题,国人都会嗤之以鼻:谁不会开会,我们最擅长的就是开会,一辈子开的会都不下几百上千个。但你肯定经常遇到过这样的问题:你	2008年11期_金字塔,还是海星?.pdf	http://sso.cdclib.org/interlibSSO/goto/6/=06190596Z93/kcms/detail/detail.aspx?dbCode=cjfq&filename=YHJS200811019&dbname=CJFD0608
解密扁平化	中国计算机用户	2008	2008年11期	【作者】 石菲 ；	扁平化组织 ； 供应链 ； 全球采购中心 ； 王先生 ； 渠道扁平化 ； 尔玛 ； 信息共享程度 ； 客户信息 ； 核心企业 ； 现金折扣 ；	扁平化组织带来的"跨组织"、信息共享特性,这些貌似颠覆金字塔的新武器,剥去扁平化的外衣,这些特性在金字塔中也隐约可见。	2008年11期_解密扁平化.pdf	http://sso.cdclib.org/interlibSSO/goto/6/=06190596Z93/kcms/detail/detail.aspx?dbCode=cjfq&filename=YHJS200811020&dbname=CJFD0608
信息化策动力	中国计算机用户	2008	2008年11期	【作者】 雷赫 ；	策动力 ； 张朝阳 ； 信息总监 ； 业务流程 ； 效益回报 ； 创造性破坏 ； 信息传递方式 ； 组织结构扁平化 ； 管理组织结构 ； 知识扩散 ；	信息化给企业带来效率提高、成本降低等效应之外,还引发管理变革等一系列变化。信息化在不知不觉中引发了一场革命。	2008年11期_信息化策动力.pdf	http://sso.cdclib.org/interlibSSO/goto/6/=06190596Z93/kcms/detail/detail.aspx?dbCode=cjfq&filename=YHJS200811021&dbname=CJFD0608
组织就是这回事儿	中国计算机用户	2008	2008年11期	【作者】 郑悦 ；	应时而变 ； 活下去 ； 经济发展 ； 管理层次 ； 企业组织结构 ； 市场经济竞争 ； 钱皮 ； 生存法则 ； 劳动分工理论 ； 盈利能力 ；	无论是金字塔还是扁平化的海星,说到底都是适应经济发展的形式。为了"活下去"和"活得更好",组织结构不得不"应时而变"。	2008年11期_组织就是这回事儿.pdf	http://sso.cdclib.org/interlibSSO/goto/6/=06190596Z93/kcms/detail/detail.aspx?dbCode=cjfq&filename=YHJS200811022&dbname=CJFD0608
