title	journal_name	year	issue	author	keywords	summary	pdf_filename	article_url
业界周讯	中国计算机用户	2008	2008年32期		联合培训 ； 研发生产基地 ； 天狮集团 ； NetApp ； 服务器厂商 ； 技术工程师 ； 数据中心服务 ； 王全国 ； 宝德 ； 现代信息服务业 ；	<正>深圳欲打造动漫"硅谷"深圳将加强对动漫产业发展的政策扶持,并有意将深圳建设成为中国乃至全世界的"动漫谷"。目前,深圳全市经营动漫游戏类企业已有337家,其中漫画经营企业81家、动画经营企业206家、游戏经营企业11家,从业人员约1万	2008年32期_业界周讯.pdf	http://sso.cdclib.org/interlibSSO/goto/6/=06190596Z93/kcms/detail/detail.aspx?dbCode=cjfq&filename=YHJS200832034&dbname=CJFD0608
新产品	中国计算机用户	2008	2008年32期		笔记本电脑 ； 英特尔迅驰 ； 白色条纹 ； 超便携笔记本 ； 硬盘锁 ； 自然流畅 ； 固态硬盘 ； 移动性 ； 备份软件 ； 硬盘容量 ；	<正>富士通手写笔记本"靓装"上市富士通LifeBook T1010全功能手写笔记本电脑在一席白色条纹"靓装"机壳下,搭载13.3英寸笔触式双向旋转宽屏幕、全新45纳米英特尔迅驰2处理器与无线技术,在移动性、灵活性、便携性方面取得了完美的平衡。	2008年32期_新产品.pdf	http://sso.cdclib.org/interlibSSO/goto/6/=06190596Z93/kcms/detail/detail.aspx?dbCode=cjfq&filename=YHJS200832035&dbname=CJFD0608
书介	中国计算机用户	2008	2008年32期		可靠性工程 ； 书介 ； 质量控制 ； 化学工业出版社 ； 质量经济性 ； 系统可靠性分析 ； 先进制造模式 ； 质量检验 ； 控制图 ； 可靠性管理 ；	<正>质量控制与可靠性工程基础出版社:化学工业出版社页码:344页出版时间:2005年ISBN:7502569006定价:28元作者从我国当今质量控制和可靠性工程的实际出发,系统地阐述了质量控制与可靠性工程的基本概念、基本理论和基本方法。	2008年32期_书介.pdf	http://sso.cdclib.org/interlibSSO/goto/6/=06190596Z93/kcms/detail/detail.aspx?dbCode=cjfq&filename=YHJS200832036&dbname=CJFD0608
读者之声	中国计算机用户	2008	2008年31期		读者之声 ； 服务型企业 ； 全盘皆输 ； 信息反馈 ； 服务设计 ； 客户管理系统 ； 日相 ； 商业销售 ； 员工管理 ； 良好反应 ；	<正>28期《时尚巅峰的IT较量》:世间万物.适者生存,否则,就会走向消亡。而IT产品所构成的系统.如果能够很好地驾驭和应用.将会帮助CIO们更好地去适应环境,创建一个立于不败之地的空间。山东孟繁琪	2008年31期_读者之声.pdf	http://sso.cdclib.org/interlibSSO/goto/6/=06190596Z93/kcms/detail/detail.aspx?dbCode=cjfq&filename=YHJS200831001&dbname=CJFD0608
虚拟化“现形”	中国计算机用户	2008	2008年31期	【作者】 雷赫 ；	产业生态系统 ； 中间层次 ； 硬件成本 ； 虚拟机技术 ； 机房空间 ； 普罗大众 ； 数据中心 ； “风暴” ； 数据安全 ；	除了关注虚拟化营造的美好前景,以及IT厂商关于虚拟化的渲染,我们更应把视角转向用户,看看他们就虚拟化在做些什么,想些什么。	2008年31期_虚拟化“现形”.pdf	http://sso.cdclib.org/interlibSSO/goto/6/=06190596Z93/kcms/detail/detail.aspx?dbCode=cjfq&filename=YHJS200831003&dbname=CJFD0608
虚拟化梦想照进现实	中国计算机用户	2008	2008年31期		服务器虚拟化 ； 公司信息中心 ； 应用虚拟化 ； 数据中心 ； 京卫 ； 朱正 ； 虚拟化应用 ； 虚拟化软件 ； 医药研发 ； 信息化规划 ；	<正>"虚拟化还处于被观察的阶段,离实施还有点距离",但是,这距离正在不断缩小。"虚拟化技术就像一颗长在树上的果子,我们都很饿也很想吃,但这果子熟透了没有,有没有副作用,现在能不能吃,如果要吃的话,是该剥了皮吃还是直接吞下呢?"	2008年31期_虚拟化梦想照进现实.pdf	http://sso.cdclib.org/interlibSSO/goto/6/=06190596Z93/kcms/detail/detail.aspx?dbCode=cjfq&filename=YHJS200831004&dbname=CJFD0608
惟恐错过虚拟化	中国计算机用户	2008	2008年31期		互联网浪潮 ； 服务器虚拟化 ； 大中华区 ； Citrix ； 中国惠普 ； 计算机处理器 ； 市场总监 ； 虚拟化应用 ； 应用虚拟化 ； 产品部 ；	<正>虚拟化已经在IT业界形成一股浪潮,就像20世纪末的互联网浪潮一样,谁不沾边谁就落后。目前,虚拟化技术正在横扫一切领域,从CPU到服务器,从存储到操作系统,从网络到管理软件,各个领域都能听到虚拟化的声音。这已经形成一股浪潮,就像20世纪末的互联网浪潮一样,谁不沾边互联网谁就落后,所以,如今的几大IT厂商都在争先恐后的"虚拟化",为了涌上浪潮的尖端,有时也会针锋相对。	2008年31期_惟恐错过虚拟化.pdf	http://sso.cdclib.org/interlibSSO/goto/6/=06190596Z93/kcms/detail/detail.aspx?dbCode=cjfq&filename=YHJS200831005&dbname=CJFD0608
“推拉”虚拟化	中国计算机用户	2008	2008年31期		推拉 ； 服务器虚拟化 ； 物理服务器 ； 信息中心主任 ； 问题管理 ； 应用虚拟化 ； 虚拟化应用 ； 虚拟机 ； 虚拟服务器 ； 匹配程度 ；	<正>一边是用户谨小慎微的实践,一边是厂商高调大力的推行,虚拟化在这"一推一拉"中稳步前行。2008年8月15日,VMware总裁兼首席执行官Paul Maritz就该公司服务器虚拟化软件中的一个瑕疵引起的困难向用户表示道歉。	2008年31期_“推拉”虚拟化.pdf	http://sso.cdclib.org/interlibSSO/goto/6/=06190596Z93/kcms/detail/detail.aspx?dbCode=cjfq&filename=YHJS200831006&dbname=CJFD0608
天下	中国计算机用户	2008	2008年31期		验证程序 ； 图灵测试 ； 经济刺激 ； Yahoo ； 服务公司 ； 高额成本 ； Forrester ； 市场研究机构 ； 实现速度 ； 总体投资 ；	<正>透视人工CAPTCHA解答服务CAPTCHA正式名称叫自动区分计算机和人类的图灵测试,然而即便是机器,这套验证程序也已经力不从心,Yahoo、Google和微软的电子邮件CAPTCHA验证都已被黑客攻破。但显然任何CAPTCHA都无法在人类面前存活,如果有合适的经济刺激的话。在印度就有着规模巨大的人工CAPTCHA解答服务公司,每天完成1000次验证,工人可以拿到2美元的收入。这项服务的优点处:员	2008年31期_天下.pdf	http://sso.cdclib.org/interlibSSO/goto/6/=06190596Z93/kcms/detail/detail.aspx?dbCode=cjfq&filename=YHJS200831007&dbname=CJFD0608
基于资源的竞争	中国计算机用户	2008	2008年31期	【作者】 戴维·科利斯 ； 辛西娅·蒙哥马利 ；	动态竞争 ； 卓越绩效 ； 可替代性 ； 可模仿性 ； 管理人员 ； 品牌标志 ； 专有性 ； 系列测试 ； 持久性 ；	<正>如果公司在业务和战略方面拥有最佳和最合适的资源储备,那它就会取得成功。制定公司战略时,你是专注于行业和竞争环境的分析,还是公司内部现象的分析?也许,这两种方法都已经不合时宜了。现在,人们提出了一种新的战略分析框架。这种方法以经济学为基础,阐释了在动态竞争环境里,企业资源如何提升	2008年31期_基于资源的竞争.pdf	http://sso.cdclib.org/interlibSSO/goto/6/=06190596Z93/kcms/detail/detail.aspx?dbCode=cjfq&filename=YHJS200831008&dbname=CJFD0608
为创新启蒙	中国计算机用户	2008	2008年31期	【作者】 彼得·马什 ；	所在点 ； 沟通渠道 ； 普利斯特里 ； 启蒙时代 ； 外来者 ； 加州理工学院 ； 美国西北大学 ； 经济史学家 ； 风力发电机 ； 设计细节 ；	<正>如果公司想要获得成功,就需要改善他们与最聪明头脑的沟通渠道。根据乔尔·莫凯尔(Joel Mokyr)的看法,即使是最具创新精神的行业也应该了解它们的局限所在点。它们的优势并不都在于想出新的点子,而是在于利用这些新点子。	2008年31期_为创新启蒙.pdf	http://sso.cdclib.org/interlibSSO/goto/6/=06190596Z93/kcms/detail/detail.aspx?dbCode=cjfq&filename=YHJS200831009&dbname=CJFD0608
ERP不能削足适履	中国计算机用户	2008	2008年31期	【作者】 徐立洋 ；	定岗定编 ； 人力资源部 ； 竞聘上岗 ； 三个和尚 ； 改变自己 ； ERP ； 前几 ； 项目实施 ； 经营分析 ； 管理理论 ；	<正>完全按照ERP产品功能来改变自己的业务,就更是掉进了削足适履的圈套。前几日听说,三个和尚没水吃的故事又有了下文。总寺派人来解决问题,他们认为问题的关键在于管理不到位,就招聘和尚成立了寺庙管理部来制定分工流程,还花钱请来人传授ERP,成立人力资源部,实行竞聘上岗、定岗定编。	2008年31期_ERP不能削足适履.pdf	http://sso.cdclib.org/interlibSSO/goto/6/=06190596Z93/kcms/detail/detail.aspx?dbCode=cjfq&filename=YHJS200831010&dbname=CJFD0608
国内PC厂商今年如何过冬?	中国计算机用户	2008	2008年31期	【作者】 尚昭 ；	财报 ； PC ； 方正集团 ； 同方股份 ； 长城电脑 ； 广积粮 ； 购买需求 ； 客户服务 ； 外部经济环境 ； 设备制造业 ；	继马云抛出"中小企业寒冬论"之后,一时间,"PC寒冬论"甚至"PC冰河论"都成为PC厂商对今年市场预期的代表性表述。	2008年31期_国内PC厂商今年如何过冬?.pdf	http://sso.cdclib.org/interlibSSO/goto/6/=06190596Z93/kcms/detail/detail.aspx?dbCode=cjfq&filename=YHJS200831011&dbname=CJFD0608
侯红：信息化要稳中求胜	中国计算机用户	2008	2008年31期	【作者】 石菲 ；	稳中求胜 ； 行业特殊性 ； 轨道交通设计 ； 计算机应用 ； 轨道交通行业 ； 信息技术部 ； 基础数据 ； 大型信息系统 ； 铁路行业 ； 南昌铁路局 ；	<正>由于轨道交通行业的特殊性,大型信息系统很难上马,只好先从小处入手,稳中求胜。轨道交通设计行业的信息化应用和其他行业不同,因为2000年左右建设部的"甩图版"工程,大部分设计人员熟悉了CAD等电子绘图软件,熟悉了计算机应用操作,可以说是打下了信息化的好基础。但在以后的几年间,由于行业特殊性和业务的复杂性,信息化水平却一直没有得到很大发展。	2008年31期_侯红：信息化要稳中求胜.pdf	http://sso.cdclib.org/interlibSSO/goto/6/=06190596Z93/kcms/detail/detail.aspx?dbCode=cjfq&filename=YHJS200831012&dbname=CJFD0608
IT连环计之反客为主	中国计算机用户	2008	2008年31期		主事者 ； 战争主动权 ； 首脑机关 ； 要害部位 ； 信息源 ； 有效掌控 ； 战争中 ； 随需应变 ； 数字世界 ； 响应能力 ；	<正>古人按语说:为人驱使者为奴,为人尊处者为客.不能立足者为暂客,能立足者为久客,客久而不能主事者为贱客,能主事则可渐握机要,而为主矣。按语中将这个过程分为五步:争客位,乘隙,插足,握机,成功。概括地讲,就是变被动为主动,把主动权慢慢地掌握到自己手中来。主客之势常常发生变化,有的变客为主,有的变主为客。关键在于要变被动为主动,争取掌握主动权。反客为主,在军事上,是指在战争中,要努力变被动为主动,争取掌握战争主动权的谋略。尽量想办法钻空子,控制它的首脑机关或者要害部位,抓住有利时机,兼并或者控制他人。	2008年31期_IT连环计之反客为主.pdf	http://sso.cdclib.org/interlibSSO/goto/6/=06190596Z93/kcms/detail/detail.aspx?dbCode=cjfq&filename=YHJS200831013&dbname=CJFD0608
自主研发的ERP如何走远	中国计算机用户	2008	2008年31期	【作者】 尚昭 ；	杨威 ； 研发方式 ； ERP ； 库存情况 ； 物流部 ； 信息管理中心 ； 主要参与者 ； 手工记录 ； 信息化部门 ； 往前走 ；	与那些采用现成的ERP产品的"正规军"同行们相比,泰启丰ERP的适用性优势颇大。但自始至终摆在面前的资金、人才等挑战,让泰启丰ERP的开拓者感到压力很大。	2008年31期_自主研发的ERP如何走远.pdf	http://sso.cdclib.org/interlibSSO/goto/6/=06190596Z93/kcms/detail/detail.aspx?dbCode=cjfq&filename=YHJS200831014&dbname=CJFD0608
善于挖掘战略资产	中国计算机用户	2008	2008年31期	【作者】 王甲佳 ； 【机构】 东经控股集团有限公司 ；	战略资产 ； 市场转型 ； 信息系统 ； 新商业模式 ； 软件架构 ； 软件生产过程 ； 令人 ； 技术开发工作 ； 杨威 ； 未来战略 ；	<正>泰启丰的问题表面上是ERP出现了难以为继的问题,本质上却是新商业模式在市场转型时不能确定的问题。泰启丰是一家令人尊敬的公司,八年来,自主开发了自己的信息系统,应该说他们已经借助信息系统找到了颇有生命力的商业模式,这是值得骄傲的。	2008年31期_善于挖掘战略资产.pdf	http://sso.cdclib.org/interlibSSO/goto/6/=06190596Z93/kcms/detail/detail.aspx?dbCode=cjfq&filename=YHJS200831015&dbname=CJFD0608
自主研发如何继续走下去?	中国计算机用户	2008	2008年31期	【作者】 裴丽华 ； 【机构】 常州依维柯客车有限公司信息中心 ；	管理过程 ； 杨威 ； 风险降低 ； 业务流程 ； 人力资源 ； 更新升级 ； 信息收集 ； 数据平台 ； 实施周期 ； 应用系统 ；	<正>找到一个优秀的合作伙伴,你会得到一种成熟的管理思想和方法,让你站得更高。从另外一个角度来审视企业的管理方式。看到这个案例,很容易就令人想起一个曾经引起颇多争议的话题,自主研发还是买成熟产品?很多企业在进行ERP选型时都或多或少地遇到这个难题。说它难,	2008年31期_自主研发如何继续走下去?.pdf	http://sso.cdclib.org/interlibSSO/goto/6/=06190596Z93/kcms/detail/detail.aspx?dbCode=cjfq&filename=YHJS200831016&dbname=CJFD0608
成为业内软件供应商	中国计算机用户	2008	2008年31期	【作者】 付颐芳 ； 【机构】 北京正略钧策企业管理咨询有限公司 ；	软件供应商 ； 管理本质 ； 发展阶段 ； 版本升级 ； 尔玛 ； 零售连锁企业 ； 产品周期 ； 管理思维 ； 管理优化 ； 现有模式 ；	<正>泰启丰ERP的成功及即将面临的挑战对人们提出了回归管理本质的课题,也对我们应该选择什么样的ERP实现之路有所提示。泰启丰自主开发及应用的ERP在公司的成长发展阶段获得了成功。这个经过数次版本升级的ERP系统帮助公司的信息化管理从无到有,发挥了显著的功能。但是随着项目规模的发展,	2008年31期_成为业内软件供应商.pdf	http://sso.cdclib.org/interlibSSO/goto/6/=06190596Z93/kcms/detail/detail.aspx?dbCode=cjfq&filename=YHJS200831017&dbname=CJFD0608
CCU读者俱乐部会员评论	中国计算机用户	2008	2008年31期		资金成本 ； 俱乐部会员 ； 磨合期 ； CCU ； 外包方式 ； 整体成本 ； 人力资源 ； 团队人员 ； 业务人员 ； 财务管理 ；	<正>有效转嫁成本本案例中泰启丰在ERP实践中已经取得很大成功,其适用性优势是其成功的最关键——解决的是信息化的核心问题。目前的困境,无论是人力成本也好,资金成本也好,关键是如何使该成本能够得到有效地转嫁,从而减轻公司的整体成本压力。如果现在再采用外包方式,显然是不可行的,如此,必然前功尽弃,是否还能继续保持适用性的优势,还得有一段磨合期。	2008年31期_CCU读者俱乐部会员评论.pdf	http://sso.cdclib.org/interlibSSO/goto/6/=06190596Z93/kcms/detail/detail.aspx?dbCode=cjfq&filename=YHJS200831018&dbname=CJFD0608
管理层是否高估了IT	中国计算机用户	2008	2008年31期	【作者】 辛晴 ；	业务目标 ； 企业生态系统 ； 管理目标 ； 管理执行 ； 战略决策 ； 企业现代化 ； 企业系统 ； 采购模式 ； 市场领导者 ； 管理技能 ；	企业面临的压力与去年同期相比增加了近一倍,如何让IT需求和业务目标完美融合仍然是最大的挑战。	2008年31期_管理层是否高估了IT.pdf	http://sso.cdclib.org/interlibSSO/goto/6/=06190596Z93/kcms/detail/detail.aspx?dbCode=cjfq&filename=YHJS200831019&dbname=CJFD0608
CIO的沟通技巧	中国计算机用户	2008	2008年31期		企业高层管理者 ； 商业流程 ； 战略决策 ； CIO ； 个人素养 ； 工作经验 ； 其在 ；	<正>本次调查显示.企业高层管理者非常重视自己的沟通能力.超过半数的参与调查者都对自己目前的沟通能力不满意。对于CIO来说,良好的沟通技巧至关重要。另据一项对500名CIO所做的调查显示:70%的人认为通往成功的关键是有效的沟通;58%的人选择谙熟商业流程和运作;而46%的人则认为战略性的思想和计划能力很重要。而此前被认为很重要的IT技能,只获得了10%的认可。这不能不说是一个巨大的观念改变。在上个世纪80年代末到90年代初.在CIO职位	2008年31期_CIO的沟通技巧.pdf	http://sso.cdclib.org/interlibSSO/goto/6/=06190596Z93/kcms/detail/detail.aspx?dbCode=cjfq&filename=YHJS200831020&dbname=CJFD0608
庆祝中国计算机用户协会成立二十五周年 中国计算机用户二十五年信赖品牌调查	中国计算机用户	2008	2008年31期		启明星辰 ； 联想网御 ； 艾克斯特 ； 利盟 ； EPSON ； 网络口 ； 卫士通 ； 迪蒙 ； 柯尼卡 ； 美能达 ；		2008年31期_庆祝中国计算机用户协会成立二十五周年+中国计算机用户二十五年信赖品牌调查.pdf	http://sso.cdclib.org/interlibSSO/goto/6/=06190596Z93/kcms/detail/detail.aspx?dbCode=cjfq&filename=YHJS200831021&dbname=CJFD0608
如何规避项目风险	中国计算机用户	2008	2008年31期	【作者】 Peter Brooks ； 丰祖军 ；	项目目标 ； 项目人员 ； 项目团队 ； 信息技术风险 ； 项目组成员 ； 层次的 ； 利润流 ； 项目制定 ； 投资估算 ； 投资评估 ；	<正>从时间、功能和质量、费用三个角度考察项目风险,并有针对性的进行控制。项目失败将造成浪费——稀缺的资源被投放到了无法获得任何价值的项目上,项目人员其实是可以从事其他的能带来价值的工作的。不仅如此,项目失败还会带来两个更深层次的影响。	2008年31期_如何规避项目风险.pdf	http://sso.cdclib.org/interlibSSO/goto/6/=06190596Z93/kcms/detail/detail.aspx?dbCode=cjfq&filename=YHJS200831022&dbname=CJFD0608
软件开发模型面面观	中国计算机用户	2008	2008年31期	【作者】 黄绍良 ； 【机构】 清华大学国际工程项目管理研究院 ；	软件开发模型 ； 瀑布模型 ； 规格说明 ； 功能需求 ； 构件开发 ； 维护阶段 ； 增量模型 ； 系统的功能 ； 实现阶段 ； 快速原型 ；	在实际的软件开发中,很少有某个开发团队完全遵循开发模型的规定,因为每个模型都有其限定条件,并不完全适用于所有的开发环境。	2008年31期_软件开发模型面面观.pdf	http://sso.cdclib.org/interlibSSO/goto/6/=06190596Z93/kcms/detail/detail.aspx?dbCode=cjfq&filename=YHJS200831023&dbname=CJFD0608
全规年代IT管理人员的九大困惑	中国计算机用户	2008	2008年31期	【作者】 王东红 ； 【机构】 ITGov中国IT治理研究中心 ；	管理人员 ； 九大 ； 信息技术投资 ； 风险管理 ； 内部控制 ； 绩效评价 ； 财务价值 ； 萨班斯法案 ； 组织竞争力 ； 信息化战略 ；	各种各样新的概念和认证也不断涌现在IT人员眼前,面对现实中的困惑,IT管理人员应该怎么办?	2008年31期_全规年代IT管理人员的九大困惑.pdf	http://sso.cdclib.org/interlibSSO/goto/6/=06190596Z93/kcms/detail/detail.aspx?dbCode=cjfq&filename=YHJS200831024&dbname=CJFD0608
IT治理的7种视角	中国计算机用户	2008	2008年31期	【作者】 Ernie Jordan Luke Silcock ； 汤大马 ；	IT治理 ； 风险管理 ； 管理控制 ； 合规风险 ； 财务资源 ； 费用成本 ； 审计人员 ； 审计过程 ； 审计流程 ； 信息技术 ；	有企业声称已经实施了IT治理,但从方法论上说,其实都是基于不同的角度,各有侧重,也各有弱点。	2008年31期_IT治理的7种视角.pdf	http://sso.cdclib.org/interlibSSO/goto/6/=06190596Z93/kcms/detail/detail.aspx?dbCode=cjfq&filename=YHJS200831025&dbname=CJFD0608
以用户为中心的敏捷开发	中国计算机用户	2008	2008年31期	【作者】 Marc McNeill ； 【机构】 ThoughtWorks有限公司 ；	项目目标 ； 应用程序 ； 开发者 ； 业务分析 ； 团队工作 ； 测试驱动开发 ； 文件内容 ； 令人头痛 ； 应用框架 ； 前期设计 ；	结合以用户为中心的设计,敏捷方法可以开发出更好的应用程序,产出以最终用户及其体验为中心的商业利益。	2008年31期_以用户为中心的敏捷开发.pdf	http://sso.cdclib.org/interlibSSO/goto/6/=06190596Z93/kcms/detail/detail.aspx?dbCode=cjfq&filename=YHJS200831026&dbname=CJFD0608
品牌营销的信息化	中国计算机用户	2008	2008年31期	【作者】 袁炜 ； 【机构】 上海龙头(集团)股份有限公信息管理部 ；	竞争能力 ； 供应链 ； 技术推动 ； 营销管理 ； 组织营销 ； 库存积压 ； 存货管理 ； 营销控制 ； 扁平化管理 ； 营销信息 ；	用互联网技术来支撑企业的运营,进行品牌的创新,提升核心竞争能力,利用信息技术推动工业化发展。	2008年31期_品牌营销的信息化.pdf	http://sso.cdclib.org/interlibSSO/goto/6/=06190596Z93/kcms/detail/detail.aspx?dbCode=cjfq&filename=YHJS200831027&dbname=CJFD0608
项目管理的极致运用	中国计算机用户	2008	2008年31期	【作者】 谢卫国 ； 【机构】 交通银行上海分行信息技术部 ；	项目管理 ； 信息技术部 ； 人才培养战略 ； 银行总行 ； 交通银行 ； 后备干部 ； 文档管理系统 ； 技术特长 ； 问题管理 ； 计划完成情况 ；	项目管理作为一种方法论大家都能认同,但在这样大规模的大集中工程中,尤其是在时间非常紧的项目中使用,难度之大可想而知。	2008年31期_项目管理的极致运用.pdf	http://sso.cdclib.org/interlibSSO/goto/6/=06190596Z93/kcms/detail/detail.aspx?dbCode=cjfq&filename=YHJS200831028&dbname=CJFD0608
以信息化推动产业管理	中国计算机用户	2008	2008年31期	【作者】 李静 ； 【机构】 上海电气电站集团 ；	企业战略发展 ； 产业管理 ； 装备产业 ； 上海电气 ； 电站设备 ； 信息系统平台 ； 信息化规划 ； 信息化企业 ； 核心业务流程 ； 管理手段 ；	"国内第一、国际一流"的发展战略目标已经确定。而作为支撑企业战略发展的信息化工程又将如何与之应对?	2008年31期_以信息化推动产业管理.pdf	http://sso.cdclib.org/interlibSSO/goto/6/=06190596Z93/kcms/detail/detail.aspx?dbCode=cjfq&filename=YHJS200831029&dbname=CJFD0608
呼市商行：在灾备路上摸索	中国计算机用户	2008	2008年31期	【作者】 石菲 ；	灾备中心 ； 城市商业 ； 业务连续性 ； 数据备份 ； 人为灾难 ； 现代化支付 ； 核心业务系统 ； 中间业务 ； 运维管理 ； 容灾 ；	面对随时都有可能发生的自然或人为灾难,做好数据备份、系统恢复及业务连续性管理,对金融业变得越发紧迫和重要。	2008年31期_呼市商行：在灾备路上摸索.pdf	http://sso.cdclib.org/interlibSSO/goto/6/=06190596Z93/kcms/detail/detail.aspx?dbCode=cjfq&filename=YHJS200831030&dbname=CJFD0608
SOA是一场变革	中国计算机用户	2008	2008年31期	【作者】 洪鸣 ； 【机构】 安徽省国家税务局信息中心 ；	用户体验 ； 技术推动 ； 应用系统 ； 管理目标 ； 信息系统 ； 成熟度 ； SOA ； 金税三期 ； 信息化目标 ； 帐务处理 ；	SOA要想能够得到广泛的应用,不仅仅取决于技术的成熟度,更将取决于能否利用此技术推动应用系统结构的变革,能否使用户体验得到最佳的提升。	2008年31期_SOA是一场变革.pdf	http://sso.cdclib.org/interlibSSO/goto/6/=06190596Z93/kcms/detail/detail.aspx?dbCode=cjfq&filename=YHJS200831031&dbname=CJFD0608
从数据库到智能平台	中国计算机用户	2008	2008年31期	【作者】 王占波 ；	智能平台 ； 数据库管理 ； 商业智能 ； 数据挖掘 ； 符国新 ； 数据平台 ； 业务群 ； 数据仓库 ； 简体中文版 ； 数据管理 ；	通过新版本的SQL Server,微软意图联合数据库管理与商业智能两种应用,继续开拓动态IT的策略。	2008年31期_从数据库到智能平台.pdf	http://sso.cdclib.org/interlibSSO/goto/6/=06190596Z93/kcms/detail/detail.aspx?dbCode=cjfq&filename=YHJS200831032&dbname=CJFD0608
直流供电助力节能	中国计算机用户	2008	2008年31期	【作者】 范志超 ； 【机构】 浪潮北京公司研发部 ；	直流供电 ； 服务器技术 ； 服务器产品 ； 服务器厂商 ； 直流电源 ； 芯片级 ； 小硬盘 ； 产品整体 ； 服务器系统 ； 架构技术 ；	节能已然成为当前服务器技术发展的关键词,厂商纷纷给出解决方案,但哪种方式更节省、更可靠呢?	2008年31期_直流供电助力节能.pdf	http://sso.cdclib.org/interlibSSO/goto/6/=06190596Z93/kcms/detail/detail.aspx?dbCode=cjfq&filename=YHJS200831033&dbname=CJFD0608
