title	journal_name	year	issue	author	keywords	summary	pdf_filename	article_url
“神圣玫瑰”之战	中国计算机用户	2007	2007年23期	【作者】 黄昆 ；	笔记本市场 ； 笔记本电脑 ； 数字家庭 ； 业务群 ； 处理器技术 ； 全权代理 ； 宏基 ； 二三级城市 ； 首款 ； 产品性能 ；	英特尔向市场抛出了“神圣的玫瑰”,多家厂商极速跟进,华硕也是其中的一份子,面对如此竞争压力,华硕的赢点还要看用户的选择。	2007年23期_“神圣玫瑰”之战.pdf	http://sso.cdclib.org/interlibSSO/goto/6/=06190596Z93/kcms/detail/detail.aspx?dbCode=cjfq&filename=YHJS200723016&dbname=CJFD0608
SOA落地不分贵贱	中国计算机用户	2007	2007年23期	【作者】 董丽凤 ；	业务流程 ； SOA ； 软件集团 ； 烟草系统 ； 大中华区 ； 信息中心 ； 浪潮集团 ； 业务咨询 ； 应用软件开发 ； 副总裁 ；	SOA的种种优势,让身处困境的用户们看到了希望。但同时,又让这些用户们有了更多的顾虑,资金、风险种种因素都不得不考虑。SOA到底距离自己有多远?自己企业的现状,是否适合实施SOA呢?	2007年23期_SOA落地不分贵贱.pdf	http://sso.cdclib.org/interlibSSO/goto/6/=06190596Z93/kcms/detail/detail.aspx?dbCode=cjfq&filename=YHJS200723017&dbname=CJFD0608
自主创新 自我发展——2007第十一届中国国际软件博览会掠影	中国计算机用户	2007	2007年23期	【作者】 郑悦 ； 徐健淞 ；	软博会 ； 信息服务外包 ； 自我发展 ； 展览内容 ； 北京展览馆 ； 信息产业 ； 信息服务业 ； 国家发改委 ； 骨干企业 ； 中间件 ；	6月14日～16日,由信息产业部、国家发改委、科技部和北京市人民政府主办的2007第十一届中国国际软件博览会(简称“软博会”)在中国北京展览馆开幕。	2007年23期_自主创新+自我发展——2007第十一届中国国际软件博览会掠影.pdf	http://sso.cdclib.org/interlibSSO/goto/6/=06190596Z93/kcms/detail/detail.aspx?dbCode=cjfq&filename=YHJS200723018&dbname=CJFD0608
焦虑调查	中国计算机用户	2007	2007年23期	【作者】 石菲 ； 丁常彦 ； 黄昆 ； 徐健淞 ；	焦虑情绪 ； 焦虑状态 ； 轻度焦虑 ； 中度焦虑 ； 不确定因素 ； 学业问题 ； 咨询市场 ； 王先生 ； 过班 ； 不合理要求 ；	焦虑是一种心理状态而不是一种情绪,在这个充满不确定因素、浮躁涌动的时代,使人们很容易生活在焦虑当中。在这样一个时代,纷繁的世界需要编辑,人们的心灵更需要梳理。我们调查人们的焦虑状态,只是想告诉人们,焦虑并不可怕。勇敢的正视焦虑,你会发现,焦虑只不过是一件很简单的事情。	2007年23期_焦虑调查.pdf	http://sso.cdclib.org/interlibSSO/goto/6/=06190596Z93/kcms/detail/detail.aspx?dbCode=cjfq&filename=YHJS200723019&dbname=CJFD0608
在痛苦中坚持	中国计算机用户	2007	2007年23期		王先生 ； 列夫·托尔斯泰 ； 信息中心主任 ； 系统上线 ； 信息化规划 ； 业务流程 ； 最根本问题 ； 实施流程 ； 软件巨头 ； 焦虑分值 ；	<正>列夫·托尔斯泰《安娜卡列妮娜》一书的开头这样写道:幸福的人大致都是相似的,而不幸的人各有各的不幸。	2007年23期_在痛苦中坚持.pdf	http://sso.cdclib.org/interlibSSO/goto/6/=06190596Z93/kcms/detail/detail.aspx?dbCode=cjfq&filename=YHJS200723020&dbname=CJFD0608
适度的焦虑不太糟	中国计算机用户	2007	2007年23期		信息中心主任 ； 央企 ； 一所 ； 拓展训练 ； 跑出去 ； 第二年 ； 不好看 ； 她说 ； 分解压力 ； 测验分数 ；	<正>蔡先生,48岁,某央企信息中心主任。焦虑分值:60蔡先生的经历颇有点传奇色彩,小时候曾经被误诊得了败血病,导致家人担心受怕了好几年,不准他参加任何体育运动。身体不好的他上了一所技校,毕业后进工厂当了学徒工。	2007年23期_适度的焦虑不太糟.pdf	http://sso.cdclib.org/interlibSSO/goto/6/=06190596Z93/kcms/detail/detail.aspx?dbCode=cjfq&filename=YHJS200723021&dbname=CJFD0608
心态好,一切皆有可能	中国计算机用户	2007	2007年23期		焦虑分值 ； 一切皆有可能 ； 信息中心主任 ； 卫生系统 ； 亚健康问题 ； 自我调节 ； 适应行为 ； 事对 ； 焦虑情绪 ； 基础教育信息化 ；	<正>鲁先生,42岁,卫生系统某政府部门微机中心主任。焦虑分值:35高先生:37岁,教育行业某政府部门信息中心主任焦虑分值:40	2007年23期_心态好,一切皆有可能.pdf	http://sso.cdclib.org/interlibSSO/goto/6/=06190596Z93/kcms/detail/detail.aspx?dbCode=cjfq&filename=YHJS200723022&dbname=CJFD0608
迟学斌:“高性能”CIO	中国计算机用户	2007	2007年23期	【作者】 那罡 ； 徐健淞 ；	超级计算中心 ； CIO ； 并行计算 ； 计算机网络信息 ； 用户账号 ； 科技进步 ； 机群系统 ； 应用服务 ； 超级服务器 ； 高性能计算机 ；	<正>“大伙儿都要吃饭,我就要不停地找项目。”中科院超级计算中心(以下简称超算中心)主任迟学斌说话不紧不慢,但从话中能够感觉到他对整个中心的感情,这种感情源自他20多年在中心的工作和生活。	2007年23期_迟学斌:“高性能”CIO.pdf	http://sso.cdclib.org/interlibSSO/goto/6/=06190596Z93/kcms/detail/detail.aspx?dbCode=cjfq&filename=YHJS200723023&dbname=CJFD0608
IT整合,难处理的需求	中国计算机用户	2007	2007年23期	【作者】 黄昆 ；	企业并购 ； 业务流程 ； 中间件产品 ； 华商集团 ； 应用系统 ； 信息化项目 ； 信息中心主任 ； 企业内部业务 ； 多核处理器 ； 财务整合 ；	IT整合对CIO来说是极富挑战的,但现在问题不是企业是否会进行整合,而是企业将采取什么方法进行整合。这是令CIO最头疼的问题。	2007年23期_IT整合,难处理的需求.pdf	http://sso.cdclib.org/interlibSSO/goto/6/=06190596Z93/kcms/detail/detail.aspx?dbCode=cjfq&filename=YHJS200723024&dbname=CJFD0608
猎人与猎狗	中国计算机用户	2007	2007年23期	【作者】 喻明 ；	不知道 ； 就这样 ； 服务时间 ； 得其所 ；	你不知道,我们两个跑的是完全不同的。我仅仅为了一顿饭而跑,他却是为了性命而跑呀。	2007年23期_猎人与猎狗.pdf	http://sso.cdclib.org/interlibSSO/goto/6/=06190596Z93/kcms/detail/detail.aspx?dbCode=cjfq&filename=YHJS200723025&dbname=CJFD0608
“中小制造企业流程管理”系列之二 做好规划是成功的一半	中国计算机用户	2007	2007年23期	【作者】 褚四斌 ；	中小制造企业 ； 业务流程 ； 项目团队 ； 项目计划 ； 项目管理软件 ； 经营过程 ； 应付账款 ； 工程设计变更 ； 变更管理 ； 部门主管 ；	如果中小企业不能及时注意业务流程并有计划地进行业务流程管理,必将会给他们带来不少管理职责不清,相互“踢皮球”的故事,并最终影响到企业的运行效率,增加工作的难度和复杂程度。	2007年23期_“中小制造企业流程管理”系列之二+做好规划是成功的一半.pdf	http://sso.cdclib.org/interlibSSO/goto/6/=06190596Z93/kcms/detail/detail.aspx?dbCode=cjfq&filename=YHJS200723026&dbname=CJFD0608
Snn存储让数据成为主角	中国计算机用户	2007	2007年23期		Snn ； 存储解决方案 ； 副总裁 ； 存储系统 ； 磁带存储 ； 新增用户 ； 串行连接 ； 产品家族 ； 存储产品 ； 存储平台 ；	在采用了Sun公司的存储解决方案之后,HBO负责广播运营的资深副总裁Charles Cataldo说,Sun的企业和NAS存储系统允许我们在全球范围内交付内容,同时使成本降低。Sun公司提供了一个真正期望的高质量解决方案,能够提高效率,允许我们的关键业务分发实现持续的高可用性。	2007年23期_Snn存储让数据成为主角.pdf	http://sso.cdclib.org/interlibSSO/goto/6/=06190596Z93/kcms/detail/detail.aspx?dbCode=cjfq&filename=YHJS200723027&dbname=CJFD0608
项目管理牵引扁平化	中国计算机用户	2007	2007年23期	【作者】 文建波 ；	项目管理 ； 项目化管理 ； 人才选拔 ； 部门设置 ； 扁平化管理 ； 战略执行 ； 项目组合管理 ； 组织结构扁平化 ； 组织效率 ； 人力资源 ；	除非SH集团以有利于重大项目运作为导向,系统优化部门设置、岗位编制、薪酬、考核、培训、人才选拔等各方面的机制、流程和制度,否则重大工作的项目化推进仍然会举步维艰。	2007年23期_项目管理牵引扁平化.pdf	http://sso.cdclib.org/interlibSSO/goto/6/=06190596Z93/kcms/detail/detail.aspx?dbCode=cjfq&filename=YHJS200723028&dbname=CJFD0608
服务协议的边界	中国计算机用户	2007	2007年23期	【作者】 孙翊威 ；	服务协议 ； 丁磊 ； 服务成本 ； 呼出 ； 服务水平协议 ； 运维人员 ； 外包商 ； 业务单元 ； 服务总监 ； 备机 ；	当服务改进超出服务协议范围时,在控制好服务成本的前提下,为了维系客户关系,我们可以选择做。但是,做之前一定要处理好内部员工和客户两方面的情绪。	2007年23期_服务协议的边界.pdf	http://sso.cdclib.org/interlibSSO/goto/6/=06190596Z93/kcms/detail/detail.aspx?dbCode=cjfq&filename=YHJS200723029&dbname=CJFD0608
多重应用的宽带世界	中国计算机用户	2007	2007年23期	【作者】 那罡 ；	三重 ； 江苏电信 ； 应用业务 ； 应用服务 ； 网络接入 ； 边缘路由器 ； 客户数量 ； 数据流量 ； 数据通道 ； 模块化软件 ；	运营商不断推出更高附加值的宽带应用业务,而宽带应用才是真正支撑宽带网络发展的主要力量,随着用户数量及三重应用服务需求的迅速增长,单一的网络接入及宽带服务已经无法满足用户的要求。	2007年23期_多重应用的宽带世界.pdf	http://sso.cdclib.org/interlibSSO/goto/6/=06190596Z93/kcms/detail/detail.aspx?dbCode=cjfq&filename=YHJS200723030&dbname=CJFD0608
智能化监控捕捉足球流氓	中国计算机用户	2007	2007年23期	【作者】 那罡 ；	智能化监控 ； 视频监视 ； 智能视频 ； 整体成本 ； 动反应 ； 监控设备 ； 视频监控系统 ； 图像序列 ； 应远 ； 分析设备 ；	对于视频监视而言,主动反应远比被动反应重要。通过学习人的行为并自动地实时检测各种物体,智能视频分析设备能够以更低的整体成本实现安全性的提高。	2007年23期_智能化监控捕捉足球流氓.pdf	http://sso.cdclib.org/interlibSSO/goto/6/=06190596Z93/kcms/detail/detail.aspx?dbCode=cjfq&filename=YHJS200723031&dbname=CJFD0608
新一代刀片露锋芒	中国计算机用户	2007	2007年23期	【作者】 黄昆 ；	新一代数据 ； 关键基础设施 ； 计算密度 ； 连接性 ； 机架式服务器 ； 服务器产品 ； 数据中心 ； 系统管理软件 ； 大型系统 ； 服务器市场 ；	技术日趋成熟和管理的简单化,驱使新一代刀片服务器正在成为新一代数据中心关键基础设施之一。	2007年23期_新一代刀片露锋芒.pdf	http://sso.cdclib.org/interlibSSO/goto/6/=06190596Z93/kcms/detail/detail.aspx?dbCode=cjfq&filename=YHJS200723032&dbname=CJFD0608
微软Forefront安全解决方案	中国计算机用户	2007	2007年23期		Forefront ； 间谍软件 ； 管理控制台 ； 代理行为 ； 计算机组 ； 降低成本 ；	<正>一直以来,微软都将安全问题看作头等大事来对待,最近随着Forefront安全解决方案的推出,带来了全新的安全解决方案,Forefront作为微软全新的安全品牌究竟包含了那些产品和技术?究竟有何优势,本文将分三个部分向您介绍	2007年23期_微软Forefront安全解决方案.pdf	http://sso.cdclib.org/interlibSSO/goto/6/=06190596Z93/kcms/detail/detail.aspx?dbCode=cjfq&filename=YHJS200723033&dbname=CJFD0608
不识假账的办公系统	中国计算机用户	2007	2007年23期	【作者】 月娥 ；	办公系统 ； 管理软件系统 ； 吴远 ； 企业内部信息 ； 办公自动化 ； 应用系统 ； 管理自动化 ； 信息系统 ； 报销单 ； 互通互联 ；	“以往的所谓企业办公管理软件,还能不能帮助我们完成企业管理的规范化呢?企业办公管理软件还需要具备哪些‘与时俱进’的功能呢?”这些吴远想到了,但是他无能为力。	2007年23期_不识假账的办公系统.pdf	http://sso.cdclib.org/interlibSSO/goto/6/=06190596Z93/kcms/detail/detail.aspx?dbCode=cjfq&filename=YHJS200723034&dbname=CJFD0608
建构企业信息化运行环境	中国计算机用户	2007	2007年23期	【作者】 李冠强 ； 【机构】 北大纵横管理咨询公司 管理咨询顾问 ；	运行环境 ； 信息化问题 ； 信息系统规划 ； 办公自动化系统 ； 组织流程 ； 信息化方面 ； 战略管理模式 ； 信息化战略 ； 管理软件系统 ； 中国企业管理 ；	“优秀的运行环境是企业信息化能够成功实施的保障和关键。案例中正是缺少了这种对信息化运行环境的前期准备,导致后续出现诸多问题。”	2007年23期_建构企业信息化运行环境.pdf	http://sso.cdclib.org/interlibSSO/goto/6/=06190596Z93/kcms/detail/detail.aspx?dbCode=cjfq&filename=YHJS200723035&dbname=CJFD0608
“信息孤岛”与协同办公	中国计算机用户	2007	2007年23期	【作者】 韩建锋 ； 【机构】 石家庄嘉禾啤酒有限责任公司 信息主管 ；	业务流程 ； 协同办公 ； 数据仓库 ； 先进管理思想 ； 系统开发过程 ； 数据平台 ； 私营企业发展 ； 管理系统 ； 协同系统 ； 数据集成 ；	“实现了协同,就实现了信息资源透明和共享,就实现了信息共用,所有系统人员都可以按照一定的权限进行查询。”	2007年23期_“信息孤岛”与协同办公.pdf	http://sso.cdclib.org/interlibSSO/goto/6/=06190596Z93/kcms/detail/detail.aspx?dbCode=cjfq&filename=YHJS200723036&dbname=CJFD0608
软件协同是关键	中国计算机用户	2007	2007年23期	【作者】 刘洪涛 ； 【机构】 西安交通大学管理学院 副教授博士后 ；	吴远 ； 智能分析 ； 文档管理 ； 应用系统 ； 协同性 ； 人力资源 ； 知识管理工具 ； 客户管理 ； 内在能力 ； 信息畅通 ；	“如果吴远所采用的软件,能实现和ERP销售数据的对接,那个销售员还会做假账吗?”	2007年23期_软件协同是关键.pdf	http://sso.cdclib.org/interlibSSO/goto/6/=06190596Z93/kcms/detail/detail.aspx?dbCode=cjfq&filename=YHJS200723037&dbname=CJFD0608
读者俱乐部会员评论	中国计算机用户	2007	2007年23期		俱乐部会员 ； 项目管理系统 ； 财务管理系统 ； 信息系统 ； 物资系统 ； 物资采购管理 ； 假帐 ； 实际工作流程 ； 个人技能 ； 信息更新 ；	<正>开发各系统之间的接口案例中的问题,主要是信息孤岛造成的,这是企业在信息化的过程中不可避免要出现的阶段,最典型的现象有:相同的数据不同部门提供结果却不一样,各部门数据无法共享需要手工核对,信息化不能彻底解决某个事情等等。	2007年23期_读者俱乐部会员评论.pdf	http://sso.cdclib.org/interlibSSO/goto/6/=06190596Z93/kcms/detail/detail.aspx?dbCode=cjfq&filename=YHJS200723038&dbname=CJFD0608
液晶航母全能冠军——三星570DX强势出击	中国计算机用户	2007	2007年23期		可视面积 ； 高清标准 ； 审美需要 ； 动态对比度 ； 动态最优化 ； 金属质感 ； 外观设计 ； 双支架 ； 视频显示 ； 可视范围 ；	<正>在液晶日益成为市场主导的今天,你是否还在为公共场所播放的宣传片的“微缩形象”而耗尽眼力?还在为其“小巧”的画面烦恼不已?还在为被“精简”摔的图片心生遗憾?现在,大家需要看到的是全能液晶——三星570DX,只有它能在行业市场中破浪前行!	2007年23期_液晶航母全能冠军——三星570DX强势出击.pdf	http://sso.cdclib.org/interlibSSO/goto/6/=06190596Z93/kcms/detail/detail.aspx?dbCode=cjfq&filename=YHJS200723039&dbname=CJFD0608
制度为何如此短命	中国计算机用户	2007	2007年23期	【作者】 荷意 ；	王回 ； 企业业务流程 ； 人力资源部 ； 监督问题 ； 良性循环 ； 换版 ； 文件档案 ； 业务情况 ； 上岗证 ； 信息渠道 ；	<正>小王在T公司工作了近两年的时间,前段时间由于家里有事,请了三个月的长假,假期已满,小王回公司上班。上班没几天,正赶上公司管理整顿,需修改各部门的管理制度,为此,上司让小王整理一下本部门规章制度。	2007年23期_制度为何如此短命.pdf	http://sso.cdclib.org/interlibSSO/goto/6/=06190596Z93/kcms/detail/detail.aspx?dbCode=cjfq&filename=YHJS200723040&dbname=CJFD0608
黄鼠狼数学	中国计算机用户	2007	2007年23期	【作者】 史考特·亚当斯 ； 吴学华 ； 郑国仪 ；	销售代理 ； 购买广告 ； 职业人士 ； 广告投资 ； 泰斯 ； 亚当斯 ； 成本计算 ； 普莱 ； 地方电台 ； 告诉我 ；	<正>黄鼠狼数学的美妙之处就在于:实用性不重要,用大数字替代小数字。黄鼠狼个个都是玩弄数字的高手,他们是怎样做到的呢?	2007年23期_黄鼠狼数学.pdf	http://sso.cdclib.org/interlibSSO/goto/6/=06190596Z93/kcms/detail/detail.aspx?dbCode=cjfq&filename=YHJS200723041&dbname=CJFD0608
高产出管理	中国计算机用户	2007	2007年23期	【作者】 邢芳 ；	中层经理 ； 格鲁夫 ； 韦尔奇 ； 杠杆率 ； 管理智慧 ； 组织结构 ； 信息收集 ； 实战经验 ； 高层经理 ； 管理瓶颈 ；	没有血雨腥风的并购,也没有力挽狂澜的战略;看不到斗智斗勇的CEO,也看不到横空出世的董事长。格鲁夫说,他这本书是给企业中那些管理若干下属的中层经理们看的,是教中层经理人如何做管理,带下属,对上司的。	2007年23期_高产出管理.pdf	http://sso.cdclib.org/interlibSSO/goto/6/=06190596Z93/kcms/detail/detail.aspx?dbCode=cjfq&filename=YHJS200723042&dbname=CJFD0608
掠食者的理由	中国计算机用户	2007	2007年22期	【作者】 赵毅 ；	搅局者 ； 中小企业用户 ； 最底层 ； 先天缺陷 ； 文中 ；	<正>在中国管理软件市场上提到SAP,想到的第一个形容词可能就是“专业”,当谈到IBM,也许更多人想到的是“理念”,至于微软,充其量也只能算做“搅局者”。但这话拿到中小企业市场上,也许就不那么形象了。	2007年22期_掠食者的理由.pdf	http://sso.cdclib.org/interlibSSO/goto/6/=06190596Z93/kcms/detail/detail.aspx?dbCode=cjfq&filename=YHJS200722001&dbname=CJFD0608
人脸识别搜索将给我们带来什么	中国计算机用户	2007	2007年22期	【作者】 刘兴亮 ；	Paris ； 搜索框 ； 新京报 ； 人脸识别技术 ； 用户体验 ； 刘兴亮 ； 消费购物 ； 网络支付 ； 首款 ； 身份鉴别 ；	<正>《新京报》用整整三个版的篇幅介绍了Paris·Hilton,也许是我太孤陋寡闻,之前从未听说过这号人物,在搜索框中输入Paris,返回和“Paris”相关的结果,比如法国巴黎的风光,或是许多名字中含有巴黎的人物照片,	2007年22期_人脸识别搜索将给我们带来什么.pdf	http://sso.cdclib.org/interlibSSO/goto/6/=06190596Z93/kcms/detail/detail.aspx?dbCode=cjfq&filename=YHJS200722002&dbname=CJFD0608
拿什么保护你,我的虚拟财产	中国计算机用户	2007	2007年22期	【作者】 张书乐 ；	虚拟财产 ； 小龙女 ； 不知道 ； 在博 ； 立法体系 ； 保险需求 ； 数据显示 ； 真金 ； 公司会议 ； 张书 ；	<正>不久前,一位游戏代言人小龙女彤彤在游戏中被盗,随后新浪将她写在博客中的这番经历放置在其网站重要位置,一时间成为各大游戏网站关注的焦点。小龙女彤彤被盗后的一番感言让人印象深刻:“要知道我那套装备价值换成现钞有一万多元啊!要是能给这些东西买个保险,损失就会小很多了,就是不知道哪里有这险保?”	2007年22期_拿什么保护你,我的虚拟财产.pdf	http://sso.cdclib.org/interlibSSO/goto/6/=06190596Z93/kcms/detail/detail.aspx?dbCode=cjfq&filename=YHJS200722003&dbname=CJFD0608
天下	中国计算机用户	2007	2007年22期		信息鸿沟 ； 欠发达国家 ； 信息技术 ； 凯特林 ； 即时通讯 ； 企业沟通 ； 资讯科技 ； 基业长青 ； 雅虎 ； 选择快乐 ；	<正>亚洲多国首脑宣布将携手缩小IT信息鸿沟亚洲多国首脑共同表示,将携手缩小亚洲地区发达与欠发达国家的信息鸿沟。在日前韩国首都首尔召开的第六次亚洲合作对话ACD中,亚洲多国政府代表发布了上述表态。发言人表示,“信息技术的发展,有助于保证国际稳定性和安全性,”而各国之间IT鸿沟的消除,也意味着未来亚洲地区各国之间的关系将更加稳定安全。(赛迪网2007年6月12日)	2007年22期_天下.pdf	http://sso.cdclib.org/interlibSSO/goto/6/=06190596Z93/kcms/detail/detail.aspx?dbCode=cjfq&filename=YHJS200722004&dbname=CJFD0608
4.8亿手机用户上网有“入口”	中国计算机用户	2007	2007年22期		上网方式 ； 独立域名 ； 站点数量 ； 网民总数 ； 寻址 ； 大城市 ；	<正>无线网址简化上网方式本刊讯中国互联网络信息中心(CNNIC)发布的《2007中国无线互联网(WAP)发展状况调查报告》(以下简称《报告》)显示:截至2007年3月底,我国的WAP活跃用户数约为3900万人,具有独立域名的WAP站点数量约为6.5万,中国无线互联网暂处导入阶段。	2007年22期_4.8亿手机用户上网有“入口”.pdf	http://sso.cdclib.org/interlibSSO/goto/6/=06190596Z93/kcms/detail/detail.aspx?dbCode=cjfq&filename=YHJS200722005&dbname=CJFD0608
“软博会”展现我国软件业成就	中国计算机用户	2007	2007年22期		软博会 ； 信息服务产业 ； 销售收入 ； 信息服务外包 ； 日至 ； 信息服务业 ； 数字内容 ； 中关村软件园 ； 中间件 ； 骨干企业 ；	<正>我国软件与信息服务产业销售收入年增长率达到了37.8%本刊讯记者从6月14日至16日在北京举行的“2007第十一届中国国际软件博览会(以下简称‘软博会’)”了解到:我国软件与信息服务产业销售收入由2001年的796亿元增长到了2006年的4800亿元,年增长率达到了37.8%;软件与信息服务出口额增长8倍,上升到2006年的60.6亿美元。	2007年22期_“软博会”展现我国软件业成就.pdf	http://sso.cdclib.org/interlibSSO/goto/6/=06190596Z93/kcms/detail/detail.aspx?dbCode=cjfq&filename=YHJS200722006&dbname=CJFD0608
国家体育馆“科技味”十足	中国计算机用户	2007	2007年22期		国家会议中心 ； 钢屋架 ； 毗邻而居 ； 城市景观 ； 设计灵感 ； 工程结构 ； 太阳能发电 ； 地下车库 ； 张弦 ； 南立面 ；	<正>消化8万吨首钢钢渣,“机器人”滑移钢屋架位于北京奥林匹克公园中心区南部,与“鸟巢”和“水立方”以及国家会议中心毗邻而居的国家体育馆。国家体育馆以中国“折扇”为设计灵感,采取由南向北的波浪式造型,屋面轻盈而富于动感。	2007年22期_国家体育馆“科技味”十足.pdf	http://sso.cdclib.org/interlibSSO/goto/6/=06190596Z93/kcms/detail/detail.aspx?dbCode=cjfq&filename=YHJS200722007&dbname=CJFD0608
坚持开放平台策略	中国计算机用户	2007	2007年22期		副总裁 ； 大中华区 ； 消费电子产品 ； 笔记本电脑 ； 纳米工艺 ； 战略布局 ； 图形显示 ； 整合平台 ； 数字电视 ； 勿容置疑 ；	<正>郭可尊勾勒全新AMD远景本刊讯6月12日,AMD全球高级副总裁兼大中华区总裁郭可尊女士在“Radeon HD 2000系列新一代图形显示新品会”上,勾勒了AMD远景:“未来,全新的AMD将坚持开放平台策略,与合作伙伴一道,为企业及个人用户提供包括笔记本电脑、台式机、工作站、服务器和消费电子产品的解决方案。”	2007年22期_坚持开放平台策略.pdf	http://sso.cdclib.org/interlibSSO/goto/6/=06190596Z93/kcms/detail/detail.aspx?dbCode=cjfq&filename=YHJS200722008&dbname=CJFD0608
新闻	中国计算机用户	2007	2007年22期		维安 ； 新闻人物 ； 风险投资商 ； 电子交易平台 ； 商贸平台 ； 考试院 ； 遍及全球 ； 目标锁定 ； 数字北京 ； 教育考试 ；	<正>新闻人物尹维安800万美元笑对马云瞧,尹维安这个高兴劲。也是,他能不高兴吗?6月8日,800万美元又进了囊中。风险投资商看中的是万商网的“按需消费”B2B电子商务模式。这800万美元使得尹维安“激情四射”,他要完成B2B战略的重要布局。	2007年22期_新闻.pdf	http://sso.cdclib.org/interlibSSO/goto/6/=06190596Z93/kcms/detail/detail.aspx?dbCode=cjfq&filename=YHJS200722009&dbname=CJFD0608
直销、分销,两手都要硬	中国计算机用户	2007	2007年22期	【作者】 邢芳 ；	渠道伙伴 ； 体验店 ； 资金周转速度 ； 大中华区 ； 渠道政策 ； BtoB ； 国家市场 ； 内部邮件 ； 转销 ； 直销模式 ；	是B to B还是B to B to B?在供应商与企业用户之间加入一个B,顺理成章地可以延伸出来“B to B to B”与“B to B to C”,以及“B to B to无限”。	2007年22期_直销、分销,两手都要硬.pdf	http://sso.cdclib.org/interlibSSO/goto/6/=06190596Z93/kcms/detail/detail.aspx?dbCode=cjfq&filename=YHJS200722010&dbname=CJFD0608
