title	journal_name	year	issue	author	keywords	summary	pdf_filename	article_url
抗震中的网络传播“蝴蝶效应”	中国计算机用户	2008	2008年21期	【作者】 长弓乐 ；	受灾群众 ； “蝴蝶效应” ； 汶川 ； 茫茫人海 ； 气候反常 ； 七盘 ； 张琪 ； 科技时代 ； 长弓 ； 蝴蝶效应 ；	<正>在整个抗灾过程中,互联网的巨大传播效能所带给我们的不仅仅是信息的全面共享,更多的是给与了所有受灾群众一种生的希望和爱的感受,从地震发生之后起,无数的群众用双眼盯住了汶川及周边的范围,无数的疑问在地震发生后的几天几夜里一直困扰着每一个人。而网络在此刻发挥了巨大的效力,特别是从一些细节上显出了力量。	2008年21期_抗震中的网络传播“蝴蝶效应”.pdf	http://sso.cdclib.org/interlibSSO/goto/6/=06190596Z93/kcms/detail/detail.aspx?dbCode=cjfq&filename=YHJS200821003&dbname=CJFD0608
GPS即将成为手机的标配	中国计算机用户	2008	2008年21期		GPS ； 音乐播放 ； 配置表 ； 移动通信基站 ； 扰码 ； 卫星系统 ； 定位技术 ； 定位误差 ； 启动速度 ； “伽利略” ；	<正>当音乐播放已成为"标配"而不再具有市场杀伤力,GPS就成了接过冲锋陷阵旗子的新一代"旗手"。我们发现,近来上市的新款手机的功能配置表中,GPS悄悄多了起来。就像几年前厂商大力吹嘘自己的64和弦、MP3功能一样,当音乐播放已成为"标配"而不再具有市场杀伤力,	2008年21期_GPS即将成为手机的标配.pdf	http://sso.cdclib.org/interlibSSO/goto/6/=06190596Z93/kcms/detail/detail.aspx?dbCode=cjfq&filename=YHJS200821004&dbname=CJFD0608
移动网络:灾难面前抢得生机	中国计算机用户	2008	2008年21期	【作者】 胡姗姗 ；	抢险救灾 ； 无线数据业务 ； 汶川大地震 ； 个人电脑 ； 危难时刻 ； 公共信息服务 ； 语音通讯 ； 成都市民 ； 数字显示 ； 中国联通 ；	<正>在传统互联网络连接出现意外中断或故障时,移动网络对挽救生命和抢险救灾赢得了极为宝贵的时间。5月12日的四川汶川大地震,让全国甚至全球的炎黄子孙紧紧地连在了一起,在面对灾难时,众志成城,为抢救生命付出最大的努力。在这次抗震救灾中,人们	2008年21期_移动网络:灾难面前抢得生机.pdf	http://sso.cdclib.org/interlibSSO/goto/6/=06190596Z93/kcms/detail/detail.aspx?dbCode=cjfq&filename=YHJS200821005&dbname=CJFD0608
雅虎口碑整合	中国计算机用户	2008	2008年21期		雅虎 ； 口碑网 ； 电子商务战略 ； 生活服务 ； 淘宝网 ； 生活搜索 ； 服务基地 ； 蓄谋已久 ； 支付宝 ； 网购 ；	<正>正方打造生活服务基地利用口碑网在生活服务领域的经验,雅虎口碑未来将与阿里巴巴旗下C2C网站淘宝网形成联动,进一步巩固马云的电子商务战略。马云的这步棋是蓄谋已久还是心血来潮,这似乎变得不重要了。	2008年21期_雅虎口碑整合.pdf	http://sso.cdclib.org/interlibSSO/goto/6/=06190596Z93/kcms/detail/detail.aspx?dbCode=cjfq&filename=YHJS200821006&dbname=CJFD0608
IT担当重建先锋	中国计算机用户	2008	2008年21期	【作者】 丁常彦 ；	数据中心 ； 建筑设计 ； 容灾 ； 对口支援 ； 社会参与 ； 建筑施工 ； 生态环境资源 ； 常彦 ； 基础设施 ；	地震灾后恢复重建工作的号角已经吹响,建筑设计如何保证安全可靠、数据中心如何应对灾难、原有产业如何借重建升级……当这一系列问题摆在人们面前时,IT的身影逐渐显现出来。	2008年21期_IT担当重建先锋.pdf	http://sso.cdclib.org/interlibSSO/goto/6/=06190596Z93/kcms/detail/detail.aspx?dbCode=cjfq&filename=YHJS200821007&dbname=CJFD0608
让重建又好又快	中国计算机用户	2008	2008年21期	【作者】 丁常彦 ；	建筑安全 ； 建筑设计 ； 汶川地震 ； 新建房屋 ； 抗震设计规范 ； 建筑消耗 ； 计算机辅助设计 ； 纸质地图 ； 软件设计 ； 工程设计阶段 ；	在汶川地震灾后恢复重建中,房屋重建是灾区群众最需迫切解决的问题。IT技术给这些新建房屋的安全、环保等提供了新的保障。	2008年21期_让重建又好又快.pdf	http://sso.cdclib.org/interlibSSO/goto/6/=06190596Z93/kcms/detail/detail.aspx?dbCode=cjfq&filename=YHJS200821008&dbname=CJFD0608
保护数据的无形防线	中国计算机用户	2008	2008年21期	【作者】 雷赫 ；	容灾备份 ； 灾难恢复 ； 灾难备份 ； 灾备系统 ； 备份与恢复 ； 容灾中心 ； 信息系统 ； 异地容灾 ； 硬件供应商 ； 金融机构 ；	地震过后,银行储户的信息是否还在,没有证件的用户是否可以照常办理业务……数据容灾备份的应用为地震灾区筑起了一道无形的防线。	2008年21期_保护数据的无形防线.pdf	http://sso.cdclib.org/interlibSSO/goto/6/=06190596Z93/kcms/detail/detail.aspx?dbCode=cjfq&filename=YHJS200821009&dbname=CJFD0608
产业转型不停步	中国计算机用户	2008	2008年21期	【作者】 石菲 ；	服务外包基地 ； 腾讯公司 ； 业务流程外包 ； 陈一 ； 沿海地区 ； 贝瑞特 ； 光电科技 ； 副总裁 ； 设备研发 ； 班加罗尔 ；	<正>震后一个月,重建成了抗震救灾的重点。作为中国服务外包基地城市,成都正在从地震中快速恢复。	2008年21期_产业转型不停步.pdf	http://sso.cdclib.org/interlibSSO/goto/6/=06190596Z93/kcms/detail/detail.aspx?dbCode=cjfq&filename=YHJS200821010&dbname=CJFD0608
并不简单的重建	中国计算机用户	2008	2008年21期	【作者】 徐立洋 ；	重建规划 ； 中国电信 ； 中国移动 ； 卫星电话 ； 电子信息行业 ； 成都高新区 ； 汶川 ； 迈普 ； 移动通信公司 ； 人口布局 ；	重建不只是恢复那么简单。企业的重建不是把原有的东西恢复了,而是要在重建过程中寻求产业升级,将落后产能淘汰掉,这需要信息化手段的支持。	2008年21期_并不简单的重建.pdf	http://sso.cdclib.org/interlibSSO/goto/6/=06190596Z93/kcms/detail/detail.aspx?dbCode=cjfq&filename=YHJS200821011&dbname=CJFD0608
大事	中国计算机用户	2008	2008年21期		中国软件 ； 软博会 ； 骨干企业 ； 信息产业 ； 五化 ； 金卡工程 ； 华旗爱国者 ； 人才培养 ； 项目建设单位 ； 容灾系统 ；	<正>中国软件产业发展确立五大重点在6月12日开幕的第十二届软博会上,工业和信息产业部有关领导表示,组建工信部后,在工业化与信息化融合及"五化"并举的新背景下,中国软件产业将突出提升产业公共服务能力、重大专项重点突破、融合发展、培养骨干企业、加强人才培养等五大重点。同时,我国软件产业的收入,由2000年593亿上升到2007年5834亿,占	2008年21期_大事.pdf	http://sso.cdclib.org/interlibSSO/goto/6/=06190596Z93/kcms/detail/detail.aspx?dbCode=cjfq&filename=YHJS200821012&dbname=CJFD0608
电子商务再迈诚信“坎儿”	中国计算机用户	2008	2008年21期	【作者】 雷赫 ；	诚信通 ； 企业身份 ； 个人身份 ； 企业会员 ； 网络交易 ； 阿里巴巴网络 ； 支付平台 ； 货到付款 ； 卫哲 ； 网商 ；	<正>虽然电子商务已经存在充分的发展基础,但并不完善的诚信体系使得买卖双方始终留有一份谨慎。6月10日,阿里巴巴在电子商务的诚信建设上有了新动作,推出"诚信通个人会员服务"。与其2002年推出的"诚信通企业会员服务"不同,"诚信通个人会员服务"采用个人身份实名认证,而非企业身份认证,是基于用户提供	2008年21期_电子商务再迈诚信“坎儿”.pdf	http://sso.cdclib.org/interlibSSO/goto/6/=06190596Z93/kcms/detail/detail.aspx?dbCode=cjfq&filename=YHJS200821013&dbname=CJFD0608
绿色IT还有多远	中国计算机用户	2008	2008年21期	【作者】 石菲 ；	世界环境日 ； 转变传统观念 ； 废旧电器 ； 产品材料 ； 绿色数据中心 ； 不落人后 ； 产品消费者 ； 个体经营 ； 战略性技术 ； 有毒材料 ；	<正>绿色IT无疑是个好事情,但绿色IT到底离我们有多远,却是个值得思考的问题。2008年6月5日是第37个世界环境日,今年世界环境日以"转变传统观念,推行低碳经济"为主题,关注资源和促进低碳经济的生活方式。	2008年21期_绿色IT还有多远.pdf	http://sso.cdclib.org/interlibSSO/goto/6/=06190596Z93/kcms/detail/detail.aspx?dbCode=cjfq&filename=YHJS200821014&dbname=CJFD0608
天下	中国计算机用户	2008	2008年21期		美国微软公司 ； 声音识别 ； 分析报告 ； 人机交互 ； 即时消息 ； 电视面板 ； 赛迪顾问 ； 英特尔投资 ； 电脑主机 ； 俄亥俄州 ；	<正>2020年:人与计算机生理界限将消失6月11日,美国微软公司的一项报告文章,题目是"人与计算机之间的生理界限到2020年将消失"。此报告涉及了2020年可能在人机交互(HCI)领域产生的一些发展情况。分析报告指出,将人类与鼠标、键盘和显示器等机器联系起来的常规媒介将发生变化,变成更为直观的媒介,例如声音识别系统和可触屏幕。有了这些	2008年21期_天下.pdf	http://sso.cdclib.org/interlibSSO/goto/6/=06190596Z93/kcms/detail/detail.aspx?dbCode=cjfq&filename=YHJS200821015&dbname=CJFD0608
未来汽车,电子掌控?	中国计算机用户	2008	2008年21期		电子控制系统 ； 历史资料 ； 自动驾驶系统 ； 车身设计 ； 机械式变速器 ； 电子设备 ； 碰撞事故 ； 引擎技术 ； 民用车辆 ； 流线形 ；	<正>让越来越多的电子设备来参与汽车操控已经是大势所趋。F1汽车赛不仅是一项汽车高科技的竞赛,更兼有将未来的汽车技术展示给人们的效果。翻阅历史资料,可以知道在上世纪五六十年代,汽车安全带并不是车	2008年21期_未来汽车,电子掌控?.pdf	http://sso.cdclib.org/interlibSSO/goto/6/=06190596Z93/kcms/detail/detail.aspx?dbCode=cjfq&filename=YHJS200821016&dbname=CJFD0608
印度外包企业大打家庭牌	中国计算机用户	2008	2008年21期	【作者】 Amol Sharma ； Jackie Range ； Vibhuti Agarwal ；	家庭牌 ； 医疗保险公司 ； 人力资源主管 ； 登门拜访 ； 安全保护措施 ； 华尔街日报 ； 人生选择 ； 工作时间 ；	<正>由于面临员工短缺,印度的专业外包企业正竭尽所能地招募人才。十个月前,当外包企业Keane Inc.聘用Jyoti Taneja在位于印度Gurgaon的办公室工作后,Taneja的父母都感到非常担心。22岁的Taneja女士负责接听美国医疗保险公司的客户	2008年21期_印度外包企业大打家庭牌.pdf	http://sso.cdclib.org/interlibSSO/goto/6/=06190596Z93/kcms/detail/detail.aspx?dbCode=cjfq&filename=YHJS200821017&dbname=CJFD0608
全球最快计算机研制成功	中国计算机用户	2008	2008年21期		笔记本电脑 ； 运算性能 ； 洛斯阿拉莫斯 ； 达戈 ； 托马斯 ； 核安全 ； 斯蒂 ； 刀片服务器 ； 数据中心 ； 双内核 ；	<正>Roadrunner的运算能力相当于10万台能力最强大的笔记本电脑。6月10日,美国洛斯阿拉莫斯国家实验室和IBM的科学家公布了世界上首台运算性能达到每秒1000万亿次的超级计算机。美国核安全管理局局长托马斯·达戈斯蒂诺(ThomasD	2008年21期_全球最快计算机研制成功.pdf	http://sso.cdclib.org/interlibSSO/goto/6/=06190596Z93/kcms/detail/detail.aspx?dbCode=cjfq&filename=YHJS200821018&dbname=CJFD0608
纳米电子设备可能致癌	中国计算机用户	2008	2008年21期		纳米电子 ； 纤维状 ； 恶性间皮瘤 ； 纳米技术 ； 纳米材料 ； 近期出版 ； 复合金属 ； 心包膜 ； 消费类产品 ； 爱丁堡大学 ；	在工作场所无意间吸入石棉可能导致恶性间皮瘤,产生癌细胞。研究结果表明,长而薄的石棉纤维状的多壁碳纳米管可产生与石棉纤维类似的作用。	2008年21期_纳米电子设备可能致癌.pdf	http://sso.cdclib.org/interlibSSO/goto/6/=06190596Z93/kcms/detail/detail.aspx?dbCode=cjfq&filename=YHJS200821019&dbname=CJFD0608
电子表格纷争	中国计算机用户	2008	2008年21期	【作者】 李晓慧 ；	电子表格 ； Lotus ； 应用软件 ； 个人电脑 ； 布里克 ； 通信软件 ； 首款 ； 游戏软件 ； 行业软件 ； 软件制作 ；	从首款电子表格软件VisiCalc开始,Lotus1-2-3、Multiplan直到Excel,在电子表格领域各家厂商的竞争,使用户得到了越来越好的体验。	2008年21期_电子表格纷争.pdf	http://sso.cdclib.org/interlibSSO/goto/6/=06190596Z93/kcms/detail/detail.aspx?dbCode=cjfq&filename=YHJS200821020&dbname=CJFD0608
程朝晖:感性的构件者	中国计算机用户	2008	2008年21期	【作者】 雷赫 ；	程朝晖 ； 构件技术 ； 中间件 ； 职业选择 ； 框架技术 ； 业务流程 ； 应用服务器 ； 机器语言 ； 技术理念 ； 返回的 ；	对于构件的技术理念,他是理性的;对于自己的职业选择,他是感性的。理性做思考,感性做决断,程朝晖演绎着自己的构件人生。	2008年21期_程朝晖:感性的构件者.pdf	http://sso.cdclib.org/interlibSSO/goto/6/=06190596Z93/kcms/detail/detail.aspx?dbCode=cjfq&filename=YHJS200821021&dbname=CJFD0608
员工与客户如何扁平化?	中国计算机用户	2008	2008年21期	【作者】 王甲佳 ；	决策难点 ； 思维困境 ； 角色尴尬 ； 王甲 ； 管理层级 ； 管理冲突 ； 生命周期 ； 内部组织机构 ； 不知道 ； 丰田生产方式 ；	急CIO之所急,想CIO之所想,做CIO倾述及献计献策之对象。通过对生动的典型场景展现和分析,与业内专家、CIO、企业管理者,共同探讨信息化过程中的管理冲突、思维困境、决策难点、角色尴尬等问题。	2008年21期_员工与客户如何扁平化?.pdf	http://sso.cdclib.org/interlibSSO/goto/6/=06190596Z93/kcms/detail/detail.aspx?dbCode=cjfq&filename=YHJS200821022&dbname=CJFD0608
客户忠诚度决定企业利润	中国计算机用户	2008	2008年21期	【作者】 韩建锋 ； 【机构】 石家庄嘉禾啤酒有限责任公司 信息主管 ；	客户忠诚度 ； 企业利润 ； 组织结构 ； 课题组研究 ； 渠道管理 ； 渠道扁平化 ； 管理层级 ； 渠道营销 ； 扁平化管理 ； 扁平化组织 ；	哈佛商学院服务管理课题组研究证明,企业的利润是由客户忠诚度决定的,忠诚的客户给企业带来的异乎寻常的利润。	2008年21期_客户忠诚度决定企业利润.pdf	http://sso.cdclib.org/interlibSSO/goto/6/=06190596Z93/kcms/detail/detail.aspx?dbCode=cjfq&filename=YHJS200821023&dbname=CJFD0608
用管理客户的方式管理员工	中国计算机用户	2008	2008年21期	【作者】 侯象洋 ； 【机构】 东经控股集团有限公司 项目经理 ；	上海盛大 ； 陈天桥 ； 发展序列 ； 专业岗位 ；	<正>张伟所需要的想让客户享受到的"招之即来,挥之即去"的理想状念,其实就是内部反应的向外延伸。长春工业成套设备有限公司的张伟,遇到的问题和上海盛大的陈天	2008年21期_用管理客户的方式管理员工.pdf	http://sso.cdclib.org/interlibSSO/goto/6/=06190596Z93/kcms/detail/detail.aspx?dbCode=cjfq&filename=YHJS200821024&dbname=CJFD0608
信息化规划保证企业战略目标	中国计算机用户	2008	2008年21期	【作者】 缪华 ； 【机构】 北大纵横管理咨询公司 咨询顾问 ；	信息化规划 ； 企业战略目标 ； 企业信息化战略 ； 企业变革 ； 企业流程 ； 企业管理现状 ； 管理组织体系 ； 信息系统 ； 信息化人才 ； 企业发展战略 ；	<正>有些老板听到一个不错的概念就要在企业里实施,完全不考虑与企业战略是否吻合。这样的背景下做出的信息系统基本都是短命的。案例中李苏通面临的是一个如何重新构建企业信息化规划以实现企业变革目标的任务。	2008年21期_信息化规划保证企业战略目标.pdf	http://sso.cdclib.org/interlibSSO/goto/6/=06190596Z93/kcms/detail/detail.aspx?dbCode=cjfq&filename=YHJS200821025&dbname=CJFD0608
CCU读者俱乐部 会员评论	中国计算机用户	2008	2008年21期		读者俱乐部 ； CCU ； 企业雇员 ； 整合程度 ； 响应程度 ； 知识管理系统 ； 服务转型 ； 不知道 ； 部门间 ； 服务性工作 ；	<正>采取"秘密客户"的方式所谓的"扁平化"就是要压缩管理层,使员工和客户之间的关系变得日益紧密和重要,对工作业绩的衡量标准自然就成为重要的信息来源。有许多企业采取"秘密客户"的方式来收集服务质量的信息。"秘密客户"是由企	2008年21期_CCU读者俱乐部+会员评论.pdf	http://sso.cdclib.org/interlibSSO/goto/6/=06190596Z93/kcms/detail/detail.aspx?dbCode=cjfq&filename=YHJS200821026&dbname=CJFD0608
软件开发的爵士乐	中国计算机用户	2008	2008年21期	【作者】 石菲 ；	软件开发 ； 软件配置管理 ； 软件生产 ； 开发速度 ； 开发生命周期 ； 需求分析 ； 软件设计 ； 软件生命周期 ； 软件需求 ； 可扩展的 ；	软件开发是一种高度协作的过程,就像是一支乐队在集体演奏,每一个音乐家不但要集中精力演奏自己的部分,同时还要与乐队全体成员保持合拍与同步。	2008年21期_软件开发的爵士乐.pdf	http://sso.cdclib.org/interlibSSO/goto/6/=06190596Z93/kcms/detail/detail.aspx?dbCode=cjfq&filename=YHJS200821027&dbname=CJFD0608
打造“山地物探铁军”	中国计算机用户	2008	2008年21期	【作者】 徐立洋 ；	物探技术 ； 四川石油管理局 ； 自身性 ； 投资规模 ； 整套系统 ； 工程技术服务 ； 地震数据采集 ； 天然气生产 ； 地震采集 ； 叠前深度偏移 ；	除了硬件设备自身性能优异与否之外,整套系统的投资规模是否可以接受、供应商是否拥有部署大型HPCC的丰富经验,也是HPCC系统能否顺利实施的重要因素。	2008年21期_打造“山地物探铁军”.pdf	http://sso.cdclib.org/interlibSSO/goto/6/=06190596Z93/kcms/detail/detail.aspx?dbCode=cjfq&filename=YHJS200821028&dbname=CJFD0608
挽救失去的信息	中国计算机用户	2008	2008年21期	【作者】 程斌 ；	数据恢复 ； 国家信息中心 ； 信息安全研究 ； 灾区政府 ； 技术支持服务 ； 汶川地震 ； 高端服务器 ； 数据存储介质 ； 磁盘阵列 ； 政府机构 ；	近日,国家信息中心信息安全研究与服务中心(DRS数据恢复服务)正式对外界承诺,将为汶川地震灾区政府部门、部队、医院和学校提供数据恢复免费技术支持服务。	2008年21期_挽救失去的信息.pdf	http://sso.cdclib.org/interlibSSO/goto/6/=06190596Z93/kcms/detail/detail.aspx?dbCode=cjfq&filename=YHJS200821029&dbname=CJFD0608
灾备系统中的容量优化技术	中国计算机用户	2008	2008年21期	【作者】 程斌 ；	灾备系统 ； 数据备份 ； 重复数据 ； 数据压缩技术 ； 灾难恢复 ； 数据总量 ； 存储系统 ； 匹配算法 ； 数据处理系统 ； 信息系统 ；	全世界每年都要发生各式各样的自然灾害,利用现代科技去尽可能的减少灾害的损失,也许是我们无奈的选择。	2008年21期_灾备系统中的容量优化技术.pdf	http://sso.cdclib.org/interlibSSO/goto/6/=06190596Z93/kcms/detail/detail.aspx?dbCode=cjfq&filename=YHJS200821030&dbname=CJFD0608
寻找最佳功耗平衡点	中国计算机用户	2008	2008年21期	【作者】 程斌 ；	技术架构 ； 威盛电子 ； 能耗控制 ； 芯片厂商 ； 浮点运算 ； 国家信息中心 ； 处理器系统 ； 摩尔定律 ； 绿色计算 ； 移动计算 ；	<正>寻找性能和能耗的平衡点,构建平衡的技术架构。已经逐渐替代了多年来重性能轻能耗的模式。	2008年21期_寻找最佳功耗平衡点.pdf	http://sso.cdclib.org/interlibSSO/goto/6/=06190596Z93/kcms/detail/detail.aspx?dbCode=cjfq&filename=YHJS200821031&dbname=CJFD0608
统一网络管理实现网络优化	中国计算机用户	2008	2008年21期	【作者】 程斌 ；	网络管理 ； 网络层 ； 流量管理 ； 上网行为管理 ； 不可控因素 ； 网络设备 ； 网络瘫痪 ； 服务器群 ； 互联网网络 ； 互联网访问 ；	面对日益复杂的网络环境,多种多样的不可控因素,网络管理者开始布置统一网络流量管理设备来维护企业网络的顺畅。	2008年21期_统一网络管理实现网络优化.pdf	http://sso.cdclib.org/interlibSSO/goto/6/=06190596Z93/kcms/detail/detail.aspx?dbCode=cjfq&filename=YHJS200821032&dbname=CJFD0608
不要做星星	中国计算机用户	2008	2008年21期	【作者】 喻明 ；	第二年 ；	<正>做不了太阳就做月亮,做不了月亮,千万别做星星。因为一旦陷入了满天的星星之中,就再也没人找得到你了。	2008年21期_不要做星星.pdf	http://sso.cdclib.org/interlibSSO/goto/6/=06190596Z93/kcms/detail/detail.aspx?dbCode=cjfq&filename=YHJS200821033&dbname=CJFD0608
信息安全,企业何去何从?	中国计算机用户	2008	2008年21期	【作者】 徐立洋 ；	信息安全 ； 自动取款机 ； 信息技术风险 ； 内部控制 ； 风险管理指引 ； 万事达 ； 资产损失 ； 香港金融管理局 ； 报告过程 ； 执行结果 ；	<正>100%安全的系统是不存在的,对于存在信息安全风险的业务,不应是一味排斥和逃避,关键在于科学的管理和控制。2005年12月6日,上海市民李先生在银行自动取款机提款时,发现自己的两张牡丹灵通卡上各有1414元不翼而飞。经查询,原来两天前有一个陌生人从网上转走了这笔款项。	2008年21期_信息安全,企业何去何从?.pdf	http://sso.cdclib.org/interlibSSO/goto/6/=06190596Z93/kcms/detail/detail.aspx?dbCode=cjfq&filename=YHJS200821034&dbname=CJFD0608
深切缅怀我国计算机网络的开拓者王行刚	中国计算机用户	2008	2008年21期	【作者】 张英 ； 【机构】 中国科学院计算技术研究所 研究员 ；	计算机界 ； 信息匮乏 ； 编委会副主任 ； 前沿技术 ； 计算机应用 ； 中国科学院 ； 专题化 ； 奋斗一生 ； 网络原理 ； 信息系统集成 ；	王行刚同志是我国计算机网络的先行者,他不仅是我国第一台电子计算机(103机)等5台早期计算机的研制者,还是《中国计算机用户》的创始人之一。他的病逝,使我国计算机事业失去了一位领路人。同时,《中国计算机用户》也为失去这样一位良师益友而痛惜万分。在《中国计算机用户》创刊后的前10年间,王行刚与众多国内计算机界著名专家一道,组织了大量前沿技术报道,并以专题化的方式,及时、准确地反映了我国计算机领域的最新进展。尤其是在信息匮乏的年代,为推动我国计算机应用的发展,做出了卓越的贡献。王行刚先生曾任过《中国计算机用户》编委会副主任、编委会主任。今天,为了深切缅怀这位我国计算机界的老前辈,我们特约请曾经与王行刚先生一起工作和生活过的战友以及他的学生,撰写了一组《深切缅怀我国计算机网络的开拓者王行刚》的文章,以表达我们对他的敬意与缅怀。	2008年21期_深切缅怀我国计算机网络的开拓者王行刚.pdf	http://sso.cdclib.org/interlibSSO/goto/6/=06190596Z93/kcms/detail/detail.aspx?dbCode=cjfq&filename=YHJS200821035&dbname=CJFD0608
对金融电子化的突出贡献	中国计算机用户	2008	2008年21期	【作者】 陈福康 ； 张英 ； 【机构】 中国人民银行宁波分行 ； 中国科学院计算技术研究所 原副行长 ； 研究员 ；	金融电子化 ； 人民银行总行 ； 银行业务 ； 金融业务 ； 大城市 ； 工商银行 ； 建设银行 ； 金融机构 ； 计算机集成 ； 攻关项目 ；	<正>记得那是在1986年,我国金融界开始制定国家银行业务的电子化规划,王行刚同志被中国人民银行总行聘为"银行电子化专业组"总设计师。他随同当时金融界的有关领导同志分别去了京、津、沪等几大城市作调	2008年21期_对金融电子化的突出贡献.pdf	http://sso.cdclib.org/interlibSSO/goto/6/=06190596Z93/kcms/detail/detail.aspx?dbCode=cjfq&filename=YHJS200821036&dbname=CJFD0608
是严师更是慈父	中国计算机用户	2008	2008年21期	【作者】 杨雅辉 ； 罗治国 ； 【机构】 北京大学软件与微电子学院 ； 中国移动研究院 副教授 ；	信息技术领域 ； 德高 ； 博士学位 ； 人格魅力 ； 毕生精力 ； 中国移动 ； 终生受益 ； 教育事业 ； 网络规划设计 ； 研究工作 ；	<正>听到王行刚老师病逝的消息,我们抑制不住内心的悲痛。我国信息技术领域失去了一位德高望众的科学家,我们也从此失去了敬爱的恩师。我们有幸成为他的研究生,在他的指导下获博士学位。我们亲身领略	2008年21期_是严师更是慈父.pdf	http://sso.cdclib.org/interlibSSO/goto/6/=06190596Z93/kcms/detail/detail.aspx?dbCode=cjfq&filename=YHJS200821037&dbname=CJFD0608
