title	journal_name	year	issue	author	keywords	summary	pdf_filename	article_url
品尝虚拟化	中国计算机用户	2007	2007年10期	【作者】 杨桂珍 ； 【机构】 广州城市职业学院 ；	虚拟技术 ； 虚拟机软件 ； 计算任务 ； 软件应用 ； 虚拟化管理 ； 数据中心 ； 服务器数量 ； 应用程序 ； 投资成本 ； 容量规划 ；	虚拟技术即将迎来一个新的发展浪潮,在技术上可以让虚拟机上的软件更加自由地在物理机器上运行,分担计算任务,而软件应用不会发生崩溃,网络响应更加快速。	2007年10期_品尝虚拟化.pdf	http://sso.cdclib.org/interlibSSO/goto/6/=06190596Z93/kcms/detail/detail.aspx?dbCode=cjfq&filename=YHJS200710021&dbname=CJFD0608
用集群去存储百川	中国计算机用户	2007	2007年10期	【作者】 黄昆 ；	集群存储 ； 存储系统 ； 网络存储技术 ； 商业需求 ； 企业级应用 ； 存储方法 ； 存储阵列 ； 服务器软件 ； 服务器系统 ； 服务器集群 ；	企业发展对存储的需求使集群存储走到了存储前列,与集群服务器类似,集群存储也有着很多不同的含义和实现方式,以满足各种不同的应用和商业需求。	2007年10期_用集群去存储百川.pdf	http://sso.cdclib.org/interlibSSO/goto/6/=06190596Z93/kcms/detail/detail.aspx?dbCode=cjfq&filename=YHJS200710022&dbname=CJFD0608
用户心中的误区	中国计算机用户	2007	2007年10期	【作者】 陈禹 ； 【机构】 大庆油田地质录井分公司 ；	文件系统 ； 带外 ； 集群环境 ； 文件存储 ； 命名空间 ； 存储市场 ； 软件系统 ； 数据文件 ； 可扩展性 ； 文件级 ；	用户对存储集群产品名称仍存在误解,误以为集群文件系统是只在计算集群环境下使用的文件系统,虽然两者在应用中确实是经典搭配,但却没有必然联系。	2007年10期_用户心中的误区.pdf	http://sso.cdclib.org/interlibSSO/goto/6/=06190596Z93/kcms/detail/detail.aspx?dbCode=cjfq&filename=YHJS200710023&dbname=CJFD0608
机房空调要专用	中国计算机用户	2007	2007年10期	【作者】 王铁旺 ； 【机构】 艾默生网络能源空调系统部 经理 ；	机房空调 ； 机房环境 ； 显热比 ； 机房设备 ； 机房使用 ； 技术细节 ； 空气处理 ； 制冷量 ； 恒温恒湿 ； 洁净度 ；	<正>民用空调的设计以人为本,机房专用空调的设计以电子元器件为本,其二者在应用价值和具体技术细节的设计上存在诸多差异。	2007年10期_机房空调要专用.pdf	http://sso.cdclib.org/interlibSSO/goto/6/=06190596Z93/kcms/detail/detail.aspx?dbCode=cjfq&filename=YHJS200710024&dbname=CJFD0608
CIO装备	中国计算机用户	2007	2007年10期		CIO ； 话音通信 ； 即时消息 ； 间谍软件 ； 呼叫中心 ； 防病毒 ； 医学影像系统 ； 监控功能 ； 液晶显示器 ； 清晰准确 ；	<正>监控你的空间这种新型摄像机为用户提供了监控家庭或办公室的有效工具。无论是上班时间还是外出时,都可轻松监控家庭或办公室的一举一动,并自动发出电邮或电话警告通知。	2007年10期_CIO装备.pdf	http://sso.cdclib.org/interlibSSO/goto/6/=06190596Z93/kcms/detail/detail.aspx?dbCode=cjfq&filename=YHJS200710025&dbname=CJFD0608
走出编码“困惑”	中国计算机用户	2007	2007年10期	【作者】 徐立洋 ；	商品编码 ； 数据分析 ； 库存商品 ； 具体核算 ； 当期利润 ； 生命周期 ； 结算单 ； 财会部门 ； 增值税发票 ； 服装类 ；	如果给每个商品都维护一个编码,系统资源的占用会非常大,商场还得不断地扩充设备。要是商品编码给新品重复使用,那同编码不同商品的销售数据就会混在一起,不利于进行数据分析。	2007年10期_走出编码“困惑”.pdf	http://sso.cdclib.org/interlibSSO/goto/6/=06190596Z93/kcms/detail/detail.aspx?dbCode=cjfq&filename=YHJS200710026&dbname=CJFD0608
明确原则,理清思路	中国计算机用户	2007	2007年10期	【作者】 贾宁 ； 【机构】 赛迪顾问企业信息化咨询中心 咨询顾问 ；	信息编码 ； 编制原则 ； 数据分析 ； 商品编码 ； 商品管理 ； 产品周期 ； 编码规则 ； 编码方案 ； 服装类 ； 编码工作 ；	<正>解决小鲁的困惑关键在确定“信息编码的编制原则”,应根据企业的商品管理与数据分析需求,参考商品特点,确定该企业数据编码原则。	2007年10期_明确原则,理清思路.pdf	http://sso.cdclib.org/interlibSSO/goto/6/=06190596Z93/kcms/detail/detail.aspx?dbCode=cjfq&filename=YHJS200710027&dbname=CJFD0608
利用商品编码加强单品管理	中国计算机用户	2007	2007年10期	【作者】 方凯旋 ； 【机构】 沃尔玛(中国)投资有限公司信息系统部 高级系统工程师 ；	商品编码 ； 信息录入 ； 零售业发展 ； 最小存货单位 ； 复合索引 ； 生产效率 ； 商品管理 ； 商品条形码 ； 商品种类 ； 商品物流 ；	<正>盈品百货CIO深入分析商品信息数据的流向,先与采购部门和商品信息录入部门制定一套商品编码的方案和流程	2007年10期_利用商品编码加强单品管理.pdf	http://sso.cdclib.org/interlibSSO/goto/6/=06190596Z93/kcms/detail/detail.aspx?dbCode=cjfq&filename=YHJS200710028&dbname=CJFD0608
项目的成功需要坚决的努力	中国计算机用户	2007	2007年10期	【作者】 姜波 ； 【机构】 鲁花集团信息中心 主任 ；	项目目标 ； 信息化项目 ； 信息系统 ； 信息主管 ； 流程重组 ； 业务流程 ； 工作依据 ； 信息项目 ； 优秀项目经理 ； 遇水架桥 ；	<正>如果信息系统没有上线之前是可以对自己各种的想法与项目的设计进行调整的。一旦上线,就没有回头之箭了。	2007年10期_项目的成功需要坚决的努力.pdf	http://sso.cdclib.org/interlibSSO/goto/6/=06190596Z93/kcms/detail/detail.aspx?dbCode=cjfq&filename=YHJS200710029&dbname=CJFD0608
读者俱乐部会员评论	中国计算机用户	2007	2007年10期		条形码管理 ； 数据库技术 ； 俱乐部会员 ； 将来发展 ； 商品编码 ； 商品包装 ； 编码表 ； 数据库信息 ； 数据库设计 ； 商品管理 ；	<正>采用条形码管理现在很多商场都采用条形码进行管理,而且大多数商品包装上都有条形码标识,我认为可以直接转入该商场数据库,既便于管理,又便于将来发展后的扩充,并且方便与供货商交流数据。(庞振伟)	2007年10期_读者俱乐部会员评论.pdf	http://sso.cdclib.org/interlibSSO/goto/6/=06190596Z93/kcms/detail/detail.aspx?dbCode=cjfq&filename=YHJS200710030&dbname=CJFD0608
走出“无序”建设的怪圈	中国计算机用户	2007	2007年10期	【作者】 刘兴国 ； 熊健 ；	阶段性发展 ； 信息系统 ； 无序建设 ； 历史问题 ； 切实可行的建议 ； 业务流程 ； 环境兼容 ； 数据标准 ； 信息主管 ； 计划书 ；	信息化建设有一个不断提高的阶段性发展过程,不可能一步到位,同时还要考虑诸多的现状和历史问题,因此,必须建立“长线”和“短线”的工作机制。	2007年10期_走出“无序”建设的怪圈.pdf	http://sso.cdclib.org/interlibSSO/goto/6/=06190596Z93/kcms/detail/detail.aspx?dbCode=cjfq&filename=YHJS200710031&dbname=CJFD0608
“两会”与博客	中国计算机用户	2007	2007年10期	【作者】 李新 ；	人民网 ； 宣传报道 ； 中说 ； 声地 ； 两会报道 ； 斗地主 ； 沟通交流平台 ； 在博 ； 网络工具 ； 运输成本 ；	<正>晚饭后,看了会电视,一如既往地泡杯茶,坐到电脑跟前,打开音乐,或看看书,或上上网,这是我晚上生活的三部曲。	2007年10期_“两会”与博客.pdf	http://sso.cdclib.org/interlibSSO/goto/6/=06190596Z93/kcms/detail/detail.aspx?dbCode=cjfq&filename=YHJS200710032&dbname=CJFD0608
让科技回归人性	中国计算机用户	2007	2007年10期	【作者】 张述冠 ；	舒马赫 ； 经济发展 ； 不可再生资源 ； 赫然在目 ； 工业化时代 ； 主流模式 ； 一本 ； 作者简介 ； 逆向思考 ； 大量生产 ；	我们需要“另外一种科技,一种人性化的科技”。这种科技不但不会让人的双手和大脑变成多余的,反而会让它们变得比以前任何时候都更具有生产力。	2007年10期_让科技回归人性.pdf	http://sso.cdclib.org/interlibSSO/goto/6/=06190596Z93/kcms/detail/detail.aspx?dbCode=cjfq&filename=YHJS200710033&dbname=CJFD0608
读者之声	中国计算机用户	2007	2007年09期		读者之声 ； 检疫检验 ； 协同作战 ； 信息化提升 ； 信息资源规划 ； 软件商 ； 信息安全 ； 熊猫烧香 ； 良性运转 ； 客服热线 ；	<正>《加固菜篮子》:“菜篮子”是老百姓生活的重要部分,通过信息化的手段来加强“菜篮子”的管理,提升“菜篮子”的安全性,最终服务老百姓是信息化的成就所在。目前农业、质检、卫生、工商、检疫检验等多个部门都在守护“菜篮子”,如何使这么多部门协同作战,加固好“菜篮子”,信息化的建设功不可没。希望这样的信息化工程能尽快在全国推广。	2007年09期_读者之声.pdf	http://sso.cdclib.org/interlibSSO/goto/6/=06190596Z93/kcms/detail/detail.aspx?dbCode=cjfq&filename=YHJS200709000&dbname=CJFD0608
IT管理也是“思想布道”?	中国计算机用户	2007	2007年09期	【作者】 谷峰 ； 【机构】 深圳巨田证券公司系统工程部 经理 ；	蛮荒之地 ； 法律知识 ； IT管理 ； 伸张正义 ； 深层理解 ； 工作环境 ； 信息理论 ； 基层人员 ； 网络工具 ； 谷峰 ；	<正>记得好莱坞动作影星史泰隆在一部科幻大片《特警判官》中饰演未来世界的执法官时曾说过这样一句话:法官的责任不仅仅是除暴安良、伸张正义,更多的是要把法律带到那些有人类存在的蛮荒之地,把代表文明的法律知识传授给他们,让他们具有法制的意识。	2007年09期_IT管理也是“思想布道”?.pdf	http://sso.cdclib.org/interlibSSO/goto/6/=06190596Z93/kcms/detail/detail.aspx?dbCode=cjfq&filename=YHJS200709001&dbname=CJFD0608
天下	中国计算机用户	2007	2007年09期		量子计算机 ； 量子比特 ； 首席技术官 ； 加拿大温哥华 ； 罗斯 ； 基尼 ； 电子垃圾 ； 哈佛经典 ； 组织气氛 ； 组织变革 ；	<正>全球首台量子电脑在加拿大诞生加拿大温哥华D-Wave公司首席技术官基尼·罗斯宣布,该公司已成功研制出一个具有16位量子比特的“猎户星座”量子计算机。	2007年09期_天下.pdf	http://sso.cdclib.org/interlibSSO/goto/6/=06190596Z93/kcms/detail/detail.aspx?dbCode=cjfq&filename=YHJS200709002&dbname=CJFD0608
新闻	中国计算机用户	2007	2007年09期		科技投入 ； 学科结构 ； 产出效率 ； 计划司 ； 域名注册 ； 基础研究 ； 科学技术奖励 ； 汉字输入 ； 淘宝网 ； 互联网创业 ；	<正>出语惊人科技投入不要光看总量科技部计划司评估统计处处长刘树梅说:“提起科技投入,人们往往首先看总量。但事实上,简单看规模和排名并不能真实反映一个国家的科技实力和‘健康’水平,更重要的是进行投入强度、学科结构、产出效率方面的分析比较。”	2007年09期_新闻.pdf	http://sso.cdclib.org/interlibSSO/goto/6/=06190596Z93/kcms/detail/detail.aspx?dbCode=cjfq&filename=YHJS200709003&dbname=CJFD0608
网络也该无障碍	中国计算机用户	2007	2007年09期	【作者】 邢芳 ； 徐健淞 ；	无障碍设计 ； 信息无障碍 ； 残障人士 ； 李莉 ； 信息产业 ； 信息获取 ； 互联网世界 ； 国家政府部门 ； 计算机水平 ； 人才交流中心 ；	信息无障碍技术包括两大方面:一是辅助软件的设计;二是网站本身的无障碍设计。	2007年09期_网络也该无障碍.pdf	http://sso.cdclib.org/interlibSSO/goto/6/=06190596Z93/kcms/detail/detail.aspx?dbCode=cjfq&filename=YHJS200709004&dbname=CJFD0608
走出围城	中国计算机用户	2007	2007年09期	【作者】 正月 ；	最大降水量 ； 传志 ； 八月十五 ； 风暴潮 ； 网络维护人员 ； 这一天 ； 云遮月 ； SOHO ； 远程工作 ； 俱乐部会员 ；	城市里生活的人,最怕的是堵车。马路上川流不息的车辆,是城市律动的脉搏。如果有一天,这一切都好像被施了魔法一样一动不动,城市又会怎样?	2007年09期_走出围城.pdf	http://sso.cdclib.org/interlibSSO/goto/6/=06190596Z93/kcms/detail/detail.aspx?dbCode=cjfq&filename=YHJS200709005&dbname=CJFD0608
法律出台之后	中国计算机用户	2007	2007年09期	【作者】 石菲 ；	电子产品 ； 电子垃圾 ； 管理办法 ； 污染者 ； 有毒物质 ； 产品厂商 ； 废弃电器 ； 电子废物 ； 产品生产者 ； 强制措施 ；	现在,《电子信息产品污染控制管理办法》开始实施,如果说限制在电子产品中使用有害原料只是第一步的话,我们要做的还有很多。	2007年09期_法律出台之后.pdf	http://sso.cdclib.org/interlibSSO/goto/6/=06190596Z93/kcms/detail/detail.aspx?dbCode=cjfq&filename=YHJS200709006&dbname=CJFD0608
下一个是谁?	中国计算机用户	2007	2007年09期	【作者】 邢芳 ；	手机用户数 ； 寻呼业务 ； 中国联通 ； 单向收费 ； 曾经辉煌 ； 新增用户 ； 战争中 ； 电信改革 ； 信息产业 ； 中国电信 ；	在信息接收终端的战争中,在被手机业PK掉的寻呼业之后,下一个参加PK的会是谁?谁才能与手机进行终极PK?谁又只能成为末路英雄?	2007年09期_下一个是谁?.pdf	http://sso.cdclib.org/interlibSSO/goto/6/=06190596Z93/kcms/detail/detail.aspx?dbCode=cjfq&filename=YHJS200709007&dbname=CJFD0608
华为3Com转换角色	中国计算机用户	2007	2007年09期	【作者】 边锋 ；	产品供应商 ； 渠道合作伙伴 ； 宽视界 ； 统一通信 ； 全球营销 ； 网络融合 ； 存储领域 ； 网络电视 ； 首席运营官 ； 萨班斯 ；	华为3Com(H3C)成立3年,经历了多种变化,股权、产品、市场、技术……最终实现了角色的转换—由单一的网络产品供应商,转变为解决方案供应商。	2007年09期_华为3Com转换角色.pdf	http://sso.cdclib.org/interlibSSO/goto/6/=06190596Z93/kcms/detail/detail.aspx?dbCode=cjfq&filename=YHJS200709008&dbname=CJFD0608
用友成年礼	中国计算机用户	2007	2007年09期	【作者】 唐宏梅 ；	用友公司 ； 王文京 ； 管理软件厂商 ； 成年礼 ； 移动商务 ； 金算盘 ； 用友移动 ； 董事局主席 ； 高端市场 ； 移动电子商务 ；	18岁是人成年的标志,对于用友公司来说,在经历18年的发展后将面临怎样的拐点?	2007年09期_用友成年礼.pdf	http://sso.cdclib.org/interlibSSO/goto/6/=06190596Z93/kcms/detail/detail.aspx?dbCode=cjfq&filename=YHJS200709009&dbname=CJFD0608
Oracle融合的伙伴力量	中国计算机用户	2007	2007年09期	【作者】 黄昆 ；	中间件产品 ； 国际厂商 ； Oracle ； 市场策略 ； 唱赞歌 ； 免费升级 ； 大中华区 ； 销售总监 ； 技术架构 ； 升级版本 ；	<正>5年时间,Oracle融合中间件为何会一跃成为全球成长最快的中间件。2006年的中间件是软件市场的焦点,国内外软件厂商无一例外对中间件大唱赞歌。其中,一些国际厂商的中间件产品逐渐走向成熟。	2007年09期_Oracle融合的伙伴力量.pdf	http://sso.cdclib.org/interlibSSO/goto/6/=06190596Z93/kcms/detail/detail.aspx?dbCode=cjfq&filename=YHJS200709010&dbname=CJFD0608
借“光”上路	中国计算机用户	2007	2007年09期	【作者】 那罡 ；	联想网御 ； 市场策略 ； 中国信息安全 ； 渠道合作 ； 三年 ； 网域 ； 市场支撑 ； 客户服务 ； 市场目标 ； 市场调查报告 ；	当初从联想网御出走的任增强心中一直憋者一股劲,誓要在三年内夺取国内安全市场的“头牌”,但网御神州“借光”的市场策略,将来的路也许并不平坦。	2007年09期_借“光”上路.pdf	http://sso.cdclib.org/interlibSSO/goto/6/=06190596Z93/kcms/detail/detail.aspx?dbCode=cjfq&filename=YHJS200709011&dbname=CJFD0608
维权2.0	中国计算机用户	2007	2007年09期	【作者】 王占波 ；	网上银行服务 ； 徐继哲 ； 中国银联 ； 跨行交易 ； 群体内聚力 ； 个人银行业务 ； 跨行取款 ； 网上银行业务 ； 网银业务 ； 离港 ；	互联网既是消费者维权的对象也是维权的工具。由产品打假到服务维权,由个人投诉到网络维权联盟,网络维权将消费者维权带入2.0时代。	2007年09期_维权2.0.pdf	http://sso.cdclib.org/interlibSSO/goto/6/=06190596Z93/kcms/detail/detail.aspx?dbCode=cjfq&filename=YHJS200709012&dbname=CJFD0608
超越零合游戏	中国计算机用户	2007	2007年09期	【作者】 田野 ；	互联网经济 ； 消费者主权 ； 后现代经济 ； 雅虎法则 ； 摩尔定律 ； 信用水平 ； 这个世界 ； 吕本富 ； 经济创新 ； 梅特卡夫 ；	在互联网这个世界上最亮的太阳照耀下,自我清洁的网络特性将驱动出一个新的商业模式并大肆张扬,未来的消费者主权和社会整体信用水平将得到极大的提升,最终将超越甲方和乙方的零合游戏。	2007年09期_超越零合游戏.pdf	http://sso.cdclib.org/interlibSSO/goto/6/=06190596Z93/kcms/detail/detail.aspx?dbCode=cjfq&filename=YHJS200709013&dbname=CJFD0608
“四海为家”的CIO	中国计算机用户	2007	2007年09期	【作者】 唐宏梅 ；	当当网 ； 雅虎 ； 团队工作 ； 工作习惯 ； CIO ； 首席技术官 ； 电子商务领域 ； 咨询顾问 ； 中国香港 ； 电子商务平台 ；	每一次职业迁徙并不在Hubert的意料之中,这种迁徙被他自己解释为“四海为家”,是性格所致,也是在不同环境下他已习惯了兼容并蓄。	2007年09期_“四海为家”的CIO.pdf	http://sso.cdclib.org/interlibSSO/goto/6/=06190596Z93/kcms/detail/detail.aspx?dbCode=cjfq&filename=YHJS200709014&dbname=CJFD0608
车间走出CIO	中国计算机用户	2007	2007年09期	【作者】 郑悦 ； 徐健淞 ；	车间工人 ； 副总工程师 ； 赵书 ； 电力工业信息化 ； 摄影记者 ； 信息中心主任 ； CIO ； 电力信息化 ； 设备健康水平 ； 设备资产管理 ；	<正>从车间工人到副总工程师,从部门经理到CIO,赵书君,业务出身的他,对IT有着不一样的理解。一面对摄影记者的镜头,他总是不好意思地低下眼帘;一提到自己的工作,他马上扬起眉毛打开“话匣子”。	2007年09期_车间走出CIO.pdf	http://sso.cdclib.org/interlibSSO/goto/6/=06190596Z93/kcms/detail/detail.aspx?dbCode=cjfq&filename=YHJS200709015&dbname=CJFD0608
2007我们要更安全——2007信息安全现状与投资建设调查	中国计算机用户	2007	2007年09期	【作者】 那罡 ；	信息安全 ； 数字证书 ； 办公网 ； 业务网 ； 硬件防火墙 ； 访问控制机制 ； 物理隔离 ； 信息系统 ； 病毒防范 ； 信息资产 ；	信息安全系统是为企业业务持续运转提供服务的一种工具,如何运用好这个工具,将会是企业生存的重要硬指标。2007年,企业会更加关注在信息安全新技术和安全设备的投资。	2007年09期_2007我们要更安全——2007信息安全现状与投资建设调查.pdf	http://sso.cdclib.org/interlibSSO/goto/6/=06190596Z93/kcms/detail/detail.aspx?dbCode=cjfq&filename=YHJS200709016&dbname=CJFD0608
新龟兔赛跑	中国计算机用户	2007	2007年09期	【作者】 喻明 ；	龟兔赛跑 ； 与某 ； 善道 ； 原因解析 ； 创造机会 ； 工作单位 ； 个人表现 ； 河对岸 ； 下轮 ；	动作快且前后一致的人总是胜过缓慢且持续的人;依着自己的优势来工作;结合所有的资源且团队合作的人,总能打败单打独斗者;面对失败时,绝不轻言放弃;最后,与某一情境竞争,而不是限定某对手。	2007年09期_新龟兔赛跑.pdf	http://sso.cdclib.org/interlibSSO/goto/6/=06190596Z93/kcms/detail/detail.aspx?dbCode=cjfq&filename=YHJS200709017&dbname=CJFD0608
系统存于现场	中国计算机用户	2007	2007年09期	【作者】 蒋恒熠 ；	供应链 ； 价值增值过程 ； 永续经营 ； 营业利润 ； 中高层管理 ； 现实思考 ； 相信你 ； 决策方向 ； 茫茫人海 ； 公共信息平台 ；	温州的鞋跟制造企业仰义五美集团发起了一个“熠春计划”,即要把鞋跟做成鞋行业的CPU,在这个战略中,企业的信息化建设将发挥关键性的作用。还处在见习期的集团新任CIO王秉然细心地考察温州本地不同企业的生产方式,他希望能从温州企业的差异之中找到生产方式的本质,从而为“熠春计划”的启动找准基点。	2007年09期_系统存于现场.pdf	http://sso.cdclib.org/interlibSSO/goto/6/=06190596Z93/kcms/detail/detail.aspx?dbCode=cjfq&filename=YHJS200709018&dbname=CJFD0608
丰田的绳子	中国计算机用户	2007	2007年09期	【作者】 刘宝红 ；	生产管理经验 ； 美国通用 ； 汽车制造公司 ； 汽车生产厂 ； 日本丰田 ； 丰田公司 ； 最终客户 ； 生产效率 ； 客户服务 ； 生产车间 ；	问题就是问题,不解决就永远在那里。有生产管理经验的人大都知道,很多新问题都是老问题的翻版,只因为老问题没有得到根本解决,所以就产生了新问题。	2007年09期_丰田的绳子.pdf	http://sso.cdclib.org/interlibSSO/goto/6/=06190596Z93/kcms/detail/detail.aspx?dbCode=cjfq&filename=YHJS200709019&dbname=CJFD0608
预测改变行为	中国计算机用户	2007	2007年09期	【作者】 张述冠 ；	市场营销人员 ； 预测值 ； 预测数据 ； 区域经理 ； 促销策略 ； 目标销售量 ； 服装生产企业 ； 报名回执 ； 价格折扣 ； 统计预测 ；	必须要改变人们的行为方式,还要努力消除一些人在预测中存有的主观偏见。比如说,销售人员通常会低估预测值,而市场营销人员则刚好相反。	2007年09期_预测改变行为.pdf	http://sso.cdclib.org/interlibSSO/goto/6/=06190596Z93/kcms/detail/detail.aspx?dbCode=cjfq&filename=YHJS200709020&dbname=CJFD0608
事件管理以点带面	中国计算机用户	2007	2007年09期	【作者】 孙翊威 ； 【机构】 上海通方客户服务中心服务管理部 ；	事件管理 ； 客户服务中心 ； 支持过程 ； 服务节点 ； 服务管理 ； 工作质量 ； 配置管理 ； 问题管理 ； 变更管理 ； 发布管理 ；	事件管理通过对服务支持过程的服务环节和服务节点的设点监控,不仅监督了服务支持过程,检查了服务台的工作质量,而且也实现了事件管理对实施管理部整体上的服务支持监控。	2007年09期_事件管理以点带面.pdf	http://sso.cdclib.org/interlibSSO/goto/6/=06190596Z93/kcms/detail/detail.aspx?dbCode=cjfq&filename=YHJS200709021&dbname=CJFD0608
服务器崛起	中国计算机用户	2007	2007年09期	【作者】 边凯 ； 那罡 ；	服务器市场 ； 第四季度 ； 双核处理器 ； 听觉系统 ； 酷睿 ； 四核处理器 ； 安腾处理器 ； 企业级服务器 ； 开源操作系统 ； 端系统 ；	<正>2006年的服务器市场,“核”战、开源、虚拟化不断轰炸着我们的听觉系统。伴随着“轰炸”,服务器市场在升温。2007年2月,IDC发布了一份关于2006年服务器市场的总体报告,整体市场达到523亿美元的收入,相对于2005年增长了2%。在2006年第四季度的市场销售中,10年来中高端系统季度需求破天荒地超越了对低端服务器的需求。	2007年09期_服务器崛起.pdf	http://sso.cdclib.org/interlibSSO/goto/6/=06190596Z93/kcms/detail/detail.aspx?dbCode=cjfq&filename=YHJS200709022&dbname=CJFD0608
好用才是硬道理	中国计算机用户	2007	2007年09期	【作者】 边凯 ； 石菲 ； 郑悦 ； 董丽凤 ；	用才 ； 实践才能 ； 商用计算 ； 技术决策 ； 高性能计算机 ； 电子交易 ； 终端客户 ； 计算服务器 ； 服务器厂商 ； 业务运行 ；	<正>选服务器不是选衣服,我们要的是稳定的系统、性价比高的系统,而并不是走什么时髦路线。“选服务器不是选衣服,我们要的是稳定的系统、性价比高的系统,而并不是走什么时髦路线,新品肯定有它的优势,但是安全稳定是服务器最根本的要求,这只有实践才能证明。”另一位信息化负责人的一席话,说出了许多CIO的心声。	2007年09期_好用才是硬道理.pdf	http://sso.cdclib.org/interlibSSO/goto/6/=06190596Z93/kcms/detail/detail.aspx?dbCode=cjfq&filename=YHJS200709023&dbname=CJFD0608
5大障碍阻挠虚拟化进程	中国计算机用户	2007	2007年09期		服务器虚拟化 ； 应用程度 ； 服务器厂商 ； 网络层面 ； 虚拟网络 ； 技术成本 ； 虚拟服务器 ； 应用虚拟化 ； 系统可扩展性 ； 虚拟化管理 ；	<正>虚拟化是近两年服务器行业的一大热点。随着芯片、操作系统、服务器、工具软件等厂商的加入,服务器虚拟化的产业生态圈逐渐形成。服务器虚拟化在国外也已经取得了不少成功应用。但是在中国市场,用户对于服务器虚拟化技术的认识、接受与应用程度还是比较低。	2007年09期_5大障碍阻挠虚拟化进程.pdf	http://sso.cdclib.org/interlibSSO/goto/6/=06190596Z93/kcms/detail/detail.aspx?dbCode=cjfq&filename=YHJS200709024&dbname=CJFD0608
