title	journal_name	year	issue	author	keywords	summary	pdf_filename	article_url
Linux集群实时监控系统的一种实现方法	计算机系统应用	2013	2013年09期	【作者】 熊齐 ； 唐佳明 ； 【Author】       XIONG Qi;TANG Jia-Ming;National Linux Technology Training & Development Center,Hunan University of Arts and Science; 【机构】 湖南文理学院国家级Linux技术培训与推广中心 ；	Linux集群 ； 实时 ； 监控系统 ； 线程池 ； Linux cluster ； real-time ； monitoring system ； thread pool ；	随着云计算技术的日益发展,Linux集群以造价低廉、易于扩充等优势得到了愈来愈广泛的应用.为了更好地发挥集群性能,充分利用集群节点的资源,对集群性能进行实时监控是很有必要的.提出了一种Linux集群监控器设计与实现方法.该方法通过每隔一段时间采集节点机/proc虚拟文件系统中的信息,如CPU和内存使用情况等.经过过滤后,通过socket传输给监控服务器.论文首先给出了监控器的总体设计方案,整个监控系统由守护在管理节点上的信息管理服务器进程和运行在各个计算节点上的采集器进程组成.然后分采集器和信息管理器两大部分,分别介绍了其具体的设计框架和其采用的关键技术.采集器分主要由信息采集、信息处理和信息传送3个模块组成,分别采用3个线程来完成.信息管理器采用了线程池技术,用以接受采集器发送过来的传输请求.实践证明,该系统可以很好地满足实时监控Linux集群性能的需要.	2013年09期_Linux集群实时监控系统的一种实现方法.pdf	http://sso.cdclib.org/interlibSSO/goto/6/=06190596Z93/kcms/detail/detail.aspx?dbCode=cjfq&filename=XTYY201309010&dbname=CJFDLAST2013
一种自动化图像隐写分析平台	计算机系统应用	2013	2013年09期	【作者】 李明则 ； 向阳 ； 张文华 ； 【Author】       LI Ming-Ze;XIANG Yang;ZHANG Wen-Hua;Xian Communications Institute; 【机构】 西安通信学院 ；	隐写分析 ； 特征选择 ； 数据分析 ； 自动化 ； 操作平台 ； steganalysis ； feature selections ； data analysis ； automation ； operation platform ；	针对目前图像隐写分析手动程序编码操作耗时复杂易错、特征选择单一盲目、数据结果分析手段单一等问题,利用MATLAB开发工具,设计了一种能自动实现图像隐写分析过程的操作平台.它节省了研究人员收集各类算法的时间和精力,减少了人为编码引发的操作错误和操作时间.手动和自动特征选择与图表信息显示的结合使用,增加了特征选择与数据结果分析的手段,提升了隐写分析的进度.	2013年09期_一种自动化图像隐写分析平台.pdf	http://sso.cdclib.org/interlibSSO/goto/6/=06190596Z93/kcms/detail/detail.aspx?dbCode=cjfq&filename=XTYY201309011&dbname=CJFDLAST2013
基于WEB挖掘的网络爬虫设计与实现	计算机系统应用	2013	2013年09期	【作者】 肖毅 ； 张林 ； 聂笑一 ； 【Author】       XIAO Yi;ZHANG Lin;NIE Xiao-Yi;Information Science and Technology College,Hunan Agricultural University;Orient Science& Technology College,Hunan Agricultural University; 【机构】 湖南农业大学信息科学技术学院 ； 湖南农业大学东方科技学院 ；	数据挖掘 ； Web爬虫 ； 挖掘技术 ； data-mining ； Web crawler ； Web-minning technology ；	从介绍Web挖掘与数据挖掘的差异入手,分析Web挖掘中Web爬虫的必要性和现代Web挖掘技术的发展方向,在深入了解Web爬虫的原理及其功能的基础上,提出一个现代网站通用的挖掘模型,并利用该模型设计一种网络爬虫.经实例证明,该爬虫能高效爬取更多的各种页面数据.	2013年09期_基于WEB挖掘的网络爬虫设计与实现.pdf	http://sso.cdclib.org/interlibSSO/goto/6/=06190596Z93/kcms/detail/detail.aspx?dbCode=cjfq&filename=XTYY201309012&dbname=CJFDLAST2013
基于NI无线传感器网络的智能家居监控系统	计算机系统应用	2013	2013年09期	【作者】 陆鑫潮 ； 蒋敏兰 ； 李慧芬 ； 【Author】       LU Xin-Chao;JIANG Min-Llan;LI Hui-Fen;Department of Information Science and Engineering,Zhejiang Normal University; 【机构】 浙江师范大学数理与信息工程学院 ；	智能家居 ； NI无线传感器网络 ； 传感器节点 ； LabVIEW ； 络远程监控 ； smart home ； NI wireless sensor network(NI WSN) ； sensor nodes ； LabVIEW ； remote control ；	为了快速、准确监控家居环境中的某些参数,构建了一种基于NI无线传感器网络的智能家居监控系统.系统由多组传感器分别采集温湿度、烟雾、盗情等环境数据,通过NI无线传感器网络节点以无线网络的方式将数据发送到上位机PC,在PC端利用LabVIEW软件编程对数据进行判断处理与控制,取得了良好的人机交互界面.其中,详细介绍了系统的软件设计流程.该智能家居监控系统具备NI无线传感器网络的特性—低功耗、实时性好、易扩展、可远程监控等优点.在智能家居领域具有广阔的市场前景和应用推广价值.	2013年09期_基于NI无线传感器网络的智能家居监控系统.pdf	http://sso.cdclib.org/interlibSSO/goto/6/=06190596Z93/kcms/detail/detail.aspx?dbCode=cjfq&filename=XTYY201309013&dbname=CJFDLAST2013
三维虚拟酒店管理教学实践系统	计算机系统应用	2013	2013年09期	【作者】 孙悦 ； 张姝 ； 娄海涛 ； 张敬尊 ； 【Author】       SUN Yue;ZHANG Shu;LOU Hai-Tao;ZHANG Jing-Zun;Information College,Beijing Union University; 【机构】 北京联合大学信息学院 ；	虚拟现实 ； 三维 ； 酒店管理 ； 课程实践 ； 组卷 ； virtual reality ； three-dimensional ； hotel management ； course practice ； composing test paper ；	为解决酒店管理专业学生实践成本过高以及考核方式单一的问题,采用3ds Max、Virtual Reality-Platform和J2EE等技术构建了三维虚拟酒店管理的教学实践系统,用于学生在线课程实践和考试.以客房服务为例,深入分析了该服务的流程和实现方法,详细描述了酒店客房的虚拟场景实现和对课程信息的管理.通过本系统,学生可如身临其境般完成课程的练习和考核,教师可在线指导学生练习或组卷考核学生.	2013年09期_三维虚拟酒店管理教学实践系统.pdf	http://sso.cdclib.org/interlibSSO/goto/6/=06190596Z93/kcms/detail/detail.aspx?dbCode=cjfq&filename=XTYY201309014&dbname=CJFDLAST2013
基于KVM的远程声卡显卡虚拟化技术	计算机系统应用	2013	2013年09期	【作者】 姜邦杰 ； 吴俊敏 ； 朱小东 ； 李科君 ； 罗琳 ； 张朋飞 ； 胡蝶 ； 【Author】       JIANG Bang-Jie;WU Jun-Min;ZHU Xiao-Dong;LI Ke-Jun;LUO Lin;ZHANG Peng-Fei;HU Die;School of Computer Science and Technology,University of Science and Technology of China;Suzhou Institute for Advanced study,University of Science and Technology of China; 【机构】 中国科学技术大学计算机科学与技术学院 ； 中国科学技术大学苏州研究院 ；	KVM虚拟机 ； 设备虚拟化 ； 设备共享 ； 多媒体设备 ； QEMU设备模拟 ； 屏幕扩展 ； KVM ； I/O virtualization ； device sharing ； multimedia device ； QEMU ； screen expansion ；	针对家庭多媒体环境下的设备共享问题,提出了一种基于KVM虚拟机的远程设备虚拟化技术方案.该方案利用了KVM虚拟机的设备模拟技术,在其设备模拟模块QEMU中实现远程设备虚拟化,使得本地用户能够像使用本地的设备一样使用远程的真实物理设备.接着描述了远程虚拟声卡和显卡的具体实现以及相应的优化措施,并且利用远程虚拟显卡实现了屏幕扩展功能,最后通过实验进行性能分析.本方案优点在于仅需要在用户态的虚拟设备层添加所需要的远程设备的虚拟化,方便灵活且系统的安全性高同时不需要修改客户操作系统.	2013年09期_基于KVM的远程声卡显卡虚拟化技术.pdf	http://sso.cdclib.org/interlibSSO/goto/6/=06190596Z93/kcms/detail/detail.aspx?dbCode=cjfq&filename=XTYY201309015&dbname=CJFDLAST2013
一种数据级安全访问控制方案	计算机系统应用	2013	2013年09期	【作者】 唐建 ； 徐罡 ； 许舒人 ； 【Author】       TANG Jian;XU Gang;XU Shu-Ren;Technology Center of Software Engineering,Institute of Software,Chinese Academy of Sciences; 【机构】 中国科学院软件研究所软件工程技术中心 ；	数据访问策略 ； 行级权限 ； 列级权限 ； SQL解析 ； data access strategy ； row-level-rules ； column-level-rules ； SQL analysis ；	为了更好地保护Web应用系统中敏感数据不被非法访问.在传统的基于角色的访问控制模型基础上提出了由用户集合和数据访问权限构成的数据访问策略,并将数据访问策略关联到功能,通过对原有业务SQL解析,使用行级访问权限对数据记录进行行级过滤,再根据列级访问权限对数据记录相应属性进行屏蔽处理来进行数据安全访问控制,并设计了数据安全访问控制的框架.最后将该方案应用到新发地农产品供应链管理平台中,验证了该方案的可行性和有效性.	2013年09期_一种数据级安全访问控制方案.pdf	http://sso.cdclib.org/interlibSSO/goto/6/=06190596Z93/kcms/detail/detail.aspx?dbCode=cjfq&filename=XTYY201309016&dbname=CJFDLAST2013
基于Unity3D的虚拟博物馆信息可视化系统	计算机系统应用	2013	2013年09期	【作者】 任国栋 ； 陈林华 ； 陶学锋 ； 方先行 ； 【Author】       REN Guo-Dong;CHEN Lin-Hua;TAO Xue-Feng;FANG Xian-Xing;SINOSOFT Co.Ltd.;Hangzhou Arts & Crafts Museum; 【机构】 北京中科软件有限公司 ； 杭州工艺美术博物馆 ；	虚拟博物馆 ； Wed3D ； 三维可视化 ； 可视化系统 ； Unity3D ； virtual museum ； Wed3D ； three-dimensional visualization ； visualization system ； Unity3D ；	信息可视化技术可以帮助我们加深对大规模复杂数据和信息间相互关系的理解,而三维技术为信息可视化领域带来了新思路.本文根据杭州工艺美术博物馆虚拟博物馆三维展厅浏览和藏品知识点信息浏览的可视化需求,设计并实现了藏品信息可视化系统.该系统基于Unity3D开发平台搭建,根据杭州工艺美术博物馆虚拟博物馆藏品信息可视化需求分别设计实现相应的三维可视化组件,通过Web3D客户端技术实现了用户通过浏览器高速、便捷地浏览博物馆三维可视化信息的功能需求.	2013年09期_基于Unity3D的虚拟博物馆信息可视化系统.pdf	http://sso.cdclib.org/interlibSSO/goto/6/=06190596Z93/kcms/detail/detail.aspx?dbCode=cjfq&filename=XTYY201309017&dbname=CJFDLAST2013
计算机本体理论在石油勘探开发知识管理系统中的应用研究	计算机系统应用	2013	2013年09期	【作者】 邓小亚 ； 【Author】       DENG Xiao-Ya;Department of Computer Science,Sichuan University of Arts and Science; 【机构】 四川文理学院计算机科学系 ；	本体 ； 领域本体 ； 石油本体库 ； 知识工程 ； 采油工程 ； ontology ； domain ontology ； oil ontology ； knowledge engineering ； oil extraction engineering ；	本体论与各个领域计算机技术的发展结合产生了所谓的"领域本体"的构建及应用研究,首先介绍了计算机本体理论的基本概念,接着给出石油勘探开发知识管理系统的框架设计,然后提出基于多层次业务流程的石油勘探和开发领域知识本体库的构建方法,把石油勘探开发领域所涉及方面分为多级业务活动层次,并以采油工程方案为例列出了对应的知识本体库构建方法的探讨.	2013年09期_计算机本体理论在石油勘探开发知识管理系统中的应用研究.pdf	http://sso.cdclib.org/interlibSSO/goto/6/=06190596Z93/kcms/detail/detail.aspx?dbCode=cjfq&filename=XTYY201309018&dbname=CJFDLAST2013
一种主动防御的数据库审计子系统	计算机系统应用	2013	2013年09期	【作者】 王振铎 ； 王振辉 ； 陈绥阳 ； 王艳丽 ； 【Author】       WANG Zhen-Duo;WANG Zhen-Hui;CHEN Sui-Yang;WANG Yan-Li;School of Electronic & information,College of Siyuan;School of Technology and Engineering,Xi’an Fanyi University; 【机构】 西安思源学院电子信息工程学院 ； 西安翻译学院工程技术学院 ；	数据库审计 ； 会话 ； 主动防御 ； 触发器 ； database audit ； session ； active defense ； trigger ；	针对数据库审计技术存在的缺陷,提出利用数据库会话技术,设计具有实时提醒和处理安全风险能力的数据库审计子系统.系统详细记录用户的操作行为,对非法入侵行为进行主动处理,增加了审计系统的主动防预能力,将"事后审计分析"提前到"事后及时处理".该系统应用证实有效提高了数据库的安全性,保护了企业和用户的信息.	2013年09期_一种主动防御的数据库审计子系统.pdf	http://sso.cdclib.org/interlibSSO/goto/6/=06190596Z93/kcms/detail/detail.aspx?dbCode=cjfq&filename=XTYY201309019&dbname=CJFDLAST2013
同源视频Copy-Move篡改检测及恢复	计算机系统应用	2013	2013年09期	【作者】 陈智文 ； 黄添强 ； 吴铁浩 ； 袁秀娟 ； 苏伟峰 ； 【Author】       CHEN Zhi-Wen;HUANG Tian-Qiang;WU Tie-Hao;YUAN Xiu-Juan;SU Wei-Feng;School of Mathematics and Computer Science,Fujian Normal University;Key Laboratory of Network Security and Cryptography,Fujian Normal University;Department of Computer Science and Technology,BUN-HKBU United International College; 【机构】 福建师范大学数学与计算机科学学院 ； 福建师范大学网络安全与密码技术福建省高校重点实验室 ； 北京师范大学-香港浸会大学联合国际学院理工科技学部 ；	视频篡改 ； 序列copy-move ； 偏差矩阵 ； 视频恢复 ； video tampering ； frame sequential copy-move ； deviation-matrix ； video restoration. ；	针对同源视频序列的copy-move篡改方式,提出一种通过度量图像内容间的相关性,来实现对视频序列的copy-move篡改检测并恢复的方法.首先将视频帧内容转化为一系列连续的图像帧,对图像分块,提取每帧图像的8个特征矢量,再利用欧氏距离计算帧间相关性,并通过添加偏差矩阵构造动态偏差阈值,检测出copy-move篡改序列且精确至帧,从而实现对视频序列的篡改检测与恢复.实验表明,该算法对同源视频序列的copy-move篡改检测及恢复能够取得理想的效果.	2013年09期_同源视频Copy-Move篡改检测及恢复.pdf	http://sso.cdclib.org/interlibSSO/goto/6/=06190596Z93/kcms/detail/detail.aspx?dbCode=cjfq&filename=XTYY201309020&dbname=CJFDLAST2013
一种多目标置换流水车间调度问题的优化算法	计算机系统应用	2013	2013年09期	【作者】 何启巍 ； 张国军 ； 朱海平 ； 刘敏 ； 【Author】       HE Qi-Wei;ZHANG Guo-Jun;ZHU Hai-Ping;LIU Min;Mechanical Science and Engineering College,Huazhong University of Science and Technology; 【机构】 华中科技大学机械科学与工程学院 ；	粒子群优化算法 ； 变邻域搜索 ； 多目标 ； 置换流水车间调度 ； particle swarm optimization ； variable neighborhood search ； multi-objective ； permutation flow shop scheduling ；	针对最大完工时间最小和总流经时间最小的多目标置换流水车间调度问题(permutation flow shop scheduling problem,PFSP),提出一种粒子群优化算法与变邻域搜索算法结合的混合粒子群优化(hybrid particle swarm optimization algorithm,HPSO)算法,并使算法在集中搜索和分散搜索之间达到合理的平衡.在该混合算法中,采用NEH启发式算法进行种群初始化,以提高初始解质量;运用随机键表示法设计基于升序排列规则(ranked-order-value,ROV),将连续PSO算法应用于置换流水车间调度问题;引入外部档案集存贮Pareto解,并采用强支配关系和聚集距离相结合的混合策略保证解集的分布性;采用Sigma法和基于聚集距离的轮盘赌法进行全局最优解的选择;提出变邻域搜索算法,对外部集中的Pareto解作进一步地局部搜索.最后,运用提出的混合算法求解Taillard基准测试集,并将测试结果与SPEA2算法进行比较,验证该调度算法的有效性.	2013年09期_一种多目标置换流水车间调度问题的优化算法.pdf	http://sso.cdclib.org/interlibSSO/goto/6/=06190596Z93/kcms/detail/detail.aspx?dbCode=cjfq&filename=XTYY201309021&dbname=CJFDLAST2013
基于虹膜特征密钥的营房信息加密研究	计算机系统应用	2013	2013年09期	【作者】 王强 ； 易良廷 ； 【Author】       WANG Qiang;YI Liang-Ting;Management Department of Military Engineering,Logistics Engineering University; 【机构】 后勤工程学院军事工程管理系 ；	虹膜特征 ； 密钥 ； 营房信息 ； 加密 ； iris feature ； key ； barracks information ； encryption ；	在军队后勤信息化建设中,营房勤务信息化是重要的组成部分.为解决营房信息化中信息安全面临的严峻形势和传统加密手段的安全隐患,提出一种基于虹膜特征密钥的信息加密算法.从人体虹膜中提取375位虹膜特征码,然后从特征码中提取加密密钥用于营房信息加密.实验结果表明,加密信息的安全性得到了提高.	2013年09期_基于虹膜特征密钥的营房信息加密研究.pdf	http://sso.cdclib.org/interlibSSO/goto/6/=06190596Z93/kcms/detail/detail.aspx?dbCode=cjfq&filename=XTYY201309022&dbname=CJFDLAST2013
一种可撤销的KP-ABE方案	计算机系统应用	2013	2013年09期	【作者】 胡海英 ； 商威 ； 【Author】       HU Hai-Ying;SHANG Wei;Beijing China Power Information Technology Company; 【机构】 北京中电普华信息技术有限公司 ；	属性的加密 ； 密钥策略 ； 用户撤销 ； 直接撤销模式 ； 访问树 ； attribute based encryption ； key policy ； user revocation ； direct revocation mode ； access tree ；	提出了一个支持私钥撤销的KP-ABE(Key Policy Attribute Based Encryption)方案,该方案以直接撤销模式对用户进行撤销,能够在不更新系统公钥和任何一个用户的私钥的情况下完成对用户的撤销,更新代价较小.同时该方案基于访问树实现与Attrapadung等人基于LSSS(Linear Secret Sharing Schemes)的支持用户撤销的KP-ABE方案相比,构造更为简单.该方案的安全性可以规约到标准模型下的判定性q-BDHE(q-Bilinear Diffie-Hellman Exponent)假设.	2013年09期_一种可撤销的KP-ABE方案.pdf	http://sso.cdclib.org/interlibSSO/goto/6/=06190596Z93/kcms/detail/detail.aspx?dbCode=cjfq&filename=XTYY201309023&dbname=CJFDLAST2013
基于对等模式的虚拟计算环境下的一种任务调度算法	计算机系统应用	2013	2013年09期	【作者】 张千 ； 石琎 ； 梁鸿 ； 关新全 ； 【Author】       ZHANG Qian;SHI Jin;LIANG Hong;GUAN Xin-Quan;College of Computer and Communication Engineering,China University of Petroleum(East China); 【机构】 中国石油大学(华东)计算机与通信工程学院 ；	对等模式 ； 加权随机 ； 反馈机制 ； 任务调度 ； 负载平衡 ； peer-to-peer mode ； weighted random ； feedback mechanisms ； task scheduling ； load-balance ；	基于对等模式的虚拟计算系统体系结构,提出一种基于加权随机和反馈机制的任务调度算法.选定的调度节点首先对资源进行按需筛选和静态量化排序,继而对权重递减的资源进行随机选择,然后获取相应动态信息进行过载过滤及排序得到最终资源,最后通过反馈机制实现算法对系统负载的自适应性.实验表明该算法有效避免了系统瓶颈,平衡了负载,具有较好的自适应性.	2013年09期_基于对等模式的虚拟计算环境下的一种任务调度算法.pdf	http://sso.cdclib.org/interlibSSO/goto/6/=06190596Z93/kcms/detail/detail.aspx?dbCode=cjfq&filename=XTYY201309024&dbname=CJFDLAST2013
基于一次密钥的数据加密算法优化	计算机系统应用	2013	2013年09期	【作者】 房祥超 ； 李兴保 ； 【Author】       FANG Xiang-Chao;LI Xing-Bao;School of Information Technology and Communication,Qufu Normal University; 【机构】 曲阜师范大学信息技术与传播学院 ；	DES算法 ； 一次密钥 ； 加密原理 ； 算法优化 ； DES algorithm ； key ； encryption principle ； algorithm to optimize ；	介绍了关于DES算法的一些研究情况,分析了DES了算法的加密原理以及实现过程,通过内容分析,简单介绍了DES算法的几种改进方案,通过分析它的加密过程以及几种改进方案,进而提出了自己的一个改进思想即一次密钥的加密方案,通过这个方案为DES算法的优化作一个参考.	2013年09期_基于一次密钥的数据加密算法优化.pdf	http://sso.cdclib.org/interlibSSO/goto/6/=06190596Z93/kcms/detail/detail.aspx?dbCode=cjfq&filename=XTYY201309025&dbname=CJFDLAST2013
基于VR的二维触发式碰撞检测算法	计算机系统应用	2013	2013年09期	【作者】 王坤 ； 【Author】       WANG Kun;Information Engineering Department,Sichuan Information Technology College; 【机构】 四川信息职业技术学院信息工程系 ；	碰撞检测 ； 虚拟现实技术 ； 二维空间 ； 事件处理 ； collision detection ； virtual reality technology ； two-dimensional space ； event handling ；	在虚拟场景中经常会用到虚拟现实技术设置某精灵的移动范围和区域,物体与物体之间碰撞检测的算法成为技术关键,常用的基于图形图像的算法虽然很有效应用范围广,但是无事件处理能力,并且执行效率低和占用大量的系统资源.本文介绍一种利用二维数组高效的碰撞检测算法,满足执行效率高但精度要求不高的碰撞检测.	2013年09期_基于VR的二维触发式碰撞检测算法.pdf	http://sso.cdclib.org/interlibSSO/goto/6/=06190596Z93/kcms/detail/detail.aspx?dbCode=cjfq&filename=XTYY201309026&dbname=CJFDLAST2013
一种城市环境下的地理位置路由策略改进方法	计算机系统应用	2013	2013年09期	【作者】 郑敏 ； 沈永增 ； 张先平 ； 【Author】       ZHENG Min;SHEN Yong-Zeng;ZHANG Xian-Ping;College of Information Engineering,Zhejiang University of Technology; 【机构】 浙江工业大学信息工程学院 ；	车载自组织网络 ； 路由协议 ； 地理位置 ； 路网模型 ； 网络传输负荷 ； vehicular ad hoc network ； routing protocol ； geographic location ； road network ； transmission load ；	在城市环境下的VANET应用场景中,传统的基于地理位置信息的路由算法如GPSR等存在一些问题,本文在此基础上提出一个改进的路由协议,通过对车辆节点网络传输负荷以及所在路段方向等状态信息进行检测,并将此作为路由转发选择依据.新协议选择传输延时小并且路由健壮性较强的路径进行数据转发,有效地提高了城市环境下的路由传递效率.NS2仿真结果表明新协议具有较好的性能.	2013年09期_一种城市环境下的地理位置路由策略改进方法.pdf	http://sso.cdclib.org/interlibSSO/goto/6/=06190596Z93/kcms/detail/detail.aspx?dbCode=cjfq&filename=XTYY201309027&dbname=CJFDLAST2013
扩展的动态逻辑程序及其在产品个性化推荐中的应用	计算机系统应用	2013	2013年09期	【作者】 夏杰 ； 王洁 ； 蔡文君 ； 【Author】       XIA Jie;WANG Jie;CAI Wen-Jun;Key Laboratory of Multimedia and Intelligent Software,College of Computer Science,Beijing University of Technology; 【机构】 北京工业大学多媒体与智能软件北京重点实验室 ；	知识库更新 ； 扩展的动态逻辑程序 ； 用户偏好 ； 最优回答集 ； 个性化推荐 ； knowledge base update ； extended dynamic logic program ； user preferences ； optimal answer set ； personalized recommendation ；	动态逻辑程序能很好的处理知识库更新问题,但它不能描述和处理具有偏好的知识更新问题.因此,本文在动态逻辑程序的基础上,提出了一种新的扩展的动态逻辑程序,它通过对规则头部使用有序析取的方法使其能够描述和处理具有偏好的知识更新问题,进一步增强了知识的表达和推理能力,并且定义了其最优回答集语义.同时将这种新的扩展的动态逻辑程序应用于产品推荐系统中,使用户获得的推荐信息具有个性化特点,达到个性化推荐的目的.最后以一个产品个性化推荐实例讨论扩展的动态逻辑程序在产品个性化推荐中的应用.	2013年09期_扩展的动态逻辑程序及其在产品个性化推荐中的应用.pdf	http://sso.cdclib.org/interlibSSO/goto/6/=06190596Z93/kcms/detail/detail.aspx?dbCode=cjfq&filename=XTYY201309028&dbname=CJFDLAST2013
