title	journal_name	year	issue	author	keywords	summary	pdf_filename	article_url
网桥方式联通BNC和RJ-45子网	计算机系统应用	1997	1997年06期	【作者】 陶宇荣 ； 【机构】 广电部设计院!100866 ；	子网 ； BNC ； RJ-45 ； 网桥 ； 文件服务器 ； 网络工作站 ； 网段 ； 网络集线器 ； 网络系统 ； 网络驱动程序 ；	采用双绞线、集线器星形联接（RJ－45），和采用同轴电缆总线式联接（BNC）的局域网，是时下最普遍的网络联接方式，笔者采用文件服务器为内桥的方式实现了它们的互联。具体作法是：1．首先联通双绞线（RJ－45）网段，使该网段能够实现网络的正常运行。（1）硬件连接。分别将服务器、网络工作站的网络接口用双绞线连接至网络集线器（HUB）。（2）软件安装。安装NOVELL操作系统和工作站网络驱动程序。2．在文件服务器内插入第二块网卡，通过网卡的BNC接口与同轴电缆（BN）网段连接。注意：两块网卡的地址、中断号设定不要冲突。例如网卡1：联接类型四一45I／O基址300H中断号5网卡2：联接类型BNCI／O基	1997年06期_网桥方式联通BNC和RJ-45子网.pdf	http://sso.cdclib.org/interlibSSO/goto/6/=06190596Z93/kcms/detail/detail.aspx?dbCode=cjfq&filename=XTYY199706023&dbname=CJFD9498
消息·动态	计算机系统应用	1997	1997年06期		彩色打印机 ； Cisco ； 图象信息 ； 会议电视 ； 访问服务器 ； 信息管理系统 ； 帧中继技术 ； 多层体系结构 ； 内部用户 ； 网页内容 ；	CLI获得新疆维吾尔自治区会议电视网合约美国CLI公司与新疆维吾尔自治区邮电管理局签署了新疆会议电视网工程合约。此次签约项目为新疆维吾尔自治区会议电视网一期工程，该会议电视网以新疆维吾尔自治区邮电管理局为中心，下接乌鲁木齐市政府、全疆15个地州。生产建设兵团司令部、三个生产建设兵团师部等20个会场，设置3台多媒体会议电视服务器MCgy，其中包括CLI公司在国内首次推出的24个E1喘口MCS2，终端设备采用CLI公司世界最先进的超集成会议电视系统Radiance，全网传输速率为2Mbps，可直接与邮电部国家会议电视骨干网相连，全网预计在今年7月1日正式开通。Cisco特采用56－Kbps调制解调	1997年06期_消息·动态.pdf	http://sso.cdclib.org/interlibSSO/goto/6/=06190596Z93/kcms/detail/detail.aspx?dbCode=cjfq&filename=XTYY199706024&dbname=CJFD9498
集中计算步入新境界──美国SEQUENT公司副总裁兼技术主管陈博士访谈	计算机系统应用	1997	1997年06期		副总裁 ； SEQUENT ； 技术主管 ； 主机系统 ； 大规模系统 ； 系统集成 ； 对称多处理 ； 应用软件 ； 可移植性 ； 数据仓库 ；	美国SEQUENT系统公司作为数据中心开放系统方案的领先供应商，十多年来，一直致力于开拓创新。最新推出的NUMA－Q产品，结合结构上的技术突破、完整系统移植眼务以及与业界领导厂商良好合作等优势，成为业界焦点。IDC报告认为：“SEQUENT公司NU－MA－Q的问世，将在业界引起轰动。”正值SEQUENT在国内发布第一台商用NUMA系统—－NUMA－Q2000之际，本刊采访了专程来京的公司副总裁和技术主管SieveChen博士。陈博士出生福建，台湾长大，在美国获硕士、博士学位、曾任著名的Crar研究公司副总裁，负责开发并交付业界最畅销和最成功的超级计算机一CrayX－MP48。后创办Chen系统	1997年06期_集中计算步入新境界──美国SEQUENT公司副总裁兼技术主管陈博士访谈.pdf	http://sso.cdclib.org/interlibSSO/goto/6/=06190596Z93/kcms/detail/detail.aspx?dbCode=cjfq&filename=XTYY199706025&dbname=CJFD9498
SMART-UPS1000	计算机系统应用	1997	1997年06期		SMART ； 电源插座 ； 网络操作系统 ； 外部程序 ； SNMP ； 输出电压 ； 使用寿命 ； 电源问题 ； 日志文件 ； 统计数据 ；	APC的SmartUPS－1000有六个电源插座。它几乎为市场上的每一种网络操作系统都提供了极好的管理软件。在电压出现波动或下跌时，SmrtLJPS－1000能够在不耗用电池的情况下自动降低或提升电压以维持正常输出电压，这一点对延长电池的使用寿命至关重要。热切换电池使得即便是一般用户也能在不关闭眼务器和其它设备的情况下更换电池。要卸掉电池，仅需打开前面板，拧掉下部的金属板，断开电池连接，抽出电池即可，更换电池仅需要几分钟的时间。安装SmartUPS－1000需要将其接到墙上的电源插座，把服务器、显示器和其它设备接到它的电源插座上。我们在受保护的服务器上安装了APC的PowerChutePlus	1997年06期_SMART-UPS1000.pdf	http://sso.cdclib.org/interlibSSO/goto/6/=06190596Z93/kcms/detail/detail.aspx?dbCode=cjfq&filename=XTYY199706026&dbname=CJFD9498
面向对象的分布式测控系统	计算机系统应用	1997	1997年05期	【作者】 付长冬 ； 王勇 ； 潘清 ； 【机构】 国防科工委指挥技术学院!101407 ；	面向对象 ； 分布式 ； 测控系统 ； 继承 ；	本文首先介绍分布式测控系统的组成情况、软件功能模块、面向对象程序设计的基本概念；然后着重介绍基于面向对象的分布式测控系统总控软件的总体设计、系统中的基本类及其层次关系等内容。	1997年05期_面向对象的分布式测控系统.pdf	http://sso.cdclib.org/interlibSSO/goto/6/=06190596Z93/kcms/detail/detail.aspx?dbCode=cjfq&filename=XTYY199705000&dbname=CJFD9498
基于层次式并行处理机制的分布式实时测控系统	计算机系统应用	1997	1997年05期	【作者】 张颖 ； 杨乔林 ； 方安祥 ； 【机构】 中国科学院计算技术所!100080 ； 北京科技大学计算机系!100083 ；	单片机 ； 并行处理 ； 分布式系统 ；	本文介绍了为均衡系统中由单片机组成的那些节点在通信控制、系统管理及用户应用程序等三个方面的时空开销而采取的一种层次式并行处理机制。	1997年05期_基于层次式并行处理机制的分布式实时测控系统.pdf	http://sso.cdclib.org/interlibSSO/goto/6/=06190596Z93/kcms/detail/detail.aspx?dbCode=cjfq&filename=XTYY199705001&dbname=CJFD9498
洗衣机智能模糊控制系统	计算机系统应用	1997	1997年05期	【作者】 刘晓明 ； 桂舜尧 ； 【机构】 上海交通大学!200030 ；	模糊控制 ； 传感器 ；	本文将模糊控制引入洗衣机控制系统中，根据洗衣机工作特点，重点阐述了其模糊决策系统和主要检测电路，并给出该洗衣机的控制程序流图。	1997年05期_洗衣机智能模糊控制系统.pdf	http://sso.cdclib.org/interlibSSO/goto/6/=06190596Z93/kcms/detail/detail.aspx?dbCode=cjfq&filename=XTYY199705002&dbname=CJFD9498
一个KDD应用系统的设计与实现	计算机系统应用	1997	1997年05期	【作者】 俞机运 ； 黄上腾 ； 【机构】 上海交通大学计算机系!200030 ；	应用系统 ； KDD ； 数据库管理 ； 系统的结构 ； 高校科研管理 ； 知识发现 ； 属性域 ； 任务描述 ； 软件集成 ； 对象分析 ；	本文介绍了一个基于高校科研管理的KDD应用系统的结构、功能和实现技术。	1997年05期_一个KDD应用系统的设计与实现.pdf	http://sso.cdclib.org/interlibSSO/goto/6/=06190596Z93/kcms/detail/detail.aspx?dbCode=cjfq&filename=XTYY199705003&dbname=CJFD9498
一个基于规则的人员考核专家系统的设计	计算机系统应用	1997	1997年05期	【作者】 徐小平 ； 【机构】 广东民族学院电子工程系!510633 ；	规则 ； 人员考核 ； 专家系统 ； 推理机 ；	本文在对人员考核领域知识作充分了解、分析的基础上，提出一个基于规则的人员考核专家系统的设计方案，重点探讨了知识的表示、推理策略及推理方法等，为人员考核工作提供了一种公正、理性、科学的方法。	1997年05期_一个基于规则的人员考核专家系统的设计.pdf	http://sso.cdclib.org/interlibSSO/goto/6/=06190596Z93/kcms/detail/detail.aspx?dbCode=cjfq&filename=XTYY199705004&dbname=CJFD9498
网络互联实现校园网MIS系统的联合使用	计算机系统应用	1997	1997年05期	【作者】 姚领众 ； 宋翰涛 ； 郭贵锁 ； 【机构】 北京理工大学计算中心!100081 ；	FoxBASE ； ORACLE ； PowerBuilder ； UNIX ； NetWare ； 网络互联 ；	北京理工大学校园网MIS系统选择了以TCP／IPNFS系统（UNIX）为网络，以ORACLE／PowerBuilder为主要开发工具的研制环境。我们采用了UNIX与Netware互联、通过ODBC实现PowerBuilder应用程序对Netware上的FbxBAS等异种数据库的访问。	1997年05期_网络互联实现校园网MIS系统的联合使用.pdf	http://sso.cdclib.org/interlibSSO/goto/6/=06190596Z93/kcms/detail/detail.aspx?dbCode=cjfq&filename=XTYY199705005&dbname=CJFD9498
基于TCP/IP网际的语音/数据综合传输研究	计算机系统应用	1997	1997年05期	【作者】 陈富贵 ； 胡修林 ； 【机构】 江汉石油学院信工系!434102 ； 华中理工大学电信系!430074 ；	计算机网络 ； 时延 ； TCP／IP ； 网关 ； 报文分组 ；	在TCP／IP网际环境下实现语音／数据分组综合传输的研究尚不见报导。本文主要叙述了语音与数据传输的特点，提出并探讨了TCP／IP网际环境中分组语音交换的模型与协议以及IP网关综合传输语音／数据分组的几种方法。	1997年05期_基于TCP+IP网际的语音+数据综合传输研究.pdf	http://sso.cdclib.org/interlibSSO/goto/6/=06190596Z93/kcms/detail/detail.aspx?dbCode=cjfq&filename=XTYY199705006&dbname=CJFD9498
基于C/S的分布式远程访问服务安全管理	计算机系统应用	1997	1997年05期	【作者】 施嵘 ； 郭宗桂 ； 【机构】 上海交通大学网络中心!200030 ；	CLIENT／SERVER ； 远程访问 ； 网络管理 ； 网络安全 ； 身份验证 ； 加密 ； 记费管理 ；	越来越多的远程用户通过MODEM拨号上网，同时也带来了更加严重的安全问题和管理问题。本文详细讨论了远程访问用户的安全管理、身份验证、访问授权和记费管理，并描述了一种在CLIENT／SERVER架构下的分布式安全管理系统，说明了它的协议及其实现方法，最后给出了实例。	1997年05期_基于C+S的分布式远程访问服务安全管理.pdf	http://sso.cdclib.org/interlibSSO/goto/6/=06190596Z93/kcms/detail/detail.aspx?dbCode=cjfq&filename=XTYY199705007&dbname=CJFD9498
一种新的网络传输协议—XTP	计算机系统应用	1997	1997年05期	【作者】 贾亚军 ； 【机构】 新疆石油地球物理所!830011 ；	XTP ； 协议 ； 分布计算 ； 分析应用 ；	本文是编译者在对AlfredCWeaver先生《TheXpressTransferProtocol）的初步学习和认识基础上整理的。该文对XTP发展背景、功能及其前景等做了较详细的论述。编译者在网络的管理和维护中所遇到的诸多的协议问题，在Weaver先生的这篇论文中得到了答案及思路。	1997年05期_一种新的网络传输协议—XTP.pdf	http://sso.cdclib.org/interlibSSO/goto/6/=06190596Z93/kcms/detail/detail.aspx?dbCode=cjfq&filename=XTYY199705008&dbname=CJFD9498
提高软件可修改性的若干方法	计算机系统应用	1997	1997年05期	【作者】 林志斌 ； 【机构】 交通部广州信息技术研究所!510075 ；	软件 ； 可修改性 ； 数据库 ； 信息屏蔽 ； 独立性 ； 面向对象 ；	本文结合笔者开发MIS软件的经验，提出了提高软件可修改性的若干方法：使用数据库、修改输入域、信息屏蔽、提高模块独立性、面向对象程序设计、为修改留下余地。	1997年05期_提高软件可修改性的若干方法.pdf	http://sso.cdclib.org/interlibSSO/goto/6/=06190596Z93/kcms/detail/detail.aspx?dbCode=cjfq&filename=XTYY199705009&dbname=CJFD9498
决策系统中统计模型建模方法的研究	计算机系统应用	1997	1997年05期	【作者】 沈沧海 ； 【机构】 中国科学院计算技术研究所!100080 ；	决策系统 ； 模型库 ； 统计模型 ；	本文提出一个具有实用价值的统计模型的快速建模方法，该方法通过已知的统计数据作了曲线与相关的一些曲线方程进行拟合，求出它们之间拟合误差最小的曲线方程作为该统计数据的统计模型。	1997年05期_决策系统中统计模型建模方法的研究.pdf	http://sso.cdclib.org/interlibSSO/goto/6/=06190596Z93/kcms/detail/detail.aspx?dbCode=cjfq&filename=XTYY199705010&dbname=CJFD9498
大中型MIS的计算机软件结构模型设计	计算机系统应用	1997	1997年05期	【作者】 李爱国 ； 苗云迁 ； 法逸中 ； 【机构】 江苏职工医科大学计算机中心!210029 ；	计算机软件 ； MIS ； 模型设计 ； 设计方案 ； 结构模型 ； 数据结构设计 ； 总控 ； 共享数据 ； 终端用户 ； 动态数据 ；	本文系统阐述了一个大中型MIS的计算机软件结构模型设计方案，从进程的功能划分、结构模式、运行控制以及数据结构设计等方面，论述了该设计方案中采用的主要关键技术。技术研讨	1997年05期_大中型MIS的计算机软件结构模型设计.pdf	http://sso.cdclib.org/interlibSSO/goto/6/=06190596Z93/kcms/detail/detail.aspx?dbCode=cjfq&filename=XTYY199705011&dbname=CJFD9498
实现企业信息集成的一种有效方法	计算机系统应用	1997	1997年05期	【作者】 杨北约 ； 【机构】 张家口市农业机械工程学校!075000 ；	OO.ODBC.DBMS ； 分布式处理 ； Client／Server ；	本文介绍一种利用OO技术及开放数据库互联（ODBC）标准实现的企业信息集成的思想、方法、结构及其关键技术。	1997年05期_实现企业信息集成的一种有效方法.pdf	http://sso.cdclib.org/interlibSSO/goto/6/=06190596Z93/kcms/detail/detail.aspx?dbCode=cjfq&filename=XTYY199705012&dbname=CJFD9498
MIS基于模型的通用管理方法	计算机系统应用	1997	1997年05期	【作者】 赵稳军 ； 许长虹 ； 秦秀梅 ； 【机构】 华东石油大学!257062 ；	管理信息系统 ； 系统维护 ； 并行开发 ； 概念模型 ； 信息屏蔽 ；	本文针对当前管理信息系统（MIS）在开发、维护、扩充等方面存在的问题，提出了通用模型管理方法，M快系统开发速度，提高系统的一致性和通用性。	1997年05期_MIS基于模型的通用管理方法.pdf	http://sso.cdclib.org/interlibSSO/goto/6/=06190596Z93/kcms/detail/detail.aspx?dbCode=cjfq&filename=XTYY199705013&dbname=CJFD9498
基于Oracle及Novell的Client/Server结构MIS系统	计算机系统应用	1997	1997年05期	【作者】 王会进 ； 龙舜 ； 蔡成滇 ； 曾锦明 ； 【机构】 暨南大学计算机系!510632 ；	Client/Server体系结构 ； 网络信息管理系统 ； OraclePowerObjects ；	Client／Server体系结构是网络技术与数据库技术的相结合的产物，本文介绍一个基于Novell／Oracle的Cient／Server网络信息管理系统的设计与实现。	1997年05期_基于Oracle及Novell的Client+Server结构MIS系统.pdf	http://sso.cdclib.org/interlibSSO/goto/6/=06190596Z93/kcms/detail/detail.aspx?dbCode=cjfq&filename=XTYY199705014&dbname=CJFD9498
新型织机计算机监测系统	计算机系统应用	1997	1997年05期	【作者】 张冬雯 ； 阎卫平 ； 王文辉 ； 【机构】 河北科技大学中校区微机中心 ； 石家庄市自动化研究所 ；	计算机监测 ； 新型织机 ； 数据采集 ； 系统参数 ； 管理系统 ； 显示系统 ； 工控机 ； 串行通讯 ； 计长 ； 双向串行 ；	本交给出了“织机计算机监测和管理系统”的硬件设计，包括数据采集、显示系统、数据处理各部分的设计，并详细介绍了微机管理系统实现的各种功能。	1997年05期_新型织机计算机监测系统.pdf	http://sso.cdclib.org/interlibSSO/goto/6/=06190596Z93/kcms/detail/detail.aspx?dbCode=cjfq&filename=XTYY199705015&dbname=CJFD9498
中煤商务EDI系统的设计和开发	计算机系统应用	1997	1997年05期	【作者】 崔岚 ； 【机构】 中国矿业大学!221008 ；	中煤商务EDI ； 增值服务 ； SYBASE ； 电子邮件 ； 联机检索 ；	本文论述了中煤商务EDI信息服务系统的设计和开发过程，重点介绍了各种新型增值服务的概念和基于SYBASE数据库平台上电子邮件和联机检索系统的开发。	1997年05期_中煤商务EDI系统的设计和开发.pdf	http://sso.cdclib.org/interlibSSO/goto/6/=06190596Z93/kcms/detail/detail.aspx?dbCode=cjfq&filename=XTYY199705016&dbname=CJFD9498
基于C/S的分布式财务管理系统	计算机系统应用	1997	1997年05期	【作者】 张红涛 ； 吴相林 ； 【机构】 华中理工大学!430074 ；	客户／服务器 ； Sybase/Powerbuilder ； 分布式系统 ；	本文首先对客户／服务器结构进行了简述，介绍了华中理工大学财务MIS系统的需求及此系统运行的硬件、软件环境，进一步阐述了系统包含的主要功能及特色。	1997年05期_基于C+S的分布式财务管理系统.pdf	http://sso.cdclib.org/interlibSSO/goto/6/=06190596Z93/kcms/detail/detail.aspx?dbCode=cjfq&filename=XTYY199705017&dbname=CJFD9498
生产信息综合管理系统的设计—过程控制与管理信息的融合	计算机系统应用	1997	1997年05期	【作者】 俞文光 ； 王奇志 ； 【机构】 杭州龙山化工总厂!311213 ；	生产信息 ； 过程控制 ； 管理信息 ； DCS ；	文本简要介绍了生产信息综合管理系统的性质、特点及作用，结合中小型化工企业生产管理基本运行模式，提出了一套比较切实可行的改造方案，并提出在实施过程中应遵循的原则。	1997年05期_生产信息综合管理系统的设计—过程控制与管理信息的融合.pdf	http://sso.cdclib.org/interlibSSO/goto/6/=06190596Z93/kcms/detail/detail.aspx?dbCode=cjfq&filename=XTYY199705018&dbname=CJFD9498
大庆石化水气厂综合管理系统	计算机系统应用	1997	1997年05期	【作者】 杨永达 ； 张清武 ； 【机构】 大庆石化总厂信息中心!163714 ；	综合管理系统 ； ORACLE ； 文件服务器 ； 事务处理 ； 系统开发技术 ； 打印格式 ； 数据传送 ； 软件资源 ； 用户界面 ； 软件设计 ；	一、概述1系统组成该系统是一种基于微机局域网络的综合信息管理系统。该系统实现了由计划、财务、调度、人事、机动、质量、计量、技术、供应和厂长查询等十个子系统组成的微机局域网络。网络拓朴结构为总线型，电缆长度约30O米。2系统目标系统目标是针对水气厂原人工系统（简称原系统）存在的具体问题和水气厂的管理要求而制定的。从执行功能上看，水气厂的人工管理系统可以分为四个层次，即数据采集及控制事务处理、管理控制及决策指挥四个层次，系统功能划分如图2所示：组织机构如图3所示：门）原系统存在的问题①由于数据来源、采样周期不统一，填报周转环节多，精度取舍不一致，造成信息的大量冗余，不能实现信息共享，不能保证信息的	1997年05期_大庆石化水气厂综合管理系统.pdf	http://sso.cdclib.org/interlibSSO/goto/6/=06190596Z93/kcms/detail/detail.aspx?dbCode=cjfq&filename=XTYY199705019&dbname=CJFD9498
Windows 95的长文件名支持策略	计算机系统应用	1997	1997年05期	【作者】 刘福军 ； 【机构】 烟台开发区建设公司!264006 ；	Windows 95 ； 命名约定 ； 支持策略 ； 应用程序 ； 目标文件 ； 反斜线 ； 特殊格式 ； 实现机制 ； 总体设计 ； 存储文件 ；	对MS－DOS和Windows3．1用户而言，长文件名支持是Wind。WS95的一项新特色，它不再局限于MS－DOS和Windows3．1的8．3文件命名约定（8个字符的文件名和3个字符的扩展名），而支持长达255个字符的文件名；同时，Windows95自动为每一个长文件名分配一个符合8．3文件命名约定的”短名”，以实现其对MS－DOS和Windows3．1应用程序的上下兼容。一、MS—DOS文件命名约定及其优缺点1．文件（包括目录）名最长为8个字符，同时可包含一个最长为3个字符的扩展名。2．对大小写不加区分，MS－DOS自动将文件名中的小写转换为大写。3．只能包含如下字符：字母A—一月大小写	1997年05期_Windows+95的长文件名支持策略.pdf	http://sso.cdclib.org/interlibSSO/goto/6/=06190596Z93/kcms/detail/detail.aspx?dbCode=cjfq&filename=XTYY199705020&dbname=CJFD9498
Windows 95的MS-DOS虚拟机与新DOS内部命令	计算机系统应用	1997	1997年05期	【作者】 张永胜 ； 【机构】 山东师范大学 ；	MS-DOS ； 虚拟机 ； Windows 95 ； 命令行 ； 当前目录 ； 应用程序 ； 磁盘空间 ； 开始菜单 ； 游戏软件 ； 子菜单 ；	一、MS－DOS虚拟机在Windows95的工作桌面上，从开始（START）菜单的程序（Programs）子菜单中选择MS－DOS方式（MS－DOSPromPt）就可以打开一个MS－DOS虚拟机。在开始菜单的运行（Run）X4话框中键人Command．corn或者从资源管理器中双击COmmand、。om，都同样可以打开MS－DOS虚拟机。Windows95的MS－DOS虚拟机为用户提供使用MS－DOS命令的环境。MS－DOS虚拟机全面地支持运行MS－DOS命令及应用程序，改进了DOS应用程序使用内存空间的保护方式，极大地提高了对MS－DOS应用程序的兼容性，其32位保护模式的设备驱动程序为MS	1997年05期_Windows+95的MS-DOS虚拟机与新DOS内部命令.pdf	http://sso.cdclib.org/interlibSSO/goto/6/=06190596Z93/kcms/detail/detail.aspx?dbCode=cjfq&filename=XTYY199705021&dbname=CJFD9498
通用MIS中表格生成与打印模块的设计与实现	计算机系统应用	1997	1997年05期	【作者】 唐世明 ； 【机构】 承德电控设备厂!068150 ；	打印模块 ； MIS ； 结构描述 ； 总体设计思想 ； 分页 ； 数值型 ； 变量名 ； 字处理软件 ； 命令格式 ； 方法定义 ；	一、功能与特色1可打印任意数据库的任意字段，允许选择打印范围；2表格可直接输出至打印机或文本文件；3．表格线兼容CCED、WPS等字处理软件；4．可选择横向压缩打印、分页打印及是否打印中线；5．可打印表格名称、单位名称、共一页第一页、制表人、制表日期等表围信息；6．可选择打印汇总项，有选择地对数值型字段进行汇总；7‘字段名可用其他文字替代打印，解决了非汉字字段名的打印问题；8．该模块既可挂接到通用MIS，又可独立成为一个系统。二、总体设计思想l．为了实现系统的通用性，使用了库结构描述数据库。即由要打印的数据库生成其库结构描述数据库，并定义一组变量与要打印的数据库的各个字段—一对应，这样就把对要	1997年05期_通用MIS中表格生成与打印模块的设计与实现.pdf	http://sso.cdclib.org/interlibSSO/goto/6/=06190596Z93/kcms/detail/detail.aspx?dbCode=cjfq&filename=XTYY199705022&dbname=CJFD9498
修改DOS设置VGA单色显示器的显示方式	计算机系统应用	1997	1997年05期	【作者】 郭凯 ； 【机构】 新疆大学图书馆!830046 ；	DOS ； VGA ； 显示方式 ； 单步执行 ； 倍速 ； 彩显 ； 设备驱动程序 ； 宏基 ；	VGA单显在许多单位都有配置，配置这样的显示器往往会被BIOS置为MDA显示方式，在配置某些软、硬件时就出现显示混乱。如在安装宏基倍速光驱时，屏幕一片混乱，同时死机；但是这台计算机换上彩显后，宏基驱动器安装一切正常。但一换上单显后故障依然。通过单步执行CONFIG，SYS和AUTOEXECBAT（在机器出现Startingms－dos…时，立即按FS）发现，在执行到DEVICE＝C：／ACER／ACERCD．SYS后机器死机。单显计算机若不执行宏基驱动程序，则机器启动正常。这时调用BIOS中断的OF号功能（获取当前显示器显示方式）：C：＼＞BEBUGXXXX：0100MOVAH，OFxxxx：	1997年05期_修改DOS设置VGA单色显示器的显示方式.pdf	http://sso.cdclib.org/interlibSSO/goto/6/=06190596Z93/kcms/detail/detail.aspx?dbCode=cjfq&filename=XTYY199705023&dbname=CJFD9498
Windows3.X与Windows95的同盘安装	计算机系统应用	1997	1997年05期	【作者】 唐兆海 ； 【机构】 江苏洪泽县工商银行!223100 ；	安装目录 ； 电脑用户 ； 核心文件 ； 安装程序 ； Windows3.X ； Windows95 ； 应用程序 ； SETUP ； 怕麻烦 ； 改变自己 ；	Window95越来越流行，不少电脑用户想升级自己的系统，但又不愿放弃已经用熟的MS－DOS和WindowsX；也有的已升级到Windows95的用户，还怀念自己的旧友Windows3X。如何在不同的情况下同盘安装Windows3．X与Windows95呢？笔者将使用过程中所得到的一点经验介绍给大家。1．用Windows95原版安装（1）正向安装：在Windows3．X中安装Windows95，用户原来安装Windows3．X时，系统自动生产一个安装目录为C：＼Window民用于Windows3X系统文件的装载；在安装Win－dows95时，若不想使用原来窗口中的应用程序，就在MSDOS提示符	1997年05期_Windows3.X与Windows95的同盘安装.pdf	http://sso.cdclib.org/interlibSSO/goto/6/=06190596Z93/kcms/detail/detail.aspx?dbCode=cjfq&filename=XTYY199705024&dbname=CJFD9498
