title	journal_name	year	issue	author	keywords	summary	pdf_filename	article_url
GSM短消息通信方式在车辆监控系统的具体应用	计算机系统应用	2005	2005年04期	【作者】 朱晓梅 ； 刘向东 ； 薛鸿德 ； 【机构】 北京理工大学自动控制系 ； 北京理工大学自动控制系 100081 ； 100081 ； 100081 ；	GSM短消息 ； 车辆监控 ；	本文主要介绍了车辆监控和调度管理系统的组成、原理以及涉及的相关技术,重点讨论了本系统的GSM短 消息通信方式的技术实现。	2005年04期_GSM短消息通信方式在车辆监控系统的具体应用.pdf	http://sso.cdclib.org/interlibSSO/goto/6/=06190596Z93/kcms/detail/detail.aspx?dbCode=cjfq&filename=XTYY200504017&dbname=CJFD0305
Java 2如何传送非Serializable的final对象	计算机系统应用	2005	2005年04期	【作者】 曹大有 ； 【机构】 湖北丹江口郧阳师范高等专科学校计算机科学系 442700 ；	持续性 ； 系列化 ； 对象 ；	在Java中有很多非Serializable的final的对象,在默认条件下,它们是不能通过流的方式来完成持续性的。 本文则探讨了如何通过对象流的子类来完成这些类对象的Serializable。	2005年04期_Java+2如何传送非Serializable的final对象.pdf	http://sso.cdclib.org/interlibSSO/goto/6/=06190596Z93/kcms/detail/detail.aspx?dbCode=cjfq&filename=XTYY200504018&dbname=CJFD0305
Windows2000下基于PVM的并行计算实践研究	计算机系统应用	2005	2005年04期	【作者】 尚月强 ； 【机构】 贵州师范大学数学与计算机科学学院 贵阳 550001 ；	PVM ； Windows2000 ； 并行计算 ；	为了把网络计算在我国中小研究单位和大专院校推广普及,本文详细介绍了Windows2000操作系统下并 行环境PVM的构建、PVM并行程序的设计、编写、调试等,并给出了编程实例。实践表明,基于PVM的并行计算以 其构架简单、使用方便、计算能力大、性能价格比高等优势,特别适合我国中小研究单位和大专院校,必将成为我 国网络计算的重要方向,普遍用于各科学领域。	2005年04期_Windows2000下基于PVM的并行计算实践研究.pdf	http://sso.cdclib.org/interlibSSO/goto/6/=06190596Z93/kcms/detail/detail.aspx?dbCode=cjfq&filename=XTYY200504019&dbname=CJFD0305
基于RichTextBox控件的WYSIWYG预览	计算机系统应用	2005	2005年04期	【作者】 黄建华 ； 刘超 ； 【机构】 桂林电子工业学院通信与信息工程系 ； 上海交通大学电子工程系 541004 ； 200030 ；	RichTextBox控件 ； 所见即所得 ； 预览 ； 应用程序接口 ；	WYSIWYG是对编辑软件所普遍要求具备的一种关键技术,该技术使得软件打印输出效果和屏幕显示效果完 全一致。RichTextBox是VB所带的标准控件,该控件具备基本的图文显示、编辑和简单的格式设置功能,可以应付 普通图文处理的需要。本文主要讨论如何对RichTextBox控件进行设置和编程,调用Windows API及其未公开的 信息,使其能够按打印输出的结果来预览其内容,即如何实现RichTextBox控件的WYSIWYG预览。	2005年04期_基于RichTextBox控件的WYSIWYG预览.pdf	http://sso.cdclib.org/interlibSSO/goto/6/=06190596Z93/kcms/detail/detail.aspx?dbCode=cjfq&filename=XTYY200504020&dbname=CJFD0305
基于Web在SQL Server中存取图形文件的实现	计算机系统应用	2005	2005年04期	【作者】 李蕾 ； 张宏伟 ； 【机构】 天津工业大学 ； 天津工业大学 300160 ； 300160 ；	SQL Server ； Image字段 ； 数据流 ； Asp.net ；	本文在.NET Framework中使用C#作为ASP.NET编程语言的关键代码,通过SQL Server数据表的Image字段 真正实现了图形文件(数据流)的存取,发挥SQL Server数据管理系统所提供的强大功能,安全、快速、有效地管理 基于Web的由客户机提交给数据库的数据流操作指令。	2005年04期_基于Web在SQL+Server中存取图形文件的实现.pdf	http://sso.cdclib.org/interlibSSO/goto/6/=06190596Z93/kcms/detail/detail.aspx?dbCode=cjfq&filename=XTYY200504021&dbname=CJFD0305
VB.NET共享软件注册	计算机系统应用	2005	2005年04期	【作者】 潘应晖 ； 【机构】 福建省武夷山市南平师范高等专科学校 354300 ；	VB.NET ； 共享软件 ； 注册码 ； 注册表 ； 序列号 ；	通过对注册表及系统自定义隐藏文件的操作,以硬盘物理序列号为注册码,并用加密形式保存,对共享软件 起到真正的保护作用,防止破解,提高共享软件合法使用的安全性,并给出部分代码。	2005年04期_VB.NET共享软件注册.pdf	http://sso.cdclib.org/interlibSSO/goto/6/=06190596Z93/kcms/detail/detail.aspx?dbCode=cjfq&filename=XTYY200504022&dbname=CJFD0305
JAVA语言的多态性及其应用研究	计算机系统应用	2005	2005年04期	【作者】 蓝雯飞 ； 周俊 ； 陈淑清 ； 【机构】 中南民族大学计算机科学学院 ； 中南民族大学计算机科学学院 430074 ； 430074 ； 430074 ；	Java语言 ； 多态性 ； 重写 ； 类 ；	多态性增强了程序设计语言的表达能力。本文就JAVA语言支持的多态性作了全面的阐述和讨论,还重点 分析了抽象类和接口的区别;在此基础上,结合例子说明了多态性在程序设计中的应用。	2005年04期_JAVA语言的多态性及其应用研究.pdf	http://sso.cdclib.org/interlibSSO/goto/6/=06190596Z93/kcms/detail/detail.aspx?dbCode=cjfq&filename=XTYY200504023&dbname=CJFD0305
多操作系统安装的一种简易方法	计算机系统应用	2005	2005年04期	【作者】 钟守机 ； 【机构】 江西理工大学 341000 ；	操作系统 ； 安装 ； Partition Magic ；	本文介绍了利用硬盘分区魔术师Partition Magic在一块硬盘上同时安装上Windows 98se／ME、Windows 2000、Windows XP及Linux四个操作系统的简易方法和关键技术。	2005年04期_多操作系统安装的一种简易方法.pdf	http://sso.cdclib.org/interlibSSO/goto/6/=06190596Z93/kcms/detail/detail.aspx?dbCode=cjfq&filename=XTYY200504024&dbname=CJFD0305
跨平台Web网页防火墙构建	计算机系统应用	2005	2005年04期	【作者】 龚珍 ； 王乘 ； 【机构】 华中科技大学数字化工程中心 ； 华中科技大学数字化工程中心 430074 ； 430074 ；	php mysql ；	该文探讨了跨平台Web网页的安全性问题,利用php&mysql技术,提出了构建跨平台Web网页防火墙的IP地址技 术和用户权限验证法,并给出了实现过程,对基于Web的应用程序开发和网络数据库的安全技术的研究具有实际意义。	2005年04期_跨平台Web网页防火墙构建.pdf	http://sso.cdclib.org/interlibSSO/goto/6/=06190596Z93/kcms/detail/detail.aspx?dbCode=cjfq&filename=XTYY200504025&dbname=CJFD0305
基于Nomadix USGⅡ二次开发的可行性分析	计算机系统应用	2005	2005年04期	【作者】 罗小平 ； 王福兆 ； 【机构】 华南理工大学计算机科学与工程学院 ； 广东省电子技术学校网络中心 510641 广州 广东农工商职业技术学院计算机系 广州 510507 ； 广州 510515 ；	通用用户网关 ； 二次开发 ； 可行性 ；	美国NOMADIX公司生产的通用用户网关(USG)是一个革命性的平台,为开展宽带服务提供了强大的支持, 被广泛地应用在酒店、住宅、小区、学生宿舍、机场等场所。虽然通用用户网关(USG)本身提供的功能非常强大, 仍不能满足用户各种各样的需求,对其进行二次开发是必要的。为此,本文通过研究该网关的XML命令说明文档 和采用ASP语言通过XML控制网关的例程等资料,对基于USGⅡ作二次开发进行了可行性分析。	2005年04期_基于Nomadix+USGⅡ二次开发的可行性分析.pdf	http://sso.cdclib.org/interlibSSO/goto/6/=06190596Z93/kcms/detail/detail.aspx?dbCode=cjfq&filename=XTYY200504026&dbname=CJFD0305
基于单片机的分布式以太网管理系统	计算机系统应用	2005	2005年04期	【作者】 张浩平 ； 【机构】 南京林业大学信息科学技术学院 210037 ；	以太网 ； 单片机 ； TCP/IP协议 ；	本文提出了一种以PC机为上位机,单片机为下位机而组建的分布式以太网交换机管理系统的设计和实现, 阐述了基于单片机的TCP／IP协议的实现,并给出了系统软、硬件的组成。	2005年04期_基于单片机的分布式以太网管理系统.pdf	http://sso.cdclib.org/interlibSSO/goto/6/=06190596Z93/kcms/detail/detail.aspx?dbCode=cjfq&filename=XTYY200504027&dbname=CJFD0305
国际	计算机系统应用	2005	2005年04期		华纳兄弟 ； 互动娱乐 ； 整体基础 ； 黑客帝国 ； 设计中心 ； 结算系统 ； 收购要约 ； 更新换代周期 ； 角色扮演 ； Ellison ；	<正>创新科技 再现科幻经典 华纳兄弟在线与IBM携手打造"黑客帝国Online"游戏 近日,华纳兄弟在线宣布,IBM将为华纳兄弟互动娱乐公司提供 包括IBM eServer p系列服务器和IBM eServer x系列服务器在内的 硬件系统,为其第一款大型多人在线角色扮演类游戏(MMORPG)- "黑客帝国Online"(Matrix Online)输入强大动力。 为了支持"黑客帝国Online",华纳兄弟在线采用了包括IBM eServer p系列服务器和IBM eServer x系列服务器的硬件系统,来支持 整体基础设施。此外,华纳兄弟在线将会为注册和结算系统部署	2005年04期_国际.pdf	http://sso.cdclib.org/interlibSSO/goto/6/=06190596Z93/kcms/detail/detail.aspx?dbCode=cjfq&filename=XTYY200504028&dbname=CJFD0305
国内	计算机系统应用	2005	2005年04期		重磅出击 ； 服务器市场 ； Novell ； 开放源码 ； 微软大中华区 ； 软件正版化 ； 绩效管理 ； 技术支持中心 ； 大中华地区 ； 正版软件 ；	<正>OpenPower释放开放力量 IBM重磅出击Linux服务器市场 IBM在北京举办主题为"开放就是力量！"的新闻发布会,全面推 进针对开放源码操作系统Linux进行优化的eServer OpenPower系列 服务器及系列解决方案。IBM宣布,为此已经组建了专门的团队,将 全力投入到推动这一新兴市场的发展中。同时,IBM相应的专业技 术支持及合作伙伴配合也已逐步到位。新组建的开放合作伙伴中心 (OPC)将为OpenPower在跨平台解决方案方面提供有力的支持。 中科红旗和Novell等IBM的合作Linux厂商伙伴也纷纷到会,他们表	2005年04期_国内.pdf	http://sso.cdclib.org/interlibSSO/goto/6/=06190596Z93/kcms/detail/detail.aspx?dbCode=cjfq&filename=XTYY200504029&dbname=CJFD0305
《计算机系统应用》稿约	计算机系统应用	2005	2005年04期	【机构】 《计算机系统应用》杂志社 ；	计算机系统应用 ； 中国期刊网 ； 中国学术期刊 ； 中国科学院 ； 科技期刊 ； 自动化技术 ； 作者联系地址 ； 综合评价 ； 录用稿件 ； 邮寄地址 ；	<正>《计算机系统应用》是中国科学院主管、中国科学院软件研究所主办的、面向国内外公开发行 的技术性、应用性强的科技期刊,2000年被列为计算机与自动化技术类核心期刊,本刊最大特点是 突出实用性。被《中国期刊网》、《中国学术期刊光盘版》全文收录。是《中国学术期刊综合评价数 据库》、《中国科学引文数据库》的来源期刊。	2005年04期_《计算机系统应用》稿约.pdf	http://sso.cdclib.org/interlibSSO/goto/6/=06190596Z93/kcms/detail/detail.aspx?dbCode=cjfq&filename=XTYY200504030&dbname=CJFD0305
电子政务系统中的安全风险管理	计算机系统应用	2005	2005年03期	【作者】 闫强 ； 舒华英 ； 陈钟 ； 段云所 ； 【机构】 北京邮电大学经济管理学院 ； 北京大学计算机科学技术系 ； 北京大学计算机科学技术系 100876 ； 100876 ； 100871 ； 100871 ；	电子政务 ； 风险管理 ； 风险评估 ；	电子政务的开展以信息技术为基础,如何解决电子政务系统的安全问题已成为一个迫在眉睫的课题。本文从安全风险管理的角度出发,论述了电子政务系统面临的风险,介绍了风险评估与风险消除的一般方法。	2005年03期_电子政务系统中的安全风险管理.pdf	http://sso.cdclib.org/interlibSSO/goto/6/=06190596Z93/kcms/detail/detail.aspx?dbCode=cjfq&filename=XTYY200503001&dbname=CJFD0305
软件过程管理及其成本的平衡	计算机系统应用	2005	2005年03期	【作者】 王海阳 ； 【机构】 中央财经大学信息系 100081 ；	CMM ； 过程管理 ； 管理成本 ； 敏捷方法 ； 管理模型 ； 组织行为 ；	在进行软件过程管理时,会大大的增加管理成本,可能会局部降低效率。是否能将所产生的成本控制在一定范围,是实现管理和商业目标关键因素。在许多情况下,管理目标没有达到,而管理成本却大规模上升,总体效率降低,给企业带来损失。本文分析了造成成本增加的原因,主张在理解模型思想的前提下,采取务实、敏捷和有效的实施,从而降低管理成本的方法。	2005年03期_软件过程管理及其成本的平衡.pdf	http://sso.cdclib.org/interlibSSO/goto/6/=06190596Z93/kcms/detail/detail.aspx?dbCode=cjfq&filename=XTYY200503002&dbname=CJFD0305
Windows DNA和工作流技术支持的电子政务系统实现研究	计算机系统应用	2005	2005年03期	【作者】 李章兵 ； 郑明才 ； 刘定 ； 【机构】 湖南科技大学计算机学院 ； 湖南大学计算机学院 ； 湖南科技大学计算机学院 湘潭411201 ； 长沙410083 ； 湘潭411201 ；	windowsDNA ； 工作流 ； 电子政务系统 ； COM组件 ；	在windows DNA三层构架技术中,结合COM组件和工作流技术,实现电子政务管理系统,可以最大限度地满足政府部门管理系统的健壮、稳定、可扩展和安全的要求,具有一定的实用价值。	2005年03期_Windows+DNA和工作流技术支持的电子政务系统实现研究.pdf	http://sso.cdclib.org/interlibSSO/goto/6/=06190596Z93/kcms/detail/detail.aspx?dbCode=cjfq&filename=XTYY200503003&dbname=CJFD0305
Intranet环境下煤炭企业监控系统集成研究	计算机系统应用	2005	2005年03期	【作者】 尹洪胜 ； 钱建生 ； 华钢 ； 于国防 ； 【机构】 江苏徐州中国矿业大学信电学院 ； 江苏徐州中国矿业大学信电学院 221008 ； 221008 ； 221008 ；	Intranet ； 监控系统 ； 综合集成 ； Web组态技术 ；	研究了煤炭企业监控系统集成的协议模型;提出了一种Intranet环境下全矿务局各种监控系统综合集成方案,该方案能够实现基于WWW浏览器的监测监控功能;详细论述了涉及的接入网关的实现、监控系统通信协议的分析、监控系统数据的统一编码和压缩方法、WEB组态软件、监控系统的数据流通信机制和数据同步机制等关键技术。	2005年03期_Intranet环境下煤炭企业监控系统集成研究.pdf	http://sso.cdclib.org/interlibSSO/goto/6/=06190596Z93/kcms/detail/detail.aspx?dbCode=cjfq&filename=XTYY200503004&dbname=CJFD0305
基于ORACLE的城市规划档案管理信息系统的设计和实现	计算机系统应用	2005	2005年03期	【作者】 池海滨 ； 【机构】 宁波市规划局北仑分局 315800 ；	城市规划 ； 档案 ； 信息系统 ；	本文从项目背景、系统设计、关键技术等方面讨论了"城市规划档案管理信息系统"研究和建立的过程,介绍了在建立过程中一些做法和经验以及应用效果,为建设类似系统提供范例。	2005年03期_基于ORACLE的城市规划档案管理信息系统的设计和实现.pdf	http://sso.cdclib.org/interlibSSO/goto/6/=06190596Z93/kcms/detail/detail.aspx?dbCode=cjfq&filename=XTYY200503005&dbname=CJFD0305
分布式粮情检测控制系统的实现	计算机系统应用	2005	2005年03期	【作者】 余笛 ； 王力为 ； 彭兵 ； 彭及 ； 周前 ； 【机构】 长沙中南大学信息科学与工程学院 ； 长沙中南大学冶金科学与工程学院 ； 长沙中南大学信息科学与工程学院 410083 ； 410083 ； 410083 ；	测控系统 ； 粮情检测 ； 数据采集 ； 现场总线 ；	本文介绍了分布式粮情检测控制系统,给出了系统的总体结构,并对系统的硬件配置、软件功能以及系统的安装等作了详细的说明。	2005年03期_分布式粮情检测控制系统的实现.pdf	http://sso.cdclib.org/interlibSSO/goto/6/=06190596Z93/kcms/detail/detail.aspx?dbCode=cjfq&filename=XTYY200503006&dbname=CJFD0305
基于Web使用挖掘的个性化服务技术研究	计算机系统应用	2005	2005年03期	【作者】 崔林 ； 宋瀚涛 ； 龚永罡 ； 陆玉昌 ； 【机构】 北京理工大学计算机科学与工程系 ； 清华大学计算机科学技术系 100081 ； 100081 ； 100084 ；	个性化服务 ； Web使用挖掘 ； 推荐系统 ；	Internet的快速增长导致了对个性化服务需求急剧增加,Web使用挖掘正成为实现个性化系统功能的思想和方法的有价值的源泉。本文讨论了基于Web使用挖掘的Web个性化技术,并针对个性化系统的功能,介绍了相关数据采集和预处理技术及其在个性化系统中的应用。	2005年03期_基于Web使用挖掘的个性化服务技术研究.pdf	http://sso.cdclib.org/interlibSSO/goto/6/=06190596Z93/kcms/detail/detail.aspx?dbCode=cjfq&filename=XTYY200503007&dbname=CJFD0305
中间件技术比较研究	计算机系统应用	2005	2005年03期	【作者】 杨德仁 ； 栾静 ； 顾君忠 ； 【机构】 上海华东师范大学计算机应用研究所 ； 上海华东师范大学计算机应用研究所 200062 ； 200062 乌鲁木齐 新疆师范大学 数理信息学院 ； 830054 ； 200062 ；	中间件 ； 体系结构 ； 技术 ； 机制 ；	本文归纳了中间件的定义,描述了中间件的分类方法和体系结构,比较了中间件的典型实现机制,论述了服务的共享机制和新型中间件,总结了中间件与系统性能的关系,最后展望了中间件的发展趋势及面临的挑战。	2005年03期_中间件技术比较研究.pdf	http://sso.cdclib.org/interlibSSO/goto/6/=06190596Z93/kcms/detail/detail.aspx?dbCode=cjfq&filename=XTYY200503008&dbname=CJFD0305
利用SPI进行数据加密传输的研究	计算机系统应用	2005	2005年03期	【作者】 刘翌南 ； 【机构】 长沙理工大学计算机与通信工程学院 410076 ；	Winsock2SPI ； 对称加密算法 ； 散列函数 ；	本文提出了基于Winsock 2 SPI网络封包截获技术的数据加密传输的模型并实现之,试验表明此模型可在不改变已有网络通信系统的基础上实现灵活的数据加密传输功能。	2005年03期_利用SPI进行数据加密传输的研究.pdf	http://sso.cdclib.org/interlibSSO/goto/6/=06190596Z93/kcms/detail/detail.aspx?dbCode=cjfq&filename=XTYY200503009&dbname=CJFD0305
基于CWM的关系数据库建模方法	计算机系统应用	2005	2005年03期	【作者】 朱婵 ； 许龙飞 ； 周锦煌 ； 【机构】 广州暨南大学信息科技学院计算机系 ； 广州暨南大学信息科技学院计算机系 510632 ； 510632 ； 510632 ；	公共仓库元模型(CWM) ； 元数据 ； 关系模式 ；	对关系数据库进行建模的不同工具和产品都有其自己的元数据定义和格式,这使得它们之间的互操作非常困难。论文介绍了基于公共仓库元模型(CWM)的关系数据库建模方法,使用这种方法,数据库设计者能够通过标准的CWM格式来设计和创建数据库。	2005年03期_基于CWM的关系数据库建模方法.pdf	http://sso.cdclib.org/interlibSSO/goto/6/=06190596Z93/kcms/detail/detail.aspx?dbCode=cjfq&filename=XTYY200503010&dbname=CJFD0305
基于Flash实现JavaCard事务带来的问题及其解决方案	计算机系统应用	2005	2005年03期	【作者】 李栋 ； 杨义先 ； 【机构】 北京邮电大学国家重点实验室 ； 北京邮电大学国家重点实验室 100876 ； 100876 ；	Transaction(事务) ； EEPROM ； Flash ； 掉电 ；	通常Java Card使用的可读写存储介质是EEPROM,由于写Flash的特殊性,导致使用Flash来实现事务时,断电时系统可能不能恢复到事务开始前的状态。本文针对Flash在断电恢复时出现的问题提出了相应的解决方案,并且得到了很好的实践验证。	2005年03期_基于Flash实现JavaCard事务带来的问题及其解决方案.pdf	http://sso.cdclib.org/interlibSSO/goto/6/=06190596Z93/kcms/detail/detail.aspx?dbCode=cjfq&filename=XTYY200503011&dbname=CJFD0305
基于关系DBMS的一种数据库加密实现方法	计算机系统应用	2005	2005年03期	【作者】 王洪 ； 吕述望 ； 刘振华 ； 【机构】 中国科学院研究生院 ； 中国科学院研究生院 100039 ； 100039 ； 100039 ；	数据库加密 ； 数据库管理系统 ；	本文提出了一种在DBMS内实现数据库加密的方法,并对各相关功能的实现和操作进行了阐述。该加密方法在尽可能不影响原有系统功能的基础上,在方便用户使用的同时,提高了数据库系统的安全。	2005年03期_基于关系DBMS的一种数据库加密实现方法.pdf	http://sso.cdclib.org/interlibSSO/goto/6/=06190596Z93/kcms/detail/detail.aspx?dbCode=cjfq&filename=XTYY200503012&dbname=CJFD0305
基于矢量空间模型的文本自动分类系统研究	计算机系统应用	2005	2005年03期	【作者】 包剑 ； 冀常鹏 ； 李义杰 ； 【机构】 辽宁工程技术大学电子与信息工程系 ； 辽宁工程技术大学电子与信息工程系 123000 ； 123000 ； 123000 ；	矢量空间模型 ； 文本自动分类 ； 特征抽取 ；	随着互联网及其信息服务的快速增长,对于网络信息资源的获取越来越重要,而面向Web的文本挖掘技术的发展及应用对于解决这一问题将会起到极其重要的影响。通过分析文本自动分类的关键理论及技术,给出基于矢量空间模型的文本自动分类系统的执行过程,给出了系统的实现算法,提高了系统的精度和效率。	2005年03期_基于矢量空间模型的文本自动分类系统研究.pdf	http://sso.cdclib.org/interlibSSO/goto/6/=06190596Z93/kcms/detail/detail.aspx?dbCode=cjfq&filename=XTYY200503013&dbname=CJFD0305
DAO模式在EJB中的应用	计算机系统应用	2005	2005年03期	【作者】 张文东 ； 侯飞 ； 潘琪 ； 周宏 ； 【机构】 东营石油大学(华东)计算机与通信工程学院 ； 东营胜利石油管理局 ； 东营胜利石油管理局 257061 ； 257061 ； 257061 ；	EJB ； DAO模式 ； Fast-LaneReader模式 ；	本文介绍了EJB技术、DAO模式和Fast-LaneReader模式,同时结合事例给出一种在EJB体系结构中采用经过Fast-LaneReader模式优化的DAO模式进行图像数据存取的方法。	2005年03期_DAO模式在EJB中的应用.pdf	http://sso.cdclib.org/interlibSSO/goto/6/=06190596Z93/kcms/detail/detail.aspx?dbCode=cjfq&filename=XTYY200503014&dbname=CJFD0305
JAVA内部类分析与应用研究	计算机系统应用	2005	2005年03期	【作者】 浦云明 ； 【机构】 厦门集美大学 361021 ；	JAVA ； 内部类 ； 包含类 ；	本文分析了JAVA内部类,内部类的存储分配机制,说明了程序设计中如何巧妙地应用JAVA的各种内部类,内部类的应用可以简化程序设计,保证程序代码的清晰明了,提高程序运行效率。	2005年03期_JAVA内部类分析与应用研究.pdf	http://sso.cdclib.org/interlibSSO/goto/6/=06190596Z93/kcms/detail/detail.aspx?dbCode=cjfq&filename=XTYY200503015&dbname=CJFD0305
多针绗缝机控制系统的设计与实现	计算机系统应用	2005	2005年03期	【作者】 刘伟 ； 曲文元 ； 秦勃 ； 【机构】 中国海洋大学计算机科学系 ； 中国海洋大学计算机科学系 266071 ； 266071 ； 266071 ；	插补运动 ； 控制系统 ； 模糊控制器 ；	本文介绍了多针绗缝机控制系统的设计与实现,从软件角度详细介绍了控制模块从设计到实现的全过程,并且对其在设计中遇到的问题给出了具体的解决方法。	2005年03期_多针绗缝机控制系统的设计与实现.pdf	http://sso.cdclib.org/interlibSSO/goto/6/=06190596Z93/kcms/detail/detail.aspx?dbCode=cjfq&filename=XTYY200503016&dbname=CJFD0305
基于WebGIS的输油管线选线决策支持系统研究	计算机系统应用	2005	2005年03期	【作者】 王帅 ； 周庆忠 ； 【机构】 重庆后勤工程学院 ； 重庆后勤工程学院 400016 ； 400016 ；	野战输油管线 ； 选线优化 ； WebGIS ；	本文通过运用WebGIS技术实现了野战输油管线地理信息的快速采集与处理,并在其空间分析的基础上,在DSS(Decision Support Systems)模型库中建立选线决策动态规划模型,快速得出铺设野战输油管线的最佳路线,从而实现了野战输油管线选线决策的智能化,对野战管线部队的信息化建设具有积极的意义。	2005年03期_基于WebGIS的输油管线选线决策支持系统研究.pdf	http://sso.cdclib.org/interlibSSO/goto/6/=06190596Z93/kcms/detail/detail.aspx?dbCode=cjfq&filename=XTYY200503017&dbname=CJFD0305
利用SQLXML调用存储过程的方法	计算机系统应用	2005	2005年03期	【作者】 蔡瑞奎 ； 【机构】 广东商学院教育技术中心 广州510320 ；	SQLXML ； 存储过程 ； HTTP ；	本文利用SQLXML 3.0,通过对数据库存储过程的调用,达到对数据按XML方式处理的目的,对数据转换很有用处。利用查询的存储过程,演示以HTTP方式按XML格式输出SQL数据库数据的方法。该方法为提升SQLsenver 2000对XML数据文件的处理能力有很好效果。	2005年03期_利用SQLXML调用存储过程的方法.pdf	http://sso.cdclib.org/interlibSSO/goto/6/=06190596Z93/kcms/detail/detail.aspx?dbCode=cjfq&filename=XTYY200503018&dbname=CJFD0305
