title	journal_name	year	issue	author	keywords	summary	pdf_filename	article_url
新产品	计算机系统应用	1997	1997年04期		会议电视 ； 会议系统 ； 主摄像机 ； 网管员 ； 自动柜员机 ； 最佳平台 ； 数据传送 ； Lunar ； 家用电脑 ； 蜂窝系统 ；	CLI推出各新会议电视系换－LunarCLI推出下一代会议系统Lunar，可接入Internet，具有PC功能和会议电视功能；新的会议系统将会议设备和软件结合在同一设备中，使用单一界面和简单的触摸控制。97年2月，美国视讯公司（CLI）宣布推出新的产品系列一Lunr，Lunar是专为满足会议要求而设计的经济易用的新～代会议系统。为用户提供使用同一界面召开本地或远地会议的全套设备和软件。Lunar使用H．320‘T．120国际标准将图像、声音和数据传送到所有会议和地点。T．120数据共享功能由简单的单键操作即可完成。Lunar通过T．120兼容的DataBeamFarsite软件为不同地点提供共	1997年04期_新产品.pdf	http://sso.cdclib.org/interlibSSO/goto/6/=06190596Z93/kcms/detail/detail.aspx?dbCode=cjfq&filename=XTYY199704024&dbname=CJFD9498
编辑前言	计算机系统应用	1997	1997年03期		管理信息系统 ； 系统集成技术 ； 人一机系统 ； 校园信息系统 ； 支持系统 ； 总体设计 ； 面向对象 ； 计算机软件 ； 支撑环境 ； 技术系统 ；	本期的“系统建设”栏目收集了四篇有关管理信息系统建设方法和总体设计等方面的文章，组成一个专栏。管理信息系统是一个社会一技术系统，它涉及到多种科学技术领域，如管理科学、系统科学、专业系统技术、计算机技术、信息技术、系统集成技术等等。因此设计、实现这个系统的难度是很大的，没有多方面专业人才的通力合作，没有企事业单位领导的大力支持和强有力的领导，是很难实现的。管理信息系统也是一个人一机系统，这个系统是用现代的计算机与信息技术建立一个支持系统，辅助各级管理人员进行管理活动。因此，人是这个系统中最重要的因素，没有管理人员的积极参加设计和使用，系统是无法发挥作用的。因此在系统设计和实施中必须充分考虑工作人	1997年03期_编辑前言.pdf	http://sso.cdclib.org/interlibSSO/goto/6/=06190596Z93/kcms/detail/detail.aspx?dbCode=cjfq&filename=XTYY199703000&dbname=CJFD9498
校园信息系统的规划、建立与管理	计算机系统应用	1997	1997年03期	【作者】 陈庆章 ； 【机构】 浙江工业大学信息工程学院!310014 ；	校园信息系统 ； 校园网络 ； 系统分析 ； 系统管理 ；	本文主要是探讨建立在大学校园网络之上的校园信息系统，应如何选择、规划、建立和管理。	1997年03期_校园信息系统的规划、建立与管理.pdf	http://sso.cdclib.org/interlibSSO/goto/6/=06190596Z93/kcms/detail/detail.aspx?dbCode=cjfq&filename=XTYY199703001&dbname=CJFD9498
谈人的因素对高校MIS建设的影响	计算机系统应用	1997	1997年03期	【作者】 景晓瑜 ； 【机构】 北京语言文化大学教育管理信息中心 ；	MIS（管理信息系统） ； 人机关系 ；	本文围绕高校MIS建设问题，分析并论证了高校与该项工作相关的各类人员在MIS建设中的位置和作用以及对MIS建设所产生的影响。本文着重强调不要忽略诸多重要的社会因素，而只把MIS建设看成是一个单纯的技术问题。	1997年03期_谈人的因素对高校MIS建设的影响.pdf	http://sso.cdclib.org/interlibSSO/goto/6/=06190596Z93/kcms/detail/detail.aspx?dbCode=cjfq&filename=XTYY199703002&dbname=CJFD9498
综合性企业信息系统	计算机系统应用	1997	1997年03期	【作者】 党齐民 ； 杨新发 ； 【机构】 西安石油学院计算机系!710061 ； 西安理工大学计算中心!710048 ；	Client／Server结构 ； 数据仓库 ； 企业信息处理系统 ；	本文介绍了基于Client／Server结构综合企业信息系统的构成、主要功能以及涉及到的有关技术和方法。	1997年03期_综合性企业信息系统.pdf	http://sso.cdclib.org/interlibSSO/goto/6/=06190596Z93/kcms/detail/detail.aspx?dbCode=cjfq&filename=XTYY199703003&dbname=CJFD9498
面向对象系统分析方法的研究	计算机系统应用	1997	1997年03期	【作者】 刘培玉 ； 刘法胜 ； 张家重 ； 潘建平 ； 【机构】 山东师范大学计算机科学系!250014 ；	系统分析 ； 面向对象 ； 层次模型 ； 静态模型 ； 动态模型 ； 一致性 ；	本文首先给出了一种用于信息建模的层次式面向对象的系统分析模型，包括静态模型和动态模型，其次还对论了需求分析模型的正确性及一致性问题。利用这种层次方法建立的需求分析模型，易于理解和维护，又便于图形描述，因而，支．持需求分析建模的辅助软件工具也易于开发实现。	1997年03期_面向对象系统分析方法的研究.pdf	http://sso.cdclib.org/interlibSSO/goto/6/=06190596Z93/kcms/detail/detail.aspx?dbCode=cjfq&filename=XTYY199703004&dbname=CJFD9498
Internet防火墙和服务质量	计算机系统应用	1997	1997年03期	【作者】 何刚 ； 吴志美 ； 【机构】 中国科学院软件研究所!100080 ；	Internet ； Intranet ； 防火墙 ； 服务质量 ；	如何防止用户私有数据被窃取，如何防止非法用户入侵，是Internet用户很关心的问题。本文简单介绍了Internet信息安全的一些概念，并介绍防火墙和服务质量的概念。最后阐述了一个PC机网关防火墙系统的实现。	1997年03期_Internet防火墙和服务质量.pdf	http://sso.cdclib.org/interlibSSO/goto/6/=06190596Z93/kcms/detail/detail.aspx?dbCode=cjfq&filename=XTYY199703005&dbname=CJFD9498
网络安全与防火墙	计算机系统应用	1997	1997年03期	【作者】 杨槟 ； 【机构】 清华大学计算机系!100084 ；	网络安全 ； 防火墙产品 ； Firewall ； 包过滤技术 ； 身份验证 ； 过滤规则 ； 应用代理 ； Encryption ； 网络系统安全 ； 地址变换 ；	Internet以及Intranet的飞速发展，使得计算机网络一夜之间成了人们关心的热点。计算机网络给人们带来了巨大的利益。通信的手段不再只是电话，传真，而增加了更快捷和便宜的E—mail，EDI系统给网上贸易提供了可能。网络给人们带来了并即将带来更多的娱乐手段，人们通过网络看报纸杂志交友聊天，获取大量信息，而花费不多。通过网络召开电视会议，看电影听音乐…。所有这一切的发展正在并即将给人们的生活带来巨大的变化，人们处在一种惊喜之中。然而这惊喜的背后，也有一些担忧。当人们通过计算机定货或拨出一大笔款项时，当人们打开自己的Web站点向世人展示时，当那些军事机要部门通过网络传递消息时，他们不免有些战	1997年03期_网络安全与防火墙.pdf	http://sso.cdclib.org/interlibSSO/goto/6/=06190596Z93/kcms/detail/detail.aspx?dbCode=cjfq&filename=XTYY199703006&dbname=CJFD9498
飞行器总体测控系统的网络通信	计算机系统应用	1997	1997年03期	【作者】 傅长冬 ； 潘清 ； 王勇 ； 【机构】 国防科工委指挥技术学院!101407 ；	网络通信 ； TCP／IP协议 ； 客户／服务器 ；	飞行器总体测控系统是基于网络通信的分布式测控系统。本文具体介绍总控系统的工作环境，实现网络通信的设计方案，着重介绍系统的进程关系及连接控制等关键技术。	1997年03期_飞行器总体测控系统的网络通信.pdf	http://sso.cdclib.org/interlibSSO/goto/6/=06190596Z93/kcms/detail/detail.aspx?dbCode=cjfq&filename=XTYY199703007&dbname=CJFD9498
NOVELL网软件环境的设置	计算机系统应用	1997	1997年03期	【作者】 章强 ； 【机构】 扬州职业大学!225200 ；	NOVELL网络 ； 用户组 ； 登录原稿 ； 自动登录 ；	本文从一个系统管理员的角度介绍了目前使用广泛的NOVELL网络的软件环境的设置，对用户、用户组和系统登录原稿这两个最为关键的问题进行了深入的讨论，并给出应用实例，同时对设置中易碰到的两个常见困难进行了探讨。	1997年03期_NOVELL网软件环境的设置.pdf	http://sso.cdclib.org/interlibSSO/goto/6/=06190596Z93/kcms/detail/detail.aspx?dbCode=cjfq&filename=XTYY199703008&dbname=CJFD9498
基于系统软件资源的应用软件功能集成策略	计算机系统应用	1997	1997年03期	【作者】 卜淮原 ； 胡曙 ； 【机构】 重庆后勤工程学院!630041 ；	软件集成 ； 软件工程 ； 系统资源 ；	本文围绕开发微机应用软件系统的工程组织问题，从操作系统的角度对应用软件的功能集成机理进行了分析，提出了“面向对象+模块化+系统软件融合调度”的软件工程组织策略。该策略强调系统分析以功能为划分对象的依据，并将其开发为可独立运行的模块，系统集成和功能调度以系统软件底层资源的基础，是一种可操作性和买用性较强，先进、可靠、易维护、易扩充的应用软件开发方法。	1997年03期_基于系统软件资源的应用软件功能集成策略.pdf	http://sso.cdclib.org/interlibSSO/goto/6/=06190596Z93/kcms/detail/detail.aspx?dbCode=cjfq&filename=XTYY199703009&dbname=CJFD9498
在VB下开发Windows Help的方法	计算机系统应用	1997	1997年03期	【作者】 郑沛 ； 【机构】 北京航空航天大学计算机系!100083 ；	字串 ； VisualBasic ； 应用软件 ； VB ； Windows Help ； 命令按钮 ； 属性设置 ； 窗体 ； 帮助信息 ； 应用程序 ；	作为Windows操作系统的一个突出优点，其应用程序强大的联机帮助系统使广大用户受益匪浅。评价应用软件的质量，一个主要的标准就是看软件的Help系统是否完善。利用VisualBasic，可以方便地建立Windows下应用软件的Help系统，主要分为以下5步：门）由Help作者规划软件的Help系统，确定Help将提供的信息内容。（2）由Help作者利用编辑器编写Help标题文件，并加入特定的编码信息。这个文件是Help系统的主体，文件中还包括一些控制代码，它们将决定用户如何在Help中移动。（3）由程序员根据Help标题文件建立Help工程文件（。HPJ），并利用VB专业版的HelpCOmpi	1997年03期_在VB下开发Windows+Help的方法.pdf	http://sso.cdclib.org/interlibSSO/goto/6/=06190596Z93/kcms/detail/detail.aspx?dbCode=cjfq&filename=XTYY199703010&dbname=CJFD9498
利用Delphi开发C/S型的数据库应用程序	计算机系统应用	1997	1997年03期	【作者】 赵云升 ； 李治柱 ； 【机构】 上海交通大学计算机系!200030 ；	Client／Server ； Delphi ； BDE ； ODBC ；	本文介绍了Delphi的数据库结构、访问SQL数据库服务器的SQLLinks和ODBC两种方法、Delphi中多用户环境下的控制以及分发数据库应用程序的实现。	1997年03期_利用Delphi开发C+S型的数据库应用程序.pdf	http://sso.cdclib.org/interlibSSO/goto/6/=06190596Z93/kcms/detail/detail.aspx?dbCode=cjfq&filename=XTYY199703011&dbname=CJFD9498
执行逻辑独立于打印控制的FOMP设施	计算机系统应用	1997	1997年03期	【作者】 宋传杰 ； 霍杰 ； 姚念馥 ； 王有强 ； 【机构】 山东省农业银行电脑部!250001 ；	报表打印 ； 格式 ； 格式覆盖 ； 映射 ；	本文实现了一种报表，特别是复杂报表打印的Forms－Overlay－Map－Print设施，从而基本实现了应用程序的执行逻辑独立子报表打印控制过程。	1997年03期_执行逻辑独立于打印控制的FOMP设施.pdf	http://sso.cdclib.org/interlibSSO/goto/6/=06190596Z93/kcms/detail/detail.aspx?dbCode=cjfq&filename=XTYY199703012&dbname=CJFD9498
江西省公交管理信息网络系统	计算机系统应用	1997	1997年03期	【作者】 傅晓强 ； 蒋雅辉 ；	信息网络系统 ； 公交管理 ； 网络操作系统 ； 应用软件 ； 数据流图 ； 数据库语言 ； 管理功能 ； 单机操作 ； 管理系统软件 ； 系统文档 ；	1、系统开发原则及策略道路交通管理，这是一项涉面广泛、内容复杂繁多的综合管理工作，从现代交通管理角度来定义也可以说是一项系统工程。因此如何把握全局，抓住关键，科学规划就成为整个项目成功与否的重要支点和基础。为此，我们进行了卓有成效的调查研究，在取得大量资料和国内外有关信息之后，确定了开发的初步原则为“自上而下、自下而上、先软件后硬件、先局域、后广域”以达到科学开发，满足需求，技术先进的目标。2．系统功能与要求（1）各地市级局域网络，各终端机不联网时能单机操作完成证卡的录入检索、统计表、查询、修改、打印等功能；联网时能在本局域网内相互之间进行通信、调用、检索、查询、修改、打印等，数据文件信息共享	1997年03期_江西省公交管理信息网络系统.pdf	http://sso.cdclib.org/interlibSSO/goto/6/=06190596Z93/kcms/detail/detail.aspx?dbCode=cjfq&filename=XTYY199703013&dbname=CJFD9498
多媒体沙盘演播系统	计算机系统应用	1997	1997年03期	【作者】 田波 ； 【机构】 上海交通大学计算机系!200030 ；	控制码 ； 面向对象方法 ； 多媒体数据库 ； 查询管理 ； 体系结构 ； 多媒体控制 ； 应用程序 ； 媒体化 ； 关系数据库 ； 软件结构 ；	一、引言多媒体的出现给计算机的应用注入了新的活力，如果将多媒体、通信、控制和数据库技术结合起来，应用于沙盘演播系统，使得人们不但可以从计算机（或电视）屏幕上得到和录像一样的视觉效果，还可以通过数据库技术随机查询自己想知道的内容并演播出来。另外通过控制技术控制埋设在沙盘上的发光管线的显示，标识出地域、河流、中心点、建筑物等重要部位，大大加深了人们的印象。“三北防护林体系工程演播系统”就是在以上的想法指导下建成的多媒体控制的沙盘演播系统。下面分成问题描述、体系结构（软／硬件）、演播数据库的多媒体化、通信控制机制的实现等几个部分介绍这个演播系统的实现。二、问题描述“三北防护林体系工程演播系统”是一个	1997年03期_多媒体沙盘演播系统.pdf	http://sso.cdclib.org/interlibSSO/goto/6/=06190596Z93/kcms/detail/detail.aspx?dbCode=cjfq&filename=XTYY199703014&dbname=CJFD9498
银行综合网络的设计与实现	计算机系统应用	1997	1997年03期	【作者】 潘渊 ； 冯颖 ； 刘军 ； 【机构】 交通银行广州分行电脑部 ；	综合网络 ； 广域网络 ； 网络管理软件 ； 网络层 ； 主机系统 ； 网段 ； 子网 ； 全电子化 ； 金融网点 ； 综合查询 ；	一、现状交通银行广州分行是交通银行的十二个管辖行之一，担负着对广东、福建二省的交行业务的管理及本行业务的自营工作，随着我国金融改革的深入，其业务的发展也得到了进一步的加强，业务网点不断地增多。目前，广州交行的各主要业务（会计、储蓄、外汇、事后）虽已实现了电子化，但在下一步的业务发展中有大量的共享数据，却分别由各自主管部门处理。由于各业务系统的彼此孤立，分行对业务管理部门的信息传输和采集还未完全电子化和自动化，使得决策缓慢、不准确。加之，各部门之间缺乏数据资源共享及综合信息查询的概念，造成信息管理混乱、信息流通及交换不方便，效率低。在区域上，广州分行下属管理中山、佛山、福州等分行，也有大量的业务	1997年03期_银行综合网络的设计与实现.pdf	http://sso.cdclib.org/interlibSSO/goto/6/=06190596Z93/kcms/detail/detail.aspx?dbCode=cjfq&filename=XTYY199703015&dbname=CJFD9498
多媒体仪器模拟系统的设计与实现	计算机系统应用	1997	1997年03期	【作者】 李宏 ； 王茸 ；	模拟系统 ； 多媒体技术 ； 设计过程 ； 软件开发环境 ； 数字存储示波器 ； 在线帮助 ； 软件运行环境 ； 主菜单 ； 教学效果 ； 图像处理 ；	购买现代先进仪器大都需要花费大量财力物力，大批购置就更不可能了，如果仅仅是学习使用它们，这样做是很不实际的。本文讲述了运用多媒体技术进行仪器模拟的方法，很好解决了这个问题，在实际应用中收到了满意的效果。	1997年03期_多媒体仪器模拟系统的设计与实现.pdf	http://sso.cdclib.org/interlibSSO/goto/6/=06190596Z93/kcms/detail/detail.aspx?dbCode=cjfq&filename=XTYY199703016&dbname=CJFD9498
应用是成功之本──介绍福建建行商业银行综合业务系统	计算机系统应用	1997	1997年03期		综合业务系统 ； 清算中心 ； 对公 ； 特约商户 ； 清算系统 ； 卡人 ； 资金清算 ； 支付系统 ； 业务子系统 ； 客户资金 ；	一、概况福建省建设银行的商业银行综合业务系统是一个典型的应用系统成功实例。此系统是福建建行与北京宇博公司在一年多的时间内，投入很大精力共同研制成功的。该系统最大的特点是把涉及银行内外各项业务的7个子系统集成在一起，跨地市联机联网，由交换清算中心统一资金转发，可方便地实现任一范围内的联网和业务种类的扩展；避免了目前国内银行系统普遍存在的各项业务子系统互相分割的状况，使该系统处于目前国内的领先地位。目前，综合业务系统的应用在福州、泉州、龙岩、漳州、南平、三明、莆田等7地市已全面展开，对公会计通存通兑，储蓄通存通兑，信用卡联网系统，ATM联网系统，清算中心系统，管理信息系统及电子钱包系统在7地市业务	1997年03期_应用是成功之本──介绍福建建行商业银行综合业务系统.pdf	http://sso.cdclib.org/interlibSSO/goto/6/=06190596Z93/kcms/detail/detail.aspx?dbCode=cjfq&filename=XTYY199703017&dbname=CJFD9498
AS/400上的Java问答	计算机系统应用	1997	1997年03期	【作者】 PaulConte ； 张昆 ；	应用开发工具 ； 用户界面 ； 编程语言 ； 类库 ； AS/400 ； Java ； 存储过程 ； 机器指令 ； 动态执行 ； 开发环境 ；	Java的确切含文是什么？Java对AS／400编程有什么影响？IBM多伦多实验室负责开发VisualAge的关键人物PhilCotilthard先生在谈及这一热门新语言以及IBM在AS／400上支持Java计划和即将出台的可用于Java开发环境下的VisualAge之话题时，就用户提出的一些问题做了如下回答。问：Java的设计适合于一般的商业编程，同时它也适合做系统和WebPage的编程吗？答：是的。C和C＋十多年来一直没有脱离开做为一种商业编程语言。SUN已经开始着手解决由于简化了语言描述的标头问题，以便C和C＋十更好地用于商业编程语言。问：Java中为什么会有这么多令人激动的东西？答：J	1997年03期_AS+400上的Java问答.pdf	http://sso.cdclib.org/interlibSSO/goto/6/=06190596Z93/kcms/detail/detail.aspx?dbCode=cjfq&filename=XTYY199703018&dbname=CJFD9498
AS/400支持Internet	计算机系统应用	1997	1997年03期	【作者】 夏地 ； 【机构】 IBM公司 ；	文件服务器 ； 登录界面 ； 终端用户 ； 数据库服务 ； AS/400 ； Internet ； 通信软件 ； 服务器技术 ； 集成文件 ； 服务器体系结构 ；	有没有一种工具能帮助用户建立自己的Intranet，而且既不需要在PC上安装界面转换程序，也不需要特别的APPC通信软件就能在Windows、Machintosh或UNIX平台上顺利运行您的应用程序，这种工具将帮助您跨越不同平台的障碍，以最小的投资获得最大程度上的信息共享，这种工具就是OS／4003版本里的InternetConnec－tionFORAS／400oInternet乙nnectionFORAS／400（简称IO400）包含一个WWW服务器，一个5250ygHTML转换器和一个HTML数据库工具，无论是基于CISC技术还是POW－ERPC技术的AS／400都可立即运行IC／400。	1997年03期_AS+400支持Internet.pdf	http://sso.cdclib.org/interlibSSO/goto/6/=06190596Z93/kcms/detail/detail.aspx?dbCode=cjfq&filename=XTYY199703019&dbname=CJFD9498
AS/400在Internet上的安全性──如何在Internet上保护您的AS/400免遭非法“入侵”	计算机系统应用	1997	1997年03期	【作者】 高热东 ； 【机构】 IBM公司 ；	AS/400 ； Internet ； 主机系统 ； 系统安全 ； 防火墙软件 ； Telnet ； 防火墙功能 ； 破坏系统 ； 保安措施 ； 信息传输 ；	在信息高速发展的今天，从Internet上可以获得许多有价值的信息。因此很多人都对Internet特别感兴趣。由此而产生的是许多人不顾一切的通过lute。t访问您的系统，而并不考虑其是否被授权，以及对您的系统是否有足够的了解等，就擅自进行操作。当然有的在很大程度上是出于好奇，或者无知。但对您的系统会构成威胁，所以您需要在系统安全方面保持警惕。以前Internet上的主机大多是Unix，PC或Macin－tosh等平台的产品，现在AS／400也可做为Internet的主机，通过网络连到全球的Internet网络上。用户可以通过网络或PPP协议或SLIP方式连接访问到全球的Internet网络上，	1997年03期_AS+400在Internet上的安全性──如何在Internet上保护您的AS+400免遭非法“入侵”.pdf	http://sso.cdclib.org/interlibSSO/goto/6/=06190596Z93/kcms/detail/detail.aspx?dbCode=cjfq&filename=XTYY199703020&dbname=CJFD9498
FoxPro GET字段对象控制	计算机系统应用	1997	1997年03期	【作者】 梁翎 ； 【机构】 中科院兰州文献情报中心!730000 ；	FoxPro ； 对象控制 ； 单选钮 ； 文本编辑 ； 复选框 ； EDIT ； 屏幕设计 ； 下拉菜单 ； 热键 ； 滚动条 ；	在FoxPro屏幕设计中，为了使屏幕显示符合通常使用习惯，经常需要使用各种控制、按钮等。FoxPro提供的这类控制包括复选框、隐藏按钮、列表、下拉菜单、压入按钮、单选钮、数码器以及文本编辑区域。大多数控制用不同形式的＠．．GET建立。文本编辑区域用＠…EDIT建立。发出READ或READCYCLE激活各种控制。以下说明每个FOxPro控制及其使用。豆．复选框在FOxProforMS－DOS屏幕上，复选框是一对方括号，右边为一串文字，提示复选框控制什么。例如：［X］TaxExempt。在FOxProforWindows屏幕上，复选框是一个方框，右边是一个带热键（下划线字母）的说明文字。例如：回T	1997年03期_FoxPro+GET字段对象控制.pdf	http://sso.cdclib.org/interlibSSO/goto/6/=06190596Z93/kcms/detail/detail.aspx?dbCode=cjfq&filename=XTYY199703021&dbname=CJFD9498
数据库结构描述文件的几种特殊用途	计算机系统应用	1997	1997年03期	【作者】 李政 ； 【机构】 吉林四平师范学院计算机系!136000 ；	数据库结构 ； 描述文件 ； 功能模块 ； 软件开发效率 ； 数据库应用系统 ； 结构描述 ； 查询条件 ； 段名 ； 应用软件 ； 教学工作量 ；	大家知道，在FORPRO、FoXBASE中，对于任意一个打开的数据库（源库），可用COPYTO＜文件名＞STRUCTUREEXTENDED建立一个对应的结构描述文件。结构描述文件也是数据库，它含有四个字段：FIELD－NAME、FIELThTYPE。LIELD－LEN、FIELD－DEC，分别用于存放源库字段名、字段类型、字段宽度和小数位位数，每一条记录对应于源库的一个字段。利用结构描述文件可建立一个新数据库的结构，命令为：CREATE＜库名＞FROM＜结构描述文件名＞我们注意到：①数据库的结构与结构描述文件可以互相转换；②数据库的每一个字段的信息对应于结构描述文件的一条记录，结构描述文件把源	1997年03期_数据库结构描述文件的几种特殊用途.pdf	http://sso.cdclib.org/interlibSSO/goto/6/=06190596Z93/kcms/detail/detail.aspx?dbCode=cjfq&filename=XTYY199703022&dbname=CJFD9498
一种实现FOX数据库查询条件任意生成的方法	计算机系统应用	1997	1997年03期	【作者】 崔振杰 ； 【机构】 中国人民银行商丘分行!476000 ；	数据库查询 ； FOX ； 组合查询 ； 关系符 ； 用户界面 ； 信息管理系统 ； 设备管理 ； 应用系统 ； 查询表达式 ； 逻辑组合 ；	1．问题的提出目前，在国内有大量采用FOXBASE或FOXPRO编制的各类信息管理系统。在系统中不可避免地要向用户提供查询功能，对某些固定的查询，可预先设计，如输入各种关键字进行查询，如人事档案管理中的人员编码，设备管理中的设备编码等，这类查询具有唯一性。另一类是某些字段的取值具有可枚举性，如性别、职称、学历、职务等，对这类查询可以设计较好的用户界面满足查询需要。而对多字段不固定的组合条件查询，设计者且难以满足用户的需要，因为对多字段的组合查询，各字段间的逻辑组合将是十分庞大的，要在系统设计时逐项满足是不可能的，因此，大多数设计者往往让用户输入组合查询条件，而要做到这一点，用户必须对要查询的库	1997年03期_一种实现FOX数据库查询条件任意生成的方法.pdf	http://sso.cdclib.org/interlibSSO/goto/6/=06190596Z93/kcms/detail/detail.aspx?dbCode=cjfq&filename=XTYY199703023&dbname=CJFD9498
