title	journal_name	year	issue	author	keywords	summary	pdf_filename	article_url
基于GAE云计算的区域移动医疗服务平台	计算机系统应用	2013	2013年06期	【作者】 吕美丹 ； 祝锡永 ； 傅慧 ； 陆忠芳 ； 【Author】       LV Mei-Dan,ZHU Xi-Yong,FU Hui,LU Zhong-Fang(Department of Management Sciences and Engineering,Zhejiang Sci-Tech University,Hangzhou 310018,China) 【机构】 浙江理工大学管理科学与工程系 ；	移动医疗 ； 云计算 ； Google App Engine ； Android ； mobile health ； cloud computing ； Google App Engine ； Android ；	针对医疗信息化与互联网应用现状,提出面向区域移动医疗网络服务平台概念.在分析移动医疗及其发展现状、云计算及其关键技术和Android平台应用开发模式的基础上,首先提出基于云计算的移动医疗服务平台整体架构,并分别从信息资源提供层、云计算平台层、医疗服务层和移动应用层等四个方面进行阐述;然后在研究GoogleApp Engine云服务平台的基础上,对基于GAE的移动医疗服务平台的服务器端与客户端技术、数据模型等关键技术进行详细描述;最后给出基于GAE的移动医疗服务平台的系统实现,分别从平台服务器端和移动客户端两方面进行描述,其中客户端实现基于Android移动操作系统,为普通用户提供专家门诊信息、医药用品信息及其他功能.	2013年06期_基于GAE云计算的区域移动医疗服务平台.pdf	http://sso.cdclib.org/interlibSSO/goto/6/=06190596Z93/kcms/detail/detail.aspx?dbCode=cjfq&filename=XTYY201306006&dbname=CJFDLAST2013
物联网ZigBee网关的设计与实现	计算机系统应用	2013	2013年06期	【作者】 张艺粟 ； 李鸿彬 ； 贾军营 ； 于波 ； 【Author】       ZHANG Yi-Su1,2,LI Hong-Bin2,JIA Jun-Ying2,YU Bo2 1(University of Chinese Academy of Sciences,Beijing 100049,China) 2(Shenyang Institute of Computing Technology,Chinese Academy of Sciences,Shenyang 110171,China) 【机构】 中国科学院大学 ； 中国科学院沈阳计算技术研究所 ；	网关 ； ZigBee ； 物联网 ； TCP/IP ； 嵌入式Linux ； gateway ； ZigBee ； Internet of Things ； TCP/IP ； embedded Linux ；	物联网中应用广泛的ZigBee协议与传统的TCP/IP协议并不兼容,如何实现两种异构网络的融合是物联网的关键技术所在.对物联网网关的需求进行了分析,并基于CC2530开发套件、龙芯1B开发板、Zstack协议栈和嵌入式linux系统,设计并实现了一个物联网ZigBee网关的原型系统,完成了ZigBee网络的管理、协议转换、数据收发等功能,并通过实验对各部分功能进行了验证.	2013年06期_物联网ZigBee网关的设计与实现.pdf	http://sso.cdclib.org/interlibSSO/goto/6/=06190596Z93/kcms/detail/detail.aspx?dbCode=cjfq&filename=XTYY201306007&dbname=CJFDLAST2013
协同办公系统在企业中的设计与应用	计算机系统应用	2013	2013年06期	【作者】 曹义新 ； 【Author】       CAO Yi-Xin(Hefei General Machinery Research Institute,Hefei 230031,China) 【机构】 合肥通用机械研究院 ；	协同办公 ； 业务流程管理 ； 办公自动化软件 ； Weaver协同办公系统 ； coordination working ； business process management ； office automation software ； Weaver coordination working system ；	协同办公是现代企业管理模式的高级阶段,研究人员从典型协同办公系统在企业中的技术路线规划和系统搭建入手,对企业现有的业务流程管理进行优化和电子化,在分段应用的基础上逐步提高协同办公系统在企业中的应用水平,最后给出详细分析和应用展望.	2013年06期_协同办公系统在企业中的设计与应用.pdf	http://sso.cdclib.org/interlibSSO/goto/6/=06190596Z93/kcms/detail/detail.aspx?dbCode=cjfq&filename=XTYY201306008&dbname=CJFDLAST2013
高铁沿线GSM-R电磁环境实时检测系统	计算机系统应用	2013	2013年06期	【作者】 刘宏志 ； 刘卓 ； 【Author】       LIU Hong-Zhi,LIU Zhuo(Department of Computer & Information Engineering,Beijing Technology and Business University,Beijing 100048,China) 【机构】 北京工商大学计算机与信息工程学院 ；	GSM-R ； 电磁环境 ； 检测系统 ； 数据采集 ； 数据处理 ； GSM-R ； electromagnetic environment ； test system ； data acquisition ； data processing ；	为了适应高速铁路工程测试的实际需要,提出了高铁沿线GSM-R电磁环境实时检测系统的设计方案.该系统使用ESPI、GPS等仪器,通过控制技术实现了对GSM-R电磁环境数据实时、连续地采集,并对测试数据进行筛选处理,最终实现了对被测路段GSM-R电磁环境数据的曲线显示及质量评价.	2013年06期_高铁沿线GSM-R电磁环境实时检测系统.pdf	http://sso.cdclib.org/interlibSSO/goto/6/=06190596Z93/kcms/detail/detail.aspx?dbCode=cjfq&filename=XTYY201306009&dbname=CJFDLAST2013
基于BAC的业务探测系统	计算机系统应用	2013	2013年06期	【作者】 李伟镰 ； 【Author】       LI Wei-Lian(Business Support Monitoring Center,China Mobile(Shenzhen) Limited,Shenzhen 518048,China) 【机构】 中国移动(深圳)有限公司支撑网监控中心 ；	业务可用性 ； 业务探测 ； 业务可用性中心 ； BPM ； BOSS ； LoadRunner ； J2EE ； business availability ； business monitoring ； BAC ； BPM ； BOSS ； LoadRunner ； J2EE ；	探讨了建立业务探测系统的必要性,介绍了业务探测的相关技术,提出了系统的探测方案,根据方案设计了系统的总体架构,并运用多种技术实现了该系统.该系统为提升业务支撑系统的客户感知,提升系统的满意度从而提高电信业务支撑运营管理水平提供了有力的保障.	2013年06期_基于BAC的业务探测系统.pdf	http://sso.cdclib.org/interlibSSO/goto/6/=06190596Z93/kcms/detail/detail.aspx?dbCode=cjfq&filename=XTYY201306010&dbname=CJFDLAST2013
基于物联网的水产养殖水质实时监测系统	计算机系统应用	2013	2013年06期	【作者】 曾宝国 ； 刘美岑 ； 【Author】       ZENG Bao-Guo,LIU Mei-Cen(Sichuan Information Technology College,Guangyuan 628017,China) 【机构】 四川信息职业技术学院 ；	水产养殖 ； 水质监测 ； ZigBee ； GPRS ； aquaculture ； the water quality monitoring ； ZigBee ； GPRS ；	为了实现水产养殖水质的实时监测和信息化管控,以ZigBee、GPRS、智能水质监测传感器等物联网核心技术为手段,设计了一套水产养殖水质实时监测系统,能实时采集水产养殖用水的水位、溶解氧、PH值、温度、视频等参数,并进行分析、展示和反馈控制,从而解决了水产养殖业水质实时监测和管理问题.	2013年06期_基于物联网的水产养殖水质实时监测系统.pdf	http://sso.cdclib.org/interlibSSO/goto/6/=06190596Z93/kcms/detail/detail.aspx?dbCode=cjfq&filename=XTYY201306011&dbname=CJFDLAST2013
基于TFT彩屏的便携式智能车手持调试平台	计算机系统应用	2013	2013年06期	【作者】 蓝晓柯 ； 陈朋 ； 【Author】       LAN Xiao-Ke,CHEN Peng(College of Information Engineering,Zhejiang University of Technology,Hangzhou 310023,China) 【机构】 浙江工业大学信息工程学院 ；	MC9S12XS128 ； TFT彩屏液晶 ； 智能车调试 ； 人机交互界面 ； MC9S12XS128 ； TFT color screen ； smart car debugging ； interactive interface ；	介绍的智能车是以Freescale 16位单片机MC9S12XS128为控制核心,利用CMOS摄像头方式作为路径识别传感器,采集赛道图像信息的控制系统.针对智能车具有参数调试繁琐的问题,首先从硬件和软件两个方面介绍了基于TFT彩屏的便携式智能车手持调试平台,然后对该平台的人机交互界面以及在路径识别方面的应用进行了详细介绍.其中彩屏的显示界面包含从路径中提取的黑线,阈值显示,动态图像和静态图像.本文设计的智能车手持调试平台,使调试者能在短时间内对图像进行有效的分析,提高了调试效率.	2013年06期_基于TFT彩屏的便携式智能车手持调试平台.pdf	http://sso.cdclib.org/interlibSSO/goto/6/=06190596Z93/kcms/detail/detail.aspx?dbCode=cjfq&filename=XTYY201306012&dbname=CJFDLAST2013
基于LabVIEW高温摩擦磨损试验机测试系统	计算机系统应用	2013	2013年06期	【作者】 王春辉 ； 曾群锋 ； 【Author】       WANG Chun-Hui,ZENG Qun-Feng(Key Laboratory of Education Ministry for Modern Design and Rotor-Bearing System,Xi’an Jiaotong University,Xi’an 710049,China) 【机构】 西安交通大学现代设计及转子轴承系统教育部重点实验室 ；	高温摩擦磨损试验机 ； LabVIEW ； 测试系统 ； high temperature tribometer ； LabVIEW ； testing system ；	高温摩擦磨损试验机主要用于测试摩擦副材料在高温工况下的摩擦磨损性能.采用LabVIEW软件,通过调用动态链接库驱动数据采集卡,设计开发了用于高温摩擦磨损试验机的虚拟仪器测试系统.测试系统包括摩擦力、温度、载荷、转速等数据采集,数据存储,数据处理、图形显示及生成实验报告等功能.在高温摩擦磨损试验机上,利用该测试系统测量并记录摩擦系数,观察所采集的数据以及多次重复性试验.实验结果表明该测试系统具有较高的稳定性、准确性及可靠性.	2013年06期_基于LabVIEW高温摩擦磨损试验机测试系统.pdf	http://sso.cdclib.org/interlibSSO/goto/6/=06190596Z93/kcms/detail/detail.aspx?dbCode=cjfq&filename=XTYY201306013&dbname=CJFDLAST2013
基于S3C2440的电能表校验装置主控系统	计算机系统应用	2013	2013年06期	【作者】 朱红娟 ； 曾毓 ； 【Author】       ZHU Hong-Juan1,ZENG Yu2 1(School of Software Engineering,Tongji University,Shanghai 201804,China) 2(School of Electronics and Information,Hangzhou Dianzi University,Hangzhou 310018,China) 【机构】 同济大学软件学院 ； 杭州电子科技大学电子信息学院 ；	电能表 ； 校验装置 ； 检定 ； 闭环调整 ； WinCE ； Watt-hour-Meter ； verify device ； calibration ； closed loop adjustment ； WinCE ；	电能表是最主要的电能计量器具,也是一种用于贸易结算的计量器具,它的准确、可靠对于保护用户和电力企业的利益至关重要,所以对电能表的检定就显得尤为重要.主要介绍电能表检验装置主控部分的硬件和软件实现.硬件上采用ARM9(S3c2440)处理器作为主控单元,操作系统上移植了微软的WinCE嵌入式系统,实现了软件人机交互界面的简洁和美观.	2013年06期_基于S3C2440的电能表校验装置主控系统.pdf	http://sso.cdclib.org/interlibSSO/goto/6/=06190596Z93/kcms/detail/detail.aspx?dbCode=cjfq&filename=XTYY201306014&dbname=CJFDLAST2013
一种面向领域WEB服务的数据中心模型	计算机系统应用	2013	2013年06期	【作者】 沈燕 ； 雷蕾 ； 【Author】       SHEN Yan,LEI Lei(Software institute,Nanyang Institute of Technology,Nanyang 473000,China) 【机构】 南阳理工学院软件学院 ；	数据中心 ； 语义集成 ； 数据映射 ； 数据仓库 ； 分布式异构数据源集成 ； data center ； semantic integration ； data mapping ； data warehouse ； distributed heterogeneous data integration ；	提出一种通用的面向领域WEB服务的数据中心模型.利用语义集成、数据映射、数据仓库及其他数据集成技术,不仅完成分布式异构数据源的无缝数据集成,而且实现数据源与数据中心之间的数据共享和透明数据交换,为领域WEB服务提供统一数据服务.在"油气生产系统软件集成平台"中采用该模型,组建了中国石油油气井生产领域数据中心,构建一个面向油气井生产领域,集生产管理、设备管理、工作流程控制、优化设计、故障诊断、辅助决策等功能为一体的WEB服务平台,解决了海量、分布式异构数据源的有机集成和无缝共享问题.从而验证了该模型的正确性及可行性.	2013年06期_一种面向领域WEB服务的数据中心模型.pdf	http://sso.cdclib.org/interlibSSO/goto/6/=06190596Z93/kcms/detail/detail.aspx?dbCode=cjfq&filename=XTYY201306015&dbname=CJFDLAST2013
基于3G无线网络的多路视频监控系统	计算机系统应用	2013	2013年06期	【作者】 赵定勇 ； 韩鹏 ； 魏运全 ； 【Author】       ZHAO Ding-Yong,HAN Peng,WEI Yun-Quan(Department of Electrical Engineering,Sichuan Information Technology College,Guangyuan 628024,China) 【机构】 四川信息职业技术学院电气工程系 ；	3G无线通信模块 ； 多路视频监控 ； 无线手持移动终端 ； 3G wireless communications module ； multi-channel video monitoring ； wireless handset ；	通过分析现阶段3G无线网络传输的特点、无线视频监控系统的工作原理和技术难点,提出并设计了一种多路无线视频监控系统的设计方案.该方案不仅具有六路视频通道的无线视频监控功能,同时还实现了六路视频数据的网络监控和网络保存功能等.	2013年06期_基于3G无线网络的多路视频监控系统.pdf	http://sso.cdclib.org/interlibSSO/goto/6/=06190596Z93/kcms/detail/detail.aspx?dbCode=cjfq&filename=XTYY201306016&dbname=CJFDLAST2013
中心辐射层次式拓扑极坐标算法	计算机系统应用	2013	2013年06期	【作者】 李怀江 ； 康义民 ； 王俊 ； 雷蕾 ； 【Author】       LI Huai-Jiang,KANG Yi-Min,WANG Jun,LEI Lei(Command Automation Workstation,General Logistic Department,PLA,Beijing 100842,China) 【机构】 总后勤部指挥自动化工作站 ；	极坐标算法 ； 网络设备 ； 拓扑结构 ； 节点圆 ； 模型 ； polar coordinate algorithm ； network equipment ； topology structure ； pitch circle ； model ；	针对网状、树状网络拓扑反映网络层次、通断状态和单屏展现不足的问题,研究提出了一种基于极坐标算法绘制中心辐射层次式拓扑图形的实现方式,实现了拓扑图形的自动分层显示和动态更新,能够高效清晰地呈现网络设备连接关系,研究成果已在多个单位得到了实践检验,为强化网络管理与维护提供了重要手段.	2013年06期_中心辐射层次式拓扑极坐标算法.pdf	http://sso.cdclib.org/interlibSSO/goto/6/=06190596Z93/kcms/detail/detail.aspx?dbCode=cjfq&filename=XTYY201306017&dbname=CJFDLAST2013
基于特征点环形分布统计概率的图像检索	计算机系统应用	2013	2013年06期	【作者】 郭健 ； 【Author】       GUO Jian(Department of Information and Technology of Xiamen Ocean Vocational College,Xiamen,361012,China) 【机构】 厦门海洋职业技术学院信息技术系 ；	小波变换 ； 特征点 ； 概率 ； 距离 ； 权 ； wavelet transform ； salient point ； probability ； distance ； weight ；	分析了传统的基于小波边界点图像检索方法的缺点,提出了一种基于图像特征点环形分布概率的图像检索算法.该方法首先利用粗分辨率下绝对值大的小波系数对应于原始信号中全局变化大的区域这一特性,反向查找细分辨率下能够反映这种全局变化的小波系数,直到找到原始信号中相应的特征点;然后,将图像沿半径方向等分成若干同心圆环,计算图像特征点在这些圆环中的分布概率,以此作为图像的特征向量;最后,通过带权的街区距离计算图像间的相似度.实验表明本文提出的检索算法及图像相似度计算方法不仅检索精度高,还具有较优的旋转、尺度及视觉角度不变性.	2013年06期_基于特征点环形分布统计概率的图像检索.pdf	http://sso.cdclib.org/interlibSSO/goto/6/=06190596Z93/kcms/detail/detail.aspx?dbCode=cjfq&filename=XTYY201306018&dbname=CJFDLAST2013
基于云计算的改进余弦向量度量法索引项权值算法	计算机系统应用	2013	2013年06期	【作者】 付永贵 ； 尚成国 ； 马尚才 ； 【Author】       FU Yong-Gui,SHANG Cheng-Guo,MA Shang-Cai(School of Information Management,Shanxi University of Finance and Economics,Taiyuan 030031,China) 【机构】 山西财经大学信息管理学院 ；	ICVMMITWCC算法 ； 云计算 ； 平均权值 ； 相对权值 ； 排序效率 ； ICVMMITWCC algorithm ； cloud computing ； average weight ； relative weight ； the efficiency of sorting ；	针对用户对索引项重要程度无区分以及普通计算平台承载能力受限提出基于云计算的改进余弦向量度量法索引项权值算法(ICVMMITWCC算法),该算法通过从包含全部索引项的文本集中计算索引项平均权值对经典的余弦向量度量法索引项权值算法(CCVMMITW算法)修改求得相对权值;通过实验对比ICVMMITWCC算法与CCVMMITW算法下文本的排序效率,说明ICVMMITWCC算法更贴近用户查询需求.	2013年06期_基于云计算的改进余弦向量度量法索引项权值算法.pdf	http://sso.cdclib.org/interlibSSO/goto/6/=06190596Z93/kcms/detail/detail.aspx?dbCode=cjfq&filename=XTYY201306019&dbname=CJFDLAST2013
基于B*树聚簇索引的加密字符串查询方法	计算机系统应用	2013	2013年06期	【作者】 刘洁 ； 【Author】       LIU Jie(School of Computer Science and Engineering,Jiangsu University of Science and Technology,Zhenjiang 212003,China) 【机构】 江苏科技大学计算机科学与工程学院 ；	数据库加密 ； 加密字符串查询 ； 索引特征值 ； B*树聚簇索引 ； database encryption ； encrypted character string query ； index characteristic code ； B* tree cluster index ；	为了提高在数据库中查询加密字符串数据的性能,提出一种在索引特征值上创建B*树聚簇索引的查询方法.每一个待加密字符串数据对应一个索引特征值,索引特征值以数值的形式保存在索引字段中.查询时使用两阶段查询策略,首先利用索引字段对加密数据进行一次粗糙查询过滤掉不相干的记录,然后在返回的粗糙集合解密的基础上进行明文查询,得到最终结果.实验表明该方法较现有查询方法在查询性能有较大的提升.	2013年06期_基于B*树聚簇索引的加密字符串查询方法.pdf	http://sso.cdclib.org/interlibSSO/goto/6/=06190596Z93/kcms/detail/detail.aspx?dbCode=cjfq&filename=XTYY201306020&dbname=CJFDLAST2013
基于QPSO的BP神经网络油田节能指标预测	计算机系统应用	2013	2013年06期	【作者】 尚福华 ； 杨慧 ； 张吉峰 ； 马明梅 ； 董桂苓 ； 【Author】       SHANG Fu-Hua1,YANG Hui1,ZHANG Ji-Feng2,MA Ming-Mei1,DONG Gui-Ling3 1(School of Computer and Information Technology,Northeast Petroleum University,Daqing 163318,China) 2(Daqing Drilling Engineering Geologic Logging Company,Daqing 163318,China) 3(Information Department,Daqing No.3 Oil Production,Daqing 163318,China) 【机构】 东北石油大学计算机与信息技术学院 ； 大庆市钻探工程公司地质录井一公司 ； 大庆市第三采油厂信息中心 ；	BP神经网络 ； 量子粒子群 ； 指标预测 ； 算法优化 ； 滑动平均 ； bp neural network ； quantum partical swarm ； index prediction ； algorithm optimization ； moving average ；	针对BP神经网络易陷入局部极小问题以及收敛速度慢的问题,引入量子粒子群优化算法和BP神经网络相结合的方法,共享BP神经网络强大的灵活性和量子粒子群全局搜索能力强的优势,通过改进QPSO的平均最优位置的计算方法,实现基于BP神经网络和量子粒子群的油田节能指标预测.以大庆某采油厂注水泵机组单耗数据为训练数据,预测结果表明该方法能达到良好的预测效果,具有可行性.	2013年06期_基于QPSO的BP神经网络油田节能指标预测.pdf	http://sso.cdclib.org/interlibSSO/goto/6/=06190596Z93/kcms/detail/detail.aspx?dbCode=cjfq&filename=XTYY201306021&dbname=CJFDLAST2013
自适应直方图均衡化改进的全变分图像修复	计算机系统应用	2013	2013年06期	【作者】 任慧 ； 李新华 ； 朱逸婷 ； 【Author】       REN Hui,LI Xin-Hua,ZHU Yi-Ting(College of Electronical and Information Engineering,Anhui University,Hefei 230039,China) 【机构】 安徽大学计算智能与信号处理教育部重点实验室 ；	全变分(TV)模型 ； 强化细节 ； 自适应直方图均衡化 ； 形态学 ； 图像修复 ； total variation(TV) model ； strengthen the details ； CLAHE ； morphological ； image defect restoration ；	为了解决全变分(TV)模型修复窄带图像缺陷时产生的视觉不连通的问题,改善图像修复的效果.采用可以强化细节的自适应直方图均衡化(CLAHE)操作来扩大图像的动态范围;在全变分变换后对图像不连通区域做形态学运算来平滑并消除图像中的孤立点.文章给出了算法原理和实现步骤,实验结果表明修复之后的图像峰值信噪比提高,视觉连通效果较好.	2013年06期_自适应直方图均衡化改进的全变分图像修复.pdf	http://sso.cdclib.org/interlibSSO/goto/6/=06190596Z93/kcms/detail/detail.aspx?dbCode=cjfq&filename=XTYY201306022&dbname=CJFDLAST2013
改进的Gabor指纹图像增强算法	计算机系统应用	2013	2013年06期	【作者】 张跃 ； 王昊 ； 【Author】       ZHANG Yue,WANG Hao(School of Electronic and Technology,Liaoning University of Technology,Jinzhou 121001,China) 【机构】 辽宁工业大学电子与信息工程学院 ；	灰度曲率 ； 方向一致性 ； 自适应滤波窗口 ； Gabor滤波器 ； gray curvature ； direction consistency ； adaptive windows size of filters ； Gabor filters ；	算法采用按方向计算的灰度曲率,并将它归一化后用来作为衡量块内方向是否一致的标准,并通过此参数和指纹图像的平均频率共同调节滤波窗口的大小.实验结果表明,该方法不仅可以很好的消除粘连和连接断线,而且可以缓解因方向图求取不准确而对图像增强造成的不利影响,同时还增加了滤波器本身的稳定性和适用性.	2013年06期_改进的Gabor指纹图像增强算法.pdf	http://sso.cdclib.org/interlibSSO/goto/6/=06190596Z93/kcms/detail/detail.aspx?dbCode=cjfq&filename=XTYY201306023&dbname=CJFDLAST2013
基于DCT和混沌的图像隐藏技术	计算机系统应用	2013	2013年06期	【作者】 黄慧青 ； 【Author】       HUANG Hui-Qing(School of Mathematics,Jiaying University,Meizhou 514015,China) 【机构】 嘉应学院数学学院 ；	混沌系统 ； 图像置乱 ； 图像隐藏 ； DCT变换 ； chaotic system ； image scrambling ； image hiding ； DCT transfer ；	提出一种基于DCT和混沌的图像隐藏算法.首先利用混沌系统产生混沌序列对秘密图像进行加密,然后利用DCT变换与混沌序列把秘密图像隐藏到载体图像中.实验结果表明,该算法具有良好的安全性和隐藏效果.	2013年06期_基于DCT和混沌的图像隐藏技术.pdf	http://sso.cdclib.org/interlibSSO/goto/6/=06190596Z93/kcms/detail/detail.aspx?dbCode=cjfq&filename=XTYY201306024&dbname=CJFDLAST2013
一种基于主题相似性和网络拓扑的微博社区发现方法	计算机系统应用	2013	2013年06期	【作者】 王卫平 ； 范田 ； 【Author】       WANG Wei-Ping,FAN Tian(School of Management,University of Science and Technology of China,Hefei 230026,China) 【机构】 中国科学技术大学管理学院 ；	社会网络 ； 微博 ； 社区发现 ； 聚类 ； LDA ； social network ； Microblogging ； community mining ； clustering ； LDA ；	随着微博的迅速发展和大量普及,微博社区发现已经成为新兴的研究热点.发现网络社区有助于运营商理解网络结构和用户特征,为用户提供个性化服务.目前有关社区挖掘的研究大多只关注于网络结构,忽略节点内容.本文综合考虑网络结构和节点内容,提出一种基于用户主题相似性和网络拓扑结构的微博社区发现方法.首先从微博文本中抽取用户主题,然后结合用户之间的链接关系,对它们进行基于相似性的聚类,最终获得社区结构.在真实数据集上的实验证明:所提出的方法不但能够发现潜在社区,而且还能获知社区主题.	2013年06期_一种基于主题相似性和网络拓扑的微博社区发现方法.pdf	http://sso.cdclib.org/interlibSSO/goto/6/=06190596Z93/kcms/detail/detail.aspx?dbCode=cjfq&filename=XTYY201306025&dbname=CJFDLAST2013
