title	journal_name	year	issue	author	keywords	summary	pdf_filename	article_url
电信行业网络信息安全体系的建设	计算机系统应用	2003	2003年04期	【作者】 周振宇 ； 【机构】 华中科技大学电子与信息工程系 ；	信息网络安全 ； 信息安全管理体系 ；	针对电信运营商提出了IP网络安全体系结构,并给出安全体系的部署步骤	2003年04期_电信行业网络信息安全体系的建设.pdf	http://sso.cdclib.org/interlibSSO/goto/6/=06190596Z93/kcms/detail/detail.aspx?dbCode=cjfq&filename=XTYY200304011&dbname=CJFD0305
应用BC4J进行Web开发探讨	计算机系统应用	2003	2003年04期	【作者】 赖佳栋 ； 黄慧山 ； 【机构】 深圳供电局 ； 深圳供电局 518001 ； 518001 ；	BC4J ； JAVA组件 ； 封装 ；	BC4J是ORACLE公司提出的一种开发组件架构,全面体现了企业级分布式多层结构信息系统的特点。本文讨论了BC4J的主要架构,以及运用这套组件进行企业WEB应用开发的主要办法,并结合企业的实际应用加以说明,最后对BC4J在实际应用中的一些问题进行讨论。	2003年04期_应用BC4J进行Web开发探讨.pdf	http://sso.cdclib.org/interlibSSO/goto/6/=06190596Z93/kcms/detail/detail.aspx?dbCode=cjfq&filename=XTYY200304012&dbname=CJFD0305
中国民航分布式销售管理系统的实现	计算机系统应用	2003	2003年04期	【作者】 刘红宇 ； 【机构】 中国航空结算中心 100028 ；	销售管理系统 ； 国内航空公司 ； 分布处理 ； 作业管理 ； 软件项目管理 ； 设计背景 ； 销售代理 ； 软构件技术 ； 数据交换 ； 批作业 ；	<正> 1分布式销售管理系统设计背景 国内航空公司迫切需要一套适合国内航空公司分公司,办事处和销售代理人的分布式销售管理系统,而且能适应于不同的业务规模,能适应于不同的软硬件平台,能够提供与现有系统的各种数据接口,能进行灵活高效的分布处理。我们本着“立足中国民航实际,着眼未来发展趋势,符合国际航空规则,跟踪世界先进技	2003年04期_中国民航分布式销售管理系统的实现.pdf	http://sso.cdclib.org/interlibSSO/goto/6/=06190596Z93/kcms/detail/detail.aspx?dbCode=cjfq&filename=XTYY200304013&dbname=CJFD0305
基于Analysis Services的OLAP展现工具在教务系统中的应用	计算机系统应用	2003	2003年04期	【作者】 张选东 ； 张小玲 ； 李晋宏 ； 【机构】 北方工业大学 ； 北方工业大学 100041 ； 100041 ； 100041 ；	OLAP ； 数据仓库 ； 展现工具 ；	本文讲述了OLAP的特点,建立数据仓库的步骤,OLAP的设计和实施,并完成了OLAP展现工具proOLAP, proOLAP系统结构和完成的主要功能,并以教务系统为例用proOLAP对学生成绩进行了分析。	2003年04期_基于Analysis+Services的OLAP展现工具在教务系统中的应用.pdf	http://sso.cdclib.org/interlibSSO/goto/6/=06190596Z93/kcms/detail/detail.aspx?dbCode=cjfq&filename=XTYY200304014&dbname=CJFD0305
Unix/Linux可信主机的配置与应用	计算机系统应用	2003	2003年04期	【作者】 胡雪梅 ； 胡建荣 ； 【机构】 广东纺织职业技术学院 ； 佛山市城郊农村信用联社 528000 ； 528000 ；	Unix ； Linux ； 配置 ； 可信主机 ；	本文介绍了Unix/Linux可信主机的概念,重点论述了其在不同应用条件下的配置,并简要探讨了相关的安全问题。	2003年04期_Unix+Linux可信主机的配置与应用.pdf	http://sso.cdclib.org/interlibSSO/goto/6/=06190596Z93/kcms/detail/detail.aspx?dbCode=cjfq&filename=XTYY200304015&dbname=CJFD0305
RS/6000小型机系统性能优化	计算机系统应用	2003	2003年04期	【作者】 朱光远 ； 【机构】 青岛市农村信用联社 266071 ；	RS/6000小型机 ； 性能优化 ； 提高性能 ；	RS/6000小型机的性能优化是提高主机系统利用率的最有效手段,通过合理的内存分配提高文件的访问效率,调整缓冲区减少文件使用时的磁盘访问,设置调页空间加快系统的反应速度,利用逻辑卷管理的数据条块化功能减少磁盘资源的竞争,优化I/OPacing避免大规模的I/O请求耗尽CPU时间等等,可极大提高主机的运行性能。	2003年04期_RS+6000小型机系统性能优化.pdf	http://sso.cdclib.org/interlibSSO/goto/6/=06190596Z93/kcms/detail/detail.aspx?dbCode=cjfq&filename=XTYY200304016&dbname=CJFD0305
Office VBA中ADO错误处理研究	计算机系统应用	2003	2003年04期	【作者】 彭江平 ； 【机构】 湖南大学会计学院信息管理系 410079 ；	VBA ； ADO ； 错误处理 ；	针对VBA一般情况下不能处理ADO错误信息的问题,分析了问题的形成机理,并给出了一个完整的解决方案,对在VBA或VB中处理ADO错误有一定的指导意义。	2003年04期_Office+VBA中ADO错误处理研究.pdf	http://sso.cdclib.org/interlibSSO/goto/6/=06190596Z93/kcms/detail/detail.aspx?dbCode=cjfq&filename=XTYY200304017&dbname=CJFD0305
为什么使用EJB组件?	计算机系统应用	2003	2003年04期	【作者】 郭琳 ； 李环 ； 【机构】 北京中医药大学信息中心 ； 首都师范大学信息工程学院 100000 ； 100000 ；	组件化 ； EJB组件 ； 企业级应用 ； 分布式对象技术 ； 商务逻辑 ； 体系结构 ； 表示层 ； 数据映射 ； 胖客户端 ； 应用服务器 ；	<正> 1什么是EJB组件?EJB组件是为企业级应用设计的java组件模型 EJB组件是基于标准分布式对象技术,CORBA和RMI的服务器端java组件。EJB组件总是分布式的,这是它们与标准JavaBeans组件最根本的区别。	2003年04期_为什么使用EJB组件?.pdf	http://sso.cdclib.org/interlibSSO/goto/6/=06190596Z93/kcms/detail/detail.aspx?dbCode=cjfq&filename=XTYY200304018&dbname=CJFD0305
项目终止的方法与实践	计算机系统应用	2003	2003年04期	【作者】 黄向明 ； 【机构】 中国航空结算中心系统运行部 100028 ；	项目目标 ； 竣工验收 ； 项目验收 ； 用户方 ； 项目文件 ； 程序图 ； 大型建设项目 ； 战略变化 ； 项目组成员 ； 计划阶段 ；	人们通常关注如何申请项目和实施项目,但只有极少的人关注如何去终止项目。本文对目前项目终止的类型及原因进行了分析,并针对不同类型项目的终止方法进行了研究,对正常终止的项目竣工验收的标准与依据进行了分析;并就如何优化竣工验收的组织与程序进行了研究。	2003年04期_项目终止的方法与实践.pdf	http://sso.cdclib.org/interlibSSO/goto/6/=06190596Z93/kcms/detail/detail.aspx?dbCode=cjfq&filename=XTYY200304019&dbname=CJFD0305
对目前中国IC卡行业现状以及发展的几个看法	计算机系统应用	2003	2003年04期	【作者】 谭开文 ； 孙京宁 ； 【机构】 昆明城投公司 ； 清华同方 ；	IC ； 数据存储量 ； 卡多 ； 清算中心 ； 市场不规范 ； 融资手段 ； 技术优势 ； 应用领域 ； 共享数据 ； 落后者 ；	<正> 1 IC卡行业分析 IC卡的应用,集成作为一个新兴的技术和手段,目前已经在很多领域开始了应用。他以数据存储量大、安全性保密性好、使用方便等特点正被越来越多的行业和人们所接受和使用。	2003年04期_对目前中国IC卡行业现状以及发展的几个看法.pdf	http://sso.cdclib.org/interlibSSO/goto/6/=06190596Z93/kcms/detail/detail.aspx?dbCode=cjfq&filename=XTYY200304020&dbname=CJFD0305
分布式环境下大对象数据发布的设计及实现	计算机系统应用	2003	2003年04期	【作者】 张志远 ； 【机构】 新华社技术局 10003 ；	大对象数据 ； WEB ； HTTP ； 数据库 ；	大对象数据的发布方式直接决定了系统能否构建成分布式体系结构。通过分析HTTP协议的请求、响应状态及WEB服务器的内容协商机制,本文提出三种实现大对象数据WEB环境发布的方法,分别针对不同数据类型。首先将所有数据存入数据库中,对于图像数据可以使用HTML标签方式发布,对于格式化文档使用HTML表单方式发布,对于静态HTML文件使用Apache重定向模块实现发布,这三种发布方式服务器端均使用Java Servlet程序访问数据库,以流模式实现大对象数据的发布。	2003年04期_分布式环境下大对象数据发布的设计及实现.pdf	http://sso.cdclib.org/interlibSSO/goto/6/=06190596Z93/kcms/detail/detail.aspx?dbCode=cjfq&filename=XTYY200304021&dbname=CJFD0305
international	计算机系统应用	2003	2003年04期		三星电子 ； 企业排名 ； 税后净利润 ； 营业利润率 ； international ； 企业表现 ； 以太网产品 ； 半导体企业 ； 半导体工业 ； 财务困难 ；	<正> 全球IT版图呈现美影响减弱欧亚崛起的势头 Global IT Industry Presents a Tendency of Slow-Down inAmerica and Boom in Eurasia 2002年度全球主要IT企业税后净利润排行榜日前出炉,微软、三星电子、IBM以78.3亿美元、54.3亿美元、35.7亿美元分列前三位。《日本经济新闻》在分析这一排行榜时称:全球IT业势力版图已发生了少许变化,美国IT企业的影响已开始减弱,欧亚企业排名开始蹿升,硬件企业表现突出。总体来说,这次上榜的企业在获利上与往年相比都有所下滑,其中营业利润率比5年前高的企业仅有三星电子.	2003年04期_international.pdf	http://sso.cdclib.org/interlibSSO/goto/6/=06190596Z93/kcms/detail/detail.aspx?dbCode=cjfq&filename=XTYY200304022&dbname=CJFD0305
domestic	计算机系统应用	2003	2003年04期		随需应变 ； 市场策略 ； 全国巡展 ； Exhibition ； domestic ； 商务解决方案 ； 存储解决方案 ； 渠道合作伙伴 ； 大中华地区 ； 存储业务 ；	<正> 随需应变,一触即发;精装平台一劳永“e”——IBM eServeri系列新品发布全国巡展拉开序幕Adaptivet to Neressities, Touch and Go;De Luxe Platform.Once and for All——Nationwide Itinerant Exhibition of New Products of IBM eServeriSeries Preludes IBM在北京举行了主题为“随需应变一触即发;精装平台一劳永“e” 的IBMeServer i系列新产品新闻发布会。会上,IBM发布了eScrver i系列的最新服务器,最新的电子商务解决方案以及在中国的市场策略。	2003年04期_domestic.pdf	http://sso.cdclib.org/interlibSSO/goto/6/=06190596Z93/kcms/detail/detail.aspx?dbCode=cjfq&filename=XTYY200304023&dbname=CJFD0305
以过程管理技术规避软件开发的管理风险	计算机系统应用	2003	2003年03期	【作者】 马慧 ； 杨一平 ； 张萍 ； 【机构】 首都经济贸易大学信息学院 ； 首都经济贸易大学信息学院 100026 ； 100026 ； 100026 ；	管理风险 ； 规避 ； CMM ； 过程关键域 ；	本文揭示了开发中常见的问题。同时描述了主要参考CMM过程关键域的具体内容,对于规避风险以及软件项目质量的提高均具有重要的指导意义。	2003年03期_以过程管理技术规避软件开发的管理风险.pdf	http://sso.cdclib.org/interlibSSO/goto/6/=06190596Z93/kcms/detail/detail.aspx?dbCode=cjfq&filename=XTYY200303000&dbname=CJFD0305
成都双流国际机场航显系统的设计实现	计算机系统应用	2003	2003年03期	【作者】 金辉 ； 石敏 ； 【机构】 装备指挥技术学院软件中心 ； 装备指挥技术学院软件中心 101416 ； 101416 ；	航班信息显示系统 ； 集群 ； 可用性 ；	本文详细介绍了代表我国第二代航班信息显示技术特点的成都双流国际机场新航站楼航班信息显示系统的结构和技术特点,并从发展角度对航班信息显示系统的未来进行了展望和分析。	2003年03期_成都双流国际机场航显系统的设计实现.pdf	http://sso.cdclib.org/interlibSSO/goto/6/=06190596Z93/kcms/detail/detail.aspx?dbCode=cjfq&filename=XTYY200303001&dbname=CJFD0305
多媒体课件自动生成系统	计算机系统应用	2003	2003年03期	【作者】 杨印根 ； 吴克捷 ； 【机构】 南昌江西师范大学计算中心 ； 南昌江西师范大学计算中心 330027 ； 330027 ；	多媒体 ； 课件 ； Authorware自动生成系统 ；	制作多媒体课件对于广大教师来说是一件十分繁重的劳动。如何把教师从这种繁重的劳动中解放出来是我们面临的一个重要课题。我们研制了一个多媒体课件自动生成系统,该系统将课件的内容和结构分离开来,同时将课件结构设计成具有一定的智能性和通用性,它可以将教师准备好的素材内容自动生成课件,使得素材具有高度的重用性和共享性,从而大大提高课件的开发效率。	2003年03期_多媒体课件自动生成系统.pdf	http://sso.cdclib.org/interlibSSO/goto/6/=06190596Z93/kcms/detail/detail.aspx?dbCode=cjfq&filename=XTYY200303002&dbname=CJFD0305
销售管理系统的设计与实现	计算机系统应用	2003	2003年03期	【作者】 付春云 ； 赵春辉 ； 【机构】 大庆石油化工工程公司计算机开发公司信息工程部 ； 大庆油田有限责任公司试油试采分公司射孔作业大队 163711 ； 163402 ；	双机热备 ； 读卡器 ； 审批流程 ； 授权模块 ；	文中介绍了Windows环境下用Powerbuilder开发的销售管理信息系统,详细分析了系统的实现,重点介绍了系统应用双机热备的硬件特点和使用读卡器、网上审批流程、使用者的灵活权限等软件开发的特点,缩短业务人员有效工作时间,同时也能保证数据的安全性、完整性和一致性。	2003年03期_销售管理系统的设计与实现.pdf	http://sso.cdclib.org/interlibSSO/goto/6/=06190596Z93/kcms/detail/detail.aspx?dbCode=cjfq&filename=XTYY200303003&dbname=CJFD0305
多Agent智能制造系统中通信机制的研究	计算机系统应用	2003	2003年03期	【作者】 杜玉强 ； 王明哲 ； 【机构】 武汉华中科技大学控制科学与工程系 ； 武汉华中科技大学控制科学与工程系 430074 ； 430074 ；	agent ； 多agent系统 ； 对话模式 ； 着色Petri网 ；	在分析agent和多agent系统特点的基础上,着重研究了基于多agent的智能制造系统中的通信问题,提出了对话模式作为agent之间的通信机制,并使用着色Petri网进行了校验。	2003年03期_多Agent智能制造系统中通信机制的研究.pdf	http://sso.cdclib.org/interlibSSO/goto/6/=06190596Z93/kcms/detail/detail.aspx?dbCode=cjfq&filename=XTYY200303004&dbname=CJFD0305
应用于远程教育的在线协同作图平台	计算机系统应用	2003	2003年03期	【作者】 陈喆 ； 吴志军 ； 【机构】 清华大学精密仪器与机械学系 ； 清华大学精密仪器与机械学系 100084 ； 100084 ；	在线协同作图平台 ； Java ； 网络通信 ；	本文就应用于远程教育的在线协同作图平台开发过程中的一些主要方面做了探讨与实践。针对要实现的功能和相应的系统体系结构,重点讨论了作图平台设计中的一些问题,提出了解决问题的方法和思路,主要论题包括:图形的数据结构描述及算法库、网络连接及通信,多线程技术的应用。	2003年03期_应用于远程教育的在线协同作图平台.pdf	http://sso.cdclib.org/interlibSSO/goto/6/=06190596Z93/kcms/detail/detail.aspx?dbCode=cjfq&filename=XTYY200303005&dbname=CJFD0305
基于Agent技术规范(FIPA)的移动应用研究	计算机系统应用	2003	2003年03期	【作者】 范宝德 ； 张群星 ； 时百胜 ； 【机构】 烟台大学计算机系 ； 徐州商业银行 ； 徐州商业银行 264005 ； 221003 ； 221003 ；	FIPA ； 移动 ； Agent ； 应用 ；	首先介绍移动应用中的新问题,然后介绍软件Agent技术、描述基本的FIPA规范及FIPA支持的移动应用的基本原理,并通过一个例子来阐明这些原理。	2003年03期_基于Agent技术规范(FIPA)的移动应用研究.pdf	http://sso.cdclib.org/interlibSSO/goto/6/=06190596Z93/kcms/detail/detail.aspx?dbCode=cjfq&filename=XTYY200303006&dbname=CJFD0305
基于动态代理服务器的地方广告	计算机系统应用	2003	2003年03期	【作者】 罗忠石 ； 崔学文 ； 赵炜平 ； 【机构】 黑龙江省鸡西大学计算机系 ； 黑龙江省鸡西大学计算机系 158100 ； 158100 ； 158100 ；	因特网 ； 万维网 ； 信息商业 ； 电子商务 ； 因特网广告 ； 代理转换 ；	本文主要介绍了基于Squid-based代理服务器的地方广告的设计思想与各种功能的执行细节。这种网络广告的模式对“因特网”来说意义重大,它为涉及到的各方提供了一个双赢的局面。	2003年03期_基于动态代理服务器的地方广告.pdf	http://sso.cdclib.org/interlibSSO/goto/6/=06190596Z93/kcms/detail/detail.aspx?dbCode=cjfq&filename=XTYY200303007&dbname=CJFD0305
引导企业需求,创造客户价值 企业应用软件盛会将于今年6月在沪举行	计算机系统应用	2003	2003年03期	【作者】 倪鸣 ； 【机构】 上海软件行业协会会务部 上海霖科 ；	企业应用软件 ； 电子政务应用 ； 行业活动 ； 上海市人民政府 ； 信息化办公室 ； 物流应用 ； 供应链 ； 信息技术 ； 数据库服务 ； 参展公司 ；	<正> 由上海市人民政府信息化办公室,上海软件行业协会主办及多家IT媒体承办的“2003年上海国际软件行业年会”(CISE2003)以及相关专业展览和论坛将于今年6月下旬在上海举行。年会针对不同的行业应用特点举办不同主题的行业活动,其中包括2003年制造业信息技术应用展览及会议、2003年供应链及物流应用技术展览和会议、2003年电子政务应用技术展览和会议、2003	2003年03期_引导企业需求,创造客户价值+企业应用软件盛会将于今年6月在沪举行.pdf	http://sso.cdclib.org/interlibSSO/goto/6/=06190596Z93/kcms/detail/detail.aspx?dbCode=cjfq&filename=XTYY200303008&dbname=CJFD0305
基于SIP协议的服务器设计与实现	计算机系统应用	2003	2003年03期	【作者】 纪筱斐 ； 黄德才 ； 方路平 ； 陈海珍 ； 【机构】 杭州浙江工业大学信息工程学院 ； 杭州浙江工业大学信息工程学院 310014 ； 310014 ； 310014 ；	SIP ； VOIP ； SIP服务器 ；	SIP是一种应用层控制信令协议,用于创建、修改和结束与一个或多个参与者的会话。它具有简单、扩展性好以及扩容性好等优点。本文介绍了SIP协议的优点并且给出了一个SIP服务器的设计与实现方案。	2003年03期_基于SIP协议的服务器设计与实现.pdf	http://sso.cdclib.org/interlibSSO/goto/6/=06190596Z93/kcms/detail/detail.aspx?dbCode=cjfq&filename=XTYY200303009&dbname=CJFD0305
宽带VPN网络密钥管理的研究应用	计算机系统应用	2003	2003年03期	【作者】 朱长安 ； 刘嘉勇 ； 刘军 ； 【机构】 成都四川大学信息安全所 ； 成都四川大学信息安全所 610064 ； 610064 ； 610064 ；	密钥管理 ； 宽带VPN ； SKIP协议 ；	本文主要基于中低速VPN网络环境的几种密钥管理协议出发,引出适合在高速VPN网络环境下的SRIP密钥管理协议,然后对该协议及其特点进行分析,并结合IPSEC和VPN,从密钥的产生,证书的颁发和网络框架等三个方面出发,提出基于SKIP协议的密钥管理模型,最后结合宽带VPN网络的IPSEC隧道和传输两种模式在LINUX操作系统中实现。	2003年03期_宽带VPN网络密钥管理的研究应用.pdf	http://sso.cdclib.org/interlibSSO/goto/6/=06190596Z93/kcms/detail/detail.aspx?dbCode=cjfq&filename=XTYY200303010&dbname=CJFD0305
混合式入侵检测系统的研究	计算机系统应用	2003	2003年03期	【作者】 侍伟敏 ； 【机构】 焦作工学院计算机系 454000 ；	网络安全 ； 入侵检测系统 ； 混合式 ；	本文介绍了基于网络的和基于主机的入侵检测系统各自的特点,分析了这两种入侵检测系统存在的问题,给出了一种混合式入侵检测系统的解决方案,并对混合式入侵检测系统的组成及其功能进行了详细的分析研究,最后对本系统的特点作了简单的总结。	2003年03期_混合式入侵检测系统的研究.pdf	http://sso.cdclib.org/interlibSSO/goto/6/=06190596Z93/kcms/detail/detail.aspx?dbCode=cjfq&filename=XTYY200303011&dbname=CJFD0305
基于SSL的安全网站的理论与实践	计算机系统应用	2003	2003年03期	【作者】 朱旭东 ； 【机构】 广东湛江海洋大学海滨学院 524005 ；	SSL ； RSA ； Web Server ；	Web服务器和客户机之间的传输数据的安全性一直是电子商务应用的重中之重。本文首先对SSL理论作深入解剖,然后以普遍使用的IIS5.0 Web Server为例,避开复杂的编程,通过简单的操作具体实现SSL。	2003年03期_基于SSL的安全网站的理论与实践.pdf	http://sso.cdclib.org/interlibSSO/goto/6/=06190596Z93/kcms/detail/detail.aspx?dbCode=cjfq&filename=XTYY200303012&dbname=CJFD0305
Oracle数据库在人口管理信息系统中的研究与应用	计算机系统应用	2003	2003年03期	【作者】 何月顺 ； 蒋年德 ； 丁秋林 ； 【机构】 江西抚州东华理工学院 ； 江苏南京南京航空航天大学 344000 ； 344000 ； 210016 ；	分布式数据库 ； 客户/服务器体系结构 ； 数据库服务器 ； 人口管理信息系统 ；	本文阐述了在Oracle境下人口管理信息系统分布式数据库的设计方案,重点研究了人口管理信息系统的数据分布特点、分布式的数据库模型和拓朴结构、数据复制、网络通信、分布式查询与数据更新。	2003年03期_Oracle数据库在人口管理信息系统中的研究与应用.pdf	http://sso.cdclib.org/interlibSSO/goto/6/=06190596Z93/kcms/detail/detail.aspx?dbCode=cjfq&filename=XTYY200303013&dbname=CJFD0305
大亚湾核电站Exchange 2000 Cluster实现	计算机系统应用	2003	2003年03期	【作者】 徐宏文 ； 熊少学 ； 赵志中 ； 【机构】 深圳广东大亚湾核电站 ； 深圳广东大亚湾核电站 518124 ； 518124 ； 518124 ；	群件系统 ； 群集 ； Exchange 2000 ； cluster ； IBM x370 ；	广东大亚湾核电站自98年部署微软Exchange群件系统以来,用户规模不断扩大,同时基于群件系统的应用开发,如办公自动化、视频会议等需求的提出.使得当初的系统设计目标无论在性能、容量和稳定运行等方面都不能满足当前需求。为此,公司IT部门成立了专项小组,在经过充分比较论证和方案选型后,决定将群件系统由Exchange5.5单机环境升级到Exchange 2000群集结构。2002年3月,项目小组顺利实现了上述目标。本文简要论述了整个项目的设计思想和实现过程。	2003年03期_大亚湾核电站Exchange+2000+Cluster实现.pdf	http://sso.cdclib.org/interlibSSO/goto/6/=06190596Z93/kcms/detail/detail.aspx?dbCode=cjfq&filename=XTYY200303014&dbname=CJFD0305
PI系统在电厂实时监控中的应用	计算机系统应用	2003	2003年03期	【作者】 陈兵 ； 李俊娥 ； 熊爱国 ； 聂剑平 ； 田强 ； 【机构】 武汉大学计算中心 ； 西安国家电力公司热工研究院 ； 西安国家电力公司热工研究院 430072 ； 430072 ； 710032 ； 710032 ；	PI ； 实时/历史数据库 ； 实时监控 ； SIS ； 应用 ；	本文在阐述了实时/历史数据库平台PI系统的主要技术特点,主要功能模块的基础上,具体介绍了PI在电厂实时监控系统SIS中的应用实例,指出基于PI系统的SIS开发在工业管控一体化中将有广阔的应用前景。	2003年03期_PI系统在电厂实时监控中的应用.pdf	http://sso.cdclib.org/interlibSSO/goto/6/=06190596Z93/kcms/detail/detail.aspx?dbCode=cjfq&filename=XTYY200303015&dbname=CJFD0305
基于EE的银行企业网络的设计与实现	计算机系统应用	2003	2003年03期	【作者】 李燕燕 ； 【机构】 中国农业银行软件开发中心 100036 ；	APP协议 ； SNA协议 ； IP协议 ； EE ；	对于许多企业,如何使各历史时期基于不同通信协议SNA或IP开发出来的应用系统高效地在单一的IP传输网络中运行是急需解决的问题.EE技术正是为这一目的而设计。本文结合农业银行全国网建设的具体情况,论述基于EE技术的企业网络的设计及实现过程。	2003年03期_基于EE的银行企业网络的设计与实现.pdf	http://sso.cdclib.org/interlibSSO/goto/6/=06190596Z93/kcms/detail/detail.aspx?dbCode=cjfq&filename=XTYY200303016&dbname=CJFD0305
ASP技术的出错处理	计算机系统应用	2003	2003年03期	【作者】 黄天戍 ； 谭志江 ； 任清珍 ； 【机构】 武汉大学 ； 武汉大学 430072 ； 430072 ； 430072 ；	ASP ； 错误对象 ； 出错处理 ；	本文较为全面的分析了ASP网络编程中存在的出错处理问题。对错误进行了分类,针对每一类错误举出实例给予解决,对ASP程序的健壮性及开发调试有重要意义。	2003年03期_ASP技术的出错处理.pdf	http://sso.cdclib.org/interlibSSO/goto/6/=06190596Z93/kcms/detail/detail.aspx?dbCode=cjfq&filename=XTYY200303017&dbname=CJFD0305
