title	journal_name	year	issue	author	keywords	summary	pdf_filename	article_url
文本搜索排序中构造训练集的一种方法	计算机系统应用	2010	2010年10期	【作者】 王黎 ； 帅建梅 ； 【Author】       WANG Li,SHUAI Jian-Mei(Department of Automation,University of Science and Technology of China,Hefei 230027,China) 【机构】 中国科学技术大学自动化系 ；	信息检索 ； 自学习排序 ； 构造训练集 ； information retrieval ； learning to rank ； construct training set ；	在文本搜索领域,用自学习排序的方法构建排序模型越来越普遍。排序模型的性能很大程度上依赖训练集。每个训练样本需要人工标注文档与给定查询的相关程度。对于文本搜索而言,查询几乎是无穷的,而人工标注耗时费力,所以选择部分有信息量的查询来标注很有意义。提出一种同时考虑查询的难度、密度和多样性的贪心算法从海量的查询中选择有信息量的查询进行标注。在LETOR和从Web搜索引擎数据库上的实验结果,证明利用本文提出的方法能构造一个规模较小且有效的训练集。	2010年10期_文本搜索排序中构造训练集的一种方法.pdf	http://sso.cdclib.org/interlibSSO/goto/6/=06190596Z93/kcms/detail/detail.aspx?dbCode=cjfq&filename=XTYY201010044&dbname=CJFD0910
个性化推荐系统中的混合用户偏好获取	计算机系统应用	2010	2010年10期	【作者】 蒋翀 ； 费洪晓 ； 【Author】       JIANG Chong1,FEI Hong-Xiao2(1.Modern Education Technology Center,Hunan Woman’s Vocational University,Changsha 410004,China)(2.School of Software,Central South University of China,Changsha 410079,China) 【机构】 湖南女子职业大学现代教育技术中心 ； 中南大学软件学院 ；	显式评分 ； 隐式反馈 ； 混合用户偏好获取 ； explicit ratings ； implicit feedback ； mixed-mode preference access ；	针对个性化推荐系统中用户偏好信息量小的问题,提出了混合用户偏好获取,以相对准确但稀少的显式评分为基础,综合考虑用户页面停留时间、页面滚动时间和鼠标点击次数三项浏览行为,以评分转化规则为依据,得到隐式评分。结合隐式评分和显式评分,构建反映用户偏好的用户-项目矩阵,为个性化推荐算法的实施提供数据基础。实验证明,混合用户偏好获取是可行和有效的。	2010年10期_个性化推荐系统中的混合用户偏好获取.pdf	http://sso.cdclib.org/interlibSSO/goto/6/=06190596Z93/kcms/detail/detail.aspx?dbCode=cjfq&filename=XTYY201010045&dbname=CJFD0910
移动Agent安全措施与实现	计算机系统应用	2010	2010年10期	【作者】 林德树 ； 黄廷磊 ； 【Author】       LIN De-Shu,HUANG Ting-Lei(School of Computer and Control,GuiLin University of Electronic Technology,Guilin 541004,China) 【机构】 桂林电子科技大学计算机与控制学院 ；	移动Agent ； 安全 ； 加密 ； 信誉值 ； mobile agent ； security ； cryptography ； reputation value ；	移动Agent的应用日益广泛,移动Agent系统的安全问题突出,如何解决移动Agent安全问题是非常关键的。本文提出了基于密码学和计算机网络安全的移动Agent的安全措施,同时给出了实现的方法,并提出可以采用的其他新型的安全措施。这些措施的核心问题是既要保证移动Agent通信的安全和移动Agent执行环境的安全,同时又要保证移动Agent能够应用的更为广泛。	2010年10期_移动Agent安全措施与实现.pdf	http://sso.cdclib.org/interlibSSO/goto/6/=06190596Z93/kcms/detail/detail.aspx?dbCode=cjfq&filename=XTYY201010046&dbname=CJFD0910
普适计算的隐私保护协议	计算机系统应用	2010	2010年10期	【作者】 贾宗璞 ； 冯倩倩 ； 【Author】       JIA Zong-Pu,FENG Qian-Qian(Department of Computer Science and Technology,Henan Polytechnic University,Jiaozuo 454000,China) 【机构】 河南理工大学计算机科学与技术学院 ；	普适计算 ； 隐私保护 ； 认证 ； 攻击 ； 安全 ； pervasive computing ； privacy protect ； authentication ； attack ； secure ；	改进了一个用于保护用户隐私的安全协议。该协议引入了服务发现者,用户并不直接与服务提供者进行通信,而是通过服务发现者来完成用户的需求。通过对协议的安全分析,可以看出:该协议保护了用户的隐私,也防止了用户被跟踪,并且减少了原有协议的计算量,更适合普适计算。该协议可以很好的保护用户的隐私,并且能够防止重放攻击。	2010年10期_普适计算的隐私保护协议.pdf	http://sso.cdclib.org/interlibSSO/goto/6/=06190596Z93/kcms/detail/detail.aspx?dbCode=cjfq&filename=XTYY201010047&dbname=CJFD0910
一种分布式系统自动升级的方法	计算机系统应用	2010	2010年10期	【作者】 赵珂 ； 郑尚辉 ； 沈洪骥 ； 【Author】       ZHAO Ke1,ZHENG Shang-Hui2,SHEN Hong-Ji2(1.Department of Computer,Shandong Education Institute,Jinan 250013,China;2.Technology Company,Shandong Xinhua Bookstore,Jinan 250002,China) 【机构】 山东教育学院计算机科学与技术系 ； 山东新华书店集团科技公司 ；	Power Builder ； Web Service ； 分布式系统 ； 自动升级 ； PowerBuilder ； Web service ； distributional system ； auto-update keyword ；	介绍了利用Power Builder提供的技术实现版本控制以及自动升级版本功能的方法,给出了自动升级流程和关键技术的实现,提出的升级方案由于基于Web Service,所以具有普遍性,能够适合分布式系统架构下开发的软件的自动升级。目前该自动升级功能已在书店的物流信息管理平台中得到良好的应用。	2010年10期_一种分布式系统自动升级的方法.pdf	http://sso.cdclib.org/interlibSSO/goto/6/=06190596Z93/kcms/detail/detail.aspx?dbCode=cjfq&filename=XTYY201010048&dbname=CJFD0910
一种基于圆几何特征的虹膜定位算法	计算机系统应用	2010	2010年10期	【作者】 魏炜 ； 【Author】       WEI Wei(Suzhou Health College,Suzhou 215002,China) 【机构】 苏州卫生职业业技术学院 ；	虹膜识别 ； 虹膜定位 ； 几何特征 ； 内边缘定位 ； iris recognition ； iris location ； geometrical characteristic ； pupil location ；	虹膜定位是虹膜识别中基础性环节,其精度和速度决定了虹膜识别系统的性能,为提高虹膜定位的速度,提出一种基于圆几何特征的虹膜内边缘定位算法,利用内外边缘中心的耦合特性缩小微积分方法搜索外边缘的范围。试验结果表明,与经典虹膜定位算法相比,本算法快速﹑精确﹑鲁棒。	2010年10期_一种基于圆几何特征的虹膜定位算法.pdf	http://sso.cdclib.org/interlibSSO/goto/6/=06190596Z93/kcms/detail/detail.aspx?dbCode=cjfq&filename=XTYY201010049&dbname=CJFD0910
Ad Hoc网络中AODV路由协议的分析与改进	计算机系统应用	2010	2010年10期	【作者】 吴国凤 ； 邵臣 ； 【Author】       WU Guo-Feng,SHAO Chen(Department of Computer and Information,Hefei University of Technology,Hefei 230009,China) 【机构】 合肥工业大学计算机与信息学院 ；	AdHoc网络 ； 改进AODV协议 ； NS-2 ； 时延 ； 吞吐量 ； Ad Hoc network ； improved AODV protocol ； NS-2 ； delay ； throughput ；	AODV协议是Ad Hoc网络中典型的反应式路由协议。该协议仅适用于双向传输信道,路由表仅维护一条到指定目的节点的路由,所以对于AODV协议的改进是必要的。就是针对Ad Hoc协议应用在某些特定场合做了一定的改进,并通过实验仿真验证了改进后的AODV协议可以提高网络的吞吐量并有效的降低了网络传输时延。	2010年10期_Ad+Hoc网络中AODV路由协议的分析与改进.pdf	http://sso.cdclib.org/interlibSSO/goto/6/=06190596Z93/kcms/detail/detail.aspx?dbCode=cjfq&filename=XTYY201010050&dbname=CJFD0910
一种矢量道路图层节点匹配新算法	计算机系统应用	2010	2010年10期	【作者】 孙棣华 ； 毕俊杰 ； 廖孝勇 ； 【Author】       SUN Di-Hua,BI Jun-Jie,LIAO Xiao-Yong(College of Automation,Chongqing University,Chongqing 400044,China) 【机构】 重庆大学自动化学院 ；	节点匹配 ； 路网拓扑 ； MapX ； Mapinfo ； 道路图层 ； node-matching ； road network topological ； MapX ； Mapinfo ； road layer ；	针对矢量道路图层在生成过程中存在的过头、不及以及交叉口分离等典型的不规范情况,提出采用距离最近原则确定与道路交叉口相连接的各道路之间的关系,应用直线段延长法以及直线段替换法等处理方法,将原始道路图层规范化的节点匹配算法。应用该算法,在VB6.0开发环境和MapInfo二次开发控件MapX支持下,实现了原始道路图层中所有道路的正确关联,为路网拓扑结构的正确构建打下良好的基础。实验结果表明,该算法适用于道路拓扑复杂情形。	2010年10期_一种矢量道路图层节点匹配新算法.pdf	http://sso.cdclib.org/interlibSSO/goto/6/=06190596Z93/kcms/detail/detail.aspx?dbCode=cjfq&filename=XTYY201010051&dbname=CJFD0910
一种角色权限管理方案的算法设计	计算机系统应用	2010	2010年10期	【作者】 刘鹏远 ； 【Author】       LIU Peng-Yuan(School of Computer,Hubei University of Economy,Wuhan 430205,China) 【机构】 湖北经济学院计算机学院 ；	角色 ； 权限 ； 功能点 ； 菜单 ； 算法 ； role ； privilege ； function point ； menu ； algorithm ；	基于角色的权限管理在信息管理系统的开发中得到普及应用,应用角色权限管理技术可实现不同身份登录验证后具有不同的操作界面,提高了系统的易用性和健壮性。基于作者开发的一个项目,分权限菜单处理、修改角色数据预准备、角色展现页面逻辑、以及客户端复杂逻辑控制多个方面详尽给出一系列核心算法实现。应用表明这些核心算法有着较好的处理性能。	2010年10期_一种角色权限管理方案的算法设计.pdf	http://sso.cdclib.org/interlibSSO/goto/6/=06190596Z93/kcms/detail/detail.aspx?dbCode=cjfq&filename=XTYY201010052&dbname=CJFD0910
一种基于循环匹配的Web服务发现策略	计算机系统应用	2010	2010年10期	【作者】 余伟 ； 陆杰 ； 【Author】       YU Wei,LU Jie(Computer College Chongqing University,Chongqing 400044,China) 【机构】 重庆大学计算机学院 ；	Web服务匹配 ； 语义概念 ； 循环匹配 ； 本体 ； 二义性 ； Web service matching ； semantic concept ； cycle matching ； ontology ； ambiguity ；	随着互联网的高速发展和广泛应用,互联网用户对服务的要求越来越高,同时开发人员对代码的重用和应用服务松耦合的要求也越来越高。Web服务则提供了一种解决上述问题的方法,而传统的Web服务匹配主要是基于关键字的,缺乏对语义的支持,因而在服务匹配方面的效率较低。采用语义概念来表达Web服务的描述性内容,并针对概念之间的二义性提出了一种循环匹配的方法来计算概念之间的相似度,并最终来确定请求服务和广告服务的相似度。最后,实验证明本文提出的策略有较好的可行性和有效性。	2010年10期_一种基于循环匹配的Web服务发现策略.pdf	http://sso.cdclib.org/interlibSSO/goto/6/=06190596Z93/kcms/detail/detail.aspx?dbCode=cjfq&filename=XTYY201010053&dbname=CJFD0910
互联网视频摘要信息自动抽取	计算机系统应用	2010	2010年10期	【作者】 易荣锋 ； 朱六璋 ； 尹文科 ； 【Author】       YI Rong-Feng1,ZHU Liu-Zhang2,YIN Wen-Ke1(1.Department of Automation,University of Science and Technology of China,Hefei 230027,China;2.Anhui Electric Power Jiyuan Company,Hefei 230000,China) 【机构】 中国科学技术大学自动化系 ； 安徽电力继远软件公司 ；	摘要信息抽取 ； 互联网视频 ； 网页净化 ； video summary extraction ； internet video ； page purification ；	提出一种识别视频播放页,并从中抽取视频摘要信息的方法,播放页的自动识别是通过三个判定要素的运用来实现,播放页内摘要信息的抽取是通过依次去除背景噪声、随机噪声、残留噪声来实现。有关实验结果表明,该方法具有较好的通用性。	2010年10期_互联网视频摘要信息自动抽取.pdf	http://sso.cdclib.org/interlibSSO/goto/6/=06190596Z93/kcms/detail/detail.aspx?dbCode=cjfq&filename=XTYY201010054&dbname=CJFD0910
DTN网络中ED算法的分析与改进	计算机系统应用	2010	2010年10期	【作者】 陈元甲 ； 刘卫国 ； 施荣华 ； 【Author】       CHEN Yuan-Jia,LIU Wei-Guo,SHI Rong-Hua(School of Information Science and Engineering,Central South University,Changsha 410083,China) 【机构】 中南大学信息科学与工程学院 ；	延迟容忍网络 ； 路由算法 ； 延时开销 ； 最早传递算法 ； delay tolerant network(DTN) ； routing algorithm ； delay cost ； earliest delivery(ED) ；	详细研究了延迟容忍网络(DTN)的一种确定性路由算法—ED(Earliest-Delivery),分析了其计算延时开销函数,并在此基础上充分考虑了传播延时、节点之间链路的连接规律,引入链路连接状态表来选取路由决策时刻,优化延时开销的计算。实验结果表明,改进后的ED算法可以有效地降低延时,提高路由成功率。	2010年10期_DTN网络中ED算法的分析与改进.pdf	http://sso.cdclib.org/interlibSSO/goto/6/=06190596Z93/kcms/detail/detail.aspx?dbCode=cjfq&filename=XTYY201010055&dbname=CJFD0910
移动自组网中基于稳定邻居的数据复制算法	计算机系统应用	2010	2010年10期	【作者】 常秋菊 ； 杨金民 ； 【Author】       CHANG Qiu-Ju,YANG Jin-Min(School of Software,Hunan University,Changsha 410082,China) 【机构】 湖南大学软件学院 ；	移动自组网 ； 数据复制 ； 稳定邻居 ； 剩余能量 ； 数据访问率 ； mobile ad hoc ； data replication ； stable neighbors ； surplus energy ； data accessibility ；	移动自组网络中由于节点的移动和能量的有限性,节点间的链路不稳定,使得数据的访问成功率较低,节点间能量消耗不平衡。针对此问题,提出基于节点稳定邻居的复制算法,对节点的数据项访问频度进行加权处理,综合考虑节点的稳定邻居数和剩余能量,以此确定数据副本的放置位置。模拟实验结果表明,该算法能有效提高数据访问成功率,平衡节点间能量消耗。	2010年10期_移动自组网中基于稳定邻居的数据复制算法.pdf	http://sso.cdclib.org/interlibSSO/goto/6/=06190596Z93/kcms/detail/detail.aspx?dbCode=cjfq&filename=XTYY201010056&dbname=CJFD0910
基于VRML的Web3D环境交互方法	计算机系统应用	2010	2010年10期	【作者】 晏焱 ； 杨清文 ； 李慧翔 ； 董飞 ； 【Author】       YAN Yan,YANG Qing-Wen,LI Hui-Xiang,DONG Fei(Artillery Academy of PLA,Hefei 230031,China) 【机构】 中国人民解放军炮兵学院 ；	虚拟现实 ； VRML ； 交互性 ； virtual reality ； VRML ； interactive ；	基于VRML的虚拟现实技术存在交互模式单一、交互控制编程复杂的缺点,根据VRML的特点,分析了多事件复杂场景交互和网页与场景交互的方法,提出了运用API和网络编程语言实现交互手段多样化的方法,并进行了实际应用,应用表明该方法节约了开发时间、减少了路由层次,提高了运行效率。	2010年10期_基于VRML的Web3D环境交互方法.pdf	http://sso.cdclib.org/interlibSSO/goto/6/=06190596Z93/kcms/detail/detail.aspx?dbCode=cjfq&filename=XTYY201010057&dbname=CJFD0910
基于ACL控制校园网P2SP下载流量的研究与实现	计算机系统应用	2010	2010年10期	【作者】 周迪民 ； 段国云 ； 【Author】       ZHOU Di-Min,DUAN Guo-Yun(Dept.of Modern Education Technology Center,Hunan University of Science and Engineering,Yongzhou 425100,China) 【机构】 湖南科技学院现代教育技术中心 ；	P2P ； 访问控制列表 ； 流量控制 ； 资源索引服务器 ； P2P ； ACL ； traffic control ； index server ；	P2P(Peer-to-Peer,点对点)下载技术是校园网带宽控制的技术热点,此技术的应用占用了校园网大量的出口带宽,80%的出口资源被20%的用户所占用,造成了校园网带宽的瓶颈。分析P2SP(Peer-to-Sever&Peer)技术原理,结合校园网络的设计及使用的特点,提出了利用基于时间的ACL(Access Control Lists,访问控制列表)来控制用户访问P2SP资源索引服务器以控制下载流量的具体实现方法。校园网出口实际测试结果显示,本方法能准确控制P2SP流量。	2010年10期_基于ACL控制校园网P2SP下载流量的研究与实现.pdf	http://sso.cdclib.org/interlibSSO/goto/6/=06190596Z93/kcms/detail/detail.aspx?dbCode=cjfq&filename=XTYY201010058&dbname=CJFD0910
基于RTMP的文档在线浏览工具	计算机系统应用	2010	2010年10期	【作者】 汪孔敏 ； 李觊 ； 李华飙 ； 南凯 ； 【Author】       WANG Kong-Min,LI Ji,LI Hua-Biao,NAN Kai(Collaboration Environment Research Center,Computer Network Information Center,Chinese Academy of Sciences,Beijing 100190,China) 【机构】 中科院计算机网络信息中心协同工作环境研究中心 ；	文档转换 ； 文档流传输 ； 在线浏览 ； RTMP ； 同步浏览 ； document convert ； document data transfer ； online viewing ； RTMP ； synchronization ；	提出基于RTMP的文档在线浏览实现方案。该方案能够实现各种文档在线浏览,并且可以同步播放,达到各个客户端同步浏览的效果。首先我们在线转换各种文档为Flash文件,然后通过客户端的Flash文件调用文档转换后的Flash文件,实现文档在线浏览,然后通过客户端的操作,实现文档的翻页、拖放、以及缩放,再加上基于RTMP的Red5服务器,利用共享对象来实现文档的同步播放,各个客户端能够同步浏览。本系统关键为:文档转换、文档流传输和文档同步浏览,该系统最终实现了文档的在线浏览,并增加了同步浏览的功能,提高了工作效率。	2010年10期_基于RTMP的文档在线浏览工具.pdf	http://sso.cdclib.org/interlibSSO/goto/6/=06190596Z93/kcms/detail/detail.aspx?dbCode=cjfq&filename=XTYY201010059&dbname=CJFD0910
Provisioning Services与XenApp联合组建局域网应用环境的研究	计算机系统应用	2010	2010年10期	【作者】 郑羽 ； 【Author】       ZHENG Yu(School of Engineering,Shanxi Datong University,Datong 037003,China) 【机构】 山西大同大学工学院 ；	XenApp ； 应用虚拟化 ； Provisioning Services ； 应用流 ； 网络应用环境 ； XenApp ； application virtualization ； provisioning services ； application streaming ； LAN application environment ；	Citrix公司推出的基于应用流技术的Provisioning Services软件可以实现客户端通过PXE技术获取服务端采用VDisk磁盘存放的操作系统镜像文件,实现无盘启动;而同公司的基于应用虚拟化技术的XenApp软件则可以实现瘦客户端对服务器端所发布程序的访问。将两者相互结合来组建局域网应用环境,不但可以节省软硬件成本,而且对局域网络环境的管理也变得更加轻松和安全。此外还可以指定客户端可运行的应用程序,对服务器端的访问也不仅限于局域网内部。	2010年10期_Provisioning+Services与XenApp联合组建局域网应用环境的研究.pdf	http://sso.cdclib.org/interlibSSO/goto/6/=06190596Z93/kcms/detail/detail.aspx?dbCode=cjfq&filename=XTYY201010060&dbname=CJFD0910
Web信息抽取及知识表示系统的研究与实现	计算机系统应用	2010	2010年09期	【作者】 谭守标 ； 徐超 ； 江元 ； 宁仁霞 ； 【Author】       TAN Shou-Biao, XU Chao, JIANG Yuan (School of Electronic Science and Technology, Anhui University, Hefei 230039, China)NING Ren-Xia(Electronic Information Engineering, Huangshan University, Huangshan 245021, China) 【机构】 安徽大学电子科学与技术学院 ； 黄山学院电子信息工程系 ；	Web信息提取 ； 知识表示 ； 数据密集型Web页面 ； 基于本体的关键词库 ； web information extraction ； knowledge presentation ； data intensive web pages ； ontology-based keyword library ；	研究了从数据密集型Web页面中自动提取结构化数据并形成知识表示系统的问题。基于知识数据库实现动态页面获取,进行预处理后转换为XML文档,采用基于PAT-array的模式发现算法自动发现重复模式,结合基于本体的关键词库自动识别页面数据显示结构模型,利用XML的对象-关系映射技术将数据存入知识数据库,由此实现Web数据自动抽取。同时,利用知识数据库已有知识从互联网抽取新知识,达到知识数据库的自扩展。以交通信息自动抽取及混合交通出行方案生成与表示系统进行的实验表明该系统具有高抽取准确率和良好的适应性。	2010年09期_Web信息抽取及知识表示系统的研究与实现.pdf	http://sso.cdclib.org/interlibSSO/goto/6/=06190596Z93/kcms/detail/detail.aspx?dbCode=cjfq&filename=XTYY201009002&dbname=CJFD0910
融合Google Earth的船舶监控与应急系统的设计	计算机系统应用	2010	2010年09期	【作者】 杜秀川 ； 徐惠民 ； 李强 ；		海上船舶监控与应急救援系统是基于全球定位系统(GPS)、地理信息系统(GIS)、遥感技术(RS)、信息管理系统(MIS)和网络技术,来实现海洋船舶的定位、救援、搜索和信息综合服务,依据GIS信息管理与处理平台构筑数字海洋实时动态数字化的现代技术体系[1]。选择一个优秀的GIS服务平台,构建完整的监控与应急救援系统服务模型是系统开发的关键。1引言在Google Earth软件提供的三维虚拟地球场景的基础上,完整设计并实现了该系统的用户数据接收层、中间处理层和发布层部分,可以充分满足各类船舶的监控和安全救助需要。整套监控与应急系统设计框图如图1。各类船舶携带有低功耗的卫星通信终端和GPS定位系统,	2010年09期_融合Google+Earth的船舶监控与应急系统的设计.pdf	http://sso.cdclib.org/interlibSSO/goto/6/=06190596Z93/kcms/detail/detail.aspx?dbCode=cjfq&filename=XTYY201009003&dbname=CJFD0910
面向安全生产综合监管系统的工作流引擎	计算机系统应用	2010	2010年09期	【作者】 滕飞 ； 廉东本 ；		本引擎研制背景基于沈阳市安全生产监管系统项目。该系统主要用于对市辖区内所有企业的生产活动进行监督管理,对事故进行模拟、预测分析、调度、救援、进行统一处理等。该系统的很多关键业务不仅能够处理日常的业务流程,而且能够通过各种技术手段提供决策支持。并且为了直观形象,系统引入了GIS技术,在提供决策的同时也能够用GIS技术提供非常直观的地图服务。该系统中存在很多诸如救援分析之类的关键业务,这类业务都涉及了大量的GIS服务。在系统的建设过程中,引入了工作流技术。因为现有的开源工作流引擎很难直接集成处理GIS业务,所以我们通过对安全生产监管领域中关键业务的实际开发需求的分析,设计并实现了一个轻量级嵌入式工	2010年09期_面向安全生产综合监管系统的工作流引擎.pdf	http://sso.cdclib.org/interlibSSO/goto/6/=06190596Z93/kcms/detail/detail.aspx?dbCode=cjfq&filename=XTYY201009004&dbname=CJFD0910
一种基于Web服务的RIA系统集成的应用	计算机系统应用	2010	2010年09期	【作者】 曲海成 ； 李洋 ； 【Author】       QU Hai-Cheng, LI Yang (College of Software, Liaoning Technical University, Huludao 125105, China) 【机构】 辽宁工程技术大学软件学院 ；	Web服务 ； 富互联网应用 ； 系统集成 ； 数字签名 ； 加密 ； Web services ； RIA ； system integration ； digital signature ； encryption ；	将Flex与Web服务相结合构建RIA(Rich Internet Application,富互联网应用)系统集成,利用Web服务将应用系统中业务流程逻辑封装为标准服务,通过服务的发布与发现机制,实现企业数据资源共享;利用加密算法对传输报文数字签名和加密;利用Flex为用户提供统一的富客户端用户界面,实现高度互动性和响应性的客户端,丰富用户体验;利用模块Modules方式、导航方式、动态加载组件方式,组件重用方式等重构Flex表示层,提高系统性能,并与J2EE相整合,验证Flex与Web服务相结合构建RIA系统集成的可行性,合理性。	2010年09期_一种基于Web服务的RIA系统集成的应用.pdf	http://sso.cdclib.org/interlibSSO/goto/6/=06190596Z93/kcms/detail/detail.aspx?dbCode=cjfq&filename=XTYY201009005&dbname=CJFD0910
