title	journal_name	year	issue	author	keywords	summary	pdf_filename	article_url
Linux下自动化测试执行管理工具的设计与实现	计算机系统应用	2010	2010年04期	【作者】 韩涛 ； 高静 ； 【Author】       HAN Tao,GAO Jing(School of Computer Science and Technology,Beihang University,Beijing 100191,China) 【机构】 北京航空航天大学计算机学院 ；	测试自动化 ； 测试执行管理 ； 测试执行过程 ； 测试资源 ； test automation ； test execution management ； test execution process ； test resource ；	测试自动化是提高软件测试效率的重要途径。尽管各种测试工具具有强大的执行功能,但没有对测试过程和测试资源进行有效的管理。设计并实现了一个Linux下的自动化测试执行管理工具,侧重于测试执行管理和测试资源管理,并详细阐述了其总体构架、模块设计和关键技术。	2010年04期_Linux下自动化测试执行管理工具的设计与实现.pdf	http://sso.cdclib.org/interlibSSO/goto/6/=06190596Z93/kcms/detail/detail.aspx?dbCode=cjfq&filename=XTYY201004028&dbname=CJFD0910
基于C8051F040的数据传输嵌入式系统开发	计算机系统应用	2010	2010年04期	【作者】 刘敬彪 ； 艾勇福 ； 盛庆华 ； 【Author】       LIU Jing-Biao,AI Yong-Fu,SHENG Qing-Hua (Electronic Information Institution,Hangzhou Dianzi University,Hangzhou 310018,China) 【机构】 杭州电子科技大学电子信息学院 ；	嵌入式设备 ； 计算机 ； C8051F040单片机 ； 数据传输 ； 总线接口 ； embedded devices ； computer ； c8051f040 single chip ； data transmission ； bus interface ；	为了解决嵌入式设备与计算机不能直接互联通信或者通信距离短的问题,基于C8051F040单片机和高速UART串行端口及其内置CAN控制器,开发一套适合多种总线接口配置要求的通用数据传输嵌入式系统。该系统具有总线接口配置灵活、数据及事物处理能力强等特点,具有一定的通用性。本系统已成功应用于深海取样钻机监控系统中各功能模块相互数据传输,系统运行稳定、可靠。	2010年04期_基于C8051F040的数据传输嵌入式系统开发.pdf	http://sso.cdclib.org/interlibSSO/goto/6/=06190596Z93/kcms/detail/detail.aspx?dbCode=cjfq&filename=XTYY201004029&dbname=CJFD0910
基于遗传算法的库存仿真及优化	计算机系统应用	2010	2010年04期	【作者】 刘丽娜 ； 古平 ； 杨佳登 ； 【Author】       LIU Li-Na,GU Ping,YANG Jia-Deng (Department of Computer,Chongqing University,Chongqing 400044,China) 【机构】 重庆大学计算机学院 ；	仿真优化 ； 遗传算法 ； 种间竞争 ； 仿真实例 ； 仿真分析 ； simulation optimization ； genetic algorithm ； competition between populations ； simulation example ； simulation analysis ；	为使成本费用的总和最小,利用仿真优化技术,以某制造企业为例建立了一种随机需求库存模型,并运用改进的遗传算法优化库存模型,得到了库存的优化候选策略。实例表明提出的仿真优化技术是有效可行的,可以为企业提供决策支持。	2010年04期_基于遗传算法的库存仿真及优化.pdf	http://sso.cdclib.org/interlibSSO/goto/6/=06190596Z93/kcms/detail/detail.aspx?dbCode=cjfq&filename=XTYY201004030&dbname=CJFD0910
基于科学计算可视化技术的电网调度系统应用	计算机系统应用	2010	2010年04期	【作者】 张菁 ； 蒋愈勇 ； 王化龙 ； 【Author】       ZHANG Jing,JIANG Yu-Yong,WANG Hua-Long (Guangxi Electric Power Industry Investigation Design and Research Institute,Nanning 530023,China) 【机构】 广西电力工业勘察设计研究院数字电网研究中心 ；	科学计算可视化技术 ； 电网调度 ； 电网控制决策 ； 可视化平台 ； visualization in scientifc computing ； power grid dispatch ； power grid control decision ； visualization platform ；	科学计算可视化技术(Visualization in Scientific Computing),是一门融合了包括图形学、图象处理、数据管理、网络技术、人机界面等多个计算机学科在内的综合技术。由于电力科学具有数据量大、分析复杂等特点,科学计算可视化技术与电力系统的结合有着广阔的应用前景。介绍了一种基于科学计算可视化技术实现的电网综合调度系统,该系统将对保障电力系统的安全运行,提高电网调度的科学决策水平提供有力保障。	2010年04期_基于科学计算可视化技术的电网调度系统应用.pdf	http://sso.cdclib.org/interlibSSO/goto/6/=06190596Z93/kcms/detail/detail.aspx?dbCode=cjfq&filename=XTYY201004031&dbname=CJFD0910
文件运动轨迹追踪技术的研究及实现	计算机系统应用	2010	2010年04期	【作者】 王文宇 ； 【Author】       WANG Wen-Yu (The Chinese Academy of Science,Beijing 100049,China) 【机构】 中国科学院研究生院 ；	文件系统过滤驱动 ； 透明加密 ； 运动轨迹 ； 追踪 ； 审计 ； file system filter driver ； transparent encrypt ； trajectory ； tracing ； audit ；	详细阐述了文件运动轨迹追踪技术的实现方法,并提供基于该技术的文件运动轨迹追踪系统的解决方案。利用Windows文件系统过滤驱动对文件透明加密,并追踪文件运动轨迹。追踪文件离开工作安全域后,无法使用;在工作安全域内,只允许满足安全策略的进程操作追踪文件,其他进程则拒绝访问。对追踪文件的任何操作,文件运动轨迹追踪系统均记录日志并上传至服务器,既保证实时监控文件流向,杜绝危险性的操作,又便于以后对操作信息进行统计分析和审计。	2010年04期_文件运动轨迹追踪技术的研究及实现.pdf	http://sso.cdclib.org/interlibSSO/goto/6/=06190596Z93/kcms/detail/detail.aspx?dbCode=cjfq&filename=XTYY201004032&dbname=CJFD0910
IEEE1451.4在机器人足部感知系统中的应用	计算机系统应用	2010	2010年04期	【作者】 蔡永娟 ； 沈春山 ； 吴仲城 ； 申飞 ； 【Author】       CAI Yong-Juan1,2,SHEN Chun-Shan3,WU Zhong-Cheng1,3,SHEN Fei1,3(1. Institute of Intelligent Machines,CAS,Hefei230031,China;2. Automation Department,University of Technology and Science of China,Hefei230026,China;3. High Magnetic Field Laboratory,Chinese Academy of Science,Hefei 230031,China) 【机构】 中国科学院合肥智能机械研究所 ； 中国科技大学自动化系 ； 中国科学院强磁场科学中心 ；	IEEE1451.4 ； TEDS ； Labview ； 机器人感知 ； IEEE1451.4 ； TEDS ； Labview ； robot perception ；	针对机器人传感器接口复杂多样的现状,提出了机器人传感器接口标准化的方案。通过赋予传感器电子表单TEDS(Transducer Electronic Data Sheet),实现了机器人传感器的智能化,改善了由于不同传感器之间的异构性带来的诸多问题,将该接口标准用于机器人足部感知系统,并用Labview开发了其电子表单的读写及配置软件,实现了传感器的即插即用。	2010年04期_IEEE1451.4在机器人足部感知系统中的应用.pdf	http://sso.cdclib.org/interlibSSO/goto/6/=06190596Z93/kcms/detail/detail.aspx?dbCode=cjfq&filename=XTYY201004033&dbname=CJFD0910
基于差异化存储的时空数据库的设计与实现	计算机系统应用	2010	2010年04期	【作者】 王宇清 ； 李建 ； 唐开山 ； 吴军 ； 罗光红 ； 【Author】       WANG Yu-Qing,LI Jian,TANG Kai-Shan,WU Jun,LUO Guang-Hong (School of Computer Science,Southwest Petroleum University,Chengdu 610500,China) 【机构】 西南石油大学计算机科学学院 ；	时态GIS ； 差异化 ； 版本管理 ； 时空数据库 ； 数据模型 ； temporal GIS ； difference ； version management ； spatiotemporal database ； data model ；	首先简要分析了时空数据库的功能和特点及几种典型的时空数据模型。然后在面向对象时空数据模型的基础上引入了差异化版本存储的概念,讨论了借助版本差异信息设计一种历史数据冗余小,当前数据利用率高的时空数据模型的基本方法。最后实现了一个具有基本时态功能且能有效平衡数据库存储容量和系统执行效率的地理信息管理系统。	2010年04期_基于差异化存储的时空数据库的设计与实现.pdf	http://sso.cdclib.org/interlibSSO/goto/6/=06190596Z93/kcms/detail/detail.aspx?dbCode=cjfq&filename=XTYY201004034&dbname=CJFD0910
连通域标记并行算法在多核处理器上的设计和实现	计算机系统应用	2010	2010年04期	【作者】 张健 ； 徐茂兴 ； 【Author】       ZHANG Jian,XU Mao-Xing(College of Computer,Zhejiang University of Technology,Hangzhou 310023,China) 【机构】 浙江工业大学计算机学院 ；	连通域标记 ； 多核处理器 ； 图像分割 ； 并行 ； 游程码 ； connected component labeling ； multi-core processor ； image segmentation ； parallel ； run-length encoding ；	为满足全方位视觉运动目标检测跟踪系统中检测和跟踪实时性的要求,采用多核程序设计和并行处理技术,对系统中连通域标记算法,重新进行了设计和实现。为解决由图像分割造成的连通域的分离,应用边界处的游程码,将两个不同任务块中分割处的连通域合并成一个连通域。最后通过实验证明该并行算法比传统算法在多核处理器上运行更快,更好地解决了多核处理器饥饿问题,让多核处理器发挥了更高的效率。	2010年04期_连通域标记并行算法在多核处理器上的设计和实现.pdf	http://sso.cdclib.org/interlibSSO/goto/6/=06190596Z93/kcms/detail/detail.aspx?dbCode=cjfq&filename=XTYY201004035&dbname=CJFD0910
一种面向机器人的超市形态建模方法	计算机系统应用	2010	2010年04期	【作者】 杨淮清 ； 余冠华 ； 刘童 ； 薛明昊 ； 【Author】       YANG Huai-Qing,YU Guan-Hua,LIU Tong,XUE Ming-Hao (Shenyang University of Technology,Shenyang 110078,China) 【机构】 沈阳工业大学 ；	环境建模 ； 形态建模 ； 多知识结构 ； 机器人学 ； 超市管理 ； environmental modeling ； morphology modeling ； multi-knowledge structure ； robotics ； supermarket managemen ；	结合超市经营客观实际,围绕环境、商品、货架形态建模过程遇到的体系结构、关键症结解决对策等展开深入讨论,给出了问题处置策略、指导原则与技术路线。	2010年04期_一种面向机器人的超市形态建模方法.pdf	http://sso.cdclib.org/interlibSSO/goto/6/=06190596Z93/kcms/detail/detail.aspx?dbCode=cjfq&filename=XTYY201004036&dbname=CJFD0910
OSEK/VDX嵌入式实时操作系统在汽车稳定性控制器中的应用	计算机系统应用	2010	2010年04期	【作者】 郜文 ； 李继来 ； 梁华为 ； 【Author】       GAO Wen1,2,LI Ji-Lai1,2,LIANG Hua-Wei1(1. Institute of Intelligent Machines,Chinese Academy of Sciences,Hefei 230031,China;2. University of Science and Technology of China,Hefei 230027,China) 【机构】 中国科学院合肥智能机械研究所 ； 中国科学技术大学自动化系 ；	OSEK/VDX ； 嵌入式 ； 实时 ； 操作系统 ； 汽车稳定性控制器 ； OSEK/VDX ； embedded ； real-time ； operating system ； vehicle stability controller ；	根据OSEK/VDX标准设计嵌入式实时操作系统,侧重于任务管理,资源管理部分的实现。并在自主开发的汽车稳定性控制器硬件在环仿真平台上进行验证。实验结果表明,在该操作系统上开发系统可以有效地提高实时性和稳定性,能够满足汽车稳定性控制器的要求。	2010年04期_OSEK+VDX嵌入式实时操作系统在汽车稳定性控制器中的应用.pdf	http://sso.cdclib.org/interlibSSO/goto/6/=06190596Z93/kcms/detail/detail.aspx?dbCode=cjfq&filename=XTYY201004037&dbname=CJFD0910
基于正交实验的蚁群算法在车间调度问题中的应用	计算机系统应用	2010	2010年04期	【作者】 张晓玲 ； 杨健 ； 杜英国 ； 【Author】       ZHANG Xiao-Ling,YANG Jian,DU Ying-Guo(Department of Computer Science and Mathematics,Dali University,Dali 671003,China) 【机构】 大理学院数学与计算机学院 ；	蚁群算法(Ant Colony Algorithms) ； 车间调度问题(J0b Shop Scheduling Problem) ； 正交实验 ； 正交表 ； ant colony algorithm(ASA) ； job-shop scheduling problem (JSP) ； orthogonal experiment ； orthogonal table ；	提出用正交实验的方法来设置蚁群算法在求解车间调度问题的参数。蚁群算法在求解车间调度问题时的性能大部分依赖于参数的设置,各参数的值不同,则蚁群算法的收敛速度和得到的解也不同,使用正交实验的方法来测试各个参数对蚁群算法性能的影响,通过对实验结果的分析可得出参数的最佳组合方案。用经典的JSP的样例对这种组合方案进行了测试,实验结果表明用正交实验法得到的蚁群算法的参数设置方案可以加快算法的收敛速度,使算法能够得到问题的最优解或近似最优解。	2010年04期_基于正交实验的蚁群算法在车间调度问题中的应用.pdf	http://sso.cdclib.org/interlibSSO/goto/6/=06190596Z93/kcms/detail/detail.aspx?dbCode=cjfq&filename=XTYY201004038&dbname=CJFD0910
神经网络挖掘模型在水电评标决策支持中的应用	计算机系统应用	2010	2010年04期	【作者】 曲俊华 ； 汪萌 ； 【Author】       QU Jun-Hua,WANG Meng (Department of Computer Science and Technology,North China Electric Power University,Beijing 102206,China) 【机构】 华北电力大学计算机科学与技术系 ；	神经网络 ； 数据挖掘 ； 招投标 ； 决策支持 ； 商务智能 ； neutral net ； data mining ； bidding ； decision support ； business intelligence ；	水电项目评标决策支持系统克服传统评标主观性和不确定性的弊端,充分利用历史评标数据,为水电工程项目中的评标环节提供决策支持。提出了基于神经网络算法的数据挖掘模型,分析和研究了模型特点及建立过程,并将其应用于水电工程项目评标决策支持系统中,结合水电项目招投标的实际业务需要,实现了一个公正合理的水电项目评标决策支持系统。	2010年04期_神经网络挖掘模型在水电评标决策支持中的应用.pdf	http://sso.cdclib.org/interlibSSO/goto/6/=06190596Z93/kcms/detail/detail.aspx?dbCode=cjfq&filename=XTYY201004039&dbname=CJFD0910
基于Robot测试框架的关键字驱动的研究与应用	计算机系统应用	2010	2010年04期	【作者】 黄得女 ； 刘敬彪 ； 嵇斌 ； 【Author】       HUANG De-Nv1,LIU Jing-Biao1,JI Bin2 (1. College of Electronic Information,Hangzhou Dianzi University,Hangzhou 310037,China 2. H3C Technology Company,Hangzhou 310053,China) 【机构】 杭州电子科技大学电子信息学院 ； 杭州华三通信技术有限公司 ；	Robot测试框架 ； 关键字 ； 自动化测试 ； robot testing framework ； keyword-driven ； automatic testing ；	为了有效提高软件的测试效率,通过对自动化测试技术之间优缺点比较,结合Web的特点和业务流程,提出了一种基于Robot测试框架的关键字驱动技术。在此技术的基础上,设计并实现了将Robot测试框架运行于RFT等测试工具,实现了测试脚本生成、测试执行与测试报告生成自动化,大大提高了自动化测试效率,保证了软件质量。	2010年04期_基于Robot测试框架的关键字驱动的研究与应用.pdf	http://sso.cdclib.org/interlibSSO/goto/6/=06190596Z93/kcms/detail/detail.aspx?dbCode=cjfq&filename=XTYY201004040&dbname=CJFD0910
企业数据信息交换的安全策略	计算机系统应用	2010	2010年04期	【作者】 林碧英 ； 吴优 ； 【Author】       LIN Bi-Ying,WU You (Department of Computer Science and Technology,North China Electricity Power University,Beijing 102206,China) 【机构】 华北电力大学计算机科学与技术系 ；	SSL ； XML ； 安全 ； 加密 ； 数据交换 ； SSL ； XML ； security ； encrypt ； data exchange ；	在现代企业应用中,多个应用系统或者同一个系统的多个用户之间往往需要进行数据信息交换,如何保证数据传输中的安全变得越来越重要。讲述了如何利用SSL加密和XML加密保证数据交换安全的方案设计以及具体实现。并用实例予以了验证,有一定的实际意义。	2010年04期_企业数据信息交换的安全策略.pdf	http://sso.cdclib.org/interlibSSO/goto/6/=06190596Z93/kcms/detail/detail.aspx?dbCode=cjfq&filename=XTYY201004041&dbname=CJFD0910
ORACLE数据库SQL优化原则	计算机系统应用	2010	2010年04期	【作者】 郭珉 ； 【Author】       GUO Min (School of Information Management,Shanxi University of Finance and Economics,Taiyuan 030006,China) 【机构】 山西财经大学信息管理学院 ；	Oracle数据库 ； SQL ； 性能优化 ； 优化器 ； 共享池 ； oracle database ； SQL ； performance tuning ； optimizer ； shared buffer pool ；	Oracle数据库是当前应用最广泛的大型数据库之一,其系统结构复杂,性能受多方面因素影响,其中SQL语句的执行效率是影响其性能的关键因素。以一个省级通信运营商的ORACLE ERP系统为例,从ORACLE数据库的SQL共享原理和SQL执行过程入手,指出合理配置数据库参数,提高SQL语句共享、提高数据缓存命中率是SQL语句性能提高的前提;并在此基础提出了SQL语句优化的四个原则。	2010年04期_ORACLE数据库SQL优化原则.pdf	http://sso.cdclib.org/interlibSSO/goto/6/=06190596Z93/kcms/detail/detail.aspx?dbCode=cjfq&filename=XTYY201004042&dbname=CJFD0910
一种Windows平台下本地进程间过程调用的实现方法及其应用	计算机系统应用	2010	2010年04期	【作者】 肖利平 ； 【Author】       XIAO Li-Ping (Unit 91655 of People’s Liberation Army of China,Beijing 100036,China) 【机构】 91655部队 ；	Windows平台 ； 内存映射文件 ； 进程间过程调用 ； Windows platform ； memory mapping file ； process internal procedure call ；	在实际的应用软件开发工作中可能需要为下面的情形提供一种解决方案:有一簇结构非常复杂的功能函数集,有若干个不同的应用都需要利用这一簇功能集来实现相应的功能。如何完成上述情形的开发工作,有很多可选方案。提出了一种进程间过程调用的实现方法,并就如何把此方法应用于上述问题的解决以及在实际开发中应该注意的问题进行了阐述。	2010年04期_一种Windows平台下本地进程间过程调用的实现方法及其应用.pdf	http://sso.cdclib.org/interlibSSO/goto/6/=06190596Z93/kcms/detail/detail.aspx?dbCode=cjfq&filename=XTYY201004043&dbname=CJFD0910
异常农产品价格数据的检测	计算机系统应用	2010	2010年04期	【作者】 应磊 ； 王儒敬 ； 杨紫微 ； 苏雅茹 ； 【Author】       YING Lei1,2,WANG Ru-Jing1,YANG Zi-Wei1,2,SU Ya-Ru1,2 (1.Institute of Intelligent Machines,Chinese Academy of Science,Hefei 230031,China;2. Department of Automation,University of Science and Technology of China,Hefei 20027,China) 【机构】 中国科学院合肥智能机械研究所 ； 中国科学技术大学自动化系 ；	异常数据 ； 检测 ； 垂直搜索 ； 农业 ； 价格数据 ； abnormal data ； detecting vertical search engines ； agriculture ； price data ；	农业垂直搜索引擎中的价格数据来源于各个农业网站,由于多种因素,采集到的数据中存在大量异常数据。同时,采集到的农产品价格数据具有其自身的特点,这些特点使得传统的异常数据检测方法不能够很好的工作。针对搜索引擎采集到的海量农产品价格数据,提出了一种异常价格数据的检测方法。实际应用表明,该方法能够取得很好的效果。	2010年04期_异常农产品价格数据的检测.pdf	http://sso.cdclib.org/interlibSSO/goto/6/=06190596Z93/kcms/detail/detail.aspx?dbCode=cjfq&filename=XTYY201004044&dbname=CJFD0910
基于变化概率的网络选课系统公平算法	计算机系统应用	2010	2010年04期	【作者】 张戈 ； 【Author】       ZHANG Ge (China Youth University for Political Sciences,Beijing 100089,China) 【机构】 中国青年政治学院计算机教学与应用中心 ；	选课算法 ； 变化概率 ； 公平性 ； 网络拥堵 ； algorithms of Web course selection-arrangement system ； varied probability ； the equity problem ； network congestion ；	网络选课系统研发工作的重点和难点就是找到一种算法既能充分体现选课活动的公平性又能很好地解决大批量并发访问系统带来的网络拥堵问题。对现有选课算法进行了分析和研究,提出并详细阐述用于实时选课系统的一种新算法——基于变化概率的公平算法。该算法使得每个学生在选课活动当中能拥有趋于均等的选课概率,从而使选课活动在最大程度上实现了公平性原则并极大的缓解了网络拥堵问题。	2010年04期_基于变化概率的网络选课系统公平算法.pdf	http://sso.cdclib.org/interlibSSO/goto/6/=06190596Z93/kcms/detail/detail.aspx?dbCode=cjfq&filename=XTYY201004045&dbname=CJFD0910
基于UML活动图生成系统测试场景的方法	计算机系统应用	2010	2010年04期	【作者】 王志坚 ； 金春 ； 【Author】       WANG Zhi-Jian,JIN Chun(College of Computer & Information Engineering,Hehai University,Nanjing 210098,China) 【机构】 河海大学计算机及信息工程学院 ；	活动图 ； 测试场景 ； 统一建模语言 ； 覆盖准则 ； 完全并发块 ； activity diagram ； test scenario ； unified modeling language ； coverage rules ； fully concurrent block ；	旨在研究运用统一建模语言(UML)活动图生成测试场景的方法。首先对UML活动图进行了形式化定义,确定了一系列覆盖准则。然后,根据覆盖准则制定活动图的一般处理思路,针对活动图中并发结构提出采用信号量和嵌套分割的方法进行处理。该方法有效控制了测试场景集的数量,为UML活动图的自动化测试提供了系统的、有效的、可行的方法。	2010年04期_基于UML活动图生成系统测试场景的方法.pdf	http://sso.cdclib.org/interlibSSO/goto/6/=06190596Z93/kcms/detail/detail.aspx?dbCode=cjfq&filename=XTYY201004046&dbname=CJFD0910
支持脚本嵌入的Web工作流的研究与实现	计算机系统应用	2010	2010年04期	【作者】 卢良进 ； 郑民 ； 吴海洪 ； 【Author】       LU Liang-Jin,ZHENG Min,WU Hai-Hong (Department of Modern Education Techonology,Yiwu Industrial & Commercial College,Yiwu 322000,China) 【机构】 义乌工商学院现代教育技术处 ；	工作流 ； 脚本 ； Web ； 表单 ； 用户自定义 ； workflow ； script ； Web ； form ； user-defined ；	分析了预编译工作流与Web表单工作流模型的优缺点,提出了两者相结合的支持在活动中嵌入解释性脚本的Web工作流模型,实现了活动业务逻辑与工作流系统的分离,使用户可以在不修改工作流基础设施的情况下,实现对流程活动的用户界面、业务逻辑及活动流向的完全自定义。实践证明,该模型具有较高的可扩展性和可重用性。	2010年04期_支持脚本嵌入的Web工作流的研究与实现.pdf	http://sso.cdclib.org/interlibSSO/goto/6/=06190596Z93/kcms/detail/detail.aspx?dbCode=cjfq&filename=XTYY201004047&dbname=CJFD0910
基于BCV和LogMiner实现增量数据抽取的应用	计算机系统应用	2010	2010年04期	【作者】 杨从法 ； 宋兴彬 ； 【Author】       YANG Cong-Fa1,SONG Xing-Bin2(1. Information Center of Zibo State Tax Bureau,Zibo 255047,China;2. Information Center of Shandong State Tax Bureau,Jinan,250002,China) 【机构】 淄博市国家税务局信息中心 ； 山东省国家税务局信息中心 ；	数据抽取 ； 业务持续性卷 ； 重做日志 ； 归档日志 ； 增量抽取 ； data extraction ； business continuance volume ； redo log ； archived log ； incremental data extraction ；	介绍了不同数据抽取方式的优缺点,基于EMC存储联机业务持续性卷BCV数据备份和Oracle LogMiner分析归档日志原理,分析了数据抽取复制方案,实现了省级数据集中应用生产环境到分析平台中增量数据抽取。	2010年04期_基于BCV和LogMiner实现增量数据抽取的应用.pdf	http://sso.cdclib.org/interlibSSO/goto/6/=06190596Z93/kcms/detail/detail.aspx?dbCode=cjfq&filename=XTYY201004048&dbname=CJFD0910
QoS二次流量监管实现	计算机系统应用	2010	2010年04期	【作者】 邢海飞 ； 郭裕顺 ； 【Author】       XING Hai-Fei,GUO Yu-Shun (School of Electronics & Information,Hangzhou Dianzi University,Hangzhou 310018,China) 【机构】 杭州电子科技大学电子信息学院 ；	服务质量 ； 流量监管 ； 约定访问速率 ； 分层QoS ； 以太网交换机 ； quality of service ； traffic policing ； CAR (committed access rate) ； hierarchical QoS ； ethernet switch ；	流量监管TP(Traffic Policing)就是对流量进行控制,它通过监督进入网络的流量速率,确保进入的流量被限制在一个合理的范围内。为满足网络中多用户多业务对流量监管的要求,通过对QoS流量监管的模式方法CAR(Committed Access Rate,约定访问速率)的分析研究,在路由平台上实现了QoS二次的流量监管功能,经在三层交换机上测试,证明了监管的有效性。	2010年04期_QoS二次流量监管实现.pdf	http://sso.cdclib.org/interlibSSO/goto/6/=06190596Z93/kcms/detail/detail.aspx?dbCode=cjfq&filename=XTYY201004049&dbname=CJFD0910
