title	journal_name	year	issue	author	keywords	summary	pdf_filename	article_url
基于Hibernate实现对异构数据库的集成	计算机系统应用	2005	2005年06期	【作者】 阳王东 ； 唐伟佳 ； 【机构】 中南大学信息科学与工程学院 ； 中科软件集团南方信息产业有限公司 410083 ； 413000 ；	数据集成 ； 映射 ； 数据访问 ； 异构数据库 ；	利用面向对象的hibernate数据访问技术,不但可以利用动态的数据库配置来实现不同物理位置的数据的透明访问,本文通过分析数据集成中数据主题域的划分,建立一套与物理数据结构隔离的数据对象,在此基础上利用类的反射机制的实现算法定义了一套统一的数据访问接口,消除了数据集成中对物理数据结构的依赖。	2005年06期_基于Hibernate实现对异构数据库的集成.pdf	http://sso.cdclib.org/interlibSSO/goto/6/=06190596Z93/kcms/detail/detail.aspx?dbCode=cjfq&filename=XTYY200506014&dbname=CJFD0305
基于Agent的存储区域网络(SAN)智能管理技术	计算机系统应用	2005	2005年06期	【作者】 曾庆辉 ； 【机构】 西南师范大学计算机与信息科学学院 重庆400715 ；	Agent ； SAN ； 网络管理 ； 协同工作 ；	利用Agent技术对存储区域网络(SAN)进行智能管理是一种全新的设想。本文提出了一种基于Agent的存储区域网络的管理体系,各部件本地的管理任务由监控Agent完成,SAN的整体由管理Agent与各监控Agent协同完成,大大减轻了用户管理的负担。而且整个管理体系可伸缩性强,各Agent还具有一定的学习和推理能力, 能够具有智能地完成各种管理任务。	2005年06期_基于Agent的存储区域网络(SAN)智能管理技术.pdf	http://sso.cdclib.org/interlibSSO/goto/6/=06190596Z93/kcms/detail/detail.aspx?dbCode=cjfq&filename=XTYY200506015&dbname=CJFD0305
基于开源软件数据库系统的开发	计算机系统应用	2005	2005年06期	【作者】 解文明 ； 黄少敏 ； 【机构】 汕头大学医学院网络中心 ； 汕头大学医学院网络中心 515041 ； 515041 ；	数据库 ； 软件 ； 开发 ；	文章在分析开源软件开发数据库技术的基础上,论述了采用JSP技术构建高性能、低成本数据库系统时的集成软件及运行环境,重点阐述了利用开源软件开发Web数据库时需要解决的一些问题。	2005年06期_基于开源软件数据库系统的开发.pdf	http://sso.cdclib.org/interlibSSO/goto/6/=06190596Z93/kcms/detail/detail.aspx?dbCode=cjfq&filename=XTYY200506016&dbname=CJFD0305
基于LINUX操作系统的文件服务器	计算机系统应用	2005	2005年06期	【作者】 周晓林 ； 魏茂珍 ； 丁霞 ； 【机构】 安徽省气象台 ； 安徽省气象科技开发中心 ； 安徽省气象台 230031 ； 230031 ； 230031 ；	LINUX ； 文件服务器 ； Windows ； 映射 ； SAMBA应用 ；	通过对LINUX操作系统中的用户、用户所在的组和目录所对应的用户、组所拥有权限之间的组合实现了对用户、组进行目录权限管理。再通过对LINUX的SAMBA应用的分析,实现了Windows系统通过查找计算机后映射盘符的方法来共享LINUX服务器的网络资源。	2005年06期_基于LINUX操作系统的文件服务器.pdf	http://sso.cdclib.org/interlibSSO/goto/6/=06190596Z93/kcms/detail/detail.aspx?dbCode=cjfq&filename=XTYY200506017&dbname=CJFD0305
艺术品拍卖市场行情发布系统的研究与开发	计算机系统应用	2005	2005年06期	【作者】 王小元 ； 【机构】 科学院计算机网络信息中心 100080 ；	发布系统 ； 研究与开发 ； 艺术品拍卖 ； 艺术品投资 ； 艺术品交易 ； 房地产热 ； 文物艺术品 ； 企业应用集成 ； 发布平台 ； 中间件 ；	<正>1 引言艺术品投资,是继金融证券、房地产之后的第三大投资领域。据统计,近10年来,在美国投资领域里, 房地产赢利率在4.7%左右,股票在17%左右,而艺术品投资赢利率则高达24%。在我国,继股票热、房地产热之后,文物艺术品投资市场正如火如茶,交易的数量越来越庞大,交易的记录不断攀升、打破,参与的人群越来越广泛。艺术品交易,已经成为社会经济活动最重要的组成部分。	2005年06期_艺术品拍卖市场行情发布系统的研究与开发.pdf	http://sso.cdclib.org/interlibSSO/goto/6/=06190596Z93/kcms/detail/detail.aspx?dbCode=cjfq&filename=XTYY200506018&dbname=CJFD0305
CorelDRAW自动阅卷的设计和实现	计算机系统应用	2005	2005年06期	【作者】 涂金德 ； 【机构】 温州职业技术学院计算机系 325035 ；	自动阅卷 ； CorelDRAW ； COM对象 ； VB ；	CorelDRAW是目前最流行的矢量图形设计软件之一,已作为证书考试和专业考试的必考软件之一,但人工阅卷工作量大,实现自动阅卷很有必要。文中通过分析CorelDRAW对象模型,找出阅卷有关的COM对象,然后对CorelDRAW各知识要点的测试进行分析,并做相应的测试实验,制定出自动阅卷技术方案,最后用VB设计与实现了自动阅卷功能模块。经真实考试阅卷测试,其阅卷速度快,结果正确,达到阅卷要求。	2005年06期_CorelDRAW自动阅卷的设计和实现.pdf	http://sso.cdclib.org/interlibSSO/goto/6/=06190596Z93/kcms/detail/detail.aspx?dbCode=cjfq&filename=XTYY200506019&dbname=CJFD0305
基于GPRS技术对用电大客户电能量数据管理的实现	计算机系统应用	2005	2005年06期	【作者】 朱建凯 ； 李炜 ； 【机构】 长沙威胜信息技术有限公司 ； 长沙威胜信息技术有限公司 410013 ； 410013 ；	GPRS ； 数据采集 ； 电力负荷管理 ；	本文对用电大户电能量数据采集的背景和业务需求进行了分析,对采用GPRS技术实现电能量数据的技术方案做了详细描述,并结合一个具体的项目介绍了该系统的体系结构;文中对该系统实现的功能和作用也给出了详细说明。	2005年06期_基于GPRS技术对用电大客户电能量数据管理的实现.pdf	http://sso.cdclib.org/interlibSSO/goto/6/=06190596Z93/kcms/detail/detail.aspx?dbCode=cjfq&filename=XTYY200506020&dbname=CJFD0305
基于Oracle的邮件系统的存储优化	计算机系统应用	2005	2005年06期	【作者】 栾杰 ； 【机构】 石油化工科学研究院 100083 ；	LOB ； 数据库碎片 ； 行链接 ； 优化 ；	本文分析了Oracle中大对象(LOB)的存储机理,探讨了LOB字段存储参数的正确配置,提供了多种监控方法,对基于Oracle的邮件系统进行了优化,使数据库存储空间的分配更加合理,提高了系统性能。	2005年06期_基于Oracle的邮件系统的存储优化.pdf	http://sso.cdclib.org/interlibSSO/goto/6/=06190596Z93/kcms/detail/detail.aspx?dbCode=cjfq&filename=XTYY200506021&dbname=CJFD0305
在Visual C#.Net下利用DataGrid控件实现主-从式查询	计算机系统应用	2005	2005年06期	【作者】 韩毅 ； 陈建 ； 张靖波 ； 肖永鹏 ； 【机构】 长春光机物理所、中科院研究生院 ； 北京联合大学生物化学工程学院 ； 东北师范大学计算机学院 ； 东北师范大学计算机学院 130024 东北师范大学计算机学院 130024 ； 100081 ； 长春130024 ； 长春130024 ；	数据库 ； C# ； DataGrid ； 控件 ； 主-从式查询 ；	本文给出一种在C#中利用单一DataGrid控件实现主-从式查询的方法。采用该方法生成的主-从式数据网格在根据主表信息查询明细时具有视觉直观、导航灵活的特点。	2005年06期_在Visual+C#.Net下利用DataGrid控件实现主-从式查询.pdf	http://sso.cdclib.org/interlibSSO/goto/6/=06190596Z93/kcms/detail/detail.aspx?dbCode=cjfq&filename=XTYY200506022&dbname=CJFD0305
局域网计算机状态自动检测的设计与实现	计算机系统应用	2005	2005年06期	【作者】 高成敏 ； 陈良 ； 【机构】 广东警官学院计算机系 ； 广东警官学院计算机系 广州510232 ； 广州510232 ；	ICMP协议 ； 计算机状态 ； 自动检测 ； 局域网 ；	本文设计了一种自动检测计算机状态(包括计算机是否启动,网络是否联通)的方法,并给出可能有故障的计算机列表。采用ICMP (Internet Control Message Protocol,互联网控制报文协议)检测计算机状态,并用Ac- cess数据库进行记录,用C++语言在VC++6.0环境下实现了这种方法。局域网(机房)维护人员可随时检查可能有故障的计算机的列表。该方法及其实现软件对减轻局域网(机房)维护人员的工作具有很大的实用价值。	2005年06期_局域网计算机状态自动检测的设计与实现.pdf	http://sso.cdclib.org/interlibSSO/goto/6/=06190596Z93/kcms/detail/detail.aspx?dbCode=cjfq&filename=XTYY200506023&dbname=CJFD0305
基于WEB的可移动桌面任务管理器的设计与实现	计算机系统应用	2005	2005年06期	【作者】 刘友生 ； 【机构】 广东松山职业技术学院计算机系 512126 ；	ASP ； WEB程序 ； 桌面任务管理器 ； 任务提醒 ； 远程管理 ；	探讨了如何利用ASP程序,结合后台数据库技术,实现了WEB应用程序的桌面化应用,阐述了实现此过程的基本原理,介绍了ASP程序设计的详细步骤。	2005年06期_基于WEB的可移动桌面任务管理器的设计与实现.pdf	http://sso.cdclib.org/interlibSSO/goto/6/=06190596Z93/kcms/detail/detail.aspx?dbCode=cjfq&filename=XTYY200506024&dbname=CJFD0305
基于Delphi的MIDAS分布式体系结构分析与实现	计算机系统应用	2005	2005年06期	【作者】 苏志芳 ； 陈和平 ； 【机构】 武汉科技大学信息科学与工程学院 ； 武汉科技大学信息科学与工程学院 430081 ； 430081 ；	MIDAS ； 多层分布式 ； Delphi ； 无状态对象 ；	本文首先介绍了基于Delphi的MIDAS多层分布式数据库技术的基本特点及其发展历程,然后阐述了MIDAS 三层分布式体系结构工作流程及典型构建过程,最后结合开发实例给出了MIDAS的具体实现方法并对执行效率问题进行了讨论。	2005年06期_基于Delphi的MIDAS分布式体系结构分析与实现.pdf	http://sso.cdclib.org/interlibSSO/goto/6/=06190596Z93/kcms/detail/detail.aspx?dbCode=cjfq&filename=XTYY200506025&dbname=CJFD0305
数据仓库系统综合测试策略的研究	计算机系统应用	2005	2005年06期	【作者】 谷岩 ； 【机构】 广州大学 510091 ；	数据仓库 ； 单元测试 ； 组装集成测试 ； 加载测试 ； 交付测试 ； 测试策略 ；	数据仓库系统的软件测试是一个综合测试过程,本文给出了数据仓库系统的测试策略及测试方法。由于采用的测试方法不可能彻底发现系统的所有错误,因此本文给出了测试终止的标准。	2005年06期_数据仓库系统综合测试策略的研究.pdf	http://sso.cdclib.org/interlibSSO/goto/6/=06190596Z93/kcms/detail/detail.aspx?dbCode=cjfq&filename=XTYY200506026&dbname=CJFD0305
国际	计算机系统应用	2005	2005年06期		计算容量 ； 大型主机 ； 随需应变 ； 中型企业 ； 网络附加存储 ； 副总裁 ； 存储市场 ； 中端产品 ； 联想公司 ； 网络存储 ；	<正>IBM大型主机中端产品为全球领先客户实现随需应变可靠性近日,IBM宣布全球的众多客户正在采用于2004年5 月发布的IBM大型主机面向中型企业的IBM eServer z890系统。现在,IBM向客户交付的z890系统已经达到了与上一代产品z800系统相同的计算容量,而所用的时间仅仅是z800系统达到同一计算容量所用时间的三分之一。IBM eServer z系列副总裁Terri Virnig表示:“z890计划是我们有史以来最成功的z系列计划之一。z890系统提供	2005年06期_国际.pdf	http://sso.cdclib.org/interlibSSO/goto/6/=06190596Z93/kcms/detail/detail.aspx?dbCode=cjfq&filename=XTYY200506027&dbname=CJFD0305
国内	计算机系统应用	2005	2005年06期		合作伙伴计划 ； 区副 ； 渠道策略 ； 市场投入 ； 二三级城市 ； 信息产业 ； 副总裁 ； 信息产品管理 ； 销售能力 ； 渠道拓展 ；	<正>F1领跑2005 IBM eServer x系列公布2005年渠道策略及合作伙伴计划5月24日,以“F1领跑2005”为主题的IBM eServer x 系列2005年渠道策略及合作伙伴计划发布会在北京举行。IBM eServer x系列中国区副总经理孙丹女士介绍了x 系列服务器渠道“F1计划”2004年取得的出色业绩,并公布了2005年新的渠道策略及合作伙伴计划。2004:F1计划加速疾驰,全面支持多方共赢	2005年06期_国内.pdf	http://sso.cdclib.org/interlibSSO/goto/6/=06190596Z93/kcms/detail/detail.aspx?dbCode=cjfq&filename=XTYY200506028&dbname=CJFD0305
基于GIS构建交通规划信息系统	计算机系统应用	2005	2005年05期	【作者】 胥滢波 ； 【机构】 长沙湖南大学 410083北京交通部规划研究院100029 ；	GIS ； 信息系统 ； 交通 ； 规划 ；	交通规划是政府指导交通行业发展的重要依据之一。本文系统分析了交通规划信息系统的总体架构,确定了应用系统的组成及各部分的功能,并基于ArcGIS介绍了系统主要应用功能的技术实现。	2005年05期_基于GIS构建交通规划信息系统.pdf	http://sso.cdclib.org/interlibSSO/goto/6/=06190596Z93/kcms/detail/detail.aspx?dbCode=cjfq&filename=XTYY200505001&dbname=CJFD0305
基于关系数据库的智能教学系统知识库设计	计算机系统应用	2005	2005年05期	【作者】 罗梅 ； 王万森 ； 【机构】 首都师范大学信息工程学院 ； 首都师范大学信息工程学院 100037 ； 100037 ；	智能教学系统 ； 知识库 ； 关系数据库 ； 知识表示 ；	本文通过对知识库和关系数据库的比较,说明了基于关系数据库设计知识库的可行性,并以智能教学系统中知识库的构建过程为例,介绍了知识表示方法,具体给出了基于关系数据库建立知识库的方法,并简要说明了知识库管理和知识获取方法。	2005年05期_基于关系数据库的智能教学系统知识库设计.pdf	http://sso.cdclib.org/interlibSSO/goto/6/=06190596Z93/kcms/detail/detail.aspx?dbCode=cjfq&filename=XTYY200505002&dbname=CJFD0305
基于GIS动态流量渲染的WEB数字视频集成监控系统	计算机系统应用	2005	2005年05期	【作者】 田启明 ； 郑培余 ； 【机构】 温州职业技术学院计算机系 ； 昆明云南大学信息学院计算机科学与技术系 325035昆明云南大学信息学院计算机科学与技术系650091 ； 650091 ；	GIS ； 流量渲染 ； WEB ； 数字视频监控 ；	提高智能交通系统诸多子系统之间的信息共享和互操作集成度是ITS研究的重要内容。本文设计并实现了WEB操作界面的交通信号控制系统与电视监控的紧密集成,通过WebGis界面动态交通流量信息的实时渲染,快速定位交通异常区域,同时显示异常区域MPEG4数字视频图象,辅助疏导交通拥堵,取得了良好的应用效果。	2005年05期_基于GIS动态流量渲染的WEB数字视频集成监控系统.pdf	http://sso.cdclib.org/interlibSSO/goto/6/=06190596Z93/kcms/detail/detail.aspx?dbCode=cjfq&filename=XTYY200505003&dbname=CJFD0305
基于.NET Passport的B2C网站研究与实现	计算机系统应用	2005	2005年05期	【作者】 沈士根 ； 【机构】 嘉兴学院信息工程学院 314001 ；	单一登录 ； .NET Passport ； 身份认证 ； B2C ；	单一登录.NET Passport协议正逐渐成为B2C网站身份认证的关键技术。文章分析了.NET Passport的工作原理,提出了基于.NET Passport的B2C网站逻辑性设计,说明了在开发基于.NET Passport的B2C网站时涉及的关键技术,最后结合授权管理器,给出了具体实现。	2005年05期_基于.NET+Passport的B2C网站研究与实现.pdf	http://sso.cdclib.org/interlibSSO/goto/6/=06190596Z93/kcms/detail/detail.aspx?dbCode=cjfq&filename=XTYY200505004&dbname=CJFD0305
融合下一代电信级IP网的核心引擎-TB级路由器	计算机系统应用	2005	2005年05期	【作者】 曾斌 ； 曾凯 ； 王宇熙 ； 杨英 ； 【机构】 浙江林学院现代教育技术中心 ； 浙江林学院信息工程学院 ； 微创网格信息技术有限公司 311300 ； 311300 ； 310018 ；	电信级IP网 ； TB级核心路由器 ； PAROLI光接口 ； BGP ； SLA ；	本文分析了目前电信级核心网络中存在的急需解决的问题,介绍了T比特路由器作为融合下一代电信级IP 网的核心引擎的各项技术优势以及它是如何解决目前电信级核心网络中存在的问题和如何帮助电信运营商建立下一代电信级IP网的。	2005年05期_融合下一代电信级IP网的核心引擎-TB级路由器.pdf	http://sso.cdclib.org/interlibSSO/goto/6/=06190596Z93/kcms/detail/detail.aspx?dbCode=cjfq&filename=XTYY200505005&dbname=CJFD0305
一类智能系统的自主能力嵌入研究与仿真	计算机系统应用	2005	2005年05期	【作者】 柯宗武 ； 田开坤 ； 汪自云 ； 【机构】 黄石湖北师范学院计算机科学与技术系 ； 黄石湖北师范学院计算机科学与技术系 435002 ； 435002 ； 435002 ；	自主性 ； 高性价比 ； 嵌入机制 ； 有效策略 ；	本文提出了有智能系统的自主性嵌入机制与实现方法,并给出一个仿真实例,是指导高性价比系统设计的有效策略。	2005年05期_一类智能系统的自主能力嵌入研究与仿真.pdf	http://sso.cdclib.org/interlibSSO/goto/6/=06190596Z93/kcms/detail/detail.aspx?dbCode=cjfq&filename=XTYY200505006&dbname=CJFD0305
基于移动IPv6及MBWA的纯IP移动网络实现技术	计算机系统应用	2005	2005年05期	【作者】 蔡茂国 ； 王小民 ； 【机构】 深圳大学信息工程学院 ； 深圳大学信息工程学院 518060 ； 518060 ；	移动IPv6 ； 移动宽带无线接入 ； 纯IP移动通信 ；	介绍了移动IPv6协议对IP移动性的支持,以及IP移动宽带无线接入(MBWA)技术IEEE802.16e及IEEE802. 20标准,探讨了基于IPv6及MBWA结合的纯IP(Pure IP)移动通信网络实现技术。	2005年05期_基于移动IPv6及MBWA的纯IP移动网络实现技术.pdf	http://sso.cdclib.org/interlibSSO/goto/6/=06190596Z93/kcms/detail/detail.aspx?dbCode=cjfq&filename=XTYY200505007&dbname=CJFD0305
一种基于DCT域的图像快速检索技术	计算机系统应用	2005	2005年05期	【作者】 秦军 ； 罗国明 ； 【机构】 解放军理工大学通信工程学院研二队 ； 解放军理工大学通信工程学院电信工程系 ；	DCT ； 压缩域处理 ； 特征提取 ； 纹理描述 ； 图像检索 ；	图像视频压缩标准的出现,使得图像数据格式普遍为压缩格式,从而促进了压缩域内图像检索技术的迅速发展。DCT(Discrete Cosine Transform离散余弦变换)是目前应用最为广泛的多媒体数据压缩技术之一,直接在DCT域进行特征提取,能够避免繁琐的压缩数据编、解码操作,大大减少处理时间和处理量,节省内存空间,使得图像检索更加高效。本文首先说明了DCT变换的定义和DCT域的矩阵运算,最后着重介绍了基于DCT域图像检索技术的一种图像内容快速检索方法。	2005年05期_一种基于DCT域的图像快速检索技术.pdf	http://sso.cdclib.org/interlibSSO/goto/6/=06190596Z93/kcms/detail/detail.aspx?dbCode=cjfq&filename=XTYY200505008&dbname=CJFD0305
Observer模式在JavaGUI中的分析与应用	计算机系统应用	2005	2005年05期	【作者】 雷镇 ； 雷蕾 ； 周淑秋 ； 王华 ； 【机构】 首都师范大学信息工程学院 ； 首都师范大学信息工程学院 100037 ； 100037 ； 100037 ；	设计模式 ； 观察者模式 ； Java图形用户界面 ；	设计模式描述了对象之间如何通信,而且彼此的数据模型和方法没有任何牵连。保持分离始终是优秀的面向对象编程的目标之一。本文以Observer模式为例,具体介绍了Observer模式问题的产生及解决Java GUI组件间的通信。最后以实例说明运用此设计模式带来软件扩充和复用的方便性。	2005年05期_Observer模式在JavaGUI中的分析与应用.pdf	http://sso.cdclib.org/interlibSSO/goto/6/=06190596Z93/kcms/detail/detail.aspx?dbCode=cjfq&filename=XTYY200505009&dbname=CJFD0305
园区网中的IPv6实现及应用	计算机系统应用	2005	2005年05期	【作者】 江魁 ； 张凡 ； 【机构】 深圳市深圳大学网络中心 ； 深圳市深圳大学网络中心 518060 ； 518060 ；	下一代互联网 ； IPv6 ； 园区网 ；	该文结合一个大型园区网中IPv6网络建设项目的探索与实践,探讨了IPv6在园区网中实现及应用的关键技术和难点。首先给出IPv6地址规划原则,随后介绍IPv6接入的实现方法,最后说明IPv6应用的实现。	2005年05期_园区网中的IPv6实现及应用.pdf	http://sso.cdclib.org/interlibSSO/goto/6/=06190596Z93/kcms/detail/detail.aspx?dbCode=cjfq&filename=XTYY200505010&dbname=CJFD0305
模糊理论与信息熵在电力设计行业顾客满意度测评中的应用	计算机系统应用	2005	2005年05期	【作者】 马艳 ； 【机构】 清华大学自动化系 100084 ；	顾客满意度 ； 顾客满意度指数 ； 综合评判法 ； 专家评判法 ； 信息熵 ；	以顾客为中心,实现顾客满意,是企业发展的关键。本文将采用专家评判法、综合评判法与信息理论的知识对现有的电力设计行业的顾客满意度测评系统进行改进,为企业提供更准确的顾客满意度。	2005年05期_模糊理论与信息熵在电力设计行业顾客满意度测评中的应用.pdf	http://sso.cdclib.org/interlibSSO/goto/6/=06190596Z93/kcms/detail/detail.aspx?dbCode=cjfq&filename=XTYY200505011&dbname=CJFD0305
无线移动Ad Hoc网络的路由技术研究	计算机系统应用	2005	2005年05期	【作者】 桂超 ； 孙宝林 ； 王虹 ； 【机构】 武汉湖北经济学院计算机与电子科学系 ； 武汉理工大学计算机学院 ； 武汉湖北经济学院计算机与电子科学系 430205 ； 430070 ； 430205 ；	路由协议 ； 无线通信 ； Ad Hoc网络 ；	无线移动Ad Hoc网络(MANET)作为可移动分布式多跳无线网络,没有预先确定的网络拓扑或网络基础设施以及集中控制。为了在如此的网络中促进通信,路由技术主要用于在节点之间发现路径。Ad Hoc网络路由协议的主要目的是在网络拓扑的动态变化下任意两个节点之间建立一个使得通信总费用和带宽耗费最少的正确和有效的通信路径。在这篇论文中,论述了无线Ad Hoc网络的特性、问题和技术,并通过不同的标准对存在的一些路由协议进行分类和比较。	2005年05期_无线移动Ad+Hoc网络的路由技术研究.pdf	http://sso.cdclib.org/interlibSSO/goto/6/=06190596Z93/kcms/detail/detail.aspx?dbCode=cjfq&filename=XTYY200505012&dbname=CJFD0305
图象信息隐藏检测研究	计算机系统应用	2005	2005年05期	【作者】 周继军 ； 王颖 ； 钮心忻 ； 【机构】 北京邮电大学信息安全中心 ； 北京邮电大学信息安全中心 100876 ； 北京202信箱71分箱102600 ； 100876 ；	信息隐藏 ； 检测 ；	图象信息隐藏检测研究已经成为学术界在网络与信息安全领域中一项重要的攻关课题。本文首先介绍了典型的图象信息隐藏检测算法并给出了算法评价,然后指出了当前图象信息隐藏检测的攻关难点和下一步的研究方向。	2005年05期_图象信息隐藏检测研究.pdf	http://sso.cdclib.org/interlibSSO/goto/6/=06190596Z93/kcms/detail/detail.aspx?dbCode=cjfq&filename=XTYY200505013&dbname=CJFD0305
高效的基于动态数据更新的关联规则挖掘算法	计算机系统应用	2005	2005年05期	【作者】 刘松 ； 林海萍 ； 【机构】 广州广东商学院信息学院 ； 广州广东商学院信息学院 510320 ； 510320 ；	关联规则 ； 动态关联规则挖掘 ； 变动数据 ； 原始数据库 ；	在本文中,我们针对动态关联规则挖掘问题提出两个有效的处理算法,即EIM-A和EIM-G算法。它们能根据数据库的动态变化,高效地进行关联规则的更新。通过知识数据库的维护,最多只需要扫描原始数据库一次,就能得到所需的频繁项目集,能有效地降低更新关联规则所需的成本。	2005年05期_高效的基于动态数据更新的关联规则挖掘算法.pdf	http://sso.cdclib.org/interlibSSO/goto/6/=06190596Z93/kcms/detail/detail.aspx?dbCode=cjfq&filename=XTYY200505014&dbname=CJFD0305
基于AHP-Fuzzy的智能决策模型建立及应用	计算机系统应用	2005	2005年05期	【作者】 胡子义 ； 彭岩 ； 【机构】 首都师范大学信息工程学院 ； 首都师范大学信息工程学院 100037河南许昌学院计算机科学系461000 ； 100037 ；	智能决策 ； 指标体系 ； 层次分析法 ； 模糊评估 ；	决策系统所研究的首要问题是决策模型的建立,其中智能化技术的应用尤为重要。本文提出了AHP和Fuzzy技术相结合的方法较好地解决了决策模型的建立问题,这为类似问题的解决提供了一种行之有效的办法。文末还通过相应的实证分析说明了该方法在实际决策中的应用。	2005年05期_基于AHP-Fuzzy的智能决策模型建立及应用.pdf	http://sso.cdclib.org/interlibSSO/goto/6/=06190596Z93/kcms/detail/detail.aspx?dbCode=cjfq&filename=XTYY200505015&dbname=CJFD0305
