title	journal_name	year	issue	author	keywords	summary	pdf_filename	article_url
中小规模低成熟度软件企业的项目风险管理	计算机系统应用	2003	2003年10期	【作者】 方德英 ； 李敏强 ； 【机构】 天津大学管理学院 ； 天津大学管理学院 300072 洛阳 河南科技大学经济与管理学院 471003 ； 300072 ；	软件开发企业 ； 项目风险管理 ； 软件开发环境 ； 成熟度 ； 信息技术系统 ； 一级企业 ； 计划进度 ； 小规模企业 ； 经验估计 ； 统计资料 ；	<正> 1 问题的提出 伴随着网络时代的到来和信息经济的涌现,社会对信息技术系统产生了空前的需求,于是也催生了众多水平参差不齐、规模大小不一的软件开发企业。统计资料显示[1],我国软件企业绝大多数规模偏小、成熟度等级不高:55％的企业拥有不足50名员工,42％的拥有50～200名员工。软件企业中达到事实上的国际标准“软件能力成熟度(CMM1.1版本)”二级水平的企业只有区	2003年10期_中小规模低成熟度软件企业的项目风险管理.pdf	http://sso.cdclib.org/interlibSSO/goto/6/=06190596Z93/kcms/detail/detail.aspx?dbCode=cjfq&filename=XTYY200310001&dbname=CJFD0305
移动定位技术和移动定位系统	计算机系统应用	2003	2003年10期	【作者】 孙巍 ； 王行刚 ； 【机构】 中国科学院计算所 ； 中国科学院计算所 100080 ； 100080 ；	移动互联网 ； 定位技术 ； 移动通信 ；	移动终端的位置是移动互联网中的关键信息。本文从移动定位技术、典型的移动定位系统及当前研究热点等方面对其进行了阐述。	2003年10期_移动定位技术和移动定位系统.pdf	http://sso.cdclib.org/interlibSSO/goto/6/=06190596Z93/kcms/detail/detail.aspx?dbCode=cjfq&filename=XTYY200310002&dbname=CJFD0305
基于JAVA的移动电子商务	计算机系统应用	2003	2003年10期	【作者】 雷敏 ； 宋茂强 ； 杨榆 ； 【机构】 北京邮电大学软件学院 ； 北京邮电大学软件学院 100876 ； 100876 ； 100876 ；	移动电子商务 ； J2ME ； 无线互联网 ； JAVA ；	移动电子商务已经引起市场上的一场革命,而且在很大的程度上影响和改变了商品交易的场所和时间。移动设备,特别是手机、无线网络使得数以百万计的用户可以访问到这个无线市场。这个巨大的市场激发了很多针对移动用户开发的众多增值业务。在这篇文章中介绍了移动电子商务的概念、移动电子商务发展的动力,并且提出了一个基于无线JAVA的移动电子商务框架。	2003年10期_基于JAVA的移动电子商务.pdf	http://sso.cdclib.org/interlibSSO/goto/6/=06190596Z93/kcms/detail/detail.aspx?dbCode=cjfq&filename=XTYY200310003&dbname=CJFD0305
一种实用的DGPS设计方法与现场智能单元	计算机系统应用	2003	2003年10期	【作者】 邬春学 ； 余镇危 ； 【机构】 中国矿业大学 ； 中国矿业大学 100083 湖北荆州 江汉石油学院 434023 ； 100083 ；	DGPS ； 智能现场单元 ； 河海航道 ；	本文介绍了一种实用的差分GPS即DGPS、无线数据通信与现场智能仪表相结合的基本工作原理,重点分析了DGPS计算方法和计算机实现。文中还以河海航道管理应用为例,根据其特殊环境,提出了差分定位的软件编程基本思路、系统的设计方法、数据通信协议等。该系统运行稳定、可靠,目前正在油田、河海航道部门推广使用。	2003年10期_一种实用的DGPS设计方法与现场智能单元.pdf	http://sso.cdclib.org/interlibSSO/goto/6/=06190596Z93/kcms/detail/detail.aspx?dbCode=cjfq&filename=XTYY200310004&dbname=CJFD0305
基于校园网的考试管理系统体系的构建	计算机系统应用	2003	2003年10期	【作者】 叶晓彤 ； 【机构】 自贡师范高等专科学校计科系 643000 ；	考试管理系统 ； 校园网 ； WEB数据库 ；	本文分析了现有的考试系统在高校考试和题库管理实践应用中的不足,提出了一种以校园网为平台的、B/W和C/S考试方式相结合的、远程题库维护和计算机网络考试一体化的考试管理系统体系结构,并讨论了该体系结构设计中的关键技术实现方式。	2003年10期_基于校园网的考试管理系统体系的构建.pdf	http://sso.cdclib.org/interlibSSO/goto/6/=06190596Z93/kcms/detail/detail.aspx?dbCode=cjfq&filename=XTYY200310005&dbname=CJFD0305
Agent数据库系统集成设计与实现	计算机系统应用	2003	2003年10期	【作者】 范宝德 ； 姜远明 ； 【机构】 烟台大学计算机学院 ； 烟台大学计算机学院 264005 ； 264005 ；	FIPA规范 ； Agent系统 ； 集成 ；	本文简介Agent软件集成规范,阐述Agent系统与非Agent软件集成的设计与实现技术,介绍基于Grasshopper平台应用面向Agent的编程技术实现Agent数据库系统集成。	2003年10期_Agent数据库系统集成设计与实现.pdf	http://sso.cdclib.org/interlibSSO/goto/6/=06190596Z93/kcms/detail/detail.aspx?dbCode=cjfq&filename=XTYY200310006&dbname=CJFD0305
基于双机流程控制的博物馆底帐采集的设计	计算机系统应用	2003	2003年10期	【作者】 陶洁 ； 梁赓 ； 李春晓 ； 柳军飞 ； 【机构】 中国科技大学研究生院 ； 中国科技大学研究生院 100039 中国科学院软件研究所 100080 ； 100039 中国科学院软件研究所 100080 ； 100039 中国科学院软件研究所 100080 ；	博物馆底帐 ； 双机流程控制 ； 动态数据交换 ；	本文分析了博物馆底帐信息采集的特点,针对其批量、快速、准确和易于管理的要求,提出了一种基于双机流程控制设计思想的解决方案。	2003年10期_基于双机流程控制的博物馆底帐采集的设计.pdf	http://sso.cdclib.org/interlibSSO/goto/6/=06190596Z93/kcms/detail/detail.aspx?dbCode=cjfq&filename=XTYY200310007&dbname=CJFD0305
基于脚本对象模型(SOM)的Web数据绑定技术的实现	计算机系统应用	2003	2003年10期	【作者】 习胜丰 ； 【机构】 益阳湖南城市学院信息与计算机科学系 413000 ；	SOM ； DHTML应用程序 ； DTC控件 ； 数据绑定 ； Web ；	SOM脚本对象模型是开发DHTML应用程序中Web数据绑定的基础,本文分析了基于SOM的DTC控件的运行原理,实现了在DHTML应用程序中通过DTC进行的Web数据绑定,解决了Web编程中的一个重要课题。	2003年10期_基于脚本对象模型(SOM)的Web数据绑定技术的实现.pdf	http://sso.cdclib.org/interlibSSO/goto/6/=06190596Z93/kcms/detail/detail.aspx?dbCode=cjfq&filename=XTYY200310008&dbname=CJFD0305
主动网络的安全策略	计算机系统应用	2003	2003年10期	【作者】 许力 ； 郑宝玉 ； 吴子文 ； 【机构】 南京邮电学院信息工程系 ； 福州福建师范大学计算机科学系 210003 福州福建师范大学计算机科学系 350007 ； 210003 ； 350007 ；	主动网络 ； 网络安全 ； 主动报文 ； 结点操作系统 ； 网络环境 ； 移动代理 ；	目前基于IP模型的网络体系结构缺乏一定的灵活性,制约和延缓了新协议、新应用的开发与应用。主动网络把计算能力从端结点引入到网络内部,赋与网络可编程能力。但它在提供灵活性的同时,也产生了比以往网络更多的安全问题,本文从四个方面分析和探讨了对各种安全问题的不同解决办法。并给出了一些新的解决思路。	2003年10期_主动网络的安全策略.pdf	http://sso.cdclib.org/interlibSSO/goto/6/=06190596Z93/kcms/detail/detail.aspx?dbCode=cjfq&filename=XTYY200310009&dbname=CJFD0305
XML部署JSP应用	计算机系统应用	2003	2003年10期	【作者】 王劲松 ； 王健 ； 【机构】 南京东南大学计算机科学与技术系 ； 南京东南大学计算机科学与技术系 210096 ； 210096 ；	可扩展标识语言 ； JSP ； 电子商务 ；	用XML标记来部署JSP三层模型,可使程序结构清晰、实现构件重用,系统容易调整和扩展。本文以一个花卉定购站点为实例,从四个方面实际地论述了XML在JSP中的应用。	2003年10期_XML部署JSP应用.pdf	http://sso.cdclib.org/interlibSSO/goto/6/=06190596Z93/kcms/detail/detail.aspx?dbCode=cjfq&filename=XTYY200310010&dbname=CJFD0305
电子商务中供应链的Petri网建模	计算机系统应用	2003	2003年10期	【作者】 秦荪涛 ； 【机构】 河海大学国际工商学院 浙江财经学院信息系 310012 ；	电子商务 ； 供应链 ； petri网模型 ；	文章论述了电子商务中供应链事物流程和Petri网的建模方法,Petri网是一种强有力的工具,作者通过一个电子商务供应链的概念模型,将它转换成为一个等价的Petri同模型,从中分析电子商务中供应链模型的性质,更好地从概念模型层次上验证电子商务的供应链在实现过程中的动态仿真。	2003年10期_电子商务中供应链的Petri网建模.pdf	http://sso.cdclib.org/interlibSSO/goto/6/=06190596Z93/kcms/detail/detail.aspx?dbCode=cjfq&filename=XTYY200310011&dbname=CJFD0305
辽宁电力信息化建设实践	计算机系统应用	2003	2003年10期	【作者】 潘明惠 ； 【机构】 辽宁省电力有限公司 ；	信息网络系统 ； 信息化建设 ；	本文是辽宁省电力公司信息化建设的总结,详细描述了信息化建设各个阶段的工作要点,并提供了信息系统应用效益的具体数据。	2003年10期_辽宁电力信息化建设实践.pdf	http://sso.cdclib.org/interlibSSO/goto/6/=06190596Z93/kcms/detail/detail.aspx?dbCode=cjfq&filename=XTYY200310012&dbname=CJFD0305
连续主动补货系统的设计与实现	计算机系统应用	2003	2003年10期	【作者】 谭涛 ； 肖利华 ； 张小华 ； 韩永生 ； 【机构】 和讯公司 ； 中科院软件所宁波开发中心中雅软件有限公司 ； 中科院软件所宁波开发中心中雅软件有限公司 100020 ； 315153 ； 315153 ；	供应商管理库存 ； 连续主动补货 ； 工作流管理 ；	VMI是供应链管理中一种先进的库存管理策略,连续主动补货系统则是VMI的主要支撑技术之一。本文介绍了一个连续主动补货系统的具体设计与实现,并且介绍了其中利用到的主要技术——工作流管理技术。	2003年10期_连续主动补货系统的设计与实现.pdf	http://sso.cdclib.org/interlibSSO/goto/6/=06190596Z93/kcms/detail/detail.aspx?dbCode=cjfq&filename=XTYY200310013&dbname=CJFD0305
后关系型数据库Caché的应用研究	计算机系统应用	2003	2003年10期	【作者】 张金辉 ； 刘仲英 ； 【机构】 同济大学经济与管理学院 ； 同济大学经济与管理学院 200092 ； 200092 ；	面向对象 ； 数据库 ； 后关系型数据库 ； Cache ；	本文首先简要介绍Cache的技术背景和概况;而后说明Cache的三大特色:优异的数据表现力、对象化的数据库、集成的WEB应用;最后将给出一个应用实例。	2003年10期_后关系型数据库Caché的应用研究.pdf	http://sso.cdclib.org/interlibSSO/goto/6/=06190596Z93/kcms/detail/detail.aspx?dbCode=cjfq&filename=XTYY200310014&dbname=CJFD0305
应用DNS实现WEB集群服务的负载均衡	计算机系统应用	2003	2003年10期	【作者】 肖军弼 ； 王宇 ； 【机构】 石油大学(华东)计算机与通信工程学院 ； 石油大学(华东)计算机与通信工程学院 257061 ； 257061 ；	DNS ； WEB ； 集群 ； 负载均衡 ；	本文讲述应用DNS的Round Robin功能,实现WEB集群服务的负载均衡的原理,并通过在Linux操作系统下的具体配置过程,验证其实现方法的正确性,最后总结了该方法的特点及适用场合。	2003年10期_应用DNS实现WEB集群服务的负载均衡.pdf	http://sso.cdclib.org/interlibSSO/goto/6/=06190596Z93/kcms/detail/detail.aspx?dbCode=cjfq&filename=XTYY200310015&dbname=CJFD0305
PowerBuilder应用的性能优化策略	计算机系统应用	2003	2003年10期	【作者】 金鹏 ； 【机构】 宁波大学商学院 315211 ；	PowerBuilder ； 性能优化 ；	本文从数据库设计、数据窗口、数据统计等方面对PowerBuilder应用程序设计的性能优化方法进行了详细阐述。	2003年10期_PowerBuilder应用的性能优化策略.pdf	http://sso.cdclib.org/interlibSSO/goto/6/=06190596Z93/kcms/detail/detail.aspx?dbCode=cjfq&filename=XTYY200310016&dbname=CJFD0305
加锁与解除锁定Windows2000/XP注册表编辑器的方法研究	计算机系统应用	2003	2003年10期	【作者】 孟万化 ； 【机构】 浙江绍兴文理学院 312000 ；	注册表 ； 键 ； 注册表编辑器 ； Wimdows API ；	注册表是Windows系统的核心数据库,在系统的启动、运行与操作过程中起着重要的作用。用户往往通过注册表编辑器(Regedit.exe)与32位注册表编辑器(Regedt32.exe)来修改注册表,同时考虑到计算机安全与应用,有必要锁定与解除锁定注册表编辑器。本文分析了注册表编辑器加锁与解除锁定的原理,提出了几种解决方法。	2003年10期_加锁与解除锁定Windows2000+XP注册表编辑器的方法研究.pdf	http://sso.cdclib.org/interlibSSO/goto/6/=06190596Z93/kcms/detail/detail.aspx?dbCode=cjfq&filename=XTYY200310017&dbname=CJFD0305
十进制与任意进制转换的设计与实现	计算机系统应用	2003	2003年10期	【作者】 刘建波 ； 蔡文水 ； 吕铁山 ； 【机构】 河北医科大学流行病学与统计学教研室 ； 国家邮政局石家庄培训中心 ； 国家邮政局石家庄培训中心 050017 ； 050021 ； 050021 ；	任意进制 ； 算法 ； 转换 ； 位权 ；	本文从项目应用中实际遇到的问题出发,从理论上解决十进制与任意进制转换或者任意进制之间转化的算法,设计思路清晰简捷并提供了实现算法的程序源码。	2003年10期_十进制与任意进制转换的设计与实现.pdf	http://sso.cdclib.org/interlibSSO/goto/6/=06190596Z93/kcms/detail/detail.aspx?dbCode=cjfq&filename=XTYY200310018&dbname=CJFD0305
基于Windows环境的仿真输入原理与实现	计算机系统应用	2003	2003年10期	【作者】 陈炼 ； 刘昌平 ； 【机构】 江西南昌大学计算中心 ； 江西南昌大学计算中心 330029 ； 330029 ；	仿真 ； 键盘 ； 鼠标 ； 程序控制 ；	本文介绍了一种在Windows平台下仿真键盘、鼠标输入的方法,使用此方法可以记录键盘、鼠标的输入,并且模仿记录的健盘、鼠标输入动作,从而模拟人的行为实现程序自动控制。	2003年10期_基于Windows环境的仿真输入原理与实现.pdf	http://sso.cdclib.org/interlibSSO/goto/6/=06190596Z93/kcms/detail/detail.aspx?dbCode=cjfq&filename=XTYY200310019&dbname=CJFD0305
安全移动电子商务研究	计算机系统应用	2003	2003年10期	【作者】 张浩军 ； 李晓雪 ； 祝跃飞 ； 【机构】 解放军信息工程大学信息工程学院 ； 河南郑州 ； 解放军信息工程大学信息工程学院 450002 ； 河南省农业银行科技处 ； 450002 ； 450002 ；	WAP ； WPKI ； PKI ； 移动电子商务 ； 网络安全 ；	本文介绍了安全移动电子商务的概念与应用,分析了实现安全移动商务的国际标准WAP,构建安全无线商务环境WPKI的概念与安全机制,并且给出了两种基于WPKI认证环境的模型与过程。	2003年10期_安全移动电子商务研究.pdf	http://sso.cdclib.org/interlibSSO/goto/6/=06190596Z93/kcms/detail/detail.aspx?dbCode=cjfq&filename=XTYY200310020&dbname=CJFD0305
业界动态	计算机系统应用	2003	2003年10期		选件 ； 存储服务器 ； 主机系统 ； Sharp ； 服务器性能 ； 硅芯片 ； 支持能力 ； 软件功能 ； 中国惠普 ； 大中华地区 ；	<正> News Radar 重组IBM FAStT600:宝剑锋从Turbo出 ——采用“Turbo选件”的IBM FAStT600存储服务器性能显著提高 Regrouping IBM FAStT600:Sharp Sward Coming from Turbo 近日,IBM宣布将重组IBM FAStT600存储服务器产品,并特别推出“Turbo选 件”(Turbo Option),重组后的FAStT600将具有更大的容量、速度、性能和更宽广 的主机系统支持能力,从而为客户提供企业级的存储特性。	2003年10期_业界动态.pdf	http://sso.cdclib.org/interlibSSO/goto/6/=06190596Z93/kcms/detail/detail.aspx?dbCode=cjfq&filename=XTYY200310021&dbname=CJFD0305
企业信息化战略思考	计算机系统应用	2003	2003年09期	【作者】 潘明惠 ； 【机构】 辽宁省电力有限公司 ；	企业 ； 信息化 ； 战略 ； 思考 ；	本文总结了多年来企业信息化理论研究与工程实践经验,依据社会系统动力学原理,分析了信息化在企业生存与发展中地位与作用,总结了“阶段性、时效性、持久性”总体建设策略指导企业信息化实践。探讨了从战略上思考企业信息化影响全局和关系到成功失败的问题。	2003年09期_企业信息化战略思考.pdf	http://sso.cdclib.org/interlibSSO/goto/6/=06190596Z93/kcms/detail/detail.aspx?dbCode=cjfq&filename=XTYY200309000&dbname=CJFD0305
医疗信息系统分布式技术平台研究	计算机系统应用	2003	2003年09期	【作者】 叶枫 ； 吕旭东 ； 段会龙 ； 【机构】 浙江工业大学计算机信息系统研究所 ； 浙江大学生物医学工程研究所 ； 浙江大学生物医学工程研究所 310014 ； 310014 ； 310014 ；	医疗信息系统 ； 分布式技术 ； CORBA ； EJB ；	分布式对象技术为解决医疗信息系统的集成提供了一条崭新的途径。本文在分析比较当前主流的分布式对象技术的基础上,提出了医疗信息系统分布式对象技术平台,介绍了该平台的软件总线层和对象管理层的设计与实现。	2003年09期_医疗信息系统分布式技术平台研究.pdf	http://sso.cdclib.org/interlibSSO/goto/6/=06190596Z93/kcms/detail/detail.aspx?dbCode=cjfq&filename=XTYY200309001&dbname=CJFD0305
用ASP.NET实现微型卫星故障远程诊断专家系统	计算机系统应用	2003	2003年09期	【作者】 鲁异 ； 李俊峰 ； 【机构】 清华大学工程力学系 ； 清华大学工程力学系 100084 ； 100084 ；	专家系统Browser/Server ； ASP.NET ；	本文简要介绍了一个微星卫星的故障远程诊断专家系统原型的设计思想和实现要点。此原型系统以“航天清华一号”微星卫星为工程应用背景,构建于PC机Windows 2000操作系统和ASP.NET开发环境下。ASP.NET的众多新特性在本系统的开发中起了重要作用。	2003年09期_用ASP.NET实现微型卫星故障远程诊断专家系统.pdf	http://sso.cdclib.org/interlibSSO/goto/6/=06190596Z93/kcms/detail/detail.aspx?dbCode=cjfq&filename=XTYY200309002&dbname=CJFD0305
电子政务安全与主机系统设计	计算机系统应用	2003	2003年09期	【作者】 高峰 ； 卢尚琼 ； 【机构】 临安浙江林学院现代教育技术中心 ； 临安浙江林学院图书馆 311300 ； 311300 ；	电子政务 ； 安全漏洞 ； 外部攻击 ； 内部威胁 ； 主机系统 ；	本文首先讨论电子政务系统的安全隐患及其特点,在此基础上提出了一种基于安全考虑的主机系统方案。实践表明,本文作者为某市所设计的电子政务主机系统方案具有比较好的安全性能:一方面它能够有效地抵御来自网络外部的攻击行为;另一方面,它能够有效地防止来自网络内部的攻击行为。	2003年09期_电子政务安全与主机系统设计.pdf	http://sso.cdclib.org/interlibSSO/goto/6/=06190596Z93/kcms/detail/detail.aspx?dbCode=cjfq&filename=XTYY200309003&dbname=CJFD0305
列车调度系统关键技术研究	计算机系统应用	2003	2003年09期	【作者】 许士敏 ； 陈鹏举 ； 武传华 ； 【机构】 合肥解放军电子工程学院 ； 合肥解放军电子工程学院 230037 ； 230037 ； 230037 ；	GPS ； GSM ； GIS ；	基于GPS和GSM技术的列车智能化调度指挥系统中,存在定位精度要求高和数据传输要求高两个关键问题。本文提出RTK定位技术和GPRS技术实现方法并在实验系统中取得了良好的运行效果。	2003年09期_列车调度系统关键技术研究.pdf	http://sso.cdclib.org/interlibSSO/goto/6/=06190596Z93/kcms/detail/detail.aspx?dbCode=cjfq&filename=XTYY200309004&dbname=CJFD0305
开放链接技术研究	计算机系统应用	2003	2003年09期	【作者】 李春晓 ； 梁赓 ； 左春 ； 【机构】 中国科学技术大学、中科院软件研究所 ； 中国科学技术大学、中科院软件研究所 ；	数字图书馆 ； 数字资源 ； 开放链接(OpenURL) ； 来源资源 ； 目标资源 ；	本文依托数字图书馆的建设背景阐明了数字资源建设中的数字资源基于内容的相关性,重点研究了当前倍受业界关注的解决基于内容链接的技术标准——开放链接(OpenURL)的基本概念、工作流程及其应用模式。	2003年09期_开放链接技术研究.pdf	http://sso.cdclib.org/interlibSSO/goto/6/=06190596Z93/kcms/detail/detail.aspx?dbCode=cjfq&filename=XTYY200309005&dbname=CJFD0305
一个Geomedia图形访问扩展类的构建	计算机系统应用	2003	2003年09期	【作者】 罗德安 ； 【机构】 成都电子科技大学电子工程学院 610054 ；	地理信息系统 ； 组件技术 ； 系统集成 ；	本文构建了一个用于Geomedia图形访问的扩展类,文中对该扩展类的构造原理、构造方法和使用方法都作了详细的讨论。	2003年09期_一个Geomedia图形访问扩展类的构建.pdf	http://sso.cdclib.org/interlibSSO/goto/6/=06190596Z93/kcms/detail/detail.aspx?dbCode=cjfq&filename=XTYY200309006&dbname=CJFD0305
XPath技术的解析	计算机系统应用	2003	2003年09期	【作者】 段晓娟 ； 徐长梅 ； 孙宁 ； 【机构】 长沙大学计算机系 ； 长沙大学计算机系 410003 ； 410003 ； 410003 ；	XPath ； XML ； 数据模型 ；	本文详细讨论了XPath的工作原理、数据模型、定位路径等主要语法,并通过示例说明其具体使用方法。	2003年09期_XPath技术的解析.pdf	http://sso.cdclib.org/interlibSSO/goto/6/=06190596Z93/kcms/detail/detail.aspx?dbCode=cjfq&filename=XTYY200309007&dbname=CJFD0305
Linux下多线程技术分析及应用	计算机系统应用	2003	2003年09期	【作者】 金惠芳 ； 陶利民 ； 张基温 ； 【机构】 上海华东政法学院 ； 无锡江南大学信息工程学院 ； 无锡江南大学信息工程学院 200042 ； 214036 ； 214036 ；	进程 ； 线程 ； 多线程 ； 互斥 ； 同步 ；	本文介绍了进程、线程的基本概念及多线程的实现方式;分析了Linux中多线程的实现技术;最后,介绍了Linuxpthreads库中的关键函数,并以经典的读者-写者问题的实现来阐述多线程编程的核心核技术。	2003年09期_Linux下多线程技术分析及应用.pdf	http://sso.cdclib.org/interlibSSO/goto/6/=06190596Z93/kcms/detail/detail.aspx?dbCode=cjfq&filename=XTYY200309008&dbname=CJFD0305
基于3Com 4007 QOS特性增强VLAN安全性	计算机系统应用	2003	2003年09期	【作者】 宋博强 ； 陈岩 ； 陈洪涛 ； 张晟 ； 刘畅 ； 【机构】 北京军医学院网络管理中心 ； 北京深思软件股份有限公司系统集成部 ； 北京军医学院网络管理中心 100071 ； 100005 ； 100071 ； 100071 ；	校园网 ； 3Com 4007 ； QOS特性 ； VLAN网络安全 ；	本文讨论了在典型校园网环境中利用3Com 4007的QOS特性,实现各VLAN用户之间访问控制的方法。通过VLAN用户之间访问控制的设置,可以有效增强校园网内网的安全,使之成为网络稳定运行的一道安全屏障。	2003年09期_基于3Com+4007+QOS特性增强VLAN安全性.pdf	http://sso.cdclib.org/interlibSSO/goto/6/=06190596Z93/kcms/detail/detail.aspx?dbCode=cjfq&filename=XTYY200309009&dbname=CJFD0305
从802.11、802.1x论无线网络的安全性	计算机系统应用	2003	2003年09期	【作者】 彭红 ； 【机构】 武汉中南财经政法大学工商管理学院 430064 ；	802.11 ； 802.1x ； 无线局域网 ； 安全性 ； 认证 ；	随着无线网络的迅速发展,网络安全问题巳也逐渐引人注意。本文从802.11和802.1x协议安全机制的角度,分析了他们在无线网安全中存在的缺陷和问题。	2003年09期_从802.11、802.1x论无线网络的安全性.pdf	http://sso.cdclib.org/interlibSSO/goto/6/=06190596Z93/kcms/detail/detail.aspx?dbCode=cjfq&filename=XTYY200309010&dbname=CJFD0305
基于ASP架构的电子商务平台的研制	计算机系统应用	2003	2003年09期	【作者】 陈英 ； 朱长红 ； 【机构】 北京理工大学计算机科学技术系 ； 北京理工大学计算机科学技术系 100081 ； 100081 ；	ASP ； CBD ； JavaBeans ；	本文介绍了所研制的有创新思想和实用价值的电子商务平台,它为ASP提供底层的应用服务支持,使ASP可以在统一的应用平台上迅速架构自己的服务。先讨论了ASP的概念与层次结构,其次对ASP基础架构的需求、原型、体系结构进行了分析,最后通过一个例子简要介绍了如何利用本电子商务平台进行二次开发。	2003年09期_基于ASP架构的电子商务平台的研制.pdf	http://sso.cdclib.org/interlibSSO/goto/6/=06190596Z93/kcms/detail/detail.aspx?dbCode=cjfq&filename=XTYY200309011&dbname=CJFD0305
