title	journal_name	year	issue	author	keywords	summary	pdf_filename	article_url
一种遵循欧洲自动售货机协议的监控系统设计	计算机系统应用	2010	2010年07期	【作者】 李光宇 ； 贺建飚 ； 【Author】       LI Guang-Yu,HE Jian-Biao(School of Information Science and Engineering,Central South University,Changsha 410083,China) 【机构】 中南大学信息科学与工程学院 ；	自动售货机 ； 通用分组无线服务技术 ； 欧洲售货机协会数据传输协议 ； 监控系统 ； 实时通信 ； vending machine ； GPRS ； EVA-DTS ； monitor system ； real-time communication ；	目前我国自动售货机远程监控系统数据传输协议格式不统一,各个厂商的管理平台之间没有兼容性。针对这种现状,研究并设计一种基于EVA-DTS和GPRS的自动售货机监控系统方案。利用GPRS实现售货机与监控中心的组网,采用EVA-DTS建立数据的格式,设计并实现了实时的、安全度高的监控系统。该系统能够保障自动售货机与数据中心稳定的通信,便于运营者的运营和管理。任何符合EVA-DTS的售货机都可以用该系统进行管理,具有很强的通用性。	2010年07期_一种遵循欧洲自动售货机协议的监控系统设计.pdf	http://sso.cdclib.org/interlibSSO/goto/6/=06190596Z93/kcms/detail/detail.aspx?dbCode=cjfq&filename=XTYY201007035&dbname=CJFD0910
基于嵌入式Linux的远程抄表系统集中器的实现	计算机系统应用	2010	2010年07期	【作者】 朱仕亮 ； 何克右 ； 【Author】       ZHU Shi-Liang,HE Ke-You(Department of Computer Science and Technology,Wuhan University of Technology,Wuhan 430063,China) 【机构】 武汉理工大学计算机科学与技术学院 ；	远程抄表 ； 集中器 ； 嵌入了Linux ； remote meter reading system ； concentrator ； embedded Linux ；	通过分析比较国内外各种现有远程抄表系统的优点和不足,结合当前计算机技术和通信技术的发展和作者的实践经验,实现一种基于S3C2440处理器和嵌入式Linux的设计方案;具体说明了该方案的系统架构,并详细介绍了集中器嵌入式软件实现的关键技术。	2010年07期_基于嵌入式Linux的远程抄表系统集中器的实现.pdf	http://sso.cdclib.org/interlibSSO/goto/6/=06190596Z93/kcms/detail/detail.aspx?dbCode=cjfq&filename=XTYY201007036&dbname=CJFD0910
新虚拟场景模型下智能漫游算法设计与实现	计算机系统应用	2010	2010年07期	【作者】 于丽莉 ； 戴青 ； 【Author】       YU Li-Li,DAI Qing(Institute of Electronic Technology,PLA Information Engineering University,Zhengzhou 450004,China) 【机构】 解放军信息工程大学电子技术学院 ；	虚拟场景 ； 正方体模型 ； 虚拟对象 ； 智能漫游算法 ； 完全二叉树 ； virtual scene ； cube model ； virtual object ； intelligent roaming algorithms ； complete BiTree ；	基于对相关智能预测算法的分析,发现现有算法并未考虑到虚拟场景节点间存在的潜在关联关系,降低了算法的预测准确率。针对此问题,在一种新的立方体虚拟场景模型的基础上,提出了一种智能漫游算法,通过为每个节点建立一个以当前节点为根结点的完全二叉树结构,利用节点间潜在的关联关系判断下一步可能被操作的对象,对预测对象提前进行绘制并调入内存,有效弥补了相关算法存在的缺陷,从而提高了虚拟场景漫游的效率和实时性,算法具有较高的准确性。	2010年07期_新虚拟场景模型下智能漫游算法设计与实现.pdf	http://sso.cdclib.org/interlibSSO/goto/6/=06190596Z93/kcms/detail/detail.aspx?dbCode=cjfq&filename=XTYY201007037&dbname=CJFD0910
基于SVM的视频检索系统框架	计算机系统应用	2010	2010年07期	【作者】 赵颖川 ； 王万良 ； 蒋一波 ； 【Author】       ZHAO Ying-Chuan,WANG Wan-Liang,JIANG Yi-Bo(Computer College,Zhejiang University of Technology,Hangzhou 310013,China) 【机构】 浙江工业大学计算机科学与技术学院 ；	MPEG-7 ； CBVR ； 结果排序 ； 支持向量机(SVM) ； 相关反馈 ； MPEG-7 ； content-based video retrieval (CBVR) ； reranking ； support vector machine (SVM) ； relevance feedback ；	底层特征到高级语义的转化是视频检索中的重要环节。结合在视频检索中的相关反馈,结果排序以及BOOST思想,提出了针对视频检索的改进的SVM算法流程,并根据改进的SVM算法提出了基于SVM的视频检索系统框架。通过采用TREC2007的数据测试表明,该视频检索系统框架可达到较高的查准率和查全率。	2010年07期_基于SVM的视频检索系统框架.pdf	http://sso.cdclib.org/interlibSSO/goto/6/=06190596Z93/kcms/detail/detail.aspx?dbCode=cjfq&filename=XTYY201007038&dbname=CJFD0910
基于OCCI技术存取数据库大对象的方法及实现	计算机系统应用	2010	2010年07期	【作者】 全杰 ； 【Author】       QUAN Jie(China Academy of Electronics and Information Technology,Beijing 100041,China) 【机构】 中国电子科学研究院系统集成部 ；	OCCI ； LOB ； Oracle ； VC ； 数据库 ； OCCI ； LOB ； Oracle ； VC ； database ；	如何高效快捷地存取LOB类型数据是数据库应用程序开发的一个技术难题。对此,提出基于OCCI技术存取Oracle数据库LOB类型数据的一种方法,举例阐述了其技术实现过程,同时给出在VC6.0环境中已通过调试的源代码。该方法具有简单快捷、容易处理的优点。	2010年07期_基于OCCI技术存取数据库大对象的方法及实现.pdf	http://sso.cdclib.org/interlibSSO/goto/6/=06190596Z93/kcms/detail/detail.aspx?dbCode=cjfq&filename=XTYY201007039&dbname=CJFD0910
基于Windows脚本技术的计算机信息采集方案实现	计算机系统应用	2010	2010年07期	【作者】 刘珊 ； 【Author】       LIU Shan(Teaching and Research Division for Computer Science,Employees’College of Fengtai in Beijing,Beijing 100161,China) 【机构】 北京市丰台区职工大学计算机教研室 ；	Windows脚本 ； VBS ； WSH ； WMI ； 数据库 ； Windows script ； VBS ； WSH ； WMI ； database ；	使用Windows脚本编程,并结合数据库实现C/S模式下的网络内计算机设备信息的获取,展示了在网络环境下Windows脚本结合数据库编程技术的强大功能,善用Windows脚本编程技术将提高系统管理员日常管理和维护效率。	2010年07期_基于Windows脚本技术的计算机信息采集方案实现.pdf	http://sso.cdclib.org/interlibSSO/goto/6/=06190596Z93/kcms/detail/detail.aspx?dbCode=cjfq&filename=XTYY201007040&dbname=CJFD0910
基于信息熵的蚁群聚类算法在客户细分中的应用	计算机系统应用	2010	2010年07期	【作者】 吴春旭 ； 刘艳泽 ； 苟清龙 ； 【Author】       WU Chun-Xu,LIU Yan-Ze,GOU Qing-Long(Department of Management,University of Science and Technology of China,Hefei 230026,China) 【机构】 中国科学技术大学管理学院 ；	信息熵 ； 蚁群算法 ； 聚类 ； 客户细分 ； 应用 ； entropy ； ant colony algorithm ； clustering ； customer segmentation ； application ；	传统的蚁群聚类算法需设置较多参数,且聚类时间较长。基于信息熵的蚁群聚类算法通过信息熵改变蚂蚁拾起和放下数据的规则,减少了参数的设置、缩短了聚类的时间,将其应用于客户细分,并且与采用传统的蚁群聚类算法得到的细分结果进行比较分析,实验表明。基于信息熵的蚁群聚类算法可以加快客户细分的聚类进程。	2010年07期_基于信息熵的蚁群聚类算法在客户细分中的应用.pdf	http://sso.cdclib.org/interlibSSO/goto/6/=06190596Z93/kcms/detail/detail.aspx?dbCode=cjfq&filename=XTYY201007041&dbname=CJFD0910
TRBAC模型在办公自动化中的应用	计算机系统应用	2010	2010年07期	【作者】 宁运飞 ； 王加阳 ； 【Author】       NING Yun-Fei,WANG Jia-Yang(College of Information Science and Engineering,Central South University,Changsha 410083,China) 【机构】 中南大学信息科学与工程学院 ；	TRBAC模型 ； 办公自动化 ； 访问控制 ； TRBAC model ； office automation ； access control ；	信息系统访问控制已越来越受到重视,特别是在办公自动化领域中控制资源访问要求的访问控制。但是传统的角色访问控制模型和任务访问控制模型并不能满足工作流多变的控制需求,针对此问题,引出了基于任务和角色的访问控制模型,它能够满足办公自动化所涉及的业务领域对权限管理的要求。最后,结合实际的办公自动化系统的开发,给出了基于任务和角色的访问控制模型的一个具体的应用实例。	2010年07期_TRBAC模型在办公自动化中的应用.pdf	http://sso.cdclib.org/interlibSSO/goto/6/=06190596Z93/kcms/detail/detail.aspx?dbCode=cjfq&filename=XTYY201007042&dbname=CJFD0910
基于UML的车间制造过程信息化系统建模	计算机系统应用	2010	2010年07期	【作者】 周廉东 ； 潘慧丽 ； 洪春燕 ； 王琦峰 ； 【Author】       ZHOU Lian-Dong,PAN Hui-Li,HONG Chun-Yan,WANG Qi-Feng(Business School,Zhejiang Wanli University,Ningbo 315100,China) 【机构】 浙江万里学院商学院 ；	车间制造过程信息化系统 ； UML ； 系统建模 ； workshop manufacturing process information system ； unified modeling language(UML) ； system modeling ；	车间制造过程信息化系统是支撑车间制造过程运作的信息化平台,是制造企业管理决策与设备执行之间的信息桥梁,并兼有车间生产运作的信息化管理功能。采用面向对象分析设计方法,在分析了车间制造过程信息化系统的业务流程的基础上,使用UML建模工具建立了概念模型、用例模型、动态模型和物理模型。	2010年07期_基于UML的车间制造过程信息化系统建模.pdf	http://sso.cdclib.org/interlibSSO/goto/6/=06190596Z93/kcms/detail/detail.aspx?dbCode=cjfq&filename=XTYY201007043&dbname=CJFD0910
一种改进的无线传感器网络信息融合技术	计算机系统应用	2010	2010年07期	【作者】 付华 ； 胡雅馨 ； 【Author】       FU Hua,HU Ya-Xin(Faculty of Electrical and Control Engineering,Liaoning Technical University,Huludao 125105,China) 【机构】 辽宁工程技术大学电气与控制工程学院 ；	息融合 ； 卡尔曼滤波 ； 支持向量机 ； 无线传感器网络 ； information fusion ； Kalman filter ； SVM ； wireless sensor network ；	针对矿井环境监测系统的安全隐患问题,提出基于改进Kalman滤波与SVM的分布递阶信息融合方法,将系统中的传感器分为源节点和汇聚节点,在源节点采用改进Kalman滤波,汇聚节点采用SVM信息融合方法。该算法可以有效地降低无线传感器网络的能耗和网络信息冲突,仿真结果表明,该方法具有可靠性,并有效地提高无线传感器网络的信息融合精度。	2010年07期_一种改进的无线传感器网络信息融合技术.pdf	http://sso.cdclib.org/interlibSSO/goto/6/=06190596Z93/kcms/detail/detail.aspx?dbCode=cjfq&filename=XTYY201007044&dbname=CJFD0910
宗地的封闭性检查	计算机系统应用	2010	2010年07期	【作者】 张凯选 ； 高小六 ； 陈飞 ； 【Author】       ZHANG Kai-Xuan 1,GAO Xiao-Liu 2,CHEN Fei 1(1.Shoool of Geomatics Liaoning Technical University,Fuxin 12300,China;2.Department of Survey,Liaoning Provincial College of Communications,Shengyang 110122,China) 【机构】 辽宁工程技术大学测绘与地理科学学院 ； 辽宁省交通高等专科学校测绘系 ；	GIS ； 宗地 ； 封闭性检查 ； VBA ； 数据入库 ； 地籍成果输出 ； GIS ； Ancestor parcel ； closure test ； VBA ； database populating ； Cadastre results output ；	作为GIS基础数据来源的数字地籍图大多都是基于AutoCAD平台的。和GIS数据不同,它们不注重实体间的闭合性,拓扑关系等问题。宗地的封闭性检查是CAD数据与GIS数据进行数据转换以及地籍数据入库前矢量数据标准化的重要组成部分。从进行宗地封闭性检验的技术基础、理论基础以及宗地不闭合的成因出发,探讨了进行宗地封闭性检验的技术流程,并阐述了利用AutoCAD VBA作为开发语言,采用AutoCAD ActiveX技术,在AutoCAD 2005平台上进行二次开发,实现了宗地封闭检验和人机互动修改的方法;解决了在AutoCAD平台下进行地籍数据入库及地籍成果输出等问题。	2010年07期_宗地的封闭性检查.pdf	http://sso.cdclib.org/interlibSSO/goto/6/=06190596Z93/kcms/detail/detail.aspx?dbCode=cjfq&filename=XTYY201007045&dbname=CJFD0910
基于DIV标签树的网页主题信息抽取方法	计算机系统应用	2010	2010年07期	【作者】 欧阳柳波 ； 杨柱 ； 易显 ； 【Author】       OU YANG Liu-Bo,YANG Zhu,YI Xian(Software College,Hunan University,Changsha 410082,China) 【机构】 湖南大学软件学院 ；	主题信息抽取 ； DIV标签树 ； STU-DIV模型树 ； 主题相关度 ； 剪枝算法 ； extraction of topic information ； DIV tag-tree ； STU-DIV model-tree ； topic corelation ； Cut-Tree algorithm ；	随着CSS+DIV布局方式逐渐成为网页结构布局的主流,对此类网页进行高效的主题信息抽取已成为专业搜索引擎的迫切任务之一。提出一种基于DIV标签树的网页主题信息抽取方法,首先根据DIV标签把HTML文档解析成DIV森林,然后过滤掉DIV标签树中的噪声结点并且建立STU-DIV模型树,最后通过主题相关度分析和剪枝算法,剪掉与主题信息无关的DIV标签树。通过对多个新闻网站的网页进行分析处理,实验证明此方法能够有效地抽取新闻网页的主题信息。	2010年07期_基于DIV标签树的网页主题信息抽取方法.pdf	http://sso.cdclib.org/interlibSSO/goto/6/=06190596Z93/kcms/detail/detail.aspx?dbCode=cjfq&filename=XTYY201007046&dbname=CJFD0910
段染纱线仿真模拟中的颜色渐变实现方法	计算机系统应用	2010	2010年07期	【作者】 张瑞林 ； 曾祥慧 ； 朱宝湘 ； 【Author】       ZHANG Rui-Lin,ZENG Xiang-Hui,ZHU Bao-Xiang(Software Engineering Institute,Zhejiang Sci-Tech University,Hangzhou 310018,China) 【机构】 浙江理工大学软件工程研究所 ；	颜色空间 ； 纱线模型 ； 段染纱 ； 颜色渐变 ； 线性插值 ； 三次样条插值 ； color space ； yarn model ； section dyed yarn ； color gradient ； linear interpolation ； cubic spline interpolation ；	在段染纱线的仿真模拟中,如何实现段染纱线上相邻两种颜色之间的自然渐变是实现其仿真模拟的核心。首先利用数值分析中线性插值和三次样条插值的方法,建立基本的颜色渐变模型。然后,以双色段染纱线和三色段染纱线为例,结合现有的基于光照模型和纱线几何结构的纱线模拟方法,采用纹理叠加的方式,来完成对段染单纱、加捻纱的计算机模拟。最后,根据实际染纱工艺中具体的工艺参数,对已建立的颜色渐变模型进行优化,使其更具实用性,应用也更为广泛。	2010年07期_段染纱线仿真模拟中的颜色渐变实现方法.pdf	http://sso.cdclib.org/interlibSSO/goto/6/=06190596Z93/kcms/detail/detail.aspx?dbCode=cjfq&filename=XTYY201007047&dbname=CJFD0910
一种基于用户属性的搜索算法	计算机系统应用	2010	2010年07期	【作者】 余坦 ； 王益民 ； 【Author】       YU Tan,WANG Yi-Min(Software School,Hunan University,Changsha 410082,China) 【机构】 湖南大学软件学院 ；	搜索模式 ； 用户属性 ； 个性化搜索 ； 相适度算法 ； search-model ； user attribute ； personalized search ； compatibility algorithm ；	如何提高搜索的准确度是搜索算法改进的一个重要方面。提出了一种基于用户模型的搜索模式相适度算法,首先定义了一系列搜索模式,在搜索模式中有与之匹配的用户模型和相应的信息排序策略。用户检索时,利用空间向量模型计算出与用户最匹配的搜索模式,然后根据所选搜索模式中定义的排序算法,将最切合用户信息需求的数据优先呈现给用户,将用户属性作为信息重排的依据,达到针对用户的具体情况提供个性化搜索服务的目的。实验证明,本算法在可接受的时间消耗下,极大地提高了信息搜索的准确度。	2010年07期_一种基于用户属性的搜索算法.pdf	http://sso.cdclib.org/interlibSSO/goto/6/=06190596Z93/kcms/detail/detail.aspx?dbCode=cjfq&filename=XTYY201007048&dbname=CJFD0910
基于SUSAN的种子点生长边缘检测算法	计算机系统应用	2010	2010年07期	【作者】 李艳梅 ； 胡晓辉 ； 王静 ； 【Author】       LI Yan-Mei 1,2,HU Xiao-Hui 2,WANG Jing-Xin 2(1.College of Information Sciences and Technology,Gansu Agriculture University,Lanzhou 730070,China;2.School of Electronic&Information Engineering,Lanzhou Jiaotong University,Lanzhou 730070,China) 【机构】 甘肃农业大学信息科学与技术学院 ； 兰州交通大学电子与信息工程学院 ；	边缘检测 ； 种子点 ； 角点提取 ； SUSAN ； 生长 ； sobel ； edge detection ； seed point ； corner detection ； SUSAN ； growth ； sobel ；	角点是一种特殊的边缘点,是数字图像中重要的几何特征。利用边缘点连续的特性,提出了一种基于SUSAN算法的种子点生长边缘检测算法。利用Susan算法获得图像的角点,再将获得的角点作为种子点,根据边缘点的判断准则对其进行生长,最终实现边缘检测。实验证明,设计的算法具有较高的效率和很好的抗噪声能力,是一种有效的边缘检测方法。	2010年07期_基于SUSAN的种子点生长边缘检测算法.pdf	http://sso.cdclib.org/interlibSSO/goto/6/=06190596Z93/kcms/detail/detail.aspx?dbCode=cjfq&filename=XTYY201007049&dbname=CJFD0910
指定类数下仿射传播聚类的快速算法	计算机系统应用	2010	2010年07期	【作者】 王开军 ； 郑捷 ； 【Author】       WANG Kai-Jun,ZHENG Jie(School of Mathematics and Computer Science,Fujian Normal University,Fuzhou 350108,China) 【机构】 福建师范大学数学与计算机学院 ；	快速聚类 ； 指定类数的聚类 ； affinity propagation ； fast clustering ； clustering under given number of clusters ； affinity propagation ；	针对Science杂志上提出的仿射传播(Affinity propagation)聚类产生指定类数的聚类结果时效率较低的问题,提出了基于多网格策略的快速算法。该算法采用多网格搜索策略来减少调用仿射传播算法的次数,改进偏向参数的上界以缩小搜索范围。新方法大幅度地提高了仿射传播聚类在指定类数下的速度性能。实验结果表明新方法十分有效,在运行时间上比现有方法减少了22%-90%。	2010年07期_指定类数下仿射传播聚类的快速算法.pdf	http://sso.cdclib.org/interlibSSO/goto/6/=06190596Z93/kcms/detail/detail.aspx?dbCode=cjfq&filename=XTYY201007050&dbname=CJFD0910
一种人脸检测方法	计算机系统应用	2010	2010年07期	【作者】 刘海 ； 朱小平 ； 【Author】       LIU Hai,ZHU Xiao-Ping(Department of Computer Engineering and Technology,Guangdong Institute of Science and Technology,Zhuhai 519090,China) 【机构】 广东科学技术职业学院软件学院 ；	人脸检测 ； 平均斜率 ； 灰度投影曲线 ； 皮肤特征 ； face detection ； curve avage slope ； curved projection ； skin characteristics ；	通过定义曲线的平均斜率(Curve Avage Slope),利用灰度投影曲线和曲线平均斜率在图像中寻找出人脸的左右边界,然后根据人脸的其他特征,比如头发颜色,皮肤颜色,眼睛特征,寻找出人脸的上下边界,从而检测出图像中的人脸区域。	2010年07期_一种人脸检测方法.pdf	http://sso.cdclib.org/interlibSSO/goto/6/=06190596Z93/kcms/detail/detail.aspx?dbCode=cjfq&filename=XTYY201007051&dbname=CJFD0910
Windows Mobile智能手机中Flash数据读取功能的设计与开发	计算机系统应用	2010	2010年07期	【作者】 姜明 ； 严顼琦 ； 【Author】       JIANG Ming,YAN Xu-Qi(Institute of Software and Intelligent Technology,Hangzhou Dianzi University,Hangzhou 310018,China) 【机构】 杭州电子科技大学软件与智能技术研究所 ；	Windows Mobile ； OneNand Flash ； 数据读取 ； Windows mobile ； oneNand flash ； data reading ；	阐述了如何在windows mobile 5.0的环境下越过文件系统直接读取OneNand Flash。首先介绍了OneNand Flash的特点,然后简要地介绍了windows mobile5.0系统,最后介绍了如何按块读取OneNand Flash中的数据并将读取的数据传输给PC。结合Windows Mobile上开发GHOST软件的实例,详细介绍了数据读取以及数据传输的全过程,并给出了部分关键代码。	2010年07期_Windows+Mobile智能手机中Flash数据读取功能的设计与开发.pdf	http://sso.cdclib.org/interlibSSO/goto/6/=06190596Z93/kcms/detail/detail.aspx?dbCode=cjfq&filename=XTYY201007052&dbname=CJFD0910
技能点组合分布的技能操作题库组卷研究	计算机系统应用	2010	2010年07期	【作者】 陈尧妃 ； 陈焕通 ； 倪应华 ； 【Author】       CHEN Yao-Fei 1,CHEN Huan-Tong 1,Ni Yinghua 2(1.College of Information Engineering,Jinhua College of Profession and Technology,Jinhua 321017,China;2.Xingzhi College,Zhejiang Normal University,Jinhua 321004,China) 【机构】 金华职业技术学院信息工程学院 ； 浙江师范大学行知学院 ；	技能考核 ； 组合分布 ； 组卷约束 ； skills assessment ； combination distribution ； constraints of test paper ；	根据技能组卷特点提出围绕技能点构建组卷约束模型,使用组合分布策略实现技能题库自动组卷。设计了技能点组卷矩阵约束模型,重点探讨组合分布组卷策略实现的三个关键环节:参数验证优化、技能点组合方案生成和技能试卷生成。通过实例验证表明:使用该方法实现技能题库组卷完全满足技能点组卷矩阵约束条件,具有组卷方法简便、组卷效率高、试卷质量优的特点,非常适合技能题库的组卷应用。	2010年07期_技能点组合分布的技能操作题库组卷研究.pdf	http://sso.cdclib.org/interlibSSO/goto/6/=06190596Z93/kcms/detail/detail.aspx?dbCode=cjfq&filename=XTYY201007053&dbname=CJFD0910
基于增强纹理谱描述符的图像检索	计算机系统应用	2010	2010年07期	【作者】 毋小省 ； 孙君顶 ； 【Author】       WU Xiao-Sheng,SUN Jun-Ding(School of Computer Science and technology,Henan Polytechnic University,Jiaozuo 454003,China) 【机构】 河南理工大学计算机科学与技术学院 ；	纹理谱 ； 局部二值模式 ； 中心对称局部二值模式 ； 共生矩阵 ； texture spectrum ； local binary pattern ； center-symmetric local binary pattern ； co-occurence matrix ；	提出了一种从图像低频信息提取纹理特征的方法。首先根据图像局部区域灰度均值与全局灰度均值间的关系,获取反映图像低频信息的二值图像;然后基于该二值图像,采用类似灰度共生矩阵的方法描述其纹理特征。实验结果表明,采用文中方法结合传统纹理谱描述符可有效提高图像检索的效率。	2010年07期_基于增强纹理谱描述符的图像检索.pdf	http://sso.cdclib.org/interlibSSO/goto/6/=06190596Z93/kcms/detail/detail.aspx?dbCode=cjfq&filename=XTYY201007054&dbname=CJFD0910
Hadoop下的分布式搜索引擎	计算机系统应用	2010	2010年07期	【作者】 胡彧 ； 封俊 ； 【Author】       HU Yu 1,FENG Jun 2(1.The Institute of Measuring and Controlling Technology,Taiyuan University of Technology,Taiyuan 030024,China;2.College of Computer and Software,Taiyuan University of Technology,Taiyuan 030024,China) 【机构】 太原理工大学测控技术研究所 ； 太原理工大学计算机与软件学院 ；	Hadoop ； PageRank ； Map/Reduce ； 分布式搜索引擎 ； Hadoop ； PageRank ； Map/Reduce ； distributed search engine ；	分析了Hadoop系统结构,提出一种改进的PageRank算法,使用Map/Reduce模式设计系统模块。实验证明,使用Hadoop框架能够设计出具有高性能、高可靠性和易扩展性的分布式搜索引擎。	2010年07期_Hadoop下的分布式搜索引擎.pdf	http://sso.cdclib.org/interlibSSO/goto/6/=06190596Z93/kcms/detail/detail.aspx?dbCode=cjfq&filename=XTYY201007055&dbname=CJFD0910
基于J2ME的维汉双语电子词典的研究与实现	计算机系统应用	2010	2010年07期	【作者】 张永才 ； 吾守尔·斯拉木 ； 【Author】       ZhANG Yong-Cai,WU Shou Er·Si La-Mu(Institute of Information Science and Engineering,Xinjiang University,Urumchi 830046,China) 【机构】 新疆大学信息工程学院 ；	J2ME ； WTK ； 电子词典 ； 维吾尔语输入 ； J2ME ； WTK ； electronical dictionary ； Uigur word input ；	在WTK平台上使用J2ME技术开发实现了维汉双语电子词典。分析设计了合理的词典的词库文件结构和良好的用户界面,选用折半查找算法来实现快速搜索词语,并实现了手机数字键盘和触摸屏并用的维吾尔语输入方式。	2010年07期_基于J2ME的维汉双语电子词典的研究与实现.pdf	http://sso.cdclib.org/interlibSSO/goto/6/=06190596Z93/kcms/detail/detail.aspx?dbCode=cjfq&filename=XTYY201007056&dbname=CJFD0910
