title	journal_name	year	issue	author	keywords	summary	pdf_filename	article_url
VB中指针功能变通实现及应用	计算机系统应用	2003	2003年08期	【作者】 斐钟哲 ； 刘小明 ； 申礼宏 ； 丁健 ； 张万军 ； 【机构】 北京工业大学交通工程研究所 ； 南京军区司令部 ； 南京解放军理工大学 ； 总装工程兵驻蚌埠地区军代室 ；	指针变量 ； VB ； 存储结构 ； 邻接矩阵 ； 存储方法 ； 邻接表 ； 链表 ； 数据结构 ； 数据存储 ； 存储空间 ；	<正> 1 引言 在某些应用情况下,链式存储结构是存储数据方法的唯一选择,例如在对于包含10000个顶点的网络(图)的数据存储中,用“邻接矩阵”法仅邻接矩阵就至少需要100M的存储空间,这显然是不现实的,所以必须采用基于链式存储结构的“邻接表”存储方法。但在VB中,由于不存在指针类型变量,使得开发人员无法在VB环境下实现链式存储结构,极大地限制了VB在软件工程中的应用。因此,探索在VB中变通实现指针及扩展其在数据结构建立中的应用具有显著的实用意义。	2003年08期_VB中指针功能变通实现及应用.pdf	http://sso.cdclib.org/interlibSSO/goto/6/=06190596Z93/kcms/detail/detail.aspx?dbCode=cjfq&filename=XTYY200308017&dbname=CJFD0305
Matlab图形用户界面编程的几点思考	计算机系统应用	2003	2003年08期	【作者】 刘伟 ； 刘光斌 ； 吴红 ； 【机构】 西安第二炮兵工程学院 ； 北京第二炮兵第二研究所 710025 ； 710025 ； 100080 ；	Matlab ； 图形界面 ； 句柄 ；	Matlab作为一种科学计算语言,得到了广泛的应用。从Matlab 6.0以来,其图形界面的编程功能得到了增强,本文着重说明了其图形界面编程的基本思想,程序运行的流程以及不同界面的数据的相互传输问题,并给出了一个实例来说明其应用。	2003年08期_Matlab图形用户界面编程的几点思考.pdf	http://sso.cdclib.org/interlibSSO/goto/6/=06190596Z93/kcms/detail/detail.aspx?dbCode=cjfq&filename=XTYY200308018&dbname=CJFD0305
Web应用中使导航目录与文档内容同步	计算机系统应用	2003	2003年08期	【作者】 陈冈 ； 舒建文 ； 【机构】 武汉科技学院经济管理学院 ； 武汉科技学院经济管理学院 430074 ； 430074 ；	树型导航目录 ； 文档内容 ； 同步 ； Web应用 ； HHCTRL ；	分析了静态的树型导航目录在表现信息的层次隶属关系时存在的问题,提出利用HHCTRL控件使导航目录与文档内容同步,构成一种动态的树型导航目录,从而解决问题。	2003年08期_Web应用中使导航目录与文档内容同步.pdf	http://sso.cdclib.org/interlibSSO/goto/6/=06190596Z93/kcms/detail/detail.aspx?dbCode=cjfq&filename=XTYY200308019&dbname=CJFD0305
主细表更新在PowerBuilder中的实现	计算机系统应用	2003	2003年08期	【作者】 陈渝 ； 【机构】 昆明理工大学管理与经济学院 650093 ；	事务 ； 完整性 ； 主细表更新 ； POWERBUILDER ；	本文介绍了在PowerBuilder开发环境中如何实现数据库中主细表数据完整性的维护。	2003年08期_主细表更新在PowerBuilder中的实现.pdf	http://sso.cdclib.org/interlibSSO/goto/6/=06190596Z93/kcms/detail/detail.aspx?dbCode=cjfq&filename=XTYY200308020&dbname=CJFD0305
开发Access 2002的“从文本到语音”功能	计算机系统应用	2003	2003年08期	【作者】 王巍巍 ； 黄南川 ； 【机构】 廊坊河北工业大学分院 ； 廊坊河北工业大学分院 065000 ； 065000 ；	从文本到语音 ； VBA程序设计 ； 窗体设计 ； 朗读数据表 ；	本文主要阐述如何在Access 2002中开发“从文本到语音”的语音合成功能,详细介绍了开发设计的具体步骤。并对各程序代码做了详细的说明。	2003年08期_开发Access+2002的“从文本到语音”功能.pdf	http://sso.cdclib.org/interlibSSO/goto/6/=06190596Z93/kcms/detail/detail.aspx?dbCode=cjfq&filename=XTYY200308021&dbname=CJFD0305
基于Web的实时监控系统信息访问的研究和开发	计算机系统应用	2003	2003年08期	【作者】 黄天戍 ； 谭志江 ； 任清珍 ； 张旭良 ； 【机构】 武汉大学电子信息学院 ； 武汉大学电子信息学院 430072 ； 430072 ； 430072 ；	Web ； 数据库 ； RS-485 ； 浏览器/服务器 ；	在工业及自动化领域,采用Internet/Intranet技术,将Web与数据库技术和现场监控系统结合使用将为实时监控系统带来新的变革。在此背景下,本文提出基于Web的实时监控系统信息访问模型,并针对这一模型结合实时系统特点提出了一种新的解决方案,实现了485串口通信、数据的存取访问和远程命令控制。	2003年08期_基于Web的实时监控系统信息访问的研究和开发.pdf	http://sso.cdclib.org/interlibSSO/goto/6/=06190596Z93/kcms/detail/detail.aspx?dbCode=cjfq&filename=XTYY200308022&dbname=CJFD0305
怎样将VFP通用型字段中的内容插入WORD文档	计算机系统应用	2003	2003年08期	【作者】 常新功 ； 【机构】 太原山西财经大学信息与管理学院 030006 ；	通用型字段 ； Selection对象 ； Word对象 ；	本文利用WORD中的对象模型编程,提供了一种简便的将VFP通用型字段中的内容插入到WORD文档中的方法。	2003年08期_怎样将VFP通用型字段中的内容插入WORD文档.pdf	http://sso.cdclib.org/interlibSSO/goto/6/=06190596Z93/kcms/detail/detail.aspx?dbCode=cjfq&filename=XTYY200308023&dbname=CJFD0305
银行电子化与技术保障策略研究	计算机系统应用	2003	2003年08期	【作者】 李晓德 ； 【机构】 北京市工商银行顺义支行 101300 ；	银行电子化 ； 技术保障 ； 策略 ； 研究 ；	电子化与技术保障是相辅相成的,既要重视系统的可靠性,促进业务发展,也要加强防护,保持长期稳定,如此才能确保实现又安全又完美的电子化目标。本文阐述了电子化及其重要性、技术保障策略与方法。	2003年08期_银行电子化与技术保障策略研究.pdf	http://sso.cdclib.org/interlibSSO/goto/6/=06190596Z93/kcms/detail/detail.aspx?dbCode=cjfq&filename=XTYY200308024&dbname=CJFD0305
无线局域网技术及其未来应用	计算机系统应用	2003	2003年08期	【作者】 晏斌 ； 王进 ； 【机构】 沈阳市交通局信息中心 ； 沈阳市交通局信息中心 110004 ； 110004 ；	无线局域网 ； 技术特点 ； 结构原理 ； 技术标准 ； 未来发展 ；	本文主要介绍与论述了无线局域网的发展背景,技术特征与特点、结构组成原理、遵循的技术标准、普遍存在的问题与缺点及未来发展前景与实际应用。	2003年08期_无线局域网技术及其未来应用.pdf	http://sso.cdclib.org/interlibSSO/goto/6/=06190596Z93/kcms/detail/detail.aspx?dbCode=cjfq&filename=XTYY200308025&dbname=CJFD0305
业界动态	计算机系统应用	2003	2003年08期		甲骨文公司 ； 桌面软件 ； 西南区 ； 埃里森 ； 个人电脑 ； Desktop ； 企业应用软件 ； 芯片产品 ； 无线芯片 ； 副总裁 ；	<正> IBM台式机“Think战略”牵制戴尔多元化 “Think”strategy of IBM’s desk PC hold down multi-industrization of DELL 目前,IBM放弃了使用三年多的台式机品牌NetVista,启用了基于Think战略的全新台式机品牌-ThinkCentre,与此同时,IBM还推出了新的显示器品牌ThinkVision,这是继去年11月提出“Think战略”后,IBM PC最具里程碑意义的事件。对于更名,IBM个人电脑事业部华南及西南区总经理陈华安认为这源于	2003年08期_业界动态.pdf	http://sso.cdclib.org/interlibSSO/goto/6/=06190596Z93/kcms/detail/detail.aspx?dbCode=cjfq&filename=XTYY200308026&dbname=CJFD0305
通信运营企业的客户关系管理(CRM)系统	计算机系统应用	2003	2003年07期	【作者】 姜华彪 ； 【机构】 长沙中南大学商学院 410003 ；	客户关系管理 ； 运营 ； 服务 ；	本文基于我国通信企业信息系统应用的现状,论了建设CRM(客户关系管理)必要性,论述了通信企业建设CRM的架构、各子系统功能以及相互关系。	2003年07期_通信运营企业的客户关系管理(CRM)系统.pdf	http://sso.cdclib.org/interlibSSO/goto/6/=06190596Z93/kcms/detail/detail.aspx?dbCode=cjfq&filename=XTYY200307000&dbname=CJFD0305
铁路信息化建设的核心——TMIS	计算机系统应用	2003	2003年07期	【作者】 张红麟 ； 【机构】 铁道部信息技术中心 100844 ；	TMIS ； 信息化 ；	铁路货运管理信息系统(TMIS)是铁路信息化建设的核心,本文将围绕TMIS简单介绍铁路信息化建设的进展及今后发展趋势。	2003年07期_铁路信息化建设的核心——TMIS.pdf	http://sso.cdclib.org/interlibSSO/goto/6/=06190596Z93/kcms/detail/detail.aspx?dbCode=cjfq&filename=XTYY200307001&dbname=CJFD0305
全路统一TMIS传输平台的总体设计与技术实现	计算机系统应用	2003	2003年07期	【作者】 陈玲 ； 【机构】 铁道部信息技术中心 100844 ；	数据传输 ； MQSeries ； 队列 ； TMIS ；	本文介绍了全路统一TMIS传输平台的总体设计与实现,主要包括结构设计、功能设计、应用接口设计、日志处理以及新旧系统兼容及切换等方面的内容。	2003年07期_全路统一TMIS传输平台的总体设计与技术实现.pdf	http://sso.cdclib.org/interlibSSO/goto/6/=06190596Z93/kcms/detail/detail.aspx?dbCode=cjfq&filename=XTYY200307002&dbname=CJFD0305
铁路工务管理信息系统的设计与实现	计算机系统应用	2003	2003年07期	【作者】 郭年根 ； 孙美 ； 孙远运 ； 徐文荣 ； 张树艳 ； 【机构】 铁道部电子计算技术中心 ； 铁道部电子计算技术中心 100844 ； 100844 ； 100844 ；	铁路工务 ； 信息系统 ； 系统设计 ；	本文在分析国内外工务信息化建设现状的基础上,提出了我国工务管理信息系统建设的目标以及主要内容,阐述了系统设计中的关键技术,并说明了系统应用特点。	2003年07期_铁路工务管理信息系统的设计与实现.pdf	http://sso.cdclib.org/interlibSSO/goto/6/=06190596Z93/kcms/detail/detail.aspx?dbCode=cjfq&filename=XTYY200307003&dbname=CJFD0305
铁路车号自动识别系统	计算机系统应用	2003	2003年07期	【作者】 王庆文 ； 【机构】 铁道部信息技术中心 100844 ；	铁路车号 ； 自动识别 ；	铁路车号自动识别系统是一个对全国铁路货车车辆、列车、机车运行位置进行动态追踪管理的实时信息自动采集和报告系统。本文介绍该系统的架构、信息处理流程和应用,并阐述车号自动识别系统的应用前景以及与运输管理信息系统(TMIS)的关系。	2003年07期_铁路车号自动识别系统.pdf	http://sso.cdclib.org/interlibSSO/goto/6/=06190596Z93/kcms/detail/detail.aspx?dbCode=cjfq&filename=XTYY200307004&dbname=CJFD0305
Oracle数据仓库解决方案概述	计算机系统应用	2003	2003年07期	【作者】 郭琳 ； 陈志军 ； 周玉华 ； 杨林 ； 刘宇宏 ； 李环 ； 【机构】 北京中医药大学信息中心 ； 首都师范大学信息工程学院 100029 ； 100029 ； 100037 ；	数据仓库 ； 设计建模 ； Oracle ； 元数据 ；	本文介绍了用Oracle的产品来做数据仓库的设计与开发要完成数据仓库的设计建模、数据转换与集成、数据存储与管理、数据的分析和展示、数据仓库的维护和管理的五个过程。	2003年07期_Oracle数据仓库解决方案概述.pdf	http://sso.cdclib.org/interlibSSO/goto/6/=06190596Z93/kcms/detail/detail.aspx?dbCode=cjfq&filename=XTYY200307005&dbname=CJFD0305
软件插件技术的原理与实现	计算机系统应用	2003	2003年07期	【作者】 李延春 ； 【机构】 华北计算技术研究所 100083 ；	插件 ； plug-in ； 动态链接 ； COM组件类别 ；	基于插件的应用系统拥有良好的可扩充性、可定制性和可维护性,本文论述了插件技术的基本原理,并给出了三种不同的实现插件系统的方法。	2003年07期_软件插件技术的原理与实现.pdf	http://sso.cdclib.org/interlibSSO/goto/6/=06190596Z93/kcms/detail/detail.aspx?dbCode=cjfq&filename=XTYY200307006&dbname=CJFD0305
音频数字水印技术	计算机系统应用	2003	2003年07期	【作者】 王勇 ； 李奕飞 ； 张瑾玉 ； 王淑琴 ； 【机构】 四川大学计算机学院 ； 四川大学计算机学院 2001研43#610064 ； 2001研43#610064 ； 2001研43#610064 ；	数字水印 ； 小波变换 ； 人类听觉系统模型 ； 设计模式 ；	在技术日新月异的今天,数字水印越来越受到广泛的重视,随着internet的发展和广泛的应用,数字水印技术无疑将成为解决版权问题的一种理想的方案。数字水印是将信息隐藏到目标数据中的一门技术。它应该具有不可感知性和鲁棒性的特点。本文讨论了基于小波变换和统计理论的音频领域里的数字水印技术,提出了分块水印添加技术。	2003年07期_音频数字水印技术.pdf	http://sso.cdclib.org/interlibSSO/goto/6/=06190596Z93/kcms/detail/detail.aspx?dbCode=cjfq&filename=XTYY200307007&dbname=CJFD0305
基于内容的视频检索研究	计算机系统应用	2003	2003年07期	【作者】 余一清 ； 汪宏斌 ； 周洞汝 ； 【机构】 武汉大学计算机学院 ； 武汉大学计算机学院 430072 ； 430072 ； 430072 ；	基于内容的索引 ； 视频 ； 相似性 ；	基于内容的检索能使用户根据媒体特征对媒体内容进行检索和查询。由于多媒体数据中含有丰富的视频数据,并且是随时间动态变化的,其特征很难用一般的静态特征来描述,为了取得视频数据的特征,对视频数据的处理非常重要。本文将介绍基于内容的视频检索中相似索引的处理技术和方法。	2003年07期_基于内容的视频检索研究.pdf	http://sso.cdclib.org/interlibSSO/goto/6/=06190596Z93/kcms/detail/detail.aspx?dbCode=cjfq&filename=XTYY200307008&dbname=CJFD0305
基于虚拟技术的计算机辅助教学	计算机系统应用	2003	2003年07期	【作者】 玄兆燕 ； 常秀辉 ； 刘兆妍 ； 【机构】 唐山河北理工学院机械系 ； 唐山河北理工学院机械系 063009 ； 063009 ； 063009 ；	CAI ； 虚拟仪器 ； LabVIEW ；	本文论述了以labVIEW为编程平台的《机械控制工程》虚拟实验室解决方案,介绍了系统的软件组成及虚拟实验室较之传统实验室的忧势。	2003年07期_基于虚拟技术的计算机辅助教学.pdf	http://sso.cdclib.org/interlibSSO/goto/6/=06190596Z93/kcms/detail/detail.aspx?dbCode=cjfq&filename=XTYY200307009&dbname=CJFD0305
智能集成网络开发平台研究	计算机系统应用	2003	2003年07期	【作者】 周庆忠 ； 曾慧娥 ； 【机构】 重庆后勤工程学院 ； 重庆工业高等专科学校 400016 ； 400051 ；	智能集成 ； 计算机网络 ； 开发平台 ； 油料装备 ；	本文论述智能集成网络开发平台的结构与功能,叙述智能集成关键技术及集成过程。该平台的研制为快速生成油料装备保障智能系统提供实现工具。	2003年07期_智能集成网络开发平台研究.pdf	http://sso.cdclib.org/interlibSSO/goto/6/=06190596Z93/kcms/detail/detail.aspx?dbCode=cjfq&filename=XTYY200307010&dbname=CJFD0305
缓冲区溢出的危害及防范	计算机系统应用	2003	2003年07期	【作者】 邱强 ； 【机构】 上海海运学院 200135 ；	缓冲区溢出 ； 网络安全 ； 安全漏洞 ； 网络攻击 ；	缓冲区溢出(BufferOverflow)是网络安全中最为常见的一种形式,它普遍存在于各类的操作系统及运行在操作系统上的应用软件中,是网络安全中最危险的漏洞之一。一个匿名的Internet用户可以利用这个漏洞获得一台主机的部分或全部的控制权。如果能有效的消除缓冲区溢出的漏洞,很大一部分的网络安全问题将得到缓解。本文简单介绍了缓冲区溢出的普遍性和危害性,并结合缓冲区溢出的原理,讲解了如何有效的防止缓冲区溢出。	2003年07期_缓冲区溢出的危害及防范.pdf	http://sso.cdclib.org/interlibSSO/goto/6/=06190596Z93/kcms/detail/detail.aspx?dbCode=cjfq&filename=XTYY200307011&dbname=CJFD0305
OA系统信息获取中PUSH机制的研究	计算机系统应用	2003	2003年07期	【作者】 赵松林 ； 【机构】 北京北方交通大学 100044 ；	办公自动化 ； PUSH机制 ； 信息推送 ；	作者将Internet中的PUSH技术的思想引入到了OA系统中用于探讨OA中主动式的信息推送方式,旨在建立一种全方位,立体的OA系统信息PUSH机制模型,以满足OA中信息获取的要求。	2003年07期_OA系统信息获取中PUSH机制的研究.pdf	http://sso.cdclib.org/interlibSSO/goto/6/=06190596Z93/kcms/detail/detail.aspx?dbCode=cjfq&filename=XTYY200307012&dbname=CJFD0305
充分运用面向对象思想提高BCB编程的效率	计算机系统应用	2003	2003年07期	【作者】 邢成思 ； 李睿 ； 程永军 ； 【机构】 石家庄陆军指挥学院研究生系 ； 石家庄市第四十二中学 ； 石家庄陆军指挥学院研究生系 050084 ； 050061 ； 050084 ；	面向对象 ； BCB ； UML ； OOP ；	面向对象技术经过20多年的发展,日趋成熟,00A(面向对象分析Object-Oriented Analysis,OOD(面向对象设计Object-Oriented Design)和00P(面向对象编程Object-OrientedProgramming)已成为业界主流。在分析与设计领域,对面向对象方式的研究比较深人;然而,在编写代码的过程中,由于种种原因,人们往往更关注应用软件功能的实现,从而忽略了面向对象思想的运用。本文介绍了如何借助UML在编程的全过程中运用面向对象的思想,并总结了运用面向对象思想指导软件开发对提高软件质量和开发效率的意义。	2003年07期_充分运用面向对象思想提高BCB编程的效率.pdf	http://sso.cdclib.org/interlibSSO/goto/6/=06190596Z93/kcms/detail/detail.aspx?dbCode=cjfq&filename=XTYY200307013&dbname=CJFD0305
多媒体监控系统的实现及多播技术在其中的应用	计算机系统应用	2003	2003年07期	【作者】 潘飞 ； 杜建华 ； 【机构】 南京邮电学院电子工程系 ； 南京东南大学自动控制系 210003 ； 210096 ；	多媒体监控 ； 多播 ； MPEG-2 ； TCP/IP ；	本文介绍了一种多媒体数字监控系统。对它的结构、工作原理以及特点做了介绍,尤其详尽阐述了它所采用的IP多播技术。	2003年07期_多媒体监控系统的实现及多播技术在其中的应用.pdf	http://sso.cdclib.org/interlibSSO/goto/6/=06190596Z93/kcms/detail/detail.aspx?dbCode=cjfq&filename=XTYY200307014&dbname=CJFD0305
大连市实时交通信息发布系统	计算机系统应用	2003	2003年07期	【作者】 谭国真 ； 瞿晓高 ； 【机构】 大连理工大学计算机科学与工程系 ； 大连理工大学计算机科学与工程系 116024 ； 116024 ；	智能交通系统 ； 实时发布 ； SCOOT ；	本系统是为了适应日益增长的交通信息需求,实现道路交通管理的自动化和交通信息的实时共享而制作的。该系统最主要的功能是道路交通信息的实时动态发布,使用户通过因特网能获取最新的道路交通实时信息作为外出时的行路参考。	2003年07期_大连市实时交通信息发布系统.pdf	http://sso.cdclib.org/interlibSSO/goto/6/=06190596Z93/kcms/detail/detail.aspx?dbCode=cjfq&filename=XTYY200307015&dbname=CJFD0305
基于TUXEDO中间件的邮政电子化支局生产作业系统的设计与实现	计算机系统应用	2003	2003年07期	【作者】 于海燕 ； 张霞 ； 【机构】 石家庄河北经贸大学计算机中心 ； 石家庄河北经贸大学计算机中心 050091 ； 050091 ；	中间件 ； 三层C/S模式 ； BEA TUXEDO ；	邮政电子化支局生产作业系统是邮政综台网的一个应用系统,是一个联机交易处理系统。我们采用了三层C/S模式,并在三层结构中利用BEA TUXEDO分布式事物处理中间件,设计并实现了邮政电子化支局生产作业系统,本文是对该研究工作的介绍和总结。	2003年07期_基于TUXEDO中间件的邮政电子化支局生产作业系统的设计与实现.pdf	http://sso.cdclib.org/interlibSSO/goto/6/=06190596Z93/kcms/detail/detail.aspx?dbCode=cjfq&filename=XTYY200307016&dbname=CJFD0305
关于WINDOWS下的PHP4安装配置故障解析	计算机系统应用	2003	2003年07期	【作者】 濮青 ； 【机构】 合肥中国科学技术大学计算机系 230026 ；	PHP ； WINDOWS ； 安装 ；	PHP在WINDOWS系统上的安装过程比较繁琐,而且容易错。本文介绍了在WIN2000和WIN98下安装与配置PHP4时出现的故障情况,并提出了相应的解决之道。	2003年07期_关于WINDOWS下的PHP4安装配置故障解析.pdf	http://sso.cdclib.org/interlibSSO/goto/6/=06190596Z93/kcms/detail/detail.aspx?dbCode=cjfq&filename=XTYY200307017&dbname=CJFD0305
用VC开发Windows下的串口异步通信程序	计算机系统应用	2003	2003年07期	【作者】 刘春立 ； 【机构】 河北沧州师范专科学校 061001 ；	串行异步通信 ； Windows ； VC ；	本文讨论串行异步通信有关的技术及Windows环境下利用VC(VisualC++)进行串行异步通信程序的设计方法。	2003年07期_用VC开发Windows下的串口异步通信程序.pdf	http://sso.cdclib.org/interlibSSO/goto/6/=06190596Z93/kcms/detail/detail.aspx?dbCode=cjfq&filename=XTYY200307018&dbname=CJFD0305
随需应变智能分析	计算机系统应用	2003	2003年07期	【机构】 北京勃朗峰新型建材有限责任公司 100013 ；	智能分析 ； 随需应变 ； 元数据管理 ； 决策需要 ； 关系数据库 ； 即席查询 ； 商业智能 ； 系统开发人员 ； 可复用性 ； 统计分析功能 ；	<正> 1 背景 随着中国市场快速的开放和繁荣,中小企业越来越多地感觉到来自内部管理的压力,企业管理需要更加专业化,企业决策需要更加精确的科学分析,这都需要对浩如烟海的各种业务数据作更加准确、快速的统计与分析需求将从各个业务部门潮水般涌向企业IT部门,并且	2003年07期_随需应变智能分析.pdf	http://sso.cdclib.org/interlibSSO/goto/6/=06190596Z93/kcms/detail/detail.aspx?dbCode=cjfq&filename=XTYY200307019&dbname=CJFD0305
路由网络中的系统互连	计算机系统应用	2003	2003年07期	【作者】 田文军 ； 胡寒光 ； 【机构】 湖北十堰东风汽车工程研究院 ； 湖北十堰东风汽车公司工艺研究所 442001 ； 442001 ；	UNLX Windows NT ； 路由网络 ； 异种机 ； 操作系统 ； 互连 ；	随着网络升级改造和新的UNIX服务器和WinNT工作站的引进,我单位的计算机信息网络系统,由原先的两个物理上隔开的局域网扩展为多子网系统。不仅提高了网络的运行效率,而且还满足了一定的安全性需要。本文详细介绍了我们实现多子网异种机系统互连的配置过程,以及从老系统向新系统平滑过度的过程。	2003年07期_路由网络中的系统互连.pdf	http://sso.cdclib.org/interlibSSO/goto/6/=06190596Z93/kcms/detail/detail.aspx?dbCode=cjfq&filename=XTYY200307020&dbname=CJFD0305
电子商务与中国铁路	计算机系统应用	2003	2003年07期	【作者】 李中浩 ； 【机构】 铁道部信息技术中心 100084 ；	铁路运输 ； 物流 ； 电子商务 ；	本文针对电子商务的发展对中国铁路运输提出的挑战和机遇,分析了铁路电子商务建设的必要性和可行性,提出了铁路电子商务发展的目标是从物流的承担者转变为物流的组织者的观点。介绍了中国铁路电子商务建设的现状和策略。对中国铁路电子商务建设的内容进行了说明。	2003年07期_电子商务与中国铁路.pdf	http://sso.cdclib.org/interlibSSO/goto/6/=06190596Z93/kcms/detail/detail.aspx?dbCode=cjfq&filename=XTYY200307021&dbname=CJFD0305
西藏地区IT系统集成的设计与实施特点	计算机系统应用	2003	2003年07期	【作者】 胡志刚 ； 【机构】 信息产业部电子第二十八研究所、南京欣网视讯科技股份有限公司 210014 ；	系统集成 ； 系统设计 ； 西藏 ；	本文基于在西藏的多年工作经验,就西藏大型IT系统集成的设计与实施特点进行归纳总结,并从硬件环境设计、软件系统设计和系统买施三个方面进行对比分析,提出可供借鉴的建议,以期能够对有志于西部大开发的设备制造商、系统集成商和IT系统建设者有所帮助。	2003年07期_西藏地区IT系统集成的设计与实施特点.pdf	http://sso.cdclib.org/interlibSSO/goto/6/=06190596Z93/kcms/detail/detail.aspx?dbCode=cjfq&filename=XTYY200307022&dbname=CJFD0305
Microsoft Producer自定义演示模板的编辑	计算机系统应用	2003	2003年07期	【作者】 曹传新 ； 陈昕 ； 施培俊 ； 【机构】 南京解放军理工大学工程兵工程学院 ； 南京第二军医大学南京军医学院 ； 南京解放军理工大学工程兵工程学院 210007 ； 210099 ； 210007 ；	Producer ； PowerPoint ； 演示 ； 模板 ；	本文介绍了Microsoft Producer中演示模板的自定义方法,以及最终浏览相关界面及显示内容的编辑。	2003年07期_Microsoft+Producer自定义演示模板的编辑.pdf	http://sso.cdclib.org/interlibSSO/goto/6/=06190596Z93/kcms/detail/detail.aspx?dbCode=cjfq&filename=XTYY200307023&dbname=CJFD0305
