title	journal_name	year	issue	author	keywords	summary	pdf_filename	article_url
工业软件国产化不是一句口头禅	软件世界	2010	2010年12期	【作者】 刘琼 ；	工业软件 ； 管理软件厂商 ； 周宏仁 ； 软博会 ； 工业化道路 ； 国产软件 ； 工业企业发展 ； 企业研发能力 ； 规划阶段 ； 浙大中控 ；	<正> 在"两化融合"进程加快、走新型工业化道路步伐加速的形势下,大力发展工业软件已成为各方共识。上海针对工业软件专门出台行动计划;北京明确提出要大力发展工业软件;用友、金蝶等传统管理软件厂商也表现出积极进军工业软件领域的意愿。一时间,工业软件成为业界热议的话题,在多部"十二五"规划草稿中也频频亮相。俗话说,知易行难。与2008年周宏仁在第十二届软博会高调提出"中国应大	2010年12期_工业软件国产化不是一句口头禅.pdf	http://sso.cdclib.org/interlibSSO/goto/6/=06190596Z93/kcms/detail/detail.aspx?dbCode=cjfq&filename=RJSJ201012001&dbname=CJFDLAST2014
要闻	软件世界	2010	2010年12期		首席技术 ； 美国新奥尔良 ； 软件产业基地 ； 物联网 ； 日至 ； 中国惠普 ； 甲骨文公司 ； 高新技术人才 ； 信息产业园 ； 产业发展论坛 ；	<正> 华盛顿著名黑客出任美国联邦贸易委员会首席技术专家。纽约WebOS2.0数月内将登陆所有Palm装置。新奥尔良2010年国际超级计算机大会11月13日至19日在美国新奥尔良举行。	2010年12期_要闻.pdf	http://sso.cdclib.org/interlibSSO/goto/6/=06190596Z93/kcms/detail/detail.aspx?dbCode=cjfq&filename=RJSJ201012002&dbname=CJFDLAST2014
中国软件和信息服务高峰论坛在京举行	软件世界	2010	2010年12期		中国软件 ； 软件信息 ； 颁奖礼 ； 领军 ； 电子信息 ； 信息服务 ； 院党委书记 ； 产业发展研究 ； 十年 ；	<正> 11月25日,"2010年中国软件和信息眼务高峰论坛暨辉煌十年——十大领军人物、十大领军企业颁奖礼"在北京举行,中国电子信息产业发展研究院党委书记洪京一、中国软件行业协会副理事长兼秘书长胡崑山出席会议。本次会议以"创新发展软件信息服务,支撑产业调结构促增长"为主题,共	2010年12期_中国软件和信息服务高峰论坛在京举行.pdf	http://sso.cdclib.org/interlibSSO/goto/6/=06190596Z93/kcms/detail/detail.aspx?dbCode=cjfq&filename=RJSJ201012003&dbname=CJFDLAST2014
声音	软件世界	2010	2010年12期		传志 ； 董事局主席 ； 全球市场份额 ； 中国企业家 ； 用友软件 ； 免费杀毒 ； 法国里昂 ； 中国软件 ； 用友公司 ； 金山网络 ；	<正> "现在联想PC全球市场份额更是历史性地突破双位数,达到10.2%,比市场平均增速快了一倍。"——联想集团董事局主席、联想控股有限公司总裁兼董事长柳传志近期,柳传志在法国里昂市获得"世界企业家"大奖,而获此殊荣的中国企业家今年只有柳传志一人。评委会认为在柳传志的带领下,联想并购了IBM的所有的PC部门,成功地让联想与国际接轨而获得这项荣誉。而在国际化之后联想的下一步该怎么走,这个问题还需要他与更多联想人去斟酌。	2010年12期_声音.pdf	http://sso.cdclib.org/interlibSSO/goto/6/=06190596Z93/kcms/detail/detail.aspx?dbCode=cjfq&filename=RJSJ201012004&dbname=CJFDLAST2014
地方资讯	软件世界	2010	2010年12期		挂牌交易 ； 质押融资 ； 技术专利 ； 海外机构 ； 东软集团 ； 行业解决方案 ； 外包发展 ； 外经贸委 ； 产业论坛 ； 电子信息 ；	<正> 北京市:中关村自主创新企业再添技术融资新渠道日前,中国技术交易所宣布,将与中粮信托公司就设立"自主创新知识产权融资集合资金信托计划"签订合作备忘录。这意味着中关村众多研发机构今后将新增一条用技术专利质押融资的新渠道。据相关人员介绍,众多研发机构拥有大量的技术专利,但作为无形资产,以前很难用技术融到资金,当研发机构把这些技术专利送到技术市场挂牌交易时,如果这些技术专利具有融资功能,将大大提高交易的积极性。	2010年12期_地方资讯.pdf	http://sso.cdclib.org/interlibSSO/goto/6/=06190596Z93/kcms/detail/detail.aspx?dbCode=cjfq&filename=RJSJ201012005&dbname=CJFDLAST2014
地方观点	软件世界	2010	2010年12期		郭金 ； 世界城市 ； 经济发展方式 ； 顾问委员会 ； 资源平台 ； 综合保税区 ； 中国特色 ； 产业转型升级 ； 信息服务产业 ； 府副 ；	<正> 北京市委副书记、市长郭金龙"大家要提振信心谋发展,通过企业的发展壮大,共同把中关村国家自主创新示范区建设好、发展好,为建设中国特色的世界城市、加快首都经济发展方式转变贡献力量。"链接:中关村国家自主创新示范区企业家顾问委员会座谈会上,北京市委副书记、市长郭金龙表示,市政府将认真贯彻各项指示精神,探索建立首都创新资源平台。	2010年12期_地方观点.pdf	http://sso.cdclib.org/interlibSSO/goto/6/=06190596Z93/kcms/detail/detail.aspx?dbCode=cjfq&filename=RJSJ201012006&dbname=CJFDLAST2014
云计算时代真的到来了吗?	软件世界	2010	2010年12期	【作者】 刘亚杰 ；	计算时代 ； 谷歌 ； 中小型企业 ； 网络攻击 ； 发展试点 ； 先锋作用 ； 何来 ； 信赖度 ； Matthew ； 数据迁移 ；	<正> 现如今,"云计算"的热度越来越高,而我们就从此进入"云计算"时代了吗?不管它是否到来,我们都应该冷静一下,深刻理解一下"云计算"。只要是围绕"云计算"的话题,从来就不缺少讨论的参与者。谷歌以应用托管、企业搜索以及其他形式向企业开放他们的"云";微软针对中小型企业和个人用户推出众多"软件即服务"产品;IBM在2008年"云计算"领域的累积投入就已	2010年12期_云计算时代真的到来了吗?.pdf	http://sso.cdclib.org/interlibSSO/goto/6/=06190596Z93/kcms/detail/detail.aspx?dbCode=cjfq&filename=RJSJ201012007&dbname=CJFDLAST2014
背景新闻	软件世界	2010	2010年12期		云计算中心 ； 物联网 ； 新一代互联网 ； 无锡新区 ； 信息产业 ； 高性能计算机 ； 应用支撑 ； 软件服务业 ； 三网融合 ； 计算标准 ；	<正> 中国物联网云计算中心无锡启用 11月26日,无锡新区与国内高性能计算机龙头曙光信息合作建设的中国物联网云计算中心今日启用,部署峰值性能达百万亿次/秒的计算机系统,可为目前驻扎于此的大量科研院所和企业提供高效能云计算服务应用支撑。云计算是整个信息产业公认的未来发展趋势,也是推动新一代互联网、物联网、	2010年12期_背景新闻.pdf	http://sso.cdclib.org/interlibSSO/goto/6/=06190596Z93/kcms/detail/detail.aspx?dbCode=cjfq&filename=RJSJ201012008&dbname=CJFDLAST2014
专家观点	软件世界	2010	2010年12期		专家观点 ； 身份管理 ； 业务程序 ； cipher ； 道云 ； 不知道 ；	<正> 用户对于自己的信息一无所知。——身份管理供应商Tricipher公司的首席执行官John Desantis最糟糕的事情在于我们采用了"云"这个字,听起来让人感觉业务程序像云一样被直接暴露在外面。——Thinkstrategies公司的分析师Jeff Kaplan	2010年12期_专家观点.pdf	http://sso.cdclib.org/interlibSSO/goto/6/=06190596Z93/kcms/detail/detail.aspx?dbCode=cjfq&filename=RJSJ201012009&dbname=CJFDLAST2014
信息服务	软件世界	2010	2010年12期		市场覆盖 ； 经验优势 ； 服务团队 ； 信息服务 ； 黄仁勋 ； 互联网工程 ； 网络实名 ； 软件集团 ； 李小龙 ； 国产电影 ；	<正> 微软安心服务全球首发近日,微软公司正式推出针对成长型企业的微软安心服务。微软服务团队将发挥其企业级信息化实施的经验优势,及遍布亚太区的强大技术支持团队,携手合作伙伴拓展市场覆盖,为广大成长型企业用户提供多样、增值的原厂服务模式,充分满足企业快速成长及	2010年12期_信息服务.pdf	http://sso.cdclib.org/interlibSSO/goto/6/=06190596Z93/kcms/detail/detail.aspx?dbCode=cjfq&filename=RJSJ201012010&dbname=CJFDLAST2014
国外动态	软件世界	2010	2010年12期		应用程序 ； 国外动态 ； Android ； Store ； 首款 ； 智能平台 ； 数据中心 ； 出口带宽 ； 终端用户 ； 网络应用 ；	<正> 瑞典推出全球首款Android电视Scandiinavia安卓电视预装了Google Android 1.5操作系统,它可以通过自有的AppStore下载电视专用的应用程序,并具有相当的扩展性。目前,Scandinavia安卓电视支持大概20多款应用程序,预计今年年底,其App Store应用程序商店可用软件将超过1000款。	2010年12期_国外动态.pdf	http://sso.cdclib.org/interlibSSO/goto/6/=06190596Z93/kcms/detail/detail.aspx?dbCode=cjfq&filename=RJSJ201012011&dbname=CJFDLAST2014
数据分析技术风行的九大因素	软件世界	2010	2010年12期	【作者】 John Jordan ； 姜稳 ；	九大 ； 六西格玛管理 ； 全面质量管理 ； 决策方式 ； 数据分析技术 ； 数据密集型 ； 供应链 ； 市场问题 ； 投资组合理论 ； 投资交易 ；	<正> 1.全面质量管理和六西格玛管理计划培养出一代重视严格运用数据的产品经理。六西格玛计划遭到滥用和曲解是毫无疑问的事实,但是我认为,以数据为主导的决策方式所带来的成功,极大影响了现在企业内部对高等统计式数据分析更为广泛的兴趣。2.数量金融学将运筹学、物理学、生物学、供应链管理学及其他领域的一些理念用于解决货币及市场问题。经过一些转变,许多数据密集型技术,比	2010年12期_数据分析技术风行的九大因素.pdf	http://sso.cdclib.org/interlibSSO/goto/6/=06190596Z93/kcms/detail/detail.aspx?dbCode=cjfq&filename=RJSJ201012012&dbname=CJFDLAST2014
中国软件和信息服务企业股市风云录	软件世界	2010	2010年12期		信息服务企业 ； 风云录 ； 示范园区 ； 产业示范基地 ； 银江股份 ； 汉王科技 ； 产业规模化 ； 立思辰 ； 同方股份 ； 城市论坛 ；	<正> 红榜1.我国将建10大文化产业园11月21日,文化部文化产业司副司长吴江波在举行的"文化创意产业与品牌城市论坛上表示,"十二五"期间我国将力争形成10家具有重大影响的国家级文化产业示范园区。吴江波表示,"十二五"期间,文化产业规模化,集约化发展仍将是主要趋势之一,我国将建设一批高起点、规模化,能够代表国家水准和未来发展方向的文化产业示范基地和示范园区。	2010年12期_中国软件和信息服务企业股市风云录.pdf	http://sso.cdclib.org/interlibSSO/goto/6/=06190596Z93/kcms/detail/detail.aspx?dbCode=cjfq&filename=RJSJ201012013&dbname=CJFDLAST2014
“瞬捷”企业IT快功术	软件世界	2010	2010年12期	【作者】 洪蕾 ； 杨春晖 ；	质量管理 ； 重要砝码 ； 《功夫》 ； 中国联通 ； 掩耳 ； 项目管理 ； 火云 ； 生命周期 ； 浙江移动 ； 体系模型 ；	"天下功夫,无坚不破,惟快不破。"如《功夫》中火云邪神所云,在瞬息万变的商场实战中,企业产品及业务必须最快响应并适应顾客消费需求变化,速度是克敌制胜的重要砝码,IT是实现进程的关键要素,需要CIO练就一套"击敌须如迅雷,雷发不及掩耳"的IT"快"功术。	2010年12期_“瞬捷”企业IT快功术.pdf	http://sso.cdclib.org/interlibSSO/goto/6/=06190596Z93/kcms/detail/detail.aspx?dbCode=cjfq&filename=RJSJ201012014&dbname=CJFDLAST2014
以中国软件名城为契机 推进软件和信息服务业再上新台阶	软件世界	2010	2010年12期	【作者】 季建业 ；	中国软件 ； 信息服务业 ； 软件项目管理 ； 服务外包基地 ； 资源密集 ； 科技体制 ； 基础软件 ； 人才创新 ； 软件业发展 ； 业务收人 ；	<正> 中国软件名城,是南京向更高目标迈进的新起点,我们将以此为契机,努力实现软件产业爆发式增长。南京是科技人才创新资源密集的城市,也是软件业快速发展的城市。2005年李源潮同志提出"南京要加快建设中国软件名城",2006年工信部、江苏省和南京市签署了推动软件名城建设合作备忘录。这4年来,全市上下抢抓南京作为中国软件出口创新基地、中国服务外包基地城市、全国科技体制综	2010年12期_以中国软件名城为契机+推进软件和信息服务业再上新台阶.pdf	http://sso.cdclib.org/interlibSSO/goto/6/=06190596Z93/kcms/detail/detail.aspx?dbCode=cjfq&filename=RJSJ201012015&dbname=CJFDLAST2014
仿真中国市场思变	软件世界	2010	2010年12期	【作者】 李玲玲 ；	中国市场 ； 安世亚太 ； 独家销售 ； 产品平台 ； 行业积累 ； 副总裁 ； 人才体系 ； 专业部门 ； 研发信息 ； 从零开始 ；	从ANSYS中国独家销售和技术支持总代到形成自己独有的仿真产品平台和技术体系,安世亚太无疑想用自身的发展向业界传递仿真在中国市场的潜在变化。	2010年12期_仿真中国市场思变.pdf	http://sso.cdclib.org/interlibSSO/goto/6/=06190596Z93/kcms/detail/detail.aspx?dbCode=cjfq&filename=RJSJ201012016&dbname=CJFDLAST2014
你好!企业级互联网Office	软件世界	2010	2010年12期	【作者】 史蕾 ；	互联网市场 ； Office ； 即时通讯 ； 破茧化蝶 ； 聊天软件 ； 腾讯 ； 市场占有率 ； 平台服务 ； 互联互通 ； 提供商 ；	<正> im0的诞生是为了解决"中国企业普遍需要即时通讯,但目前只能使用个人聊天软件"的困境。四年,对于一个企业来说是短暂的,但对于充满"奇迹"的中国互联网来说,四年足以让一个企业完成破茧化蝶的过程。作为企业即时通讯服务平台的提供商imo,过去的四年是不平凡的。	2010年12期_你好!企业级互联网Office.pdf	http://sso.cdclib.org/interlibSSO/goto/6/=06190596Z93/kcms/detail/detail.aspx?dbCode=cjfq&filename=RJSJ201012017&dbname=CJFDLAST2014
“信息智能”先行者	软件世界	2010	2010年12期	【作者】 卢敏 ；	现金储备 ； 数据仓库 ； 咨询服务 ； 业务多元化 ； 内容管理 ； 成真 ； 首席营销官 ； 非结构化 ； 规划时间 ； 切人 ；	<正> EMC对信息智能领域的提前布局,让EMC软件事业部插上了智能的翅膀。八年,EMC成功利用自己雄厚的现金储备进入软件和咨询服务市场。在这八年里,EMC进行了30多次收购,而其中涉及软件的收购更是让EMC的业务多元化目标成真,其中对VMware这个虚拟化老大的收购、对RSA安全排头兵的收购,以及最近对数据仓库领域Greenplum的收购让业界看到了EMC	2010年12期_“信息智能”先行者.pdf	http://sso.cdclib.org/interlibSSO/goto/6/=06190596Z93/kcms/detail/detail.aspx?dbCode=cjfq&filename=RJSJ201012018&dbname=CJFDLAST2014
BPM强化IBM业务敏捷路线图	软件世界	2010	2010年12期	【作者】 卢敏 ；	BPM ； IBM ； 基础设施管理 ； 支持能力 ； 系列产品 ； 商业环境 ； 新经济环境 ； 集成中间件 ； 核心系统 ； 应用程序 ；	<正>为了提升对企业达成业务敏捷性的支持能力,IBM在BPM、SOA及基础设施管理层面进行了一系列整合和收购,并推出系列产品和解决方案。今年5月,IBM	2010年12期_BPM强化IBM业务敏捷路线图.pdf	http://sso.cdclib.org/interlibSSO/goto/6/=06190596Z93/kcms/detail/detail.aspx?dbCode=cjfq&filename=RJSJ201012019&dbname=CJFDLAST2014
金蝶EAS渠道伙伴体系“蝶变”之路	软件世界	2010	2010年12期	【作者】 邢铖 ；	渠道伙伴 ； EAS ； 产品部 ； 品牌垄断 ； 企业管理软件 ； 电子商务服务 ； 集团管控 ； 传统销售模式 ； 集团型 ； 金蝶软件 ；	<正>有了成熟的技术和产品之后,还要将其成功转化为市场化价值,这离不开一个成功的营销模式,金蝶成功地融合了这三者,走出了属于自己的"蝶变"之路。从2007年	2010年12期_金蝶EAS渠道伙伴体系“蝶变”之路.pdf	http://sso.cdclib.org/interlibSSO/goto/6/=06190596Z93/kcms/detail/detail.aspx?dbCode=cjfq&filename=RJSJ201012020&dbname=CJFDLAST2014
国家软件产业基地巡礼——珠海南方软件园	软件世界	2010	2010年12期	【作者】 本刊编辑部 ；	南方软件园 ； 软件产业基地 ； 园区产业 ； 倍增计划 ； 基础服务 ； 中国软件 ； 首席运营官 ； 电子集团 ； 软件产品 ； 软件研发 ；	<正>2010年,园区大力实施"服务倍增计划",狠抓"基础服务""增值服务"和"创新服务"这三大服务来集聚园区产业。"海上云天,天下珠海",提到珠海	2010年12期_国家软件产业基地巡礼——珠海南方软件园.pdf	http://sso.cdclib.org/interlibSSO/goto/6/=06190596Z93/kcms/detail/detail.aspx?dbCode=cjfq&filename=RJSJ201012021&dbname=CJFDLAST2014
创新发展软件信息服务 支撑产业调结构促增长——2010中国软件和信息服务高峰论坛暨辉煌十年·十大领军人物、企业、产业园区颁奖盛典	软件世界	2010	2010年12期	【作者】 邢铖 ； 姜稳 ；	软件信息 ； 领军 ； 中国软件 ； 信息服务 ； 金源大饭店 ； 十年 ； 电子信息 ； 物联网 ； 北京中科 ； 基础软件 ；	<正> 2010年11月25日,由中国软件行业协会、中国电子信息产业发展研究院主办的"2010年中国软件和信息服务高峰论坛暨辉煌十年·十大领军人物、企业、产业园区"在北京世纪金源大饭店隆重举行。大会以"创新发展软件信息服务,支撑产业调结构促增长"为主题,聚集了软件与服务、工业设计等多个领域的数十家软件企业,使本届论坛成为	2010年12期_创新发展软件信息服务+支撑产业调结构促增长——2010中国软件和信息服务高峰论坛暨辉煌十年·十大领军人物、企业、产业园区颁奖盛典.pdf	http://sso.cdclib.org/interlibSSO/goto/6/=06190596Z93/kcms/detail/detail.aspx?dbCode=cjfq&filename=RJSJ201012022&dbname=CJFDLAST2014
东方正通抢占物联网先机	软件世界	2010	2010年12期	【作者】 李玲玲 ；	物联网 ； 唐山大地震 ； 应急平台 ； 应用软件 ； 软件模式 ； 辅助决策 ； 人工方式 ； 应急联动 ； 公共突发事件 ； 管理系统 ；	<正>现在人人都谈物联网,在大家还没想明白怎么用它时,东方正通率先将物联网引入到了应急管理领域当中,为业界描绘了物联网的另一种应用前景。1976年,唐山大地震震后3个小时,第一架直升机起飞	2010年12期_东方正通抢占物联网先机.pdf	http://sso.cdclib.org/interlibSSO/goto/6/=06190596Z93/kcms/detail/detail.aspx?dbCode=cjfq&filename=RJSJ201012023&dbname=CJFDLAST2014
让SaaS服务实现“多云”见“晴”	软件世界	2010	2010年12期	【作者】 姜稳 ；	平台服务 ； 信息化方面 ； 企业门户 ； 软件开发方式 ； SaaS ； 用户业务 ； 组件式 ； 灵活定制 ； 数据安全 ； 组件化 ；	<正>当许许多多云平台在中国市场"遮天蔽日"的时候,客户更希望云平台服务能够落地,进而切实感受它的存在。"现在,大部分成长型企业在信息化方面都比较迷茫	2010年12期_让SaaS服务实现“多云”见“晴”.pdf	http://sso.cdclib.org/interlibSSO/goto/6/=06190596Z93/kcms/detail/detail.aspx?dbCode=cjfq&filename=RJSJ201012024&dbname=CJFDLAST2014
溢信科技:另辟安全蹊径	软件世界	2010	2010年12期	【作者】 李玲玲 ；	国际市场 ； 半反应 ； 国内同类产品 ； 产品提供商 ； 得力干将 ； 渠道伙伴 ； 中国软件 ； 政府市场 ； 研发总监 ； 创业期 ；	<正>在国内,做安全的和需要安全的多半反应都是"安全不好做"。但溢信科技却在自己的内网安全领域不仅活得有些滋味,还能在国际市场指点一二。偶尔说起早先	2010年12期_溢信科技:另辟安全蹊径.pdf	http://sso.cdclib.org/interlibSSO/goto/6/=06190596Z93/kcms/detail/detail.aspx?dbCode=cjfq&filename=RJSJ201012025&dbname=CJFDLAST2014
银江股份:快速发展的智慧城市建设者	软件世界	2010	2010年12期		银江股份 ； 城市建设者 ； 物联网 ； 第一眼 ； 成长性企业 ； 国家创新基金 ； 市场策略 ； 中国软件 ； 立项项目 ； 中标金额 ；	<正>银江股份智慧城市建设正如火如荼地进行,橙色的"ENJOYOR"在全国30多个大中城市扎根。章建强市那种第一眼就让人产生信任感的人,眼神坚定,言语豪迈	2010年12期_银江股份:快速发展的智慧城市建设者.pdf	http://sso.cdclib.org/interlibSSO/goto/6/=06190596Z93/kcms/detail/detail.aspx?dbCode=cjfq&filename=RJSJ201012026&dbname=CJFDLAST2014
打造学海中的信息化方舟	软件世界	2010	2010年12期	【作者】 史蕾 ；	教育软件 ； 行业标准 ； 新型学习方式 ； 传统学习方式 ； 国内教育 ； 乐思 ； 软件产品 ； 信息技术 ； 九十年代 ； 学生学习质量 ；	<正>当前国内从事教育信息化的企业在发展中遇到的主要挑战来自市场培育、行业标准与可持续的商业模式三个方面。如果说网路和教育可以改变人的命运	2010年12期_打造学海中的信息化方舟.pdf	http://sso.cdclib.org/interlibSSO/goto/6/=06190596Z93/kcms/detail/detail.aspx?dbCode=cjfq&filename=RJSJ201012027&dbname=CJFDLAST2014
广安科技:项目管理领域专家	软件世界	2010	2010年12期		项目管理 ； 领域专家 ； 企业内训 ； 管理咨询服务 ； 考前培训 ； 总承包企业 ； 计算机软件技术 ； 提供商 ； 项目业主 ； 信息管理 ；	<正> 广安科技是企业级项目管理整体解决方案专业提供商。自2001年成立以来,一直致力于项目管理及其相关事业:主要从事于提供企业项目管理整体解决方案(SuperPIP)、Oracle Primavera系列项目管理软件应用及推广、PMI项目管理咨询服务、PMP考前培训、IPMP认证及企业内训服务。其中企业项目管理整体解决方案(SuperPIP)获得国内项目管理领域多项大	2010年12期_广安科技:项目管理领域专家.pdf	http://sso.cdclib.org/interlibSSO/goto/6/=06190596Z93/kcms/detail/detail.aspx?dbCode=cjfq&filename=RJSJ201012028&dbname=CJFDLAST2014
信景技术:网络沟通无障碍	软件世界	2010	2010年12期		网络沟通 ； 站点建设 ； 信息管理系统 ； 网络安全 ； 数据安全 ； 支付平台 ； 实时沟通 ； 网站联盟 ； 商务应用系统 ； 运营经验 ；	<正> 广州市信景技术有限公司成立于1999年9月,是一家专门从事INTERNET电子商务应用开发的高科技软件公司。在数据安全,网络安全,组网,站点建设,电子商务应用开发、大型信息管理系统的系统分析与设计方面具有丰富的实践经验。以互联网电子商务为核心,公司以"网络沟通无障碍"为口号,以互联网电子商务为核心,推出了信使系列网络实用软件。其	2010年12期_信景技术:网络沟通无障碍.pdf	http://sso.cdclib.org/interlibSSO/goto/6/=06190596Z93/kcms/detail/detail.aspx?dbCode=cjfq&filename=RJSJ201012029&dbname=CJFDLAST2014
浩丰创源:“iAgent”是我们的骄傲	软件世界	2010	2010年12期		数字录音 ； 外拨 ； 中国人保 ； 座席 ； 盛大网络 ； 贝塔斯曼 ； iAgent ； 橡果国际 ； 泰康人寿 ； 通信解决方案 ；	<正> 多方合作赢得市场浩丰创源是中国领先的统一通信解决方案供应商。同时也是管理软件全球领先的供应商,拥有联络中心、多媒体、自动语音、数字录音、预测外拨、座席绩效管理、客户关系管理等完整系列、完全自主知识产权的产品。浩丰创源通过与中国人寿、中国人保财险、中国银行、招商银行、泰康人寿、渤海保险、橡果国际、贝塔斯曼、欧唯特、盛大网络、联想集团、	2010年12期_浩丰创源:“iAgent”是我们的骄傲.pdf	http://sso.cdclib.org/interlibSSO/goto/6/=06190596Z93/kcms/detail/detail.aspx?dbCode=cjfq&filename=RJSJ201012030&dbname=CJFDLAST2014
华夏电通:数字音频高端应用领域的优秀供应商	软件世界	2010	2010年12期		电通 ； 高端应用 ； 软硬件产品 ； 数字音视频 ； 应用服务 ； 数字音频 ； 流媒体 ； 政府机构 ； 计算机行业 ； 创新产品奖 ；	<正> 北京华夏电通科技有限公司(简称华夏电通)成立于2001年,主要从事数字音视频及流媒体处理与控制技术的研发和应用服务,向国内政府机构和大型企业提供基于公司自主研发的具有自主知识产权的核心软硬件产品的一站式应用解决方案,是国内数字音视频高端应用领域领先的研发与应用服务供应商。	2010年12期_华夏电通:数字音频高端应用领域的优秀供应商.pdf	http://sso.cdclib.org/interlibSSO/goto/6/=06190596Z93/kcms/detail/detail.aspx?dbCode=cjfq&filename=RJSJ201012031&dbname=CJFDLAST2014
