title	journal_name	year	issue	author	keywords	summary	pdf_filename	article_url
国内外机器翻译进展状况	软件世界	1994	1994年12期	【作者】 戴伟长 ； 【机构】 中国软件技术与服务总公司 ；	进展状况 ； 翻译处理 ； 语言处理 ； 计算语言学 ； 科技文献 ； 翻译人员 ； 工作投入 ； 人类交往 ； 科研成果 ； 科技发展 ；	<正> 人类在漫长的发展过程中创造了数以千计的形态各异的语言,随之而来的各民族间的言语不通给人类交往带来诸多不便,为进行沟通,翻译行业在远古时代即已为社会所需。 进入二十世纪以后,科学技术蓬勃发展,科研成果的相互交流日益频繁,各个国家对翻译工作投入极大力量,翻译人员日见增多。但本世纪科技发展迅猛异常,科技文献数量急剧增加,用手工翻译处理浩如烟海的科技资料令人日感力不从心,寻找高效快速翻译工具已成当务之急。 1946年,世界第一台电子计算机问世,标志着	1994年12期_国内外机器翻译进展状况.pdf	http://sso.cdclib.org/interlibSSO/goto/6/=06190596Z93/kcms/detail/detail.aspx?dbCode=cjfq&filename=RJSJ199412000&dbname=CJFD9498
“译星”英汉机器翻译系统	软件世界	1994	1994年12期	【作者】 李素元 ； 黄晓玲 ； 【机构】 中软总公司 ； 中软总公司 ；	机器翻译系统 ； 译星 ； 计算机科学 ； 专业词典 ； 数据处理工作 ； 自然语言理解 ； 语义分析 ； 机器翻译研究 ； 句法分析 ； 静态信息 ；	<正> 一、前言人工智能是计算机科学中的尖端学科,而机器翻译又是其中最具挑战性的领域。当今世界,各种文字的信息每时每刻都在大量涌现,每年仅出版的文献就达500万篇,各国都要投入大量的人力、物力从事文字的翻译工作。随着我国改革、开放的逐步深入,与外界的交往愈来愈多,汉语与其它语言之间的数据处理工作日趋频繁;另外,很多单位都在引进、消化、吸收国外的先进技术,有大量的科技资料急需翻译。人们迫切希望能从繁重的翻译工作中解放出来。	1994年12期_“译星”英汉机器翻译系统.pdf	http://sso.cdclib.org/interlibSSO/goto/6/=06190596Z93/kcms/detail/detail.aspx?dbCode=cjfq&filename=RJSJ199412001&dbname=CJFD9498
DDBMS和DBMS的客户机/务器述评	软件世界	1994	1994年12期	【作者】 徐泽同 ； 涂方登 ； 李沐兴 ；	集中式数据库 ； 管理系统 ； client ； DDBMS ； 分布式数据库 ； 场地自治 ； 用户接口 ； 多线索机制 ； 并发控制 ； 计算机网 ；	本文依Chris.Date的DDB12准则对分布式数据库管理系统(DDBMS)和集中式数据库管理系统(DBMS)的Client/Server型分布作了对比分析,并对现在流行的几个DBMS的Client/Serv-er作了述评。	1994年12期_DDBMS和DBMS的客户机+务器述评.pdf	http://sso.cdclib.org/interlibSSO/goto/6/=06190596Z93/kcms/detail/detail.aspx?dbCode=cjfq&filename=RJSJ199412002&dbname=CJFD9498
用面向对象技术开发所见即所得的排版软件	软件世界	1994	1994年12期	【作者】 刘海 ； 【机构】 达因软件公司 ；	面向对象 ； 排版软件 ； 所见即所得 ； 技术开发 ； 排版系统 ； 软件功能 ； 编辑系统 ； 模拟显示 ； 对象关系 ； 流行软件 ；	<正> 经过严密的前期市场调查、论证,达因软件公司决定研究开发一个排版软件项目(即文典排版系统),决定采用Windows平台,并借助其图形界面优势完成一个DOS上各流行软件都难以实现的所见即所得的排版软件。该排版系统比之仅具模拟显示功能的DOS上的软件在实现上有许多复杂之处,为此,决定用面向对象技术(Object oriented,OO)来进行开发。 OO技术在国内外都属比较新的方向,下面以文典系统的编辑子系统为例介绍这种方法的运用。 下图是一个编辑系统的对象关系图,其中使用	1994年12期_用面向对象技术开发所见即所得的排版软件.pdf	http://sso.cdclib.org/interlibSSO/goto/6/=06190596Z93/kcms/detail/detail.aspx?dbCode=cjfq&filename=RJSJ199412003&dbname=CJFD9498
一个基于SUN工作站的图文混排工具	软件世界	1994	1994年12期	【作者】 李锡林 ； 吕晋育 ；	图文混排 ； 用户界面 ； 图像文件格式 ； 热门研究课题 ； 填充算法 ； 编辑处理 ； 图元 ； 支持软件 ； 管理模块 ； 格式文件 ；	用户界面(User Interface)是人和计算机之间联系的中间媒界。要开发好的用户界面十分费时,因此为开发用户界面提供更好的设计和实现环境已经成为当今的热门研究课题之一,本文介绍了一个实用工具“图形,图像,文字混合编辑处理系统”的实现。	1994年12期_一个基于SUN工作站的图文混排工具.pdf	http://sso.cdclib.org/interlibSSO/goto/6/=06190596Z93/kcms/detail/detail.aspx?dbCode=cjfq&filename=RJSJ199412004&dbname=CJFD9498
数据库应用中的图文混排打印	软件世界	1994	1994年12期	【作者】 赵忠孝 ； 【机构】 太原师范专科学校 ；	图形文件 ； 应用软件 ； 压缩存储 ； 图文混排 ； 打印输出 ； 试题库管理系统 ； 图形信息 ； 背景点 ； 矢量字库 ； 计算图 ；	<正> 在用dBASE和FOXBASE开发各种应用软件时,往往需要显示和打印一些图形和图像。本文以SPT所生成的图形文件为例,介绍数据库应用中如何实现图文的混排打印输出。 一、图形文件的结构 SPT图形文件分为文件头和图形信息两部分。非压缩存储SPT图形文件中,前64个字节是文件头,下面是一个图形文件TU.SPT的结构:	1994年12期_数据库应用中的图文混排打印.pdf	http://sso.cdclib.org/interlibSSO/goto/6/=06190596Z93/kcms/detail/detail.aspx?dbCode=cjfq&filename=RJSJ199412005&dbname=CJFD9498
远程数据库检索系统	软件世界	1994	1994年12期	【作者】 叶毅 ； 阎秀群 ；	数据库检索系统 ； 个人计算机 ； 公用电话网 ； 组网结构 ； 通信机 ； 用户接口 ； 专用线路 ； 数据库机 ； 分组交换网 ； 管理模块 ；	<正> 本系统是一种通过电话网和/或分组交换网,在个人计算机DOS操作系统下实现的远程数据库检索系统。 一、系统结构 系统的组网结构如图1所示,网络中心(网络中继)至少由两台微机组成。一台为通信机,一台数据库机。网络终端由个人计算机、调制解调器和网络软件组成,它们与网络中心(网络中继)的物理联结是靠公用电话网或数据网来实现的,不需另外敷设专用线路。计算机与电话在不做通讯时可照常使用。网	1994年12期_远程数据库检索系统.pdf	http://sso.cdclib.org/interlibSSO/goto/6/=06190596Z93/kcms/detail/detail.aspx?dbCode=cjfq&filename=RJSJ199412006&dbname=CJFD9498
对微机与工作站C语言源程序相互移植的几点体会	软件世界	1994	1994年12期	【作者】 时晓 ；	C语言 ； 语言版本 ； 应用软件 ； 编译系统 ； Borland ； 运行库 ； 堆栈溢出 ； 显示属性 ； 库函数 ； 控制函数 ；	<正> 把在一种机器上编写的程序转移到另外一个带有不同处理器和操作系统的机器上,这个过程称为移植。这件事可能很简单,也可能很难,这取决于程序是如何编写的,若一个程序不易移植,必含有很多与机器有关的内容,即程序中的代码只能在一种操作系统下和处理机上运行,给同一程序在不同环境中运行带来了困难。 目前无论是在工作站,还是在各类PC系列微机上,系统与应用软件大多数是采用C/C++语言编写的。各种C语言版本,如MS C 6.0,MS C/C++7.0和Borland C/C++3.0/3.1,虽然同属于C语	1994年12期_对微机与工作站C语言源程序相互移植的几点体会.pdf	http://sso.cdclib.org/interlibSSO/goto/6/=06190596Z93/kcms/detail/detail.aspx?dbCode=cjfq&filename=RJSJ199412007&dbname=CJFD9498
Windows环境下自绘三维位图按钮编程技术	软件世界	1994	1994年12期	【作者】 方旭明 ； 王倩 ； 【机构】 西南交通大学 ； 西南交通大学 ；	Windows ； VisualBasic ； 应用程序 ； 少述 ； Button ； 派生类 ； 类库 ； studio ； Paint ； visible ；	<正> 很多程序员都希望自己设计的Windows应用程序有一个形象直观的图形按钮工具框(如Microsoft公司的VisualC/C++和Vi-sual Basic等中的资源工具框),但设计中涉及的编程技术一般资料较少述及,本文介绍了Mi-crosoft公司新近推出的Visual C/C++1.0和VisualBasic3.0两种语言设计形如三维图形的位图按钮的关键技术。在实际应用程序中,按钮多成组出现且集中放置在一个子窗口或对话框中,本文将以这种情况作为讨论的重点。	1994年12期_Windows环境下自绘三维位图按钮编程技术.pdf	http://sso.cdclib.org/interlibSSO/goto/6/=06190596Z93/kcms/detail/detail.aspx?dbCode=cjfq&filename=RJSJ199412008&dbname=CJFD9498
多种汉字系统间共享使用相同字库文件的有效方法	软件世界	1994	1994年12期	【作者】 白焰 ； 【机构】 辽宁省铁岭市委办公室 ；	库文件 ； 发展阶段 ； 文件共享 ； 硬盘空间 ； 共享功能 ； 数据文件 ； 应用程序 ； POP ； PUSH ； WORD ；	<正> 目前国内比较流行的汉字系统有几十种,如常见的有联想、金山、2.13、新时代、启明星等汉字系 统。每种汉字系统又经历了不同的发展阶段,出现了各种不同的版本。由于每种汉字系统或一种汉字系统的不同版本各有自己的优点,这就要求一台微机中往往同时装入几种汉字系统或一种汉字系统的几个不同版本。每一种汉字系统中都带有一套完整的显示字库和打印字库,正常情况下必须全部装入才	1994年12期_多种汉字系统间共享使用相同字库文件的有效方法.pdf	http://sso.cdclib.org/interlibSSO/goto/6/=06190596Z93/kcms/detail/detail.aspx?dbCode=cjfq&filename=RJSJ199412009&dbname=CJFD9498
C语言数据库CodeBase 4.2的汉化	软件世界	1994	1994年12期	【作者】 黄宁 ； 【机构】 工商银行江西省赣州地区分行科技科 ；	数据库管理 ； C语言 ； CodeBase 4.2 ； 索引文件 ； 文件处理 ； 过滤操作 ； 函数库 ； UNIX ； 数据库文件 ； 通用软件 ；	<正> 一、问题提出 CodeBase是一个面向数据库和屏幕管理的C语言函数库,能用于多种操作系统(UNIX/XENIX,OS2,DOS),且在DOS系统中又支持多种C编译器(Microsoft C,Quick C,Turbo C,Zortch C++和Wat-com C).CodeBase提供了一套完整的数据库管理功能(记录的追加、插入和删除,字段的定义、存取和替换,过滤操作,文件的打开、关闭与建立,数据库和索引文件的锁定与解锁,MEM型文件处理,数据库的整理、扩展和索引等)。因此,CodeBase兼容了	1994年12期_C语言数据库CodeBase+4.2的汉化.pdf	http://sso.cdclib.org/interlibSSO/goto/6/=06190596Z93/kcms/detail/detail.aspx?dbCode=cjfq&filename=RJSJ199412010&dbname=CJFD9498
高档微机上的键码扩展与软件兼容	软件世界	1994	1994年12期	【作者】 宋立波 ； 【机构】 辽宁省铁岭市委 ；	键码 ； 主键 ； 功能键 ； 在原 ； 驱动程序 ； 应用系统 ； 热键 ； 应用程序 ； 系统扩充 ； POP ；	<正> 目前使用的高中档微机上普遍采用101个按键的键盘,这类键盘与早期使用的84按键的键盘相比,在软、硬件上都进行了一定的扩展。在硬件方面,101键的键盘在原84键的键盘基础上增加了中部光标键等与原键盘上相应按键功能相同的17个辅助按键,被称为替换按键,而原84按键的键盘上相应按键称为可替换键;在软件方面,使用101按键键盘的微机ROM BIOS,在保持原键盘硬中断INT09H	1994年12期_高档微机上的键码扩展与软件兼容.pdf	http://sso.cdclib.org/interlibSSO/goto/6/=06190596Z93/kcms/detail/detail.aspx?dbCode=cjfq&filename=RJSJ199412011&dbname=CJFD9498
由ORACLE的表生成文本文件的简便方法	软件世界	1994	1994年12期	【作者】 王崇光 ； 【机构】 中船总西安第七○五研究所 ；	ORACLE ； 装入程序 ； 生成数据 ； 表生 ； TABLE ； 命令行 ； 段名 ；	<正> 在实际应用中,有时需要由TABLE生成可以在操作系统下使用的ASCⅡ码文件。而ORACLE系统所提供的EXPORT实用程序所卸出的后备文件是一种特殊的压缩形式,是不可读的,不能用于ODL装入程序。若采用PRO＊C或OCI调用编程,先查询所需数据再写入一数据文件非常繁琐。笔者经反复摸索,找到了一个非常简便的实用方法。如要由表EXAMPLE生成数据文件,可按以下步骤实现:	1994年12期_由ORACLE的表生成文本文件的简便方法.pdf	http://sso.cdclib.org/interlibSSO/goto/6/=06190596Z93/kcms/detail/detail.aspx?dbCode=cjfq&filename=RJSJ199412012&dbname=CJFD9498
CCED使用经验	软件世界	1994	1994年12期		修改文件 ； 可执行文件 ； CCED ； 打印结果 ； 误检 ； 编辑状态 ； 选单 ； 输出功能 ； 直接打印 ； 打印效果 ；	<正> CCED以其自动制表,表格计算方面的特色获得广大用户的喜爱。而CCED 5.0在精密排版打印方面又达到了新的高度,我们在使用过程当中遇到了一些在软件使用说明中未曾提及的实际问题,现罗列如下: (1)安装CCED 5.0时,微机上的防毒卡警告说有病毒修改可执行文件,产生此现象是因为CCED安装时修改或产生某些CCED软件的可执行文件,这属于正常情况,是防毒卡误检,可不必理睬。当提问是否修改文件继续进行时,应回答继续进行。	1994年12期_CCED使用经验.pdf	http://sso.cdclib.org/interlibSSO/goto/6/=06190596Z93/kcms/detail/detail.aspx?dbCode=cjfq&filename=RJSJ199412013&dbname=CJFD9498
智能财务分析系统	软件世界	1994	1994年12期	【作者】 张治文 ； 张树民 ； 【机构】 IPC中国代表处 ； 秦皇岛农行 ；	报表输出 ； 自动化问题 ； 财务分析 ； 程序设计人员 ； 数据输入 ； 模型定义 ； 手工记帐 ； 决策支持系统 ； 会计电算化 ； 固定格式 ；	<正> 自50年代起计算机技术引入会计工作以来,会计电算化得到了广泛的应用。该系统通过对录入的会计凭证进行处理,实现了账务与会计报表的自动化。解决了手工记帐的自动化问题,反映了一个经济实体的财务状况。但这类系统从数据输入到报表输出都是按固定格式进行的,所能解决的问题都是专业程序设计人员设定的,用户不能突破这个界限。	1994年12期_智能财务分析系统.pdf	http://sso.cdclib.org/interlibSSO/goto/6/=06190596Z93/kcms/detail/detail.aspx?dbCode=cjfq&filename=RJSJ199412014&dbname=CJFD9498
INGRES——关系数据库的技术先锋	软件世界	1994	1994年12期	【作者】 李鹏 ；	关系数据库 ； INGRES ； 报表工具 ； 数据库产品 ； 数据管理 ； 表处理 ； 对象管理 ； 管理系统 ； 开发工具包 ； 应用程序 ；	<正> INGRES数据库产品分为三类,第一类为IN-GRES数据库基本管理系统,包括数据管理、知识管理和对象管理,集三种主要信息资源管理于一体。第二类是INGRES开发工具,大致分为三种,一种是INGRES基于form的工具,如支持字符界面的开发工具包Vision、表处理工具Table、表联接工具Joind-ef、报表工具Reports、生成饼图、直方图的工具Graphs等;第二种是支持图形界面的开发工具,如Windows 4GL;第三种是INGRES提供的编程语言;	1994年12期_INGRES——关系数据库的技术先锋.pdf	http://sso.cdclib.org/interlibSSO/goto/6/=06190596Z93/kcms/detail/detail.aspx?dbCode=cjfq&filename=RJSJ199412015&dbname=CJFD9498
CCED 5.0——电脑用户的良伴	软件世界	1994	1994年12期	【作者】 赵虹 ；	电脑用户 ； CCED 5.0 ； 良伴 ； 表格制作 ； 测试版 ； 计算功能 ； 教学演示 ； 文本编辑 ； 文件加密 ； 显示文件 ；	<正> 初识CCED是从一朋友处COPY到的CCED5.0测试版,当时心想它既然是测试版,那就让我来试一试它的功能吧。进入CCED的天地,首先吸引住我的是它方便的制表和计算功能。用CCED自动生成一个表格时,只需按几下键盘,在几秒钟的时间内即可完成,而且实现表格线的粗细变换,表格撑宽撑高都只需按一个键。此外,利用表格中的各种数据,可以很方便的进行行列间的计算。	1994年12期_CCED+5.0——电脑用户的良伴.pdf	http://sso.cdclib.org/interlibSSO/goto/6/=06190596Z93/kcms/detail/detail.aspx?dbCode=cjfq&filename=RJSJ199412016&dbname=CJFD9498
一个交互式框图生成工具	软件世界	1994	1994年12期	【作者】 周昱 ；	生成工具 ； 窗口界面 ； 交互式图形 ； 图形软件包 ； 应用程序 ； 事件驱动 ； 修改功能 ； 图形系统 ； 输入设备 ； 数据结构 ；	<正> 目前在国内没有出售工作站级的,用来作框图、流程图目的的软件。基于此目的,本人在Openlook环境下,用SunView的图形软件包,通过自己设计窗口界面,实现了交互式图形编辑的目的。可广泛地用	1994年12期_一个交互式框图生成工具.pdf	http://sso.cdclib.org/interlibSSO/goto/6/=06190596Z93/kcms/detail/detail.aspx?dbCode=cjfq&filename=RJSJ199412017&dbname=CJFD9498
多媒体数据库FBase	软件世界	1994	1994年12期	【作者】 刘仁宇 ；	多媒体数据库 ； FBase ； FoxPro ； 功能基础 ； 矢量汉字 ； 函数集 ； 用户界面 ； VESA ； 平滑升级 ； 媒体空间 ；	<正> FBase是由北京新未来电子技术公司开发的多媒体数据库系统,采用扩充数据库命令、函数集的方法,在FoxPro环境中增加了一百余条命令和函数,可处理图形、图像、声音、矢量汉字及简单动画,在保留FoxPro强大管理功能基础上,又拓展出一个全新的多媒体空间。FBase的图像功能十分强大,图像类型有二值图象、灰度图像及彩色图像,可对图像进行局部显示、游动、无级缩放、旋转、镜像等处理,提供存屏、恢复屏幕操作。以上图像功能支持VESA标	1994年12期_多媒体数据库FBase.pdf	http://sso.cdclib.org/interlibSSO/goto/6/=06190596Z93/kcms/detail/detail.aspx?dbCode=cjfq&filename=RJSJ199412018&dbname=CJFD9498
中国软件行业协会1994年度推荐优秀软件产品简介(二)	软件世界	1994	1994年12期		产品简介 ； 软件开发环境 ； 结构程序 ； FORTRAN ； 程序语言 ； 逻辑层次 ； 武汉市洪山区 ； 技术研究所 ； 分页 ； 图元 ；	<正> 神图软件开发环境(C/C++、FORTRAN)(武汉市洪山区远望技术研究所) 该软件是辅助C/C++,FORTRAN进行程序设计的CASE工具,体现了“流程图即程序”的原理。它淡化程序语言的具体文法形式,用户依菜单选取预置的结构图元、填入少量信息即实现程序设计。该软件的主要功能有:图示结构编辑器,拼出图示结构程序并能直接提交编译和连接;分析文本源程序成为按逻辑层次分页的图示结构程序,便于阅读和理	1994年12期_中国软件行业协会1994年度推荐优秀软件产品简介(二).pdf	http://sso.cdclib.org/interlibSSO/goto/6/=06190596Z93/kcms/detail/detail.aspx?dbCode=cjfq&filename=RJSJ199412019&dbname=CJFD9498
美国BYTE杂志读者评选的1994年度最佳软件产品	软件世界	1994	1994年12期		软件产品 ； BYTE ； 杂志读者 ； 选购指南 ； Lotus ； 数据库管理软件 ； Perfect ； 应用程序包 ； Corel ； Novell ；	<正> 美国BYTE杂志读者评选的1994年度最佳软件产品已揭晓。参加评选的均是软件产品的实际用户,因此评选结果可成为未来使用者的选购指南。 软件产品: OS/2 2.x IBM	1994年12期_美国BYTE杂志读者评选的1994年度最佳软件产品.pdf	http://sso.cdclib.org/interlibSSO/goto/6/=06190596Z93/kcms/detail/detail.aspx?dbCode=cjfq&filename=RJSJ199412020&dbname=CJFD9498
中文信息处理接口规范介绍	软件世界	1994	1994年12期	【作者】 阎宏 ； 皮卓丁 ； 【机构】 联想集团 ； 联想集团 ；	中文信息处理 ； 接口规范 ； 软件开发者 ； 技术委员会 ； 应用程序 ； 查询系统 ； 调用方式 ； 使用平台 ； 程序调用 ； 热键 ；	<正> 本文介绍CPTC—DOS-CPI规范的概貌,目的是让广大应用软件开发者对中文DOS专委会所制订的这一规范有一个总体的了解。有关技术内容仅供参考,具体细节以中文平台技术委员会正式发布的文本为准。	1994年12期_中文信息处理接口规范介绍.pdf	http://sso.cdclib.org/interlibSSO/goto/6/=06190596Z93/kcms/detail/detail.aspx?dbCode=cjfq&filename=RJSJ199412021&dbname=CJFD9498
尖端彩色印前系统——先进开放的中文彩色印前系统	软件世界	1994	1994年12期		软件技术 ； 单字节 ； 电脑科技 ； 美国专利 ； 文字库 ； 应用软件 ； 看图识字 ； 激光印字机 ； 核心软件 ； 联合开发 ；	<正> 尖端彩色印前系统(简称尖端系统),是由中外合资珠海卓夫尖端电脑科技有限公司与加拿大顶尖科技公司联合开发推出的,是一套集世界上最先进的软件硬件技术于一身,与世界上最先进的软件硬件技术同步的系统。该系统采用世界上第一套单字节中文处理技术(美国专利),使得尖端系统成为与西方软件技术完全兼容的全开放式系统,也是世界上速度最快的一套中文彩色印前系统。	1994年12期_尖端彩色印前系统——先进开放的中文彩色印前系统.pdf	http://sso.cdclib.org/interlibSSO/goto/6/=06190596Z93/kcms/detail/detail.aspx?dbCode=cjfq&filename=RJSJ199412022&dbname=CJFD9498
Microsoft FoxPro 2.5使用技术讲座 第八讲 使用FoxPro 2.5的扩展功能——FoxPro 2.5的库构造工具	软件世界	1994	1994年12期	【作者】 傅淑堂 ；	FoxPro ； 扩展功能 ； 开发环境 ； 硬件驱动程序 ； 编程接口 ； 编程语言 ； handle ； Foxpro ； 位操作 ； 命令窗口 ；	<正> Microsoft FoxPro 2.5其开发环境本身为用户提供了丰富而完备的编程语言。但是尚不止此。为了使程序员能够充分利用C语言灵活、高效、控制细腻的特点,FoxPro2.5还提供给用户一个强有力的扩展功能,即FoxPro2.5的库构造工具(FoxPro2.5Library Construction Kit),它使FoxPro有了方便的与C语言的编程接口。有了这一API,以前在FoxPro中不方便甚至不容易实现的任务,如位操作、复杂输出控制、或编写硬件驱动程序等,现在都可以利用C	1994年12期_Microsoft+FoxPro+2.5使用技术讲座+第八讲+使用FoxPro+2.5的扩展功能——FoxPro+2.5的库构造工具.pdf	http://sso.cdclib.org/interlibSSO/goto/6/=06190596Z93/kcms/detail/detail.aspx?dbCode=cjfq&filename=RJSJ199412023&dbname=CJFD9498
第九讲 在不同的网络环境中使用Microsoft FoxPro 2.5	软件世界	1994	1994年12期	【作者】 傅淑堂 ；	FoxPro ； 数据库管理系统 ； 数据库文件 ； 多用户环境 ； 功能表 ； 数据库应用程序 ； 后台管理 ； 死锁问题 ； 并发控制 ； 生成工具 ；	<正> Microsoft FoxPro2.5是一种网络版的数据库管理系统,其网络功能表现在,它允许网络上的多个用户共享其数据库文件,提供了一套在多用户环境中控制共享冲突的命令和函数,如: FLOCK 0,锁定文件 LOCK 0,锁定记录 RLOCK 0,锁定记录 SET EXCLUSIVE,设置独享/共享开关 SET LOCK,设置锁定 SET MULTILOCK,设置多个锁定 SET REFRES,设置刷新 SET REPROCESS,设置重试 UNLOCK,解锁	1994年12期_第九讲+在不同的网络环境中使用Microsoft+FoxPro+2.5.pdf	http://sso.cdclib.org/interlibSSO/goto/6/=06190596Z93/kcms/detail/detail.aspx?dbCode=cjfq&filename=RJSJ199412024&dbname=CJFD9498
《标准程序设计语言丛书》	软件世界	1994	1994年12期	【机构】 全国信息技术标准化委员会 ； 程序设计语言分技术委员会 ；	程序设计语言 ； 图形核心系统 ； PASCAL ； 现已出版 ； 技术委员会 ； 计算机软件 ； BASIC ； 中国铁道出版社 ； 玉方 ； 技术标准化 ；	<正> 全国信息技术标准化委员会程序设计语言分技术委员会为在我国推行程序设计语言的国际标准和国家标准,在中国铁道出版社的大力支持下,向我国的广大计算机软件同行推出一套严格按照国际标准、国家标准撰写的程序设计语言丛书。现已出版了五册,即:《C语言》(孙玉方等著)、《PASCAL语言》(郑国梁等著)、《BASIC语言》(邓良松等著)、《GKS图形核心系统》(方家	1994年12期_《标准程序设计语言丛书》.pdf	http://sso.cdclib.org/interlibSSO/goto/6/=06190596Z93/kcms/detail/detail.aspx?dbCode=cjfq&filename=RJSJ199412025&dbname=CJFD9498
英汉对照软件专业时文选读	软件世界	1994	1994年12期	【作者】 剑欣 ；	软件专业 ； 英汉对照 ； Berkeley ； Release ； UNIX ； command ； stuff ； administrator ； 运行命令 ； train ；	<正> UNIX VARIANTS How different are they?(Continued from last issue). For example,if a programmer wishes to zero out ablock of storage in System V Release 4,the command ismemset; BSD systems use the command bzero. "If people want to make sure their knowledge does-n’ t become obsolete,they should train on [System V Re-lease 4] because it is where there has been a large effortto bring all this stuff together, " says Ray Swartz, presi-dent of Berkeley Decision Systems, makers of Trainingon Video products for learning Unix.	1994年12期_英汉对照软件专业时文选读.pdf	http://sso.cdclib.org/interlibSSO/goto/6/=06190596Z93/kcms/detail/detail.aspx?dbCode=cjfq&filename=RJSJ199412026&dbname=CJFD9498
