title	journal_name	year	issue	author	keywords	summary	pdf_filename	article_url
BCM抵御灾难的有效管理方法	软件世界	2008	2008年07期	【作者】 陈建新 ； 【机构】 中国信息化推进联盟BCM专业委员会 ；	业务中断 ； BCM ； 管理方法 ； 数据恢复 ； 信息基础设施 ； 容灾 ； 预先计划 ； 企业业务流程 ； 管理体系建设 ； 叶志平 ；	<正>目前我国大多数企业在遇到突发事件时,通常的做法是启动相关的应急预案,通过应急管理对其事件实施预警、处置和恢复。它所关注的重点是员工的人身安全和企业的资产等。而突发事件对企业的冲击所造成的业务中断,并由此引发	2008年07期_BCM抵御灾难的有效管理方法.pdf	http://sso.cdclib.org/interlibSSO/goto/6/=06190596Z93/kcms/detail/detail.aspx?dbCode=cjfq&filename=RJSJ200807044&dbname=CJFD0608
构建随需应用的未来	软件世界	2008	2008年07期	【作者】 王勇 ；	企业业务流程 ； 商业流程 ； 用友软件 ； 反应能力 ； 用友公司 ； 信息系统 ； 管理软件厂商 ； 战略支持 ； 商业环境 ； 企业应用集成 ；	<正>前几天,和一位制造业的CIO朋友聊天,他说,虽然"灵活性"并不是他在选型ERP软件时必须考虑的首要因素,但它却是在以后的业务开展中最想得到的东西。确实如此。企业业务流程对外部商业环境的反应能力将直接决定着企业的竞争力,甚至是生死存亡。而业务流程能否成功改变,很大程度上取决于其信息系统具备的灵活转变及创新适应能力。因此,CIO们希望能够借助灵活的方式支持商业流程转变并实现创新。	2008年07期_构建随需应用的未来.pdf	http://sso.cdclib.org/interlibSSO/goto/6/=06190596Z93/kcms/detail/detail.aspx?dbCode=cjfq&filename=RJSJ200807045&dbname=CJFD0608
数据防护领域的木桶理论	软件世界	2008	2008年07期	【作者】 卢敏 ；	木桶理论 ； 小摊贩 ； 管理处处长 ； 关键流程 ； 内部文件 ； 机密资料 ； 典章制度 ； 任君 ； 安全防护 ； 信息安全 ；	<正>某企业科技管理处处长李某,在深圳龙华园附近,目睹了小摊贩在贩售企业商业机密资料,一本本影印的企业内部文件,一字排开任君挑选,有产品研发文件、品质关键流程文件,甚至是公司典章制度。一些知名科技制造公司,历经多年打拼、投入巨资研发的成果,在这里只需3元人民币!	2008年07期_数据防护领域的木桶理论.pdf	http://sso.cdclib.org/interlibSSO/goto/6/=06190596Z93/kcms/detail/detail.aspx?dbCode=cjfq&filename=RJSJ200807046&dbname=CJFD0608
英特尔将并行化撒落凡间	软件世界	2008	2008年07期	【作者】 郝艳 ；	产品事业部 ； 自信满满 ； 高端人群 ； 并行化 ； 并行编程 ； 多核时代 ； 开发者 ； 软件研发 ； 软件销售 ； 软件开发人员 ；	<正>"一年前,英特尔编译器的主要用户还是以科研院所、能源单位为主体的高端人群,而一年后的今天,英特尔编译器的主要用户则已经是普通的软件开发人员,这些均源于多核的普及!"英特尔开发者产品事业部销售和业务发展总监佘飞对多核时代的到来自信满满,"多核并行编程已经成为软件研发人员不可规避的问题。"	2008年07期_英特尔将并行化撒落凡间.pdf	http://sso.cdclib.org/interlibSSO/goto/6/=06190596Z93/kcms/detail/detail.aspx?dbCode=cjfq&filename=RJSJ200807047&dbname=CJFD0608
放大困难 缩小成绩	软件世界	2008	2008年07期	【作者】 涂兰敬 ；	刘积仁 ； 软件外包业务 ； 离岸外包 ； 中国软件外包 ； 市场占有率 ； 医疗设备公司 ； 工程解决方案 ； 市场领先 ； 产品工程 ； 服务转型 ；	<正>近期,在"新东软,新征程"东软战略发布会上,东软总裁兼CEO刘积仁博士表示,东软未来新的使命将是成为全球优秀的IT解决方案与服务供应商。据悉,离岸软件与服务外包作为东软重点的业务发展板块,在近10年中获得了飞跃发展。	2008年07期_放大困难+缩小成绩.pdf	http://sso.cdclib.org/interlibSSO/goto/6/=06190596Z93/kcms/detail/detail.aspx?dbCode=cjfq&filename=RJSJ200807048&dbname=CJFD0608
Jazz,驾御研发的力量	软件世界	2008	2008年07期	【作者】 郝艳 ；	软件研发 ； 需求变更 ； 进度计划 ； 软件集团 ； 团队工作 ； Jazz ； 软件平台 ； 软件生产过程 ； 难于上青天 ； 咨询顾问 ；	<正>按时按量地研发对于软件研发人员而言,简直是"难于上青天。"的确,对于需求变更不断的软件研发来说,成功的"作品"少之又少。据美国一份评估报告显示,17个主要的国防部软件合同中,平均28个月的进度计划推迟了20个月才完成;一个4年应该完成的任务,	2008年07期_Jazz,驾御研发的力量.pdf	http://sso.cdclib.org/interlibSSO/goto/6/=06190596Z93/kcms/detail/detail.aspx?dbCode=cjfq&filename=RJSJ200807049&dbname=CJFD0608
信息安全需分级管理	软件世界	2008	2008年07期	【作者】 卢敏 ；	信息安全 ； 信息泄露 ； 分级管理 ； 防毒软件 ； 管理权限 ； 瑞星公司 ； 下属机构 ； 计算机专业知识 ； 瑞星杀毒 ； 软件网络 ；	<正>A是一家国有大型企业,拥有庞杂的体系,众多的下属机构。分支机构在城市间通过均架设局域网,通过专线和交换机沟通。每天大量业务数据通过网络传输和处理,一旦发生信息泄露,后果将十分严重。信息安全问题可怎么解决?	2008年07期_信息安全需分级管理.pdf	http://sso.cdclib.org/interlibSSO/goto/6/=06190596Z93/kcms/detail/detail.aspx?dbCode=cjfq&filename=RJSJ200807050&dbname=CJFD0608
向科技要警力	软件世界	2008	2008年07期	【作者】 卢敏 ；	交警系统 ； 外勤人员 ； 紧急性 ； 数据缓存 ； 后台管理系统 ； 辅助工具 ； 数据整合 ； 移动性 ； 移动通信 ； 二代身份证 ；	<正>移动性、突发性、紧急性强。这是公安交警人员平时工作的共同特点。由于公安交警系统中一线外勤人员居多,工作的性质和特点决定了他们需要在非办公环境的一线路面现场对信息数据进行查询和处理。以往的依靠原有的固定专网方式已无法支持和适应大	2008年07期_向科技要警力.pdf	http://sso.cdclib.org/interlibSSO/goto/6/=06190596Z93/kcms/detail/detail.aspx?dbCode=cjfq&filename=RJSJ200807051&dbname=CJFD0608
ERP的原则	软件世界	2008	2008年07期	【作者】 齐书阳 ；	ERP ； 中药加工 ； 物料管理 ； 流程控制 ； 中药生产 ； 财务分析 ； 供应商选择 ； 粗放式管理 ； 背后原因 ； 贸易行业 ；	<正>"中国ERP实施的失败率是很高的,但是在我看来却并没有那么难。"ERP项目已成功运行一年的北京市同仁堂制药有限公司副总经理李江这样告诉记者。	2008年07期_ERP的原则.pdf	http://sso.cdclib.org/interlibSSO/goto/6/=06190596Z93/kcms/detail/detail.aspx?dbCode=cjfq&filename=RJSJ200807052&dbname=CJFD0608
告别信任危机	软件世界	2008	2008年07期	【作者】 郝艳 ；	企业市场 ； 社区论坛 ； 最终用户 ； 网络口碑 ； 口碑营销 ； 个人媒体 ； 企业产品 ； 消费行为 ； 智能分析 ； 负面评价 ；	<正>在Web2.0时代,互联网信息将直接挑战零售业、餐饮业等直接面对最终用户的企业市场。有资料显示,仅2006年7月份,我国就有43.2%的网民经常使用论坛、BBS、讨论组,有60%以上的社区网民通过社区找寻自身所面临的问题的解决方案,而有33.5%的网民消费行为受到社区论坛经验的影响。	2008年07期_告别信任危机.pdf	http://sso.cdclib.org/interlibSSO/goto/6/=06190596Z93/kcms/detail/detail.aspx?dbCode=cjfq&filename=RJSJ200807053&dbname=CJFD0608
呼叫中心,用户体验是关键	软件世界	2008	2008年07期	【作者】 卢敏 ；	用户体验 ； 呼叫中心 ； 携程 ； 令人 ； 旅游网站 ； 数据预测 ； 信息技术部 ； 统计分析 ； 国航 ； 成本中心 ；	<正>几年前,当用户选择呼叫中心系统时,市场上琳琅满目的产品加上令人眼花缭乱的组合,让很多专业人士都往往无所适从,而今天,这样的情况正在发生很大改变。	2008年07期_呼叫中心,用户体验是关键.pdf	http://sso.cdclib.org/interlibSSO/goto/6/=06190596Z93/kcms/detail/detail.aspx?dbCode=cjfq&filename=RJSJ200807054&dbname=CJFD0608
变革您的数据中心	软件世界	2008	2008年07期	【作者】 卢敏 ；	数据中心 ； 电力消耗 ； 成本效率 ； 数据爆炸 ； 服务器虚拟化 ； 系统维护人员 ； NetApp ； 科研人员 ； 文件服务 ； 存储需求 ；	<正>IT数据中心正经历一场重大变革。客户面临数据爆炸式增长,电力消耗和成本效率多重挑战、服务器虚拟化正改变着服务器、网络和存储基础架构。加拿大迈克·史密斯基因组科学中心有200多名科学家和科研人员。该中心系统维护人员Greg Stazyk表示:"由于我们的大部分	2008年07期_变革您的数据中心.pdf	http://sso.cdclib.org/interlibSSO/goto/6/=06190596Z93/kcms/detail/detail.aspx?dbCode=cjfq&filename=RJSJ200807055&dbname=CJFD0608
浅析政务信息网络化发展	软件世界	2008	2008年07期	【作者】 张泽根 ； 【机构】 海淀区信息化工作办公室 ；	政务信息 ； 政府信息化建设 ； 政府体制改革 ； 网络化发展 ； 电子政务 ； 门户网 ； 服务型转变 ； 协同平台 ； 业务梳理 ； 架构层 ；	<正>随着政府体制改革的逐步深入和政府信息化建设的飞速发展,我国政务信息网络化建设取得了显著成就,开始进入一个非常关键的时期,即从基础建设到全面应用的深刻变革时期。作为政务应用发展的必然趋势,全面打造服务型政府是贯穿我国政务信息网络化建设的重	2008年07期_浅析政务信息网络化发展.pdf	http://sso.cdclib.org/interlibSSO/goto/6/=06190596Z93/kcms/detail/detail.aspx?dbCode=cjfq&filename=RJSJ200807056&dbname=CJFD0608
EIM的葡萄是否已经熟了	软件世界	2008	2008年07期	【作者】 王勇 ；	即时通讯 ； 即时消息 ； 语音功能 ； 核心机密 ； 腾讯 ； EIM ； 雅虎 ； 安全性考虑 ； 王志东 ； 协同软件 ；	<正>当整合了IP语音功能、Web会议、即时消息及电子邮件等功能,通过加强通讯协作进而提出统一通讯概念后,企业即时通讯(EIM)已开始在内涵上和QQ、MSN等个人级IM工具有了天壤之别。而更为重要的是,当企业的大量核心机密蕴藏在IM之上时,企业就不得不出于安全考虑而使用EIM软件。在个性化需求与安全性考虑的共同作用下,EIM似乎正在迎来自己真正的春天。	2008年07期_EIM的葡萄是否已经熟了.pdf	http://sso.cdclib.org/interlibSSO/goto/6/=06190596Z93/kcms/detail/detail.aspx?dbCode=cjfq&filename=RJSJ200807057&dbname=CJFD0608
办公室里的虚拟化	软件世界	2008	2008年07期	【作者】 涂兰敬 ；	盗版软件 ； 安装程序 ； 内部信息化 ； 软件正版化 ； 病毒侵袭 ； 配置企业 ； 计算机环境 ； 工作环境 ； 应用程序 ； 购买数量 ；	<正>你是否为了企业内的PC每天的维护而烦恼?你是否为新PC安装程序、病毒侵袭导致无法正常使用等这样的问题头疼,担心不经意使用的盗版软件而承担风险?……	2008年07期_办公室里的虚拟化.pdf	http://sso.cdclib.org/interlibSSO/goto/6/=06190596Z93/kcms/detail/detail.aspx?dbCode=cjfq&filename=RJSJ200807058&dbname=CJFD0608
软件外包需打通任督二脉	软件世界	2008	2008年07期	【作者】 王勇 ；	软件外包业务 ； 任督二脉 ； 萨蒂 ； 信息产业局 ； 国内软件 ； 人才储备 ； 规模性 ； 综合服务能力 ； 产业基地 ； 调研数据 ；	<正>说起外包,言必称印度。诚然,塔塔咨询、印孚瑟斯、萨蒂扬、维布络这些耳熟能详的名字不断刺激着中国软件外包神经。在这些筹码的激励下,很多软件公司都把软件外包业务作为公司的发展目标,甚至一些外包企业已展开诸多并购,很多城市也对外包重视程度日益增强,逐渐形成了有区域特色的外包。	2008年07期_软件外包需打通任督二脉.pdf	http://sso.cdclib.org/interlibSSO/goto/6/=06190596Z93/kcms/detail/detail.aspx?dbCode=cjfq&filename=RJSJ200807059&dbname=CJFD0608
系统工具专题	软件世界	2008	2008年07期	【作者】 七影 ；	网管员 ； 运行平台 ； 软件功能 ； 垃圾文件 ； 窗口精灵 ； 超级兔子 ； 优化大师 ； 悠悠闹钟 ； 文件恢复软件 ； 右键菜单 ；	我们在用电脑的时候都会遇到一些难以容忍的小问题,比如操作不习惯、没查出病毒却越来越慢、莫名其妙浏览器就变了样子等等。虽然我们不去解决这些问题,依然可以使用。但是大家都活到二十一世纪了,电脑这东西凭什么就不让我们用得更顺心一点。可是电脑毕竟是高级电子设备,读者朋友们又不都是程序员、网管员出身。去向老鸟请教呢,往往是成吨的术语,听得一头雾水。想请人上门来一趟,平日积累的那些小问题,估计没三、四个小时弄不完。在这个鸡牛猪羊组团升值的年代,算算请人家"随便吃点什么"的成本……本期自由软件栏目,我们为大家介绍的是一些系统工具,这些涵盖多方面的软件可以帮助我们很容易的调教电脑。让貌似很深奥的问题迎刃而解。随后你会发现,电脑其实是个欺软怕硬的家伙,只要找对软件,想怎么收拾就怎么收拾。一天收拾它两遍,第一遍练手,第二遍出气。	2008年07期_系统工具专题.pdf	http://sso.cdclib.org/interlibSSO/goto/6/=06190596Z93/kcms/detail/detail.aspx?dbCode=cjfq&filename=RJSJ200807060&dbname=CJFD0608
工具百宝箱	软件世界	2008	2008年07期		网页病毒 ； 五笔 ； 内存释放专家 ； 超级兔子桌面秀 ； 超微型 ； 极点五笔输入法 ； 梦幻桌面 ； 无忧隐藏 ； 中文输入 ； 漏洞扫描 ；	本期免费工具软件栏目除了照常为大家推荐小巧实用的免费工具软件以外,还包括了一些前面自由软件专题中,没有推荐的一些"超微型"系统工具软件。此外,本月千呼万唤的FireFox 3浏览器终于正式发布了,饱受网页病毒困扰的读者,不妨尝试一下这款非常安全的浏览器。	2008年07期_工具百宝箱.pdf	http://sso.cdclib.org/interlibSSO/goto/6/=06190596Z93/kcms/detail/detail.aspx?dbCode=cjfq&filename=RJSJ200807061&dbname=CJFD0608
BI:系统决策密钥	软件世界	2008	2008年07期		省烟草专卖局 ； BI ； 生产基地 ； 卷烟销售 ； 决策分析 ； 专题分析 ； 数据报表 ； 专卖管理 ； 数据仓库 ； 品牌集中度 ；	<正>素有"天府之国"美誉的四川,既是国内烟草重要的生产基地,同时也是烟草消费大省。而四川省烟草专卖局(公司)(简称四川烟草)作为四川省连续多年的纳税大户,肩负着将从"两烟大省"向"两烟强省"跨越的重任。无疑,先进的信息技术成为四川烟草提升自身竞争力和实力的重要工具。	2008年07期_BI:系统决策密钥.pdf	http://sso.cdclib.org/interlibSSO/goto/6/=06190596Z93/kcms/detail/detail.aspx?dbCode=cjfq&filename=RJSJ200807062&dbname=CJFD0608
从IT到业务——运维管理的深层次探讨	软件世界	2008	2008年07期	【作者】 马珂 ； 【机构】 神州泰岳软件股份有限公司咨询业务部 经理 ；	运维管理 ； 神州泰岳 ； 部门主管 ； 资源配置 ； 度量和 ； 经济运行 ； 员工信息 ； 网络门户 ； 运维体系 ； 综合信息平台 ；	<正>企业的发展和IT环境的成熟是一个互相驱动、交替上升的过程。商业社会中,企业作为一个经济运行实体,其所有的活动和投入都是围绕利益产出的目标进行的。在当前激烈的商业竞争环境中,企业正不断地进行变革,以适应市场和用户的需求。	2008年07期_从IT到业务——运维管理的深层次探讨.pdf	http://sso.cdclib.org/interlibSSO/goto/6/=06190596Z93/kcms/detail/detail.aspx?dbCode=cjfq&filename=RJSJ200807063&dbname=CJFD0608
声音	软件世界	2008	2008年06期		销售期 ； 软件产业规模 ； 用友软件 ； 中国软件业 ； 中小企业用户 ； 在线服务 ； 移动应用 ； 服务转型 ； 电子商务服务 ； 终端设备 ；	<正>一句话"WindOWS XP‘续命’至2010年。"微软将再次延长Windows XP的销售期至2010年.以便PC制造商在低价电脑上预装该操作系统。微软OEM集团高级主管Rob Young表示.此次Windows XP延期决定主要面向"上网机"(NetTop).这	2008年06期_声音.pdf	http://sso.cdclib.org/interlibSSO/goto/6/=06190596Z93/kcms/detail/detail.aspx?dbCode=cjfq&filename=RJSJ200806002&dbname=CJFD0608
融合分裂的运维体系	软件世界	2008	2008年06期	【作者】 齐书阳 ；	运维体系 ； 网络系统管理 ； 信息安全管理 ； 运维管理 ； 用户认证 ； 流程控制 ； 管理设备 ； 运维人员 ； 神州泰岳 ； 业务流程 ；	<正>在信息化应用不断深入的今天,保证IT系统的安全、稳定、高效的运行开始变得越来越重要。于是各种IT运维管理系统纷纷上马.网络系统管理、服务流程管理、信息安全管理等。	2008年06期_融合分裂的运维体系.pdf	http://sso.cdclib.org/interlibSSO/goto/6/=06190596Z93/kcms/detail/detail.aspx?dbCode=cjfq&filename=RJSJ200806003&dbname=CJFD0608
联盟合作	软件世界	2008	2008年06期		开源项目 ； 中间件 ； Apache ； WebServices ； APACHE ； 数字出版技术 ； 清华大学出版社 ； 出版系统 ； 方正阿帕比 ； 艾克斯特 ；	<正>5月21日,APACHE董事会全票通过Tuscany成为顶级项目的提案。Tuscany开源项目于两年前开始在Apache开源组织中孵化,它涵盖了WebServices、SCA和SDO等SOA技术,得到了IBM、普元、德勤、Amdocs等商业中间件公司和IT服务商的大力投入。	2008年06期_联盟合作.pdf	http://sso.cdclib.org/interlibSSO/goto/6/=06190596Z93/kcms/detail/detail.aspx?dbCode=cjfq&filename=RJSJ200806004&dbname=CJFD0608
互操作不是概念	软件世界	2008	2008年06期	【作者】 卢敏 ；	互操作性 ； 用友软件 ； 盗版率 ； 企业解决方案 ； 纳税企业 ； 数据交换 ； 通信界 ； 企业业务系统 ； 技术准入 ； 应用程序 ；	<正>微软在互操作性上有十多年的努力了,主要体现在四方面,第一是产品的互操作性,第二是听取社区的反馈,社区包括用户和合作伙伴,还有竞争对手;第三是通过不同的技术	2008年06期_互操作不是概念.pdf	http://sso.cdclib.org/interlibSSO/goto/6/=06190596Z93/kcms/detail/detail.aspx?dbCode=cjfq&filename=RJSJ200806005&dbname=CJFD0608
市场状况	软件世界	2008	2008年06期		市场状况 ； 阿里软件 ； 复合增长率 ； 盗版率 ； 行业领袖 ； 互联网实验室 ； 法律人士 ； 美国经济 ； 国家知识产权局 ； 货币对 ；	<正>6月2日,IDC中国分析认为.地震对中国整体IT市场的影响很小,灾后重建以及地震带来的启示会在未来三年中带来IT市场的反弹,预计IT支出增速将比原预测增加1%-2%。	2008年06期_市场状况.pdf	http://sso.cdclib.org/interlibSSO/goto/6/=06190596Z93/kcms/detail/detail.aspx?dbCode=cjfq&filename=RJSJ200806006&dbname=CJFD0608
选件让数据库更贴身	软件世界	2008	2008年06期	【作者】 卢敏 ；	数据库技术 ； 数据库系统 ； 选件 ； 数据卫士 ； 特定要求 ； 内存数据库 ； Guard ； 数据仓库 ； 应用测试 ； Orade ；	<正>数据库发展到今天,对于企业而言,在一些传统需求被满足的同时,在一些特定要求方面,迫切需要功能更加丰富,更加庞大而有力的数据库系统来支持,要求数据库系统不断吸取新的特性。作为数据库的有力支撑,数据库选件可以满足企业当前的需求,帮助企业实现	2008年06期_选件让数据库更贴身.pdf	http://sso.cdclib.org/interlibSSO/goto/6/=06190596Z93/kcms/detail/detail.aspx?dbCode=cjfq&filename=RJSJ200806007&dbname=CJFD0608
软件政策	软件世界	2008	2008年06期		产品博览会 ； 信息产业局 ； 人才计划 ； 评估目标 ； 人才工程 ； 西安软件园 ； 就业前培训 ； 康普 ； 基础设施 ； 人才培养工程 ；	<正>6月4日.南京市政府副秘书长施卫国表示,第四届中国(南京)国际软件产品博览会将积极推行市场化运作模式和机制.引入"外包办展"模式.探索开展专场活动和招展招商等工作的外包。	2008年06期_软件政策.pdf	http://sso.cdclib.org/interlibSSO/goto/6/=06190596Z93/kcms/detail/detail.aspx?dbCode=cjfq&filename=RJSJ200806008&dbname=CJFD0608
快100倍的设计体验	软件世界	2008	2008年06期	【作者】 涂兰敬 ；	设计体验 ； 参数建模 ； 尺寸驱动 ； 编辑点 ； 即时通讯 ； 结构性障碍 ； 设计变更 ； 产品行销 ； 三维环境 ； 防护屏障 ；	<正>Siemens PLM Software近期公布了同步建模技术,这是PLM行业首个基于特征的无参数建模。这项技术,是Siemens PLM Soft- ware一体化的产品和制造生命周	2008年06期_快100倍的设计体验.pdf	http://sso.cdclib.org/interlibSSO/goto/6/=06190596Z93/kcms/detail/detail.aspx?dbCode=cjfq&filename=RJSJ200806009&dbname=CJFD0608
新品推荐	软件世界	2008	2008年06期		新品推荐 ； 认证服务器 ； 风险管理 ； 启明星辰 ； 个人防火墙 ； 性能管理 ； 业务支撑系统 ； 即时通讯 ； 朗讯 ； 多核技术 ；	<正>RSA发布了RSA7.1版本认证服务器,其注重智能化以及优异的性能.进一步强化了RSA公司信息风险管理解决方案组合。	2008年06期_新品推荐.pdf	http://sso.cdclib.org/interlibSSO/goto/6/=06190596Z93/kcms/detail/detail.aspx?dbCode=cjfq&filename=RJSJ200806010&dbname=CJFD0608
安全报告该相信谁	软件世界	2008	2008年06期	【作者】 齐书阳 ；	入侵防护系统 ； 防病毒 ； Novell ； 软件产业基地 ； 应用程序 ； 防御系统 ； 丁全 ； 最佳做法 ； 业务规则 ； 适用性分析 ；	<正>入侵防护系统(IDS)、防火墙、防病毒应用程序等安全工具广泛存在于企业IT环境中,它们时时都在生成大量的数据。但是,如果你的防火墙指出了一个紧急问题,而您	2008年06期_安全报告该相信谁.pdf	http://sso.cdclib.org/interlibSSO/goto/6/=06190596Z93/kcms/detail/detail.aspx?dbCode=cjfq&filename=RJSJ200806011&dbname=CJFD0608
人才培训	软件世界	2008	2008年06期		欧特克 ； 科技精英 ； 职业梦想 ； 软件研发 ； 培训中心 ； 重点软件企业 ； 中关村软件园 ； 软件产业基地 ； 软博会 ； 美国惠普 ；	<正>5月18.主题为"成就未来科技精英,开启职业梦想之旅"的欧特克中国研究院2008招聘项目于近日在上海启程。作为欧特克中国研究院实习生项目的一部分.本次实	2008年06期_人才培训.pdf	http://sso.cdclib.org/interlibSSO/goto/6/=06190596Z93/kcms/detail/detail.aspx?dbCode=cjfq&filename=RJSJ200806012&dbname=CJFD0608
“移动”革命	软件世界	2008	2008年06期	【作者】 郝艳 ；	企业应用软件 ； 沟通工具 ； 软件开发 ； 移动终端 ； 首席技术官 ； 高性能应用 ； 消费电子产品 ； 桌面系统 ； 用户界面 ； 产品更新速度 ；	<正>移动终端的智能化使移动设备上的软件开发显得越发重要。随着信息化不断普及,移动设备已不再是简单的沟通工具,近而演变为以企业信息化为核心的企业应用软件终端,或以个性化通讯为核心的个人"时尚标志",无论怎样,	2008年06期_“移动”革命.pdf	http://sso.cdclib.org/interlibSSO/goto/6/=06190596Z93/kcms/detail/detail.aspx?dbCode=cjfq&filename=RJSJ200806013&dbname=CJFD0608
开源资讯	软件世界	2008	2008年06期		RedHat ； 大中华地区 ； 销售区 ； 巡展活动 ； 台式计算机 ； 化期 ； 程序运作 ； 奥运福娃 ； 台北电脑展 ； Android ；	<正>Mozilla FireFox 3.0 RC2已经完成笋发布.它是FireFox 3.0的第二个Rc测试版本。RedHat Enterprise Linux 5.2已于2008年5月21日发布。	2008年06期_开源资讯.pdf	http://sso.cdclib.org/interlibSSO/goto/6/=06190596Z93/kcms/detail/detail.aspx?dbCode=cjfq&filename=RJSJ200806014&dbname=CJFD0608
ERP设计不应量“型”而力	软件世界	2008	2008年06期	【作者】 王勇 ；	ERP ； 副总裁 ； 渠道市场 ； 经验总结 ； 企业解决方案 ； 中小企业规模 ； 财务会计 ； 升级产品 ； 实施成本 ； 中型企业 ；	<正>"‘套餐式ERP’的推出蕴涵着SAP36年的经验总结,以及对中国中小企业信息化的最新思考和独特见解。"SAP中国公司副总裁于志伟表示,"它是针对中小企业渠道市场推出的一套解决	2008年06期_ERP设计不应量“型”而力.pdf	http://sso.cdclib.org/interlibSSO/goto/6/=06190596Z93/kcms/detail/detail.aspx?dbCode=cjfq&filename=RJSJ200806015&dbname=CJFD0608
活动预告	软件世界	2008	2008年06期		计世资讯 ； 信息产业局 ； 运营服务 ； 宁波市鄞州区 ； 用友公司 ； 浙江宁波 ； 经验交流会 ； 信息化创新 ； Fowler ； 移动技术 ；	<正>6月9日"2008 SaaS在中国——2008中国软件运营服务(SaaS)大会"将移师浙江宁波,由计世资讯、宁波市信息产业局共同主办.并由宁波市鄞州区人民政府承办。	2008年06期_活动预告.pdf	http://sso.cdclib.org/interlibSSO/goto/6/=06190596Z93/kcms/detail/detail.aspx?dbCode=cjfq&filename=RJSJ200806016&dbname=CJFD0608
