title	journal_name	year	issue	author	keywords	summary	pdf_filename	article_url
运营商管道化蕴育新商机	软件和信息服务	2012	2012年06期	【作者】 黄锡伟 ； 【机构】 健友集团 ； 亚信联创 ；	管道化 ； 网络发展趋势 ； 网络实体 ； 综合平台 ； 业务承载 ； 电话网络 ； 网络分层 ； 数据业务 ； 网络设备 ； 传统电信网络 ；	<正>运营商要做智能管道的主导者、综合平台提供者以及内容和业务的参与者,为运营商提供服务的软件服务商能否跟上这一变化的脚步?网络发展趋势表现的特点是:硬件快速发展,网络设备的能力和容量快速提升,原先复杂的网络结构不断简化。从最初电话网络,交换和控制分离,网络分层分级,不同业务需要有不同网络实体承载,到现在视频、数据和话音信息可以在一个网络上承载,即所谓的三网合一。	2012年06期_运营商管道化蕴育新商机.pdf	http://sso.cdclib.org/interlibSSO/goto/6/=06190596Z93/kcms/detail/detail.aspx?dbCode=cjfq&filename=RJSJ201206036&dbname=CJFDLAST2014
世界很折腾 中国要淡定	软件和信息服务	2012	2012年06期	【作者】 尚辞 ；	郎咸平 ； 四大银行 ； 谏言 ； 民生领域 ； 房价问题 ； 藏富于民 ； 文化生活 ； 国家战略 ； 盛世危言 ； 房地产政策 ；	<正>全书内容横跨外交、内政,并广泛涉及住房、教育、投资理财、文化生活等诸多民生领域,多元而完整的内容架构,为国民尤其是针对执政者献上一份立体且全面的谏言。就在郎咸平郎旋风以新著《中国经济到了最危险的边缘》,发出诸如"中国经济开始陷入全面衰退"、"我们距离香港式的楼市崩盘只差半步"、"国有四大银行可能重蹈日本覆辙"等看似异常不淡定的盛世危	2012年06期_世界很折腾+中国要淡定.pdf	http://sso.cdclib.org/interlibSSO/goto/6/=06190596Z93/kcms/detail/detail.aspx?dbCode=cjfq&filename=RJSJ201206037&dbname=CJFDLAST2014
领导力:领悟人性、导引团队和重建文化	软件和信息服务	2012	2012年06期	【作者】 黄锡伟 ；	文化变革 ； 讲述方式 ； 咨询案例 ； 现代企业文化 ； 葛优 ； 人力资源工作 ； 商学院教授 ； 核心课题 ； 文化定义 ； 团体动力学 ；	<正>这是一本讲述如何运用领导力进行组织文化变革的实用性书籍,以咨询案例的讲述方式展开内容让读者更易获取其中的内容精髓。电影"天下无贼"中葛优扮演的老贼说到:"人心散了,队伍不好带"、"二十一世纪最缺的是人才"两句台词时,电影院都会发出人们会心的笑声。在这个	2012年06期_领导力:领悟人性、导引团队和重建文化.pdf	http://sso.cdclib.org/interlibSSO/goto/6/=06190596Z93/kcms/detail/detail.aspx?dbCode=cjfq&filename=RJSJ201206038&dbname=CJFDLAST2014
起名字	软件和信息服务	2012	2012年06期	【作者】 郭嘉凯 ；	起名字 ； 魏云 ； 创业理想 ； 黄非 ； 爬起来 ； 创业公司 ； 策划书 ； 金龟婿 ； 性情温和 ； 强打精神 ；	<正>当天晚上,魏云生又一次失眠了。躺在床上,满脑袋都是各种公司的名字。有了爱情的滋润,魏云生的创业理想一度被其抛到了九霄云外。不过,前几天与未来岳父岳母的一番会面,让魏云生从甜蜜的爱情梦中彻底惊醒。在问了魏云生的工作、收入、资产等状况后,未来岳父岳母的脸马上从春天转为冬天,那股寒冷劲儿让魏云生从心里感到一阵阵的凉意。本来说好晚上请	2012年06期_起名字.pdf	http://sso.cdclib.org/interlibSSO/goto/6/=06190596Z93/kcms/detail/detail.aspx?dbCode=cjfq&filename=RJSJ201206039&dbname=CJFDLAST2014
不该错过的需求	软件和信息服务	2012	2012年05期	【作者】 王晓民 ； 【机构】 《软件和信息服务》 ；	移动应用 ； 信息系统应用 ； 移动功能 ； 信息技术服务 ； 开发公司 ； 合作厂商 ； 业务代表 ； 营销思路 ； 营销革命 ； 应用专题 ；	<正>"最近我正在组织开发公司的移动应用解决方案。""是吗?""智能手机现在在公司员工里很普及了,我发现移动功能与公司的信息系统应用可以很好的结合,比如审批,有了智能手机,公司领导可以随时随地进行审批,不用像以前,一定要回到办公室电脑前,才能完成操作。领导对这项应用很感兴趣,但移动应用	2012年05期_不该错过的需求.pdf	http://sso.cdclib.org/interlibSSO/goto/6/=06190596Z93/kcms/detail/detail.aspx?dbCode=cjfq&filename=RJSJ201205002&dbname=CJFDLAST2014
产业资源集聚促上海车载信息服务谋动	软件和信息服务	2012	2012年05期	【作者】 江勇 ； 【机构】 同济大学 ； 上海市企业信息化促进中心 ；	车载信息 ； 安全防护 ； 无线移动通信 ； 集成服务 ； 远程诊断 ； 产业资源 ； 产业发展环境 ； 信息娱乐 ； 辅助导航 ； 信息服务产业 ；	<正>产业资源高度集聚、产业链齐整,如此先天优势,试想上海何以会放过车载信息服务业这一抢夺产业新高地之契机。所谓车载信息服务,就是通过车内终端设备(包括前装车机、后装智能终端等)和无线移动通信网络,以及集成服务平台(TSP)进行车载信息交互,从而为车辆驾乘者及相关人员提供的服务,主要实现辅助导航、安全防护、远程诊断、信息娱乐等方面的功能。	2012年05期_产业资源集聚促上海车载信息服务谋动.pdf	http://sso.cdclib.org/interlibSSO/goto/6/=06190596Z93/kcms/detail/detail.aspx?dbCode=cjfq&filename=RJSJ201205003&dbname=CJFDLAST2014
大数据时代下的Web玩法	软件和信息服务	2012	2012年05期	【作者】 李国柱 ； 【机构】 新锐创业媒体Tech2IPO ；	Web ； 动态性 ； 毕达哥拉斯 ； 引擎搜索 ； 传统搜索 ； 腾讯 ； 社交网络 ； 在线电影 ； 语义分析 ； 传统存储 ；	<正>你是否还记得毕达哥拉斯的观点"数是万物的本原",这就是大数据时代的秘密。大数据领域数不胜数,笔者为大家梳理出以下重要领域,进行剖析。一、文字为什么会有web1.0到web2.0的质变?因为数据是具有实时性和动态性的。实时性是指数据与每个人如影随形,动态性是指它们又会汇总成大数据。搜索引擎的出现正逢其时,使web端的大数据有了人口。而文字搜	2012年05期_大数据时代下的Web玩法.pdf	http://sso.cdclib.org/interlibSSO/goto/6/=06190596Z93/kcms/detail/detail.aspx?dbCode=cjfq&filename=RJSJ201205004&dbname=CJFDLAST2014
跟上大数据的脚步	软件和信息服务	2012	2012年05期	【作者】 陈光 ； 【机构】 赛迪智库软件与信息服务业研究所 ；	市场商机 ； 物联网 ； 信息技术服务 ； 信息服务业 ； 社交网络 ； 社会管理水平 ； 谷歌 ； 合并活动 ； 智能电网 ； 令人 ；	<正>国际大型企业已经开始追逐大数据的市场商机,国内企业不应落后。4月19日,美国从事大数据相关业务的软件公司Splunk在纳斯达克的首日交易令人印象深刻。该公司股价当日报收于35.48美元,与17美元的IPO发行价相比翻了一番,这引发了人们对大数据公司板块的关注。	2012年05期_跟上大数据的脚步.pdf	http://sso.cdclib.org/interlibSSO/goto/6/=06190596Z93/kcms/detail/detail.aspx?dbCode=cjfq&filename=RJSJ201205005&dbname=CJFDLAST2014
谁说Wintel联盟崩溃了?	软件和信息服务	2012	2012年05期	【作者】 刘琼 ； 【机构】 赛迪智库软件与信息服务业研究所 ；	谷歌 ； 布斯 ； Wintel ； 计算设备 ； 国产软件 ； 平板电脑 ； 移动领域 ； 市场布局 ； 基础软件 ； 市场调研公司 ；	<正>事实证明,一些2011年的论断,到2012年看,并未按照设想去发展。去年业界最热烈讨论的话题之一,是Wintel联盟"行将崩溃"与英特尔、微软两家企业"前途黯淡"。无论是谷歌收购摩托罗拉移动,还是乔布斯提出的"后PC时代",都被看作是微软和英特尔两家企业走	2012年05期_谁说Wintel联盟崩溃了?.pdf	http://sso.cdclib.org/interlibSSO/goto/6/=06190596Z93/kcms/detail/detail.aspx?dbCode=cjfq&filename=RJSJ201205006&dbname=CJFDLAST2014
东风农机信息化小记	软件和信息服务	2012	2012年05期	【作者】 刘亚杰 ；	东风农机 ； 产品外销 ； 信息中心主任 ； 拖拉机厂 ； 常州市政府 ； 东风牌 ； 投入运行 ； 用友软件 ； 终极梦想 ； 客户服务 ；	<正>目前,东风农机已经将产品外销至众多国家,其背后有一双默默奉献的信息化"推手"。中国传统制造业目前有真正意义上的CIO吗?胡建中给出的答案是否定的。胡建中的头衔是常州东风农机集团有限公司(以下简称"东风农机")信息中心主任。1980年,胡建中进入这家企业工作,一晃已经有了32个年头。	2012年05期_东风农机信息化小记.pdf	http://sso.cdclib.org/interlibSSO/goto/6/=06190596Z93/kcms/detail/detail.aspx?dbCode=cjfq&filename=RJSJ201205007&dbname=CJFDLAST2014
看数据·辩热点——2011上市公司财报纵横谈	软件和信息服务	2012	2012年05期	【作者】 尚辞 ；	财报 ； 立思辰 ； 增值税退税 ； 政府补助 ； 运维服务 ； 银江股份 ； 经常性损益 ； 浙大网新 ； 信息服务业 ； 华胜天成 ；	每年4月,注定会是一个热闹纷繁的月份。近百家软件与IT服务企业财报的集中公布,足以让我们从中辨析这些热点的状况。因为他们不光是软件与IT服务企业中的表率,他们更肩负着与IBM、甲骨文、微软、SAP、SALESFORCE等国际巨头同台竞技的使命,他们的所作所为无疑也代表了这个产业的发展动向。在他们身上,你或能看到这个产业的热点,也能看到这个产业的末来。	2012年05期_看数据·辩热点——2011上市公司财报纵横谈.pdf	http://sso.cdclib.org/interlibSSO/goto/6/=06190596Z93/kcms/detail/detail.aspx?dbCode=cjfq&filename=RJSJ201205008&dbname=CJFDLAST2014
回音、数说	软件和信息服务	2012	2012年05期		微软大中华区 ； 团队工作 ； 软件服务业 ； 令人 ； 杨元 ； 副总裁 ； 商场如战场 ； 战略执行 ； 业务收人 ； 信息技术服务 ；	<正>"这是一个艰难的决定,但这也是我必须做出的决定,因为我要为家庭着想。"在任职近4年后,微软大中华区CEO梁念坚离职,在致大中华区团队邮件中,梁念坚写道:这是一段美妙的经历。我对团队所取得的成绩感到骄傲。结果令人感到满意。尽管我在未来的日子里会怀念在微软大中华区团队工作的时光,我对这个决定并不感到	2012年05期_回音、数说.pdf	http://sso.cdclib.org/interlibSSO/goto/6/=06190596Z93/kcms/detail/detail.aspx?dbCode=cjfq&filename=RJSJ201205009&dbname=CJFDLAST2014
“营改增”试点百日,IT服务业启新	软件和信息服务	2012	2012年05期	【作者】 王刚 ； 【机构】 赛迪顾问软件与信息服务业研究中心 ；	改征 ； 增值税改革 ； 国家税务总局 ； 交通运输业 ； IT服务业 ； 国税局 ； 启新 ； 实施办法 ； 实际税负 ； 税务局局长 ；	<正>"营改增"历程回顾2011年11月16日,财政部、国家税务总局印发《营业税改征增值税试点方案》、《交通运输业和部分现代服务业营业税改征增值税试点实施办法》、《交通运输业和部分现代服务业营业税改征增值税试点有关事项的规定》、《交通运输业和部分现代服务业营	2012年05期_“营改增”试点百日,IT服务业启新.pdf	http://sso.cdclib.org/interlibSSO/goto/6/=06190596Z93/kcms/detail/detail.aspx?dbCode=cjfq&filename=RJSJ201205010&dbname=CJFDLAST2014
中小企业IT应用“众包”平台	软件和信息服务	2012	2012年05期	【作者】 郭嘉凯 ；	众包 ； IT应用 ； 法律服务 ； 在线咨询 ； 客户方 ； 软件开发 ； 创业群体 ； 提供商 ； 接包方 ； 个体经营 ；	<正>Show公司介绍:融智网是面向中小企业成长过程中对智务服务的需求(如IT服务、设计服务、法律服务、金融服务等),通过"在线咨询、智务商城、项目众包、云端应用"的服务体系,解决中小企业在智务服务过程的"咨询难、服务乱、信用差、应用少"等问题的一站	2012年05期_中小企业IT应用“众包”平台.pdf	http://sso.cdclib.org/interlibSSO/goto/6/=06190596Z93/kcms/detail/detail.aspx?dbCode=cjfq&filename=RJSJ201205011&dbname=CJFDLAST2014
寻找“活跃因子”	软件和信息服务	2012	2012年05期	【作者】 郭嘉凯 ；	信息服务产业 ； 中国软件 ； 商业模式创新 ； 管理学大师 ； 彼得 ； 信息服务行业 ； 腾讯 ； 国内软件 ； 物联网 ； 技术创新 ；	<正>缺乏成功的、创新的商业模式是制约中国软件和信息服务产业发展的重要原因之一。世界级管理学大师彼得.德鲁克曾说过:"今天企业间的竞争已经不是产品间的竞争,而是商业模式之间的竞争"。这句话对于如今的I T产业更为适用。事实上,IT产业发展到今天,在技术层面上已经相当成熟,企业如果	2012年05期_寻找“活跃因子”.pdf	http://sso.cdclib.org/interlibSSO/goto/6/=06190596Z93/kcms/detail/detail.aspx?dbCode=cjfq&filename=RJSJ201205012&dbname=CJFDLAST2014
软件营销推倒“沟通墙”	软件和信息服务	2012	2012年05期	【作者】 王晓民 ； 郭嘉凯 ； 张贝贝 ；	渠道合作伙伴 ； 营销过程 ； 大中华区 ； 市场策略 ； 中国移动 ； 企业咨询服务 ； 中国工商银行 ； 能力体系 ； 战略布局 ； 首席运营官 ；	<正>在企业级软件市场,用户的需求正在发生变化:业务部门比以往更多地参与到软件采购的决策中。但传统的软件营销方式,很难计软件厂商与用户业务部门之间形成良好的沟通和互动。那么,软件厂商该做出怎样的变化,才能推倒这座横亘在软件营销过程中,阻碍双方沟通的"无形之墙"呢?	2012年05期_软件营销推倒“沟通墙”.pdf	http://sso.cdclib.org/interlibSSO/goto/6/=06190596Z93/kcms/detail/detail.aspx?dbCode=cjfq&filename=RJSJ201205013&dbname=CJFDLAST2014
IBM欲建企业级IT应用AppStore	软件和信息服务	2012	2012年05期	【作者】 郭嘉凯 ；	IT应用AppStore ； IBM ； 开发者 ； 大中华区 ； 钱大群 ； 高额成本 ； store ； 预定计划 ； 信息管理技术 ； 展示中心 ；	<正>IBM PureSystems(专家集成系统)的推出,不仅仅是一个新的产品线,同时也给IBM带来了一种新的服务于企业级IT应用的商业模式。苹果公司创造的AppStore不仅帮助苹果打败了众多强大的竞争对手,同时也为更多的中小开发商和个人开发者提供了以往难以想象的机会。如今,IBM推出了PureSystems(专家集成系统),并希望借助这一创新的产品,与更多ISV的应用整合到一起,最终成为企业用户IT应用的AppStore。	2012年05期_IBM欲建企业级IT应用AppStore.pdf	http://sso.cdclib.org/interlibSSO/goto/6/=06190596Z93/kcms/detail/detail.aspx?dbCode=cjfq&filename=RJSJ201205014&dbname=CJFDLAST2014
推动企业战略转型	软件和信息服务	2012	2012年05期	【作者】 郭嘉凯 ；	企业咨询服务 ； 企业战略转型 ； 战略方向 ； 全方位管理 ； 整合能力 ； 大中华区 ； 战略合作伙伴 ； 战略目标 ； 发展战略 ； 技术驱动 ；	<正>向全方位管理和咨询服务商转变,是IBM GBS(全球企业咨询服务部)接下来的重要战略方向之一。10年前,IBM收购普华永道,被视为是IBM向IT服务进行战略转型的重要举措。如今,10年过去了,IBM的战略转型已经十分成功,无论是在软件还是在IT服务方面,IBM都已成为全球市场的领导者之一。但这对于IBM全球企业咨询服务部(GBS)而言,还不够。	2012年05期_推动企业战略转型.pdf	http://sso.cdclib.org/interlibSSO/goto/6/=06190596Z93/kcms/detail/detail.aspx?dbCode=cjfq&filename=RJSJ201205015&dbname=CJFDLAST2014
云GIS起飞	软件和信息服务	2012	2012年05期	【作者】 郭嘉凯 ；	地理信息 ； 北京四中 ； 超图 ； GIS ； 令人 ； 提供商 ； 运维成本 ； 空间分析算法 ； 新型商业模式 ； 交通拥挤问题 ；	<正>云计算与GIS的结合,将会给GIS行业的发展带来巨大的改变。一直以来,北京四中同学们的家长都为如何接送孩子上下学而苦恼:如果每个家长都自己开车,车辆太多会造成学校附近的交通拥堵;如果让孩子自己上学,安全方面又比较担心。这真是一个令人头疼的难题。不过,现在家长们不用再苦恼了。只要登录北京四	2012年05期_云GIS起飞.pdf	http://sso.cdclib.org/interlibSSO/goto/6/=06190596Z93/kcms/detail/detail.aspx?dbCode=cjfq&filename=RJSJ201205016&dbname=CJFDLAST2014
姗姗来迟的微软私有云	软件和信息服务	2012	2012年05期	【作者】 李玲玲 ；	董志华 ； 概念区别 ； 高级总监 ； 刃刀 ； 数据中心 ； 云将 ； 中央控制器 ； 于为 ； 技术创新 ； 混合云 ；	<正>从四、五年前大讲云概念,到公有云,到全面云,再到私有云,微软任中国市场的云路线日益清晰起来。比起在企业级市场强势的IBM,桌面端起家的微软在其企业级市场不温不火的状态下提出私有云,多少有些底气不足。微软私有云是什么?想必很多人心里都会打个问号。在看到Windows Server 2012和System Center2012时,或许会心有领悟。因为过去,Windows	2012年05期_姗姗来迟的微软私有云.pdf	http://sso.cdclib.org/interlibSSO/goto/6/=06190596Z93/kcms/detail/detail.aspx?dbCode=cjfq&filename=RJSJ201205017&dbname=CJFDLAST2014
联想服务三步走	软件和信息服务	2012	2012年05期	【作者】 李玲玲 ；	国际化浪潮 ； 企业部署 ； 防泄密 ； 三步走 ； 连锁卖场 ； 副总裁 ； 产品支持 ； 行业领导 ； 硬件问题 ； 市场服务 ；	<正>从硬件维保,到打造远程软件服务+IT桌面外包No.1,联想服务也在国际化浪潮下谋变。联想服务跟"3"总是很有缘。4月10日,联想服务在其新财年宣布将继续发力IT管理服务,并一举发布桌面管理套件、企业部署服务及数据防泄密解决方案等3款新品。除企业部署服务外,桌面管理套件和数据防泄密	2012年05期_联想服务三步走.pdf	http://sso.cdclib.org/interlibSSO/goto/6/=06190596Z93/kcms/detail/detail.aspx?dbCode=cjfq&filename=RJSJ201205018&dbname=CJFDLAST2014
王文京的决心	软件和信息服务	2012	2012年05期	【作者】 李玲玲 ；	王文京 ； 世界级企业 ； 中国软件业 ； 云时代 ； 领先优势 ； 信息技术产业 ； 创新实力 ； 战略阶段 ； 微软产品 ； 支付模式 ；	<正>一如联想启用Lenovo,用友换标决心之大可以想见。向世界级企业迈进,想法很好,但要从年收入几十个亿的规模实现百亿的跨越,已肩挑用友22年使命的王文京任务可不轻。弃用使用24年之久的"ufida",改用"yonyou",这次王文京是下了决心的。2012年4月23日,用友在水关长城发布了它的新标识,同时还推出了用友企业云平台。回顾过去24年,用友的价值以及对行业的影响得以体现:1988～1996年,正是用友的财务软件将中国的	2012年05期_王文京的决心.pdf	http://sso.cdclib.org/interlibSSO/goto/6/=06190596Z93/kcms/detail/detail.aspx?dbCode=cjfq&filename=RJSJ201205019&dbname=CJFDLAST2014
真诚和正直可以赢得一切	软件和信息服务	2012	2012年05期	【作者】 郭嘉凯 ；	孙志伟 ； 管理技巧 ； 管理哲学 ； 模式整合 ； 考核指标 ； 管理素质 ； 企业文化 ； 软件开发 ； 系统集成 ； 计算机软件 ；	<正>管理技巧也许能够让你成为优秀的管理者,但真诚和正直则能让你得到员工、合作伙伴以及用户的尊重和信任。谈到自己的管理哲学,CA Technologies中国区总经理孙志伟并没有像很多跨国公司高管一样,大谈各种管理技巧和理论。在他看来,技巧和理论固然重要,但更重要的是真诚和正直。"管理技巧也许能够让你成为优秀的管理者,但真诚和正直则能让你得到员工、合作伙伴以及用户的尊重和信任,甚至可以让你赢得一切。"孙志伟如是说。	2012年05期_真诚和正直可以赢得一切.pdf	http://sso.cdclib.org/interlibSSO/goto/6/=06190596Z93/kcms/detail/detail.aspx?dbCode=cjfq&filename=RJSJ201205020&dbname=CJFDLAST2014
伤人的代价	软件和信息服务	2012	2012年05期	【作者】 黄登兰 ； 【机构】 北京市尚衡律师事务所 ；	证据保全 ； 律师事务所 ； 石华 ； 软件股份 ； 商业软件联盟 ； 庭外和解 ； 违法事实 ； 赔偿医疗费 ； 钓鱼执法 ； 执业过程 ；	<正>不管怎样,动手打人都不会成为解决问题的最理想方式。【典型案例】北京市乾坤(深圳)律师事务所律师江同(化名),受国际商业软件联盟的委托,代理美国企业BepcF软件公司(化名),状告上市公司深圳迟贝软件股份有限公司(化名)侵犯其计算机软件著作权。深圳市中级人民法院于2011年11月1日受理此案,11月23日,法院到迟贝公司进行了相关证据保全。双方在协商此事过程中,矛盾越积越深。为解心头之恨,迟贝公司董事长石华邀请江同到咖啡厅见面,商讨和解事宜。见面之后,石华将法院出具的"证据保全裁定"摔在江同面前,威胁其人身安全,要求其撤诉。江同据理力争,石华遂举起手边椅子,在咖啡厅内进行追	2012年05期_伤人的代价.pdf	http://sso.cdclib.org/interlibSSO/goto/6/=06190596Z93/kcms/detail/detail.aspx?dbCode=cjfq&filename=RJSJ201205021&dbname=CJFDLAST2014
ITSS的杀棋	软件和信息服务	2012	2012年05期		信息技术服务 ； ITSS ； 应用试点 ； 最后的胜利 ； 中国软件 ； 信息技术标准 ； 运维服务 ； 软件服务业 ； 标准化服务 ； 基础软件 ；	<正>成都有了《服务目录》,但这只是第一步"杀棋",赢得最后的胜利,尚需进一步运筹帷幄。各行各业,标准的制定都少不了众多"第一"——第一个应用试点地区,第一个成功案例,或者第一份标准初稿……对于ITSS验证应用试点工作而言,成都占据了很多"第一"的头衔——第一批信息技术服务标准验证与应用试点单位之	2012年05期_ITSS的杀棋.pdf	http://sso.cdclib.org/interlibSSO/goto/6/=06190596Z93/kcms/detail/detail.aspx?dbCode=cjfq&filename=RJSJ201205022&dbname=CJFDLAST2014
虚拟和现实的融合	软件和信息服务	2012	2012年05期	【作者】 郭嘉凯 ；	增强现实技术 ； 网上购买 ； 网购 ； 淘宝 ； 虚拟现实系统 ； 轮廓图 ； 刘勇 ； 戴亨 ； 虚拟环境 ； 试衣 ；	<正>如何将AR技术和氽业的业务需求相结合,将是AR技术能否得到快速发展的重要因素之一。如果你是一名狂热的淘宝网购爱好者,那么你一定有过这样的梦想:如果在网上购买衣服时,坐在电脑前,就能够在线试穿,看看衣服穿到自己身上的效果如何,那就太好了。如今,这一梦想已经成为现实。	2012年05期_虚拟和现实的融合.pdf	http://sso.cdclib.org/interlibSSO/goto/6/=06190596Z93/kcms/detail/detail.aspx?dbCode=cjfq&filename=RJSJ201205023&dbname=CJFDLAST2014
项目管理体系建设切忌“两张皮”	软件和信息服务	2012	2012年05期	【作者】 宣晓锋 ； 【机构】 项目管理者联盟 ；	管理体系建设 ； 项目目标 ； 项目团队成员 ； 培养项目 ； 考核指标 ； 管理标准 ； 多项目管理 ； 组织结构 ； 过程域 ； CMMI ；	<正>项目管理体系建设是项系统工程,妄图朝夕之间完成全部工作,很可能让所得成果得而复失,更有可能将体系文件和实际情况做成"两张皮"。与10年前相比,项目管理在IT与软件企业中的地位与价值是否降低了?10年前,IT企业普遍比较重视项目管理。因为大家认识到,IT企业的生存来自项目,项目经理很重要,所以企业老总非常看重培养项目经理。但是后来发现,项目管	2012年05期_项目管理体系建设切忌“两张皮”.pdf	http://sso.cdclib.org/interlibSSO/goto/6/=06190596Z93/kcms/detail/detail.aspx?dbCode=cjfq&filename=RJSJ201205024&dbname=CJFDLAST2014
普斯电子:集中式管理攻克制造业HR孤岛难关	软件和信息服务	2012	2012年05期	【作者】 李玲玲 ；	电子制造企业 ； HR ； 自动化企业 ； 管理难题 ； 集中式管理 ； 薪酬福利 ； 手工作业 ； 成熟度 ； 集中化管理 ； 预提 ；	<正>这家有着56年历史的美国电子制造企业也因中国廉价的劳动力而将其主要生产线落址中国南方。但赶上业务扩张高峰,它同样也要直面手工作业、人员密集带来的管理难题。制造业信息化建设难,难在哪里?行业繁杂,生产经营模式千差万别,且各行业信息化成熟度不同。单就劳动密集型这一大特点,许多制造企业决策者就头疼不已。员工是制造企业,特别是非自动化企业生存的基石。如何管理好庞大的员工队伍,从薪酬	2012年05期_普斯电子:集中式管理攻克制造业HR孤岛难关.pdf	http://sso.cdclib.org/interlibSSO/goto/6/=06190596Z93/kcms/detail/detail.aspx?dbCode=cjfq&filename=RJSJ201205025&dbname=CJFDLAST2014
