title	journal_name	year	issue	author	keywords	summary	pdf_filename	article_url
2012中国信息化成果数字城市最佳实践奖 准格尔旗“数字社区”建设项目	软件和信息服务	2012	2012年11期		数字社区 ； 数字城市 ； 社区安全 ； 建设项目 ； 信息化成果 ； 社区服务 ； 网格化管理 ； 业务挑战 ； 水红花 ； 呼叫中心系统 ；	<正>业务挑战:鄂尔多斯市准格尔旗社区的网格化已具备一定的雏形,随着准格尔旗经济的飞速发展,百姓对政府及社区服务要求也越来越高,因此,以数字准格尔为支撑、以社区网格化管理与服务为基础、以社区便民惠民和加强社区安全两项内容为重点的数字社区建设,成为准格尔旗信息化工作办公室面临的挑战。解决方案:	2012年11期_2012中国信息化成果数字城市最佳实践奖+准格尔旗“数字社区”建设项目.pdf	http://sso.cdclib.org/interlibSSO/goto/6/=06190596Z93/kcms/detail/detail.aspx?dbCode=cjfq&filename=RJSJ201211019&dbname=CJFDLAST2014
2012中国信息化成果大数据创新应用奖 宁波市智慧城管平台建设项目	软件和信息服务	2012	2012年11期		建设项目 ； 城市管理 ； 信息化成果 ； 创新应用 ； 业务挑战 ； 应用体系 ； 空间地理 ； 数字城市 ； 多维信息 ； 项目收益 ；	<正>业务挑战:智慧城管是宁波市建设智慧城市的十大应用体系之一,如何利用信息资源、现代技术、多维信息采集等手段,进行城市管理部件量化、事件标准,形成统一的城市管理基础信息平台成为宁波市的工作突破重点。解决方案:宁波市智慧城管平台划分为统一视频监控、统一定位、统一空间地理和统一基础管理在内的五大支撑,形成了业务办理、实时管控、智能管控、公共服务等四大应用。一期以基础搭建为主,将优化宁	2012年11期_2012中国信息化成果大数据创新应用奖+宁波市智慧城管平台建设项目.pdf	http://sso.cdclib.org/interlibSSO/goto/6/=06190596Z93/kcms/detail/detail.aspx?dbCode=cjfq&filename=RJSJ201211020&dbname=CJFDLAST2014
2012中国信息化成果数据中心最佳实践奖 北京电视台高、标清制播网运维服务管理项目	软件和信息服务	2012	2012年11期		北京电视台 ； 信息化成果 ； 三网融合 ； 业务运营模式 ； 网络广播 ； 业务挑战 ； 数据中心 ； 数字技术 ； 网络技术 ； 运维服务 ；	<正>业务挑战:传统电视台的业务系统通常与外网基本隔离,而在三网融合的大趋势下,北京电视台结合数字技术和网络技术,采用与传统电视台不同的业务运营模式,主要业务系统一定程度上需要与互联网相连,由此面临更严峻的信息安全挑战。解决方案:北京电视台设立了北京网络广播电视台	2012年11期_2012中国信息化成果数据中心最佳实践奖+北京电视台高、标清制播网运维服务管理项目.pdf	http://sso.cdclib.org/interlibSSO/goto/6/=06190596Z93/kcms/detail/detail.aspx?dbCode=cjfq&filename=RJSJ201211021&dbname=CJFDLAST2014
2012中国信息化成果数字城市创新应用奖 镇江云平台建设总集成及业务运营支撑系统建设项目	软件和信息服务	2012	2012年11期		创新应用 ； 建设项目 ； 云计算中心 ； 数据中心 ； 信息化成果 ； 成及 ； 业务挑战 ； 数字城市 ； 指导思想 ； 持续发展 ；	<正>业务挑战:镇江云项目提出了以业务运营为主体的数据中心建设思路,即数据中心建设不以规模为建设点,而以如何能健康持续发展为指导思想,本项目涉及的云计算数据中心业务运营支撑系统目前国内外均无成熟产品。解决方案:镇江云计算中心建设项目,包括基础硬件系统建设、业务运	2012年11期_2012中国信息化成果数字城市创新应用奖+镇江云平台建设总集成及业务运营支撑系统建设项目.pdf	http://sso.cdclib.org/interlibSSO/goto/6/=06190596Z93/kcms/detail/detail.aspx?dbCode=cjfq&filename=RJSJ201211022&dbname=CJFDLAST2014
2012中国信息化成果数据中心创新应用奖 Infosys Trellis Early Adopter项目	软件和信息服务	2012	2012年11期		数据中心 ； 创新应用 ； 客户服务质量 ； 运维人员 ； 信息化成果 ； 业务挑战 ； 服务公司 ； 能源使用效率 ； 维护效率 ； 基础设施 ；	<正>业务挑战:Infosys是全球最大的IT服务公司之一,业务遍布在全球31个不同国家和75个不同城市,其在全球拥有大量分散的数据中心以及数量庞大的运维人员,如何在降低系统成本的同时,不降低客户服务质量,是他们面临的一个难题。解决方案:为应对挑战,Infosys采用了艾默生Trellis数据中心基础架构解决方	2012年11期_2012中国信息化成果数据中心创新应用奖+Infosys+Trellis+Early+Adopter项目.pdf	http://sso.cdclib.org/interlibSSO/goto/6/=06190596Z93/kcms/detail/detail.aspx?dbCode=cjfq&filename=RJSJ201211023&dbname=CJFDLAST2014
2012中国信息化成果数据中心创新应用奖 华大基因研究院生物云计算平台建设项目	软件和信息服务	2012	2012年11期		华大基因 ； 创新应用 ； 建设项目 ； 数据中心 ； 信息化成果 ； 计算能力 ； 计算平台 ； 科研机构 ； 服务器资源 ； 业务挑战 ；	<正>业务挑战:据统计生物产业有70%-80%的工作量要靠IT来完成,而数据中心的计算能力和存储管理是生物信息技术发展的技术基础。作为全球领先的生物科研机构,华大基因在提前规划布局,占领这一领域的制高点。在合理运维服务器资源、降低成本等方面面临着机遇与挑战。解决方案:通过实施此项目,华大基因研究院搭建起生物云基础设施与基础管理平台,根据IT系统现状及三年内的规划预测,建	2012年11期_2012中国信息化成果数据中心创新应用奖+华大基因研究院生物云计算平台建设项目.pdf	http://sso.cdclib.org/interlibSSO/goto/6/=06190596Z93/kcms/detail/detail.aspx?dbCode=cjfq&filename=RJSJ201211024&dbname=CJFDLAST2014
2012中国信息化成果管理软件最佳实践奖 大运汽车·用友U9ERP信息化项目	软件和信息服务	2012	2012年11期		U9ERP ； 信息化项目 ； 商用车市场 ； 信息化成果 ； 企业规模 ； 数据可用性 ； 业务挑战 ； 企业信息化管理 ； 发展规划 ； 全面集成 ；	<正>业务挑战:2010年后随着企业规模的扩大,原来搭建的信息化系统无法满足大运汽车的管理需求,信息化系统结构的弊端,如数据冗余严重、效率低下、不集中,数据可用性差等日益凸显,给企业发展带来了不利的影响。解决方案:大运汽车管理层针对大运汽车发展规划和未来几年中国商用车市场的	2012年11期_2012中国信息化成果管理软件最佳实践奖+大运汽车·用友U9ERP信息化项目.pdf	http://sso.cdclib.org/interlibSSO/goto/6/=06190596Z93/kcms/detail/detail.aspx?dbCode=cjfq&filename=RJSJ201211025&dbname=CJFDLAST2014
2012中国信息化成果数据中心最佳实践奖 兰州市数据中心建设项目	软件和信息服务	2012	2012年11期		数据中心 ； 服务应用 ； 信息资源库 ； 经济综合竞争力 ； 基础数据 ； 政务管理 ； 建设项目 ； 应用环境 ； 信息化成果 ； 交换平台 ；	<正>业务挑战:兰州市数据中心基础数据资源的整合利用作为城市战略性信息资源,直接关系到兰州市政府的政务管理与服务效率、社会与经济综合竞争力、市民综合幸福指数的提升,建设兰州市数据中心面临业务与服务应用内容多且复杂、数据关联复杂、业务涉及机构多等复杂的应用环境。解决方案:兰州市数据中心项目以围绕建设	2012年11期_2012中国信息化成果数据中心最佳实践奖+兰州市数据中心建设项目.pdf	http://sso.cdclib.org/interlibSSO/goto/6/=06190596Z93/kcms/detail/detail.aspx?dbCode=cjfq&filename=RJSJ201211026&dbname=CJFDLAST2014
2012中国信息化成果物联网创新应用奖 江苏省中小企业物联网产业创新服务平台建设项目	软件和信息服务	2012	2012年11期		物联网 ； 创新服务平台 ； 创新应用 ； 建设项目 ； 产品供求 ； 研究发展中心 ； 投融资服务 ； 信息化成果 ； 公共技术 ； 业务挑战 ；	<正>业务挑战:江苏省物联网产业中小企业在资本、技术、人才、政策、管理等方面缺乏有力的信息服务平台,因此如何有效推动无锡乃至江苏全省物联网产业快速健康发展,搭建立足无锡、服务全省、面向全国的全方位服务平台成为关键的工作挑战。解决方案:通过搭建"中小企业物联网产业创新服务平台",集合中国物联网研究发展中心各项资源,以及地方政府扶持政策,规划建设投融资服务、产品供求服务、公共技术平台、企业综	2012年11期_2012中国信息化成果物联网创新应用奖+江苏省中小企业物联网产业创新服务平台建设项目.pdf	http://sso.cdclib.org/interlibSSO/goto/6/=06190596Z93/kcms/detail/detail.aspx?dbCode=cjfq&filename=RJSJ201211027&dbname=CJFDLAST2014
2012中国信息化成果管理软件创新应用奖 上海一茶一坐餐饮有限公司ERP系统建设项目	软件和信息服务	2012	2012年11期		ERP系统建设 ； 建设项目 ； 创新应用 ； 信息化成果 ； 采购模式 ； 业务挑战 ； 资金利用率 ； 生产成本 ； 项目收益 ； 销售管理 ；	<正>业务挑战:一茶一坐目前已在18个大中型城市开设近120家门店,不断快速扩张使一茶一坐面临着一系列挑战:如何及时、准确地向门店配送餐品;如何提升中央厨房成本核算的准确性,降低中央厨房的生产成本;如何处理从采购、发货到门店收贷损耗所造成的单价变更问题,以及在集中采购模式下,如何明确供应商向子公司开票信息,满足财务核算及税务的需求等。	2012年11期_2012中国信息化成果管理软件创新应用奖+上海一茶一坐餐饮有限公司ERP系统建设项目.pdf	http://sso.cdclib.org/interlibSSO/goto/6/=06190596Z93/kcms/detail/detail.aspx?dbCode=cjfq&filename=RJSJ201211028&dbname=CJFDLAST2014
2012中国信息化成果物联网最佳实践奖 亨达智慧商店应用项目	软件和信息服务	2012	2012年11期		物联网 ； 信息化成果 ； 平板电脑 ； 企业规模 ； 手持终端 ； 业务挑战 ； 科技元素 ； 客户管理 ； 硬件设施 ； 计划调整 ；	<正>业务挑战:随着企业规模的扩大,亨达加紧了在各主要城市开设旗舰店的步伐,而旗舰店需要增加高科技元素,以彰显亨达品牌的科技形象,提升顾客体验。解决方案:亨达采用青岛中科软为其提供的亨达智慧商店应用项目,该方案主要基于RFID等物联网技术,结合手持终端、平板电脑等硬件设施,实现了品牌旗舰店鞋、箱包等商品	2012年11期_2012中国信息化成果物联网最佳实践奖+亨达智慧商店应用项目.pdf	http://sso.cdclib.org/interlibSSO/goto/6/=06190596Z93/kcms/detail/detail.aspx?dbCode=cjfq&filename=RJSJ201211029&dbname=CJFDLAST2014
2012中国信息化杰出服务商奖	软件和信息服务	2012	2012年11期		软件集团 ； 大中华区 ； 软件股份 ； 物联网 ； 华胜天成 ； 创业投资 ； 数字城市 ； 信息服务 ； 信息技术 ；		2012年11期_2012中国信息化杰出服务商奖.pdf	http://sso.cdclib.org/interlibSSO/goto/6/=06190596Z93/kcms/detail/detail.aspx?dbCode=cjfq&filename=RJSJ201211030&dbname=CJFDLAST2014
2012中国信息化成果优秀服务商单项奖	软件和信息服务	2012	2012年11期		单项奖 ； 信息化成果 ； 优秀服务 ； 软件股份 ； 房地产管理 ； 软件技术 ；		2012年11期_2012中国信息化成果优秀服务商单项奖.pdf	http://sso.cdclib.org/interlibSSO/goto/6/=06190596Z93/kcms/detail/detail.aspx?dbCode=cjfq&filename=RJSJ201211031&dbname=CJFDLAST2014
2012中国信息化成果优秀产品方案单项奖	软件和信息服务	2012	2012年11期		单项奖 ； 产品方案 ； 信息化成果 ； 物联网 ； 创新产品奖 ； 门户系统 ； 楼宇经济 ； 服务系统 ； 创新应用 ； 最佳解决方案 ；		2012年11期_2012中国信息化成果优秀产品方案单项奖.pdf	http://sso.cdclib.org/interlibSSO/goto/6/=06190596Z93/kcms/detail/detail.aspx?dbCode=cjfq&filename=RJSJ201211032&dbname=CJFDLAST2014
2012中国信息化成果政府行业优秀解决方案奖 东城区楼宇经济指标监测系统开发项目	软件和信息服务	2012	2012年11期		楼宇经济 ； 信息化成果 ； 业务现状 ； 整体框架 ； 指标体系 ； 指标监测 ； 信息中心 ； 区域经济 ； 系统开发项目 ； 委办局 ；	<正>解决方案:通过采用赛迪时代区域经济监测云平台,东城区在综合调研业务现状和深入分析具体需求的基础上,按照"远处着眼、近处着手"的原则,梳理业务需求,确定指标体系和报送流程;利用信息技术构建报送平台,连接各个委办局和区信息中心,实现在该平台的整体框架下各个委办局及	2012年11期_2012中国信息化成果政府行业优秀解决方案奖+东城区楼宇经济指标监测系统开发项目.pdf	http://sso.cdclib.org/interlibSSO/goto/6/=06190596Z93/kcms/detail/detail.aspx?dbCode=cjfq&filename=RJSJ201211033&dbname=CJFDLAST2014
2012中国信息化成果档案行业创新应用奖 合肥市肥东县档案馆档案信息化建设项目	软件和信息服务	2012	2012年11期		县档案馆 ； 档案行业 ； 档案管理软件 ； 档案数字化 ； 馆藏档案 ； 肥东 ； 信息化成果 ； 建设项目 ； 存储系统 ； 数字化加工 ；	<正>项目介绍:借助此项目,肥东县档案馆从硬件、软件、档案整理与档案数字化等多方面,实现档案馆的信息化建设。硬件方面,包括服务器、操作系统、存储系统、机柜、UPS等部署完善;软件方面,肥东县档案馆通过网络版档案管理软件,实现馆藏档案文件的全文查询、馆藏档	2012年11期_2012中国信息化成果档案行业创新应用奖+合肥市肥东县档案馆档案信息化建设项目.pdf	http://sso.cdclib.org/interlibSSO/goto/6/=06190596Z93/kcms/detail/detail.aspx?dbCode=cjfq&filename=RJSJ201211034&dbname=CJFDLAST2014
2012中国信息化成果汽车行业最具创新解决方案奖 广汇云服务系统解决方案	软件和信息服务	2012	2012年11期		社区网站 ； 手机客户端 ； 信息化成果 ； 在线音乐 ； 互联互通 ； 杀手级 ； 服务系统 ； 车载导航 ； 智能导航 ； 服务应用 ；	<正>解决方案:该方案包含车友联动、一键导航、在线音乐、防盗辅助、道路救援、违章查询、在线天气、保养预约、保养提醒等服务应用。3G互联智能导航软件以车主需求为导向,提供行车、交友、娱乐、生活的"杀手级"应用;美赛达门户社区网站配合手机客户端,创新性地实现车载导航、手机、电脑三者互联互通的"云服务";车联宝客户管	2012年11期_2012中国信息化成果汽车行业最具创新解决方案奖+广汇云服务系统解决方案.pdf	http://sso.cdclib.org/interlibSSO/goto/6/=06190596Z93/kcms/detail/detail.aspx?dbCode=cjfq&filename=RJSJ201211035&dbname=CJFDLAST2014
2012中国信息化成果食品安全行业创新应用奖 青岛中科软件股份有限公司食品安全物联网解决方案	软件和信息服务	2012	2012年11期		软件股份 ； 物联网 ； 创新应用 ； 信息化成果 ； 联网系统 ； 二维码 ； 从食 ； 市场信息 ； 信用信息 ； 快速识别 ；	<正>解决方案:食品安全存在着两方面的"失灵",即政府监管失灵和市场信息失灵,通过中科软件提出的食品安全物联网解决方案,可以有效解决以上需求。该方案即利用条码、二维码、RFID、传感器等物联网技术,建立起覆盖食品生产、加工、销售等各个环节的信息联网系统。从食	2012年11期_2012中国信息化成果食品安全行业创新应用奖+青岛中科软件股份有限公司食品安全物联网解决方案.pdf	http://sso.cdclib.org/interlibSSO/goto/6/=06190596Z93/kcms/detail/detail.aspx?dbCode=cjfq&filename=RJSJ201211036&dbname=CJFDLAST2014
2012中国信息化成果科研教育行业最佳解决方案奖 广东省高性能计算门户系统建设项目	软件和信息服务	2012	2012年11期		建设项目 ； 门户系统 ； 最佳解决方案 ； 信息化成果 ； 工程力学 ； 智能调度 ； 科研教育 ； 网格化 ； 数据环境 ； 生物信息 ；	<正>项目介绍:通过建立广东省中山大学高性能计算门户系统,有效地整合了广东省省网格和中山大学、中南大学等6所高校不同时期、不同位置构建的高性能计算资源,封装了计算化学、工程力学、计算金融、生物信息等行业的软件,实现了通过web化页面提交作业,高性能资源的网格化智能调度,并对作业	2012年11期_2012中国信息化成果科研教育行业最佳解决方案奖+广东省高性能计算门户系统建设项目.pdf	http://sso.cdclib.org/interlibSSO/goto/6/=06190596Z93/kcms/detail/detail.aspx?dbCode=cjfq&filename=RJSJ201211037&dbname=CJFDLAST2014
回音、数说	软件和信息服务	2012	2012年11期		鲍尔默 ； 服务转型 ； 甲骨文公司 ； 一封信 ； 转型目标 ； 电子信息 ； 科学院计算所 ； 倪光南 ； 杨元 ； 物联网 ；	<正>"微软将向设备和服务转型。"近日,微软CEO史蒂夫·鲍尔默在致股东的一封信中宣布,微软将全面转型,设备和服务将成为微软未来发展方向。鲍尔默此前曾暗示过这一转型目标,他在致投资者的这封公开信中称:"在继续坚持以Windows为核心的基础上,微软将向设备和服务	2012年11期_回音、数说.pdf	http://sso.cdclib.org/interlibSSO/goto/6/=06190596Z93/kcms/detail/detail.aspx?dbCode=cjfq&filename=RJSJ201211038&dbname=CJFDLAST2014
车友互联:从云端到落地	软件和信息服务	2012	2012年11期	【作者】 包俊君 ；	社区网站 ； 合作商 ； 客户管理 ； 管理系统平台 ； 终端平台 ； 联网系统 ； 智能导航 ； 服务运营商 ； 提供商 ； 互联互通 ；	<正>Show公司介绍:车友互联是国内首家落地的车联网系统方案提供商,其方案通过"云计算"的三大产品组成,即3G智能导航软件、车友互联门户社区网站、车联宝客户管理软件。在为车主打造真正车联网生活的同时,为合作商提供开放式的平台接入接口和终端平台软件,并免费提供商户管理系统平台。	2012年11期_车友互联:从云端到落地.pdf	http://sso.cdclib.org/interlibSSO/goto/6/=06190596Z93/kcms/detail/detail.aspx?dbCode=cjfq&filename=RJSJ201211039&dbname=CJFDLAST2014
怎么看苹果三星专利战的影响?	软件和信息服务	2012	2012年11期	【作者】 安晖 ； 【机构】 赛迪智库软件与信息服务业研究所 ；	智能终端 ； 全球科技 ； 侵权赔偿 ； 授权使用 ； 谷歌 ； 产品厂商 ； 自主操作 ； 软件开发商 ； 系统开发商 ； 市场竞争行为 ；	<正>近日,美国加州联邦法庭陪审团判定三星公司侵犯苹果公司在智能终端领域的6项专利,需支付侵权赔偿金10.5亿美元。该案因此成为迄今为止赔偿费最高的专利案件之一。由于智能终端是当今全球科技产业最为炙手可热的领域之一,苹果与三星又是最受关注的业界龙头企业,所以,二者之间的专利大战自然吸引了各界的	2012年11期_怎么看苹果三星专利战的影响?.pdf	http://sso.cdclib.org/interlibSSO/goto/6/=06190596Z93/kcms/detail/detail.aspx?dbCode=cjfq&filename=RJSJ201211040&dbname=CJFDLAST2014
IT服务迈向创新转型新时代	软件和信息服务	2012	2012年11期	【作者】 胡小鹏 ； 【机构】 赛迪顾问软件与信息服务业研究中心 ； 中国计算机行业协会云计算专业委员会 ；	创新转型 ； 服务化 ； 系统集成 ； 新业态 ； 新兴产业 ； 业务流程外包 ； 服务外包业务 ； 信息技术 ； 移动互联网业务 ； 战略咨询 ；	<正>"十二五"期间,服务化已经成为中国IT业发展最重要的趋势。一方面,七大战略性新兴产业的产业链将在未来几年逐渐形成和完善,为我国IT服务业提供持续的内需驱动力。另一方面,新一代信息技术的大发展带来了新技术、新服务、新业态的变革,传统IT服务迎来新的机遇。同时,国发4号文件提出了对符合条件的软件企业软件开发与测试、系统集成	2012年11期_IT服务迈向创新转型新时代.pdf	http://sso.cdclib.org/interlibSSO/goto/6/=06190596Z93/kcms/detail/detail.aspx?dbCode=cjfq&filename=RJSJ201211041&dbname=CJFDLAST2014
寻找中国软件并购的“金婚”	软件和信息服务	2012	2012年11期	【作者】 郭嘉凯 ；	中国软件 ； 国内软件 ； 华胜天成 ； 用友软件 ； 用友公司 ； 智慧地球 ； 副总裁 ； 海外收购 ； 大中华区 ； 职业经理人 ；	企业之间的并购和婚姻有着惊人的相似之处。而且,与婚姻相同的是,企业间收并购的最终目标也是要实现"金婚"。在未来相当长的一段时间内,中国软件企业仍将会不断地寻找自己并购的"金婚",因为在所有中国软件企业的心中,都有一个梦想:打造一个属于中国的世界级软件企业。	2012年11期_寻找中国软件并购的“金婚”.pdf	http://sso.cdclib.org/interlibSSO/goto/6/=06190596Z93/kcms/detail/detail.aspx?dbCode=cjfq&filename=RJSJ201211042&dbname=CJFDLAST2014
软件企业的并购战略及应对策略	软件和信息服务	2012	2012年11期	【作者】 秦建秀 ；	并购战略 ； 兼并与收购 ； 甲骨文公司 ； EBIT ； 税前利润 ； 供应链业 ； 销售机会 ； 现金流 ； 业务代表 ； 收购对象 ；	<正>你突然得知你的软件供应商被另一家公司收购了!软件企业所开展的快速整合已经不再是什么秘密,但问题是你现在不得不应对其整合的后果。只有充分了解新东家的兼并与收购战略,才能恰如其分地迎接变化;也只有这样,才能决定你和你的公司是否将受益于这场并购案,亦或受困于不久的将来就将不再支持的技术中。	2012年11期_软件企业的并购战略及应对策略.pdf	http://sso.cdclib.org/interlibSSO/goto/6/=06190596Z93/kcms/detail/detail.aspx?dbCode=cjfq&filename=RJSJ201211043&dbname=CJFDLAST2014
变革时代的创新	软件和信息服务	2012	2012年11期	【作者】 包俊君 ；	变革时代 ； 物联网 ； 新兴技术 ； 关联产品 ； 中国软件企业 ； 信息技术 ； 刘积仁 ； 经济增长 ； 信息服务业 ； 企业多元化 ；	<正>创新是推动软件创造价值的核心动力,信息技术如何通过各种创新的商业模式和关联产品来实现价值,推动社会向前发展,是软件企业的重要社会责任。当前,全球经济形势愈加复杂多变,经济增长和金融稳定面临巨大风险,各大行业面临重新洗牌,社会发展面临新一轮转型和升级。随着信息技术发展的突飞猛进,物联网、互联网、云计算等新兴技术快速走进人们的生活,影响和创造着新的学习、生活和思维模式。	2012年11期_变革时代的创新.pdf	http://sso.cdclib.org/interlibSSO/goto/6/=06190596Z93/kcms/detail/detail.aspx?dbCode=cjfq&filename=RJSJ201211044&dbname=CJFDLAST2014
江苏省中小企业物联网产业创新服务平台	软件和信息服务	2012	2012年11期		物联网 ； 创新服务平台 ； 研究发展中心 ； 创业投资 ； 企业创新发展 ； 信息化委员会 ； 产业基金 ； 平台简介 ； 信息服务 ； 无锡新区 ；	<正>一、平台简介"江苏省中小企业物联网产业创新服务平台",由江苏中科物联网科技创业投资有限公司承担建设和运营,2011年底经过江苏省经济和信息化委员会、江苏省中小企业局正式批复成立.平台旨在依托中科院和中国物联网研究发展中心的强大资源,立足无锡、服务全省、面向全国,为省内广大中小企业提供综合性、全方位的优质服务.平台充分发挥自身优势,结台地方政府扶持政策,联合全社会优秀中介服务机构,为广大中小企业提供资本、技术、产品、人才、政策、管理等各类信息服务,努力帮助提升中小企业创新发展能力,有效推动无锡市乃至江苏省物联网产业快速健康发展。	2012年11期_江苏省中小企业物联网产业创新服务平台.pdf	http://sso.cdclib.org/interlibSSO/goto/6/=06190596Z93/kcms/detail/detail.aspx?dbCode=cjfq&filename=RJSJ201211045&dbname=CJFDLAST2014
SAP HANA将贯穿全球技术研发者大会始终	软件和信息服务	2012	2012年11期	【作者】 张贝贝 ；	研发者 ； SAP HANA ； 全球技术 ； 创新价值 ； 全球企业 ； 服务部门 ； 创新应用 ； 社区网络 ； 移动应用 ； 数据平台 ；	<正>近日,在SAP召开的媒体预热会上,SAP全球企业官及SAP中国研究院总裁孙小群表示:"2012 SAP TechEd"所有的课程基本上都以SAP HANA贯穿,今年还特别推出"价值体现"的课题大类,由SAP全球支持服务部门负责,让客户和合作伙伴真正掌握如何把SAP的软件、解决方案用得更好。SAP HANA的核心创新价值近两年,业界的关注焦点都放在了SAP HANA的内存计算上,但这是否会忽略了	2012年11期_SAP+HANA将贯穿全球技术研发者大会始终.pdf	http://sso.cdclib.org/interlibSSO/goto/6/=06190596Z93/kcms/detail/detail.aspx?dbCode=cjfq&filename=RJSJ201211046&dbname=CJFDLAST2014
