title	journal_name	year	issue	author	keywords	summary	pdf_filename	article_url
诺基亚OVI中国市场胜算几何?	软件世界	2010	2010年10期	【作者】 李玲玲 ；	OVI ； 开发者 ； 选择项 ； 副总裁 ； 应用程序 ； 移动应用 ； 互联网战略 ； 销售渠道 ； 产业化之路 ； 服务开发 ；	<正>诺基亚Ovi商店正式向中国发布之举有无奈"应景"之嫌,但对中国的诺基亚用户和开发者而言总算是有了一个可选择项。全球竞相仿效苹果应用商店的战火逐渐烧	2010年10期_诺基亚OVI中国市场胜算几何?.pdf	http://sso.cdclib.org/interlibSSO/goto/6/=06190596Z93/kcms/detail/detail.aspx?dbCode=cjfq&filename=RJSJ201010022&dbname=CJFDLAST2014
NEC、东软共推云计算	软件世界	2010	2010年10期	【作者】 卢敏 ；	推云 ； NEC ； 东软集团 ； 市场领先者 ； 中国大连 ； 公司名称 ； 核心系统 ； 健康管理服务 ； 位置服务 ； 技术出资 ；	<正> 此次合作,双方的目标都是在未来成为中国的云计算服务业务领域的市场领先者。 8月31日,NEC与东软集团签署了合作协议。双方投资5000万元基于此合作协议,NEC集团与东软集团将于今年10月在中国大连设立合资公司,面向中国市场共同推进云计算服务业务。根据协议,该合资公司名称暂定为日电东软信息技术有限公司,资本金为NEC(中国)	2010年10期_NEC、东软共推云计算.pdf	http://sso.cdclib.org/interlibSSO/goto/6/=06190596Z93/kcms/detail/detail.aspx?dbCode=cjfq&filename=RJSJ201010023&dbname=CJFDLAST2014
东方通借势核高基	软件世界	2010	2010年10期	【作者】 李玲玲 ；	核高基 ； 入围企业 ； 国产软件 ； 核心业务系统 ； 商业银行资金 ； 中国软件 ； 清算中心 ； 小额支付 ； 大型商业银行 ； 人民银行 ；	随着核高基入围企业名单的陆续确定,围绕核高基的话题也不再那么讳莫如深。抛开争议不说,它确实为入围企业带来了益处,但拿下核高基项目后,怎么用?用得好不好?却又是另一种考验。	2010年10期_东方通借势核高基.pdf	http://sso.cdclib.org/interlibSSO/goto/6/=06190596Z93/kcms/detail/detail.aspx?dbCode=cjfq&filename=RJSJ201010024&dbname=CJFDLAST2014
中小企业信息化突围	软件世界	2010	2010年10期	【作者】 史蕾 ；	企业突围 ； 微薄利润 ； 物联网 ； 经营方式 ； 中国移动 ； 无线城市 ； 信息化论坛 ； 企业信息化工程 ； 客户部 ； 经营管理效率 ；	长期依靠低成本赚取微薄利润的经营方式已难以为继,市场化、国际化的现实要求,使中小企业面临机遇与挑战。而信息化正是帮助中小企业突围的有效途径。	2010年10期_中小企业信息化突围.pdf	http://sso.cdclib.org/interlibSSO/goto/6/=06190596Z93/kcms/detail/detail.aspx?dbCode=cjfq&filename=RJSJ201010025&dbname=CJFDLAST2014
数据泄漏真就“防”不胜防?	软件世界	2010	2010年10期	【作者】 李玲玲 ；	信息安全 ； 等级保护 ； 防泄密 ； 文档加密 ； 信息泄密 ； 绿盟科技 ； 文档管理 ； 行为审计 ； 公钥基础设施 ； 身份验证 ；	每天,各种来自组织内和组织间的巨量数据流动,不知不觉中增加了难以掌控的安全风险。窃密、泄密和失密的情况可能随时发生,让我们的企业和组织"防"不胜防。究竟是谁让我们的数据处于高风险?有什么方法可以保证我们的数据安全?风险与防范这对矛和盾该如何做到有效平衡?问题摆在我们面前,是深入思考还是置之不理,或将决定我们的数据安全处于何种状态。	2010年10期_数据泄漏真就“防”不胜防?.pdf	http://sso.cdclib.org/interlibSSO/goto/6/=06190596Z93/kcms/detail/detail.aspx?dbCode=cjfq&filename=RJSJ201010026&dbname=CJFDLAST2014
信息安全,巨头整合产业链的重要拼图	软件世界	2010	2010年10期	【作者】 樊江洋 ； 【机构】 中国电子信息产业发展研究院软件与信息服务业研究所 ；	信息安全 ； 副总裁 ； 维特 ； 数据中心 ； 应用程序 ； 方案执行 ； 业务格局 ； 攻击手法 ； 社会工程学 ； 攻击手段 ；	<正> 201 0年9月1 4日,惠普公司(HP)宣布将收购信息安全公司ArcSight,惠普软件与解决方案执行副总裁比尔·维特(Bill Veghte)就此次收购专门发表声明称:ArcSight的"卓越技术"将对惠普现有的安全产品和服务体系起到良好的补充作用,借助ArcSight的产品和服务,客户能够监测对其网络、数据中心中构成安全威胁及其它非正常活动的可疑应用程序。值得注意的是,在不到一个月前的8月17日,	2010年10期_信息安全,巨头整合产业链的重要拼图.pdf	http://sso.cdclib.org/interlibSSO/goto/6/=06190596Z93/kcms/detail/detail.aspx?dbCode=cjfq&filename=RJSJ201010027&dbname=CJFDLAST2014
新生媒体微博之影响	软件世界	2010	2010年10期	【作者】 吕海霞 ； 【机构】 中国电子信息产业发展研究院软件与信息服务业研究所 ；	综合门户网站 ； 信息门户 ； 互联网产品 ； 腾讯 ； 发布平台 ； 互联网营销 ； 内部沟通 ； 危机公关 ； 社会生活 ； 开放式平台 ；	<正> 作为Web2.0新生儿的微博是SNS和博客以来最热门的互联网产品,同时也是全球网络业讨论最多的耀眼明星。继2009年8月新浪网推出"新浪微博"以来,搜狐、网易、腾讯、凤凰等大型综合门户网站纷纷推出微博产品,展开"围脖大战",微博成为了信息门户网站的"标配"。随着一个"人人织博"的全民微博时代的到来,微博悄然渗透到人们社会生活的方方面面,彰显其作为新生媒体的巨大生命	2010年10期_新生媒体微博之影响.pdf	http://sso.cdclib.org/interlibSSO/goto/6/=06190596Z93/kcms/detail/detail.aspx?dbCode=cjfq&filename=RJSJ201010028&dbname=CJFDLAST2014
推行手机实名制 运营商责无旁贷	软件世界	2010	2010年10期	【作者】 陈阳 ； 【机构】 中国电子信息产业发展研究院软件与信息服务业研究所 ；	手机实名制 ； 保障信息 ； 社会渠道 ； 补登 ； 中国联通 ； 中国电信 ； 中国移动 ； 登记制度 ； 诈骗犯罪 ； 电信法 ；	<正> 工信部日前下发通知,决定从9月1日起正式实施电话用户实名登记制度,且设置三年的过渡期进行推行。手机实名制的推行,有助于打击手机不良信息和诈骗犯罪,保护个人用户权益以及保障信息流畅。虽然手机实名制的实施在短期内对运营商是一个巨大的挑战,但在长期是一项有益的政策。运营商有责任也有能力去推行手机实名制,应积极主动采取多种措施,助力手机实名制更好的施行。	2010年10期_推行手机实名制+运营商责无旁贷.pdf	http://sso.cdclib.org/interlibSSO/goto/6/=06190596Z93/kcms/detail/detail.aspx?dbCode=cjfq&filename=RJSJ201010029&dbname=CJFDLAST2014
泉城发出的科技之音——齐鲁软件园产业巡礼	软件世界	2010	2010年10期	【作者】 刘亚杰 ；	齐鲁软件园 ； 信息服务产业 ； 软件产业基地 ； 信息服务业 ； 软件服务外包 ； 服务外包基地 ； 信息服务外包 ； 软件信息 ； 企业联盟 ； 一流技术 ；	<正>位于"泉城"济南的齐鲁软件园,正用自己的方式,谱写软件和信息服务产业的强音。济南历史悠久,风景秀丽,泉水众多,因此又有"泉城"的美誉。然而	2010年10期_泉城发出的科技之音——齐鲁软件园产业巡礼.pdf	http://sso.cdclib.org/interlibSSO/goto/6/=06190596Z93/kcms/detail/detail.aspx?dbCode=cjfq&filename=RJSJ201010030&dbname=CJFDLAST2014
中国软件名城:软件和信息服务产业发展的窗口	软件世界	2010	2010年10期	【作者】 刘亚杰 ；	信息服务产业 ； 中国软件 ； 软件服务业 ； 北京民族饭店 ； 信息产业 ； 工业和信息化部 ； 倍增器 ； 新兴产业 ； 国家安全 ；	<正> 2010年一月份,中国软件名城创建工作备忘录签约仪式在北京民族饭店举行。也正是在这次会议中,工业和信息化部通过了首批"中国软件名城"创建试点城市。这五个"软件名城"分别是北京、上海、南京、济南和成都。五座城市各具特色,不过在软件和信息服务产业,这五座城市的发展速度和势头非常迅猛。软件服务业是信息产业的核心和灵魂,是经济社会发展的基础性、先导性、战	2010年10期_中国软件名城:软件和信息服务产业发展的窗口.pdf	http://sso.cdclib.org/interlibSSO/goto/6/=06190596Z93/kcms/detail/detail.aspx?dbCode=cjfq&filename=RJSJ201010031&dbname=CJFDLAST2014
“软件名城”南京——中国软件和信息服务业发展的“先头部队”	软件世界	2010	2010年10期		中国软件 ； 信息服务业 ； 经济核心区 ； 生产力布局 ； 信息服务产业 ； 杨学山 ； 联创科技 ； 信息产业 ； 产业发展环境 ； 发展战略 ；	<正> 南京,简称宁,是江苏省省会城市。它地处长江下游平原,以及国家生产力布局中最大的经济核心区——长江三角洲,总面积6598平方公里。南京众多产业的发展速度都处在全国前列,其中也包括软件	2010年10期_“软件名城”南京——中国软件和信息服务业发展的“先头部队”.pdf	http://sso.cdclib.org/interlibSSO/goto/6/=06190596Z93/kcms/detail/detail.aspx?dbCode=cjfq&filename=RJSJ201010032&dbname=CJFDLAST2014
技术创新铸就企业级安全(需求篇)	软件世界	2010	2010年10期	【作者】 卢敏 ；	企业级用户 ； 信息安全 ； 网络安全 ； 技术创新 ； 安全域 ； 邮件内容 ； 用户计算机 ； 分级保护 ； 网络访问控制 ； 检测机制 ；	企业级用户考虑更多的是怎样选择自己合适的产品,选择具有核心技术与良好服务的安全产品才能为企业带来更可靠的保障。随着政府及企业信息化建设的迅猛发展,企业级用户对安全产品的选择也将会日趋成熟。	2010年10期_技术创新铸就企业级安全(需求篇).pdf	http://sso.cdclib.org/interlibSSO/goto/6/=06190596Z93/kcms/detail/detail.aspx?dbCode=cjfq&filename=RJSJ201010033&dbname=CJFDLAST2014
中小企业信息化服务去向何方	软件世界	2010	2010年10期	【作者】 姜稳 ；	用户需求 ； 网站建设 ； 投资预算 ； 客服人员 ； 邮件系统 ； 竞争能力 ； 推广方式 ； 外部竞争环境 ； 最大收益 ； 中小企业群体 ；	<正>在中小企业信息化服务发展的道路上,不光要根据用户需求不断调整服务方式和方向,也要帮助企业找准自己的定位,这才是产业长足发展的基础。不知不觉	2010年10期_中小企业信息化服务去向何方.pdf	http://sso.cdclib.org/interlibSSO/goto/6/=06190596Z93/kcms/detail/detail.aspx?dbCode=cjfq&filename=RJSJ201010034&dbname=CJFDLAST2014
为私有云“瘦身”	软件世界	2010	2010年10期	【作者】 史蕾 ；	成本节约 ； 瘦客户机 ； 主要需求 ； 桌面型 ； 提供商 ； 语音应用 ； 本地文件 ； 可管理性 ； 访问应用 ； 银行企业 ；	<正>通过虚拟化的解决方案,可以实现对办公"私有云"的有效"瘦身",从而满足用户在安全性、合规性及成本节约等方面的需求。虚拟桌面的应用逐渐成熟	2010年10期_为私有云“瘦身”.pdf	http://sso.cdclib.org/interlibSSO/goto/6/=06190596Z93/kcms/detail/detail.aspx?dbCode=cjfq&filename=RJSJ201010035&dbname=CJFDLAST2014
数据中心网络架构三步走	软件世界	2010	2010年10期	【作者】 卢敏 ；	数据中心 ； 架构技术 ； 交换技术 ； 网络层 ； 可扩展性 ； 网络范围 ； 网络基础架构 ； 瞻博网络 ； 未来网络 ； 三步走 ；	<正> 集群交换技术能逐渐将网络的层数从两层降为一层,因此客户将可获得在整个数据中心网络范围内的更低延迟。瞻博网络近期发布了未来网络数据中心和"3-2-1"数据中心网络架构,而这正是瞻博不断进行架构技术创新的结果。一直以来,传统的网络基础架构是采用树状结构,而这种架构所具有的先天的复杂性极大地限制了云计算及其他IT系统所需的性能与可扩展性。	2010年10期_数据中心网络架构三步走.pdf	http://sso.cdclib.org/interlibSSO/goto/6/=06190596Z93/kcms/detail/detail.aspx?dbCode=cjfq&filename=RJSJ201010036&dbname=CJFDLAST2014
Check Point:软件刀片让应用更可控	软件世界	2010	2010年10期	【作者】 卢敏 ；	Check Point ； 安全管理员 ； 新兴互联网 ； 应用程序 ； 用户身份 ； 应用控制 ； 互联网安全 ； 公司网络 ； 使用策略 ； 社交网络 ；	<正> 软件刀片技术允许企业直观地制定策略,在基于用户身份的基础上,识别、阻止或限制数千应用程序的使用。根据Check Point和Ponemon近期在全球对2,100位IT安全管理员进行的调查,大部分受访者认为员工是帮助企业降低与新兴互联网应用相关安全风险的关键。而Check Point此次推出的全新的应用控制软	2010年10期_Check+Point:软件刀片让应用更可控.pdf	http://sso.cdclib.org/interlibSSO/goto/6/=06190596Z93/kcms/detail/detail.aspx?dbCode=cjfq&filename=RJSJ201010037&dbname=CJFDLAST2014
IBM ISM三步实现IT与业务智慧结合	软件世界	2010	2010年10期	【作者】 卢敏 ；	智慧地球 ； IBM ISM ； Tivoli ； 全球战略 ； 副总裁 ； 发展趋势 ； 服务链 ； 改变自己 ；	<正> 近日,IBM Tivoli Software全球战略和开发副总裁Jamie M.Thomas在访华期间对IBM的ISM未来发展趋势进行了宣讲说明。Jamie表示,IBM从两年前开始推广"智慧地球",而ISM正是"智慧地球"的核心之一。ISM能够把企业中现有的IT运营联系起来,可以在能源、交通等各个行业起到积极作用。	2010年10期_IBM+ISM三步实现IT与业务智慧结合.pdf	http://sso.cdclib.org/interlibSSO/goto/6/=06190596Z93/kcms/detail/detail.aspx?dbCode=cjfq&filename=RJSJ201010038&dbname=CJFDLAST2014
用户经验产物:Aisino A6 3.0	软件世界	2010	2010年10期	【作者】 刘亚杰 ；	企业管理软件 ； Aisino A6 3.0 ； 航天信息 ； 车间管理 ； 功能模块 ； 动态查询 ； 业务管理 ； 经验总结 ； 车间制造 ； 账套 ；	<正> "Aisino ERP产品是针对中国企业应用特点而专门研发的适用本土化的企业管理软件,在精确控制企业成本问题上的专业表现,是我们选择Aisino ERP的最根本原因。"——湖南长天九五机械有限公司董事长李新桥。好评的取得并不容易,而构建这一好评的道路更加艰难。以航天信息近期发版的Aisino A6 3.0来说,它之所以能在短时间内被用户认可,是基于航天	2010年10期_用户经验产物:Aisino+A6+3.0.pdf	http://sso.cdclib.org/interlibSSO/goto/6/=06190596Z93/kcms/detail/detail.aspx?dbCode=cjfq&filename=RJSJ201010039&dbname=CJFDLAST2014
VMware正式交付VMware View 4.5	软件世界	2010	2010年10期	【作者】 李玲玲 ；	终端用户 ； 组织机构 ； VMWare ； 首款 ； VMware ； 线或 ； 数据中心 ； 运营成本 ； 大中华区 ； 可管理性 ；	<正> 近日,VMware正式交付首款企业级桌面虚拟化解决方案——VMware View 4.5,为在线或脱机的终端用户提供丰富的虚拟桌面体验。它作为一款完整的虚拟桌面解决方案,构建了一种现代的终端用户计算架构,能够帮助企业提高安全性、降低运营成本和简化桌面管理。VMware的终端用户计算愿景,旨在帮助组织机构将遗留的桌面计算环境转变成一种更加现代、以用户为中心的应	2010年10期_VMware正式交付VMware+View+4.5.pdf	http://sso.cdclib.org/interlibSSO/goto/6/=06190596Z93/kcms/detail/detail.aspx?dbCode=cjfq&filename=RJSJ201010040&dbname=CJFDLAST2014
“新一代核心业务系统”助推跨区域发展	软件世界	2010	2010年10期	【作者】 卢敏 ；	核心业务系统 ； 跨区域发展 ； 区域性银行 ； 强化风险管理 ； 业务品种 ； 业务模块 ； 综合服务水平 ； 整合服务 ； 层次的 ；	<正> 近日,成都银行正式对外公布"新一代核心业务系统"建设招标的最终结果,神州数码融信软件有限公司一举胜出。这是神州数码融信在区域性银行市场赢得的又一重要里程碑项目,该系统建成后,将可实现"服务"和"智能"两大功能性目标,充分满足成都银行跨区域发展的战略需要,并全面支持未来3～5年	2010年10期_“新一代核心业务系统”助推跨区域发展.pdf	http://sso.cdclib.org/interlibSSO/goto/6/=06190596Z93/kcms/detail/detail.aspx?dbCode=cjfq&filename=RJSJ201010041&dbname=CJFDLAST2014
下一代数据中心:利用Oracle进行优化	软件世界	2010	2010年10期	【作者】 卢敏 ；	数据中心 ； Oracle ； 甲骨文公司 ； 产品战略 ； 存储系统 ； Orade ； 全面集成 ； 软件系统 ； 软硬件体系 ； 企业改造 ；	<正> 为全面介绍Oracle+Sun产品战略,进一步展示企业如何获得高效数据中心,甲骨文于今年七月起启动了主题为"下一代数据中心:利用Oracle进行优化"的数据中心高峰会的全球路演。活动从2010年7月起,将一直持续到2010年11月,在全球超过35个国家陆续举办100多场活动。届时,甲骨文公司高层和技术专家将全面阐释Oracle+Sun	2010年10期_下一代数据中心:利用Oracle进行优化.pdf	http://sso.cdclib.org/interlibSSO/goto/6/=06190596Z93/kcms/detail/detail.aspx?dbCode=cjfq&filename=RJSJ201010042&dbname=CJFDLAST2014
模块化产品架构:BOM管理“效率官”	软件世界	2010	2010年10期	【作者】 刘子力 ； 王滨后 ； 【机构】 海尔集团 ；	模块化产品 ； BOM ； 物料清单 ； 竞争能力 ； 产品设计周期 ； 数据管理 ； 管理手段 ； 功能元素 ； 解藕 ； 零组件 ；	物料清单(BOM)管理是企业正常运转的必须功能。有效管理BOM是提升企业竞争力的关键环节。通过模块化产品架构的定义能够有力提升BOM管理的有效性。	2010年10期_模块化产品架构:BOM管理“效率官”.pdf	http://sso.cdclib.org/interlibSSO/goto/6/=06190596Z93/kcms/detail/detail.aspx?dbCode=cjfq&filename=RJSJ201010043&dbname=CJFDLAST2014
协同随需应变,BIM拉动发展引擎	软件世界	2010	2010年10期	【作者】 CCDI ；	传统工作方式 ； BIM ； 奥体中心 ； 随需应变 ； 主体育场 ； 发展引擎 ； Autodesk ； 钢结构体系 ； 空间曲面 ； 张学斌 ；	<正>"BIM是CCDI未来的战略之一,因为我们已经预见到BIM将会改变现有建筑生命周期的传统工作方式,BIM是改变中国建筑业现状的趋势"。建筑行业是一个庞大	2010年10期_协同随需应变,BIM拉动发展引擎.pdf	http://sso.cdclib.org/interlibSSO/goto/6/=06190596Z93/kcms/detail/detail.aspx?dbCode=cjfq&filename=RJSJ201010044&dbname=CJFDLAST2014
探路者:信息化建设不能做面子工程——户外用品服装业分销网络ERP实施初探	软件世界	2010	2010年10期	【作者】 李玲玲 ；	探路者 ； 户外用品 ； ERP实施 ； 分销网络 ； 缺口问题 ； 短期资金 ； 面子工程 ； 供应链 ； 供应商管理 ； 行业发展速度 ；	风光上市,对脚踏实地做事的企业而言,确实能缓解因发展带来的短期资金缺口问题,但资金的愉悦为决策者换来的却是无形的高压,如企业内部的运营、管理、业务等都必须紧跟发展。而信息化的适时部署对探路者的减压功不可没。	2010年10期_探路者:信息化建设不能做面子工程——户外用品服装业分销网络ERP实施初探.pdf	http://sso.cdclib.org/interlibSSO/goto/6/=06190596Z93/kcms/detail/detail.aspx?dbCode=cjfq&filename=RJSJ201010045&dbname=CJFDLAST2014
悦读	软件世界	2010	2010年10期		钱贵 ； 中国员工 ； 头痛医头 ； 脚痛 ； 谷歌 ； 阿拉丁 ； 精神领袖 ； 整体管理 ； 编程思想 ； 布斯 ；	<正> 《执行力引擎——制度落地》钱贵昱耿启亮著中国经济出版社(咨询+软件)×国学智慧=制度"落地" 执行力几乎成为一个永恒的管理话题,但对许多企业而言却仅仅只是一个概念。大多数管理者都为如何将这个概念真正"落地"而苦恼,本书明确地指出其中的关键点:许多企业在现实中"头痛医头,脚痛医脚",治标不治本,而是应该首先解决执行力最基础的问题——制度落地。只有制度落地了,执行力才有可	2010年10期_悦读.pdf	http://sso.cdclib.org/interlibSSO/goto/6/=06190596Z93/kcms/detail/detail.aspx?dbCode=cjfq&filename=RJSJ201010046&dbname=CJFDLAST2014
应用推动国产工业软件“雄起”	软件世界	2010	2010年09期	【作者】 王占波 ；	工业软件 ； 制造业大国 ； 雄起 ； 中国制造 ； 全球影响力 ； 工业和信息化部 ； 国产软件 ； 管理软件厂商 ； 产业结构调整 ； 世界制造大国 ；	<正> 近年来,我国工业快速发展,已成为具有全球影响力的制造业大国。但工业大而不强的问题仍十分突出。工业软件作为我国工业和信息化的黏合剂、发动机,无疑是实现由"中国制造"到"中国创造"战略,完成产业结构调整和升级转型的重要支撑。但现状并不乐观。由工业和信息化部发布的评估报告显示,目前24.5%	2010年09期_应用推动国产工业软件“雄起”.pdf	http://sso.cdclib.org/interlibSSO/goto/6/=06190596Z93/kcms/detail/detail.aspx?dbCode=cjfq&filename=RJSJ201009001&dbname=CJFDLAST2014
要闻	软件世界	2010	2010年09期		国家税务总局 ； 服务外包业务 ； 离岸外包 ； 进口税收政策 ； 炒股软件 ； 证券从业人员 ； 投资顾问 ； 经济发展方式 ； 创新驱动型 ； 重要战略意义 ；	<正> 1 三部委新政:21城离岸外包免营业税8月11日,财政部在其官方网站向外公布,免征21个城市离岸服务外包业务的营业税,以进一步扶持服务外包产业的发展。为此,财政部、国家税务总局、商务部联合下发《关于示范城市离岸服务外包业务免征营业税的通知》显示,自2010年	2010年09期_要闻.pdf	http://sso.cdclib.org/interlibSSO/goto/6/=06190596Z93/kcms/detail/detail.aspx?dbCode=cjfq&filename=RJSJ201009002&dbname=CJFDLAST2014
业界动态	软件世界	2010	2010年09期		笔记本电脑 ； Citrix ； 易用性 ； 中国惠普 ； 工作负载 ； 智慧系统 ； 数据中心 ； 信息管理软件 ； 战略并购 ； 台式电脑 ；	<正> 1 Citrix桌面虚拟化技术让笔记本电脑用户获益8月30日,思杰系统公司发布了Citrix XenClient和Citrix XenVault两项新技术,让企业笔记本电脑用户得以享受到桌面虚拟化的益处。这两项新技术使企业IT人员更容易将笔记本电脑用户纳入统一企业桌面虚拟化战略,提供上佳的安全性和易用性。各类企业可以通过部署单一的桌面虚拟化解决方案,	2010年09期_业界动态.pdf	http://sso.cdclib.org/interlibSSO/goto/6/=06190596Z93/kcms/detail/detail.aspx?dbCode=cjfq&filename=RJSJ201009003&dbname=CJFDLAST2014
服务资讯	软件世界	2010	2010年09期		软件服务业 ； 赛迪顾问 ； 电子信息 ； 服务标准化 ； 计算机行业 ； 产业发展研究 ； 信息化推进 ； 工业和信息化部 ； 北京住总集团 ； 消费指导 ；	<正> 1 2010年中国IT服务年会在京召开8月26日,由中国电子信息产业发展研究院、中国信息化推进联盟主办,赛迪顾问股份有限公司、中国计算机报社承办的"2010年中国IT服务年会"在北京召开。本届年会以"洞悉内需新市场,聚焦服务标准化"为主题。工业和信息化部软件服务业司陈伟司长、中国电子信息	2010年09期_服务资讯.pdf	http://sso.cdclib.org/interlibSSO/goto/6/=06190596Z93/kcms/detail/detail.aspx?dbCode=cjfq&filename=RJSJ201009004&dbname=CJFDLAST2014
新品	软件世界	2010	2010年09期		卡巴斯基实验室 ； 防火墙系统 ； 旗舰产品 ； 欧特克 ； 工厂设计 ； 内容过滤 ； 三维设计 ； 二维绘图 ； 业务流量 ； 模块化设计 ；	<正> 1 成龙助阵卡巴安全部队上市8月29日,卡巴斯基实验室举行了主题为"卡巴斯基为你而战"的新品发布会。与以往的新品发布不同,卡巴斯基实验室此次携年度旗舰产品安全部队2011及反病毒2011共同亮相于规模宏大的IMAX影院,卡巴斯基实验室创始人兼CEO尤金·卡巴斯基、亚太区董事总经理张立申先生、北京百汇数字星空科技有限公司CEO刘建华先生与国际级影星成	2010年09期_新品.pdf	http://sso.cdclib.org/interlibSSO/goto/6/=06190596Z93/kcms/detail/detail.aspx?dbCode=cjfq&filename=RJSJ201009005&dbname=CJFDLAST2014
地方资讯	软件世界	2010	2010年09期		地区信息化 ； 上海信息化 ； 物联网 ； 形势分析 ； 工业转型 ； 战略协议 ； 科技研究所 ； 计算项目 ； 电子商业 ； 信息化委员会 ；	<正> 北京市:信息化蓝皮书显示北京信息化水平全国第一8月19日,《2010年中国信息化形势分析与预测》正式发布。具体内容指出,我国各地区信息化水平整体上呈逐年上升的趋势,但区域间的差异较大。其中,北京、上海信息化水平指数排名稳居国内第一和第二,在信息化水平上处于绝对的领先地位;广东、天津、浙江、福建紧随其后;而甘肃、安徽、贵州信息化水平较低,其余各省市处于中间水平。	2010年09期_地方资讯.pdf	http://sso.cdclib.org/interlibSSO/goto/6/=06190596Z93/kcms/detail/detail.aspx?dbCode=cjfq&filename=RJSJ201009006&dbname=CJFDLAST2014
