title	journal_name	year	issue	author	keywords	summary	pdf_filename	article_url
产业动态	软件世界	1995	1995年12期		自动识别 ； 混排 ； 电脑应用 ； 文通 ； 产业动态 ； 自动切割 ； 用户界面 ； 信息应用 ； 重点项目 ； 应用开发环境 ；	<正> 为了普及和推动我国电脑应用及发展,清华文通公司日前在京举行“清华TH—OCR首赠仪式”,拉开了清华文通公司在全国范围内开展赠送活动的帷幕。 清华TH—OCR是清华文通公司的拳头产品,是国家863计划的重点项目。其产品支持中、英文混排同时识别;横竖版面自动切割及同时识别;表格自动识别	1995年12期_产业动态.pdf	http://sso.cdclib.org/interlibSSO/goto/6/=06190596Z93/kcms/detail/detail.aspx?dbCode=cjfq&filename=RJSJ199512000&dbname=CJFD9498
MRPⅡ的现状和最新技术动向	软件世界	1995	1995年12期	【作者】 蒋明炜 ； 【机构】 北京利玛信息技术公司 ；	物料需求计划 ； 主生产计划 ； 软件开发环境 ； 制造资源计划 ； 管理信息系统 ； 库存模型 ； 辅助企业 ； 企业管理系统 ； 技术动向 ； 系统集成 ；	<正> 一、国内外计算机辅助企业管理的现状 MRPⅡ技术发展已有30年历史,经历过几个阶段,如图1。在50年代试图根据需求变化建立各种各样的库存模型,来解决物料需求问题,今天看来这是一种落后的管理方法。60年代建立了独立需求和相关需求的概念,围绕着主生产计划、物料清单提出了物料需求的算法和逻辑,开发了开环的物料需求计划MRP(Material Requirements Planning)。在70—80年代随着计算机技术和管理技术的发展,形成了制造资源计划MRPⅡ(Manufacturing Resource Planning)。MRP	1995年12期_MRPⅡ的现状和最新技术动向.pdf	http://sso.cdclib.org/interlibSSO/goto/6/=06190596Z93/kcms/detail/detail.aspx?dbCode=cjfq&filename=RJSJ199512001&dbname=CJFD9498
人工神经元网络模型在银行和社会经济效益评价中的应用	软件世界	1995	1995年12期	【作者】 李仲莲 ； 杨沂 ； 蒋亚君 ； 【机构】 中国金融学院 ； 中国金融学院 ；	人工神经元网络 ； 联想记忆能力 ； 经济效益评价 ； 隐节点 ； 评价方法 ； 误差反向传播 ； 综合评价 ； 正向传播 ； 输入层 ； 动态系统 ；	本文利用人工神经元网络的学习优点,通过调整神经元内部的权重,改进BP算法,加快收敛速度,对银行和社会经济效益进行综合评价,改变了传统信息联想记忆能力的评价方法,收到了较好的效果。本文提出的评价方法适用于银行和各经济部门。	1995年12期_人工神经元网络模型在银行和社会经济效益评价中的应用.pdf	http://sso.cdclib.org/interlibSSO/goto/6/=06190596Z93/kcms/detail/detail.aspx?dbCode=cjfq&filename=RJSJ199512002&dbname=CJFD9498
进程迁移的实现及其策略	软件世界	1995	1995年12期	【作者】 陈洛资 ； 黄正瑞 ； 黄干平 ；	进程迁移 ； 调度策略 ； 页表项 ； 互连网 ； 负载平衡算法 ； 用户空间 ； 栈指针 ； 通信开销 ； 运行环境 ； 环境组成 ；	本文介绍了在用以太局域网互连的SUN工作站上,给VMUNIX操作系统增加进程迁移系统功能的设计与实现,它允许按照一定的调度策略,使执行的进程可以在各结点机之间传送,并能正确地返回该进程所执行的结果。最后还介绍了有关进程迁移的策略,分析了采用这些策略后整个系统的性能。进程迁移能大大提高系统的性能。	1995年12期_进程迁移的实现及其策略.pdf	http://sso.cdclib.org/interlibSSO/goto/6/=06190596Z93/kcms/detail/detail.aspx?dbCode=cjfq&filename=RJSJ199512003&dbname=CJFD9498
SGI IRIX系统中的多线程应用程序设计	软件世界	1995	1995年12期	【作者】 李霖 ；	多线程应用 ； SGI IRIX ； 并发程序设计 ； 应用程序设计 ； 进程切换 ； 多处理机系统 ； UNIX ； 系统开销 ； 执行速度 ； 同步原语 ；	<正> 在SGI系列工作站与服务器上使用的是IRIX操作系统,它与UNIX System Ⅴ完全兼容,并吸收了BSD4.3 UNIX的若干特点,更重要的是它能够支持对称多处理机系统(SMP),支持多线程并发程序设计。 传统的单机UNIX对用户设计并发程序的支持仪限于多进程概念,用户必须将单个任务划分成独立的多个进程,这些进程通过UNIX的IPC机制相互通信、保持同步,共同完成指定任务。这种方法的缺点是进程间地址空间相互独立,进程切换的系统开销较大,IPC机制的开销也较大,这样过多的进程切换和通信	1995年12期_SGI+IRIX系统中的多线程应用程序设计.pdf	http://sso.cdclib.org/interlibSSO/goto/6/=06190596Z93/kcms/detail/detail.aspx?dbCode=cjfq&filename=RJSJ199512004&dbname=CJFD9498
城市出租汽车电脑管理系统设计	软件世界	1995	1995年12期	【作者】 邓国民 ； 【机构】 大连财贸职工学院 ；	管理系统设计 ； 总体设计思想 ； 城市出租汽车 ； 出租汽车行业 ； 功能模块 ； 功能菜单 ； 统计报表 ； 监督管理系统 ； 代码库 ； 业务管理 ；	本文提出了一种实用的电脑管理模式,并对该系统的主要功能特点以及总体设计思想进行了详细阐述,以利于椎广。	1995年12期_城市出租汽车电脑管理系统设计.pdf	http://sso.cdclib.org/interlibSSO/goto/6/=06190596Z93/kcms/detail/detail.aspx?dbCode=cjfq&filename=RJSJ199512005&dbname=CJFD9498
Windows 3.0下将内存中点位图存于与设备无关点位图文件	软件世界	1995	1995年12期	【作者】 张凤声 ；	位图文件 ； Windows 3.0 ； 图形处理 ； 输出设备 ； 存中 ； 位模式 ； 模式构成 ； 颜色表 ； 窗口句柄 ； 位面 ；	<正> Windows3.0有强大的图形处理功能,它把图形分成两类:一类是依赖于设备的点位图,另一类是与设备无关点位图。依赖于设备的位图由内存中位模式构成,由专门函数将这些位模式传给输出设备,这种位图在内存中的位与设备上像素之间有专门对应关系,而与设备无关位图不具备与设备相应格式,而DIB函数将这种与设备无关的图像数据转化为当前输出设备可理解的格式。本文讨论内存中的与设备相关的位图如何转换成与设备无关的位图而存储于,BMP文件中。这在图形处理中非常有用。 下面通过一个例子说明此过程,由于篇幅所限,在此不写整个程序,而把上述过程封装在一个函数中,函	1995年12期_Windows+3.0下将内存中点位图存于与设备无关点位图文件.pdf	http://sso.cdclib.org/interlibSSO/goto/6/=06190596Z93/kcms/detail/detail.aspx?dbCode=cjfq&filename=RJSJ199512006&dbname=CJFD9498
一种建立无规则间断自然数序列与连续自然数序列间一一对应关系的方法	软件世界	1995	1995年12期	【作者】 程捷 ；	连续自然数 ； 软件开发过程 ； 四间房 ； 索引文件 ； 算法思想 ； 映射函数 ； 矩阵方法 ； 一一映射 ； 从一 ； 不连续 ；	<正> 在软件开发过程中有时会遇到这样的问题,即将一组无规则间断自然数序列与一个从一开始的连续自然数序列一一对应起来。比如一座楼房有五层,共四十四间房间,房间编号如下:	1995年12期_一种建立无规则间断自然数序列与连续自然数序列间一一对应关系的方法.pdf	http://sso.cdclib.org/interlibSSO/goto/6/=06190596Z93/kcms/detail/detail.aspx?dbCode=cjfq&filename=RJSJ199512007&dbname=CJFD9498
Visual Basic使用技巧小集锦	软件世界	1995	1995年12期	【作者】 周乐 ； 【机构】 南开大学 ；	数据库应用程序 ； 数据库系统 ； Foxpro ； ODBC ； 编程效率 ； Visual Basic ； Paradox ； 字符型 ； 数据操作 ； 列表框 ；	<正> Visual Basic for Windows(VB)以其高效的编程效率获得了广泛的应用,笔者在使用VB过程中总结若干使用技巧和VB中一些细节汇成此文,与大家共享。 1.防止“invalid use of null”错误 VB能和Access、Foxpro、Paradox相配合编制界面漂亮的数据库应用程序。利用ODBC还能连接大型数据库系统如SQL Server等。在具体应用过程中笔者发现一个令人头疼的问题:当对数据库添加一个新记	1995年12期_Visual+Basic使用技巧小集锦.pdf	http://sso.cdclib.org/interlibSSO/goto/6/=06190596Z93/kcms/detail/detail.aspx?dbCode=cjfq&filename=RJSJ199512008&dbname=CJFD9498
几种商业图形的实现方法	软件世界	1995	1995年12期	【作者】 邓国民 ； 【机构】 大连财贸职工学院 ；	图形的 ； 数据组 ； 事务处理 ； 文件格式 ； BASIC ； 可扩充性 ； 程序说明 ； 顺序文件 ； 整理数据 ； 执行顺序 ；	<正> 本文以BASIC语言为例,详细阐述了几种商业图形的实现方法。商业图形是指对事务处理过程中产生的数据组,采用比较的方法,阐述数据间关系的图形。这种图形能够使人们更直观地,看出数据组所表示的数据间的变化,发展和数量比较关系。常见的商业图形有:直方图,比例分割圆图,分组曲线图以及分组直方图。在BASIC语言环境下这些图形既能在显示器上显示,也能在打印机或绘图仪上输出。 1.基本方法	1995年12期_几种商业图形的实现方法.pdf	http://sso.cdclib.org/interlibSSO/goto/6/=06190596Z93/kcms/detail/detail.aspx?dbCode=cjfq&filename=RJSJ199512009&dbname=CJFD9498
移花接木——让中文版Word 5.0在西文Windows 3.1下运行	软件世界	1995	1995年12期	【作者】 罗辉 ； 【机构】 湖南省双峰工商银行 ；	Windows 3.1 ； Word 5.0 ； 汉字输入 ； 图形用户界面 ； 字处理软件 ； 外挂式 ； WINDOWS ； 应用程序 ； 对象链接和嵌入 ； 程序管理 ；	<正> Word for Windows 5.0中文版是窗口环境下最佳的汉字字处理软件,它秉承了窗口友好的图形用户界面,并让您轻易地处理文字、图像及数据,做出各种图文并茂的文件。但是,Word for Windows 5.0中文版是基于从内核进行双字节汉化的中文Windows 3.1开发的,只能在中文版Windows 3.1下进行安装,如果在西文Windows 3.1下安装该软件,将引起系统崩溃,直接退出到DOS状态。而中文Windows 3.1系统本身的汉字输入和加工能力较弱,较之中文之星2.0、四通利方4.01等国人开发的外挂式Windows汉化环境,尚有明显的差距。虽然也可让外挂式汉化环境直接挂接到中文版Windows 3.1上,但两种汉字处理方式同时存	1995年12期_移花接木——让中文版Word+5.0在西文Windows+3.1下运行.pdf	http://sso.cdclib.org/interlibSSO/goto/6/=06190596Z93/kcms/detail/detail.aspx?dbCode=cjfq&filename=RJSJ199512010&dbname=CJFD9498
美国BYTE杂志读者评选的1995年最佳软件产品	软件世界	1995	1995年12期		软件产品 ； BYTE ； 系列机 ； Pentium ； 杂志读者 ； Lotus ； 计算机公司 ； Perfect ； 硬件产品 ； 服务器软件 ；	美国BYTE杂志近期公布了其读者投票评选的软件产品,选出的本年度最佳硬件产品是Apple计算机公司的Power MAC系列机,其次是HP公司LaserJet 4Si、英特尔公司的(tie)Pentium和IBM的Think Pad系列机;最佳软件产品是IBM的OS/2Warp,其次是微软件公司的Office和windows NT。下面将读者评选出的其他最佳软件产品刊登于后。	1995年12期_美国BYTE杂志读者评选的1995年最佳软件产品.pdf	http://sso.cdclib.org/interlibSSO/goto/6/=06190596Z93/kcms/detail/detail.aspx?dbCode=cjfq&filename=RJSJ199512011&dbname=CJFD9498
NOVELL嵌入系统技术(NEST)——连接智能设备与信息高速公路的桥梁	软件世界	1995	1995年12期	【作者】 徐洲 ；	嵌入系统 ； NEST ； NOVELL ； 应用程序 ； 服务代理 ； 驱动程序 ； 体系结构 ； Novell ； 服务层 ； 目录服务 ；	<正> 在80年代微机革命的推动下,Novell开发了局域网(LAN)操作系统满足微机用户共享信息和外设的需要,LAN还使用户能够用电子邮件等应用程序进行通信。随着LAN用户数量的增加、储存在LAN中的信息量也不断增大,出现了专用的服务器来集中控制数据、外围设备、应用程序和其它资源。LAN在90年代继续发展,进入了包括微机、工作站、大型机和小型机的多种机环境。涉及到多种平台和LAN设备的互连。LAN还扩展为广域网(WAN),在校园、城市、国家乃至五大洲间搭起桥梁。智能设备则在90年代突飞猛进,占尽风光。嵌入式微处理器和相应的操作系统以及应用软件	1995年12期_NOVELL嵌入系统技术(NEST)——连接智能设备与信息高速公路的桥梁.pdf	http://sso.cdclib.org/interlibSSO/goto/6/=06190596Z93/kcms/detail/detail.aspx?dbCode=cjfq&filename=RJSJ199512012&dbname=CJFD9498
Powersoft的最新套装产品Portfolio	软件世界	1995	1995年12期	【作者】 朱新宇 ；	套装产品 ； Portfolio ； Powersoft ； PowerBuilder ； 数据库管理 ； 逆向工程 ； 服务器应用 ； 服务器产品 ； desktop ； 参照完整性 ；	<正> Powersoft Portfolio是第一个支持工作组应用开发的套装客户/服务器产品。作为一个集成的套装开发工具,Portfolio首先为用户提供了用于构造高性能数据库的Star—Designor,然后可以使用PowerBuilder desktop创建一个强大的客户/服务器应用。最后,使用一个三用户版本Watcom SQL Server在工作组环境中提交应用。 一、StarDesignor StarDesignor提供创建,维护,逆向工程和为数据	1995年12期_Powersoft的最新套装产品Portfolio.pdf	http://sso.cdclib.org/interlibSSO/goto/6/=06190596Z93/kcms/detail/detail.aspx?dbCode=cjfq&filename=RJSJ199512013&dbname=CJFD9498
桌面中文排版软件——Adobe PageMaker 5.0C for Windows	软件世界	1995	1995年12期	【作者】 段建萍 ；	排版软件 ； 控制板 ； 四色印刷 ； 主页面 ； 汉仪 ； 色样 ； 现代数字技术 ； 制作流程 ； 文本编辑器 ； 尽情发挥 ；	<正> PageMaker自面世以来,即深受用户的爱戴,并且被广泛采用。PageMaker 5.0C是PC平台上首屈一指的排版软件。 它提供各式各样的设计及排版功能,包括使用控制板输入数值来置入图形并调整其大小、0.01度逐级增量旋转文字和图形、还有内建式四色印刷分色功能。不规则绕图、版面创意不再受限。先进的文字格式控制	1995年12期_桌面中文排版软件——Adobe+PageMaker+5.0C+for+Windows.pdf	http://sso.cdclib.org/interlibSSO/goto/6/=06190596Z93/kcms/detail/detail.aspx?dbCode=cjfq&filename=RJSJ199512014&dbname=CJFD9498
MICROTEK新图像扫描软件ScanWizard	软件世界	1995	1995年12期	【作者】 周荣正 ；	图像扫描 ； MICROTEK ； ScanWizard ； 驱动程序 ； 平台式 ； 高分辨率图像 ； 色彩平衡 ； 色彩校正 ； 扫描图像 ； CMYK ；	<正> 随着彩印印前系统和各类应用软件的蓬勃发展,平台式扫描仪的使用日趋广泛。MICROTEK公司新推出了新一代图像扫描软件ScanWizard。 每一台扫描仪均附有TWAIN标准扫描驱动程序,而该程序设计的好坏,直接影响到用户的使用程度,ScanWizard是图像扫描仪所附的TWAIN标准扫描驱动程序,具备了用户的各种使用环境及各种功能选项,最大限度地满足用户要求。其特点是:	1995年12期_MICROTEK新图像扫描软件ScanWizard.pdf	http://sso.cdclib.org/interlibSSO/goto/6/=06190596Z93/kcms/detail/detail.aspx?dbCode=cjfq&filename=RJSJ199512015&dbname=CJFD9498
一种便捷的图形绘制软件——VISIO	软件世界	1995	1995年12期	【作者】 蔡越江 ； 蔡越红 ；	VISIO ； 图形绘制 ； WINDOWS ； 画样 ； 图文混排 ； 绘图功能 ； 程序框图 ； WORD ； 弹出式菜单 ； 文件格式 ；	<正> VISIO是基于WINDOWS环境的图形绘制软件,主要用于规则图形的绘制,尤其擅长图文混排,如各种纲要图、示意图、程序框图、流程同等。特别是VISION 3.0版,为各类专业人员绘制专业图形新增了专业画样(stencil),使用户可以准确而快捷地绘制专业图形。 VISIO的绘图功能相当完备,它与WINDOWS下的其它图形图像软件不同的是将常用的图形制成标准图组(master shape),归类成94种画样,供用户选择使用。用VISIO生成的图文可以和WORD等WIN-	1995年12期_一种便捷的图形绘制软件——VISIO.pdf	http://sso.cdclib.org/interlibSSO/goto/6/=06190596Z93/kcms/detail/detail.aspx?dbCode=cjfq&filename=RJSJ199512016&dbname=CJFD9498
希望表格系统——UCTAB	软件世界	1995	1995年12期	【作者】 王春波 ；	表格设计 ； UCTAB ； 应用软件产品 ； 希望集团 ； 设计过程 ； 计算机专家 ； 数据库研究 ； 二维表 ； 定义表 ； 面向对象 ；	<正> 表格是我们日常工作中不可或缺的信息载体,随着信息时代的到来,利用计算机来处理表格无疑会极大提高人们的工作效率。然而,人们到底是如何使用表格,表格软件如何帮助我们实现对表格的各种操作等,一直是计算机专家们研究的主要课题之一。希望集团开展了表格软件的设计与开发,推出了第一个应用软件产品——希望表格系统UCTAB 2.0,UCTAB的设计思想源自于对传统中国表格应用的深入研究,其实现方法则吸取了流行西文表格软件的优点。	1995年12期_希望表格系统——UCTAB.pdf	http://sso.cdclib.org/interlibSSO/goto/6/=06190596Z93/kcms/detail/detail.aspx?dbCode=cjfq&filename=RJSJ199512017&dbname=CJFD9498
建筑工程设计CAD	软件世界	1995	1995年12期	【作者】 徐守民 ； 【机构】 西安邮电学院 ；	建筑工程设计 ； CAD ； 设计单位 ； 辅助设计系统 ； 建筑结构 ； 设计业 ； 计算机辅助设计 ； 设计绘图 ； 尺寸标注 ； 图形库 ；	<正> 我国的建筑工程业CAD技术出现在80年代,但发展迅速,并且很快形成了两个主要方面,一些经济实力雄厚的大的建设设计单位,引进了国外大型工作站和大型绘图软件进行开发和利用。大多数设计单位则是在微机上开发建筑结构CAD工作。由于微机的价格性能比不断降低,且操作简单,维修方便,因而我国的微机CAD开发极为成功和迅速。目前我国条件较好的一些设计单位,机器出图率,建筑可占20—30％,结构可占60—70％,而计算与分析工作则基本上完全在机器上进行。CAD技术已对我国的建筑工程设计业带来了革命性的变化。	1995年12期_建筑工程设计CAD.pdf	http://sso.cdclib.org/interlibSSO/goto/6/=06190596Z93/kcms/detail/detail.aspx?dbCode=cjfq&filename=RJSJ199512018&dbname=CJFD9498
发展迅猛的安易会计软件	软件世界	1995	1995年12期		会计软件 ； 内部控制方法 ； 会计公司 ； 软件产品 ； 安全控制措施 ； 会计工作 ； 凭证输入 ； 数据处理方法 ； 帐务处理 ； 对帐单 ；	<正> 安易会计软件 是北京安易电脑会计公司的软件产品,该产品自1992年面市,就曾以高起点、高品质令人刮目相看。经过短短几年的长足发展,安易公司及其会计软件产品取得了令人瞩目的成就,受到了管理层、用户、同行及传媒的普遍赞誉。 安易会计软件特点 安易会计软件的最大特点可概括为两句话八个字:“安全可靠,易学易用”。 “安全可靠”是对会计软件的基本要求。会计工作依赖于计算机后,数据处理方法、内部控制方法等发生了变化,因此,在会计软件中设计各种安全控制措施一直是安易会计软件关注的焦点。它包括防止有意无意	1995年12期_发展迅猛的安易会计软件.pdf	http://sso.cdclib.org/interlibSSO/goto/6/=06190596Z93/kcms/detail/detail.aspx?dbCode=cjfq&filename=RJSJ199512019&dbname=CJFD9498
典型多媒体著作工具概述	软件世界	1995	1995年12期	【作者】 陈文博 ； 【机构】 北工大计算机学院 ；	著作工具 ； 多媒体作品 ； 多媒体制作 ； 虚拟现实 ； 复用性 ； 编程工具 ； 编程人员 ； Director ； 工作方式 ； 使用工具 ；	<正> 完成一个多媒体作品(Title),就其使用工具而言,大致可分为两种工作方式。第一种工作方式是使用通用的编程工具,一般常用Visual Basic和Visual C++。通过编程和Windows的OLE机制来实现媒体的合成演示。这种方式制作周期长,复用性差。但当多媒体作品需要与已有的系统(例如后台数据库)或复杂的程序运算(例如交互式可视化、虚拟现实)相联系时,这种方式有其灵活、多变的优势。第二种工作方式是使用专门的多媒体著作工具,完成Title制作,这是最高效而常用的办法,能满足绝大多数的多媒体制作任务,而且非专业的编程人员也可以掌握。	1995年12期_典型多媒体著作工具概述.pdf	http://sso.cdclib.org/interlibSSO/goto/6/=06190596Z93/kcms/detail/detail.aspx?dbCode=cjfq&filename=RJSJ199512020&dbname=CJFD9498
大陆规模盛大的多媒体专业展将于96年举行	软件世界	1995	1995年12期		专业展 ； 媒体展 ； 多媒体产业 ； 多媒体技术 ； 国家经贸委 ； 适逢其时 ； 增值网 ； 北京会议中心 ； 三度空间 ； 媒体新技术 ；	<正> 中国国内规模■大的多媒体专业展览会——’96北京国际多媒体技术与应用展览会,将于1996年4月23日—26日举行。 这是继1994年首届中国多媒体展览会之后举办的第二届规模盛大的专业多媒体展。据悉,国家经贸委以决定,自1996年起,每年在北京举办一次世界性多媒体展会,以推动中国多媒体产业的发展。 ’96北京国际多媒体技术与应用展览会的举行适逢其时。1994年末到1995年初,多媒体市场从南向	1995年12期_大陆规模盛大的多媒体专业展将于96年举行.pdf	http://sso.cdclib.org/interlibSSO/goto/6/=06190596Z93/kcms/detail/detail.aspx?dbCode=cjfq&filename=RJSJ199512021&dbname=CJFD9498
电脑变Hi—Fi——一组多媒体音效指标浅析	软件世界	1995	1995年12期	【作者】 刘焱彬 ；	Fi ； Hi ； 噪音干扰 ； 高速运算 ； 电源供应 ； 标准配备 ； 采购单 ； “多媒体” ； 热门话题 ； 频率范围 ；	<正> 站在消费者的观点来看,去年可以说是电脑界变化相当大的一年:“多媒体”这个过去还相当陌生的名词,现在已成为热门话题;而十六位音效卡,光碟机这些原本只有少数有钱族方能享有的高档品,现在也成了大家的电脑采购单上的标准配备。最乐的当然是诸位玩家——从此摆脱了PC SPEAKER的噪音干扰!奉劝还没有买的朋友,赶快弄一套来吧,不要再折磨自己的耳朵了! 其实,要让电脑发出点音乐并非难事,只是要让你听了会很感动,就不是那么简单了。这也难怪,我们可以看看电脑内部:CPU以高速运算着,各种装置横七竖八地塞在里面,内部电线各行其是,而电源供应部分	1995年12期_电脑变Hi—Fi——一组多媒体音效指标浅析.pdf	http://sso.cdclib.org/interlibSSO/goto/6/=06190596Z93/kcms/detail/detail.aspx?dbCode=cjfq&filename=RJSJ199512022&dbname=CJFD9498
UCDOS5.0系列讲座——第二讲 系统设置与优化(上)	软件世界	1995	1995年12期		SETUP ； 菜单项 ； 显示卡 ； UCDOS5.0 ； 配置文件 ； 纸张宽度 ； 打印输出 ； 主菜单 ； 显示驱动 ； 子菜单 ；	<正> 一、运行SETUP 在DOS提示符下输入SETUP按回车即可。如果在西文环境下运行,SETUP需要用户输入UCDOS目录所在驱动器号,如C、D等,请正确输入。	1995年12期_UCDOS5.0系列讲座——第二讲+系统设置与优化(上).pdf	http://sso.cdclib.org/interlibSSO/goto/6/=06190596Z93/kcms/detail/detail.aspx?dbCode=cjfq&filename=RJSJ199512023&dbname=CJFD9498
英汉对照软件专业时文选读	软件世界	1995	1995年12期	【作者】 剑欣 ；	软件专业 ； 存储密度 ； 存取时间 ； 用户容量 ； 英汉对照 ； 兆字节 ； 激光唱片 ； 活动记录 ； 随机存取 ； erase ；	<正> 光盘作为一种存储技术,现已得到广泛的承认。它坚固、可靠、可更换,加之存储密度使其胜于磁盘。不过,与磁盘相比,光盘的存取时间确实比较慢。在三类光盘中,CD—ROM用得最广泛。CD—ROM在结构上与标准的激光唱片非常相似,并具有大约600兆字节的用户容量。然而,顾名思义,这种光盘只能记录一次,用户不能变更其内容。 WORM光盘广泛应用于需要存档的场合或必须永久保存所有系统活动记录的许多系统中。用户可以	1995年12期_英汉对照软件专业时文选读.pdf	http://sso.cdclib.org/interlibSSO/goto/6/=06190596Z93/kcms/detail/detail.aspx?dbCode=cjfq&filename=RJSJ199512024&dbname=CJFD9498
