title	journal_name	year	issue	author	keywords	summary	pdf_filename	article_url
UNIX/XENIX防备UNIFY数据库密码遗失的方法	软件世界	1994	1994年07期	【作者】 罗升 ； 陈洪森 ；	UNIX ； UNIFY ； 数据库系统 ； 数据安全 ； 关系数据库 ； 数据库实现 ； 企事业单位 ； 存取权限 ； 数据目录 ； 维护功能 ；	<正> UNIFY是当前UNIX/XENIX 操作系统下最受欢迎的关系数据库之一。由于UNIFY数据库系统采用了集单技术;提供了多种重要的实用工具:PRINT.SQL、QBF,RPT、DML、提供与高级语言接口及较完善的数据安全维护功能等。在机关、金融、保验、工矿,商业等企事业单位广泛地投入使用。现就UNIFY数据库系统中数据安全维护可能出现的数	1994年07期_UNIX+XENIX防备UNIFY数据库密码遗失的方法.pdf	http://sso.cdclib.org/interlibSSO/goto/6/=06190596Z93/kcms/detail/detail.aspx?dbCode=cjfq&filename=RJSJ199407011&dbname=CJFD9498
浅谈WPS文件密码的破译和消除	软件世界	1994	1994年07期	【作者】 翟润平 ； 【机构】 中国人民警官大学 ；	WPS ； ASCII ； 功能健 ； 二进制码 ； 编辑状态 ； 加密处理 ； 小写字母 ； 编辑功能 ； 节位 ； 正确用法 ；	<正> 本文根据作者在破译WPS文件的密码时的体会介绍WPS文件密码的设置原理和两种解密方法。1.WPS 文件密码的设置原理WPS 文件密码的设置原理是这样的:一个在WPS方式下建立的文件,一旦为其设置了密码,在存盘操作时,该密码将被存储在该文件的第733～740字节处,并且在存盘操作前,对密码字符作这样的处理,将每一密码字符的8位二进制ASCII码的	1994年07期_浅谈WPS文件密码的破译和消除.pdf	http://sso.cdclib.org/interlibSSO/goto/6/=06190596Z93/kcms/detail/detail.aspx?dbCode=cjfq&filename=RJSJ199407012&dbname=CJFD9498
实现反编译FOXBASE+伪编译程序的一种新方法	软件世界	1994	1994年07期	【作者】 杨洪立 ； 【机构】 秦皇岛市教学仪器站 ；	反编译 ； FOXBASE ； 程序设计者 ； 环境破坏 ； 历史区 ； 任意键 ； STEP ；	<正> 由于工作和研究的需要,许多FOXBASE+程序员和用户希望得到某些实用程序的源程序。但实用程序设计者出于种种原因,往往将FOXBASE+源程序编译成伪编译程序。为了防止反编译,还经常在程序的开始部分将反编译环境破坏掉。致使得到源程序的愿望难以实现,过去曾发表过的反编译方法对此也无能为力,那么,有没有新的方法能使反编译再	1994年07期_实现反编译FOXBASE+伪编译程序的一种新方法.pdf	http://sso.cdclib.org/interlibSSO/goto/6/=06190596Z93/kcms/detail/detail.aspx?dbCode=cjfq&filename=RJSJ199407013&dbname=CJFD9498
FoxBASE中的彩色动画通用清屏子程序	软件世界	1994	1994年07期	【作者】 王太龙 ； 【机构】 包钢炼钢厂 ；	FoxBASE ； 程序设计者 ； 可移植性 ； 信息管理 ； 运行环境 ； 用清 ； 工作兴趣 ； 值参数 ； CASE ； 井公 ；	<正> FoxBASE+已被广泛应用于各行各业的信息管理当中,如何减少操作员的工作强度,提高操作员的工作兴趣是程序设计者应考虑的任务之一。本人设计的《动画清屏子程序》正是基于这一点的考虑。它 有很好的通用性、可移植性和扩充性,在此奉献给广大同行.运行环境:长城286EX/16及其兼容机,FoxBASE+2.0。程序清单如下:	1994年07期_FoxBASE中的彩色动画通用清屏子程序.pdf	http://sso.cdclib.org/interlibSSO/goto/6/=06190596Z93/kcms/detail/detail.aspx?dbCode=cjfq&filename=RJSJ199407014&dbname=CJFD9498
FoxbASE应用中的两个技巧	软件世界	1994	1994年07期	【作者】 张淑艳 ； 【机构】 大连市住宅建筑工程公司 ；	索引文件 ； 数据库文件 ； FoxbASE ； 换页 ； 走纸 ； 初始状态 ；	<正> 1.INDEX和COPY命令的妙用在对数据库文件进行输入或修改完后,往往需要建立索引文件,这样便于查找。但是,当我们打开数据库文件,其排列顺序还是输入或修改时的顺序,这不是我们需要的结果。因此为了达到目的,我们则需在打开数据库文件的同时,又要打开其索引文件,这样做既浪费时间又浪费空间,本人在实践中,发现使用INDEX和COPY命令能够很好地解决这一问	1994年07期_FoxbASE应用中的两个技巧.pdf	http://sso.cdclib.org/interlibSSO/goto/6/=06190596Z93/kcms/detail/detail.aspx?dbCode=cjfq&filename=RJSJ199407015&dbname=CJFD9498
CMOS探秘	软件世界	1994	1994年07期	【作者】 肖丹 ； 【机构】 太极公司 ；	读写操作 ； 硬件资源 ； 校验和 ； 内存大小 ； 单元的 ； 系统时钟 ； 存中 ； 时间值 ；	<正> 众所周知,PC机主板上的CMOS对整个机器的硬件资源进行设置。许多BIOS功能调用,如INT13H等都是通过读取CMOS来获得有关参数。它也可以修改。CMOS通常有64字节,读写时先要向地址口70H送入一个字节单元地址,然后对数据口71H进行I/O操作,其中每一步都要延时,这样就完成了对CMOS中某一单元的读写操作。	1994年07期_CMOS探秘.pdf	http://sso.cdclib.org/interlibSSO/goto/6/=06190596Z93/kcms/detail/detail.aspx?dbCode=cjfq&filename=RJSJ199407016&dbname=CJFD9498
读者信箱	软件世界	1994	1994年07期		数据库管理系统 ； 信息管理系统 ； ORACLE ； 读者信箱 ； UNIX ； 软件配置 ； oracle ； 应用软件 ； 计算机教学 ； 最佳配置 ；	<正> dBASE下开发的数据库如何移植到ORACLE下?以前不少微机用户用dBASE编程建立了自己的数据库信息管理系统,现因业务量扩大并添置了工作站UNIX小型机等设备,并想选用Oracle等大型数据库管理系统。现有不少读者询问,以前在dBASE下所作的开发工作和通过大量录入建立的数	1994年07期_读者信箱.pdf	http://sso.cdclib.org/interlibSSO/goto/6/=06190596Z93/kcms/detail/detail.aspx?dbCode=cjfq&filename=RJSJ199407017&dbname=CJFD9498
三种集成办公软件评述	软件世界	1994	1994年07期	【作者】 刘楠 ； 杨松 ；	软件功能 ； 应用软件 ； Lotus ； Borland ； 电子表格软件 ； 数据库管理软件 ； 用户界面 ； 信息管理软件 ； 通信软件 ； Notes ；	<正> 前言现在,集成化的办公应用软件十分风行。根据Dataquest公司最近的调查.Microsoft公司的Office办公软件销售量最大,1993年它在全球的销售额高达76200万美元。另外,Lotus公司的办公软件的销售额为6800万美元,Borland公司的办公软件的销售额为1400万美元。虽然这三家公司的销售额相差较大,但其增长率都在200％以上。办公软件,起初	1994年07期_三种集成办公软件评述.pdf	http://sso.cdclib.org/interlibSSO/goto/6/=06190596Z93/kcms/detail/detail.aspx?dbCode=cjfq&filename=RJSJ199407018&dbname=CJFD9498
Windows NT的特点与适用对象	软件世界	1994	1994年07期	【作者】 陈幼松 ；	工作组计算 ； 处理器技术 ； 信息系统 ； Windows NT ； 上型 ； 徽处理器 ； 应用程序 ； 安全保密性 ； 个人机 ； 多处理器 ；	<正> 随着微处理器高速化和多处理器技术的发展,新一代操作系统在1993年应运而生,而Windows NT是其中的佼佼者。NT主要是作为桌上型机的操作系统开发的。但也可以在企业级信息系统中使用。一、NT的新技术NT的目标是要扩大它作为操作系统所能覆盖的领域,进入以下各种计算环境:(1)桌上型计算环境(基本应用);(2)工作组计算环境(Windows for Workgroups功能);(3)服务器、连网(LAN Manager	1994年07期_Windows+NT的特点与适用对象.pdf	http://sso.cdclib.org/interlibSSO/goto/6/=06190596Z93/kcms/detail/detail.aspx?dbCode=cjfq&filename=RJSJ199407019&dbname=CJFD9498
文字处理软件WPS与WS的应用比较	软件世界	1994	1994年07期	【作者】 赵榕生 ；	文字处理软件 ； WPS ； WS ； 编辑软件 ； 打印输出 ； 字处理 ； 编辑功能 ； 上下标 ； 汉化版 ； 空心字 ；	<正> WS是微机系统较早应用的文字处理软件,是西文编辑软件的汉化版本。它为用户提供了丰富的全屏幕编辑功能以及四种字型的打印输出功能,满足了文字处理的基本需要,并以其简单易学、操作方便得以广泛流行。WPS则是近几年来逐步流行的字处理系统,它针对汉字处理而开发,避免了WS在汉字处理方面的缺陷如出现半个汉字、乱字符、打印机死机等,同	1994年07期_文字处理软件WPS与WS的应用比较.pdf	http://sso.cdclib.org/interlibSSO/goto/6/=06190596Z93/kcms/detail/detail.aspx?dbCode=cjfq&filename=RJSJ199407020&dbname=CJFD9498
“神图”访谈录——一种全新的软件开发环境介绍	软件世界	1994	1994年07期		软件开发环境 ； 软件危机 ； 程序设计语言 ； 获奖产品 ； 程序语言 ； 软交会 ； 专家评价 ； 编译系统 ； 软件系统 ； 面向对象方法 ；	4月1日至6日,在北京举行的′94全国第五届“软交会”上。从200多家送展的软件产品中评选出21项金奖。武汉远望技术研究所研制的神图C-DATA(C/C++)获此殊荣。有专家评价:以神图C-DATA(C/C++)为代表的神图软件开发方式将会对传统的文本程序设计方式产生重大影响。近来,各报均以较大篇幅报道了神图软件及有关获奖产品,许多人士对神图软件给予了极大关注,他们有一个共同的愿望:希望对神图软件有较详尽的了解。怀着浓厚的兴趣,我们采访了神图软件的主要研制者梁先忠先生。	1994年07期_“神图”访谈录——一种全新的软件开发环境介绍.pdf	http://sso.cdclib.org/interlibSSO/goto/6/=06190596Z93/kcms/detail/detail.aspx?dbCode=cjfq&filename=RJSJ199407021&dbname=CJFD9498
中文大师——中文Windows的好伴侣	软件世界	1994	1994年07期		操作环境 ； 应用软件 ； 文字库 ； 市场潜力 ； 文字词 ； 应用环境 ； 自动抽取 ； 变形效果 ； 普通应用 ； 校正功能 ；	<正> 1.中文Windows平台及其存在的问题微软公司的Windows正在成为PC机的主流操作环境,受到越来越多的用户喜爱,中国现有PC微机上百万台,具有极大市场潜力,所以,中文Windows是中国用户经常关心的问题。在微软公司推出简体中文Windows(PWindows)之前,国内已有多家公司开发了基于西文Windows之上的汉化Windows平台,如中文之星、长青窗、双桥视窗等,它们不改变西文Windows的内	1994年07期_中文大师——中文Windows的好伴侣.pdf	http://sso.cdclib.org/interlibSSO/goto/6/=06190596Z93/kcms/detail/detail.aspx?dbCode=cjfq&filename=RJSJ199407022&dbname=CJFD9498
我们欢迎怎样的汉字系统	软件世界	1994	1994年07期	【作者】 何管略 ； 【机构】 广东汕头金山中学 ；	输入方法 ； 普及和提高 ； 内存空间 ； 五笔字型 ； 硬盘空间 ； 程序管理 ； 常规内存 ； 矢量字库 ； 模拟显示 ； 专用程序 ；	<正> 随着电脑的普及和提高,汉字系统也不断推陈出新,呈现百花齐放、百家争鸣的大好局面。在众多版本的汉字系统中,怎样的汉字系统,才会受到用户的欢迎呢?这是一个值得大家探讨的问题。现提出我们的看法:1.汉字输入方面(1)对于汉字的输入方法,要一专多能。即备有多种不同类型的输入方法,提供用户选择。其中尽可能优选一种最好的输入方法,作为本系统的一个特色,予以突出,起到“锦上添花”的作用。	1994年07期_我们欢迎怎样的汉字系统.pdf	http://sso.cdclib.org/interlibSSO/goto/6/=06190596Z93/kcms/detail/detail.aspx?dbCode=cjfq&filename=RJSJ199407023&dbname=CJFD9498
1993年高级程序员级部分下午试题分析	软件世界	1994	1994年07期		存储单元 ； 程序说明 ； 递归调用 ； 试题分析 ； 必答题 ； 通用寄存器 ； 和式 ； 非递归 ； 算法思想 ； 递归算法 ；	<正> 试题6[必答题] 在COMET型计算机上可以使用试卷上所附的CASL汇编语言。阅读下列说明和CASL程序,把应填入其中(?)处的字句,写在答卷的对应栏内。[程序说明]子程序MOVE是将地址为A开始的N个存储单元移到地址为B开始的N个存储单元中,对于两个区域互相重叠的情况也能正确处理。主程序在GRl中给出存放子程序所需要参数	1994年07期_1993年高级程序员级部分下午试题分析.pdf	http://sso.cdclib.org/interlibSSO/goto/6/=06190596Z93/kcms/detail/detail.aspx?dbCode=cjfq&filename=RJSJ199407024&dbname=CJFD9498
第一讲 FoxPro2.5的特点及安装与配置	软件世界	1994	1994年07期	【作者】 傅淑堂 ；	FoxPro ； 桌面数据库 ； 单系统 ； 管理系统 ； 扩展功能 ； 应用程序 ； 关系型 ； 数据输入 ； 开发环境 ； Foxpro ；	从本期起我们安排Microsoft FoxPro 2.5讲座。FoxPro是Microsoft公司推出的关系型桌面数据库管理系统,具有卓越的功能与性能,在我国已有大量用户。为此,我们特请对FoxPro 2.5使用具有丰富实践经验的傅淑堂同志撰写了此讲座。本讲座不同于一般的知识介绍,是完全从使用角度讲解,融入了作者本人的丰富使用经验,因此具有高度的实用性。本讲座初步安排9讲,每期两讲。具体是:第一讲FoxPro 2.5的特点及安装与配置;第二讲 使用FoxPro 2.5菜单生成器构造莱单系统;第三讲 使用FoxPro 2.5屏幕生成器构造数据输入/输出屏幕;第四讲 使用FoxPro 2.5报表生成器生成报表;第五讲 使用FoxPro 2.5内嵌SQL语言及RQBE工具;第六讲 使用FoxPro 2.5项目管理器构造项目和发布应用程序;第七讲 FoxPro 2.5开放功能——FoxPro 2.5连接工具的使用;第八讲 FoxPro 2.5扩展功能——FoxPro 2.5库构造工具的使用;第九讲 不同网络环境中FoxPro 2.5的使用。读者对本讲座如有什么要求,可及时与本编辑部联系,以便改进,也欢迎读者为本刊推荐实用性强的技术(产品)讲座。	1994年07期_第一讲+FoxPro2.5的特点及安装与配置.pdf	http://sso.cdclib.org/interlibSSO/goto/6/=06190596Z93/kcms/detail/detail.aspx?dbCode=cjfq&filename=RJSJ199407025&dbname=CJFD9498
第二讲 使用FoxPro 2.5菜单生成器构造菜单系统	软件世界	1994	1994年07期	【作者】 傅淑堂 ；	FoxPro 2.5 ； 菜单设计 ； 单选钮 ； 编程设计 ； 命令窗口 ； 菜单条 ； Foxpro ； 热键 ； 子菜单 ； 弹出菜单 ；	<正> 使用Microsoft FoxPro 2.5的菜单生成器,可以按照用户意图,自动生成满足要求的菜单系统。其好处是使复杂的菜单编程设计工作变成直观的、非编程的自然设计,提高了开发效率和质量。创建一个新的菜单系统,可以从File菜单中选择New…,再选Menu单选钮,再选New按钮。也可以在命令窗口中键入命令来创建,如:CREATE MENU mymenu	1994年07期_第二讲+使用FoxPro+2.5菜单生成器构造菜单系统.pdf	http://sso.cdclib.org/interlibSSO/goto/6/=06190596Z93/kcms/detail/detail.aspx?dbCode=cjfq&filename=RJSJ199407026&dbname=CJFD9498
英汉对照软件专业时文选读	软件世界	1994	1994年07期	【作者】 剑欣 ；	软件专业 ； 改善软件 ； CASE ； 工程方法 ； 软件开发 ； 软件工具 ； 英汉对照 ； 面向对象的 ； 面向对象方法 ； 应用软件 ；	<正> 对象技术与计算机辅助软件工程计算机辅助软件工程(以CASE)有希望改善软件质量,提高软件开发的速度和可预测性,并使维护更为方便.对象技术具有许多与CASE相同的潜在好处。因此,它会取代CASE吗?按照广义的定义,CASE是一种在软件工具辅助下制造软件的规范的工程方法。大多数CASE定义都包括使用某种方法学、某种处理过程和各种工	1994年07期_英汉对照软件专业时文选读.pdf	http://sso.cdclib.org/interlibSSO/goto/6/=06190596Z93/kcms/detail/detail.aspx?dbCode=cjfq&filename=RJSJ199407027&dbname=CJFD9498
第六批自由软件部分清单及简介	软件世界	1994	1994年07期		北京图书馆 ； 低密 ； 小样文件 ； 电子出版系统 ； 万达 ； 系统演示 ； 华光 ； 数据库开发工具 ； 自然段落 ； 中洲 ；	<正> 上述自由软件均不加密,工本费中已包括邮寄费;不需邮寄者,高密盘每张10元,低密盘每张6元;自带软盘拷贝者每张软盘(不分高低密)收取2元拷盘费。需自由软件者应先入网,入网和拷贝、购买自由软件请与自由软件联谊网业务部联系,详细地址是:北京白石桥路48号南楼南门208号(320路北京图书馆站路东),邮码:100081,电话:8355351,联系人:王君小姐。	1994年07期_第六批自由软件部分清单及简介.pdf	http://sso.cdclib.org/interlibSSO/goto/6/=06190596Z93/kcms/detail/detail.aspx?dbCode=cjfq&filename=RJSJ199407028&dbname=CJFD9498
出版软件	软件世界	1994	1994年07期		电子排版系统 ； 参数化绘图 ； 出版专业 ； 电子器材 ； 供销合同 ； 图形卡 ； 尺寸标注 ； 时间序列 ； 系列产品 ； 激光印字机 ；	<正> 新歌王科印歌片排版系统(电子工业版)5英寸高密盘12片 定价:998元本软件是用于排版歌片的简谱电子排版系统,可以排出十分规范美观的乐谱。本软件具有以下功能特征:1.界面友好,功能完备,操作简单,易学易用。2.具有批命令排版和交互式直观修改简谱的功能。3.一般用户可直接输出到各种24针打印机,有	1994年07期_出版软件.pdf	http://sso.cdclib.org/interlibSSO/goto/6/=06190596Z93/kcms/detail/detail.aspx?dbCode=cjfq&filename=RJSJ199407029&dbname=CJFD9498
计算机软件著作权登记公告	软件世界	1994	1994年07期	【机构】 中华人民共和国电子工业部计算机软件登记办公室 ；	软件名称 ； 中国软件 ； 分类号 ； 批准日期 ； 登记公告 ； 著作权人 ； 首次发表 ； 文字编排 ； 自动化研究所 ； 登记号 ；	<正> 登记号 940071分类号 61500-0000软件名称及 方正Super文字编排系版本号 统WPS NT[简称:WPS NT]V1.0著作权人 珠海市金山电脑有限公司及其国籍 中国软件首次发表 1993年6月30日日期及地点 中国北京市软件零售(报)价 人民币800元/套登记批准日期 1994年4月8日登记号 940072分类号 61500-0000软件名称及 方正Super特大字打印版本号 系统PHZ NT[简称:	1994年07期_计算机软件著作权登记公告.pdf	http://sso.cdclib.org/interlibSSO/goto/6/=06190596Z93/kcms/detail/detail.aspx?dbCode=cjfq&filename=RJSJ199407030&dbname=CJFD9498
信息之窗	软件世界	1994	1994年07期		杨芙清 ； 软件产品 ； 信息之窗 ； 中国科学院院士 ； 吴克忠 ； 姓氏笔划 ； 电子工业部 ； 黄晓明 ； 抽象机 ； 信息化推进 ；	<正> 中国软件行业协会推荐国内优秀软件产品活动领导小组成员组长:杨天行 教授 电子工业部计算机与信息化推进司司长成员:胡贻志 许孔时 杨芙清 黄晓明 孙元鸿 梁祥来 陈冲 朱鹏举 胡昆山专家委员会成员组长:杨芙清 教授 中国科学院院士 北京大学计算机系主任 中国软件行业协会副理事长成员(按姓氏笔划排序):方天培 石云程 刘邦君 朱鹏举 杨友麒 吴克忠 张学孝 郑人杰 金茂忠 候业勤	1994年07期_信息之窗.pdf	http://sso.cdclib.org/interlibSSO/goto/6/=06190596Z93/kcms/detail/detail.aspx?dbCode=cjfq&filename=RJSJ199407031&dbname=CJFD9498
产品长廊	软件世界	1994	1994年07期		宏单元 ； 电路单元 ； 编译工具 ； 软件设计 ； 逻辑综合 ； 图像转换 ； 内部软件 ； 彩色图像 ； 数据文件格式 ； 菜单条 ；	<正>美国compass Design Automation Inc.的集成电设计软件Compass/VTI源于IC厂家的软件设计系统，给ASIC设计师提供了先进的逻辑综合与编译工具。Compass是以它的各种各样的库为基础的，每一个电路单元包括宏单元都已经成功地使用在工	1994年07期_产品长廊.pdf	http://sso.cdclib.org/interlibSSO/goto/6/=06190596Z93/kcms/detail/detail.aspx?dbCode=cjfq&filename=RJSJ199407032&dbname=CJFD9498
软件商情一览表	软件世界	1994	1994年07期		软件商 ；	软件商情一览表软件商情一览表	1994年07期_软件商情一览表.pdf	http://sso.cdclib.org/interlibSSO/goto/6/=06190596Z93/kcms/detail/detail.aspx?dbCode=cjfq&filename=RJSJ199407033&dbname=CJFD9498
企业动态	软件世界	1994	1994年07期		企业动态 ； 网络产品 ； 发展策略 ； 网络系统 ； 媒体网络 ；	<正>最近mM网络系统总经理Willam H.Comlin先生来华，就IBM网络发展史、网络发展策略、90年代到下一世纪的网络蓝图、多媒体网络发展策略和应用作了详细的介绍，并强调指出IBM网络产品在全球市场所占有的重要地位(年营业额达50亿美	1994年07期_企业动态.pdf	http://sso.cdclib.org/interlibSSO/goto/6/=06190596Z93/kcms/detail/detail.aspx?dbCode=cjfq&filename=RJSJ199407034&dbname=CJFD9498
我国微机LAN的现状与发展	软件世界	1994	1994年06期	【作者】 张知行 ；	LAN ； 网络技术 ； 网络互连 ； 数据交换网 ； 通信技术 ； 本地网络 ； 中小型机 ； 网络状态 ； 网络线路 ； 计算机应用 ；	<正> 微机技术与通信技术的紧密结合产生的微机LAN网络技术,是当今世界发展最盛的网络技术,由此人们认为:“80年代是PC机时代,90年代是计算机网络时代”。 随着计算机应用的普及与提高,我国微机LAN也呈现蓬勃发展的势头。据几个城市微机LAN现状的初步调查和分析,探讨了LAN的发展趋势。 一、我国微机LAN的基本情况 微机LAN功能强,应用广泛,市场发展迅速,其根本原因在于: 1.LAN系统是在用户原有微机的基础上,通过	1994年06期_我国微机LAN的现状与发展.pdf	http://sso.cdclib.org/interlibSSO/goto/6/=06190596Z93/kcms/detail/detail.aspx?dbCode=cjfq&filename=RJSJ199406000&dbname=CJFD9498
管理信息系统的逻辑设计	软件世界	1994	1994年06期	【作者】 孙海波 ； 【机构】 机电部第二十八所 ；	管理信息系统 ； 现行系统 ； 逻辑模型 ； 数据种类 ； 目标系统 ； 软件开发过程 ； 信息管理 ； 内聚度 ； 调用关系 ； 管理现代化 ；	<正> 建立大型企业的计算机管理信息系统是一项涉及管理现代化和技术现代化的综合性工作,其规模和复杂程度往往是难以想象的。这就决定了系统的开发工作的复杂性,使得系统分析工作也变得非常困难。系统分析是对现行系统的理解和对目标系统的规划设计,是系统开发的基石。其核心是为目标系统建立合理的逻辑模型,这项工作称之为目标系统的逻辑设计。 一、逻辑设计的目的与方法 1.逻辑设计的目的 逻辑设计的目的是为目标系统建立一个完整的逻辑模型,使之能客观地反映现行系统,并为后续的开发工作在结构上奠定基础。逻辑设计可以理解为	1994年06期_管理信息系统的逻辑设计.pdf	http://sso.cdclib.org/interlibSSO/goto/6/=06190596Z93/kcms/detail/detail.aspx?dbCode=cjfq&filename=RJSJ199406001&dbname=CJFD9498
异种网络系统互联的实现	软件世界	1994	1994年06期	【作者】 刘艺 ； 【机构】 重庆发电厂 ；	开放系统互联 ； 网际协议 ； 传输控制协议 ； UNIX ； 网络系统 ； 产品支持 ； 网络层 ； 地址信息 ； 参考模型 ； 网络技术 ；	<正> 前 言 异种网络系统的互联是目前网络技术发展中急需解决的问题,国际标准化组织(ISO)为实现计算机网络互联制定了开放系统互联标准(OSI),这是一个比较理想的开放系统互联七层参考模型,但现阶段OSI缺乏足够的产品支持。传输控制协议(TCP)和网际协议(IP)简称TCP/IP,在目前是一个“事实上”的网络互联标准协议。TCP/IP经过多年的研究和运用后,已逐步标准化,在世界上得到许多大公司的支持,特别是得到UNIX的支持。本文主要介绍有代表性的UNIX系统与NOVELL网络互联的实现方法,同时介绍相关的网络互联产品,对其它异种系统之间的互联也具有一定的参考价值。	1994年06期_异种网络系统互联的实现.pdf	http://sso.cdclib.org/interlibSSO/goto/6/=06190596Z93/kcms/detail/detail.aspx?dbCode=cjfq&filename=RJSJ199406002&dbname=CJFD9498
中文汇编语言编程	软件世界	1994	1994年06期	【作者】 章继三 ； 【机构】 广州市设计院 ；	汇编语言编程 ； 编译系统 ； 指令集 ； 变址寄存器 ； 汉语表达 ； 确切表达 ； 我在 ； 字串 ； 计数寄存器 ； 可维护性 ；	<正> 笔者几年前因工作需要汉化了Microsoft公司的MASM1.0版,在工作中取得十分好的效果。近两年为了适应286、386指令集,又汉化了一个386ASM编译系统,效果同样很好。由于在程序中能用汉语表达编程意图,使用起来得心应手。这几年我在汉语汇编语言编程的实践中,积累了一些心得,愿供同行们参考。 在汉化了的汇编语言编译系统下编程,所有标识符都可以使用汉字,所以程序员尽可以用最能确切表达自己意思的名字。举例如程序一,是笔者编写的CCDOS词组处理的一个程序。虽然由于篇幅关系,这里没有登出程序全部,但这绝对是一个能通过	1994年06期_中文汇编语言编程.pdf	http://sso.cdclib.org/interlibSSO/goto/6/=06190596Z93/kcms/detail/detail.aspx?dbCode=cjfq&filename=RJSJ199406003&dbname=CJFD9498
