title	journal_name	year	issue	author	keywords	summary	pdf_filename	article_url
出版软件	软件世界	1994	1994年05期		汉字输入 ； 反病毒技术 ； 五笔字型输入法 ； 引导区 ； 系列机 ； 执行文件 ； 病毒克星 ； 中断服务程序 ； 自动提示 ； 学习系统 ；	<正> 计算机反病毒技术(病毒克星7.0版)(电子版)5英寸盘一片 定价:100.00元本软件适用于IBM-PC及兼客机,长城系列机。能诊治主引导区寄生型、引导区寄生型、中断服务程序寄生型病毒以及诊断执行文件寄生型病毒、病毒克星7.0版是1～6版的升级版本,功能更强,使用更方便。 汉字输入练习与测试(电子版)5英寸盘一片 定价:60元 本软件适用于对各种汉字输入(含拼音)进行训练和测试。软件动态显示输入编码是否正确及输入时间等。对输错次数超限(可设定),可自动提示正确码。 本软件界面发好,并配备五笔字型输入法的全	1994年05期_出版软件.pdf	http://sso.cdclib.org/interlibSSO/goto/6/=06190596Z93/kcms/detail/detail.aspx?dbCode=cjfq&filename=RJSJ199405023&dbname=CJFD9498
产品长廊	软件世界	1994	1994年05期		计算机软件技术 ； 智能教学系统 ； 中小学数学 ； 教学策略 ； 学生学习水平 ； 学习过程 ； 用户界面友好 ； 程序分析 ； 可扩充性 ； 逆向分析 ；	<正> HBsoft系列智能教学系统 由河北省计算机软件技术公司研制的这套系统已通过国家教委鉴定正式推向市场。该系统专为中小学生特别设计,具有如下特点:系统性强 围绕国家教委最新教学大纲精心制作的各种教学软件,除针对各知识点不同特点进行不同教学方法外,还重点突出了各知识点间的内在联系,使学生在学习过程中能融会贯通,加强对该科知识的总体认识;智能性高 因人而异、因材施教是该系统的最新特点,系统随时跟踪记录学生学习水平的变化,做出相应的教学策略决策,组织相应的习题,并对学生的回答自动进行诊断及分析;内容丰富 覆盖中小学数学、物	1994年05期_产品长廊.pdf	http://sso.cdclib.org/interlibSSO/goto/6/=06190596Z93/kcms/detail/detail.aspx?dbCode=cjfq&filename=RJSJ199405024&dbname=CJFD9498
计算机软件著作权登记公告	软件世界	1994	1994年05期	【机构】 中华人民共和国电子工业部计算机软件登记办公室 ；	软件名称 ； 中国软件 ； 登记公告 ； 分类号 ； 登记号 ； 本号 ； 控制软件 ； 管理信息 ； 计算技术 ； 计算机软件 ；	中华人民共和国电子工业部计算机软件登记办公室.记,,4001分..一30叫乍0000软件名.及希望权字系统ucD司‘ 胜本号〔简称:ucD旧‘〕v3.。.作权人北京希望电脑公司 及X二中国软件,次发农1993年11月15日 日翔及t点中国北京市软件二(.)价人民币880元,记批盆日翔1994年l月10日软件,次盘.1,93年8月15日 日翔Xt点中国北京市软件,.(报)价人民币80,000元,记批趁B翔1994年1月13日l记号洲002分鑫号一3000~0000软件名称及普通汉字操作系统 皿*号PTD06 〔筒称:PTD司‘]vZ,0.作权人北京希望电.公司 及X二中国软件,次发.1992年1	1994年05期_计算机软件著作权登记公告.pdf	http://sso.cdclib.org/interlibSSO/goto/6/=06190596Z93/kcms/detail/detail.aspx?dbCode=cjfq&filename=RJSJ199405025&dbname=CJFD9498
国内要闻	软件世界	1994	1994年05期		国内要闻 ； 激光照排系统 ； 计算机市场 ； 家用电脑 ； 电子信息 ； 市场销售量 ； 工业控制机 ； 计算机产业 ； 计算机应用 ； 全彩色 ；	<正> 1993年我国电子信息产业稳步发展 1993年,我国计算机市场持续、稳步、大幅度地增长。计算机市场销售额达到284亿元,比上年增长42.5％,是1990年的5倍。出口15.6亿美元,进口14.77亿美元。 1993年我国微机市场销售45万台,比上年增长80％。家用电脑正以世人瞩目的步伐进入寻常百姓家,1993年市场销售量达10万台。 计算机应用产品市场空前兴旺。独具特色的国产汉字激光照排系统几乎占领了国内全部市场,并出口到许多国家和地区。工业控制机、单板机市场成	1994年05期_国内要闻.pdf	http://sso.cdclib.org/interlibSSO/goto/6/=06190596Z93/kcms/detail/detail.aspx?dbCode=cjfq&filename=RJSJ199405026&dbname=CJFD9498
海外信息	软件世界	1994	1994年05期		印度软件 ； 海外信息 ； 产品销售 ； 计算机软件 ； 美国计算机 ； 克林顿政府 ； 通信设备 ； Novell ； 东欧国家 ； 语言版本 ；	<正> 美国政府放宽技术出口控制 克林顿政府已作出美国计算机与通信设备放松向中国和东欧国家出口的新规定,并于4月1日开始生效。今后对于低于100MTOP(每秒百万理论运算)的计算机和通信产品销售可不必办理特许手续,可销售给俄国、中国、越南和东欧的非军事买主。 印度软件出口激增 据印度电子与计算机软件出口促委会统计,1993/94财政年度的头9个月,印度计算机软件出口增长20％。软件与服务出口2.4亿美元,增长27％。美国是印度软件的最大市场,占印度软件出口的50％。 1994年操作系统大战热火朝天 Microsoft Windows的推出引发了各大公司之间	1994年05期_海外信息.pdf	http://sso.cdclib.org/interlibSSO/goto/6/=06190596Z93/kcms/detail/detail.aspx?dbCode=cjfq&filename=RJSJ199405027&dbname=CJFD9498
新型程序设计语言的应用发展	软件世界	1994	1994年04期	【作者】 于功弟 ； 【机构】 西南交通大学 ；	程序设计语言 ； 规格说明 ； 分别编译 ； 程序结构 ； 程序设计思想 ； 多重继承 ； 抽象数据类型 ； 发展前景 ； 大型软件系统 ； 数据抽象 ；	本文介绍程序设计语言的发展,分析几种典型新型语言的功能特点,讨论面向对象程序设计(OOP)的应用,最后探讨程序设计语言的发展前景。	1994年04期_新型程序设计语言的应用发展.pdf	http://sso.cdclib.org/interlibSSO/goto/6/=06190596Z93/kcms/detail/detail.aspx?dbCode=cjfq&filename=RJSJ199404000&dbname=CJFD9498
简便高效的HCP程序设计图法	软件世界	1994	1994年04期	【作者】 张振国 ； 宋传杰 ；	检查和维护 ； HCP ； 图形形式 ； 处理过程 ； 逻辑关系 ； 数据结构 ； 月卜 ； 包含关系 ； 记录密度 ； 标准模板 ；	<正> 程序设计图法是用图形形式表现程序逻辑关系的技法。目前流行的程序设计图法有HIPO(Hierar-chy plus Input Process Output),NS图(Nassi & Sheider-man Chart),SPD(Structured Programming Diagram),PAD(Problem Analysis Diagram Chart)等等。起源早、使用最广泛的是流程图(Flow Chart),它基本上是具体处理过程(怎样做)的图形化。对于一个人独立设计小型简单程序,它是一种容易掌握的方法;但对于多人分工设计大规模复杂程序来说就暴露出许多缺点,人们(尤其是非设计者)很难看懂它所表示的庞大复杂的逻辑关系,给程序检查和维护带来很大困难。为此,日本NTT公司开发了HCP图法(Hierar-	1994年04期_简便高效的HCP程序设计图法.pdf	http://sso.cdclib.org/interlibSSO/goto/6/=06190596Z93/kcms/detail/detail.aspx?dbCode=cjfq&filename=RJSJ199404001&dbname=CJFD9498
在多用户系统上分布式处理的实现	软件世界	1994	1994年04期	【作者】 余坚 ； 【机构】 华侨大学 ；	分布式处理 ； 多用户系统 ； 数据库管理系统 ； 存贮设备 ； 状态表 ； 打印设备 ； 分布式系统 ； 广播式 ； 信息文件 ； 脱机状态 ；	<正> 目前,以资源共享为目的的计算机网络已普遍得到应用。但这些计算机网络多数只有存贮设备,打印设备或信息文件的共享,而以共享处理机为主要目的的分布式处理系统则较少。本人在DIMENSION多用户系统上.对分布式处理进行了一些研究,并以数据库管理系统dBASE Ⅲ为基础,实现了一个分布式处理系统。	1994年04期_在多用户系统上分布式处理的实现.pdf	http://sso.cdclib.org/interlibSSO/goto/6/=06190596Z93/kcms/detail/detail.aspx?dbCode=cjfq&filename=RJSJ199404002&dbname=CJFD9498
Microsoft C6.0应用中的几个问题	软件世界	1994	1994年04期	【作者】 彭树生 ； 【机构】 紫金山天文台 ；	堆栈溢出 ； 外部变量 ； 外部数据 ； 数据变量 ； Microsoft C6.0 ； 指针变量 ； 内部数据 ； 浮点型 ； 存中 ； 输入数据 ；	<正> 在采用Microsoft C 6.0进行编程和应用开发中,遇到几个值得注意的问题,在此作些说明,以供读者参考。 1.外部数据变量和内部数据变量 内部数据变量是指在函数内部被说明的变量,而在函数之外被说明的变量却是外部变量,在编译程序时,把内部数据放在堆栈里,把外部数据放在内存中。这一点在编程时必须注意到,如果把很大的数组或很多变量作为内部数据,在编译时不会出错,但运行时会产生堆栈溢出。因此,应尽量将数据变量作	1994年04期_Microsoft+C6.0应用中的几个问题.pdf	http://sso.cdclib.org/interlibSSO/goto/6/=06190596Z93/kcms/detail/detail.aspx?dbCode=cjfq&filename=RJSJ199404003&dbname=CJFD9498
为高级语言提供音乐功能	软件世界	1994	1994年04期	【作者】 彭长禄 ； 李文萍 ； 【机构】 黑龙江省经济信息中心 ； 黑龙江省经济信息中心 ；	中断服务程序 ； 音乐功能 ； 程序设计语言 ； 功能模块 ； 数据库语言 ； 装入程序 ； 恢复现场 ； 屏幕显示 ； 我爱北京天安门 ； 显示输出 ；	本文介绍通过修改BIOS的INT 10H中断服务程序,来实现使所有高级语言都能演奏音乐的一种方法。	1994年04期_为高级语言提供音乐功能.pdf	http://sso.cdclib.org/interlibSSO/goto/6/=06190596Z93/kcms/detail/detail.aspx?dbCode=cjfq&filename=RJSJ199404004&dbname=CJFD9498
灵活方便的ORACLE通用报表生成工具	软件世界	1994	1994年04期	【作者】 赵保华 ； 李争鸣 ； 樊文波 ； 【机构】 中国科技大学 ； 中国科技大学 ；	ORACLE ； 通用报表 ； 生成工具 ； 数据库系统 ； 报表生成 ； 报表格式 ； 可移植性 ； 表结构 ； 维表 ； 逻辑坐标 ；	<正> ORACLE数据库系统是目前世界上最流行的关系数据库管理系统。它的主要优点是:具有很强的功能;具有大量的有特点的可选工具;以SQL语言为基础,可移植性好、能适应多种硬件环境。在国内,ORACLE数据库的用户也在迅速增加。 但是,ORACLE数据库系统也有不足之处。据美国DATAPRO公司对18家ORACLE用户的调查:用户认为ORACLE数据库不足之处是,ORACLE的报表生成能力差,使用繁琐。在国内,ORACLE也不能适应我国编制报表的习惯和要求。例如,ORACLE报	1994年04期_灵活方便的ORACLE通用报表生成工具.pdf	http://sso.cdclib.org/interlibSSO/goto/6/=06190596Z93/kcms/detail/detail.aspx?dbCode=cjfq&filename=RJSJ199404005&dbname=CJFD9498
内存的种类及使用——兼谈计算机的性能优化	软件世界	1994	1994年04期	【作者】 张敬新 ； 【机构】 大庆采油八厂 ；	内存管理 ； 性能优化 ； 磁盘高速缓存 ； 常规内存 ； 实地址 ； 设备驱动程序 ； 软件设计者 ； 逻辑驱动器 ； 应用程序 ； 内存空间 ；	该文介绍内存的分类、内存的使用及突破640K常规内存的方法技术。	1994年04期_内存的种类及使用——兼谈计算机的性能优化.pdf	http://sso.cdclib.org/interlibSSO/goto/6/=06190596Z93/kcms/detail/detail.aspx?dbCode=cjfq&filename=RJSJ199404006&dbname=CJFD9498
立体动态窗口界面特技程序设计方法	软件世界	1994	1994年04期	【作者】 储久良 ； 【机构】 泰州跃进电器总厂 ；	窗口界面 ； 程序设计方法 ； 应用系统 ； 用户界面 ； 程序设计思想 ； 应用程序 ； 软件系统 ； 调用方式 ； 简易型 ； 处理程序 ；	<正> 对用户来说,一个完整的应用系统窗口设计(用户界面)要有一定规范,即在整个系统中窗口特色要保持相对一致。故有个通用窗口界面对用户来说很重要,而对程序员来说则是个难得的设计助手。下面介绍窗口特技程序设计思想,大家只要将源程序输入到计算机即可在应用程序中带参数直接调用。 1.窗口的类型 在应用系统的设计中经常使用的窗口类型可以大致分为简易型、特艺型;所谓简易型是指直接用单	1994年04期_立体动态窗口界面特技程序设计方法.pdf	http://sso.cdclib.org/interlibSSO/goto/6/=06190596Z93/kcms/detail/detail.aspx?dbCode=cjfq&filename=RJSJ199404007&dbname=CJFD9498
建立窗口软件WINDOWS的程序信息文件(PIF)	软件世界	1994	1994年04期	【作者】 袁光平 ； 【机构】 黄石市大冶钢厂 ；	WINDOWS ； 信息文件 ； PIF ； 批处理文件 ； 任务状态 ； 工作位置 ； 菜单项 ； 选择项 ； 器名 ； Directory ；	<正> 在PC机上运行的软件通常都是单任务状态运行的,特别是在运行一些汉字系统软件时,处在汉字状态下,如果想退出汉字状态,释放出汉字系统所占内存,回到纯西文状态,往往通过汉字系统本身退出汉字系统功能不能释放掉汉字系统占用的全部内	1994年04期_建立窗口软件WINDOWS的程序信息文件(PIF).pdf	http://sso.cdclib.org/interlibSSO/goto/6/=06190596Z93/kcms/detail/detail.aspx?dbCode=cjfq&filename=RJSJ199404008&dbname=CJFD9498
一种在AutoCAD上快速生成各种明细表的方法	软件世界	1994	1994年04期	【作者】 张宏 ； 【机构】 宝鸡桥梁工厂 ；	输入方法 ； 编辑软件 ； 文字编辑 ； 输入速度 ； 绘图功能 ； 编辑方式 ； 点坐标 ； 转换函数 ； 下角 ； 光标定位 ；	<正> 在机械、电气等设计领域中,材料明细表的标注是必不可少的,但在现有的AutoCAD中标注大幅面的汉字存在不少困难,材料明细表、零部件明细表的输入更麻烦;众所周知,WPS、WORSTR等文字编辑系统,以处理汉字速度快,输入方法多样、便于修改等优点而越来越受到人们的青睐。如果用这几种编辑软件完成各种明细表的录入后,调入CAD中,通过CAD的绘图功能加上表格,不仅便于修改,且可	1994年04期_一种在AutoCAD上快速生成各种明细表的方法.pdf	http://sso.cdclib.org/interlibSSO/goto/6/=06190596Z93/kcms/detail/detail.aspx?dbCode=cjfq&filename=RJSJ199404009&dbname=CJFD9498
Foxbase+数据输入时光标控制技术	软件世界	1994	1994年04期	【作者】 李春葆 ； 【机构】 武汉测绘科技大学 ；	数据输入 ； Foxbase ； 输入数据 ； 屏幕编辑 ； 格式文件 ； 控制技术 ；	<正> Foxbase+提供了用于数据全屏幕编辑的屏幕格式文件,该文件由若干条@…say…get语句和read语句组成。使用屏幕格式文件输入数据存在这样的一个缺点:由于read语句激活前面的所有get语句,因而所有输入数据的字段均呈反显状态。在输入时,不能很好地标识当前输入数据的字段。 我们改进了这个问题,采用了do while和docase语句,每次仅激活一个get语句。用户输入数据时,当输完一个字段数据后,便以其它颜色重写刚输入的数据,同时激活下一个输入字段。这种方法使输	1994年04期_Foxbase+数据输入时光标控制技术.pdf	http://sso.cdclib.org/interlibSSO/goto/6/=06190596Z93/kcms/detail/detail.aspx?dbCode=cjfq&filename=RJSJ199404010&dbname=CJFD9498
WPS中若干实用编辑技巧	软件世界	1994	1994年04期	【作者】 陈岗 ； 【机构】 南京师范大学 ；	编辑技巧 ； WPS ； 办公自动化 ； 用户界面 ； 编辑系统 ； 汉字字符 ； 文字编辑 ； 编辑状态 ； 排版系统 ； 汉字代码 ；	<正> WPS编辑系统由于它用户界面良好,正被广泛地使用在办公自动化和文字编辑等领域。用户可以根据对下拉式菜单的选择来完成大部分操作,但有些非常实用的编辑命令菜单上却没有,从而影响了更好地开发和使用WPS的功能,笔者通过大量实践,总结了一些小经验。	1994年04期_WPS中若干实用编辑技巧.pdf	http://sso.cdclib.org/interlibSSO/goto/6/=06190596Z93/kcms/detail/detail.aspx?dbCode=cjfq&filename=RJSJ199404011&dbname=CJFD9498
不知XENIX口令时进入系统的应急办法	软件世界	1994	1994年04期	【作者】 石国忠 ； 石国军 ； 曹桂芳 ；	安装盘 ； 引导盘 ； XENIX ； 具体操作步骤 ； 用户口令 ； 热启动 ；	<正> 在不知XENIX多用户系统超级用户口令情况下,有两种方法可进入该主机系统。一种是用事先建立的应急引导盘;另一种是利用XENIX系统的N1安装盘。具体操作步骤是:第一:先把事先建立的应急引导盘或XENIX系统的N1安装盘放入/dev/fd096驱动器,并合上把柄;第二:启动主机系统(冷、热启动均可);第三:当屏幕上出现“boot:”提示符以	1994年04期_不知XENIX口令时进入系统的应急办法.pdf	http://sso.cdclib.org/interlibSSO/goto/6/=06190596Z93/kcms/detail/detail.aspx?dbCode=cjfq&filename=RJSJ199404012&dbname=CJFD9498
FOXBASE中的一个错误函数	软件世界	1994	1994年04期	【作者】 张开鑫 ； 【机构】 重庆华伟电子设备厂 ；	数据库软件 ； 取整函数 ； FOXBASE ； 使用手册 ；	<正> FOXBASE在我国广为流行,本人也从事过多年的FOXBASE数据库软件编程,但至今才发现它的取整函数INT()是错误的(或者说定义不够准确)。根据FOXBASE+ 2.10使用手册的定义如下: 格式:INT(〈数值表达式〉) 功能:本函数通过截取小数部分而将任何数值表达式转换为整数。	1994年04期_FOXBASE中的一个错误函数.pdf	http://sso.cdclib.org/interlibSSO/goto/6/=06190596Z93/kcms/detail/detail.aspx?dbCode=cjfq&filename=RJSJ199404013&dbname=CJFD9498
Oracle Manufacturing——提高企业竞争力的法宝	软件世界	1994	1994年04期		工作流 ； 主生产计划 ； 物料清单 ； 生产周期 ； 主计划 ； 提高质量 ； 制造业产品 ； oracle ； 工程数据库 ； 子库 ；	<正> 目前,全球性的竞争,已将制造业产品质量、分销、成本、效率推向一个新的境界。管理人员越来越深刻地认识到要提高企业管理水平,提高经济效益,引入ERP(企业资源计划系统)已成为当务之急。这是因为为了迎接全球性的挑战,要做到以下两方面: 1.缩短产品的生产周期,包括开发、制造及销售。 2.提高质量,减少费用及成本。 要实现这样的目标,企业需要充分利用人员、产品、工作流程及技术等主要资源。企业要有国际性的竞争力,需要对工作流程及制造技术作最佳的选择、使用及集成。而以前设计的MRP Ⅱ系统由于缺乏灵	1994年04期_Oracle+Manufacturing——提高企业竞争力的法宝.pdf	http://sso.cdclib.org/interlibSSO/goto/6/=06190596Z93/kcms/detail/detail.aspx?dbCode=cjfq&filename=RJSJ199404014&dbname=CJFD9498
功能强大操作灵巧的苍狼超级通信软件	软件世界	1994	1994年04期	【作者】 刘凤全 ； 【机构】 北京全胜科技开发公司 ；	通信软件 ； 电话线路 ； 远程通信 ； 设备共享 ； 命令控制 ； 重定向 ； 命令格式 ； 命令行 ； 命令处理程序 ； modem ；	<正> 本文介绍的是一种基于DOS系统的微机通信软件。 众所周知,计算机网络具有一系列重要的优点,如设备共享、信息共享、兼容性强、安全可靠等,但其操作繁杂,建网费用高昂,往往使人望而却步。事实上,对于许多用户而言,简单的微机远程通信环境,即:运行通信软件利用调制解调器通过电话线路与远程微机进行通信,是他们最现实可行的选择。目	1994年04期_功能强大操作灵巧的苍狼超级通信软件.pdf	http://sso.cdclib.org/interlibSSO/goto/6/=06190596Z93/kcms/detail/detail.aspx?dbCode=cjfq&filename=RJSJ199404015&dbname=CJFD9498
32位台式操作系统评测	软件世界	1994	1994年04期	【作者】 李卫国 ；	用户接口 ； 文件系统 ； Desktop ； 面向对象的 ； 程序库 ； 互操作性 ； 命令行接口 ； 测试中心 ； Novell ； 文本编辑程序 ；	<正> 本文介绍美国著名的Infoworld测试中心不久前对目前市场上具有代表性的6种32位台式操作系统所进行的综合比较、评测。 参加这次评测的32位台式操作系统包括: IBM公司的OS/2 2.1版 Microsoft公司的Windows NT 3.1版 Next公司的NextStep 3.2版 Santa Cruz Operation公司的SCO Open Desktop 3.0版 SunSoft公司的Solaris 2.1 for x86 Novell公司的Unix Ware Personal Edition 1.0版	1994年04期_32位台式操作系统评测.pdf	http://sso.cdclib.org/interlibSSO/goto/6/=06190596Z93/kcms/detail/detail.aspx?dbCode=cjfq&filename=RJSJ199404016&dbname=CJFD9498
我国计算机软件界的大事——中文平台特别技术委员会介绍	软件世界	1994	1994年04期	【作者】 倪光南 ； 【机构】 联想集团 ；	中文平台 ； 软件界 ； 技术委员会 ； 汉字信息处理 ； 软件开发 ； 软件系统 ； 系统接口 ； 应用程序 ； 接口规范 ； 国家技术监督局 ；	<正> 中文平台特别技术委员会于1993年9月28日宣告成立,这是我国计算机界的一件大事。它对于促进汉字信息处理方面标准和规范的制定,促进计算机的推广应用,形成国内软件开发大联盟和迅速地发展我国的软件产业都有重要的意义。 中文平台技术委员会是全国信息技术标准化技术委员会的一个特别技术委员会,属全国性组织,受电子工业部和国家技术监督局领导。它的宗旨是为了发展中文平台技术,推动中文平台技术标准的制定,发展中国的信息产业,以国际通用的软件系统技术(涉及编码、数据类型、字型、中文排序、输入/输出以及应用程序系统接口等基础技术)为基础进行研究,并	1994年04期_我国计算机软件界的大事——中文平台特别技术委员会介绍.pdf	http://sso.cdclib.org/interlibSSO/goto/6/=06190596Z93/kcms/detail/detail.aspx?dbCode=cjfq&filename=RJSJ199404017&dbname=CJFD9498
WPS for Windows——第二代中文字处理软件	软件世界	1994	1994年04期		文字处理软件 ； 自动化工具 ； 应用软件 ； 计算机应用 ； 文档窗口 ； 输入界面 ； 图文混排 ； 服务程序 ； 程序窗口 ； 汉字显示 ；	<正> 字处理软件是国内用户用得最广泛的应用软件,很多用户正是通过字处理软件的使用接触并熟悉了计算机的应用,在目前国内的计算机应用普及中,字处理软件的使用已被作为主要内容和主要方向。 WPS、Word Star和CCED等通用中文字处理软件已在国内广泛流传,它们容易学习,使用方便,深受用户钟爱,已经成为计算机所必需配备的软件,同时也成了办公自动化工具中的主力军。	1994年04期_WPS+for+Windows——第二代中文字处理软件.pdf	http://sso.cdclib.org/interlibSSO/goto/6/=06190596Z93/kcms/detail/detail.aspx?dbCode=cjfq&filename=RJSJ199404018&dbname=CJFD9498
从零开始,一天学会使用计算机——谈谈天利个人电脑中文系统TLC	软件世界	1994	1994年04期	【作者】 韦学纯 ；	个人电脑 ； TLC ； 汉字输入系统 ； 事务处理 ； 系统菜单 ； 处理日常事务 ； 从零开始 ； 日志管理 ； 全文检索 ； 底层软件 ；	<正> 只要花上一天半天时间,不必死记硬背,就可以使用计算机,潇潇洒洒地在计算机上用汉字写文章、处理日常事务,这决不是奢谈。本文介绍的天利个人电脑中文系统(TianLi PC Chinese system以下简称TLC)就是这样的系统。该系统以天利汉字输入系统(TianLi CCDOS以下简称TLS)为基础,集中目前最优秀的几十种实用软件,整个系统可以分为文稿处理、事务处理、信息大全、磁盘文件、学习游戏、全文检索、电脑工具、DOS环境等八大门类,对于一般的	1994年04期_从零开始,一天学会使用计算机——谈谈天利个人电脑中文系统TLC.pdf	http://sso.cdclib.org/interlibSSO/goto/6/=06190596Z93/kcms/detail/detail.aspx?dbCode=cjfq&filename=RJSJ199404019&dbname=CJFD9498
微软公司未来的主要产品和技术发展	软件世界	1994	1994年04期		应用程序 ； 技术发展 ； 分析者 ； 用户界面 ； 徽处理器 ； 程序管理 ； 盖茨 ； 升级系统 ； 测试过程 ； 外壳程序 ；	微软公司总裁比尔·盖茨1993年7月29日在微软公司的年度财政分析者会议上作了关于公司主要产品与技术发展工作的演讲,本文是经整理的该演讲记录,供读者参考。	1994年04期_微软公司未来的主要产品和技术发展.pdf	http://sso.cdclib.org/interlibSSO/goto/6/=06190596Z93/kcms/detail/detail.aspx?dbCode=cjfq&filename=RJSJ199404020&dbname=CJFD9498
