title	journal_name	year	issue	author	keywords	summary	pdf_filename	article_url
普华:为国产基础软件找寻出路	软件世界	2010	2010年07期	【作者】 李亮 ；	基础软件 ； 竞争劣势 ； 国产软件 ； 赵晓 ； 技术研究所 ； 盈利问题 ； 研究机构 ； 谷歌 ； 替代国 ； 海外企业 ；	<正>这家"年轻"的基础软件厂商公司,正试图通过资金、技术等资源的整合,打破以往国产基础软件分散、单一的竞争劣势。"我国完全有机会造就出中国的’IBM’和’微软’。"这是普华基础软件	2010年07期_普华:为国产基础软件找寻出路.pdf	http://sso.cdclib.org/interlibSSO/goto/6/=06190596Z93/kcms/detail/detail.aspx?dbCode=cjfq&filename=RJSJ201007020&dbname=CJFDLAST2014
中企动力“2010可信网络普及行动”全面开展	软件世界	2010	2010年07期	【作者】 苏达 ；	可信网络 ； 互联网经济 ； 网络安全 ； 应急中心 ； 网民总数 ； 信息安全 ； 损失金额 ； 任度 ； 行中 ； 十年 ；	<正> 近日,中企动力携手CNNIC,在全国各地开展"2010可信网络普及行动",旨在落实国家有关部门"普及提高网络安全水平、构建繁荣诚信互联网"的指示精神,帮助企业构建可信网站,实现互联网经济从"可用"向"可信"的转变,引导企业开展可信网络营销,提高企业竞争力。据CNNIC联合国家互联网应急中心	2010年07期_中企动力“2010可信网络普及行动”全面开展.pdf	http://sso.cdclib.org/interlibSSO/goto/6/=06190596Z93/kcms/detail/detail.aspx?dbCode=cjfq&filename=RJSJ201007021&dbname=CJFDLAST2014
结盟江民 久游试图开启网页游戏安全娱乐次世代	软件世界	2010	2010年07期	【作者】 李亮 ；	江民 ； 网络安全 ； 网页游戏 ； 反病毒软件 ； 次世代 ； 木马病毒 ； 互动娱乐 ； 流行病毒 ； 超时代 ； 防护能力 ；	<正> 近日,国内知名计算机反病毒软件公司江民科技与国内领先的互动娱乐社区2.0运营商久游网就后者旗下产品《勇士无敌》正式达成战略合作。据江民科技近期发布的《2010年5月计算机病毒与网络安全报告》显示,针对网游的木马病毒仍长期位居当月流行病毒前列。一些网络游戏也和杀毒软件展	2010年07期_结盟江民+久游试图开启网页游戏安全娱乐次世代.pdf	http://sso.cdclib.org/interlibSSO/goto/6/=06190596Z93/kcms/detail/detail.aspx?dbCode=cjfq&filename=RJSJ201007022&dbname=CJFDLAST2014
航天信息:“信息化企业”建设刻不容缓	软件世界	2010	2010年07期	【作者】 尚可 ；	信息化企业 ； 航天信息 ； 软博会 ； 技术应用水平 ； 工业和信息化部 ； 技术改造 ； 基业长青 ； 用户需求 ； 时代特性 ； 产品设计 ；	<正> 近日,工业和信息化部部长李毅中在第十四届软博会上指出"抓好技术改造,提高信息技术应用水平"。"应用是核心!"航天信息股份有限公司管理软件事业部吕俊杰副总经理的理解是,"再先进的技术,不能为户所用都是空谈。为什么我们现在的很多的ERP产品在应用上会有问题?其实很多时候软件	2010年07期_航天信息:“信息化企业”建设刻不容缓.pdf	http://sso.cdclib.org/interlibSSO/goto/6/=06190596Z93/kcms/detail/detail.aspx?dbCode=cjfq&filename=RJSJ201007023&dbname=CJFDLAST2014
软件产业的“鱼米之乡”——江苏软件和信息服务产业巡礼	软件世界	2010	2010年07期	【机构】 江苏省经济和信息化委员会 ；	信息服务产业 ； 工业基础 ； 重点软件企业 ； 信息服务业 ； 嵌人式系统 ； 信息服务外包 ； 物联网 ； 数字内容 ； 业务收人 ； 重点项目 ；	<正>江苏省风景秀丽,气候宜人,历史上素有"鱼米之乡"的美誉。但是在2010年,江苏将会大力发展信息服务产业。江苏省雄厚的经济基础和工业基础,同时也为发展软件与信	2010年07期_软件产业的“鱼米之乡”——江苏软件和信息服务产业巡礼.pdf	http://sso.cdclib.org/interlibSSO/goto/6/=06190596Z93/kcms/detail/detail.aspx?dbCode=cjfq&filename=RJSJ201007024&dbname=CJFDLAST2014
聚焦智能电网——开拓软件研发新兴市场	软件世界	2010	2010年07期	【作者】 相春雷 ；	智能电网 ； 软件研发 ； 软件开发 ； 物联网 ； 电力企业 ； 软件发展 ； 软件巨头 ； 自动化企业 ； 开发格局 ； 决策支持系统 ；	<正>智能电网离不开物联网、云计算、软件开发等IT技术,而吉山正在走着这条"智能电网"之路。智能电网,就是电网的智能化,也被称为"电网2.0",它是建立在集成的、高速双向通	2010年07期_聚焦智能电网——开拓软件研发新兴市场.pdf	http://sso.cdclib.org/interlibSSO/goto/6/=06190596Z93/kcms/detail/detail.aspx?dbCode=cjfq&filename=RJSJ201007025&dbname=CJFDLAST2014
服务催生云计算	软件世界	2010	2010年07期	【作者】 张亚勤 ； 【机构】 微软亚太研发集团 ；	开云 ； 物联网 ； 新一代互联网 ； 隐私安全 ； 产业分工 ； 数据中心 ； 完全集 ； 世界融合 ； 媒体方面 ； 移动化 ；	<正>云计算的云非常重要,端也不会消失,端会变得越来越多元化,有的端可能很薄,有的端可能相对比较厚,各种各样的端都会出现。一年前,我们开云计算大会,当时讲的最多的是什么叫云计算。	2010年07期_服务催生云计算.pdf	http://sso.cdclib.org/interlibSSO/goto/6/=06190596Z93/kcms/detail/detail.aspx?dbCode=cjfq&filename=RJSJ201007026&dbname=CJFDLAST2014
工业软件希望在前	软件世界	2010	2010年07期	【作者】 苏达 ；	工业软件 ； 工业转型 ； 经济增长方式 ； 软件服务业 ； 中国软件 ； 基础软件 ； 中国工业化 ； 论坛活动 ； 信息服务业 ； 软件应用 ；	伴随工业和制造业的发展,我国的工业软件发展面临重大机遇。"两化融合"的切入点、突破口和重要抓手,工业软件对于推动我国工业转型、促进经济增长方式转变必将发挥出重要的作用。	2010年07期_工业软件希望在前.pdf	http://sso.cdclib.org/interlibSSO/goto/6/=06190596Z93/kcms/detail/detail.aspx?dbCode=cjfq&filename=RJSJ201007027&dbname=CJFDLAST2014
多面神舟	软件世界	2010	2010年07期	【作者】 李玲玲 ；	工业软件 ； 航天工程 ； 海成 ； 系统集成 ； 探月工程 ； 工业装备 ； 集成优势 ； 工业转型 ； 全球定位系统 ； 集成解决方案 ；	若以"背靠大树好乘凉"来注解现在的神舟软件也并不为过,但假如只是这样审视十年走来的神舟软件,你会发现自己其实离中国工业软件的发展脉搏越来越远。	2010年07期_多面神舟.pdf	http://sso.cdclib.org/interlibSSO/goto/6/=06190596Z93/kcms/detail/detail.aspx?dbCode=cjfq&filename=RJSJ201007028&dbname=CJFDLAST2014
石化盈科:我们的优势在于对行业的理解	软件世界	2010	2010年07期	【作者】 王占波 ；	盈科 ； 石油勘探开发 ； 企业经营 ； 战略目标 ； 项目目标 ； 信息化项目 ； 上海华谊 ； 企业一线 ； 外部合作 ； 投资权 ；	<正>有了业务方面的经验,做解决方案的时候才能在现有基础上进行优化。对于行业的专注与理解,使得石化盈科能够在竞争者中脱颖而出。八年的时间,石化盈科从成立之初的40多人,如今已经发展到	2010年07期_石化盈科:我们的优势在于对行业的理解.pdf	http://sso.cdclib.org/interlibSSO/goto/6/=06190596Z93/kcms/detail/detail.aspx?dbCode=cjfq&filename=RJSJ201007029&dbname=CJFDLAST2014
中科辅龙:“隐形冠军”的专业路	软件世界	2010	2010年07期	【作者】 苏达 ；	隐形冠军 ； 工业软件 ； 医药行业 ； 细分领域 ； 计算机辅助设计 ； 成长之路 ； 专业市场 ； 企业合作 ； 应用领域 ； 顶尖水平 ；	<正> 深耕细分领域,服务专业市场,中科辅龙的成长之路为我国工业软件企业其他企业提供了一种借鉴。自称"小字辈"的中科辅龙瞄准的产品很小:专门做流程工厂的计算机辅助设计(CAD)软件,但他服务的客户群却很大:石化行业、石油行业、电力行业、钢铁行业、纺织行业,甚至医药行业,只要你想,还可以继续往下列名单。简言之,在国内各个设计行业中,他们的产品都用得上。也许正是这一	2010年07期_中科辅龙:“隐形冠军”的专业路.pdf	http://sso.cdclib.org/interlibSSO/goto/6/=06190596Z93/kcms/detail/detail.aspx?dbCode=cjfq&filename=RJSJ201007030&dbname=CJFDLAST2014
CAXA:快速挺进工业软件“第一军团”	软件世界	2010	2010年07期	【作者】 卢敏 ；	工业软件 ； 市场国际化 ； 经济全球化 ； 领军 ； 工业企业 ； 战略实施过程 ； 本地化服务 ； 经济增长方式 ； 工业转型 ； 技术水平 ；	<正>CAXA作为工业软件中的领军企业,在"两化融合"进程中正扮演着越来越重要的角色,随着中国市场国际化,CAXA走向国际的脚步越来越快。在经济全球化的背景下,我国的信息化几乎是伴随	2010年07期_CAXA:快速挺进工业软件“第一军团”.pdf	http://sso.cdclib.org/interlibSSO/goto/6/=06190596Z93/kcms/detail/detail.aspx?dbCode=cjfq&filename=RJSJ201007031&dbname=CJFDLAST2014
金蝶PLM初探	软件世界	2010	2010年07期	【作者】 李玲玲 ；	用友软件 ； 传统管理 ； 管理软件厂商 ； 金蝶国际 ； 姚文 ； PLM ； 制造工厂 ； 电子行业 ； 制造环节 ； 产品规划 ；	<正>其实单看PLM(产品全生命周期管理软件)并不新鲜,但短短一年多时间,国内传统管理软件领域两大厂商用友、金蝶先后通过收购玩起PLM的做法就值得玩味了。距离用友软件(600588.SH)2009年5月	2010年07期_金蝶PLM初探.pdf	http://sso.cdclib.org/interlibSSO/goto/6/=06190596Z93/kcms/detail/detail.aspx?dbCode=cjfq&filename=RJSJ201007032&dbname=CJFDLAST2014
IT运维外包,崎岖之外有光明	软件世界	2010	2010年07期	【作者】 桑小丘 ；	必须品 ； 软件选型 ； 运营维护 ； 信息化规划 ； 客户数据 ； 国际用户 ； 提供商 ； 降低成本 ； 生命周期 ； 数据中心 ；	<正>如同世界杯需要啤酒一样,IT运维外包服务越来越被国内企业所看重了。然而,啤酒依旧不是世界杯的必须品。如同世界杯需要啤酒一样,信息化工作离不开IT运维。随着数据中	2010年07期_IT运维外包,崎岖之外有光明.pdf	http://sso.cdclib.org/interlibSSO/goto/6/=06190596Z93/kcms/detail/detail.aspx?dbCode=cjfq&filename=RJSJ201007033&dbname=CJFDLAST2014
“一线式”生活还有多远?	软件世界	2010	2010年07期	【作者】 桑小丘 ；	一线式 ； 在线应用 ； 存储空间 ； 在线杀毒 ； 网线 ； 网络存储 ； 在线翻译 ； 文档编辑 ； 应用层面 ； 异地办公 ；	<正>在未来,也许我们的工作生活中需要的只是一部电脑外加一根网线。我们再也不必被安装软件所烦恼,也不必担心本地的存储空间不足。如果你是一名忙碌的办公室白领,那么接下来叙述	2010年07期_“一线式”生活还有多远?.pdf	http://sso.cdclib.org/interlibSSO/goto/6/=06190596Z93/kcms/detail/detail.aspx?dbCode=cjfq&filename=RJSJ201007034&dbname=CJFDLAST2014
国信试炼——商业智能,证券业信息化建设必不可少的工具	软件世界	2010	2010年07期	【作者】 李玲玲 ；	商业智能 ； 交易系统 ； 国信证券 ； 业务人员 ； 报表生成 ； 信息技术 ； 核心软件 ； 辅助系统 ； 软硬件平台 ； 技术过程 ；	<正>其实BI并不复杂。关键是,这个分析工具怎样能让各级业务人员,能够很熟练或者很容易地去使用它。证券行业信息技术发展的几十一年可谓是随着计算机特别是	2010年07期_国信试炼——商业智能,证券业信息化建设必不可少的工具.pdf	http://sso.cdclib.org/interlibSSO/goto/6/=06190596Z93/kcms/detail/detail.aspx?dbCode=cjfq&filename=RJSJ201007035&dbname=CJFDLAST2014
最强之眼:让监控无处不在——WebGIS为北京市石景山区环保局环境质量监控中心装上“鹰眼”	软件世界	2010	2010年07期	【作者】 李亮 ；	质量监控 ； 鹰眼 ； 通信网络 ； 网络接入 ； 综合监控 ； 空间数据库 ； 公众环境意识 ； 应急指挥系统 ； 破坏事件 ； 污染物总量控制 ；	<正>东风通信网络出口采用多条链路接入Internet,在巨大应用压力下,负责网络接入的负载均衡设备现在已是不堪重负。近年,随着我国社会经济的发展,污染源日益增多,环境污染	2010年07期_最强之眼:让监控无处不在——WebGIS为北京市石景山区环保局环境质量监控中心装上“鹰眼”.pdf	http://sso.cdclib.org/interlibSSO/goto/6/=06190596Z93/kcms/detail/detail.aspx?dbCode=cjfq&filename=RJSJ201007036&dbname=CJFDLAST2014
John Bates:为企业安上“前车灯”	软件世界	2010	2010年07期	【作者】 卢敏 ；	John Bates ； 响应能力 ； Nelson ； 副总裁 ； 技术人员 ； 首席市场官 ； 技术战略 ； 业务流程 ； 商业流程 ； 首席技术官 ；	现在,CEP可以帮助企业实时运作,而且具有高度响应能力,随时了解企业正在发生的事情,因此CEP对于企业来说有"前车灯"的功能,它可以帮助企业实时看到正在发生的事件。	2010年07期_John+Bates:为企业安上“前车灯”.pdf	http://sso.cdclib.org/interlibSSO/goto/6/=06190596Z93/kcms/detail/detail.aspx?dbCode=cjfq&filename=RJSJ201007037&dbname=CJFDLAST2014
Jeff:数字设计呈现三大趋势	软件世界	2010	2010年07期	【作者】 相春雷 ；	数字设计 ； Jeff ； 欧特克 ； 数字样机 ； 建筑信息模型 ； 逆向工程 ； 物理样机 ； Autodesk ； 应用测试 ； 工作流 ；	<正>一个天才的诞生包括1%的天分,99%的汗水。通过99%的汗水能够帮助用户完成各种评估、判断,精神可嘉,但为什么不让计算机为我们完成这99%工作呢?当人们还在为世博会	2010年07期_Jeff:数字设计呈现三大趋势.pdf	http://sso.cdclib.org/interlibSSO/goto/6/=06190596Z93/kcms/detail/detail.aspx?dbCode=cjfq&filename=RJSJ201007038&dbname=CJFDLAST2014
众说纷“云”(实践篇)	软件世界	2010	2010年07期	【作者】 卢敏 ；	北工大 ； 计算机行业 ； 未来技术 ； 软硬件平台 ； 架构师 ； 北京工业大学 ； 技术创新 ； 资源供应 ； 技术支撑平台 ； 开源社区 ；	在选择了代表IBM先进水平和全球主流趋势的软硬件平台产品之后,北工大搭建的"科教云"不仅能够满足学校高性能计算中心目前业务的需要,还能适应未来技术发展的趋势和需要。	2010年07期_众说纷“云”(实践篇).pdf	http://sso.cdclib.org/interlibSSO/goto/6/=06190596Z93/kcms/detail/detail.aspx?dbCode=cjfq&filename=RJSJ201007039&dbname=CJFDLAST2014
云时代,微软志在构建端到端的信任	软件世界	2010	2010年07期	【作者】 李玲玲 ；	云时代 ； 副总裁 ； 斯科特 ； 盖茨 ； 认证信息 ； 身份认证方法 ； 董事会主席 ； 网络攻击 ； 认证问题 ； 纵深防御 ；	<正> 安全意识越来越强是近年来微软研发思想的一个显著变化。 2002年,时任微软首席执行官、现为微软董事会主席的比尔·盖茨宣布了微软可信赖计算战略,旨在为所有计算机用户提供一个安全的、隐私得到保障的、可靠的计算体验。此后,这一战略一直贯穿了微软公司的整个工作中。微软公司副总裁斯科特·查	2010年07期_云时代,微软志在构建端到端的信任.pdf	http://sso.cdclib.org/interlibSSO/goto/6/=06190596Z93/kcms/detail/detail.aspx?dbCode=cjfq&filename=RJSJ201007040&dbname=CJFDLAST2014
IBM:启动中国云生态引擎	软件世界	2010	2010年07期	【作者】 尚可 ；	IBM ； 云计算技术 ； 物联网 ； 云计算中心 ； 跨越式发展 ； 大中华区 ； 朱近之 ； 信息产业 ； 应用开发商 ； 设备提供商 ；	<正>IBM正在将全球顶尖的云计算技术带给中国市场,进一步深化与中国企业、合作伙伴及众多机构的广泛合作,共同应对云计算以及物联网时代的挑战和机遇。6月11日,IBM举办"IBM 2010云	2010年07期_IBM:启动中国云生态引擎.pdf	http://sso.cdclib.org/interlibSSO/goto/6/=06190596Z93/kcms/detail/detail.aspx?dbCode=cjfq&filename=RJSJ201007041&dbname=CJFDLAST2014
组合测试技术与方法详解	软件世界	2010	2010年07期	【作者】 罗文兵 ； 赵亮 ； 【机构】 中国软件评测中心金融电信测试部 ；	测试用例 ； 测试技术 ； 软件测试方法 ； 信息系统 ； 被测软件 ； 软件系统 ； 黑盒测试 ； 等价类划分 ； 软件配置 ； 软件平台 ；	<正>在设计测试用例时不仅要考虑所有对软件产生影响的可能因素,而且还要考虑存在于这些因素之间的相互作用,因素与因素的组合也要进行充分的测试。软件是一个复杂的逻辑信息系统	2010年07期_组合测试技术与方法详解.pdf	http://sso.cdclib.org/interlibSSO/goto/6/=06190596Z93/kcms/detail/detail.aspx?dbCode=cjfq&filename=RJSJ201007042&dbname=CJFDLAST2014
惠普:关键业务365天的承诺	软件世界	2010	2010年07期	【作者】 卢敏 ；	支撑系统 ； 计划外 ； 企业客户服务 ； 供应链管理系统 ； 服务解决方案 ； 配置管理 ； Standish ； 技术服务部 ； 改进计划 ； 计划系统 ；	惠普与客户共同开展了"挑战365"项目,针对特定的IT服务或IT支撑系统,通过对技术、流程问题进行改进,达到365天无计划外中断的目的,帮助企业客户建立"永续运行"的IT基础架构。	2010年07期_惠普:关键业务365天的承诺.pdf	http://sso.cdclib.org/interlibSSO/goto/6/=06190596Z93/kcms/detail/detail.aspx?dbCode=cjfq&filename=RJSJ201007043&dbname=CJFDLAST2014
PBBI:“位置”成就“价值”	软件世界	2010	2010年07期	【作者】 尚可 ；	软件解决方案 ； 大中华区 ； 客户沟通 ； PBBI ； 地理空间数据 ； 可视化分析 ； 客户化 ； 地理信息服务 ； 信息共享平台 ； 信息可视化 ；	<正> 如何让位置成就价值呢?孙冠军表示可以分成几个步骤:定位、可视化、分析和规划。对于PBBI,很多GIS圈的人并不熟悉。但是它旗下的两大品牌之一MapInfo可算是鼎鼎大名,和CCM一起共同为用户提供的是一个整体软件解决方案,包括了客户沟通、GIS、位置智能等。PBBI大中华区总经理孙冠军表示,公司的目标是为客户提供完整的位置智能解决方案,因为任何用户、应用,都是利用地理信息系统平台来解决业	2010年07期_PBBI:“位置”成就“价值”.pdf	http://sso.cdclib.org/interlibSSO/goto/6/=06190596Z93/kcms/detail/detail.aspx?dbCode=cjfq&filename=RJSJ201007044&dbname=CJFDLAST2014
信息系统运维测试指标体系初探	软件世界	2010	2010年07期	【作者】 罗文兵 ； 赵亮 ； 【机构】 中国软件评测中心金融电信测试部 ；	系统运维 ； 信息系统 ； 测试指标 ； 软件生命周期 ； 建设项目 ； 运行监控 ； 业务应用系统 ； 软件测试 ； 维护阶段 ； 需求定义 ；	<正>随着IT信息系统建设的不断深入和完善,计算机软硬件系统的运行维护已经成为了各行各业、各单位领导和信息服务部门普遍关注和不堪重负的问题。对于信息系统建设项目而言,	2010年07期_信息系统运维测试指标体系初探.pdf	http://sso.cdclib.org/interlibSSO/goto/6/=06190596Z93/kcms/detail/detail.aspx?dbCode=cjfq&filename=RJSJ201007045&dbname=CJFDLAST2014
Teradata进军地理空间新领域	软件世界	2010	2010年07期	【作者】 卢敏 ；	Teradata ； 数据仓库 ； 数据集市 ； 政府机构 ； 商业智能 ； 地理空间 ； 数据转移 ； 大中华区 ； 数据冗余 ； 竞争方式 ；	越来越多的分析应用将会包含人物、事件、时间尤其是地点等多种维度,企业和政府机构的决策者必须拥有处理基于位置的数据的策略,Teradata进军地理空间领域正逢其时。	2010年07期_Teradata进军地理空间新领域.pdf	http://sso.cdclib.org/interlibSSO/goto/6/=06190596Z93/kcms/detail/detail.aspx?dbCode=cjfq&filename=RJSJ201007046&dbname=CJFDLAST2014
自主中间件平台驱动中航信破局	软件世界	2010	2010年07期	【作者】 李玲玲 ；	中间件平台 ； 服务总线 ； 应用系统 ； 信息网络 ； 离港 ； 国航 ； 航空领域 ； 技术架构 ； 信息服务系统 ； 国内软件 ；	<正>在我国,凡航空领域的应用系统都是基于中国民航信息网络股份有限公司(以下简称中航信)的订座、离港、分销、结算等大机系统之上展开的。虽然中国航信服务总线项目(TSB)与东方通签约的消息正式披露	2010年07期_自主中间件平台驱动中航信破局.pdf	http://sso.cdclib.org/interlibSSO/goto/6/=06190596Z93/kcms/detail/detail.aspx?dbCode=cjfq&filename=RJSJ201007047&dbname=CJFDLAST2014
智慧的银行——IBM三大利器保安全	软件世界	2010	2010年07期	【作者】 相春雷 ；	IBM ； 金融犯罪 ； 行为判断 ； 金融管理秩序 ； 金融诈骗罪 ； 证券犯罪 ； 管理法规 ； 金融管制 ； 机构内部 ； 洗钱行为 ；	<正>通过"3I"的设计,IBM帮助用户实现了智慧感知的能力,使得银行金融犯罪管理能够根据客户所有相关的行为判断金融犯罪是否发生。金融犯罪指发生在金融活动过程中的,违反金融管理法规	2010年07期_智慧的银行——IBM三大利器保安全.pdf	http://sso.cdclib.org/interlibSSO/goto/6/=06190596Z93/kcms/detail/detail.aspx?dbCode=cjfq&filename=RJSJ201007048&dbname=CJFDLAST2014
Sonarloqic:掀起绿色办公风暴	软件世界	2010	2010年07期	【作者】 卢敏 ；	绿色办公 ； Sonarloqic ； 碳排放 ； 运行时间 ； Lloyd ； 远程唤醒 ； 能源消耗 ； 午饭时间 ； 信息处理技术 ； 节能减排 ；	<正> 如何有针对性地鼓励用户改变习惯,真正实现"绿化"办公,SonarlogiC有奇招。也许有人会问如何量化P C机的能耗和碳排放呢?以一个拥有一万台电脑的企业为例来计算,正常情况下每台电脑每小时大约消耗0.2度电,连续运行八小时的消耗1.6度电。按每度电一元计算,一万台电脑每天的电费就是16,000元,而实际上很多企业员工在下班后有不关电脑的习惯,电脑实际运行时间是每周120小时以上。	2010年07期_Sonarloqic:掀起绿色办公风暴.pdf	http://sso.cdclib.org/interlibSSO/goto/6/=06190596Z93/kcms/detail/detail.aspx?dbCode=cjfq&filename=RJSJ201007049&dbname=CJFDLAST2014
南大通用发布GBase 8a	软件世界	2010	2010年07期	【作者】 苏达 ；	GBase 8a ； 分析数据库 ； 事务处理 ； 基础软件 ； 垄断局面 ； 自主知识产权 ； 分析型数据 ； 正面竞争 ； 首款 ； 模糊查询 ；	<正> 6月24日,沉寂很久的中国基础软件再次走进人们的视野,南大通用数据技术有限公司发布我国首款具有自主知识产权的分析数据库产品——GBase 8a。"要打破国际巨头垄断局面,需要本土企业把握细分市场机遇、实现技术突破。"南大通用CEO刘博说,"在传统的事务处理领域,我们与世界先进企业差距太大,正面竞争至少目前还是不现实的。但	2010年07期_南大通用发布GBase+8a.pdf	http://sso.cdclib.org/interlibSSO/goto/6/=06190596Z93/kcms/detail/detail.aspx?dbCode=cjfq&filename=RJSJ201007050&dbname=CJFDLAST2014
惠普推出全新ProLiant G7服务器	软件世界	2010	2010年07期	【作者】 相春雷 ；	服务器平台 ； ProLiant G7 ； 投资成本 ； 服务器管理软件 ； 生命周期 ； 至强处理器 ； 营运资金 ； 数据中心 ； 虚拟机 ； 占用空间 ；	<正> 惠普公司近日宣布推出服务器管理软件套件,能显著改善整个服务器生命周期的系统运行情况并提升效率,同时只需两个月时间即可收回全部投资成本。惠普还推出两款新的惠普ProLiantG7服务器平台,并能在两个月内收回全部投资成本。HP ProLiant DL360 G7和HP ProLiant DL 380 G7机架优化服	2010年07期_惠普推出全新ProLiant+G7服务器.pdf	http://sso.cdclib.org/interlibSSO/goto/6/=06190596Z93/kcms/detail/detail.aspx?dbCode=cjfq&filename=RJSJ201007051&dbname=CJFDLAST2014
IT项目管理为何难	软件世界	2010	2010年07期	【作者】 赵卜成 ； 【机构】 美国卡内基训练 ；	项目管理 ； 项目团队成员 ； 内部沟通 ； 卡内基训练 ； 沟通问题 ； 企业管理咨询 ； 项目时间 ； 时间管理 ； 密切性 ； 项目进程 ；	<正>人们在做决策时,往往受到情绪的牵引。良好的人际关系,会使项目管理者得到的资源更加广泛。在执行过程中,也更容易得到他人的支持。走出客户的会议室,陈工心情非常郁闷。顾客	2010年07期_IT项目管理为何难.pdf	http://sso.cdclib.org/interlibSSO/goto/6/=06190596Z93/kcms/detail/detail.aspx?dbCode=cjfq&filename=RJSJ201007052&dbname=CJFDLAST2014
