title	journal_name	year	issue	author	keywords	summary	pdf_filename	article_url
10个大数据迁移的错误	软件和信息服务	2012	2012年09期	【作者】 郭兆辉 ；	数据迁移 ； 存储形式 ； 系统集成 ； 管理数据 ； 数据源 ； 权限控制 ； 计算机系统 ； 数据传送 ； 数据转移 ； 线延迟 ；	当你把数据向新的计算机系统或存储形式转移的时候,请小心那些陷阱与风险。	2012年09期_10个大数据迁移的错误.pdf	http://sso.cdclib.org/interlibSSO/goto/6/=06190596Z93/kcms/detail/detail.aspx?dbCode=cjfq&filename=RJSJ201209024&dbname=CJFDLAST2014
西尔斯百货如何利用大数据制定价格策略	软件和信息服务	2012	2012年09期	【作者】 秦建秀 ；	西尔斯 ； 价格策略 ； 数字化企业 ； 首席技术官 ； 数据格式 ； 价格弹性 ； 雪莱 ； 服务器运行 ； 定制化 ； 积分卡 ；	<正>西尔斯百货正在利用大数据协助定价,并且这种行为几乎是实时的,借此西尔斯可精准为老客户定制折扣卷来消化库存。"我们公司正在向实时的数字化企业转变。"西尔斯百货公司首席技术官(CTO)菲尔·雪莱(Phil Shelley)近日在Hadoop峰会中这样评价。为了实现这个目的,西尔斯公司采用了开源软件Hadoop,因为这个软件可以在低成本的跨平台服务器运行、并以多种不同数据格式存储。同时,它也可以	2012年09期_西尔斯百货如何利用大数据制定价格策略.pdf	http://sso.cdclib.org/interlibSSO/goto/6/=06190596Z93/kcms/detail/detail.aspx?dbCode=cjfq&filename=RJSJ201209025&dbname=CJFDLAST2014
引入大数据的最大障碍——你自己	软件和信息服务	2012	2012年09期	【作者】 秦建秀 ；	技术障碍 ； 分析者 ； 麦肯 ； 业务模型 ； 斯普林 ； 公司文化 ； 业务单位 ； 独立模块 ； 电信业务 ； 智能分析 ；	<正>采用大数据技术的价值很容易证明,但企业这种进步需要跟随数据的引导,甚至改变企业的业务模型,这也许会造成企业对大数据的"恐惧"。引入大数据的技术障碍是显而易见的,据麦肯锡预测,到2018年,全球数据分析师的缺口将达到近20万,但抵达分析者乐园的更大障碍还是如何克服强烈的"数据恐惧症"的公司文化。	2012年09期_引入大数据的最大障碍——你自己.pdf	http://sso.cdclib.org/interlibSSO/goto/6/=06190596Z93/kcms/detail/detail.aspx?dbCode=cjfq&filename=RJSJ201209026&dbname=CJFDLAST2014
我国计算机软件专利保护法律适用分析	软件和信息服务	2012	2012年09期	【作者】 黄登兰 ； 【机构】 北京市尚衡律师事务所 ；	计算机软件 ； 著作权保护 ； 法律适用 ； 文字作品 ； 我国专利法 ； 作品形式 ； 智力活动 ； 外观设计 ； 发明专利 ； 《伯尔尼公约》 ；	<正>在我国计算机软件是否能申请专利,还是只能得到计算机软件著作权的基本保护?或是另有他解?这是软件和信息服务从业者的疑问,同时也是行业在投入软件研发创新上必须思考的问题。	2012年09期_我国计算机软件专利保护法律适用分析.pdf	http://sso.cdclib.org/interlibSSO/goto/6/=06190596Z93/kcms/detail/detail.aspx?dbCode=cjfq&filename=RJSJ201209027&dbname=CJFDLAST2014
把握项目管理中的“三角形”	软件和信息服务	2012	2012年09期	【作者】 刘羚 ； 【机构】 项目管理者联盟 ；	项目管理 ； 通用词 ； 操作过程 ； 内部控制管理 ； 项目总监 ； 内控体系 ； 风险管理 ； 承接项目 ； 营销中心 ； 项目实施 ；	<正>项目管理是个通用词,谈的人越来越多,但在实际操作过程中,针对不同国家、不同公司、不同部门对于项目管理却有"特色理解",这些理解来源于运营模式、业务特点、甚至国别文化等因素。	2012年09期_把握项目管理中的“三角形”.pdf	http://sso.cdclib.org/interlibSSO/goto/6/=06190596Z93/kcms/detail/detail.aspx?dbCode=cjfq&filename=RJSJ201209028&dbname=CJFDLAST2014
谈企业敏感信息泄密的防护	软件和信息服务	2012	2012年09期	【作者】 牟健君 ； 【机构】 光大银行信息科技部系统运维处 ；	信息泄密 ； 信息安全管理 ； 防泄密 ； 信息资产 ； 泄密事件 ； 内网安全管理 ； 办公网 ； 网络安全 ； 客户端应用程序 ； 安全防护策略 ；	目前,国内外信息安全形势严峻,多起信息安全或泄密事件接连发生,加强敏感信息的管理已经成为企业信息安全管理的重中之重。本文列举了企业敏感信息泄密的渠道、防护措施、管理要索,系统地阐述企业内网信息防泄密的方法。	2012年09期_谈企业敏感信息泄密的防护.pdf	http://sso.cdclib.org/interlibSSO/goto/6/=06190596Z93/kcms/detail/detail.aspx?dbCode=cjfq&filename=RJSJ201209029&dbname=CJFDLAST2014
信息安全防御战升级 DLP市场升温	软件和信息服务	2012	2012年09期	【作者】 谢涛 ；	信息安全产品 ； 安全防御 ； DLP ； 客户信息 ； 公民个人信息 ； 信息泄露 ； 客户资料 ； 防泄密 ； 电子商务企业 ； 个人征信 ；	不论是生意红火的银行业,还是不太景气的制造业,信息安全都越来越多地被企业关注。2012年,频发的信息安全泄露事件催生了需求,企业对信息安全产品的投入越来越大。	2012年09期_信息安全防御战升级+DLP市场升温.pdf	http://sso.cdclib.org/interlibSSO/goto/6/=06190596Z93/kcms/detail/detail.aspx?dbCode=cjfq&filename=RJSJ201209030&dbname=CJFDLAST2014
下一代数据中心呼唤新的服务器	软件和信息服务	2012	2012年09期	【作者】 郭嘉凯 ；	数据中心 ； 新一代数据 ； 管理控制台 ； 中心服务器 ； 虚拟化应用 ； 服务器性能 ； 产品总监 ； 信息系统 ； 机架式服务器 ； 现有数据 ；	<正>数据中心的巨变,也对服务器提出了更高的要求,正是在这一背景之下,E5-2600芯片横空出世。"下一代数据中心与之前相比究竟有什么不同?"这是记者在采访中,企业IT负责人经常提到的问题。因为,对于他们而言,只有对数据中心未来的发展趋势有足够的了解,才能在数据中心建设或升级时有清晰的目标和规划,才能保证企业未来的数据中心能够支撑业务的发展。	2012年09期_下一代数据中心呼唤新的服务器.pdf	http://sso.cdclib.org/interlibSSO/goto/6/=06190596Z93/kcms/detail/detail.aspx?dbCode=cjfq&filename=RJSJ201209031&dbname=CJFDLAST2014
沃森:走下竞技场 走上合作台	软件和信息服务	2012	2012年09期	【作者】 张贝贝 ；	沃森 ； 理沦 ； 技术峰会 ； 神经疾病 ； 非结构化 ； 数据结构 ； 搜索空间 ； 运作流程 ； 并行处理能力 ； 体验效果 ；	<正>从"人工智能"这一概念被提出那天起,人们就不断在这一领域钻研,并发展出众多理沦,而IBM的"沃森"与人类同台竞技并获得胜利,更成为人工智能领域具有里程碑意义的事件,对"沃森"来说,它的最终使命并不是与人类对决,而是服务人类,服务社会,成为人类的合作者。	2012年09期_沃森:走下竞技场+走上合作台.pdf	http://sso.cdclib.org/interlibSSO/goto/6/=06190596Z93/kcms/detail/detail.aspx?dbCode=cjfq&filename=RJSJ201209032&dbname=CJFDLAST2014
档案管理信息化迈入云时代	软件和信息服务	2012	2012年09期	【作者】 包俊君 ；	档案管理信息化 ； 数字档案 ； 档案人员 ； 云时代 ； 档案数字化 ； 扩展性方面 ； 工作效率 ； 档案系统 ； 技术架构 ； 交换问题 ；	<正>"电子档案"、"数字档案馆"等概念的诞生,一次次推动着档案人的观念革新。"数字档案云平台"的发布,更是提高了档案人员的工作效率以及档案的安全性和利用率。	2012年09期_档案管理信息化迈入云时代.pdf	http://sso.cdclib.org/interlibSSO/goto/6/=06190596Z93/kcms/detail/detail.aspx?dbCode=cjfq&filename=RJSJ201209033&dbname=CJFDLAST2014
本月快讯	软件和信息服务	2012	2012年09期		启动日 ； 产品供应商 ； 信息服务 ； 智能科技 ； 一体化解决方案 ； 行业经验 ； 商业合作 ； 综合竞争实力 ； 数据技术 ； 管理优化 ；	<正>中国方案商首选品牌调查评选活动启动日前,一年一度由赛迪集团《软件和信息服务》杂志、软信网和方案商专业委员会联合主办的"2012年中国方案商首选品牌大型调查评选活动"已经正式拉开帷幕,本次调查评选将历时3个月,对全国超过2000家方案	2012年09期_本月快讯.pdf	http://sso.cdclib.org/interlibSSO/goto/6/=06190596Z93/kcms/detail/detail.aspx?dbCode=cjfq&filename=RJSJ201209034&dbname=CJFDLAST2014
甲骨文助力企业提升人力资源价值	软件和信息服务	2012	2012年09期		人力资源价值 ； 人力资源管理 ； 管理时代 ； 人才管理 ； 人力资源专业 ； Orade ； 大中华区 ； 高级总监 ； 组织能力 ； 交流论坛 ；	<正>如今,企业CEO们对人力资源管理意义的认识已经有了极大的改观,他们普遍认为人力资源管理已经超越了传统的辅助角色,最终目的是推动业务并帮助企业实现战略落地,而随着云管理时代和信息化的到来,现代企业要实现人力资源管理的战略提升面临诸多挑战。据业界	2012年09期_甲骨文助力企业提升人力资源价值.pdf	http://sso.cdclib.org/interlibSSO/goto/6/=06190596Z93/kcms/detail/detail.aspx?dbCode=cjfq&filename=RJSJ201209035&dbname=CJFDLAST2014
知识企业的流程如何构建?	软件和信息服务	2012	2012年09期	【作者】 黄锡伟 ； 【机构】 健友集团 ； 亚信联创 ；	知识企业 ； 流程改进 ； 组织流程 ； 简单模仿 ； 持续发展 ； 组织效率 ； 管理制定 ； 生命周期 ； 业务目标 ； 时间驱动 ；	<正>组织流程改进是组织长远持续发展能力的基础,是组织必须关注的问题。上期说到知识企业中最重要的不是简单模仿一个体系,而是建立一个"活"的、有效的体系,让一种文化在组织中形成员工工作的精神层面约定。那么如何去设定一个有效的活流程,就需要一个流水不腐的流程管理体系。	2012年09期_知识企业的流程如何构建?.pdf	http://sso.cdclib.org/interlibSSO/goto/6/=06190596Z93/kcms/detail/detail.aspx?dbCode=cjfq&filename=RJSJ201209036&dbname=CJFDLAST2014
与客俱进	软件和信息服务	2012	2012年09期	【作者】 王甲佳 ； 【机构】 江苏省名味清坊特产有限公司 ；	营销大师 ； 科特勒 ； 利普 ； 合作伙伴协议 ； 项目进程 ； 研发资源 ； 组织行为 ； 业务流程管理 ； 用脚投票 ； 案例集 ；	<正>营销大师菲利普·科特勒有一句流传很广的名言"顾客购买的不是钻头,而是墙上的洞"。软件企业交付的不只是一套软件,而是构成企业竞争力的一种能力。	2012年09期_与客俱进.pdf	http://sso.cdclib.org/interlibSSO/goto/6/=06190596Z93/kcms/detail/detail.aspx?dbCode=cjfq&filename=RJSJ201209037&dbname=CJFDLAST2014
大数据之“用户行为分析”	软件和信息服务	2012	2012年09期	【作者】 卢东明 ； 【机构】 SAP公司全球数据库解决方案亚太区 ；	用户行为分析 ； 兵家必争之地 ； 全球电子商务 ； 进口品牌 ； 智能科技 ； 行为信息 ； 购买意向 ； 社会化媒体 ； 主要诉求 ； 第三方 ；	一纵观国内外成功的电商企业,对用户行为信息的分析和使用,无不在这个兵家必争之地做大量投入。	2012年09期_大数据之“用户行为分析”.pdf	http://sso.cdclib.org/interlibSSO/goto/6/=06190596Z93/kcms/detail/detail.aspx?dbCode=cjfq&filename=RJSJ201209038&dbname=CJFDLAST2014
数据分析需要唯物	软件和信息服务	2012	2012年09期	【作者】 张志强 ； 【机构】 海南源安隆 ；	数据分析 ； 实际经营情况 ； 购物篮分析 ； 包装规格 ； 重复购买 ； 交易数据 ； 数据挖掘工具 ； 分析模型 ； 产品更新换代 ； 毫无意义 ；	华丽的图表不代表能有准确的结果,先进的技术不代表适合每一个企业需求。信息化需要客观实际,数据分析要结合行业特点。	2012年09期_数据分析需要唯物.pdf	http://sso.cdclib.org/interlibSSO/goto/6/=06190596Z93/kcms/detail/detail.aspx?dbCode=cjfq&filename=RJSJ201209039&dbname=CJFDLAST2014
DNA是企业长盛不衰的关键?	软件和信息服务	2012	2012年09期		DNA ； 谷歌 ； 没落贵族 ； 腾讯公司 ； 晶体管数目 ； 摩尔定律 ； 商学院教授 ； 副总裁 ； 虚拟物品 ； 软件工程过程 ；	<正>无论是经历大风大浪的百年老店,还是不断涌现的新锐企业,成功失败总有原因,归结到企业DNA多少有些宿命。摩托罗拉移动被谷歌收购有一年的时间了,一个没落贵族悄然离去,一个新兴贵族进入到传统的智能手机终端领域。这场悲喜剧导致摩托罗拉南京和北京两个研究所近千名员工陷入解聘风潮,我们不禁感慨,何以让中	2012年09期_DNA是企业长盛不衰的关键?.pdf	http://sso.cdclib.org/interlibSSO/goto/6/=06190596Z93/kcms/detail/detail.aspx?dbCode=cjfq&filename=RJSJ201209040&dbname=CJFDLAST2014
好看源于戏剧因素多样	软件和信息服务	2012	2012年09期	【作者】 尚辞 ；	同类题材 ； 行业潜规则 ； 认识价值 ； 志德 ； 人心难测 ； 企业上市融资 ； 机会成本 ； 文化元素 ； 心理过程 ； 雅尼 ；	前儿年,市场上曾出现了一批以"打单"、"竞标"为主的销售类小说,据说其中最好的是《浮沉》。如今,《浮沉》被搬上荧屏,使这种说法的"可信度"更高了。	2012年09期_好看源于戏剧因素多样.pdf	http://sso.cdclib.org/interlibSSO/goto/6/=06190596Z93/kcms/detail/detail.aspx?dbCode=cjfq&filename=RJSJ201209041&dbname=CJFDLAST2014
有梦想,什么都不怕!	软件和信息服务	2012	2012年09期	【作者】 包俊君 ；	想不起 ； 黄非 ； 魏云 ； 一遍遍 ； 鸿一 ； 软件工程专业 ； 招聘网站 ； 天下软件 ； 马拉松比赛 ； 慌不择路 ；	<正>魏云生和黄非鸿对望了一眼:眼前这个女子,似曾相识,却一时想不起来究竟在哪里见过。	2012年09期_有梦想,什么都不怕!.pdf	http://sso.cdclib.org/interlibSSO/goto/6/=06190596Z93/kcms/detail/detail.aspx?dbCode=cjfq&filename=RJSJ201209042&dbname=CJFDLAST2014
谁会成为CDO?	软件和信息服务	2012	2012年09期	【作者】 陈士琛 ； 【机构】 工行数据中心 ；	CDO ； 市场认知 ； 首席营销官 ； 市场研究 ； 其在 ；	<正>上期杂志讨论了CDO(首席数据官)这一话题。随着阿里任命陆兆禧为CDO,这着实让从事技术工作的业内同仁兴奋了一把,也再次见证了大数据的火热。到底什么样的企业会设置CDO的职位?笔者认为,企业具备一定规模,有独立数据中心的企业会才会设置这个职位。至于CIO和CDO的定位具体区别是怎样	2012年09期_谁会成为CDO?.pdf	http://sso.cdclib.org/interlibSSO/goto/6/=06190596Z93/kcms/detail/detail.aspx?dbCode=cjfq&filename=RJSJ201209043&dbname=CJFDLAST2014
方案商应走出中国	软件和信息服务	2012	2012年09期	【作者】 佟君亮 ； 【机构】 太极计算机股份有限公司 ；	信息服务产业 ； 国际知名度 ； 海外订单 ；	<正>上期杂志《伦敦大舞台上的中国玩家》一文,让我们看到了走出中国的方案商的典范——水晶石科技。近些年国家大力推动企业"走出去",出台了一系列企业"走出去"的政策措施。目前,政策效应显现,近几个月中国对海外投资的增长较快,	2012年09期_方案商应走出中国.pdf	http://sso.cdclib.org/interlibSSO/goto/6/=06190596Z93/kcms/detail/detail.aspx?dbCode=cjfq&filename=RJSJ201209044&dbname=CJFDLAST2014
合纵连横	软件和信息服务	2012	2012年09期		合纵连横 ； 架构师 ； 战略规划 ； 英培 ； 营销平台 ； 异构数据 ； 数据驱动 ； 抵押贷款 ； 数据仓库 ； 产品开发 ；	<正>本刊讯近期,CA Technologie推出基于内容感知的身份认证与访问管理解决方案,助力企业实现安全可靠性与可视性,有效管理特权用户,构建企业安全保护盾。CA Technologies中国区安全方案战略规划架构师徐英培表示:"应用于管理或自动化中的技术应当成为业务的推动者,这在设置安全控制方面亦是如此。安全孤岛这样的常见问题,增加了企业无法一致执行安全策略的风险。因此,创建账户和身份,以及分配访问权限的自动化进程,对确保安全和提高效率至关重要。	2012年09期_合纵连横.pdf	http://sso.cdclib.org/interlibSSO/goto/6/=06190596Z93/kcms/detail/detail.aspx?dbCode=cjfq&filename=RJSJ201209045&dbname=CJFDLAST2014
叶诗文的速度	软件和信息服务	2012	2012年08期	【作者】 王晓民 ； 【机构】 《软件和信息服务》 ；	举世皆知 ； 游泳比赛 ； 泳姿 ； 现场画面 ； 伦敦奥运会 ； 世界纪录 ； 中国软件企业 ； 中国软件业 ； 杨学山 ； 企业管理软件 ；	<正>从没想过自己会因为看游泳比赛而熬夜,在2012伦敦奥运会举办之际,竟然发生了。熬夜只为了一个名字——叶诗文,这个神奇的小姑娘目前已经举世皆知,而她的名字也被趣解成"Yeah!She win!"。当她凭神奇的冲刺,以打破女子4×400米混合泳世界纪录的成绩夺冠时,全世界为之震惊。最后100米自由泳,叶诗文简直如同在水里飞翔,只要看到现场画面,不激动是不可能的。分解叶诗文400米混合泳全程,前三个泳姿叶诗文一直处于追赶,直到最后一个泳	2012年08期_叶诗文的速度.pdf	http://sso.cdclib.org/interlibSSO/goto/6/=06190596Z93/kcms/detail/detail.aspx?dbCode=cjfq&filename=RJSJ201208001&dbname=CJFDLAST2014
从企业CDO角色谈开去	软件和信息服务	2012	2012年08期	【作者】 卢东明 ； 【机构】 SAP公司 ；	数据资产 ； 国内大型企业 ； 企业经营效率 ； CDO ； Officer ； 战略资产 ； 首席信息官 ； 业务发展方向 ； 大型促销活动 ； 产品厂商 ；	<正>一个好的CDO会带来企业对数据的充分认识和高效使用。前日一条新闻引起了我的注意,阿里巴巴集团正式任命阿里巴巴B2B公司CEO陆兆禧为集团首席数据官(Chief Data Officer,CDO),以我的记忆,这可能是国内大型企业(包括国企、私企)第一个任命此职务的。对此我深表赞赏,CDO一职的任命看似普通,但是它的确反映了一个企业对数据的认识,对数据价值的认识,已经到了一个战略的高度。什么是CDO?和CIO、CTO有何不同?为什么要有CDO一职?向谁汇	2012年08期_从企业CDO角色谈开去.pdf	http://sso.cdclib.org/interlibSSO/goto/6/=06190596Z93/kcms/detail/detail.aspx?dbCode=cjfq&filename=RJSJ201208003&dbname=CJFDLAST2014
从你的数据中获得回报	软件和信息服务	2012	2012年08期	【作者】 Mark Seager ； 【机构】 Informatica ；	社交媒体 ； 个人消费者 ； 交互方式 ； 企业竞争 ； 数字化内容 ； 购买习惯 ； 消费习惯 ； 云中 ； 客户忠诚度 ； 促销信息 ；	<正>灵活的数据管理技术可以帮助企业从不同的系统中提炼出大数据,同时降低数据的拥有成本。围绕着大数据的炒作所触发的业内广泛的讨论已经超出了其商业价值。CEO们仍然对大数据所带来的益处持怀疑态度。社交媒体和移动设备的普及为海量数据做出了贡献,这导致个人消费者和企业用户在数据交互方式上的转变。我们正在经历信息的爆炸,不同类型的数据被存储在云中,并跨越多种不同的系统,即我们所说的"大数据"。炒作的背后当涉及到客户数据时,大数据由	2012年08期_从你的数据中获得回报.pdf	http://sso.cdclib.org/interlibSSO/goto/6/=06190596Z93/kcms/detail/detail.aspx?dbCode=cjfq&filename=RJSJ201208004&dbname=CJFDLAST2014
商业智能燃起的第四把火	软件和信息服务	2012	2012年08期	【作者】 华秀章 ； 【机构】 用友华表软件技术有限公司 ；	商业智能 ； 企业现代化 ； 决策方式 ； 业务问题 ； 移动应用 ； 企业运营 ； 管理决策 ； 分析方式 ； 业务分析 ； 挖掘分析 ；	<正>企业驾驶舱为企业提供了全新的管理和决策方式,将成就企业现代化的"办公室"。商业智能发展十几年来,已燃起三把大火——云计算、移动应用、大数据。当然,并不是因为商业智能才出现这三大技术,而是随着三大技术的出现,商业智能的价值得到充分利用,以此提升解决企业业务问题的能力。然而,现在商业智能将燃起真正的第四把火——企业驾驶舱,它为企业提供了全新的管理和决策方式,将成就企业现代化的"办公室"。	2012年08期_商业智能燃起的第四把火.pdf	http://sso.cdclib.org/interlibSSO/goto/6/=06190596Z93/kcms/detail/detail.aspx?dbCode=cjfq&filename=RJSJ201208005&dbname=CJFDLAST2014
BaaS平台:移动互联网与云计算融合的产物	软件和信息服务	2012	2012年08期	【作者】 崔丹 ； 【机构】 诚迈科技(南京)有限公司云计算事业部 ；	PUSH ； 移动终端 ； BaaS ； 平台服务 ； 应用开发者 ； 产业模式 ； 人口数量 ； 手机型号 ； 手机操作系统 ； 移动应用 ；	<正>BaaS是为移动应用开发者提供的旨在整合云后端的边界服务,包括计算、存储、PUSH、计量等多种服务。移动终端的用户群,以其庞大的人口数量、广泛的行业分布及其旺盛应用需求,推动了移动互联网及云计算的融合发展,形成了"终端+应用+内容+服务"的新的产业模式。从云计算的角度来看,这个产业模式模式催生了BaaS平台(Backendas a service后端即服务),这样一个全新的技术与服务体系,StackMob是这行业的先驱者,随后又有	2012年08期_BaaS平台:移动互联网与云计算融合的产物.pdf	http://sso.cdclib.org/interlibSSO/goto/6/=06190596Z93/kcms/detail/detail.aspx?dbCode=cjfq&filename=RJSJ201208006&dbname=CJFDLAST2014
逐浪行业创新	软件和信息服务	2012	2012年08期	【作者】 张贝贝 ；	行业创新 ； 用户需求 ； 数据分析 ； 安徽合力 ； 江苏电信 ； 合作创新 ； 副总裁 ； 技术合作伙伴 ； 定制化 ； 移动解决方案 ；	创新有很多种,技术突破的创新、商业模式的创新、运营执行的创新、用户需求创新等等,创新,从来就不是一个陌生词,而随着时代的不断发展,角逐未来,赢得市场,多面创新才是王道。	2012年08期_逐浪行业创新.pdf	http://sso.cdclib.org/interlibSSO/goto/6/=06190596Z93/kcms/detail/detail.aspx?dbCode=cjfq&filename=RJSJ201208007&dbname=CJFDLAST2014
回音、数说	软件和信息服务	2012	2012年08期		张亚勤 ； 规模效应 ； 副总裁 ； 研发集团 ； 应用级 ； 开发环境 ； 软件业务 ； 鲍尔默 ； 倪光南 ； 存储形式 ；	<正>"真正大规模的公共云服务,目前在中国是不存在的。"日前,微软全球资深副总裁、微软亚太研发集团主席张亚勤表示,目前大部分在中国应用的云服务,还都是私有的,或者是小型存储形式。而对于究竟如何才能实现应用级的公有云服务?张亚勤给出的建议是,首先,这个云要有规模效应;第二,对于可靠性、安全性、私有云和公有云的移植,还有开发环境等等都要有充分的准备。如果没有规模效应,没有管理经验和数据可靠性的话,提供云服务仍然需要时间。	2012年08期_回音、数说.pdf	http://sso.cdclib.org/interlibSSO/goto/6/=06190596Z93/kcms/detail/detail.aspx?dbCode=cjfq&filename=RJSJ201208008&dbname=CJFDLAST2014
企业App的DIY平台	软件和信息服务	2012	2012年08期	【作者】 郭嘉凯 ；	移动应用程序 ； App ； DIY ； 云城 ； 动态配置 ； 运营成本 ； 交互方式 ； 第三方 ； 应用模板 ； 腾讯 ；	<正>Show公司介绍:广州云城信息科技有限公司成立于2012年,是一家专门从事基于云的移动互联网手机平台开发的IT服务商。商业模式:通过云城科技自主开发的App360云平台,为用户提供第三方移动应用程序的设计、开发、部署、发布、托管以及运营等全方位的服务。同时,用户也可利用App360平台,进行自助式的开发。创新点:通过云计算模式,用户不仅可以快速、简单地实现移动应用程序的开发,同时也可以将这一应用完全交给云城科技来托管,降低了自身的运营成本。面向的用户:所有企业用户。	2012年08期_企业App的DIY平台.pdf	http://sso.cdclib.org/interlibSSO/goto/6/=06190596Z93/kcms/detail/detail.aspx?dbCode=cjfq&filename=RJSJ201208009&dbname=CJFDLAST2014
