title	journal_name	year	issue	author	keywords	summary	pdf_filename	article_url
帮你甩掉画图板的人——北京清华华教公司	软件世界	1995	1995年04期		华教 ； 应用软件系统 ； 培训服务 ； 支集 ； 系统集成 ； 企业宗旨 ； 应用软件设计 ； 旗舰产品 ； 基础标准 ； 技术优势 ；	<正> 北京清华华教公司是在国家教委和清华大学的关怀及扶持下成立的全民高新技术企业。奉行“技术为本、勇干开拓、信誉至上、服务于民”的企业宗旨,致力于机械CAD/CAM应用软件系统的分析、设计、咨询、培训服务和软硬件系统集成。 公司依靠清华大学雄厚的学术和技术背景,与清华大学机械工程系和精密仪器系建有稳定、良好的合作关系,自身拥有一支集开发、培训和市场于一体的高素质专业软件队伍。 公司自1993年底,根据宋键同志关于“在今后的五到十年内普及CAD,彻底地撤掉画图扳”的号召和我	1995年04期_帮你甩掉画图板的人——北京清华华教公司.pdf	http://sso.cdclib.org/interlibSSO/goto/6/=06190596Z93/kcms/detail/detail.aspx?dbCode=cjfq&filename=RJSJ199504030&dbname=CJFD9498
'95第六届软交会盛况空前 交流交易再创记录	软件世界	1995	1995年04期		软交会 ； 软件产品 ； 产品交流 ； 计算机软件 ； 成交率 ； 用户界面友好 ； 应用软件 ； 软件开发 ； 国内软件 ； 多媒体教学软件 ；	<正> 一年一度由电子工业部批准中软总公司主办、中软展览公司承办的第六届全国计算机软件交流交易会于3月5日胜利落下帷幕。历时5天,200余家企业携来600余项软件产品参展的软交会在沟通科研与产业、产业与用户的信息、技术和产品交流交易中,充分显示了贯通纵横的鹊桥功能。参观人数空前,交易活动踊跃,成交率高。不少厂商的展品两天即告罄。据不完全统计,现场成交额逾200万元,已签订协议的900多万元,意向书超千万元,总成交额在2000万元以上。	1995年04期_'95第六届软交会盛况空前+交流交易再创记录.pdf	http://sso.cdclib.org/interlibSSO/goto/6/=06190596Z93/kcms/detail/detail.aspx?dbCode=cjfq&filename=RJSJ199504031&dbname=CJFD9498
现代办公的营养套餐——联想OFFICE	软件世界	1995	1995年04期		OFFICE ； 现代办公 ； 集成软件 ； 苹果电脑 ； 功能模块 ； 终端仿真 ； 应用软件 ； 现代生活节奏 ； 辅助决策 ； 信息管理 ；	<正> 随着现代生活节奏的加快,各种行业都不断推出系列化的产品以适应这种快节奏的要求,而现代办公更是要求人们高效率地处理繁杂的事务。正是在这种情况下,联想OFFICE办公集成软件应用应运而生了。 这套现代办公的营养套餐——联想OFFICE是由联想汉字系统事业部开发的。联想汉字系统事业部成立于1992年8月。其下设开发部、市场部、销售部、生产部、苹果电脑部等集开发、生产、销售于一体。公司成立两年多的时间里,在广大用户的支持下,经过全体同仁的共同努力,汉字系统事业部已经成熟壮大,1994年营业额达四千多万元。	1995年04期_现代办公的营养套餐——联想OFFICE.pdf	http://sso.cdclib.org/interlibSSO/goto/6/=06190596Z93/kcms/detail/detail.aspx?dbCode=cjfq&filename=RJSJ199504032&dbname=CJFD9498
出版软件	软件世界	1995	1995年04期		指令表 ； 梯形图 ； 软件功能 ； 可编程控制器 ； 菜单操作 ； 自动编程 ； 开发过程 ； 集成环境 ； 题库管理 ； 采购管理系统 ；	<正> 可编程控制器程序开发平台(清华版) 5英寸盘3片 定价:900元 本软件主要实现PLC程序开发过程的自动化,由平台自动生成所需的PLC的指令表和梯级图、I/O地址对照表等组成。中西文集成环境,菜单操作。自动编程语言可以使用逻辑方程直接编程、定义助记符。编辑器可直接编辑指令表程序,并提供梯级图符号,可以直接编辑梯形图。同时可实现块操作等。	1995年04期_出版软件.pdf	http://sso.cdclib.org/interlibSSO/goto/6/=06190596Z93/kcms/detail/detail.aspx?dbCode=cjfq&filename=RJSJ199504033&dbname=CJFD9498
产品长廊	软件世界	1995	1995年04期		分类排序 ； 文通 ； 生成功能 ； 手工加工 ； 表格数据 ； 图纸管理 ； 零件参数化 ； 集成环境 ； 尺寸驱动 ； 图形处理 ；	<正> 海文通用分类排序软件HVSORT 海文通用分类排序软件HVSORT,是北京海文公司最新推出的,国内第一套商品化的按词典序排序的工具软件。可广泛应用于各种目录、索引、名录、年鉴、词典等排序,以及各种数据库的输出排序。是便于出版者编辑出版和读者查阅的得力助手。其主要功能: 1.可对数百万条信息排序,迅速准确,无需手工加工;2.包括中英文在内的多语种排序;3.对DBF数据	1995年04期_产品长廊.pdf	http://sso.cdclib.org/interlibSSO/goto/6/=06190596Z93/kcms/detail/detail.aspx?dbCode=cjfq&filename=RJSJ199504034&dbname=CJFD9498
我国财务软件发展的历史回顾	软件世界	1995	1995年04期	【作者】 方志刚 ；	软件发展 ； 软件开发 ； 系统集成 ； 应用软件 ； 方志刚 ； 企业管理信息 ； 会计电算化 ； 处理阶段 ； 帐务处理 ； 图形用户界面 ；	财务软件作为应用软件的一个特殊门类,在近十年间得到了迅速发展,创造了我国民族软件产业的一个奇迹,使会计这门古老的科学进行着一场革命,带来了良好的社会效益。本刊就我国财务软件开发与应用中的一些主要课题请北京兰多资讯有限公司方志刚同志撰写了本专题,分成五个主题发表,即《我国财务软件发展的历史回顾》、《我国财务软件开发与应用的误区》、《财务信息系统开发方法论》、《以财务应用为突破点的系统集成》、《建立财务软件业健康发展的环境》等。本专题中作者从财务软件发展的角度发表了一些看法,对财务软件的发展历史做了较深入的分析,指出了当今财务软件开发与应用中存在的问题,以及解决这些问题的初步设想,并试图对财务软件的未来进行分析与预测,提出并阐述了“财务信息系统应构筑在开放系统之上”、“Client/Server财务软件”、“以财务应用为突破点进行系统集成”、“开展财务软件R&D合作”等观点。	1995年04期_我国财务软件发展的历史回顾.pdf	http://sso.cdclib.org/interlibSSO/goto/6/=06190596Z93/kcms/detail/detail.aspx?dbCode=cjfq&filename=RJSJ199504035&dbname=CJFD9498
我国财务软件开发与应用的误区	软件世界	1995	1995年04期	【作者】 方志刚 ；	软件开发 ； 软件产品 ； 并发控制机制 ； 用户界面 ； ORACLE ； 文件服务器 ； 开发者 ； 用户对象 ； 功能模块 ； 会计核算软件 ；	<正> 如今,财务软件市场的形势似乎可称得上是一片大好,面市的“通用”财务软件产品不下二百钟,其层次各异,分属一、二、三、四代产品,造成鱼目珍珠混杂,概念模糊不清,致使开发者把握不住技术方向,用户无法适从。有必要对我国财务软件开发与应用中的误区一一指明,供广大开发者和用户参考。	1995年04期_我国财务软件开发与应用的误区.pdf	http://sso.cdclib.org/interlibSSO/goto/6/=06190596Z93/kcms/detail/detail.aspx?dbCode=cjfq&filename=RJSJ199504036&dbname=CJFD9498
财务信息系统开发方法论	软件世界	1995	1995年04期	【作者】 方志刚 ；	开发模型 ； 生命周期法 ； 原型法 ； 财务信息系统 ； 软件产品 ； 混合法 ； 软件质量 ； 软件工程 ； 需求分析 ； 模型选择 ；	<正> 一、开发模型选择 开发 个FIS系统,我们遇到的第一个问题就是开发模型的选择可题。开发工作只要有了正确的理论指导,方能有条不紊地进行。 可用的FIS的开发模型主要有生命周期法、原型法和混合法,开发FIS系统宜采用混合法,这是为什么呢? 所谓生命周期法就是将系统开发的全过程按其生命周期分成若干阶段,各个国家和各项工程的阶段划分都有所不同。如可分为系统调研、系统分析、系统设计、系统实施、系统维护等几个阶段。对各阶段的任务、功能、组织、工作、方法等都有明确的规定,并根据各阶	1995年04期_财务信息系统开发方法论.pdf	http://sso.cdclib.org/interlibSSO/goto/6/=06190596Z93/kcms/detail/detail.aspx?dbCode=cjfq&filename=RJSJ199504037&dbname=CJFD9498
以财务应用为突破点的系统集成	软件世界	1995	1995年04期	【作者】 方志刚 ；	系统集成 ； 一切从实际出发 ； 增值链 ； 应用软件开发 ； 需求分析 ； 计算机应用 ； 整体优化 ； 过程设计 ； 自动化孤岛 ； 用户目标 ；	<正> 管理学上有个名词,叫做“增值链”(ValueAdded Chain,VAC),产业发展要寻找其VAC的突破点。将VAC理论借用来解决系统集成的困难,根据一切从实际出发的原则,结合工程实施经验,我们认为,当前在我国计算机应用相对落后的企业进行系统集成的突破点是财务应用。	1995年04期_以财务应用为突破点的系统集成.pdf	http://sso.cdclib.org/interlibSSO/goto/6/=06190596Z93/kcms/detail/detail.aspx?dbCode=cjfq&filename=RJSJ199504038&dbname=CJFD9498
建立财务软件业健康发展的环境	软件世界	1995	1995年04期	【作者】 方志刚 ；	中文平台 ； 研究开发能力 ； 研究与开发 ； 中国市场 ； 中国文化 ； 已有技术 ； 会计师事务所 ； Novell ； 不知道 ； 国际形势 ；	<正> 纵观我国软件产业界之现状,无论是学者、研究开发人员还是软件商,对民族软件产业的发展均深表忧虑,纷纷献计献策,可谓仁者见仁、智者见智,其情也切。一次次,我们痛下决心:不搞硬件了,不搞操作系统了,不搞系统软件了……现在是应用软件规模大的也不搞了,似乎我们对自己在计算机方面的研究开发能力已丧失了信心！只得拿出已“沉积得很厚”的中国文化作挡箭牌,不料我们的“中文平台”竟抵挡不住“多国语言”的进攻。仔细一想,原来洋人从前瞧不上小得可怜的中国市场,而如	1995年04期_建立财务软件业健康发展的环境.pdf	http://sso.cdclib.org/interlibSSO/goto/6/=06190596Z93/kcms/detail/detail.aspx?dbCode=cjfq&filename=RJSJ199504039&dbname=CJFD9498
矢量化软件的现状及发展趋势	软件世界	1995	1995年03期	【作者】 刘亚东 ； 【机构】 北京大恒公司 ；	矢量化 ； 软件功能 ； 图形输入 ； 数字图像处理 ； 工程图 ； 模式识别 ； 轮廓跟踪 ； 工程计算 ； 图形识别 ； 符号识别 ；	由于CAD技术在我国的应用不断深化发展,人们对传统的图形输入方法即借助鼠标、键盘或数字化仪一点一划地进行图形输入感到越来越不能满足要求,因此提出了通过工程扫描仪将图纸一次自动输入到计算机中,再经过一定的软件转换处理,使其变成CAD格式,从而使用纸的输入、修改和存储变得非常方便。 工程图识别技术是一门综合技术,涉及到模式识别、人工智能、数字图像处理、CAD技术等。因此它的发展受到制约也较多,只是最近几年才发展较快。 工程图识别技术有点阵识别和矢量化识别,本期专题介绍的是矢量化软件、工程计算图纸的管理及点阵软件的测试。共有5篇文章。	1995年03期_矢量化软件的现状及发展趋势.pdf	http://sso.cdclib.org/interlibSSO/goto/6/=06190596Z93/kcms/detail/detail.aspx?dbCode=cjfq&filename=RJSJ199503000&dbname=CJFD9498
新一代矢量化软件VP..NT	软件世界	1995	1995年03期	【作者】 刘亚东 ； 【机构】 北京大恒公司 ；	矢量化 ； NT ； VP ； 北京大恒公司 ； 处理系统 ； 光栅编辑 ； 图形用户界面 ； 编辑操作 ； 倾斜校正 ； 符号识别 ；	<正> 矢量化软件是图纸自动输入处理系统的重要组成部分,在以往众多的矢量化软件中,很难找到一个功能齐全、性能卓越、符合当今软件技术发展方向的软件。而新一代矢量化软件克服了以往软件的缺陷,以崭新的姿态出现在人们面前,VP..NT就是新一代矢量化软件中的一个杰出代表。 VP..NT是德国Softelec公司推出的全自动矢量化软件,早期的软件开发工作是从1991年开始的。因此,VP..NT不仅体现了矢量化技术最新发展趋势,而且90年代最新软件技术也在其中得到了充分体现。	1995年03期_新一代矢量化软件VP..NT.pdf	http://sso.cdclib.org/interlibSSO/goto/6/=06190596Z93/kcms/detail/detail.aspx?dbCode=cjfq&filename=RJSJ199503001&dbname=CJFD9498
工程图计算机辅助管理系统	软件世界	1995	1995年03期	【作者】 刘亚东 ； 【机构】 北京大恒公司 ；	工程图 ； 计算机辅助管理 ； 图纸管理 ； 图形文件 ； 系统生成 ； 计算机管理 ； 文件格式 ； 图像格式 ； 扫描输入 ； 管理软件系统 ；	<正> CAD及相关技术的发展促进了我国各个行业加速应用CAD技术,工程图的绘制已不在绘图板上进行而是绘制在计算机里,工程旧图也可通过扫描输入及矢量转换而储存在计算机里。因此,用户需管理的不再是成千上万张图纸,而是成千上万个计算机图形文件。这样,带来的问题是常规的管理方法已经不适用,必须用全新的计算机管理方式来取代。这种背景导致了工程图计算机辅助管理系统的产生。尽管用户对工程图纸管理的需求越来越急切,但目前对于工程图计	1995年03期_工程图计算机辅助管理系统.pdf	http://sso.cdclib.org/interlibSSO/goto/6/=06190596Z93/kcms/detail/detail.aspx?dbCode=cjfq&filename=RJSJ199503002&dbname=CJFD9498
如何选购图纸自动输入矢量化系统	软件世界	1995	1995年03期	【作者】 王建营 ； 【机构】 北京大恒公司 ；	矢量化 ； 系统生成 ； 图像文件格式 ； 软件功能 ； 整套系统 ； 图纸管理 ； 计算机公司 ； 软硬件产品 ； 工程图纸 ； 图形文件 ；	<正>越来越多的单位迫切需要将以前的手绘图纸输 入到计算机中保存和再利用,而利用工程扫 描仪自动地将图纸扫描输入;再经矢量化软 件转换成CAD格式的方法是用户首选的方案。近年来,国内外不少计算机公司也瞄准这一市场,纷纷开发和推出了各种软硬件产品,一时间市场上涌现了各种专业扫描仪和矢量化软件。由于用户的期望值太高,另外对市场上的产品了解不多,买了整套系统不能满意的情况也时有发生。因此如何能买到满意的图纸自动输入矢量化系统也就成为用户极为关心的问题。本文试就市场的状况及用户的反馈信息,提供一些参考意见,以期能对用户选购软硬件系统有所启发和帮助。	1995年03期_如何选购图纸自动输入矢量化系统.pdf	http://sso.cdclib.org/interlibSSO/goto/6/=06190596Z93/kcms/detail/detail.aspx?dbCode=cjfq&filename=RJSJ199503003&dbname=CJFD9498
工程图识别技术及其软件测试	软件世界	1995	1995年03期	【作者】 张海军 ； 朱建新 ； 周济 ； 张新访 ； 【机构】 华中理工大学 ； 华中理工大学 ；	工程图 ； 软件测试 ； 识别软件 ； 字符识别 ； 中心线 ； 自由曲线 ； 识别方法 ； 尺寸标注 ； 匹配法 ； 图线 ；	本文全面地分析了各种工程图识别技术的优劣点,并且针对不同的算法,对我国软件市场上可以见到的三家最好的工程图识别软件系统进行了全面的测试和评价。	1995年03期_工程图识别技术及其软件测试.pdf	http://sso.cdclib.org/interlibSSO/goto/6/=06190596Z93/kcms/detail/detail.aspx?dbCode=cjfq&filename=RJSJ199503004&dbname=CJFD9498
ODBC应用技术初探	软件世界	1995	1995年03期	【作者】 王立丰 ；	ODBC ； FoxPro ； handle ； 数据源 ； 应用技术 ； 单步执行 ； 执行结果 ； 应用程序 ； 数据流图 ； 异步操作 ；	<正> 本文对ODBC及其在FoxPro和EXCEL中的使用进行了探讨,目的在于向读者介绍ODBC的优秀技术,以及用FoxPro和EXC-EL实现“客户—服务器”运算。以便于在您的系统中更充分地利用各种资源(如主机的速度、服务器的容量等)。	1995年03期_ODBC应用技术初探.pdf	http://sso.cdclib.org/interlibSSO/goto/6/=06190596Z93/kcms/detail/detail.aspx?dbCode=cjfq&filename=RJSJ199503005&dbname=CJFD9498
Windows下OLE技术的应用	软件世界	1995	1995年03期	【作者】 陈敏 ； 汤晓安 ； 【机构】 国防科技大学 ； 国防科技大学 ；	应用程序 ； Windows ； 关系数据库 ； 命令按钮 ； 多媒体数据库 ； 定义表 ； 程序开发人员 ； 编程环境 ； 程序调用 ； Insert ；	<正> 一、OLE概述 OLE,即对象的链接与嵌入(Object Linking andEmbedding),是一项增强Windows应用程序之间的相互协作性的技术,它使Windows应用程序的功能得以扩展。使用OLE技术,一个Windows应用程序可以启动其它Windows应用程序,也可以显示和控制其它Windows应用程序的数据,并在创建该数据的程序中对它进行编辑。例如,你的应用程序可以调用	1995年03期_Windows下OLE技术的应用.pdf	http://sso.cdclib.org/interlibSSO/goto/6/=06190596Z93/kcms/detail/detail.aspx?dbCode=cjfq&filename=RJSJ199503006&dbname=CJFD9498
微机屏幕图形存取技术	软件世界	1995	1995年03期	【作者】 周升锋 ； 张建 ； 李长波 ； 【机构】 山东工程学院 ； 山东工程学院 ；	数据结构 ； 视频缓冲区 ； 文件形式 ； 存取技术 ； 位面 ； 单链表 ； struct ； 点坐标 ； 输出文件 ； 指针变量 ；	将计算机屏幕上的图形以文件形式保存到磁盘上,需要时再调出,本文给出了两种常用的方法:(1)通过分析视频缓冲区的结构特点,对其操作,保存屏幕全部信息;(2)以数据结构作为理论依据,选择一种合适的存储方式,记录绘图的信息,对图形进行存盘和调入。	1995年03期_微机屏幕图形存取技术.pdf	http://sso.cdclib.org/interlibSSO/goto/6/=06190596Z93/kcms/detail/detail.aspx?dbCode=cjfq&filename=RJSJ199503007&dbname=CJFD9498
分布式数据库数据复制的实现——SYBASE的复制服务器概念	软件世界	1995	1995年03期	【作者】 张珲 ； 【机构】 北京经济学院 ；	分布式数据库 ； SYBASE ； 数据复制 ； 集中式系统 ； 存取速度 ； 系统开销 ； 数据共享 ； 系统性能 ； 本地数据 ； 数据输入 ；	<正> 近几年来,分布式数据库已成为信息处理的一个重要领域。其中,分布式数据库的数据共享技术更是分布式数据库实现的一个关键。过去,通过网络连接的集中式系统,已经证明在数据的共享性,存取速度以及系统开销上存在问题。以往的分布式数据库也有类似的限制,待别是当相同数据在不同的操作环境间共享时,环境之间可能相互影响。对于这类问题,复制数据是唯一可以提供高性能、高可靠性的方法,复制数据的优点还在于通过使用本地数据而减少网络负担,提高整个系统性能;通过每一个节点对数据输入、输出、更新的	1995年03期_分布式数据库数据复制的实现——SYBASE的复制服务器概念.pdf	http://sso.cdclib.org/interlibSSO/goto/6/=06190596Z93/kcms/detail/detail.aspx?dbCode=cjfq&filename=RJSJ199503008&dbname=CJFD9498
谈谈在Foxpro2.5中遍历目录树的设计	软件世界	1995	1995年03期	【作者】 徐文革 ； 【机构】 庆盛服饰皮具有限公司 ；	Foxpro2.5 ； 目录树 ； 数据库程序 ； 指定目录 ； 临时文件 ； 程序设计语言 ； FoxPro ； 第三代 ； 程序调用 ； 类数 ；	<正> 通常对目录树的遍历的讨论大多限于C语言等第三代程序设计语言中,在dBase类数据库程序设计中较少涉及。但有时为了使数据库程序更灵活,功能更强大,希望能对目录数进行遍历操作,如:删除所有目录中的临时文件,或列出指定目录及其之目录下的文件,或自动寻找指定文件等。那么,如何在dBase类数	1995年03期_谈谈在Foxpro2.5中遍历目录树的设计.pdf	http://sso.cdclib.org/interlibSSO/goto/6/=06190596Z93/kcms/detail/detail.aspx?dbCode=cjfq&filename=RJSJ199503009&dbname=CJFD9498
键盘某些特殊键状态的检测与控制	软件世界	1995	1995年03期	【作者】 李彦超 ； 【机构】 石家庄市公安局 ；	开发程序 ； CAPS ； 执行程序 ； 程序调用 ； 分别编译 ； 应用程序 ； 单元的 ； 控制原理 ； 小写字母 ； 七八 ；	<正> 在开发程序过程中,有时希望在某一时刻了解一些特殊键如CAPS LOCK,NUM LOCK,SCROLLLOCK的状态或在执行程序过程中把它们设置成某一状态。本文介绍了一种用程序检测和设置这些键的方法,这些键的状态由内存低地址(即0段)的1047和1048单元的某些位控制,如下所示:	1995年03期_键盘某些特殊键状态的检测与控制.pdf	http://sso.cdclib.org/interlibSSO/goto/6/=06190596Z93/kcms/detail/detail.aspx?dbCode=cjfq&filename=RJSJ199503010&dbname=CJFD9498
充分利用DOS 6.0的网络功能	软件世界	1995	1995年03期	【作者】 陈晓宏 ；	DOS 6.0 ； 重定向 ； 异步通信 ； 访问服务器 ； SERVER ； 计算机技术 ； 打印机接口 ； 双机 ； 软件安装 ； 串行口 ；	<正> 网络技术是当前的热门技术,特别是PC机间的联网,更是热点中的热点,许多计算机技术人员与爱好者对其都非常感兴趣,却因资金和硬软件设备等原因而找不到可供学习的网络环境。我们可以利用现有设备组建一些简单的网络环境,新版DOS 6.0提供了简易局域网络环境:包含用于简易网络环境的INTERL-INK.EXE和INTERSVR.EXE和用于与Windowsfor Workgroups配套组建LAN的程序盘——WOR-KGRP;后者需要网卡,网络连线等硬件,而前者则只	1995年03期_充分利用DOS+6.0的网络功能.pdf	http://sso.cdclib.org/interlibSSO/goto/6/=06190596Z93/kcms/detail/detail.aspx?dbCode=cjfq&filename=RJSJ199503011&dbname=CJFD9498
FoxPro 2.5 for Windows编程技巧一二	软件世界	1995	1995年03期	【作者】 杨国兴 ； 【机构】 清华大学 ；	FoxPro ； 应用程序 ； 编程技巧 ； Debug ； 调试工具 ； 过程定义 ； 项目管理 ； 编辑框 ； 事件驱动 ； 计算功能 ；	<正> 1.编程要素 一个ForPro应用程序一般由数据库、菜单、屏幕、报表、查询、PRG程序等组成,由一个项目(Project)集成管理。FoxPro提供了开发应用程序方便的工具,项目管理器、菜单生成器、屏幕生成器、报表书写器、实例关系查询,还提供了Trace Window和Debug Window等集成调试工具。	1995年03期_FoxPro+2.5+for+Windows编程技巧一二.pdf	http://sso.cdclib.org/interlibSSO/goto/6/=06190596Z93/kcms/detail/detail.aspx?dbCode=cjfq&filename=RJSJ199503012&dbname=CJFD9498
“双拼双音”助记歌诀	软件世界	1995	1995年03期	【作者】 张全明 ；	汉字输入法 ； 输入方法 ； 双音 ； 金山公司 ； 双拼 ； 法都 ； 教学效果 ； 合助 ； 近三 ； 叶皆 ；	<正> 香港金山公司研制的Super-CCDOS中的“双拼双音”汉字输入法,是拼音输入中最优秀的一种输入方法。然而,由于其中的近三十个复合韵母以及三个卷舌声母皆用指定的英文字母键替代,因此使学习者难以在短期内掌握。为了解决这一问题,笔者在教学中编制了下列“双拼双音助记歌诀”(两个“零声母”E和O极易记之,故未编入)。教学效果颇佳。	1995年03期_“双拼双音”助记歌诀.pdf	http://sso.cdclib.org/interlibSSO/goto/6/=06190596Z93/kcms/detail/detail.aspx?dbCode=cjfq&filename=RJSJ199503013&dbname=CJFD9498
将理规化为现实——SCO Open Server企业系统3.0版	软件世界	1995	1995年03期	【作者】 梁定康 ；	微机应用 ； Pentium ； UNIX ； 局域网络 ； 企业系统 ； 桌面系统 ； 市场调查公司 ； 用户需求 ； 文件名称 ； 网络文件系统 ；	<正> 目前国内微机应用很普遍。从80年代开始,INTEL公司推出了386、486处理器及现在的Pentium芯片,大大提高了计算机的运作能力。微机不再局限于个人应用方面,已能代替大型机的地位,成为一个部门的服务器,或发挥连接局域网络的功能。 UNIX是一个多用户、多进程和多功能的操作系统。SCO公司在INTEL处理器和UNIX系统上,有超过15年的开发软件和满足用户需求的经验。根据美国IDC市场调查公司,在1994年7月发表的调查报告中,	1995年03期_将理规化为现实——SCO+Open+Server企业系统3.0版.pdf	http://sso.cdclib.org/interlibSSO/goto/6/=06190596Z93/kcms/detail/detail.aspx?dbCode=cjfq&filename=RJSJ199503014&dbname=CJFD9498
