title	journal_name	year	issue	author	keywords	summary	pdf_filename	article_url
神图软件开发环境——编程者的“神笔”	软件世界	1995	1995年06期	【作者】 黄国华 ； 叶促翘 ； 【机构】 中船总公司七○一所 ； 中船总公司七○一所 ；	软件开发环境 ； FORTRAN ； 程序开发环境 ； 编程者 ； 管理功能 ； Borland ； 文本编辑 ； 程序分析 ； PASCAL ； 结构程序 ；	<正> 我们目前使用的神图软件开发环境主要是“神图FORTRAN”和“神图C/C++”(神图系列软件还包括支持PASCAL、Basic、Ada和PL/M-86等语言的环境)。“神图 C/C++”是一个基于C/C++语言,可与现行流行的语言环境,如Turbo C,Borland C++,Quick C和Microsoft C等配套使用而构成的新型工作平台:神图FORTRAN是一个基于FORTRAN语言的环境,支持Microsoft FORTRAN 5.0和标准FORTRAN 77的程序设计。神图FORTRAN和神图C/C++的共同之处都是运行于PC机,集设计、编码、分析和管理功能于一体的智能化图示程序开发环境,	1995年06期_神图软件开发环境——编程者的“神笔”.pdf	http://sso.cdclib.org/interlibSSO/goto/6/=06190596Z93/kcms/detail/detail.aspx?dbCode=cjfq&filename=RJSJ199506018&dbname=CJFD9498
质量过硬 用户放心——CSTC部分评测软件介绍	软件世界	1995	1995年06期		软件介绍 ； CSTC ； 计算机软件 ； 应用系统 ； 信息技术产品 ； 产品测试 ； 酒店管理系统 ； 文本图像 ； 综合管理系统 ； 国民经济信息化 ；	国民经济信息化的实现需要使用大量计算机、软件、通信等信息技术应用产品。为配合’95“三金”工程暨信息技术产品展览交易会,充分发挥展览交易会宣传和推广优秀产品和应用系统作用,为各行各业信息化的实施提供优质性能产品服务,电子部计算机与微电子发展研究中心和中国软件评测中心(CSTC)于1995年10日—1995年3月31日联合举办’95信息技术产品集中测试,得到众厂商积极响应。中国软件评测中心坚持面向应用的原则,经过严格初评安装检测、复评确认测试和用户调查,向社会推荐商品化成熟、质量过得硬、有良好市场前景的计算机软件产品和应用系统。现将集中测试通过严格测试获得“优秀”和推荐”等级的产品测试结果公布于众(排各不分前后),供广大用户放心地选用。	1995年06期_质量过硬+用户放心——CSTC部分评测软件介绍.pdf	http://sso.cdclib.org/interlibSSO/goto/6/=06190596Z93/kcms/detail/detail.aspx?dbCode=cjfq&filename=RJSJ199506019&dbname=CJFD9498
中国软件评测中心发布——中国龙高级中文平台(4.0版)通过确认测试	软件世界	1995	1995年06期	【作者】 黄民德 ； 杨寅夏 ； 符国刚 ； 【机构】 总工程师 ； 测试工程师 ； 测试工程师 ；	中文平台 ； 中国龙 ； 可扩充性 ； 功能规格 ； 测试工程师 ； 用户文档 ； 应用软件 ； 易用性 ； 图形显示 ； 驱动程序 ；	<正> 近日,中国软件评测中心(CSTC)受昆明明星电脑公司的委托,按照功能规格验证与面向应用相结合的原则,对其产品“中国龙V4.0高级中文平台”从功能度、兼容性、速度、可扩充性、资源利用率、易用性、可靠性及用户文档等八个方面进行了严格、规范的确认测试。	1995年06期_中国软件评测中心发布——中国龙高级中文平台(4.0版)通过确认测试.pdf	http://sso.cdclib.org/interlibSSO/goto/6/=06190596Z93/kcms/detail/detail.aspx?dbCode=cjfq&filename=RJSJ199506020&dbname=CJFD9498
请注意 国庆节期间将有病毒发作!	软件世界	1995	1995年06期	【作者】 龙爱兵 ；	特征串 ； SCAN ； handle ； 返回值 ； 功能分配 ； 传染过程 ； 跳转 ； 存中 ； write ； 回写 ；	<正> 最近在一些单位的微机上发现了一种新病毒,用正版的KILL73、最新SCAN、MSAV等杀毒软件均不能检测。F-PROT虽提示该病毒可能是以色列病毒的变种,但仍无法确认其具体形态。从其内含的特征串“CHINA,CHINA,MY MOTHER,I LOVE YOU”来看,该病毒应属国人的“杰作”。经过跟踪,笔者已全部掌握了其机理并编写了解毒程序。鉴于该病毒只在国庆节发作,不妨将其命名为“国庆祝福病毒”(以下简称	1995年06期_请注意+国庆节期间将有病毒发作!.pdf	http://sso.cdclib.org/interlibSSO/goto/6/=06190596Z93/kcms/detail/detail.aspx?dbCode=cjfq&filename=RJSJ199506021&dbname=CJFD9498
软件水平考试应考经验	软件世界	1995	1995年06期	【作者】 苏武荣 ； 【机构】 福建省政府办技术处 ；	水平考试 ； 软件人员 ； 计算机软件 ； 计算机应用 ； 系统分析员 ； 专业技术资格 ； 电子工业部 ； 评分标准 ； 数据流图 ； 系统体系结构 ；	<正> 《中国计算机软件专业技术资格和水平考试》是国家人事部和电子工业部等机构领导下的国家级考试,是为计算机应用及软件人员设置的。这项考试规定每年举行一次(一般安排在每年10月的第2个星期日),实行全国统一组织、统一大纲、统一试题、统一评分标准。为了帮助考生做好应试准备,本文将结合笔者两次顺利通过高级程序员(1987年)和系统分析员(1993)	1995年06期_软件水平考试应考经验.pdf	http://sso.cdclib.org/interlibSSO/goto/6/=06190596Z93/kcms/detail/detail.aspx?dbCode=cjfq&filename=RJSJ199506022&dbname=CJFD9498
面向对象语言和C++讲座 第五讲 C++语言的基本类库	软件世界	1995	1995年06期	【作者】 杨明 ； 张季琴 ； 【机构】 清华大学计算机系 ； 清华大学计算机系 ；	类库 ； C++语言 ； 面向对象语言 ； 软件复用 ； 代码段 ； 行代码 ； 实现阶段 ； 设计过程 ； 逻辑关系 ； 用户界面 ；	<正> 一、引言 面向对象的程序设计语言所带来的最主要的好处就是:以这种语言设计结构合理的系统能够达到高度的复用。 软件复用可以有多种形式,我们可以复用几行代码构成的代码段、特定的类或按一定逻辑关系联系起来的类。复用代码段是最简单的复用形式,但这种复用形式带来的好处是微乎其微的,因为代码必须在多个程序之间重复。面向对象的程序设计语言利用现有的类并通过继承将它们特定化、参数化,就可以复用一组有逻辑关系的类,从而达到更大程度的复用。这种以一定的逻辑关系结合起来的类的集合就是类库。	1995年06期_面向对象语言和C++讲座+第五讲+C++语言的基本类库.pdf	http://sso.cdclib.org/interlibSSO/goto/6/=06190596Z93/kcms/detail/detail.aspx?dbCode=cjfq&filename=RJSJ199506023&dbname=CJFD9498
“奔腾”微处理器	软件世界	1995	1995年06期	【作者】 金易 ；	并行计算 ； 软件兼容性 ； 流水线操作 ； Pentium ； 浮点 ； 个人机 ； 体系结构 ； 中央处理器 ； 高速缓冲存储器 ； 应用软件 ；	<正> “奔腾”处理器是英特尔公司继广泛使用的i486芯片系列之后的新一代兼容性微处理器。它的设计开始于1989年年初,其主要目标是在现有技术的实际范围内一方面最大地提高性能,一方面保持软件兼容性。“奔腾”处理器采用了0.8μm BiCMOS技术,集成了310万个晶体管。 半导体技术的不断发展促进了微处理器设计的革新。由于特征尺寸的减少和互连层的增加,集成度得到了提高,使设计人员能增加硬件资源配置以获得更多的并行计算和更深的流水线操作;由于器件速度的提	1995年06期_“奔腾”微处理器.pdf	http://sso.cdclib.org/interlibSSO/goto/6/=06190596Z93/kcms/detail/detail.aspx?dbCode=cjfq&filename=RJSJ199506024&dbname=CJFD9498
国际软件市场蓬勃发展	软件世界	1995	1995年06期	【作者】 刘林森 ；	克里夫兰 ； 市场预测 ； 降低成本 ； 家庭生活 ； 热销产品 ； 卫星传输 ； 传输服务 ； 新兴工业化国家 ； 日本厂商 ； 执行程序 ；	<正> 电脑的大规模普及和向自动化领域投资的不断增长,正在推动全球软件业高速发展。美国克里夫兰市场预测公司最近的调查报告说,1994年全世界软件市场规模约1000亿美元。据分析,许多用户相信增加对软件的投资有利于提高效率和降低成本。电脑业分析家指出,电脑工业的未来将更多地依赖软件和服务。电脑正逐渐成为用户的工作中心,并开始成为部分家庭生活中心。	1995年06期_国际软件市场蓬勃发展.pdf	http://sso.cdclib.org/interlibSSO/goto/6/=06190596Z93/kcms/detail/detail.aspx?dbCode=cjfq&filename=RJSJ199506025&dbname=CJFD9498
Novell:不陌生的名字——写在Novell突破5万名授权工程师之际	软件世界	1995	1995年06期	【作者】 肖艳 ；	Novell ； 预算目标 ； 销售渠道 ； 网络操作系统 ； 请看 ； 计算机软件 ； 中央管理 ； 财政收入 ； 教育计划 ； 软件供应商 ；	<正> 作为世界第三大计算机软件公司,在今天竟争如此激烈的市场,是如何保持自己固有的市场?又是如何成功地在全球展开Novell的授权教育计划呢?Novell一定有其制胜的法宝吧,请看下文。1.建网费用低廉、网络中央管理和全球直接服务 Novell公司不久前发表了第一季度的部分财政收入情况,宣称NetWare 4的销售量是1994财政年度NetWare 4销售量的两倍多,已经增长到接近公司整体网络操作系统预算目标的30％。随着NetWare4.1去年12月份的发表以及客户和销售渠道对此产生积极接受态度,市场份额不断增长,标志着NetWare 4做	1995年06期_Novell:不陌生的名字——写在Novell突破5万名授权工程师之际.pdf	http://sso.cdclib.org/interlibSSO/goto/6/=06190596Z93/kcms/detail/detail.aspx?dbCode=cjfq&filename=RJSJ199506026&dbname=CJFD9498
出版软件	软件世界	1995	1995年06期		二维绘图 ； 真实感图形 ； 几何变换 ； 消隐 ； 界面程序 ； 程序编译 ； 体素 ； 生成程序 ； 图像边缘提取 ； 图像分析 ；	<正> 实用计算机辅助二维绘图与三维造型 (电子版) 3.5英寸盘2片 定价:1800元 本软件为C语言源程序。主要包括计算机辅助二维绘图的各主要功能程序和三维造型的如体素产生、拼合运算、各种几何变换、消隐显示等实用程序和真实感图形生成程序。这些程序编译后可运行于微机或工作站环境。此外,还提供了用户界面程序。本软件与同名书《实用计算机辅助二维绘图与三维造型》配套发行。本软件在DOS3.0、MSC6.0以上版本、MASM5.0	1995年06期_出版软件.pdf	http://sso.cdclib.org/interlibSSO/goto/6/=06190596Z93/kcms/detail/detail.aspx?dbCode=cjfq&filename=RJSJ199506027&dbname=CJFD9498
数据库应用及研究趋势	软件世界	1995	1995年06期	【作者】 史洋 ；	数据库管理 ； 知识库管理系统 ； 数据库技术 ； 语义相关 ； 面向对象的 ； 软件体系结构 ； 数据文件 ； 全局数据库 ； 决策支持系统 ； 数据库领域 ；	<正> 数据库技术应用已渗透到人类活动的各个领域。为了叙述上的方便,现将其分为五个应用领域加以介绍。这五个领域是:商业信息处理、工程与制造、决策支持、科研与统计、多媒体方面的应用。应当指出的是,一个领域内的研究成果也可能应用于其它领域,或者为其它领域所借鉴。一、商业信息处理 这是率先采用数据库技术的一个领域。早期的数据库管理系统,实际上是面向商业的编程语言CO-BOL在管理语义相关数据文件上的延伸,主要用于大、中型商业组	1995年06期_数据库应用及研究趋势.pdf	http://sso.cdclib.org/interlibSSO/goto/6/=06190596Z93/kcms/detail/detail.aspx?dbCode=cjfq&filename=RJSJ199506028&dbname=CJFD9498
Internet——全世界最大的信息资源宝库	软件世界	1995	1995年06期	【作者】 曾明 ； 【机构】 国家自然科学基金委员会 ；	计算机互联网络 ； 地区规划 ； Internet ； 资源宝库 ； 信息通道 ； 计算机屏幕 ； 十进制数字 ； 远程查询 ； 内部链接 ； 分组交换 ；	<正> 建立于1982年的全世界最大的国际计算机互联网络Internet,巳成为现阶段事实上的国际信息高速公路。它的形成和发展,为各个国家和地区规划和建设自己的“信息高速公路,”提供了宝贵的经验。Internet不仅是连接各个国家和地区计算机网络的信息通道,还是全世界最大的信息资源宝库。	1995年06期_Internet——全世界最大的信息资源宝库.pdf	http://sso.cdclib.org/interlibSSO/goto/6/=06190596Z93/kcms/detail/detail.aspx?dbCode=cjfq&filename=RJSJ199506029&dbname=CJFD9498
虚拟现实在走向现实	软件世界	1995	1995年06期		虚拟现实 ； 虚拟环境 ； 用户界面 ； 英文大写 ； 图形系统 ； 飞行模拟器 ； 三维图形 ； 实时渲染 ； 程序开发人员 ； 沉浸式 ；	<正> 前言 虚拟现实(Virtual Reality)已取得新闻媒体及公众的理解,但是大多数不真正知道它是什么?它是希奇古怪的边缘技术,还是现代的可视化技术?它是否有市场?如果有,那么究竟有多大?虚拟现实(用英文大写字母VR表示)这项技术是现在可行,还是将来可行?正如任何一门新的尖端技术问世一样,VR既有人欢迎,也有人持怀疑态度。 简单地说,VR并不是真的,也不是现实,而是一种可交替更迭的环境。人们可以进入该环境,也可以通过计算机的各种媒体与之交互。	1995年06期_虚拟现实在走向现实.pdf	http://sso.cdclib.org/interlibSSO/goto/6/=06190596Z93/kcms/detail/detail.aspx?dbCode=cjfq&filename=RJSJ199506030&dbname=CJFD9498
计算机软件著作权登记公告	软件世界	1995	1995年06期	【机构】 中华人民共和国电子工业部计算机软件登记办公室 ；	软件名称 ； 软件制作 ； 月卜 ； 登记号 ； 中国软件 ； 分类号 ； 著作权人 ； 登记公告 ； 首次发表 ； 批准日期 ；	<正> 登记号 940295分类号 65000-0000软件名称及 润嘉财经表处理系统(单 版本号 用户)[简称:润嘉财经表] V2.01著作权人 北京市润嘉专业软件制作 及其国籍 有限公司 中国软件首次发表 1993年5月16日 日期及地点 中国北京市软件零售(报)价 人民币1500元登记批准日期 1994年12月22日登记号 940296分类号 65000-0000软件名称及 润嘉帐务处理系统(网络 版本号 版)[简称:润嘉帐务(网络 版)]V2.0著作权人 北京市润嘉专业软件制作	1995年06期_计算机软件著作权登记公告.pdf	http://sso.cdclib.org/interlibSSO/goto/6/=06190596Z93/kcms/detail/detail.aspx?dbCode=cjfq&filename=RJSJ199506031&dbname=CJFD9498
产业动态	软件世界	1995	1995年05期		计算机安全 ； 产业动态 ； 工业办公室 ； 接口规范 ； 功能接口 ； 计算机应用系统 ； 事务处理系统 ； 计划委员会 ； 统计报表管理 ； 面向对象的 ；	<正> 北京市公安局于1994年2月至4月在全市范围内进行了一次计算机安全大检查。评出北京市计划委员会、北京市电子工业办公室、北京市公用局、北京市卫生局、北京市计算中心、北京市崇文区政府、北京市宣	1995年05期_产业动态.pdf	http://sso.cdclib.org/interlibSSO/goto/6/=06190596Z93/kcms/detail/detail.aspx?dbCode=cjfq&filename=RJSJ199505000&dbname=CJFD9498
Powerbuilder获取Sybase存储过程返回参数的方法	软件世界	1995	1995年05期	【作者】 张艳燕 ； 郭立 ；	Sybase ； Powerbuilder ； 存储过程 ； 交易系统 ； 数据库开发工具 ； 后台管理系统 ； PowerBuilder ； 面向对象的 ； 服务器体系结构 ； 需求表 ；	<正> Sybase数据库以其独特的客户/服务器体系结构和优良的多线索技术、被广泛应用于交易系统中。我们已成功地应用Sybase数据库和面向对象的数据库开发工具PowerBuilder完成了秦皇岛煤碳交易所和重庆商品交易所计算机交易管理系统,利用Sybase系统大大提高了系统开发、调试的效率、投入运行后系统性能稳定且很好地满足了交易系统高可靠性、实时性等方面的要求。 交易系统一般可分为前台交易系统和后台管理系统两大组成部分,前台交易系统由主持人子系统和出	1995年05期_Powerbuilder获取Sybase存储过程返回参数的方法.pdf	http://sso.cdclib.org/interlibSSO/goto/6/=06190596Z93/kcms/detail/detail.aspx?dbCode=cjfq&filename=RJSJ199505001&dbname=CJFD9498
用VISUAL BASIC3.0在WINDOWS FOR WORKGROUPS网络上开发并建立VISUAL BASIC应用程序到EXCEL的DDE连接	软件世界	1995	1995年05期	【作者】 高志成 ； 【机构】 河北大学 ；	VISUAL ； DDE ； WINDOWS ； 应用程序 ； 计算机名 ； 实时监控程序 ； 数据管理 ； SERVER ； BASIC ； 窗体 ；	<正> 如何用EXCEL卓越的数据分析,数据管理和图表等功能来处理网络上其它计算机采集的实时数据,是开发网络上实时监控程序所要解决的问题之一。 下面谈谈在WINDOWS FOR WORKGROUP3.1(以下简称WFW)网络上用VISUAL BASIC3.0(以下简称VB)及动态数据据交换(Dynamic Data Exchange简称DDE)解决这一问题的一些技巧和方法。 1.假设WFW网上某一计算机名为COMAPUTER1,在此机上用VB建立一个基于WINDOWS的应用程序VBSERVER.EXE作为DDE服务器(SERVER)。步骤如下:	1995年05期_用VISUAL+BASIC3.0在WINDOWS+FOR+WORKGROUPS网络上开发并建立VISUAL+BASIC应用程序到EXCEL的DDE连接.pdf	http://sso.cdclib.org/interlibSSO/goto/6/=06190596Z93/kcms/detail/detail.aspx?dbCode=cjfq&filename=RJSJ199505002&dbname=CJFD9498
通用数据库编辑器的设计	软件世界	1995	1995年05期	【作者】 陶波 ； 【机构】 湖南省邮电管理局信息中心 ；	通用数据库 ； 管理信息系统 ； 应用系统 ； 窗口大小 ； 段号 ； 操作权限 ； 扩展功能 ； 库结构 ； 段名 ； 小数位 ；	<正> 在管理信息系统的开发中,最基本的操作是对数据库的操作。目前国内应用的数据库中仍以DBF类的数据库为主流产品。单位自行开发的应用系统中,大多数只能在屏幕上显示一条要操作的记录,上下记录、左右字段的操作很不直观不方便。在FoxBase中虽然提供BROW命令解决这一问题,但由于其窗口大小固定、色彩单一、功能简单,因此人们在实际很少使用它。 笔者在设计某管理信息系统中,模仿文本编辑器	1995年05期_通用数据库编辑器的设计.pdf	http://sso.cdclib.org/interlibSSO/goto/6/=06190596Z93/kcms/detail/detail.aspx?dbCode=cjfq&filename=RJSJ199505003&dbname=CJFD9498
数据库MEMO型字段绘图工具GDES的设计与应用	软件世界	1995	1995年05期	【作者】 叶颖生 ； 李鸿书 ； 【机构】 华北电力学院 ； 华北电力学院 ；	绘图工具 ； GDES ； MEMO ； 库文件 ； 信息管理 ； 命令行 ； 数据转换 ； 压缩存储 ； 编辑工具 ； FoxPro ；	<正> 目前在我国广泛使用的数据库管理系统(DBMS)一般都没有图形功能。从信息录入角度讲,这些系统不提供直接录入图形的工具,库文件也未设置图形字段;从信息管理角度讲,没有专门用于检索、分类、查找、观察和打印图形的命令和函数。FoxPro虽然增加了图形功能,但它只是实现库文件现有信息的图形化,例如将库文件中的数据转换为饼图、直方图等,而不是在库文件的某一字段直接录入和存储图形。	1995年05期_数据库MEMO型字段绘图工具GDES的设计与应用.pdf	http://sso.cdclib.org/interlibSSO/goto/6/=06190596Z93/kcms/detail/detail.aspx?dbCode=cjfq&filename=RJSJ199505004&dbname=CJFD9498
一种手工恢复文件的方法	软件世界	1995	1995年05期	【作者】 邓元木 ； 【机构】 北京理工大学 ；	文件分配表 ； 删除文件 ； 偏移量 ； 特征串 ； 编辑状态 ； 文件数据 ； 原文件 ； 元文件 ； 十六进制数 ； 屏幕提示 ；	<正> 一般来说,恢复文件的方法是这样的: 1)打开文件目录登记表,找到该文件对应的目录登记项,将其中第一个字节由E5H改回原来的字符。 2)从目录登记项中获取该文件的起始簇号和文件长度。从起始簇号出发自动或手工在文件分配表(FAT)中恢复出被删除文件的簇号链。 该方法隐含着待恢复文件同时满足下面三个条件:	1995年05期_一种手工恢复文件的方法.pdf	http://sso.cdclib.org/interlibSSO/goto/6/=06190596Z93/kcms/detail/detail.aspx?dbCode=cjfq&filename=RJSJ199505005&dbname=CJFD9498
UCDOS(3.1)特显功能及其使用	软件世界	1995	1995年05期	【作者】 马良 ； 【机构】 上海机械高等专科学校 ；	矢量汉字 ； 调用方法 ； 显示功能 ； 基本模块 ； 主要语言 ； 模式切换 ； UCDOS ； PASCAL ； 下昂 ； 命令行 ；	<正> UCDOS3.1最大的特色之一就是它所提供的特殊显示功能,该功能需要在启动UCDOS基本模块之后,再启动RDSL.COM和TX.COM块后方可使用。启动后,可在汉字环境下显示各种类型的矢量汉字、作图、模式切换乃至中断调用等等。这里,就几种主要语言的调用方法给出示例和说明,各特显功能的详细内	1995年05期_UCDOS(3.1)特显功能及其使用.pdf	http://sso.cdclib.org/interlibSSO/goto/6/=06190596Z93/kcms/detail/detail.aspx?dbCode=cjfq&filename=RJSJ199505006&dbname=CJFD9498
FoxPro2.5索引文件的使用技巧和应注意的一些问题	软件世界	1995	1995年05期	【作者】 王平 ； 【机构】 湖北广播发射台 ；	FoxPro2.5 ； 索引文件 ； 数据库应用系统 ； 索引标志 ； 数据库记录 ； 复合索引 ； 字符型 ； 命令行 ； 重复记录 ； 索引信息 ；	高效率地设计出速度高、适应性好的数据库应用系统,就必须正确、灵活地运用FoxPro的索引机制。本文结合FoxPro索引理论和实际使用的体会,举出了一些使用索引的技巧和应注意的问题。	1995年05期_FoxPro2.5索引文件的使用技巧和应注意的一些问题.pdf	http://sso.cdclib.org/interlibSSO/goto/6/=06190596Z93/kcms/detail/detail.aspx?dbCode=cjfq&filename=RJSJ199505007&dbname=CJFD9498
如何将高分辨率图形在打印机上放大输出	软件世界	1995	1995年05期	【作者】 汪前明 ； 【机构】 江苏省昆山油脂化工总厂 ；	图形输出 ； 高分辨率 ； 低分辨率 ； 打印输出 ； 硬拷贝 ； 文本方式 ； 换行 ； 神立 ； 国报 ； 一屏 ；	<正> 大家知道,用屏幕硬拷贝的方法,可以将屏幕上的图形输出到打印机,但是这种方法对于低分辨率的图形可以,而且输出的图形比屏幕上的图形小,对于高分辨率的图形,这种方法也就无能为力了。下面介绍一种实现高分辨率图形输出的方法,同样适用于低分辨	1995年05期_如何将高分辨率图形在打印机上放大输出.pdf	http://sso.cdclib.org/interlibSSO/goto/6/=06190596Z93/kcms/detail/detail.aspx?dbCode=cjfq&filename=RJSJ199505008&dbname=CJFD9498
C语言向DOS操作系统传输键盘命令的一种简便方法	软件世界	1995	1995年05期	【作者】 候万春 ； 【机构】 山东经济学校 ；	C语言 ； 应用软件 ； 编程原理 ； 批处理文件 ； 内存容量 ； 可执行程序 ； 返回值 ； TURBO ； 中项 ；	<正> 如果我们的计算机操作系统(DOS)上装有多种应用软件和多种汉字系统时,那么当启动机器时,由于内存容量以及软件之间兼容性等问题的存在,需要在AUTOEXEC.BAT文件中加入选择菜单,以实现按不同的要求使计算机执行不同应用软件以及不同汉字操作系统的目的。由于DOS操作系统不具有直接读取键盘按键的内部命令,因此编制此种菜单一般采用汇编语言。编程原理如下:	1995年05期_C语言向DOS操作系统传输键盘命令的一种简便方法.pdf	http://sso.cdclib.org/interlibSSO/goto/6/=06190596Z93/kcms/detail/detail.aspx?dbCode=cjfq&filename=RJSJ199505009&dbname=CJFD9498
优化Windows运行环境的一些体会	软件世界	1995	1995年05期	【作者】 崔智 ； 金西 ； 【机构】 中国科技大学 ； 中国科技大学 ；	运行环境 ； 软件配置 ； Windows ； 交换文件 ； 硬件配置 ； 高速缓存 ； 存取速度 ； 图形显示 ； 磁盘碎片 ； 环境变量 ；	<正> Windows运行效率的高低不仅仅与微机的性能有关,如何使微机以良好的性能高效运行Windows呢?解决的办法很简单,一需要高性能的硬件环境,二需要合理的软件配置。从我们的实践得知,在同一台微机上,经过优化处理过后运行Windows的效率比不作任何优化时高出20％—40％。为此,本文将从硬件、软件及运行环境三方面入手,全面探讨一下提高Windows运行效率的优化配置措施。1.加速Windows运行的最佳硬件配置	1995年05期_优化Windows运行环境的一些体会.pdf	http://sso.cdclib.org/interlibSSO/goto/6/=06190596Z93/kcms/detail/detail.aspx?dbCode=cjfq&filename=RJSJ199505010&dbname=CJFD9498
