title	journal_name	year	issue	author	keywords	summary	pdf_filename	article_url
软件学院应打造人才高地	软件世界	2010	2010年04期	【作者】 王建民 ； 【机构】 清华大学软件学院 ；	人才高地 ； 软件服务业 ； 软件学院 ； 软件工程硕士 ； 人才紧缺 ； 软件架构师 ； 人才教育 ； 信息系统 ； 产业发展过程 ； 软件人才培养 ；	<正>人是产业发展过程中的决定性因素,软件服务业的发展离不开人才的培养和发展,如何培养产业部门最急需的人才,是教育部门一直关注的事情。近20年来,中国软件服务业经历了从小到大、从无到有的发展历程。到2009年,软件服务业完成	2010年04期_软件学院应打造人才高地.pdf	http://sso.cdclib.org/interlibSSO/goto/6/=06190596Z93/kcms/detail/detail.aspx?dbCode=cjfq&filename=RJSJ201004010&dbname=CJFDLAST2014
绿色地球的IT责任	软件世界	2010	2010年04期	【作者】 梁念坚 ； 【机构】 微软大中华区 ；	气候变化 ； 技术创新 ； 信息技术 ； 碳排放量 ； 企业战略发展 ； 沃尔沃集团 ； 全球变暖 ； 这个世界 ； 麦肯 ； 革新者 ；	<正>技术创新不是应对环境可持续发展和气候变化挑战的唯一解决方案,但我们相信,信息技术将扮演至关重要的角色。我们相信,信息技术在应对环境可持续发展和气候变化挑战方面将扮演至关重要的角色。今天,我们在环境问	2010年04期_绿色地球的IT责任.pdf	http://sso.cdclib.org/interlibSSO/goto/6/=06190596Z93/kcms/detail/detail.aspx?dbCode=cjfq&filename=RJSJ201004011&dbname=CJFDLAST2014
中国搜索市场的变与不变	软件世界	2010	2010年04期	【作者】 郑高飞 ；	内地市场 ； 谷歌 ； 搜狗拼音 ； 网页搜索 ； 访客 ； 腾讯 ； 评论人士 ； 数据统计 ； 用户体验 ； 国内市场 ；	<正>变化的是各个搜索引擎产品的市场份额,不变的是国内市场创新不断。从长期来看,中国搜索引擎市场的发展仍有巨大的潜力。谷歌离开中国内地市场了,喧嚣过后,我们发现其对中国搜索市场并没有带来大的变化。虽然之前	2010年04期_中国搜索市场的变与不变.pdf	http://sso.cdclib.org/interlibSSO/goto/6/=06190596Z93/kcms/detail/detail.aspx?dbCode=cjfq&filename=RJSJ201004012&dbname=CJFDLAST2014
云计算使软件危机更加紧迫	软件世界	2010	2010年04期	【作者】 赵文银 ； 【机构】 中国电子学会云算专家委员会 ；	软件危机 ； 软件开发 ； 软件工程 ； 软件生产 ； 计算机软件 ； 维护过程 ； 需求模型 ； 软件成本 ； 网络服务 ； 逻辑模型 ；	<正>软件危机是指落后的软件生产方式无法满足迅速增长的计算机软件需求,从而导致软件开发与维护过程中出现一系列严重问题的现象。而云计算的出现引发了一个新的软件危机——数量增长危机。上世纪80年代以来,软件工程研究与实践取得了可喜的成就,软件技术水平有了长足的进展,但是软件工程	2010年04期_云计算使软件危机更加紧迫.pdf	http://sso.cdclib.org/interlibSSO/goto/6/=06190596Z93/kcms/detail/detail.aspx?dbCode=cjfq&filename=RJSJ201004013&dbname=CJFDLAST2014
寻找网络营销背后的技术动力	软件世界	2010	2010年04期	【作者】 王占波 ；	创业经验 ； 投放效果 ； 用户属性 ； 研发经验 ； 网站资源 ； 用户体验 ； 数据分析 ； 营销平台 ； 页面内容 ； 可真 ；	<正>有过两次创业经验的悠易互通CEO刘竣丰坚决推崇技术的力量,追求以技术为核心价值驱动也就自然成为公司的应有之义。就像满眼科技蓝的前台一样,刘竣丰的话题总是充满了对技术的热情和希冀。这位悠易互通(北京)	2010年04期_寻找网络营销背后的技术动力.pdf	http://sso.cdclib.org/interlibSSO/goto/6/=06190596Z93/kcms/detail/detail.aspx?dbCode=cjfq&filename=RJSJ201004014&dbname=CJFDLAST2014
当药店遇到互联网	软件世界	2010	2010年04期	【作者】 苏达 ；	互联网经济 ； 药品零售业 ； 网上药店 ； 第一年 ； 医药行业 ； 薛峰 ； 呼叫中心 ； 医药零售 ； 技术创造 ； 网站平台 ；	<正>在互联网经济和IT技术的介入下,药品零售业正在发生变革。药房网以技术改善服务,促进模式创新,成为行业引领者。销售额1 .8亿元,这是药房网2009年的销售额。虽然数字不算太大,但相较于药房网上线第一年获得的500万销	2010年04期_当药店遇到互联网.pdf	http://sso.cdclib.org/interlibSSO/goto/6/=06190596Z93/kcms/detail/detail.aspx?dbCode=cjfq&filename=RJSJ201004015&dbname=CJFDLAST2014
定格西行 ——IBM软件之变	软件世界	2010	2010年04期	【作者】 卢敏 ； 李玲玲 ；	软件集团 ； IBM ； 副总裁 ； 陕西省副省长 ； 业务分析 ； 大中华区 ； Mills ； 西部市场 ； 古城西安 ； 软件业务 ；	<正>2010年3月23日,古城西安。陕西省副省长景俊海与IBM软件集团掌门人、全球高级副总裁兼软件集团总经理Steve Mills成功握手。随后,Steve Mills宣布了多项针对西部市场的重要举措。上篇:与我"西行"在西部大开发10周年	2010年04期_定格西行+——IBM软件之变.pdf	http://sso.cdclib.org/interlibSSO/goto/6/=06190596Z93/kcms/detail/detail.aspx?dbCode=cjfq&filename=RJSJ201004016&dbname=CJFDLAST2014
用友“画饼”	软件世界	2010	2010年04期	【作者】 李玲玲 ；	用友软件 ； 王文京 ； 市场占有率 ； 战略布局 ； 用友公司 ； 企业财务分析 ； 北京方正 ； 经常性损益 ； 电子商务服务 ； 管理软件厂商 ；	虽然用友致远"佣金门"有一阵子弄得王文京和用友有点灰头土脸,可毕竟它在王文京的"大用友"战略里还只是个小插曲。此时的用友,更多是忙于四处挥舞它手中的并购大棒,从产品到业务、甚至渠道积极扩充版图,争做中国SAP。	2010年04期_用友“画饼”.pdf	http://sso.cdclib.org/interlibSSO/goto/6/=06190596Z93/kcms/detail/detail.aspx?dbCode=cjfq&filename=RJSJ201004017&dbname=CJFDLAST2014
海辉软件上市猜想	软件世界	2010	2010年04期	【作者】 王占波 ；	执行董事长 ； 孙振耀 ； 公司计划 ； 行业格局 ； 总体策略 ； 国际金融公司 ； 美元贬值 ； 旧话重提 ； 全球运营 ； 提供商 ；	<正>虽然上市传言一直就有,海辉软件此次的海外上市仍有特殊的意义,其展示了国内软件外包企业实力的增强和对于市场的信心。近日,IT外包企业海辉软件执行董事长孙振耀向媒体表示公司计划在美国上市。虽然没有透露其它具体细	2010年04期_海辉软件上市猜想.pdf	http://sso.cdclib.org/interlibSSO/goto/6/=06190596Z93/kcms/detail/detail.aspx?dbCode=cjfq&filename=RJSJ201004018&dbname=CJFDLAST2014
福昕:把中国软件卖到海外去	软件世界	2010	2010年04期	【作者】 李玲玲 ；	中国软件 ； 张亚勤 ； 研发集团 ； 剑走偏锋 ； 企业级产品 ； 行业解决方案 ； 知名网站 ； 通用软件 ； 终端仿真 ； 技术门槛 ；	<正>曾几何时,国内猖獗的盗版让B2C型软件公司难有立锥之地,但这也迫使一直在硅谷打拼的熊雨前不得不剑走偏锋,怀揣他的PDF技术到海外去创业,求发展。熊雨前在北京的办公地点距离他在科大少年班校友张亚勤所在的微软亚太研发集团仅一路之隔。虽然与	2010年04期_福昕:把中国软件卖到海外去.pdf	http://sso.cdclib.org/interlibSSO/goto/6/=06190596Z93/kcms/detail/detail.aspx?dbCode=cjfq&filename=RJSJ201004019&dbname=CJFDLAST2014
网宿科技:创业板年报最差股被看空还为时过早	软件世界	2010	2010年04期	【作者】 李亮 ；	网宿科技 ； 看空 ； 彭清 ； 公司公告 ； 公司成长性 ； 招商证券 ； 业绩压力 ； 另一面 ； 游戏运营商 ； 圈钱 ；	<正>虽然登陆创业板仅4个多月,就爆出公司两位高管辞职,且在陆续披露业绩的23家创业板上市公司中年报表现也最烂,但此时顾头难顾尾的网宿科技其实还有它的另一面。几乎与创业板一同成长起来的网宿科技(300017.52)最近可谓麻烦缠身。先是2010年3月10H,公司公告称董事及总经理彭清	2010年04期_网宿科技:创业板年报最差股被看空还为时过早.pdf	http://sso.cdclib.org/interlibSSO/goto/6/=06190596Z93/kcms/detail/detail.aspx?dbCode=cjfq&filename=RJSJ201004020&dbname=CJFDLAST2014
HCL吹响“本地化”号角	软件世界	2010	2010年04期	【作者】 尚可 ；	外包公司 ； 国际金融危机 ； 行业解决方案 ； HCL ； 大中华地区 ； 大中华区 ； 外包市场 ； 中国市场 ； 人力资源成本 ； 软通动力 ；	<正> 与印度其他四大外包公司一样,HCL也希望能够在中国开疆扩土。 "不要将所有的鸡蛋放进同一个篮子里。"这本来是针对投资者的这句名言,印度的IT外包巨头们正在品尝这句话中的滋味——他们60%的收入来源于美国市场;不幸的是,其中绝大多数来自于金融领域。随着国际金融危机的爆发,印度IT外包巨头们眼睁睁地看着装着所有鸡蛋的篮子向地面摔去。	2010年04期_HCL吹响“本地化”号角.pdf	http://sso.cdclib.org/interlibSSO/goto/6/=06190596Z93/kcms/detail/detail.aspx?dbCode=cjfq&filename=RJSJ201004021&dbname=CJFDLAST2014
云端北高——上海2010年信息服务业巡礼(系列二)	软件世界	2010	2010年04期	【作者】 相春雷 ；	信息服务业 ； 国家高技术 ； 最佳模式 ； 市北 ； 北高 ； 网络游戏运营 ； 产业基地 ； 全球信息技术 ； 软件服务业 ； 高技术产业 ；	<正>信息服务业与产业园区结合是实现传统行业与信息服务业双赢的最佳模式,云计算落地北高新技术服务园区走出了自己的模式。国家高技术产业基地-上海市北高新技术服务业园区是国家发改委命名的省市级开发区,并以建设国家级高技术产	2010年04期_云端北高——上海2010年信息服务业巡礼(系列二).pdf	http://sso.cdclib.org/interlibSSO/goto/6/=06190596Z93/kcms/detail/detail.aspx?dbCode=cjfq&filename=RJSJ201004022&dbname=CJFDLAST2014
国际智能旅游岛	软件世界	2010	2010年04期	【作者】 相春雷 ；	旅游岛 ； 产业联盟 ； 旅游信息化 ； 综合保税区 ； 手机产业链 ； 软件产业基地 ； 国家应急管理 ； 创意产业基地 ； 设计商 ； 手机市场 ；	<正>海南生态软件园以"国际旅游岛"建设为契机,以龙头企业为先导,建立旅游信息化产业联盟,沐浴在阳光之下,徜徉在沙滩之中;带着浪花的海水一会儿漫过脚背,一会儿又退回海中;风中飘来阵阵清香,那是不远	2010年04期_国际智能旅游岛.pdf	http://sso.cdclib.org/interlibSSO/goto/6/=06190596Z93/kcms/detail/detail.aspx?dbCode=cjfq&filename=RJSJ201004023&dbname=CJFDLAST2014
盐城国际软件园:软件蓝领基地	软件世界	2010	2010年04期	【作者】 刘东海 ；	软件蓝领 ； 土地面积 ； 地方政策 ； 互联网实验室 ； 巨人网络 ； 金算盘 ； 第九城市 ； 宝信软件 ； 汉王科技 ； 中国电子报 ；	<正>盐城素有"黄海明珠"的美称,为了发展软件和外包产业,盐城制定优惠的地方政策,诚邀IT企业和高端人才加盟。盐城,素有"黄海明珠"的美称,因盐得名,历2100年春秋,被誉为"东方湿地之都",人口815万,土地面积1 .69万平	2010年04期_盐城国际软件园:软件蓝领基地.pdf	http://sso.cdclib.org/interlibSSO/goto/6/=06190596Z93/kcms/detail/detail.aspx?dbCode=cjfq&filename=RJSJ201004024&dbname=CJFDLAST2014
系统集成资质“蝶变”	软件世界	2010	2010年04期	【作者】 杨军 ； 黄锦云 ； 【机构】 中国软件评测中心 ；	系统集成 ； 资质认证 ； 液晶屏幕 ； 电子显示屏 ； 评审机构 ； 审核员 ； 信息系统工程 ； 工业和信息化部 ； 现场评审 ； 资质认定 ；	<正>经过多年实践,系统集成资质认证政策既成就了企业的"蝶变",也得到了用户的认可。在共和国六十年华诞的庆典上,天安门广场两侧竖立起了四块十多米高的巨型电子液晶屏幕,屏幕上播放的	2010年04期_系统集成资质“蝶变”.pdf	http://sso.cdclib.org/interlibSSO/goto/6/=06190596Z93/kcms/detail/detail.aspx?dbCode=cjfq&filename=RJSJ201004025&dbname=CJFDLAST2014
戴尔:从卖电脑到卖服务	软件世界	2010	2010年04期	【作者】 王卢波 ；	高管团队 ； 迟到者 ； 服务转型 ； 尔公 ； 彼得 ； 环境复杂性 ； 美国运输部 ； 基础设施服务 ； 副总裁 ； 端对端 ；	<正> 作为一位市场迟到者,戴尔向服务转型并不令人惊讶,却给予人们许多想象空间。这也许是一条并不令人惊讶的新闻,但对于戴尔公司而言,却是业务转型的关键一步。2010年3月24日,新组建的戴尔服务中国高管团队正式亮相北京。戴尔公司董事长兼首席执行官迈克尔·戴尔表示,随着业务不断发展,越来越发现服务在IT行业的重要性。需要提供"一揽子"解决方案才能全	2010年04期_戴尔:从卖电脑到卖服务.pdf	http://sso.cdclib.org/interlibSSO/goto/6/=06190596Z93/kcms/detail/detail.aspx?dbCode=cjfq&filename=RJSJ201004026&dbname=CJFDLAST2014
亚马逊:现金奶牛的商业模式创新	软件世界	2010	2010年04期	【作者】 刘勇 ；	商业模式创新 ； 电子商务公司 ； 业务多元化 ； 消费电子产品 ； 技术创新 ； 亚马逊网站 ； 亚马逊公司 ； 京东商城 ； 流媒体服务 ； 购物模式 ；	<正>亚马逊业务多元化的背后有着清晰的逻辑,在技术创新的同时注重商业模式的创新,确保新业务能够带来持续稳健的盈利。在大部分人眼里,亚马逊是一家典型的BZC电子商务公司,靠在网上贩卖廉价的图书和消费电子产品赚钱。然而	2010年04期_亚马逊:现金奶牛的商业模式创新.pdf	http://sso.cdclib.org/interlibSSO/goto/6/=06190596Z93/kcms/detail/detail.aspx?dbCode=cjfq&filename=RJSJ201004027&dbname=CJFDLAST2014
搜索的核心价值	软件世界	2010	2010年04期	【作者】 仓剑 ； 【机构】 软件与信息服务业研究中心 ；	搜索服务 ； 新闻集团 ； 内容和形式 ； 雅虎 ； 谷歌 ； 计算技术 ； 文本内容 ； 国家图书馆 ； 图书馆检索 ； 目录索引 ；	<正>搜索服务本身是一种内容生产商没提供的新价值,而且这种价值还远不是帮助读者找到信息那么简单。最近有两则消息将搜索引擎与内容提供方的关系问题又推向舆论浪尖。首先,新闻集团宣布计划终结旗下所有的	2010年04期_搜索的核心价值.pdf	http://sso.cdclib.org/interlibSSO/goto/6/=06190596Z93/kcms/detail/detail.aspx?dbCode=cjfq&filename=RJSJ201004028&dbname=CJFDLAST2014
零售业CRM应用突破之道	软件世界	2010	2010年04期	【作者】 陈渊源 ；	企业应用系统 ； 尔玛 ； 整体规划 ； 连锁零售 ； 市场经济体制 ； 电子数据交换 ； 家乐 ； CRM ； 企业流程 ； 业务流程 ；	<正>CRM是综合性的企业应用系统,其实施应用需要对症下药,用整体规划,分步实施的原则来指导行动,才会持续成功。随着我国市场经济体制日趋完善,连锁超市发展迅速,尤其是沃尔玛、家乐福等这些世界连锁零售巨头纷纷	2010年04期_零售业CRM应用突破之道.pdf	http://sso.cdclib.org/interlibSSO/goto/6/=06190596Z93/kcms/detail/detail.aspx?dbCode=cjfq&filename=RJSJ201004029&dbname=CJFDLAST2014
西堤岛:信息化缔造品位营销	软件世界	2010	2010年04期	【作者】 周志 ；	商务休闲 ； 信息管理 ； 巴克 ； 铺上 ； 客户分析 ； coffee ； 市场布局 ； 二三线城市 ； 一线城市 ； 一级城市 ；	<正>咖啡馆定位的背后是信息管理。通过客户分析,信息技术助力西堤岛定位为"中国新型高档商务休闲咖啡"。宽敞的商务包间,松软的大沙发。在西堤岛咖啡中关村店里面,你感受到的是一种放松、惬意。铺上桌台就是一	2010年04期_西堤岛:信息化缔造品位营销.pdf	http://sso.cdclib.org/interlibSSO/goto/6/=06190596Z93/kcms/detail/detail.aspx?dbCode=cjfq&filename=RJSJ201004030&dbname=CJFDLAST2014
SaaS开启事务所新时代	软件世界	2010	2010年04期	【机构】 CCH(Commerce Clearing House)公司 ；	会计师事务所 ； 知识员工 ； SaaS ； 商业战略 ； 审计专业 ； 主机托管 ； 盈利能力 ； 实践工具 ； 商业决策 ； 知识管理系统 ；	<正>在当前经济形势下,会计师事务所也必须更密切地关注在技术方面的投资回报,进而才能保持良好的财务灵活性。因此,SaaS对事务所的吸引力将会越来越强。据调查,知识员工需要花费15%一35%的时间来查找工作所需的信息,而这其中40%的时间,他们一无所获。68%的高	2010年04期_SaaS开启事务所新时代.pdf	http://sso.cdclib.org/interlibSSO/goto/6/=06190596Z93/kcms/detail/detail.aspx?dbCode=cjfq&filename=RJSJ201004031&dbname=CJFDLAST2014
大卸“商业智能”(系列三)	软件世界	2010	2010年04期		商业智能 ； 装饰工程 ； 面子工程 ； 销售记录 ； 产品销售 ； 小资 ； 国际厂商 ； 局部应用 ； 上档 ；	<正>BI不再是高高在上的"面子工程"或者"装饰工程",在我们的生活中处处可以见到BI的身影。真实的案例能说明一切问题。本专题将分四期,从多个维度为读者大卸"商业智能"。系列三::以某行业为例,呈现最真实商业智能实战	2010年04期_大卸“商业智能”(系列三).pdf	http://sso.cdclib.org/interlibSSO/goto/6/=06190596Z93/kcms/detail/detail.aspx?dbCode=cjfq&filename=RJSJ201004032&dbname=CJFDLAST2014
挖掘数据背后的价值	软件世界	2010	2010年04期	【作者】 王占波 ；	商业智能系统 ； 中芯国际 ； 集成电路制造 ； 分析平台 ； 大型制造 ； 系统监控 ； 封装测试 ； 代工企业 ； 测试服务 ； 易用性 ；	<正>半导体行业不缺乏数据,而是数据太多。通过应用商业智能系统,中芯国际在半年的时间里,因为机器异常造成的产品损失减少了数十万美元。这是一家敢于在自我介绍里多次使用"最"的企业。中芯国际的全称为中芯国际集成电路制造有限公司(以下简称	2010年04期_挖掘数据背后的价值.pdf	http://sso.cdclib.org/interlibSSO/goto/6/=06190596Z93/kcms/detail/detail.aspx?dbCode=cjfq&filename=RJSJ201004033&dbname=CJFDLAST2014
商业智能规范先行	软件世界	2010	2010年04期	【作者】 相春雷 ；	商业智能 ； 中国医药集团 ； 知春路 ； 中央管理 ； 业务一体化 ； 国药集团 ； 医药科研 ； 复杂数据类型 ； 信息化专家 ； 商业人士 ；	<正>中国医药集团总公司用商业智能反推企业信息化建设,可以说独树一帜,有很好的借鉴意义。中国医药集团总公司(以下简称:国药集团)在知春路的办公大楼质朴简约,丝毫感觉不到这是一个中央管理	2010年04期_商业智能规范先行.pdf	http://sso.cdclib.org/interlibSSO/goto/6/=06190596Z93/kcms/detail/detail.aspx?dbCode=cjfq&filename=RJSJ201004034&dbname=CJFDLAST2014
玩转SOA	软件世界	2010	2010年04期	【作者】 Sihvung Park ； 张新 ；	SOA ； 标准化协议 ； 公共接口 ； 互操作性 ； UDDI ； 服务结构 ； 服务计算 ； 功能描述 ； 特定服务 ； WSDL ；	<正>将SOA和一个伴随大多数人(在还是小孩时)成长的玩具做类比,能让SOA简单化。虽然SOA已经存在多年,但是SOA究竟是什么仍然令人费解。许多初学SOA的人常常注重前期的细节和信息而忽略了	2010年04期_玩转SOA.pdf	http://sso.cdclib.org/interlibSSO/goto/6/=06190596Z93/kcms/detail/detail.aspx?dbCode=cjfq&filename=RJSJ201004035&dbname=CJFDLAST2014
稳步推动“云”速前进	软件世界	2010	2010年04期	【作者】 尚可 ；	赛门铁克 ； 信息安全 ； 数据中心 ； 移动系统 ； 导航软件 ； 服务组合 ； 防病毒 ； 结构化数据 ； 共享系统 ； 平台级 ；	<正> 高可靠性、高通用性、高扩展性、高性价比,云计算以传统数据中心无法比拟的优势特性,正在成为企业实现降低运营和管理成本、提高效率的首要选择。 2010年3月,清华大学高能所所长郑维民、山西移动系统规划设计师卢山先生、赛门铁克中国区首席数据中心架构顾问郑欣蕾以及赛门铁克资深信息安全	2010年04期_稳步推动“云”速前进.pdf	http://sso.cdclib.org/interlibSSO/goto/6/=06190596Z93/kcms/detail/detail.aspx?dbCode=cjfq&filename=RJSJ201004036&dbname=CJFDLAST2014
LinuX OS新贵:MeeGo	软件世界	2010	2010年04期	【作者】 卢敏 ；	智能操作系统 ； LinuX OS ； MeeGo ； 便携式笔记本 ； 硬件芯片 ； Orange ； 意大利电信 ； 参考设计 ； 平板电脑 ； 终端设备 ；	<正>MeeGo出生原因,说来简单,英特尔和诺基亚要合力专注于一个共同的平台,携手谋求更大的事业,而不是单独煞费心神地烹调两份的羹汤。在刚刚结束的巴塞罗那2010世界移动大会上,Linux智能操作系统家族两股势力合并,即英特尔的Mobhn与诺	2010年04期_LinuX+OS新贵:MeeGo.pdf	http://sso.cdclib.org/interlibSSO/goto/6/=06190596Z93/kcms/detail/detail.aspx?dbCode=cjfq&filename=RJSJ201004037&dbname=CJFDLAST2014
工具云:工具随需自取	软件世界	2010	2010年04期	【作者】 卢敏 ；	软件产品 ； 工具管理 ； 软件交付 ； 配置管理 ； 软件开发工具 ； 桌面程序 ； 软件供应商 ； 应用开发工具 ； 使用工具 ； 卡迪 ；	<正>通过工具云能够有效地进行软件交付、管理,可以迅速进行人员的更换、调配,而且软件的使用不需要预先安装,即零安装。它使得人员的调配在几分钟之内就可以完成。记者随机采访了10家百人规模左右的企业IT管理者,咨询他们是否了解公司的软件产品有哪些许可证,这些许	2010年04期_工具云:工具随需自取.pdf	http://sso.cdclib.org/interlibSSO/goto/6/=06190596Z93/kcms/detail/detail.aspx?dbCode=cjfq&filename=RJSJ201004038&dbname=CJFDLAST2014
数据仓库突破者	软件世界	2010	2010年04期	【作者】 尚可 ；	数据仓库 ； 并行处理 ； 企业级软件 ； 数据库管理系统 ； 数据引擎 ； 并行计算能力 ； 关系数据库 ； 大规模数据 ； 数据库系统 ； 金辉 ；	<正>Greenplum真正发挥了并行无处不在的优势。究其原因,在于它独特的MPP并行处理架构和传统的SMP模式不同。数据仓库(DW)早已是业界非常成熟的技术,正因为如此,突破也变得尤其困难。不过Gartner分析师Donald Feinberg对G	2010年04期_数据仓库突破者.pdf	http://sso.cdclib.org/interlibSSO/goto/6/=06190596Z93/kcms/detail/detail.aspx?dbCode=cjfq&filename=RJSJ201004039&dbname=CJFDLAST2014
移动支付推动银行卡应用	软件世界	2010	2010年04期	【作者】 吴娓娓 ； 张明燕 ； 【机构】 中国软件评测中心 ；	移动支付 ； 应用模式 ； 金融支付 ； 信息技术 ； 电话费 ； 银联 ； 网上银行系统 ； 验收测试 ； 软件平台 ； 战略规划 ；	<正>银联提出了"随支付"的战略规划,市民随时随地都能享受到一站式金融服务,北京海科融通信息技术有限公司的产品正是这一应用模式的代表。不得不承认网上银行的发展很快,这得益于互联网技术的飞速发展,各大银行的努力推动肯电子商务的蓬勃发展,但是我们也看到	2010年04期_移动支付推动银行卡应用.pdf	http://sso.cdclib.org/interlibSSO/goto/6/=06190596Z93/kcms/detail/detail.aspx?dbCode=cjfq&filename=RJSJ201004040&dbname=CJFDLAST2014
OBA平台让微软Office不再是简单的办公套件	软件世界	2010	2010年04期	【作者】 李玲玲 ；	办公套件 ； OBA ； Outlook ； 桌面程序 ； 应用系统 ； 应用程序 ； 可扩展的 ； 核心业务系统 ； 办公应用 ； 工作效率 ；	<正> 0BA(Office Business Application)是什么?微软工程师给我们举了一个形象的例子。在OBA平台,通过SharePoint、Outlook、Word、Excel、Infopath等常用office软件,能快速实现数据在服务器和客户端的部署和传送,并且它还提供将其他应用系统如DB2、SAP、Oracle等的整合。通过将所需信息和系统功能集成到桌面程序,就有机会提高工作效率。这类	2010年04期_OBA平台让微软Office不再是简单的办公套件.pdf	http://sso.cdclib.org/interlibSSO/goto/6/=06190596Z93/kcms/detail/detail.aspx?dbCode=cjfq&filename=RJSJ201004041&dbname=CJFDLAST2014
红旗软件发布inMini尚巧版	软件世界	2010	2010年04期	【作者】 卢敏 ；	inMini ； 软件发布 ； 移动互联网设备 ； Nokia ； 移动互联网终端 ； 用户体验 ； 互联网市场 ； 移动终端 ； 开源技术 ； 应用软件 ；	<正> 移动互联网的发展日渐步入快车道。中国消费者对在移动互联网终端和云端设备上获得卓越的用户体验的需求也越发强烈。日前,Intel联合Nokia共同发布了新一代针对移动终端的智能操作平台——MeeGo。红旗软件适时而动,推出最新基于MeeGo的移动互联网设备操作系统——红旗inMini尚巧版。红旗inMini尚巧版操作系统贴合时尚、轻巧概念,基于开源平台MeeGo,融	2010年04期_红旗软件发布inMini尚巧版.pdf	http://sso.cdclib.org/interlibSSO/goto/6/=06190596Z93/kcms/detail/detail.aspx?dbCode=cjfq&filename=RJSJ201004042&dbname=CJFDLAST2014
