title	journal_name	year	issue	author	keywords	summary	pdf_filename	article_url
巧用CCED 5.0制作多字体多种效果的汉字封面	软件世界	1994	1994年09期	【作者】 严煜 ； 【机构】 仪征市仪化公司 ；	软件系统设计 ； 图像文件 ； CCED 5.0 ； 打印输出 ； 模拟显示 ； 命令窗口 ； 图形文件 ； 图形显示 ； 当前目录 ； ESC ；	<正> 虽然有许多的西文原版软件(如BANNER标题狂)等可以制作精美的封面,但对于许多的软件系统设计人员来说,要实现汉字封面的制作确实是一件令人头疼的问题。笔者在使用中发现,利用最新版的CCED 5.0可以很好地解决这个问题。 首先我们在CCED 5.0的编辑窗口中进行封面汉字的输入、字形的选择,以及效果的控制等,然后通过其打印窗口中的模拟显示功能进行调试。一切都制作好以后,我们再选择打印命令,此时屏幕将出现打印命令窗口,按M键修改打印参数,并按光标键选择修改打印输出方向,按空格键选择输出图像文件。当我们再按ESC键确认选择时,屏幕将提示输入图像文件名,在这里我们假设为DEMO。进行完	1994年09期_巧用CCED+5.0制作多字体多种效果的汉字封面.pdf	http://sso.cdclib.org/interlibSSO/goto/6/=06190596Z93/kcms/detail/detail.aspx?dbCode=cjfq&filename=RJSJ199409012&dbname=CJFD9498
西文DOS下实现汉字的镶边、空心和放大	软件世界	1994	1994年09期	【作者】 李猛 ； 【机构】 黑龙江省邮电管理局教育中心 ；	语言程序 ； DOS ； 使用效果 ； 指定位置 ； 空心字 ； 任意键 ； 起始点 ； 边界点 ； 字间距 ； 初始参数 ；	<正> 要设计一个友好的软件封面,其中的标题最好用大一点的字写出,然后再进一步加以修饰,这无疑会大大渲染气氛,增强软件的使用效果。本文提供的C语言程序实现了在西文DOS下汉字镶边、空心和放大的一系列过程,并在AT&T286上,Turbo C2.0编译下执行通过,效果良好	1994年09期_西文DOS下实现汉字的镶边、空心和放大.pdf	http://sso.cdclib.org/interlibSSO/goto/6/=06190596Z93/kcms/detail/detail.aspx?dbCode=cjfq&filename=RJSJ199409013&dbname=CJFD9498
注意网络多用户软件设计中的数据串户现象	软件世界	1994	1994年09期	【作者】 郭昕兢 ； 【机构】 福建省立医院 ；	软件设计 ； 多用户系统 ； 病人信息 ； FOXPRO ； 加锁 ； 冲掉 ； replace ； 后应 ； offset ； blank ；	<正> 数据串户:生成甲记录的数据会生成到乙记录中去或甲记录的数据被乙记录冲掉。下面这个例子程序是用FOXBASE或FOXPRO编制的,她是从作者编制的住院部网络多用户系统中截取出来并简化了,其功能是完成住院病人信息输入。 程序中的住院号是医院为住院病人编制的流水号,但它不同于记录号,当一个新病人入院时,数据库追加一条新的空记录,同时把上一条记录的住院号加1替换到新空记录的住院号中。在多台终端同时输入时,当终端A生成了一个带X病人住院号的空记录(第8—22句),程序(ZZ.PRG)执行到姓名和职业输入时(第24—27句),此时,终端B又在数据库末尾又追加一个带住院号的Y病人空记录(第8—22句),这时,终端A已输完姓名和职业,经确认后应把姓名和职业替换到X病人空记录中(第28—39句),如果在程序(ZZ.PRG)第38句处用“go bott”,就会把终端A的X病人的数据替换到终端B的Y病人空记录上,这时,如果终端B病人Y也执行完姓	1994年09期_注意网络多用户软件设计中的数据串户现象.pdf	http://sso.cdclib.org/interlibSSO/goto/6/=06190596Z93/kcms/detail/detail.aspx?dbCode=cjfq&filename=RJSJ199409014&dbname=CJFD9498
一种挽救部分受损的BACKUP备份文件的方法	软件世界	1994	1994年09期	【作者】 白晓明 ； 【机构】 重庆电力职工大学 ；	备份文件 ； BACKUP ； 控制文件 ； 标志位 ； 文在 ； 入第 ； 书写习惯 ； 部本 ； 编辑功能 ； 下丈 ；	<正> DOS外部命令中的BACKUP命令,可将一个或多个文件制作备份,并在备份盘上形成两个文件:主存文件BACKUP.XXX和控制文件CONTROL.XXX。在主存文件BACKUP.XXX中,所备份的文件	1994年09期_一种挽救部分受损的BACKUP备份文件的方法.pdf	http://sso.cdclib.org/interlibSSO/goto/6/=06190596Z93/kcms/detail/detail.aspx?dbCode=cjfq&filename=RJSJ199409015&dbname=CJFD9498
硬盘主引导区损坏的预防和补救措施	软件世界	1994	1994年09期	【作者】 姜得晟 ； 【机构】 西安煤矿设计院 ；	硬盘分区 ； 引导区 ； 计算机应用 ； 写回 ；	<正> 在当今的计算机应用中,计算机病毒的危害越来越严重,许多病毒发作时直接破坏硬盘的主引导区,使硬盘分区信息彻底丢失,硬盘上的数据也随之完全丢失。在这种情况下,一般就只好重新用FDISK对硬盘进行分区,然后重新格式化每一个分区。如此,给不同的用户造成了不同程度的损失。笔者就多次遭遇这种情况,近来想出一种预防和补救的方法。其基本思想是:先将无病毒的硬盘主引导区的信息备份到一张软盘上的引导区中保存好,当硬盘主引导区被破坏时,再将其复制到硬盘主引导区中即可使硬盘恢复如初;如果事先未备份无病毒的硬盘主引导区,还可以找或造一个与你的硬盘大小和分区	1994年09期_硬盘主引导区损坏的预防和补救措施.pdf	http://sso.cdclib.org/interlibSSO/goto/6/=06190596Z93/kcms/detail/detail.aspx?dbCode=cjfq&filename=RJSJ199409016&dbname=CJFD9498
Authorware Professional——交互式多媒体创作工具	软件世界	1994	1994年09期	【作者】 黄晓地 ； 【机构】 华南师范大学 ；	交互式多媒体 ； 创作工具 ； 编程环境 ； 面向对象的 ； 应用系统 ； 应用程序 ； 声音文件 ； 流程线 ； 程序结构 ； 图像操作 ；	<正> Authorware Professional是面向开发交互式多媒体应用系统的创作工具,它能让非计算机人员不用编程,就能开发出生动活泼的交互式多媒体应用程序。它的出现被认为是创作工具的一场革命。一、面向对象、交互式的图标编程环境 Authorware面向对象的编程环境,易学易用,形象直观。进入Authorware Professional,打开窗口:	1994年09期_Authorware+Professional——交互式多媒体创作工具.pdf	http://sso.cdclib.org/interlibSSO/goto/6/=06190596Z93/kcms/detail/detail.aspx?dbCode=cjfq&filename=RJSJ199409017&dbname=CJFD9498
UNIFACE——强劲的第四代开发环境	软件世界	1994	1994年09期	【作者】 王建华 ； 【机构】 邢台市计划生育委员会 ；	开发环境 ； UNIFACE ； 系统开发工具 ； 用户界面 ； 数据库类型 ； Uniform ； 文件管理系统 ； 数据源 ； 硬件平台 ； 系统需求分析 ；	<正> UNIFACE是第四代开发工具的一个典型代表,以其强大的功能,良好的用户界面,极高的开发效率获得了用户的一致好评,流行于欧美市场,在1993年美国《Computer World》杂志信息系统开发工具的用户评比中勇夺第一。UNIFACE也已开始进入中国市场。 UNIFACE由Unique,Uniform,Universal和Inter-face四个英语单词组成,从这四个词可以看出开发者的宏伟目标,生产该产品的公司的名称也为Uni-face,其总部设在荷兰。用户以该工具开发的产品,可以独立于硬件平台、操作系统、数据库、网络、用户	1994年09期_UNIFACE——强劲的第四代开发环境.pdf	http://sso.cdclib.org/interlibSSO/goto/6/=06190596Z93/kcms/detail/detail.aspx?dbCode=cjfq&filename=RJSJ199409018&dbname=CJFD9498
常用压缩软件的选择和使用方法	软件世界	1994	1994年09期	【作者】 赫建 ； 【机构】 第一汽车集团模具中心 ；	压缩软件 ； 基本使用方法 ； 综合指标 ； 盘符 ； 压缩率 ； 备份文件 ； 文件压缩 ； 缺省 ； 删除文件 ； 帮助信息 ；	<正> 目前,各种压缩软件逐渐增多,相应地介绍和测试等文章也经常见诸于报刊,究竟哪些最实用和基本的使用方法如何?笔者以自己的实际经验谈点用法,仅供读者参考。 各种压缩软件当然是各有千秋,其中也有许多是逐步演变而来的,如LHA系列含LHARC和ICE等,没有必要用一大堆压缩软件,只要选择其中最实用的即可。压缩软件以压缩率大并占用时间少为优,但这两者是一个矛盾,取其综合指标最佳为原则。根据笔者的实际经验和测试文章,以LHA和ARJ较为突出,现常见的是LHA V2.13和ARJ V2.30。下面分别简介其特点和最常用的基本使用方法。	1994年09期_常用压缩软件的选择和使用方法.pdf	http://sso.cdclib.org/interlibSSO/goto/6/=06190596Z93/kcms/detail/detail.aspx?dbCode=cjfq&filename=RJSJ199409019&dbname=CJFD9498
中文平台技术与网络技术相结合的中文窗口-网络系统	软件世界	1994	1994年09期		平台技术 ； 网络系统 ； 网络技术 ； 用户图形界面 ； 核心软件 ； 网络软件 ； 软件性能 ； 联网能力 ； 系统接口 ； 网络工作站 ；	<正> 中文窗口-网络系统是导通科技公司与Mi-crosoft公司携手在网络及用户图形界面的中文化方面所取得的重要成果。 1.什么是中文窗口-网络系统 导通公司曾推出基于图形用户界面的Windows3.1中文窗口-平台系统。该系统实际上是一个使Windows 3.1具有中文处理能力的核心软件,它将中文输入、中文显示与打印、字库管理等集于一体。中文窗口-网络系统便基于导通公司的中文平台技术与Microsoft公司的网络技术的一个产品。	1994年09期_中文平台技术与网络技术相结合的中文窗口-网络系统.pdf	http://sso.cdclib.org/interlibSSO/goto/6/=06190596Z93/kcms/detail/detail.aspx?dbCode=cjfq&filename=RJSJ199409020&dbname=CJFD9498
化平凡为神奇——介绍朗道英汉电脑字典软件	软件世界	1994	1994年09期		操作环境 ； 朗道 ； 通用标准 ； 数据系统 ； 在线使用 ； 翻译系统 ； 热键 ； 在线式 ； 社会生活 ； 画中画 ；	<正> 随着计算机及其相关工业的迅猛发展,个人电脑在功能越来越强大的同时价格持续下降。个人电脑以超出人们预计的速度广泛普及开来。电脑已经渗透到社会生活的各个领域,越来越多的人特别是许多非计算机专业的人士开始独立使用电脑进行开发和应用。然而,电脑从已成为通用标准的操作环境到众多功能强劲、内容丰富的应用软件直至众多大型的数据系统等迄今为止大都是英文的。因此,尽管电脑本身带有各种使用说明和在线的提示等,但语言障碍仍是一个令许多人将电脑使用视为畏途的主要原因。这个问题甚至制约了电脑的普及和功效发	1994年09期_化平凡为神奇——介绍朗道英汉电脑字典软件.pdf	http://sso.cdclib.org/interlibSSO/goto/6/=06190596Z93/kcms/detail/detail.aspx?dbCode=cjfq&filename=RJSJ199409021&dbname=CJFD9498
中国软件行业协会一九九四年度推荐优秀软件产品名单	软件世界	1994	1994年09期		软件产品 ； 管理系统 ； 桌面办公系统 ； 多媒体信息系统 ； 报表处理 ； 计算机软件 ； 数据处理系统 ； 汉字识别系统 ； 软件系统 ； 软件开发环境 ；	中国软件行业协会在庆祝成立10周年之际,开展了一九九四年度推荐优秀软件产品活动。经专家初审和读者与用户投票,最终推荐优秀软件产品48个,现予以公布。本刊以后还将对其中一些产品作具体介绍。	1994年09期_中国软件行业协会一九九四年度推荐优秀软件产品名单.pdf	http://sso.cdclib.org/interlibSSO/goto/6/=06190596Z93/kcms/detail/detail.aspx?dbCode=cjfq&filename=RJSJ199409022&dbname=CJFD9498
UC DOS 3.0确认测试报告	软件世界	1994	1994年09期	【机构】 中国软件评测中心 ；	软件产品 ； 软件评测 ； 测试环境 ； 鉴定测试 ； UC DOS 3.0 ； 质量检测机构 ； 测试报告 ； 测试过程 ； 内存管理器 ； 可扩充性 ；	随着我国软件市场的日益繁荣和软件产品的大量涌现,软件评测的重要性越来越显现出来了。它对保障软件产品质量,开拓国际软件市场,促进软件市场健康发展都将发挥重要作用。中国软件评测中心是我国唯一权威性的软件产品质量检测机构,面向社会承担软件产品的鉴定测试、确认测试和判别测试等工作。它采用国外先进的产品评测技术,建立了国际通用的计算机软硬件测试环境和标准的评测体系,多年来积累了丰富的软件评测经验。本刊自本期起将陆续发布中国软件评测中心的产品评测报告,为软件产品的厂商和用户架起沟通的桥梁。希望更多厂商能在这个栏目中一展自己优秀产品的风彩,也希望广大读者与用户能通过本栏目选择到满意的软件产品。	1994年09期_UC+DOS+3.0确认测试报告.pdf	http://sso.cdclib.org/interlibSSO/goto/6/=06190596Z93/kcms/detail/detail.aspx?dbCode=cjfq&filename=RJSJ199409023&dbname=CJFD9498
UCS与计算机多文种支持	软件世界	1994	1994年09期	【作者】 陈明源 ； 【机构】 北京有线电总厂 ；	编码字符集 ； UCS ； Fortran ； 国际标准组织 ； 数据类型 ； 代码转换 ； 应用系统 ； 软件工具 ； 编程语言 ； 支持能力 ；	<正> 在过去的7至10年间,国际计算机标准界(主要是国际标准组织ISO)开始关注这样一个问题:如何增强计算机对各种民族文字的处理能力以及增强对不同民族习惯的适应性问题。关注这一问题的原因一方面是计算机市场扩大到如日本、中国等非拉丁文国家及地区,另一原因也是遇到了如汉字这种棘手的大字符集问题。这种关注促进制订了一个包括全世界文字(尚未囊括全部文字)的多文种编码字符集。即包括16位编码的(称为UCS-2,已完成)及32位编码的(称为UCS-4,正在开始)通用编码字符集UCS;同时促进在编程语言标准(如Fortran 90及	1994年09期_UCS与计算机多文种支持.pdf	http://sso.cdclib.org/interlibSSO/goto/6/=06190596Z93/kcms/detail/detail.aspx?dbCode=cjfq&filename=RJSJ199409024&dbname=CJFD9498
Microsoft FoxPro2.5使用技术讲座——第四讲 使用FoxPro 2.5的报表生成器生成报表	软件世界	1994	1994年09期	【作者】 傅淑堂 ；	FoxPro 2.5 ； 报表格式 ； 编程工具 ； 面向对象的 ； 视觉化 ； Writer ； 所见即所得 ； 单选钮 ； 定义表 ； 运行环境 ；	<正> 像屏幕生成器一样,报表生成器(Report Writer)也是FoxPro 2.5提供给用户的面向对象的视觉化编程工具,通过在报表规划窗口(Report Layout Win-dow)中放置对象,用户能够轻松地创建出漂亮的报表和标签。这些对象包括窗口中的文本、图片、字段、函数、线条和矩形等,用户可以用各种方式对它们进行操作,直到报表和标签成为满意的形式。已创建过的对象都具有可重用性,用户可以在报表之间任意进行拷贝和粘贴。用户还可以在打印之前预显报表和标签,以确信它是否完善,这就是“所见即所得”的功能。	1994年09期_Microsoft+FoxPro2.5使用技术讲座——第四讲+使用FoxPro+2.5的报表生成器生成报表.pdf	http://sso.cdclib.org/interlibSSO/goto/6/=06190596Z93/kcms/detail/detail.aspx?dbCode=cjfq&filename=RJSJ199409025&dbname=CJFD9498
第五讲 使用FoxPro 2.5的内嵌SQL语言及RQBE工具	软件世界	1994	1994年09期	【作者】 傅淑堂 ；	FoxPro ； SQL语言 ； RQBE工具 ； 数据库操作 ； 性能优化 ； 连接条件 ； Foxpro ； 程序段 ； TABLE ； 单选钮 ；	<正> FoxPro2.5的内嵌SQL语言提供了一个强大的编程手段,使用户能够享受到SQL语言简便、灵活、高效的特点,以简练的程序完成复杂的任务。Fox-Pro2.5支持的SQL命令有SELECT,CREATE CUR-SOR,CREATE TABLE,INSERT等,并且在运行时能够自动地利用RUSHMORE技术进行性能优化。有时候用许多条FoxPro命令编写的程序段,只需要一条SQL命令就能完成。 FoxPro的内嵌SQL命令是由FoxPro解释并完成相应的数据库操作的,这与本讲座后面将讲到的通过FoxPro的开放连接工具可在PoxPro程序中使	1994年09期_第五讲+使用FoxPro+2.5的内嵌SQL语言及RQBE工具.pdf	http://sso.cdclib.org/interlibSSO/goto/6/=06190596Z93/kcms/detail/detail.aspx?dbCode=cjfq&filename=RJSJ199409026&dbname=CJFD9498
英汉对照软件专业时文选读	软件世界	1994	1994年09期	【作者】 崔培莲 ； 王喜喜 ； 唐多元 ；	软件专业 ； 英汉对照 ； 文件拷贝 ； 打印输出 ； 第三个人 ； Printer ； 网络操作系统 ； workstation ； 共享文件 ； format ；	<正> 用LAN Manager你能做什么 到目前为止,你要办事可能仍不得不在办公室来回走动。每次几个人做一个项目时,不得不一个一个地传递软盘;每次需要打印一个文件时,你不得不把这个文件拷贝到软盘上,到连接打印机的计算机上打印输出。听起来耳熟吗?听起来令人沮丧。 用了LAN Manager,你就不必一个一个传递软盘,不必离开办公桌就能够访问和共享全部所需的信息:一个人写报告,另一个人检查,第三个人就能	1994年09期_英汉对照软件专业时文选读.pdf	http://sso.cdclib.org/interlibSSO/goto/6/=06190596Z93/kcms/detail/detail.aspx?dbCode=cjfq&filename=RJSJ199409027&dbname=CJFD9498
第六批自由软件部分清单及简介(续)	软件世界	1994	1994年09期		题库系统 ； 试卷管理 ； 库容量 ； 普及版 ； 软件名称 ； 著作工具 ； 程序语言 ； 查询者 ； 汉声 ； 动画文件 ；	<正> 洪老师题库系统V1.50普及版是一套题库及试卷管理系统,其中包括“洪老师题库管理系统”和“洪老师命题系统”,可以完成生成、修改、维护题库,并从这个题库中做出试卷的全过程。题库容量为1万道,可容纳8000幅图。	1994年09期_第六批自由软件部分清单及简介(续).pdf	http://sso.cdclib.org/interlibSSO/goto/6/=06190596Z93/kcms/detail/detail.aspx?dbCode=cjfq&filename=RJSJ199409028&dbname=CJFD9498
出版软件	软件世界	1994	1994年09期		图像分析 ； 图像压缩技术 ； 边缘跟踪 ； 图像格式 ； 图像增强 ； 二值图像 ； 二维绘图 ； PASCAL ； 题库管理 ； 综合管理系统 ；	<正> 实用图像分析与处理技术(电子工业版) 5英寸4H/3.5英寸盘3片 定价:2500元 本软件是配合《计算机图像分析与处理实用大全》一书而发行的软件。软件全部为C及汇编源程序。内容包括:各种图像格式(如PCX、TIF、GIF等)的读取与显示,彩色、灰度、二值图像的显示与打印,图像压缩技术,图像增强和边缘跟踪等处理技术,扫描仪和绘图仪的驱动等图像分析与处理的实用程	1994年09期_出版软件.pdf	http://sso.cdclib.org/interlibSSO/goto/6/=06190596Z93/kcms/detail/detail.aspx?dbCode=cjfq&filename=RJSJ199409029&dbname=CJFD9498
产品长廊	软件世界	1994	1994年09期		生成工具 ； 软件开发 ； Foxpro ； 快速原型法 ； 第四代语言 ； 用户网络 ； 新型管理 ； 软件自动化 ； 用户界面友好 ； 界面风格 ；	<正> 新型管理软件自动生成工具数据库之星“—DBstar 2.0” 由清华正方公司开发的新型管理软件自动生成工具数据库之星“—DBstar2.0借鉴和采用了快速原型法、第四代语言等当前流行的软件开发的新概念、新技术,是一个理想的支持中、小型MIS开发的工具软件,主要有:可自动生成DBASE Ⅲ plusFoxbase,dipper,Foxpro for DOS/windows等源语言的一体化的集中式/分布式多用户网络MIS或单机MIS;可生成多层锻套的菜单树结构,菜单窗口可任	1994年09期_产品长廊.pdf	http://sso.cdclib.org/interlibSSO/goto/6/=06190596Z93/kcms/detail/detail.aspx?dbCode=cjfq&filename=RJSJ199409030&dbname=CJFD9498
软件教学录像片简介	软件世界	1994	1994年09期		软件教学 ； 乱码 ； 配套培训 ； 汉化版 ； 文字处理软件 ； 培训中心 ； 微型计算机原理 ； 软件知识 ； Foxpro ； 电子表格软件 ；	<正> 一、微软系列教学录像片 为配合微软公司系列软件在中国的推广及应用,方便广大用户学习Microsoft软件知识,受微软公司委托,微软公司中国授权培训中心总部(微软ATC)推出微软系列软件教学录像带和配套培训教材。目前已完成以下几种。 《中文Windows 3.1使用教程》 中文Windows 3.1是微软公司于1993年10月正式推出的中文简体汉化版本。它继承了西文Win-dows 3.1的一切优点,又克服了西文Windows 3.1下运行汉字时出现的乱码现象。	1994年09期_软件教学录像片简介.pdf	http://sso.cdclib.org/interlibSSO/goto/6/=06190596Z93/kcms/detail/detail.aspx?dbCode=cjfq&filename=RJSJ199409031&dbname=CJFD9498
企业动态	软件世界	1994	1994年09期		企业动态 ； 代理协议 ； 服务器产品 ； 北大方正集团 ； 语音网络 ； 演示会 ； 副总裁 ； 家用电脑 ； 通讯产品 ； 信元交换 ；	<正> 阳光公司与ITS携手合作分销CYLINKAirLink和MICOM Maration 北京阳光科技开发公司与香港资讯工程有限公司(ITS)最近正式签署关于美国CYLINK公司的AirLink系列无线调制解调器产品和美国MICOM公司的Marathon系列数据/语音网络服务器产品中国分销代理协议。	1994年09期_企业动态.pdf	http://sso.cdclib.org/interlibSSO/goto/6/=06190596Z93/kcms/detail/detail.aspx?dbCode=cjfq&filename=RJSJ199409032&dbname=CJFD9498
软件商情	软件世界	1994	1994年09期		Release ； 软件商 ； 数据库产品 ； UNIX ； SystemV ； users ； cense ； 环境类型 ； INFORM ； 徐志强 ；	INFORM】X数据库产品S(:O刃卞口X/XENix产品名称环境类型 价格(元)UNIx平台xENIx平台Sco产品产品名称价格(元)UNIX SystemV/386 Release 3.2 Version 4.X 2一U货r License 7000 16一User肠cense 12500 over 16一User License 17500!SE。1 SQL,!NET八ekage(B怪2895023160DeveloPmen一System Releas七3.X1 3500〔SQL/CPaekage(C圣)l一8里10503961520500PaekagePackage(C)9一16了1	1994年09期_软件商情.pdf	http://sso.cdclib.org/interlibSSO/goto/6/=06190596Z93/kcms/detail/detail.aspx?dbCode=cjfq&filename=RJSJ199409033&dbname=CJFD9498
计算机软件著作权登记公告	软件世界	1994	1994年09期	【机构】 中华人民共和国电子工业部计算机软件登记办公室 ；	软件名称 ； 登记公告 ； 中国软件 ； 登记号 ； 分类号 ； 批准日期 ； 报表处理 ； 工资管理系统 ； 著作权人 ； 报表系统 ；	.记号分类号94012265500一7100 日翔及地点软件二<报)价软件名称及 版本号swD徽机辅助结构设计软件[简称:swo软件冬vl.o张宇伦中国登记批准日期中国北京市 人民币100000元 美元一00001 994年5月27日,作权人 及其国.软件首次发农 日期及地点,作权人清华大学计算机科学一与 及其二技术系中国 中国长城计算机集团公 司中国软件,次发裹1993年3月25日 日期及地点中国北京市软件.,(报)价人民币1000。元登记批准B期’1994年6月6H软件.协(报)价登记批准日期1991年12月18日中国广东省深圳市 人民币8000元1994年5月18日l记号9确0123分类	1994年09期_计算机软件著作权登记公告.pdf	http://sso.cdclib.org/interlibSSO/goto/6/=06190596Z93/kcms/detail/detail.aspx?dbCode=cjfq&filename=RJSJ199409034&dbname=CJFD9498
国内要闻	软件世界	1994	1994年09期		应用系统 ； 电子数据交换 ； 报关单 ； 进出口量 ； 国内要闻 ； 网络传送 ； 可移植性 ； 排版软件 ； 混排 ； 服务器技术 ；	<正> 我国首例EDI应用系统在首都机场海关试运行成功 我国第一个EDI(电子数据交换)应用系统在首都机场海关试运行成功,目前平均每天有80批左右的进出口货物通过这一自动化通关系统申报和放行,大大加快了通关速度。 首都机场是我国最大的空中门户,年货运进出口量在5万吨以上,报关单据近20万份。采用EDI自动化通关系统,用户可在自己的办公室将报关单通过系统网络传送到海关,作为正式报关,既简化了通	1994年09期_国内要闻.pdf	http://sso.cdclib.org/interlibSSO/goto/6/=06190596Z93/kcms/detail/detail.aspx?dbCode=cjfq&filename=RJSJ199409035&dbname=CJFD9498
海外信息	软件世界	1994	1994年09期		海外信息 ； 装机量 ； 调查公司 ； 电缆电视 ； 对称多处理 ； 网络软件 ； 四维 ； 测试计划 ； 网络市场 ； 合作设立 ；	<正> 世界计算机总量已达1.73亿台 据美国调查公司CIA统计,至1993年全世界计算机装机台数为1.73亿台。与1992年底的1.48亿台相比,增长17％。其中居世界第一位的是美国,为7420万台,占世界总量43％;第二位日本,1220万台占7％;第三位来德国,1040万台,占6％:第五位为英国,740万台。全世界装机量在100万台以上的共18个国家。	1994年09期_海外信息.pdf	http://sso.cdclib.org/interlibSSO/goto/6/=06190596Z93/kcms/detail/detail.aspx?dbCode=cjfq&filename=RJSJ199409036&dbname=CJFD9498
