title	journal_name	year	issue	author	keywords	summary	pdf_filename	article_url
声音	软件世界	2008	2008年12期		百度竞价排名 ； 基础软件 ； 倪光南 ； 客户需要 ； 李彦宏 ； 客户数据 ； 核高基 ； 应用者 ； 福布斯 ； 知识产权壁垒 ；	创新似乎成了这个时代的时髦名词,所有的决心好像不用创新不足以表示坚决,所有的改变好像不用创新不足以表示进步,在人必称创新的时候,创新的内涵却被抛到九霄云外。	2008年12期_声音.pdf	http://sso.cdclib.org/interlibSSO/goto/6/=06190596Z93/kcms/detail/detail.aspx?dbCode=cjfq&filename=RJSJ200812001&dbname=CJFDHIS
IT业恶况加剧	软件世界	2008	2008年12期		公司计划 ； 市场分析师 ； 谷歌 ； 资金状况 ； 计算机业 ； Amazon ； 在线广告 ； 破产保护 ； 第四季度 ； 电子商务公司 ；	<正> 随着业界大鳄如英特尔等降低营收预期,绩优企业如谷歌等股价持续走低,Sun 公司裁员18%,IDC 和花旗集团的市场分析师们纷纷降低预期,IT 业资金状况持续恶化。Sun 公司宣布,他们将在全球裁员18%,以在严峻的经济形势下控制开销。Sun 公司计划全年削减7至	2008年12期_IT业恶况加剧.pdf	http://sso.cdclib.org/interlibSSO/goto/6/=06190596Z93/kcms/detail/detail.aspx?dbCode=cjfq&filename=RJSJ200812002&dbname=CJFDHIS
Sun期望靠开源生存	软件世界	2008	2008年12期		Sun ； 营业收人 ； 施瓦兹 ； 平台软件 ； 乔纳森 ； 开源技术 ； 业务集团 ； 多线程 ； 企业服务器 ； 应用服务器 ；	<正> Sun 公司宣布将最多裁员6000名员工,这是自去年减员以来的又一次重整。另外,Sun还指望靠开源战略来帮助渡过难关。Sun 在第一财季(截至9月)中,营业收入为30亿美元,较去年同期下降7.1%,第一财季净亏损17亿	2008年12期_Sun期望靠开源生存.pdf	http://sso.cdclib.org/interlibSSO/goto/6/=06190596Z93/kcms/detail/detail.aspx?dbCode=cjfq&filename=RJSJ200812003&dbname=CJFDHIS
微软Windows Live Wave 3即将出炉	软件世界	2008	2008年12期		Live Wave 3 ； 社交网络 ； 升级服务 ； 周里 ； 中国电信 ； 通信中心 ； 联合品牌 ； 消费级 ； Messenger ； 副总裁 ；	<正> 微软称,期待已久的 Wirdows Live Wave 3将在接下来的数周里在全球发布。该版本旨在为 Win-dows Live 用户们提供一套全新或升级服务,以更好地与其它网站(尤其是社交网络网站)进行集成。为实现这一目标,微软将提供超过50个指向其他网站的链接,包括 Flickr、LinkedIn、Pandora、Photobucket、	2008年12期_微软Windows+Live+Wave+3即将出炉.pdf	http://sso.cdclib.org/interlibSSO/goto/6/=06190596Z93/kcms/detail/detail.aspx?dbCode=cjfq&filename=RJSJ200812004&dbname=CJFDHIS
运营商的噩梦	软件世界	2008	2008年12期		网络通信 ； 生死关头 ； 移动业务 ； 移动平台 ； 讨论组 ； 谷歌 ； 开发者 ； 英格 ； 副总裁 ； Android ；	<正> 随着竞争的加剧以及网络的开放,运营商和 ISP们已经无法严格控制用户下载什么以及他们如何使用无线网络,它们很快将面临移动互联网收入的生死关头。出席大众网络通信委员会的讨论组成员们说,"噩梦已经到来了"。照片分享应用 SnapMyLife 的 CEOGeorge Grey 说,"虽然正在销售的手90%功能都	2008年12期_运营商的噩梦.pdf	http://sso.cdclib.org/interlibSSO/goto/6/=06190596Z93/kcms/detail/detail.aspx?dbCode=cjfq&filename=RJSJ200812005&dbname=CJFDHIS
资讯	软件世界	2008	2008年12期		亚洲研究院 ； 杨致远 ； 中国电信 ； 微架构 ； 计算机科学家 ； 雅虎 ； 浪潮集团 ； 全业务经营 ； 运输机械 ； 第二人生 ；	<正> 微软计划免费提供软件给部分新创公司微软近期宣布一项针对小企业的 BizSpark 计划,此计划主要面对成立三年内,未上市,且年营收不得超过100万美元的公司,他们可	2008年12期_资讯.pdf	http://sso.cdclib.org/interlibSSO/goto/6/=06190596Z93/kcms/detail/detail.aspx?dbCode=cjfq&filename=RJSJ200812006&dbname=CJFDHIS
SOA标准体系,中国“制造”	软件世界	2008	2008年12期	【作者】 齐书阳 ；	SOA ； 互联网标准 ； 互操作能力 ； 标准化协会 ； 万维网联盟 ； 标准间 ； 国外大企业 ； 信息技术领域 ； 项目实施 ； 集中力量办大事 ；	<正>当前,国际上 SOA 标准还比较混乱,中国有望率先建立起自己的 SOA 标准体系。11月5日,SOA标准化国际论坛上,中国电子技术标准化研究所(CES功互联网标准开放实验室(ISOL)	2008年12期_SOA标准体系,中国“制造”.pdf	http://sso.cdclib.org/interlibSSO/goto/6/=06190596Z93/kcms/detail/detail.aspx?dbCode=cjfq&filename=RJSJ200812007&dbname=CJFDHIS
中国开源需要政府多一点爱	软件世界	2008	2008年12期	【作者】 齐书阳 ；	国产软件 ； 倪光南 ； 教育体系 ； 市场推广 ； 电脑教育 ； 教育培训体系 ； 培养人才 ； 文档格式 ； 专项资金支持 ； 不协调性 ；	<正>对于开源,政府除了采购上进行支持外,更重要的是在教育体系打破微软垄断的局面,同时加大对于社区的投入。开源对于中国是否有益呢?这个问题似乎不需讨论,开源对中国不仅百利而无一弊,并且对于中国建立自主可控的信息环境、	2008年12期_中国开源需要政府多一点爱.pdf	http://sso.cdclib.org/interlibSSO/goto/6/=06190596Z93/kcms/detail/detail.aspx?dbCode=cjfq&filename=RJSJ200812008&dbname=CJFDHIS
寻找CMMI的中国魂	软件世界	2008	2008年12期	【作者】 王勇 ；	CMMI ； 中国魂 ； 赵悦 ； 卡内基 ； 文化融合 ； 形与神 ； 梅隆大学 ； 业务目标 ； 不要忘了 ； 实施办法 ；	<正>获得 CMMI 最佳的实施效果是最终目的。那么,如何克服急功近利的现象,实现 CMMI 从形到神的平稳过渡呢?如果从一种阶段的跨越和提升来看CMMI,它正在迈越一个从形到神过渡的门槛。	2008年12期_寻找CMMI的中国魂.pdf	http://sso.cdclib.org/interlibSSO/goto/6/=06190596Z93/kcms/detail/detail.aspx?dbCode=cjfq&filename=RJSJ200812009&dbname=CJFDHIS
协同之惑	软件世界	2008	2008年12期	【作者】 齐书阳 ；	协同软件 ； 忽如一夜春风来 ； 层次理论 ； 软件功能 ； 即时通讯 ； 工作流 ； 副总裁 ； 王志东 ； 万树 ； 管理模块 ；	<正>协同需要一个广为认可的核心理论,"协同四层次理论"可能会是吗?2000年,协同概念刚一提出,众多办公软件厂商摇身一变成为协同软件企业,大有"忽如一夜春风来,千树万树梨花开"的局面。	2008年12期_协同之惑.pdf	http://sso.cdclib.org/interlibSSO/goto/6/=06190596Z93/kcms/detail/detail.aspx?dbCode=cjfq&filename=RJSJ200812010&dbname=CJFDHIS
精益软件研发	软件世界	2008	2008年12期	【作者】 李华焰 ； 【机构】 用友软件股份有限公司EBU产品管理部 ；	软件研发 ； 研发方式 ； 应用软件 ； 日本汽车 ； 组件化 ； 消费心理 ； 业务协作 ； 整体流程 ； 一本 ； 国内软件 ；	<正>在求新、求变、求个性的消费心理下,企业应该采用什么样的研发方式,才能满足不同需求呢?有一本描写80年代美国寻求学习日本汽车业成功的因素研究的学术书籍-《改变世界的机器》。	2008年12期_精益软件研发.pdf	http://sso.cdclib.org/interlibSSO/goto/6/=06190596Z93/kcms/detail/detail.aspx?dbCode=cjfq&filename=RJSJ200812011&dbname=CJFDHIS
直面SaaS时伐——风云网络为成长型企业创造发展新机遇	软件世界	2008	2008年12期	【作者】 卢敏 ；	SaaS ； 雅虎公司 ； 现代信息服务业 ； 国际厂商 ； 市场推广 ； 软件供应商 ； 信息化模式 ； 套装软件 ； 硬件厂商 ； 中小企业用户 ；	<正>SaaS 时代的到来已成为无可争议的事实,然而,我们以什么样的方式来"拥抱"SaaS 时代的来临呢?在国内,互联网行业的成熟发展,给SaaS的普及创造了条件,SaaS则以其成本低、实施快,	2008年12期_直面SaaS时伐——风云网络为成长型企业创造发展新机遇.pdf	http://sso.cdclib.org/interlibSSO/goto/6/=06190596Z93/kcms/detail/detail.aspx?dbCode=cjfq&filename=RJSJ200812012&dbname=CJFDHIS
跨国企业的中国心	软件世界	2008	2008年12期	【作者】 齐书阳 ；	跨国企业 ； 人才竞争力 ； 中国心 ； 孙福全 ； 中国研究中心 ； 生态环境 ； 技术创新 ； 国际竞争 ； 研发单位 ； 科技计划 ；	从制造中心到智造中心,中国高端的人才正在取代低成本的劳动力,成为参与国际竞争的主角,同时也逐渐成为跨国企业技术和产品研发的骨干。对于中国来说,这意味着又一次质的飞跃,人才竞争力的提高,生态环境的繁荣……	2008年12期_跨国企业的中国心.pdf	http://sso.cdclib.org/interlibSSO/goto/6/=06190596Z93/kcms/detail/detail.aspx?dbCode=cjfq&filename=RJSJ200812013&dbname=CJFDHIS
IBM中国开发中心的蝶变	软件世界	2008	2008年12期	【作者】 齐书阳 ；	王阳 ； 行业解决方案 ； 测试服务 ； 合作部 ； 大中华地区 ； 架构师 ； 孵化项目 ； 新兴技术 ； 技术战略 ； 行业研发 ；	<正>搬迁新址、新领军人上任,IBM 中国开发中心正在开始新的征程。开发重心将向中国倾斜软件世界:作为IBM中国开发中心(简称CDL)新的掌门人,您如何评价	2008年12期_IBM中国开发中心的蝶变.pdf	http://sso.cdclib.org/interlibSSO/goto/6/=06190596Z93/kcms/detail/detail.aspx?dbCode=cjfq&filename=RJSJ200812014&dbname=CJFDHIS
Symphony的成人礼	软件世界	2008	2008年12期	【作者】 齐书阳 ；	Symphony ； 成人礼 ； Mission ； Lotus ； Notes ； 组件开发 ； 自主设计 ； 项目管理经验 ； 中国实验室 ； 测试版 ；	<正>Mission Team,这是戴弘对中国 Symphony 团队的新定位,使命一词更多意味着责任、独立。IBM环宇大厦二层的一处走廊边,悬挂着一块匾,上面写着"Lotus Symphony	2008年12期_Symphony的成人礼.pdf	http://sso.cdclib.org/interlibSSO/goto/6/=06190596Z93/kcms/detail/detail.aspx?dbCode=cjfq&filename=RJSJ200812015&dbname=CJFDHIS
ISV搭上国际顺风车	软件世界	2008	2008年12期	【作者】 齐书阳 ；	中小企业用户 ； 顺风车 ； ISV ； 战略合作伙伴 ； 生态链 ； 合作伙伴计划 ； 品牌电脑 ； 用友公司 ； 用户体验 ； 联合实验室 ；	<正>通过融入国际巨头的生态链,本地 ISV 走向了更广阔的舞台。2008年7月,用友伟库网上线,开始面向中小企业用户提供SaaS服务。做管理软件对用友来说,可谓是	2008年12期_ISV搭上国际顺风车.pdf	http://sso.cdclib.org/interlibSSO/goto/6/=06190596Z93/kcms/detail/detail.aspx?dbCode=cjfq&filename=RJSJ200812016&dbname=CJFDHIS
天边有朵会计算的云	软件世界	2008	2008年12期	【作者】 SaaS ；	软件功能 ； 服务器群组 ； 软件架构 ； 应用软件 ； 虚拟机 ； 在线翻译 ； 客户资料 ； 后台服务器 ； 用户计算机 ； 网络防护 ；	<正>真是乱成一锅粥了!云计算到底是什么,它能为企业带来哪些应用?众说纷纭,那么,谁才是那朵会下雨的云呢?2008年的今天,10个IT专家,背靠背(就是互相不商量)表达什么是"云计算",能	2008年12期_天边有朵会计算的云.pdf	http://sso.cdclib.org/interlibSSO/goto/6/=06190596Z93/kcms/detail/detail.aspx?dbCode=cjfq&filename=RJSJ200812017&dbname=CJFDHIS
云计算就是那么回事	软件世界	2008	2008年12期	【作者】 齐书阳 ；	计算图 ； 数据中心 ； 平台层 ； 服务层 ； 大中华区 ； 埃里森 ； 周松 ； 我不知道 ； 管理世界 ； Tivoli ；	<正>大家似乎都被云计算烧"晕"了,而忘了它的本质,更惶谈如何实现了。业界对云的炒作似乎到了一种可笑的地步,没有人能够解释清楚这个模糊的概念到底在说什么,但是这丝毫不能阻挡大家谈论"云计算"的热情。不过,对于这种空对空的炒作,业界的大佬看来也烦不胜烦了	2008年12期_云计算就是那么回事.pdf	http://sso.cdclib.org/interlibSSO/goto/6/=06190596Z93/kcms/detail/detail.aspx?dbCode=cjfq&filename=RJSJ200812018&dbname=CJFDHIS
融合,SOBA的应用趋势	软件世界	2008	2008年12期	【作者】 董延春 ； 【机构】 山东德州证券公司 ；	SOBA ； 商务流程 ； 副总裁 ； 复合形式 ； 战略优势 ； 实时企业 ； 战略劣势 ； 业务流程 ； 端对端 ； 提供商 ；	<正>面向服务的商务应用,即 SOBA,代表着 SOA 进入主流并可以提供实实在在的利益。Gartner副总裁,亚太地区研究主管Dion Wiggins和Gartner亚太地区研究分析员Loulsa Ltu一起在	2008年12期_融合,SOBA的应用趋势.pdf	http://sso.cdclib.org/interlibSSO/goto/6/=06190596Z93/kcms/detail/detail.aspx?dbCode=cjfq&filename=RJSJ200812019&dbname=CJFDHIS
评估,BI的“维修站”	软件世界	2008	2008年12期	【作者】 周姝嫣 ；	商务智能 ； 动态规划 ； 商业需求 ； 公司合并 ； BI ； 最佳策略 ； 商业环境 ； 数据挖掘 ； 情景分析法 ； 预测分析 ；	<正>评估 BI 的部署过程就像驶进了"维修站",它可以弥补缺陷,执行动态规划,还可以保证 BI 将来取得成功。在当前竞争激烈的商业环境下,公司如果能够成功地部署商务智能(Bl)解决方案	2008年12期_评估,BI的“维修站”.pdf	http://sso.cdclib.org/interlibSSO/goto/6/=06190596Z93/kcms/detail/detail.aspx?dbCode=cjfq&filename=RJSJ200812020&dbname=CJFDHIS
创新设计披上“绿色”外衣	软件世界	2008	2008年12期	【作者】 涂兰敬 ；	数字建模 ； 技术峰会 ； 首席技术官 ； Autodesk ； 工业制造 ； 绿色资源 ； 数字世界 ； 高度智能化 ； 数据显示 ； 总体规划 ；	<正>数字建模正在帮助众多设计师尽快实现自己的创意,而加入可持续发展的设计理念,将会符合现代社会的要求。设计师们在设计中考虑最多的是如何进行创新设计,他们更希望有一种工具能够建立	2008年12期_创新设计披上“绿色”外衣.pdf	http://sso.cdclib.org/interlibSSO/goto/6/=06190596Z93/kcms/detail/detail.aspx?dbCode=cjfq&filename=RJSJ200812021&dbname=CJFDHIS
架构转变引发数据管理变革	软件世界	2008	2008年12期	【作者】 陈友梅 ；	首席市场官 ； 数据库机 ； Nathan ； 副总裁 ； 数据管理 ； 企业内部数据 ； 商业决策 ； Sybase ； 未来数据 ； 软硬结合 ；	<正>IT 系统的作用已经不仅仅满足企业内部数据服务,更重要的是为管理层和决策者提供商业决策。图1 svbase高级副总裁兼全球首席市场官Ra一Nathan更重要的是管理层和决策者需要通过访问 ,数据、	2008年12期_架构转变引发数据管理变革.pdf	http://sso.cdclib.org/interlibSSO/goto/6/=06190596Z93/kcms/detail/detail.aspx?dbCode=cjfq&filename=RJSJ200812022&dbname=CJFDHIS
罗鹰:从海外到国内的迂回战	软件世界	2008	2008年12期	【作者】 王勇 ；	科来软件 ； 网络分析 ； 产品销售 ； 网络安全 ； 企业核心业务 ； 中小企业用户 ； 海外市场 ； 主动防御 ； 通信软件 ； 攻击类型 ；	<正>从初中未毕业,到现在担任科来 CEO,罗鹰这一路走来,几多坎坷,几多艰辛。2001年,罗鹰成立了成都科来软件有限公司。如今,回忆起自己与科来一起走过的风风雨雨,现任科来的CEO罗鹰	2008年12期_罗鹰:从海外到国内的迂回战.pdf	http://sso.cdclib.org/interlibSSO/goto/6/=06190596Z93/kcms/detail/detail.aspx?dbCode=cjfq&filename=RJSJ200812023&dbname=CJFDHIS
深入浅出微软云平台	软件世界	2008	2008年12期		计算平台 ； 交易处理 ； 设备开发 ； 虚拟计算环境 ； 配置文件 ； 分布式应用 ； 服务总线 ； 工作流 ； 订单量 ； 应用程序 ；	<正> 过去的几年中,我们听到了很多新的词汇。比如Web 2 0、SOA、虚拟化、软件加服务(S+S)。我们透过这些名词,可以看到业界的趋势,越来越多的软件和应用已经不能离开 Internet。于是云计算平台的概念就应运而生了,而且已经有一些软件公司推出了自	2008年12期_深入浅出微软云平台.pdf	http://sso.cdclib.org/interlibSSO/goto/6/=06190596Z93/kcms/detail/detail.aspx?dbCode=cjfq&filename=RJSJ200812024&dbname=CJFDHIS
SOA九大误区	软件世界	2008	2008年12期	【作者】 胡长岭 ； 刘胜娃 ； 【机构】 西安石油大学 ；	服务安全 ； 工作流 ； SOA ； SAML ； 组合服务 ； 九大 ； Kerberos ； 企业服务总线 ； 信息安全基础 ； 服务代理 ；	采用 SOA 过程中有一些常见的错误,只要稍加努力,就可以避免。忽视这些错误(因而重蹈覆辙)可能导致你为引入 SOA 而付出的全部努力偏离轨道并失去你的优势。	2008年12期_SOA九大误区.pdf	http://sso.cdclib.org/interlibSSO/goto/6/=06190596Z93/kcms/detail/detail.aspx?dbCode=cjfq&filename=RJSJ200812025&dbname=CJFDHIS
核心基础架构优化落地微软	软件世界	2008	2008年12期	【作者】 卢敏 ；	核心基础 ； 软件解决方案 ； 业务运行 ； 技术支持中心 ； 成本费用 ； 业界分析 ； 桌面计算机 ； 营运总监 ； 大中华区 ； 系统安全保障 ；	<正>谈到微软,首先想到的是他提供给客户各式各样的软件解决方案,那么它的核心基础架构是如何优化的?通常企业面对的IT问题有:第一,IT管理越来越复杂,十年前可能一个IT管理员或IT经理,	2008年12期_核心基础架构优化落地微软.pdf	http://sso.cdclib.org/interlibSSO/goto/6/=06190596Z93/kcms/detail/detail.aspx?dbCode=cjfq&filename=RJSJ200812026&dbname=CJFDHIS
VMware:“云”的发动机	软件世界	2008	2008年12期	【作者】 卢敏 ；	用户大会 ； 虚拟技术 ； 战略计划 ； VMware ； 领先优势 ； 大中华区 ； 虚拟机 ； 副总裁 ； 虚拟环境 ； 投资成本 ；	<正>2500名专注于虚拟技术开发的工程师,从早到晚头脑里想的只有虚拟化,今年给我们带来了什么惊喜?11月4日,VMware在虚拟化用户大会上发布了新的战略计划和解决方案。	2008年12期_VMware:“云”的发动机.pdf	http://sso.cdclib.org/interlibSSO/goto/6/=06190596Z93/kcms/detail/detail.aspx?dbCode=cjfq&filename=RJSJ200812027&dbname=CJFDHIS
我们没有过冬的感觉	软件世界	2008	2008年12期	【作者】 卢敏 ；	超图 ； 软件股份 ； 质量管控 ； 渠道战略 ； 市场推广 ； 平台软件 ； 服务转型 ； 品牌提升 ； 开拓能力 ； 毒奶粉事件 ；	<正>冬天来临。对微软公司及其合作伙伴来说,并没有因为冬天的寒意而减速前进的步伐。客户如何聪明支出IT预算,怎样才能通过信息化的方式来帮助客户提高盈利的效率和	2008年12期_我们没有过冬的感觉.pdf	http://sso.cdclib.org/interlibSSO/goto/6/=06190596Z93/kcms/detail/detail.aspx?dbCode=cjfq&filename=RJSJ200812028&dbname=CJFDHIS
用户的视角去看NUI	软件世界	2008	2008年12期		设计初衷 ； NUI ； 数字内容 ； 虚拟世界 ； 互联网内容 ； 交互系统 ； 产品销售 ； 在线广告 ； 物体识别 ； 视频演示 ；	<正> NUI(Natural User Interface),统称为自然用户界面每当跟朋友聊起这个话题,总觉意犹未尽,短短几十的 IT 发展史尽数了多少业界的变迁和持续创新。以微软的 Surface 为例,通过几个视角去重新演绎这些故事。世界上第一支鼠标的设计初衷就是为了使计算机	2008年12期_用户的视角去看NUI.pdf	http://sso.cdclib.org/interlibSSO/goto/6/=06190596Z93/kcms/detail/detail.aspx?dbCode=cjfq&filename=RJSJ200812029&dbname=CJFDHIS
惠普:中远网络系统护航者	软件世界	2008	2008年12期		中远集运 ； 中远集装箱 ； 海上集装箱运输 ； 全球用户 ； 集中式系统 ； 网络系统 ； 航运业务 ； 数据中心 ； 数据共享 ； 网络管理软件 ；	<正> 中远集装箱运输有限公司(中远集运)是中国远洋运输集团(中远集团)所属的专门从事海上集装箱运输业务的企业。作为中远集运面向全球用户的航运业务系统,IRIS2系统是一数据集中式系统,全球数据统一存放,全球各口岸通过专线或者 VPN 的方式访问数据中心,实现数据共享。由于中远集运 IRIS2系统是	2008年12期_惠普:中远网络系统护航者.pdf	http://sso.cdclib.org/interlibSSO/goto/6/=06190596Z93/kcms/detail/detail.aspx?dbCode=cjfq&filename=RJSJ200812030&dbname=CJFDHIS
个性化浪潮中的榕树型企业	软件世界	2008	2008年12期	【作者】 张西振 ；	纵向一体化 ； 网络联结 ； 网络形式 ； 计划管理系统 ； 养鸡专业户 ； 信息化项目 ； 资源约束 ； 市场风险 ； 约束理论 ； 作业标准 ；	<正>个性化浪潮冲击下,传统纵向一体化企业和分散的小型企业都受到了限制,全球 CEO 纷纷把目光投向了网络形式的企业组织。在个性化浪潮的冲击下,传统纵向一体化企业的发展受到了限制,	2008年12期_个性化浪潮中的榕树型企业.pdf	http://sso.cdclib.org/interlibSSO/goto/6/=06190596Z93/kcms/detail/detail.aspx?dbCode=cjfq&filename=RJSJ200812031&dbname=CJFDHIS
IT规范化是企业的中成药	软件世界	2008	2008年12期	【作者】 齐书阳 ；	兄弟三人 ； 防范问题 ； 文王 ； 规范化工作 ； 运筹帷握 ； 不知道 ； 更换策略 ； 个人私利 ； 管理人员 ； 个人所有 ；	<正>IT 治理真正目的其实并不在于解决问题,而是防范问题的发生,但是尴尬往往就在于此。魏文王问名医扁鹊说:"你们家兄弟三人,都精通医术,到底哪一位最好呢?" 扁鹊答说:"长	2008年12期_IT规范化是企业的中成药.pdf	http://sso.cdclib.org/interlibSSO/goto/6/=06190596Z93/kcms/detail/detail.aspx?dbCode=cjfq&filename=RJSJ200812032&dbname=CJFDHIS
台湾人寿的宁静革命	软件世界	2008	2008年12期	【作者】 卢敏 ；	部门主管 ； 业务流程 ； 风险评估 ； 信息系统 ； 内部审核 ； 数据模型 ； 列人 ； 销售业绩 ； 文邦 ； 莱特 ；	<正>革命,在人们心里压根就和宁静扯不上关系,那台湾人寿的宁静革命是怎么进行的?小陈今天觉得特别有成就感,因为公司完成了两年的系统迁移、改造工程。对于台湾人寿来说,这可不是一项小工程。	2008年12期_台湾人寿的宁静革命.pdf	http://sso.cdclib.org/interlibSSO/goto/6/=06190596Z93/kcms/detail/detail.aspx?dbCode=cjfq&filename=RJSJ200812033&dbname=CJFDHIS
PLM:过程决定一切	软件世界	2008	2008年12期	【作者】 涂兰敬 ；	耐克 ； PLM ； 应用程序 ； 时尚魅力 ； 双重目标 ； 自身企业 ； 战略供应商 ； 设备产品 ； 数据集成 ； 设备部门 ；	<正>经过多年的摸索,耐克终于体会到了推行 PLM 的关键因素是什么?过程、过程还是过程!1994年,耐克决定采用PLM系统,在那一年,耐克开始建立一个定制应用程序,以便	2008年12期_PLM:过程决定一切.pdf	http://sso.cdclib.org/interlibSSO/goto/6/=06190596Z93/kcms/detail/detail.aspx?dbCode=cjfq&filename=RJSJ200812034&dbname=CJFDHIS
叩问EDM企业数据管理	软件世界	2008	2008年12期		瑞星 ； 数据管理 ； 集体诉讼 ； EDM ； 备份过程 ； 邮件系统 ； 数据恢复 ； 数据备份 ； 存储成本 ； 备份数据 ；	<正> 尽管瑞星卡卡"邮件门"事件(简称"邮件门")发生已经过去一段时间了,但事件还在继续发酵着,有报道称,由于误删近千万用户邮件,瑞星将面临集体诉讼。诉讼的原因,除了受影响的用户对瑞星的处理不满外,部分用户的邮件只能部分恢复也是重要因	2008年12期_叩问EDM企业数据管理.pdf	http://sso.cdclib.org/interlibSSO/goto/6/=06190596Z93/kcms/detail/detail.aspx?dbCode=cjfq&filename=RJSJ200812035&dbname=CJFDHIS
惠普网管与时俱进	软件世界	2008	2008年12期		网络管理中心 ； 网络管理软件 ； 软件产品 ； 广域网优化 ； 服务水平协议 ； 全生命周期管理 ； 网络性能管理 ； 产品家族 ； 故障管理 ； 市场销售量 ；	<正> 提起网络管理软件,人们首先想到的就是惠普OpenView。作为惠普历史最悠久也是惠普最早的管理软件产品之一,OpenView 到目前已经有近20年的历史,服务了数十万客户,成为著名的管理软件品牌之一。如今,惠普的网络管理中心(NMC,Network Man-agement Center)组件涵盖了可用性、变更与配置、性	2008年12期_惠普网管与时俱进.pdf	http://sso.cdclib.org/interlibSSO/goto/6/=06190596Z93/kcms/detail/detail.aspx?dbCode=cjfq&filename=RJSJ200812036&dbname=CJFDHIS
永久开启的虚拟化	软件世界	2008	2008年12期	【作者】 张祥 ；	数据中心 ； 存储系统 ； 虚拟服务器 ； 灾难恢复 ； 物理服务器 ； 文件拷贝 ； 网络设置 ； 软件安装 ； 存储虚拟化 ； 应用程序 ；	<正>在数据中心中,虚拟化技术正变得越来越重要,这就使得 HADR 工具要大显身手。本文将介绍几款致力于虚拟化技术中 HADR不同方面的产品。在数据中心中,虚拟化技术正变得越来越重要,用于快速响应服务器多变的需求	2008年12期_永久开启的虚拟化.pdf	http://sso.cdclib.org/interlibSSO/goto/6/=06190596Z93/kcms/detail/detail.aspx?dbCode=cjfq&filename=RJSJ200812037&dbname=CJFDHIS
