title	journal_name	year	issue	author	keywords	summary	pdf_filename	article_url
自己的园地	程序员	2009	2009年12期	【作者】 刘江 ；	客园 ； 自己的园地 ； 遗留系统 ； 瀑布模型 ； 交流技术 ； 高屋建领 ； 技术媒体 ； http ； 编辑流程 ； 给你 ；	<正>我从今年11月开始出任《程序员》和CSDN网站总编,在公布消息的同时,也通过微博客和其他方式开始小范围征集对杂志和网站的意见、建议。没有想到的是,这在社区里引发了规模不小的讨论。仅仅博客园里就有至少三位同学发表针锋相对的文章,阅读次数超过了1万,评论数也有好几百。在微博客里,响应之多也超过了我的预料。	2009年12期_自己的园地.pdf	http://sso.cdclib.org/interlibSSO/goto/6/=06190596Z93/kcms/detail/detail.aspx?dbCode=cjfq&filename=ITSJ200912001&dbname=CJFD0910
时序逻辑领域的开拓者	程序员	2009	2009年12期	【作者】 吕娜 ；	时序逻辑 ； 艾米尔 ； 图灵奖 ； 唐稚松 ； 时态逻辑 ； 科技成就 ； 规格说明 ； 形式验证 ； 计算机科学 ； 动态行为 ；	<正>又一位图灵奖得主去世了,他是受人尊敬的时序逻辑领域大师艾米尔·伯努利(AmirPnueli)。今年11月2日,这位1996年度图灵奖得主因脑出血去世,享年68岁,只剩那些熠熠生辉的科技成就留给后人。	2009年12期_时序逻辑领域的开拓者.pdf	http://sso.cdclib.org/interlibSSO/goto/6/=06190596Z93/kcms/detail/detail.aspx?dbCode=cjfq&filename=ITSJ200912003&dbname=CJFD0910
内容制作的SaaS化	程序员	2009	2009年12期	【作者】 Mark Phibbs ； 【机构】 Adobe亚太区 ；	文档编辑 ； SaaS ； 互联网广告 ； Acrobat ； 制作工具 ； 浏览器插件 ； 效果监测 ；	<正>上个月我去参加公司在美国举办的MAX大会。这次大会上,我们正式确认斥资18亿美元收购Omniture公司的消息。这对于Adobe来说是一个大消息,也是整个公司在战略上的新部署。	2009年12期_内容制作的SaaS化.pdf	http://sso.cdclib.org/interlibSSO/goto/6/=06190596Z93/kcms/detail/detail.aspx?dbCode=cjfq&filename=ITSJ200912004&dbname=CJFD0910
外包与内需齐头并进	程序员	2009	2009年12期	【作者】 Tom Ticknor ； 【机构】 美国QAI公司全球总部 ；	中国软件企业 ； 中国软件业 ； 雷曼 ； 信息产业 ； 新兴区 ； CMMI ； 应届大学生 ； 就业培训 ； 培训认证 ； 成熟度 ；	<正>2008年雷曼兄弟的倒下,掀起了一场波及全球的经济危机。如今一年半过去了,作为这场经济危机源头的美国,依然没有明显的起色。但反观大洋对岸的中国,虽然同样经历了经济的阵痛,却一枝独秀,依然保持着惊人	2009年12期_外包与内需齐头并进.pdf	http://sso.cdclib.org/interlibSSO/goto/6/=06190596Z93/kcms/detail/detail.aspx?dbCode=cjfq&filename=ITSJ200912005&dbname=CJFD0910
创造1+1＞2的开发工具	程序员	2009	2009年12期	【作者】 Wayne Williams ； 【机构】 Embarcadero公司 ；	数据库开发 ； Borland ； 卡迪 ； 软件开发 ； 触摸技术 ； 欧美地区 ； 产品战略 ； 市场占有率 ； 深度整合 ； 经济增长贡献 ；	<正>去年夏天,我们从一家从事数据库开发、设计和管理的公司,成为一家跨平台开发和管理工具的公司。通过对Borland公司CodeGear产品线的收购,今天的英巴卡迪诺在开发工具领域有一条非常漫长的产品线。然而全面而又漫长	2009年12期_创造1+1＞2的开发工具.pdf	http://sso.cdclib.org/interlibSSO/goto/6/=06190596Z93/kcms/detail/detail.aspx?dbCode=cjfq&filename=ITSJ200912006&dbname=CJFD0910
做每个人的互联网中心	程序员	2009	2009年12期	【作者】 陈明杰 ； 【机构】 北京傲游天下科技有限公司 ；	互联网中心 ； 傲游浏览器 ； 用户体验 ； 鼠标手势 ； 语言版本 ； 接受者 ； 个人电脑 ； 账号密码 ； 移动版 ； 基础应用 ；	<正>互联网时代,每个人都是信息的提供者和接受者,要成为所有人的互联网中心,必须符合以下几个基本条件。第一,必须是人人常用的平台。成为互联网中心的首要条件,必须是用户花了最多时间在上面的一个平台。	2009年12期_做每个人的互联网中心.pdf	http://sso.cdclib.org/interlibSSO/goto/6/=06190596Z93/kcms/detail/detail.aspx?dbCode=cjfq&filename=ITSJ200912007&dbname=CJFD0910
使用脚本实现设计和性能的平衡	程序员	2009	2009年12期	【作者】 陶震 ； 【机构】 Sun中国技术社区网站 ；	应用程序 ； 闭包 ； 实例化 ； 变量值 ； 解释程序 ；	<正>各种语言都有各自的特点,有的语言可以通过动态类型或闭包特性为我们带来好处。我们知道如何通过特定语言中的某些特性来简化编程,或使应用程序具有炫酷的功能。但这里有一个经常被忽略的问题:应该在何时以何种方式使用脚本语言?	2009年12期_使用脚本实现设计和性能的平衡.pdf	http://sso.cdclib.org/interlibSSO/goto/6/=06190596Z93/kcms/detail/detail.aspx?dbCode=cjfq&filename=ITSJ200912008&dbname=CJFD0910
真正应用测试	程序员	2009	2009年12期	【作者】 韩锷春 ； 【机构】 甲骨文大中华区 ；	应用测试 ； 测试经验 ； 测试效率 ； 生产系统 ； 工作负载 ； 并发性 ； 模拟生产 ； 选件 ； 负载信息 ； 测试系统 ；	<正>对于关键的生产系统的变更,比如硬件、软件及应用的升级,需要在重新上线之前做充分的测试及变更影响分析,以降低变更后上线的风险。而过去的测试经验告诉我们,尽管我们会用到各种模拟测试工具进行测试,但往往还是有一些问题,特别是性能问题和稳定性问题,需	2009年12期_真正应用测试.pdf	http://sso.cdclib.org/interlibSSO/goto/6/=06190596Z93/kcms/detail/detail.aspx?dbCode=cjfq&filename=ITSJ200912009&dbname=CJFD0910
关注Chrome OS	程序员	2009	2009年12期	【作者】 焦昕秋 ； 【机构】 CSDN ；	Chrome OS ； 电脑桌面 ； 网络应用 ； 坚若磐石 ； 山寨版 ； 正面冲突 ； 小插曲 ；	<正>尽管Google宣布开发操作系统Chrome OS后就很少再提及它,但外界对这款系统的关注和猜测从未停止,从图片到视频,互联网上不断有各种曝光的消息传来。根据最新消息,Google正式推出Chrome操作系统的时间定于11月18日。不过从之前的迹象来看,推出的应该是beta版产品。	2009年12期_关注Chrome+OS.pdf	http://sso.cdclib.org/interlibSSO/goto/6/=06190596Z93/kcms/detail/detail.aspx?dbCode=cjfq&filename=ITSJ200912010&dbname=CJFD0910
Visual Studio 2010和.NET 4.0 Beta 2发布	程序员	2009	2009年12期	【作者】 涂曙光 ； 【机构】 微软(中国)有限公司 ；	应用程序 ； NET 4.0 Beta 2 ； 管理功能 ； 本地系统 ； 调试工具 ； 配置工作 ； 源码 ；	<正>Visual Studio 2010和.NET Framework 4.0向着正式发布又前进了一步,微软前不久发布了它们的Beta 2版本,将它们直接提供给所有开发人员免费下载,相信.NET开发人员都会忍不住尝鲜一把。Beta 2版本内置了"Go-Live"许可,这代表开发人员可以开始使用Beta 2版本构建商	2009年12期_Visual+Studio+2010和.NET+4.0+Beta+2发布.pdf	http://sso.cdclib.org/interlibSSO/goto/6/=06190596Z93/kcms/detail/detail.aspx?dbCode=cjfq&filename=ITSJ200912011&dbname=CJFD0910
Play! 一个颠覆Java EE规范的Web开发框架	程序员	2009	2009年12期	【作者】 范凯 ；	Java EE ； Play ； Web开发 ； 开发速度 ； 类库 ； 易用性 ； 实现机制 ； 动态语言 ； 数据库访问 ； 搜索引擎优化 ；	<正>Play!Framework刚刚发布了1.0正式版本,这标志着Play!框架开始走向成熟,可以作为一个在商业项目当中严肃考虑的JavaWeb开发框架被引入。Play!为什么如此引得Java社区的关注?首先,Play!	2009年12期_Play!+一个颠覆Java+EE规范的Web开发框架.pdf	http://sso.cdclib.org/interlibSSO/goto/6/=06190596Z93/kcms/detail/detail.aspx?dbCode=cjfq&filename=ITSJ200912012&dbname=CJFD0910
移动时代的建模	程序员	2009	2009年12期	【作者】 潘加宇 ； 【机构】 UMLChina ；	手机应用 ； 中国移动 ； Store ； 移动世界 ； Android ； 移动应用 ； 状态机 ； 软件质量 ； 状态图 ； 目标人群 ；	<正>一个个App Sto re的成功故事激励开发人员跃跃欲试,准备编写自己的手机应用到App Store、Android Market、中国移动MM的大海中淘金。也许有的开发人员认为,手机上的"小"应用不需要建模。其实并非如此,市场没有"小"项目可言。手机应用需求从何而来,是靠拍脑袋和灵光一闪吗?其实,手机应用只不过是面对的"组织"发生了变化,不再是	2009年12期_移动时代的建模.pdf	http://sso.cdclib.org/interlibSSO/goto/6/=06190596Z93/kcms/detail/detail.aspx?dbCode=cjfq&filename=ITSJ200912013&dbname=CJFD0910
不紧不慢的欧盟	程序员	2009	2009年12期	【作者】 叶亮 ；	美国司法部 ； 确凿证据 ； MySQL ； Orade ； Amazon ； 市场竞争 ； 数据库产品 ； 测试版 ； 启动时间 ； Notes ；	<正>日前,欧盟委员会针对Oracle与Sun的并购案提出的"异议声明",指出收购MySQL可能会引发垄断的顾虑。Oracle和美国司法部反垄断局对此都发表了申明。Oracle认为欧盟委员会并没有确凿证据证明该并购交易不利于市场竞争;而美国反垄	2009年12期_不紧不慢的欧盟.pdf	http://sso.cdclib.org/interlibSSO/goto/6/=06190596Z93/kcms/detail/detail.aspx?dbCode=cjfq&filename=ITSJ200912014&dbname=CJFD0910
真实的流言	程序员	2009	2009年12期	【作者】 马宁 ；	显示芯片 ； 手机操作系统 ； Nokia ； 平板电脑 ； 会将 ； DirectX ； Symbian ； 发展趋势 ； Plug ；	<正>这个月的故事从一个流言讲起,ZuneX是什么?据说是微软即将推出的游戏掌机,采用了Intel Atom CPU和Nvidia显示芯片,128M内存和32G闪存。ZuneX支持蓝牙、WiFi和HSDPA等网络,可以与Xbox进行联机。我们无法证实传言,但目前发布的Zune HD采用了Nvidia Tegra芯片,有非	2009年12期_真实的流言.pdf	http://sso.cdclib.org/interlibSSO/goto/6/=06190596Z93/kcms/detail/detail.aspx?dbCode=cjfq&filename=ITSJ200912015&dbname=CJFD0910
Amazon进一步开拓云数据服务市场 微软将结束两版本SQL Server支持	程序员	2009	2009年12期	【作者】 王翔 ；	MySQL ； Amazon ； SQL Server ； 开发机构 ； 异构资源 ； 集成问题 ； 远程管理 ； 安全补丁 ； 高端用户 ； Password ；	<正>亚马逊作为云计算的先导厂家开放了基于MySQL的全新RDS服务(RelationalDatabase Service),目的是向开发机构提供关系数据库支持。RDS服务采用MySQL建设,每个数据库实例可	2009年12期_Amazon进一步开拓云数据服务市场+微软将结束两版本SQL+Server支持.pdf	http://sso.cdclib.org/interlibSSO/goto/6/=06190596Z93/kcms/detail/detail.aspx?dbCode=cjfq&filename=ITSJ200912016&dbname=CJFD0910
尊重客户的云计算	程序员	2009	2009年12期	【作者】 钱宏武 ；	人能 ； 互联网门户 ； Orade ； 软件开发 ； 商业环境 ； 邮件服务 ； 不知道 ； 就是你 ； 朵云 ； 开发者 ；	<正>上个月是光棍们的月份,每年信誓旦旦的兄弟们,不知道今年如何,首先祝福每个人能找到自己的另一半:而对于很多公司来说,他们的另一半——客户,可能是他们不能一直保持尊重的,起码不像他们所说的那样。	2009年12期_尊重客户的云计算.pdf	http://sso.cdclib.org/interlibSSO/goto/6/=06190596Z93/kcms/detail/detail.aspx?dbCode=cjfq&filename=ITSJ200912017&dbname=CJFD0910
国际化的中国网游	程序员	2009	2009年12期	【作者】 赵青 ；	游戏公司 ； 魔兽世界 ； 游戏行业 ； 互联网接入 ； 越权行为 ； 世界先进水平 ； 海外收购 ； 三定 ； 审批部门 ； 开发过程 ；	<正>近日搜狐畅游对外宣布已与Crytek公司达成协议,在国内率先引进CryEngine3引擎用于3D网络游戏的开发,搜狐畅游也成为中国首家拥有CryEngine3引擎使用权的网络游戏公司。在此之前畅游已签下了BigWorld引擎,进军3D网游的	2009年12期_国际化的中国网游.pdf	http://sso.cdclib.org/interlibSSO/goto/6/=06190596Z93/kcms/detail/detail.aspx?dbCode=cjfq&filename=ITSJ200912018&dbname=CJFD0910
聚会的季节	程序员	2009	2009年12期	【作者】 肖新光 ； 【机构】 安天实验室 ；	CERT ； 国家安全 ； 中国信息安全 ； 软件安全 ； 学术底蕴 ； 挖掘工具 ； 文件格式 ； 犯罪事件 ； 南派 ； 事中 ；	<正>关于年底的评价,CanSecWest、EUSEC都在近期召开,而被迟滞数月的CERT2009年会也终于在长沙召开。这次以"网络促进发展安全创造价值"为主题。此外,本次会议上还举行了国家安全漏洞共享平台签约	2009年12期_聚会的季节.pdf	http://sso.cdclib.org/interlibSSO/goto/6/=06190596Z93/kcms/detail/detail.aspx?dbCode=cjfq&filename=ITSJ200912019&dbname=CJFD0910
软硬件施筑同盟提价、标准也潮流	程序员	2009	2009年12期	【作者】 贾菡 ；	金蝶国际软件 ； 企业管理软件 ； 汽车零部件行业 ； 张侠 ； 研发者 ； 管理模式 ； 行业解决方案 ； 企业管理系统 ； 销售总收入 ； 大中华区 ；	<正>金蝶国际软件日前宣布:发布全球第一款融合TOGAF标准SOA架构的企业管理软件EAS7,旨在为危机后的中国企业带来全新的解决方案,以期支持日益成熟的中国管理模式走向成功。今年5月,金蝶获	2009年12期_软硬件施筑同盟提价、标准也潮流.pdf	http://sso.cdclib.org/interlibSSO/goto/6/=06190596Z93/kcms/detail/detail.aspx?dbCode=cjfq&filename=ITSJ200912020&dbname=CJFD0910
动态语言的GIS开发插件	程序员	2009	2009年12期	【作者】 高昂 ； 【机构】 资源与环境信息系统国家重点实验室 ；	地理数据 ； 动态语言 ； 地图要素 ； GIS开发 ； 地图应用 ； 地图数据 ； 空间查询 ； 投影转换 ； 地理要素 ； 模型定义 ；	<正>在以Google Maps为代表的众多网络地图应用的推动下,GIS开发已成为当前热点,与此同时,动态语言在GIS开发中的应用也越来越广泛。对于Django的开发者,使用GeoDjango(http://geodjango.org/)在应用中嵌入地图要素无疑是再合适不过的。GeoDjango是一款支持地理数据存	2009年12期_动态语言的GIS开发插件.pdf	http://sso.cdclib.org/interlibSSO/goto/6/=06190596Z93/kcms/detail/detail.aspx?dbCode=cjfq&filename=ITSJ200912021&dbname=CJFD0910
虚拟化之群雄争霸	程序员	2009	2009年12期	【作者】 蒋海鸥 ； 【机构】 华中科技大学计算机系 ；	群雄争霸 ； 用户大会 ； 全球客户 ； 服务器虚拟化 ； 虚拟机 ； 数据中心 ； 存储虚拟化 ； NetApp ； 虚拟服务器 ； Orade ；	<正>今年,一年一度的虚拟化用户大会在北京隆重举行。该大会是VMware全球客户活动的重要组成部分,是VMware中国举办的第三届虚拟化用户大会。大会以"秉云之势,乘虚而入"为主题,秉承创新的理念,主要阐述"借助虚拟化技术和	2009年12期_虚拟化之群雄争霸.pdf	http://sso.cdclib.org/interlibSSO/goto/6/=06190596Z93/kcms/detail/detail.aspx?dbCode=cjfq&filename=ITSJ200912022&dbname=CJFD0910
Tech·Ed 2009微软技术大会	程序员	2009	2009年12期	【作者】 胡长城 ；	Ed 2009 ； Tech ； Android ； 应用领域 ； 新增功能 ； 网络设备制造 ； 个人消费者 ； 移动应用 ； 国家会议中心 ； 电信设备 ；	<正>距离10月底的SD2.0大会已经一个月了,但高焕堂的"Android潮流下的赢家定位",和王煜全的"3G时代下,移动应用领域的应用开发机会"的精彩内容还时不时让我回味。跳过SD 2.0大会,接下来的一个多月,几乎就是"微软月"。先来看看几个重要事件:	2009年12期_Tech·Ed+2009微软技术大会.pdf	http://sso.cdclib.org/interlibSSO/goto/6/=06190596Z93/kcms/detail/detail.aspx?dbCode=cjfq&filename=ITSJ200912023&dbname=CJFD0910
前端开发工具概览	程序员	2009	2009年12期	【作者】 徐基伟 ； 【机构】 淘宝网 ；	前端开发工具 ； 开发环境 ； 开发工程师 ； 性能优化 ； Developer ； 本地文件 ； 调试工具 ； 重定向 ； 人员选择 ； 性能检测 ；	<正>由于前端开发工程师面临着更为复杂的开发环境。因此,完善自身的开发环境,更高效地写出健壮的代码,对于前端开发工程师而言,显得尤为重要。调试。说到前端开发平台,不得	2009年12期_前端开发工具概览.pdf	http://sso.cdclib.org/interlibSSO/goto/6/=06190596Z93/kcms/detail/detail.aspx?dbCode=cjfq&filename=ITSJ200912024&dbname=CJFD0910
新闻	程序员	2009	2009年12期		台湾经济 ； 云计算技术 ； 执行长 ； 科技业 ； 研究中心 ； 电子产品 ； 工程师们 ； 首席咨询师 ； 软件开发商 ； 开发者 ；	<正>微软将在台湾设立亚洲第一座云计算研发中心微软日前与台湾经济部签署合作备忘录,将在未来一年内于台湾设立一座云计算技术的研究中心。随着云端技术成为新一代的科技业显学,这将是微软在亚洲的第一座云计算技术研发中心,预期将可结合诸如广达及鸿海等台湾众多的委	2009年12期_新闻.pdf	http://sso.cdclib.org/interlibSSO/goto/6/=06190596Z93/kcms/detail/detail.aspx?dbCode=cjfq&filename=ITSJ200912025&dbname=CJFD0910
技术人员不应错过的技术盛宴——2009年中国软件开发2.0(SD2.0)大会纪实	程序员	2009	2009年12期	【作者】 付江 ；	软件开发 ； SD2.0 ； 国内软件 ； 技术界 ； 温都水城 ； 应用服务 ； 千人 ； 技术人员 ； 可信赖性 ； 日至 ；	<正>继成功举办两届中国软件开发2.0(SD2.0)大会之后,10月22日至24日于北京温都水城,2009年SD2.0大会如期而至。作为国内软件技术界最高水平的年度性千人技术盛宴,大会邀请了众多海外软件专家及多名来自国内外的一线	2009年12期_技术人员不应错过的技术盛宴——2009年中国软件开发2.0(SD2.0)大会纪实.pdf	http://sso.cdclib.org/interlibSSO/goto/6/=06190596Z93/kcms/detail/detail.aspx?dbCode=cjfq&filename=ITSJ200912026&dbname=CJFD0910
2009微软技术大会纪实	程序员	2009	2009年12期	【作者】 白苗 ；	四大洋 ； 数据库管理员 ； 国家会议中心 ； 大群 ； 王文彬 ； 触摸技术 ； 商用客户 ； 技术人员 ； 系统管理员 ； 首席架构师 ；	<正>11月5日,气势恢弘的国家会议中心迎来了一大群行色匆匆的人,这些来自五湖四海,甚至是五大洲四大洋的参会者,大多数都是一线的技术人员,它们当中有程序员、数据库管理员、系统管理员等不同的角色。超过6000人齐聚一堂,是为了参加今年的微软	2009年12期_2009微软技术大会纪实.pdf	http://sso.cdclib.org/interlibSSO/goto/6/=06190596Z93/kcms/detail/detail.aspx?dbCode=cjfq&filename=ITSJ200912027&dbname=CJFD0910
开源GIS盛会FOSS4G 2009报道	程序员	2009	2009年12期	【作者】 高昂 ；	地理信息 ； 开源项目 ； 澳大利亚悉尼 ； 研究机构 ； 捐助者 ； FOSS4G 2009 ； GIS ； 教育组织 ； 开发者 ； 地理数据 ；	<正>开源地理信息大会FOSS4G于2009年10月20日至23日在澳大利亚悉尼举行。众多开源GIS社区的开发者、捐助者、使用者,以及相关研究机构和教育组织的开源GIS用户在FOSS4G大会齐聚一堂,聆听FOSS4G大会近百	2009年12期_开源GIS盛会FOSS4G+2009报道.pdf	http://sso.cdclib.org/interlibSSO/goto/6/=06190596Z93/kcms/detail/detail.aspx?dbCode=cjfq&filename=ITSJ200912028&dbname=CJFD0910
SAP TechEd 2009聚焦生态系统和可持续发展——全球高级执行董事谈SOA与On-Demand融合	程序员	2009	2009年12期	【作者】 付江 ；	On-Demand ； SOA ； 全球技术 ； 研发者 ； 生态系统 ； 开放式创新 ； 施杰 ； 报表工具 ； 无限延伸 ； 指导准则 ；	<正>11月11日,历时两天、由SAP中国研究院主办的全球技术研发者大会(SAP TechEd 2009)在上海举行。本次大会以"无限延伸您的影响力"为主题,据悉共有超过1500名包括客户、合作伙伴、业内专家以及潜在客户在	2009年12期_SAP+TechEd+2009聚焦生态系统和可持续发展——全球高级执行董事谈SOA与On-Demand融合.pdf	http://sso.cdclib.org/interlibSSO/goto/6/=06190596Z93/kcms/detail/detail.aspx?dbCode=cjfq&filename=ITSJ200912029&dbname=CJFD0910
UOF:中国文档标准进入产业化	程序员	2009	2009年12期	【作者】 白苗 ；	文档标准 ； UOF ； 金山软件 ； 倪光南 ； 中国工程院院士 ； 国产软件 ； 成果汇报 ； 业内厂商 ； 拱手让人 ； 开发包 ；	<正>10月28日,金山软件在北京召开"UOFSDK网站开通发布会暨金山软件UOF成果汇报会"。中国工程院院士倪光南、中国电子技术标准化研究所科技部副主任兼国际标准化部主任吴志刚、金山办公软件公司CEO葛珂等来自国内标准化组织	2009年12期_UOF:中国文档标准进入产业化.pdf	http://sso.cdclib.org/interlibSSO/goto/6/=06190596Z93/kcms/detail/detail.aspx?dbCode=cjfq&filename=ITSJ200912030&dbname=CJFD0910
开源社区的公益之路	程序员	2009	2009年12期	【作者】 丁莹 ；	开源社区 ； 农民工子弟 ； 电脑设备 ； 教学设备 ； 信息化教学 ； 笔记本电脑 ； 信息化设备 ； 一所 ； 教育平台 ； 这一天 ；	<正>11月12日,Gdium龙芯实验室开幕典礼在朝阳区的一所农民工子弟学校——文德学校隆重举行。那一天雪后的北京十分寒冷,但是每位与会者却因为这场爱的传递而热血沸腾。	2009年12期_开源社区的公益之路.pdf	http://sso.cdclib.org/interlibSSO/goto/6/=06190596Z93/kcms/detail/detail.aspx?dbCode=cjfq&filename=ITSJ200912031&dbname=CJFD0910
李开复:我要找什么样的人一起创业?	程序员	2009	2009年12期	【作者】 闫辉 ； 杨东杰 ；	李开复 ； 创业公司 ； 商业计划 ； 创业资源 ； 核心优势 ； 马化腾 ； 一个问题 ； 张朝阳 ； 失败经验 ； 微软研究院 ；	<正>当本刊记者走进创新工场办公室时,稍显纷乱的布置表明这是一个创建不久的公司。但桌子上放置的《世界因你不同——李开复自传》的书籍好像在阐释这里的与众不同。	2009年12期_李开复:我要找什么样的人一起创业?.pdf	http://sso.cdclib.org/interlibSSO/goto/6/=06190596Z93/kcms/detail/detail.aspx?dbCode=cjfq&filename=ITSJ200912032&dbname=CJFD0910
《设计模式》15年 Erich、Richard、Ralph访谈录	程序员	2009	2009年12期	【作者】 Larry O’Brien ； 卢鸫翔 ；	Ralph ； 设计原理 ； Erich ； Richard ； 面向对象的 ； 软件设计 ； 模板方法 ； Smalltalk ； 极限编程 ； 依赖注入 ；	2009年是《设计模式》出版15周年。15年来,《设计模式》一书影响了整整一代程序员,而且可以预料,它的影响还将继续下去。作者Erich Gamma、Richard Helm、Ralph Johnson、John Vlissides四人由于首次在本书中提出面向对象的23种模式而知名,被开发者昵称为GoF(Gang of Four),15年后,书中的观点是否有新的变化?作者们又有哪些新的认识?设计模式当前以及未来的发展情况如何?值此周年之际,本刊特别组织了"设计模式15年纪念专题",希望通过这些话题的讨论,带给读者新的启迪。感谢InformIt网站的中文授权,感谢华章出版社的相关协助!	2009年12期_《设计模式》15年+Erich、Richard、Ralph访谈录.pdf	http://sso.cdclib.org/interlibSSO/goto/6/=06190596Z93/kcms/detail/detail.aspx?dbCode=cjfq&filename=ITSJ200912033&dbname=CJFD0910
为什么要写《设计模式》?	程序员	2009	2009年12期	【作者】 Erich Gamma ； Richard Helm ； Ralph Johnson ； John Vlissides ； 王海鹏 ；	设计约束 ； 面向对象 ； Smalltalk ； 规格说明 ； 实例化 ； 可扩展性 ； 标准模板 ； 数据表示 ； 建筑设计 ； 习惯用法 ；	设计模式15周年之际,我们重新将《设计模式》作者——"四人帮"于1994年发表于Addison-Wesley’s Innovations newsletter的文章刊登出来,在这篇文章中,四位作者阐述了写作《设计模式》一书的初衷及目的。15年之后,让我们重温旧文,再次体味其中的要旨!	2009年12期_为什么要写《设计模式》?.pdf	http://sso.cdclib.org/interlibSSO/goto/6/=06190596Z93/kcms/detail/detail.aspx?dbCode=cjfq&filename=ITSJ200912034&dbname=CJFD0910
走任何极端都是错误的	程序员	2009	2009年12期	【作者】 Grady Booch ； 罗小平 ； 【机构】 UML ；	面向对象方法 ； 面向对象语言 ； Netscape ； 现代软件开发 ； 抽象层 ； 架构师 ； Yahoo ； 程序结构 ； 特定任务 ； 图形描述 ；	<正>1994年,Web初生,Netscape、Yahoo等相继成立,OS/2、Windows 3.11、PHP等陆续发布,面向对象方法开始进入业界视野,程序员开始为是否选择著名的面向对象语言C++举棋不定。为用瀑布模式还是迭代模式争论不休。这一切表明,软件的复杂度正陡然上升。	2009年12期_走任何极端都是错误的.pdf	http://sso.cdclib.org/interlibSSO/goto/6/=06190596Z93/kcms/detail/detail.aspx?dbCode=cjfq&filename=ITSJ200912035&dbname=CJFD0910
