title	journal_name	year	issue	author	keywords	summary	pdf_filename	article_url
拥抱PaaS的改变	程序员	2009	2009年07期	【作者】 李战 ；	互联网资源 ； 平台服务 ； PaaS ； 开发者 ； 开发模式 ； 平台模式 ； 第三方 ； 接入能力 ； 平台化 ； 虚拟机 ；	程序员在钻研技术的同时,要更加贴近用户,真正从用户的需求入手来选择不同的技术手段。这是一个商业驱动技术的年代,或许技术的进步可以促进新的商业模式,但总体的方向是商业驱动技术。	2009年07期_拥抱PaaS的改变.pdf	http://sso.cdclib.org/interlibSSO/goto/6/=06190596Z93/kcms/detail/detail.aspx?dbCode=cjfq&filename=ITSJ200907051&dbname=CJFD0910
走向PaaS的阿里旺旺	程序员	2009	2009年07期	【作者】 扬琴 ； 闻波 ； 【机构】 阿里软件平台事业部 ； 阿里软件桌面平台 ；	阿里旺旺 ； PaaS ； 淘宝 ； 即时通讯工具 ； 网络交易 ； 网络贸易 ； 用户需求 ； 支付宝 ； 第三方 ； 商务用户 ；	<正>随着互联网的成熟和普及,用户之间基于互联网的关系正在逐步发生变化,也正是这种变化,推动着阿里旺旺的发展和变革。互联网的发展历史是一个挖掘用户需求然后满足用户需求的过程。阿里旺旺的发展同样如此,随着互联网的成熟和普及,用户之间基于互联网的关系正在逐步发生变化,也正是这种变化,推动着阿里旺旺的发展和变革。	2009年07期_走向PaaS的阿里旺旺.pdf	http://sso.cdclib.org/interlibSSO/goto/6/=06190596Z93/kcms/detail/detail.aspx?dbCode=cjfq&filename=ITSJ200907052&dbname=CJFD0910
我们在路上——QQ旋风2诞生之路	程序员	2009	2009年07期	【作者】 小虫 ；	超级旋风 ； 下载工具 ； QQ ； 资源下载 ； 视觉风格 ； 在路上 ； 腾讯 ； 下载资源 ； 完善性 ； 化繁为简 ；	<正>2006年,腾讯的第一款下载工具——"超级旋风"诞生了,在伴随用户的4年中,主创人员将主要的精力都投入到了完善性能和资源等方面。但是,随着市场上各类下载产品的日渐成熟,用户的要求也越来越高了。从超级旋风用户的反馈以及用户可用性测试的结果中可	2009年07期_我们在路上——QQ旋风2诞生之路.pdf	http://sso.cdclib.org/interlibSSO/goto/6/=06190596Z93/kcms/detail/detail.aspx?dbCode=cjfq&filename=ITSJ200907053&dbname=CJFD0910
GEEK产品	程序员	2009	2009年07期		屏幕分辨率 ； GEEK ； 触控式 ； 检测目标 ； 耳机线 ； Bright ； 洗衣服 ；	<正>Eee Keyboard PC该产品是华硕在超轻笔记本之后,又推出的一款集成了一块小小的显示屏的键盘。当然它也完全可以作为一个正常的电脑来用,键盘上5寸的触控式屏幕分辨率为800×480,	2009年07期_GEEK产品.pdf	http://sso.cdclib.org/interlibSSO/goto/6/=06190596Z93/kcms/detail/detail.aspx?dbCode=cjfq&filename=ITSJ200907054&dbname=CJFD0910
新产品&新工具	程序员	2009	2009年07期		ActionScript ； Safari ； 代码生成 ； 页面崩溃 ； 应用程序 ； 屏幕共享 ； 网络会议 ； 符号识别 ； 高亮显示 ； 用户资料 ；	<正>FlashDevelop 3.0.0 RTM FlashDevelop是一款将开放源代码面向Flash/Action Script开发的IDE。FlashDevelop本身采用。NET开发而成,可以运行在Windows环境之中。FlashDevelop除了支持ActionScript2/3以外,还支持HTML、JavaScript、CSS	2009年07期_新产品&新工具.pdf	http://sso.cdclib.org/interlibSSO/goto/6/=06190596Z93/kcms/detail/detail.aspx?dbCode=cjfq&filename=ITSJ200907055&dbname=CJFD0910
新书上架	程序员	2009	2009年07期		虚拟机 ； 敏捷软件开发 ； 企业级应用 ； 电子工业出版社 ； 开发过程 ； 胡嘉 ； 软件技术发展 ； 软件测试 ； 动态网站 ； 一本 ；	<正>企业级虚拟机应用实战:玩转VMwareⅥ、Hyper-ⅤR2、Xen Server作者:胡嘉玺出版社:电子工业出版社这是一本通俗易懂的虚拟机图书。该书完整介绍了目前最流行的企业级虚拟机产品,包括VMwareⅥ/vSphere、微软	2009年07期_新书上架.pdf	http://sso.cdclib.org/interlibSSO/goto/6/=06190596Z93/kcms/detail/detail.aspx?dbCode=cjfq&filename=ITSJ200907056&dbname=CJFD0910
Android系统开发问题杂谈	程序员	2009	2009年07期	【作者】 李亮 ；	Android ； 应用程序 ； 开发方式 ； 平台软件 ； 定制系统 ； 软件架构设计 ； 应用软件 ； 软件开发与管理 ； 链接库 ； Magic ；	<正>Android系统自从发布以来,特别是HTC G1以及最近的Magic上市,不但造成了手机业界的轰动,也吸引了众多开发人员的目光。从其上的应用程序的开发方式来看,基于Java的开发比起同样是大热门的iPhone来无疑门槛相对要低一些。另一方面,由于Android是	2009年07期_Android系统开发问题杂谈.pdf	http://sso.cdclib.org/interlibSSO/goto/6/=06190596Z93/kcms/detail/detail.aspx?dbCode=cjfq&filename=ITSJ200907057&dbname=CJFD0910
程序员的十层楼(二)	程序员	2009	2009年07期	【作者】 周伟明 ； 【机构】 IBM ；	读者反馈 ； 体能消耗 ； 一层楼 ； 数据结构与算法 ； 二字 ； 巴科斯 ； 面向对象设计 ； 基数排序 ； 高级编程语言 ； 快速排序 ；	<正>本文在网络发表后深受好评,根据读者反馈,作者对原稿重新做了修订,本刊将分三期连载。第6层学者当"专家"们想继续往上一层楼爬时,他们几乎一眼就可以看到楼梯的入口,不过令他们吃惊的是,楼梯入口处竖了一道高高的门槛,上面写着"创新"二字。不幸的是,大多数人在爬到第5层楼时已经体能消耗过度,无力翻过这道门槛。	2009年07期_程序员的十层楼(二).pdf	http://sso.cdclib.org/interlibSSO/goto/6/=06190596Z93/kcms/detail/detail.aspx?dbCode=cjfq&filename=ITSJ200907059&dbname=CJFD0910
PaaS的机遇与挑战	程序员	2009	2009年07期		版本升级 ； 云时代 ； PaaS ； 开发者 ； 第三方 ； 生态系统 ； 翻门 ； 人说 ；	<正>随着云计算逐渐深入人心,PaaS这个概念也逐渐被人们接受。PaaS的低开发门槛造就了低开发成本,而在线开发使得其几乎不用在部署上花费任何时间,与此同时,其在线的本质使用户不用为版本升级而头痛。作为第三方开发者,这意味着您可以和PaaS平台供应商组成一个双赢的生态系统,各司所长共同发展。因此,有人说:云时代的应用开发,编程技术已不再重要,重要的是应用本身!	2009年07期_PaaS的机遇与挑战.pdf	http://sso.cdclib.org/interlibSSO/goto/6/=06190596Z93/kcms/detail/detail.aspx?dbCode=cjfq&filename=ITSJ200907060&dbname=CJFD0910
大家帮助大家	程序员	2009	2009年06期	【作者】 孟迎霞 ；	男同学 ； 合作企业 ； 项目驱动 ； 大中华区 ； 项目经验 ； 校企合作模式 ； 寇先 ； 就业合同 ； 周立功 ； 传播系 ；	<正>最近杂志社要招聘编辑,于是收到很多份简历,其中包括不少即将毕业的大学生。看成绩单,高分者不少,但问到当今软件业界的一些知名企业和产品,却空白得如同一张白纸。印象最深的有一位来自江西某所大学计算机专业的男同学,他出身于一个贫寒的农村家庭,课内成绩非常优秀,但缺乏实际编程项目经验。于是,在第四学期,家里凑足了1.4万元,联系学校推荐的合作企业,	2009年06期_大家帮助大家.pdf	http://sso.cdclib.org/interlibSSO/goto/6/=06190596Z93/kcms/detail/detail.aspx?dbCode=cjfq&filename=ITSJ200906001&dbname=CJFD0910
Sun进军RIA之利器——JavaFX缔造者Chris Oliver	程序员	2009	2009年06期	【作者】 吕娜 ；	Oliver ； 计算机科学家 ； JavaFX ； RIA ； Sun ； 软件工程师 ； 创业型 ； 空闲时间 ； 首席技术官 ； 技术创造 ；	<正>Chris Oliver是Sun的高级软件工程师,是如今Sun进军RIA之利器——JavaFX的缔造者。这位极具个性的软件工程师自小叛逆,Chris说:"当我还是孩子的时候就知道,我绝对不会想成为一名计算机科学家。"尽管父母分别是麻省理工和哈佛的教授,Chris却选择不上大学。19岁时Chris在赌场里找了份工作,并利用空闲时间自学编程。后来加入了SeeBeyond公司成为一名高级工程师,这是洛杉矶的一家做EAI(现在的SOA)的创业型公司。	2009年06期_Sun进军RIA之利器——JavaFX缔造者Chris+Oliver.pdf	http://sso.cdclib.org/interlibSSO/goto/6/=06190596Z93/kcms/detail/detail.aspx?dbCode=cjfq&filename=ITSJ200906004&dbname=CJFD0910
从音乐看SOA与智慧地球	程序员	2009	2009年06期	【作者】 寇卫东 ； 【机构】 IBM软件集团 ；	策略发布 ； 智慧地球 ； SOA ； 绿色未来 ； 业务流程 ； 服务总线 ； 复调 ； 商业智能 ； 应用服务 ； 主题概念 ；	<正>不久前,以"点亮智慧的地球"为主题的2009年IBM论坛和中国策略发布会在北京举行。在论坛上,大家针对当今国际经济形势,分析了中国企业的机遇与挑战,从新锐洞察、智慧运作、动态架构、绿色未来四个方面,分享了建设"智慧的地球"的具体路径。并且举行"智慧的社会"、"智慧的城市"、	2009年06期_从音乐看SOA与智慧地球.pdf	http://sso.cdclib.org/interlibSSO/goto/6/=06190596Z93/kcms/detail/detail.aspx?dbCode=cjfq&filename=ITSJ200906005&dbname=CJFD0910
SOA从应用开始	程序员	2009	2009年06期	【作者】 黄柳青 ； 【机构】 普元软件公司 ；	中间件产品 ； 软件接口 ； 中间件平台 ； 业务流程 ； 概念炒作 ； SOA ； 企业软件 ； 服务开发 ； 信息系统 ； 应用系统 ；	<正>有人说IT是一个概念炒作的行业,没几年就出来一个新的概念。SOA这个主题经过几年的热议,是不是真的能够成为信息化建设的主流?SOA有没有比较成熟的切实可行的技术和方法可以推广?SOA有哪些措施更符合我们中国的特色?在多年的实践之后,我们很高兴和大家分享。	2009年06期_SOA从应用开始.pdf	http://sso.cdclib.org/interlibSSO/goto/6/=06190596Z93/kcms/detail/detail.aspx?dbCode=cjfq&filename=ITSJ200906006&dbname=CJFD0910
成本与创新的博弈	程序员	2009	2009年06期	【作者】 芮祥麟 ； 【机构】 SAP中国研究院 ；	商业周期 ； 熊彼得 ； 景气循环 ； 生产要素 ； 经济发展 ； 世界经济格局 ； 外部技术 ； 生产条件 ； 企业预算 ； 持续性 ；	<正>创新这一概念的提出,可以追溯到1912年美籍经济学家熊彼特(Joseph Alois Schumpeter)的《经济发展概论》:创新,即把一种新的生产要素和生产条件的"新结合"引入生产体系。而在熊彼得最常被引用的"商业周期"经济学主张中,早在上一个经济危机时他就提出:"当景气循环到谷底的同时,也是某些企业家不得不考虑退出市场或是另一些企业家必须要以‘创新’求生存的时候"。	2009年06期_成本与创新的博弈.pdf	http://sso.cdclib.org/interlibSSO/goto/6/=06190596Z93/kcms/detail/detail.aspx?dbCode=cjfq&filename=ITSJ200906007&dbname=CJFD0910
结构设计——软件开发实践的灵魂	程序员	2009	2009年06期	【作者】 万南洋 ； 【机构】 深圳证券通信有限公司 ；	软件开发 ； 软件工程 ； 结构设计 ； 软件体系结构 ； 软件系统 ； 设计层次 ； 软件设计 ； 结构化方法 ； 信息世界 ； 程序结构 ；	<正>我们知道,软件工程是一门综合性学科,它包括哲学、基础科学、技术科学、工程管理四个知识层次。软件方法哲学决定着整个学科建立的指导思想、认识论和世界观,是软件开发实践的基础。客观世界由事物及事物间的相互作用(在此称之为"过程")构成,软件实质上是客观世界在信息世界的描述,客观世界有其自身结构和运行规律,	2009年06期_结构设计——软件开发实践的灵魂.pdf	http://sso.cdclib.org/interlibSSO/goto/6/=06190596Z93/kcms/detail/detail.aspx?dbCode=cjfq&filename=ITSJ200906008&dbname=CJFD0910
业界新闻	程序员	2009	2009年06期		业界新闻 ； 网络游戏开发 ； 创业投资基金 ； 英菲尼迪 ； 产业动态 ； 谷歌 ； 创新大会 ； 开发者 ； 运营公司 ； 网络应用服务 ；	<正>新闻游戏产业动态"798GAME"获巨额投资2009年5月18日,网络游戏开发及运营公司一网娱乐科技有限公司(798GAME),获得了IDG技术创业投资基金和香港英菲尼迪投资有限公司总计2000万美元的共同投资。网游代练月收入高达5000元目前,一些网络游戏高手,以代替他人玩游戏以提升游戏角色级别或获取特定道具为职业获得收入。现在,更有不少专门的网游代练公司成立,并开辟了对外业务,为外国玩家提供服务。	2009年06期_业界新闻.pdf	http://sso.cdclib.org/interlibSSO/goto/6/=06190596Z93/kcms/detail/detail.aspx?dbCode=cjfq&filename=ITSJ200906009&dbname=CJFD0910
主编观察	程序员	2009	2009年06期		Symbian ； 开源项目 ； Store ； 开发者 ； 资本支出 ； 社区网站 ； 基础设施 ； 行代码 ； 高效经济 ； Nokia ；	<正>SymbianOS意味着什么当SymbianOS走进我们视野的时候,大家都很兴奋。确实,SymbianOS已经出现一段时间了。SymbianOS让人兴奋的原因是,它开源了!开源似乎也不是什么壮举。因为这个消息已经在一年之前发布了,而且SymbianOS并不是第一个开源的操作系统。SUN很早就把OpenSolaris开源了。但是由Symbian基金会支持的SymbianOS开源项目却有所不同。	2009年06期_主编观察.pdf	http://sso.cdclib.org/interlibSSO/goto/6/=06190596Z93/kcms/detail/detail.aspx?dbCode=cjfq&filename=ITSJ200906010&dbname=CJFD0910
并行,并行!	程序员	2009	2009年06期	【作者】 涂曙光 ； 【机构】 微软(中国)有限公司 ；	业务处理系统 ； 多线程 ； 制图软件 ； 软件开发人员 ； 并行运算 ； 多核技术 ； 开发工程师 ； 类库 ； 应用程序 ； 超线程技术 ；	<正>并行无疑已经成为了下一个开发领域的热点。随着Intel和AMD不断地将更多核心数量的CPU推向市场,软件开发人员面临的一大挑战就是如何有效地利用多个核心,写出能更好的引入并行运算的代码。用户绝不希望运行在自己的多核CPU之上的软件,却只能利用到一个CPU核心,或仅仅在少数的地方使用了多线程技巧。现代软件的复杂性,也要求开发人员能充分榨取到硬件所提供的每一分运算能力。无论是运行在客户端机器上的游戏、3D制图软件,还是运行在服务器上的数据库、业务处理系统,都开始向着并行的方向前进。	2009年06期_并行,并行!.pdf	http://sso.cdclib.org/interlibSSO/goto/6/=06190596Z93/kcms/detail/detail.aspx?dbCode=cjfq&filename=ITSJ200906011&dbname=CJFD0910
Oracle收购SUN不会改变Java社区	程序员	2009	2009年06期	【作者】 范凯 ； 【机构】 JavaEye社区 ；	曾经辉煌 ； 应用领域 ； Orade ； 企业应用开发 ； Java ； Oracle ； SUN ； 行业整合 ； 中间件产品 ； 应用软件开发 ；	<正>本月Oracle以74亿美元的价格收购了SUN公司。在这笔收购达成之前,SUN曾经先后传出和多家公司谈判收购的消息,其中最高调的一次是IBM收购SUN的传闻。SUN作为一家曾经辉煌的硅谷高科技公司,最终沦落到被收购的地步,让	2009年06期_Oracle收购SUN不会改变Java社区.pdf	http://sso.cdclib.org/interlibSSO/goto/6/=06190596Z93/kcms/detail/detail.aspx?dbCode=cjfq&filename=ITSJ200906012&dbname=CJFD0910
Borland被收购	程序员	2009	2009年06期	【作者】 潘加宇 ； 【机构】 UMLChina ；	Borland ； 官方网站公布 ； 模型驱动开发 ； 开发环境 ； 现金收购 ； 遗留系统 ； 版本管理 ； Focus ； Rational ； CMMI ；	<正>Borland在其官方网站公布消息,英国软件公司Micro Focus将以7500万美元现金收购Borland,双方董事会都已同意,收购最快于第二季度内完成。这个消息一出,网络上传来一片叹息。这几年Borland走的路线并不能说不正确。Borland本来是做代码集成开发环境,2002年依次收购了Boldsoft(模型驱动开发)、Starbase(配置和版本管理)	2009年06期_Borland被收购.pdf	http://sso.cdclib.org/interlibSSO/goto/6/=06190596Z93/kcms/detail/detail.aspx?dbCode=cjfq&filename=ITSJ200906013&dbname=CJFD0910
生命力顽强的开源世界	程序员	2009	2009年06期	【作者】 叶亮 ；	生命力顽强 ； 开源社区 ； MySQL ； Orade ； 人说 ； 开发环境 ； 开源数据库 ； 正版化 ； Solaris ； 联盟会 ；	<正>过去的这个月关于Oracle收购Sun结果的猜测和评论满天飞。有人说Oralce一定会砍掉某工具,有人说Oracle本来不想收购Sun的硬件业务,还有人说Oracle收购Sun对开源社区是噩梦。其实在什么都没确定的情况下,过分臆断并无意义。就像本栏上期所说的,开源世界	2009年06期_生命力顽强的开源世界.pdf	http://sso.cdclib.org/interlibSSO/goto/6/=06190596Z93/kcms/detail/detail.aspx?dbCode=cjfq&filename=ITSJ200906014&dbname=CJFD0910
3G前夜,还缺什么?	程序员	2009	2009年06期	【作者】 马宁 ；	世界电信日 ； 上网卡 ； 中国移动 ； 在线服务 ； Symbian ； 电子阅读器 ； Android ； 隐形成本 ； 超级明星 ； 盈利能力 ；	<正>5月17日,中国为今年的世界电信日增添了一抹亮色。移动运营商、手机厂商、芯片方案商整装待发,为3G做好准备。但在这支队伍里,是否缺少了什么? 3G业务最先会被应用在哪些设备上?智能手机、上网本?都不是,我	2009年06期_3G前夜,还缺什么?.pdf	http://sso.cdclib.org/interlibSSO/goto/6/=06190596Z93/kcms/detail/detail.aspx?dbCode=cjfq&filename=ITSJ200906015&dbname=CJFD0910
MySQL再次易主 开源旗手待新人接棒	程序员	2009	2009年06期	【作者】 王翔 ；	MySQL ； 商用产品 ； 开发基础 ； 后端 ； 数据库产品 ； 关系数据库 ； SQLServer ； 订单处理 ； execute ； 操作系统平台 ；	<正>甲骨文如愿将MySQL收入囊中。作为开源旗手,MySQL曾被视为最有希望占据市场高点、打破商用产品布局的先驱,可在被SUN收购后不久就出现了《Which SQL is MySQL》的争辩,而且SUN一直试图将MySQL与GlassFish嫁接在一起,为开源用户提供企业级的开源后端开发基础支	2009年06期_MySQL再次易主+开源旗手待新人接棒.pdf	http://sso.cdclib.org/interlibSSO/goto/6/=06190596Z93/kcms/detail/detail.aspx?dbCode=cjfq&filename=ITSJ200906016&dbname=CJFD0910
新休假 新5月	程序员	2009	2009年06期	【作者】 钱宏武 ； 【机构】 职脉网 ；	MySQL ； 手机电视 ； 开发包 ； 基础软件 ； 语义搜索 ； 互动信息 ； 律师函 ； 广电集团 ； 不知道 ； 市场炒作 ；	<正>这么多年,第一个不是7天假期的5月。这个仅仅算是长周末的假期,不知道是否仅仅是勾起了人们休息的欲望而已,而对于IT界来说,这种休息可能仅仅存在梦境中。	2009年06期_新休假+新5月.pdf	http://sso.cdclib.org/interlibSSO/goto/6/=06190596Z93/kcms/detail/detail.aspx?dbCode=cjfq&filename=ITSJ200906017&dbname=CJFD0910
别把孩子和脏水一起泼掉	程序员	2009	2009年06期	【作者】 赵青 ； 【机构】 九艺科技 ；	运营权 ； 魔兽世界 ； 九城 ； 永恒之塔 ； 杨教授 ； 中国青年报 ； 杀人放火 ； 现实生活 ； 客观存在 ；	<正>果然是真的,2009年6月之后,《魔兽世界》的运营权就要由九城变成网易了。传言变成了事实,虽然中间有很多的波折,虽然极富戏剧性,但都尘埃落定了。这次《魔兽世界》的运营权转移对三家公司——暴雪、九城、网易都意义深远,几年后我们可以看得更清楚。	2009年06期_别把孩子和脏水一起泼掉.pdf	http://sso.cdclib.org/interlibSSO/goto/6/=06190596Z93/kcms/detail/detail.aspx?dbCode=cjfq&filename=ITSJ200906018&dbname=CJFD0910
大事件 小安全	程序员	2009	2009年06期	【作者】 肖新光 ； 【机构】 安天实验室 ；	大事件 ； 商业垄断 ； 美国空军 ； 美国国家安全 ； 操作系统安全 ； 信息安全体系 ； 美国政府 ； 工程师们 ； 美国海军 ； 保鲜期 ；	<正>本月,《Wired》杂志称,美国空军因经济危机而无法大量采购新操作系统,因此希望微软单独延长对他们Windows XP系统的"保鲜期",继续提供补丁升级与操作系统安全定制。美国空军只是美国国家安全体系和作为商业垄断公司微软的接口人,而空军定制版Windows XP是一块已经开花的试验田,最终其会在整个美国政府和官方IT采购上结出果实,并很可能为微软新增数亿美元乃至	2009年06期_大事件+小安全.pdf	http://sso.cdclib.org/interlibSSO/goto/6/=06190596Z93/kcms/detail/detail.aspx?dbCode=cjfq&filename=ITSJ200906019&dbname=CJFD0910
1+52+1的红色巨人诞生	程序员	2009	2009年06期	【作者】 贾菡 ；	偏执狂 ； Ellison ； Orade ； 顶尖技术 ； 简化版 ； 应用服务 ； Larry ； 万马 ； 综合系统 ； 人力资源 ；	<正>Ellison和McNealy这两个偏执狂终于促成了Oracle和Sun的联姻。至此在这场历时4年耗资近500亿美元先后收购了52家软件公司的收购大战后,Oracle"打败"了蓝色巨人IBM成功收购了另一个巨头—Sun,以软件业红色巨人的姿态屹立在人们面前。	2009年06期_1+52+1的红色巨人诞生.pdf	http://sso.cdclib.org/interlibSSO/goto/6/=06190596Z93/kcms/detail/detail.aspx?dbCode=cjfq&filename=ITSJ200906020&dbname=CJFD0910
你是否关注Twitter的性能改进	程序员	2009	2009年06期	【作者】 高昂 ； 【机构】 资源与环境信息系统国家重点实验室 ；	技术圈 ； 信息传播方式 ； 竞选总统 ； Twitter ； 开源项目 ； MySQL ； 主流操作系统 ； 可伸缩性 ； 分布式内存 ； Messenger ；	<正>对我来说,Twitter火爆的最好证明,并非是奥巴马竞选总统时借助Twitter来推广执政理念,而是经常接触的技术圈好友,无一例外地出现在Twitter之上,并且喜欢上了Twitter的信息传播方式。	2009年06期_你是否关注Twitter的性能改进.pdf	http://sso.cdclib.org/interlibSSO/goto/6/=06190596Z93/kcms/detail/detail.aspx?dbCode=cjfq&filename=ITSJ200906021&dbname=CJFD0910
世界电信日	程序员	2009	2009年06期	【作者】 孙天泽 ； 【机构】 华清远见嵌入式培训中心 ；	世界电信日 ； 实质性启动 ； 世界电信展 ； 操作系统支持 ； 发起冲击 ； 规模性 ； 低成本优势 ； 掌上设备 ； 高端市场 ； 信息产业界 ；	<正>5月17日是世界电信日。从1969年开始,世界电信日已经整整经历了40年。在今年电信日来临之际,中国三大运营商也将全部推出3G服务,中国3G算是实质性启动。不过从新浪网公布的《全国3G网民调查报告》来看,网民对3G观望情绪浓厚,还远没有到开花结果的时候。资费固然	2009年06期_世界电信日.pdf	http://sso.cdclib.org/interlibSSO/goto/6/=06190596Z93/kcms/detail/detail.aspx?dbCode=cjfq&filename=ITSJ200906022&dbname=CJFD0910
企业应用开发	程序员	2009	2009年06期	【作者】 胡长城 ； 【机构】 普元软件 ；	企业应用开发 ； 应用领域 ； 产品策略 ； 开源社区 ； 电信日 ； 管理软件厂商 ； 应用架构 ； 终端应用 ； 上网安全 ； IMPAC ；	<正>上期刚刚交完《程序天下事》的稿件,就发生了Oracle收购Sun这件大事,在整个企业应用领域、开源社区都引起不小的轰动。Oracle在收购完Bea和Sun之后,在整个J2EE体系内,将变得更加充实;同时之前Oracle在社区和开源领域的弱势状况也将得以改观。以Oracle并购BEA之后对产品策略的调整和融合的能力来看(非常迅速果断),这次对Sun的产品线融合,应该也会很迅捷,我们拭目以待。	2009年06期_企业应用开发.pdf	http://sso.cdclib.org/interlibSSO/goto/6/=06190596Z93/kcms/detail/detail.aspx?dbCode=cjfq&filename=ITSJ200906023&dbname=CJFD0910
Web开发的改良	程序员	2009	2009年06期	【作者】 赵泽欣 ； 【机构】 淘宝UED团队 ；	工程师们 ； Web开发 ； 门户网 ； 技术发展 ； 最终阶段 ； 数据表格 ； 常用方式 ； 改良方案 ； 技术委员会 ； 开发者 ；	<正>最近网上再度兴起了CSS布局和table布局的争论。我最初颇有些不以为然:我原以为CSS布局的意义早已深入人心,却没想到还有这么多设计师及开发人员持有异议。静下心来看罢大家的讨论,一番细想,觉得原因可能有两个方面:	2009年06期_Web开发的改良.pdf	http://sso.cdclib.org/interlibSSO/goto/6/=06190596Z93/kcms/detail/detail.aspx?dbCode=cjfq&filename=ITSJ200906024&dbname=CJFD0910
加入Android阵营——记首届亚太地区Android技术大会	程序员	2009	2009年06期	【作者】 圣伟 ；	Android ； 中国联通 ； 移动服务 ； 中国移动 ； 手机操作系统 ； 开放手机联盟 ； 移动领域 ； 软硬结合 ； 韩国三星 ； 摩尔定律 ；	<正>Android,自2007年11月5日由Google发布伊始,就成为了移动领域的新生宠儿,备受业内关注。中国移动已经在Android基础上开发了自主的手机操作系统OPhone。而日前,中国联通也宣布将加入Google组建的开放手机联盟(OHA),这意味着中国联通也将开发支持Android平台的手机和移动服务。	2009年06期_加入Android阵营——记首届亚太地区Android技术大会.pdf	http://sso.cdclib.org/interlibSSO/goto/6/=06190596Z93/kcms/detail/detail.aspx?dbCode=cjfq&filename=ITSJ200906025&dbname=CJFD0910
