title	journal_name	year	issue	author	keywords	summary	pdf_filename	article_url
行在道上,从局部到全局——写在《大道至简》点评版出版之前	程序员	2009	2009年10期	【作者】 周爱民 ；	软件工程实践 ； 软件开发 ； 大道至简 ； 工程方法 ； 软件产品 ； 思维框架 ； 一本 ； 目标方向 ； 往何处去 ； 产品产出 ；	<正>五年前,因为偶然所得,我画下了一个名为"软件工程层状模型(EHM)"的图。随后,我在这个图的思维框架里面,回顾了自己数年以来的工程与软件开发实践,写下了一本《大道至简——软件工程实践者的思想》。从那时起,我一直徘	2009年10期_行在道上,从局部到全局——写在《大道至简》点评版出版之前.pdf	http://sso.cdclib.org/interlibSSO/goto/6/=06190596Z93/kcms/detail/detail.aspx?dbCode=cjfq&filename=ITSJ200910067&dbname=CJFD0910
SBC架构——解答了人类近2000年来的追寻	程序员	2009	2009年10期	【作者】 赵善中 ；	SBC ； 软件工程实践 ； 结构行为 ； 大道至简 ； 数学公式 ； 经济活动 ； 知识经济时代 ； 信息文明 ； 函数论 ； 体用不二 ；	在"行在道上,从局部到全局"这一篇文章里,周爱民很客气地讨论到我对他的书"大道至简——软件工程实践者的思想"的点评。在此关键点上,我一定要花些时间来介绍结构行为合一(StructureBehavior Coalescence,简称为SBC)的架构,要不然周爱民和我两个人之间的对话会永远没有交集。	2009年10期_SBC架构——解答了人类近2000年来的追寻.pdf	http://sso.cdclib.org/interlibSSO/goto/6/=06190596Z93/kcms/detail/detail.aspx?dbCode=cjfq&filename=ITSJ200910068&dbname=CJFD0910
三人谈:方法与选择——《大道至简(点评版)》摘选	程序员	2009	2009年10期		架构师 ； 软件架构 ； 软件工程 ； 软件开发 ； 大道至简 ； 软件设计 ； 面向对象 ； 代码分析 ； 面向过程 ； 信息管理 ；	<正>周爱民:人的精力终归是有极限的。提出新的"方法",解决的将是影响做事成效的根本问题。高焕堂:方法常常造就了懒人。数千年前,先贤创造的易经之方法,	2009年10期_三人谈:方法与选择——《大道至简(点评版)》摘选.pdf	http://sso.cdclib.org/interlibSSO/goto/6/=06190596Z93/kcms/detail/detail.aspx?dbCode=cjfq&filename=ITSJ200910069&dbname=CJFD0910
新书上架	程序员	2009	2009年10期		企业架构 ； 软件测试 ； 微软产品 ； 电子工业出版社 ； 测试工程师 ； 动态网页 ； 胡江 ； 测试流程 ； 攻防技术 ； 应用程序 ；	<正>我是一只IT小小鸟作者:胡江堂出版社:电子工业出版社一群IT小小鸟——来自十几所院校,或男生或女生;或科班,或半路转行。分布在不同的公司,或外企或国企,或民企,老板有土有洋。有失意,有快意;有泪水,	2009年10期_新书上架.pdf	http://sso.cdclib.org/interlibSSO/goto/6/=06190596Z93/kcms/detail/detail.aspx?dbCode=cjfq&filename=ITSJ200910070&dbname=CJFD0910
软件工程师的十个“不职业”行为	程序员	2009	2009年10期	【作者】 陈尚义 ； 【机构】 中软通用产品研发中心 ； 中科院研究生院 ；	软件工程师 ； 软件开发管理 ； 单元测试 ； 代码审查 ； 软件开发领域 ； 软件开发过程 ； 软件危机 ； 软件项目管理 ； 工作产品 ； 开发包 ；	职业化是软件工程师的必然选择。本文根据我在教学和软件开发管理方面的实践,列举几个软件工程师"不职业"的行为或习惯,从另外一个侧面进一步探讨什么是真正的软件工程师职业化。	2009年10期_软件工程师的十个“不职业”行为.pdf	http://sso.cdclib.org/interlibSSO/goto/6/=06190596Z93/kcms/detail/detail.aspx?dbCode=cjfq&filename=ITSJ200910071&dbname=CJFD0910
Mobile Market 能为开发者带来什么?	程序员	2009	2009年10期	【作者】 刘铁锋 ；	开发者 ； Mobile Market ； 中国移动 ； ARPU ； 分成比例 ； 手机卡 ； 外包公司 ； 智能手机市场 ； 移动应用 ； 宣传攻势 ；	吵吵嚷嚷,真真假假,在各种扑朔迷离的消息传了很多次之后,中国移动的Mobile Market终于正式上线运营了。这可算是业界第一个运营商自己涉足的程序商店了。和苹果、微软等大公司推出Appstore/Windows market的意义不同,操作系统厂商更在乎的是平台的推广和市场份额的增长,而不会在分成比例以及程序的控制上做过多的限制。对于中国移动的应用商店,可能更加割舍不下的,就是挖掘出更多的ARPU。在这样的情况下,不得不让个人开发者产生一丝担心。	2009年10期_Mobile+Market+能为开发者带来什么?.pdf	http://sso.cdclib.org/interlibSSO/goto/6/=06190596Z93/kcms/detail/detail.aspx?dbCode=cjfq&filename=ITSJ200910072&dbname=CJFD0910
守护绿色,守护家园	程序员	2009	2009年09期	【作者】 郑柯 ；	蓝色星球 ； 总排放量 ； 节能理念 ； 节约用水 ； 化石燃料 ； 信息技术设备 ； 生物品种 ； 电子行业 ； 冰冠 ； 二氧化碳量 ；	<正>前不久看了一部名为《家园(Home)》的纪录片,其中列举的种种数据让人触目惊心:我们居住的这个蓝色星球已经存在了45亿年,而人类历史只有20万年;过去50年,人类对地球的改变,比前面20万年还要多;	2009年09期_守护绿色,守护家园.pdf	http://sso.cdclib.org/interlibSSO/goto/6/=06190596Z93/kcms/detail/detail.aspx?dbCode=cjfq&filename=ITSJ200909001&dbname=CJFD0910
计算世界的奇妙探险——第一位图灵奖女得主Frances E.Allen	程序员	2009	2009年09期	【作者】 吕娜 ；	图灵奖 ； 女科学家 ； 计算机科学 ； 编译技术 ； 美国计算机 ； 并行处理技术 ； 并行计算 ； 计算技术 ； 开创性贡献 ； 高速计算机 ；	<正>她,是IBM历史上第一位女院士。她,是现代计算机编译器领域最杰出的女科学家。她,是图灵奖历史上第一位女性获奖者,叫Frances E.Allen。农场姑娘时间定格在1933年的美国纽约北部,Allen出生在一个没有电、没有暖气、没有自来水的农场,那是一个计算机诞生之前的时代。因为家里很穷,	2009年09期_计算世界的奇妙探险——第一位图灵奖女得主Frances+E.Allen.pdf	http://sso.cdclib.org/interlibSSO/goto/6/=06190596Z93/kcms/detail/detail.aspx?dbCode=cjfq&filename=ITSJ200909004&dbname=CJFD0910
让玩家主宰游戏世界	程序员	2009	2009年09期	【作者】 谭群钊 ； 【机构】 盛大网络 ；	游戏世界 ； 娱乐内容 ； 游戏体验 ； 虚拟世界 ； 盛大网络 ； 盛大文学 ； 游戏玩家 ； 首席技术官 ； 开发者 ； 长尾 ；	<正>互联网的出现,从三个方面改变了人们的娱乐方式:首先,它改变了娱乐的体验形式,人们可以在互联网的虚拟世界中,进行一些从未有过的娱乐活动;其次,它改变了人们的娱乐内容,比如网络游戏的出现,其游戏体验完全不同于最初的单机版游戏,在网络游戏的世界中,你可以和更多的朋友进行交流,更重要的是你能获得一个社区的承认	2009年09期_让玩家主宰游戏世界.pdf	http://sso.cdclib.org/interlibSSO/goto/6/=06190596Z93/kcms/detail/detail.aspx?dbCode=cjfq&filename=ITSJ200909005&dbname=CJFD0910
云计算,低成本创新之路	程序员	2009	2009年09期	【作者】 Jim Whitehurst ； 【机构】 红帽公司 ；	成本创新 ； 平台提供商 ； 软件开发商 ； 创新成本 ； 应用编程 ；	<正>随着云计算的概念逐渐深入人心,其模型也已经越来越清晰。而实际研发和运营中的不同角色,也在被各大云计算平台提供商利用自身的特点和优势进行着不同地演绎。云适用于任何企业其实,云适用于任何企业,只是不同规模的企业,所使用的云不尽相同而已:小	2009年09期_云计算,低成本创新之路.pdf	http://sso.cdclib.org/interlibSSO/goto/6/=06190596Z93/kcms/detail/detail.aspx?dbCode=cjfq&filename=ITSJ200909006&dbname=CJFD0910
平台与帽子——实现创新的产业链协作	程序员	2009	2009年09期	【作者】 芮祥麟 ； 【机构】 SAP中国研究院 ；	价值网络 ； 企业组织 ； 实体资源 ； 专用性 ； 个体企业 ； 规模经济 ； 信息技术行业 ； 二八法则 ； 自身规模 ； 业务流程 ；	<正>单个企业组织好比单枪匹马的商船,可能轻易地就被吞并消灭。而围绕核心价值链,整合上下游优势,形成核心的商业价值网络,才像一支支舰队,决胜商海。商业价值网络,强调突破个体企业资源专用性边界,跨组织共享信息资源、配置实体资源;同时强调在产业价值链的每个节点上,发挥个体能动性、创造性。所以,我们需要在商业价值	2009年09期_平台与帽子——实现创新的产业链协作.pdf	http://sso.cdclib.org/interlibSSO/goto/6/=06190596Z93/kcms/detail/detail.aspx?dbCode=cjfq&filename=ITSJ200909007&dbname=CJFD0910
成本不再是唯一的奶酪	程序员	2009	2009年09期	【作者】 杨洪林 ； 【机构】 Cognizant中国区 ；	雀巢公司 ； 尼亚 ； 专有名词 ； 加利福尼亚州 ； 业务体系 ； 新劳动法 ； 人民币升值 ； 技术目标 ； CMMI ； 日本经济 ；	<正>外包并不是软件行业的专有名词,在许多其他行业中,外包也不是什么新鲜事:位于加利福尼亚州的名牌制衣公司帕塔戈尼亚公司,没有一家属于自己的工厂;瑞士的雀巢公司在世界各地拥有495家工厂,但其半数以上的产品还要由	2009年09期_成本不再是唯一的奶酪.pdf	http://sso.cdclib.org/interlibSSO/goto/6/=06190596Z93/kcms/detail/detail.aspx?dbCode=cjfq&filename=ITSJ200909008&dbname=CJFD0910
互操性是王道	程序员	2009	2009年09期	【作者】 Jonathan Erickson ； 【机构】 Dr.Dobb’s Journal ；	Novell ； 协作环境 ； 技术中心主任 ； 开发者 ； 正因 ；	<正>商业领域中的交流是频繁的。1993年,Andrew Schulman就在Dr.Dobb中撰文《Examining the Windows AARD Detection Code》指出,Microsoft和Novell正在不遗余力地进行合作。Microsoft正在尝试将其beta版的Windows运行在Novell的DR DOS上。	2009年09期_互操性是王道.pdf	http://sso.cdclib.org/interlibSSO/goto/6/=06190596Z93/kcms/detail/detail.aspx?dbCode=cjfq&filename=ITSJ200909009&dbname=CJFD0910
非结构化数据的存储问题	程序员	2009	2009年09期	【作者】 韩锷春 ； 【机构】 甲骨文大中华区 ；	结构化数据 ； 存储问题 ； 存储应用 ； 非结构化 ； 文件系统 ； 电子表格 ； 系统设计人员 ； 事务处理 ； 一个问题 ； Orade ；	<正>如何存储应用系统中需要处理的非结构化数据,包括文本、图像、音频、视频、PDF、电子表格等,是常常困扰系统设计人员的一个问题。非结构化数据的存储通常有两种方式,一种方式是将这些数据以文件的方式存储在文件系统中,同时将指向文件的链接或路径存储在数据	2009年09期_非结构化数据的存储问题.pdf	http://sso.cdclib.org/interlibSSO/goto/6/=06190596Z93/kcms/detail/detail.aspx?dbCode=cjfq&filename=ITSJ200909010&dbname=CJFD0910
CrossBow-Solaris网络虚拟化和资源控制	程序员	2009	2009年09期	【作者】 陶震 ； 【机构】 Sun中国技术社区网站 ；	十字弓 ； 网络虚拟化 ； 资源控制 ； Solaris ； 长弓 ； 现有服务 ； 带宽资源 ； 网络接口卡 ； 性能损失 ； 战场上 ；	<正>公元前341年,中国人发明了十字弓(Crossbow),但直到中世纪,特别是当钢铁被用于制造武器时,它才得到了广泛的应用。威力强大的十字弓可以在200码之外穿透铠甲,这给安坐在马背上的骑士带来了真正的梦魇。这最大的区别之处就在于使用简单。在经过一周的训练后人们可以熟练地使用十字弓,而具备长弓的同等单弩发射技能则需要几年的练习。	2009年09期_CrossBow-Solaris网络虚拟化和资源控制.pdf	http://sso.cdclib.org/interlibSSO/goto/6/=06190596Z93/kcms/detail/detail.aspx?dbCode=cjfq&filename=ITSJ200909011&dbname=CJFD0910
如何进行Moblin的开发	程序员	2009	2009年09期	【作者】 李建 ；	开发环境 ； 虚拟机 ； Moblin ； 回调函数 ； 事件驱动 ； 编程接口 ； 硬件加速 ； clutter ； 函数库 ； 图形库 ；	虽然Moblin系统是一个完整的GNU/Linux系统,在其他GNU/Linux系统上写好的程序,很容易在Moblin上编译运行。但是,如果要进行正式的Moblin程序开发,准备一个Moblin开发环境很重要,除台式机外,Moblin系统还可以安装在KVM或者VMware虚拟机上。不想在一台机器上安装Moblin开发环境,也不想在虚拟机中安装的开发者,可以使用Moblin社区提供的MIC工具在自己的机器上自动配置一个开发环境,通过chroot的方式编译运行程序。	2009年09期_如何进行Moblin的开发.pdf	http://sso.cdclib.org/interlibSSO/goto/6/=06190596Z93/kcms/detail/detail.aspx?dbCode=cjfq&filename=ITSJ200909012&dbname=CJFD0910
虚拟化的崛起	程序员	2009	2009年09期	【作者】 涂曙光 ； 【机构】 微软(中国)有限公司 ；	虚拟机技术 ； 企业应用软件 ； 虚拟技术 ； 应用层面 ； 平台框架 ； 服务器软件 ； 应用开发人员 ； 服务器产品 ； 虚拟化应用 ； 天然优势 ；	<正>VMware公司宣布将以3.62亿美元现金及5800万元的股权,收购SpringSource公司。VMware公司的虚拟机技术看来似乎与Spring Framework没有太多关系,但我大胆预言,虚拟化的战争已经从虚拟机技术本身扩展到了它所支撑的应用层面,而两个主要的竞争对手就是微软和VMware。	2009年09期_虚拟化的崛起.pdf	http://sso.cdclib.org/interlibSSO/goto/6/=06190596Z93/kcms/detail/detail.aspx?dbCode=cjfq&filename=ITSJ200909013&dbname=CJFD0910
VMware收购SpringSource,构建PAAS平台梦想	程序员	2009	2009年09期	【作者】 范凯 ； 【机构】 JavaEye社区 ；	部门主管 ； PAAS ； SpringSource ； VMware ； exciting ； 设备领域 ； 虚拟操作系统 ； 在博 ； 虚拟机软件 ； 软件架构师 ；	<正>VMware收购SpringSource公司已经是2009年Java行业的第二笔重量级收购了。Rod Johnson也在博客里将这笔收购描述为exciting news,谈到这笔收购将在2009年的第3季度完成,之后SpringSource将成为VMware公司的一个部门,该部门主管继续由Rod Johnson担任,并且向WVware的CEO Paul Maritz负责。	2009年09期_VMware收购SpringSource,构建PAAS平台梦想.pdf	http://sso.cdclib.org/interlibSSO/goto/6/=06190596Z93/kcms/detail/detail.aspx?dbCode=cjfq&filename=ITSJ200909014&dbname=CJFD0910
软件工程又死了	程序员	2009	2009年09期	【作者】 潘加宇 ； 【机构】 UMLChina ；	软件工程 ； 文中 ； 感会 ； 人狼 ； Fowler ； 挑战极限 ；	<正>咦?为什么要说"又"呢?《人件》作者Tom Demarco在IEEE Software杂志七月刊上发表了一篇短文"Software Engineering: An Idea Whose Time Has Come and Gone"。该文只有两页,Tom Demarco在文中的主要观点是:严格的控制只能让你得到赚一点点钱的软件,不严格控制才有机会开发出赚大钱的软件。Tom Demarco还用抚养十几岁的	2009年09期_软件工程又死了.pdf	http://sso.cdclib.org/interlibSSO/goto/6/=06190596Z93/kcms/detail/detail.aspx?dbCode=cjfq&filename=ITSJ200909015&dbname=CJFD0910
收购,又见收购	程序员	2009	2009年09期	【作者】 叶亮 ；	收购价格 ； 一体化解决方案 ； 运营权 ； 计划开发 ； Amazon ； 独家销售 ； 数据中心 ； 应用服务器 ； 产品部门 ； store ；	<正>Facebook在8月11日宣布收购FriendFeed,但并未公布收购价格。很明显,此举是应对Twitter的挑战。作为双方协议的一部分,包括4名创始人在内的所有FriendFeed员工将加入Facebook。之前,期望Facebook或者Google收购twitter的呼声都很高,为什么最后选择了FriendFeed	2009年09期_收购,又见收购.pdf	http://sso.cdclib.org/interlibSSO/goto/6/=06190596Z93/kcms/detail/detail.aspx?dbCode=cjfq&filename=ITSJ200909016&dbname=CJFD0910
突破藩篱	程序员	2009	2009年09期	【作者】 马宁 ； 【机构】 微软 ；	中国移动 ； Store ； Symbian ； 开发者 ； Android ； 面向对象的 ； 开发环境 ； 团队开发 ； 草根阶层 ； 生态链 ；	<正>中国移动的MMarket终于上线了,现在还处于征集应用的阶段,支持Ophone、Windows Mobile和Symbian等几个平台。OMS基于Google Android平台,被联想、HTC和DELL等品牌手机支持,这也印证了DELL开发Android手机的传闻。MMarket的申请方式与App Store基本类似,目前提交软件不需要费用,这是符合目前中国开发者及软件比较少的现状的。与"百宝箱"被	2009年09期_突破藩篱.pdf	http://sso.cdclib.org/interlibSSO/goto/6/=06190596Z93/kcms/detail/detail.aspx?dbCode=cjfq&filename=ITSJ200909017&dbname=CJFD0910
甲骨文多项收购信息及产品发布	程序员	2009	2009年09期	【作者】 王翔 ；	OLTP ； 数据库产品 ； 能力提升 ； Orade ； 集成能力 ； oracle ； 异构数据库 ； 数据平台 ； 数据迁移 ； 异地容灾 ；	<正>这个月,Oracle的各类新闻充斥了数据库"圈子"。由于对BEA和SUN的收购,Oracle不仅很大程度巩固了既有的数据库领导者位置,而且将数据应用的交付能力提升到一个新的阶段。本月,Oracle收购了GoldenGate,借助该产品Oracle OLTP处理的实	2009年09期_甲骨文多项收购信息及产品发布.pdf	http://sso.cdclib.org/interlibSSO/goto/6/=06190596Z93/kcms/detail/detail.aspx?dbCode=cjfq&filename=ITSJ200909018&dbname=CJFD0910
虚拟化技术的下一个浪潮	程序员	2009	2009年09期	【作者】 高巍 ； 【机构】 华中科技大学 ；	VMWare ； 虚拟机 ； 最佳产品奖 ； 应用程序 ； 物理资源 ； 管理开销 ； 计费管理 ； 性能监测 ； 存储性能 ； 虚拟化管理 ；	<正>4.2亿美元,VMware成交了公司成立11年以来最大的一笔收购,被收购的SpringSource是一个为企业应用提供开源Spring架构的商业团队。VMWare在声明中提到,"现代计算环境正在开始向以应用和数据为中心、以虚拟化和云平台为支撑的环境中迁移"。这说明这家在虚拟化领域最成功的企业已经充分认可了未来的计算模式向云计算方向发展的趋势,并且正在努力扩展以它为代表的虚拟化技术在未来这个领域的势力范围。	2009年09期_虚拟化技术的下一个浪潮.pdf	http://sso.cdclib.org/interlibSSO/goto/6/=06190596Z93/kcms/detail/detail.aspx?dbCode=cjfq&filename=ITSJ200909019&dbname=CJFD0910
火热的七月	程序员	2009	2009年09期	【作者】 赵青 ； 【机构】 九艺科技 ；	数码互动 ； 同时在线人数 ； 魔兽世界 ； 梦幻西游 ； 腾讯 ； 内部测试 ； 时间问题 ； 民族感情 ； 商务会议 ； 开发理念 ；	<正>7月23日第七届中国国际数码互动娱乐展览会(简称"ChinaJoy")在上海国际博览中心开幕,和往年一样,还是一样的吵,我晃了一会儿赶紧出来,不然这老耳朵就受不了了。Showgirl依然那么多,穿的还是那么的少,套用网友的一句话,"一眼望去都是肉"。当然,我们要用艺术的眼光去欣赏。媒	2009年09期_火热的七月.pdf	http://sso.cdclib.org/interlibSSO/goto/6/=06190596Z93/kcms/detail/detail.aspx?dbCode=cjfq&filename=ITSJ200909020&dbname=CJFD0910
多事之秋	程序员	2009	2009年09期	【作者】 肖新光 ； 【机构】 安天实验室 ；	远程管理 ； 瑞星 ； 社会工程学 ； 中间人攻击 ； 安天实验室 ； 密码学家 ； 硬件安全 ； 电子商务体系 ； 无线键盘 ； 就这样 ；	<正>常言说,"多事之秋",立秋前后,一度平静的网络世界再起波澜。先是瑞星站点沦陷,之后则有搜狐、天涯、阿里巴巴等一线站点也先后被安全公司发现挂马。这一切都让人对网络世界信心进一步丧失,而江湖传言近期有一批0DAY在流传,其中包含一个3389远程管理和一个IIS6的严重漏洞。	2009年09期_多事之秋.pdf	http://sso.cdclib.org/interlibSSO/goto/6/=06190596Z93/kcms/detail/detail.aspx?dbCode=cjfq&filename=ITSJ200909021&dbname=CJFD0910
IBM数据分析和安全相得益彰	程序员	2009	2009年09期	【作者】 贾菡 ；	数据分析 ； IBM ； 咨询服务 ； 行为预测 ； 预测软件 ； 信息咨询 ； 企业分析 ； 数据管理 ； 业务分析 ； 全资收购 ；	<正>本月初,行业分析机构IDC根据各公司IT咨询服务的收入,选出2008年度10大全球IT咨询服务商和10大美国IT咨询服务商, IBM被评为2008年度全球最大的lT咨询服务商。至此,IBM已经是连续两年获此殊荣。在IBM提供的产品及服务中,除传统IT咨询服务如IT性能分	2009年09期_IBM数据分析和安全相得益彰.pdf	http://sso.cdclib.org/interlibSSO/goto/6/=06190596Z93/kcms/detail/detail.aspx?dbCode=cjfq&filename=ITSJ200909022&dbname=CJFD0910
Django及国内Python社区进展	程序员	2009	2009年09期	【作者】 高昂 ； 【机构】 资源与环境信息系统国家重点实验室 ；	Python ； Django ； 聚集函数 ； 模型层 ； 数据库表 ； 查询表达式 ； 用户定义 ； 管理界面 ； 对象模型 ； 单元测试 ；	<正>在Django框架的1.1发布版中,对ORM进行了增强,支持count(), max(),min()等聚集函数和查询表达式。在模型层,添加了非托管模型,允许用户选择使用脱离django管理的model层,并允许用户定义的model不与数据库表一一对应。在Django自带的Admin管理界面上,新版本添	2009年09期_Django及国内Python社区进展.pdf	http://sso.cdclib.org/interlibSSO/goto/6/=06190596Z93/kcms/detail/detail.aspx?dbCode=cjfq&filename=ITSJ200909023&dbname=CJFD0910
嵌入式移动开发新格局	程序员	2009	2009年09期	【作者】 孙天泽 ； 【机构】 华清远见嵌入式培训中心 ；	中国移动 ； 上真 ； Android ； 移动领域 ； 首款 ； 谷歌 ； 智能手机市场 ； 用户体验 ； 市场推广 ； 应用程序 ；	<正>首先看一条来自苹果的消息,联通斥资100亿元人民币,以2000元/部的单价从美国苹果公司一次性采购了500万部WCDMA制式iPhone手机。在苹果公司与中移动、联通谈判了多年后,中国消费者终于快要吃上真的苹果了。虽然有传言称国内的iPhone还不能用WIFI,但是联通	2009年09期_嵌入式移动开发新格局.pdf	http://sso.cdclib.org/interlibSSO/goto/6/=06190596Z93/kcms/detail/detail.aspx?dbCode=cjfq&filename=ITSJ200909024&dbname=CJFD0910
企业应用开发	程序员	2009	2009年09期	【作者】 胡长城 ； 【机构】 普元软件 ；	企业应用开发 ； 公司计划 ； 中间件 ； 大型公司 ； 软件解决方案 ； 阿里软件 ； 数据交换 ； 信息系统 ； 设计器 ； 中国工商银行 ；	<正>最近两起业界收购新闻,值得关注。一起是德国SAP公司正在计划考虑收购美国老牌中间件公司TIBCO,另一起则是Software AG公司计划斥资6.81亿美元收购IT架构咨询公司IDS Scheer(这将是2009年德国境内首个大型公司并购交易)。	2009年09期_企业应用开发.pdf	http://sso.cdclib.org/interlibSSO/goto/6/=06190596Z93/kcms/detail/detail.aspx?dbCode=cjfq&filename=ITSJ200909025&dbname=CJFD0910
性能优化的简单法则	程序员	2009	2009年09期	【作者】 王保平 ； 【机构】 淘宝网UED部 ；	性能优化 ； 雅虎 ； 延迟加载 ； Yahoo ； 产品设计 ； 思想领域 ； 第一眼 ；	<正>美国雅虎的新版首页终于发布上线,每次美国首页的改版都牵动着全世界前端工程师的注意力。其他的不表,今天只谈前端性能的优化。在Web开发领域,Yahoo!性能团队提出了著名的34条性能优化法则,归为7个类别。这次雅虎的新首页自然也是严格的遵循这34条法则。	2009年09期_性能优化的简单法则.pdf	http://sso.cdclib.org/interlibSSO/goto/6/=06190596Z93/kcms/detail/detail.aspx?dbCode=cjfq&filename=ITSJ200909026&dbname=CJFD0910
新闻	程序员	2009	2009年09期		阿拉丁 ； 创新大会 ； 李彦宏 ； 趋势论坛 ； 中国大饭店 ； 未来互联网 ； 搜索技术 ； 李一男 ； Novell ； 技术理念 ；	<正>百度技术创新大会开幕"阿拉丁"携"框计算"应用成技术焦点8月18日,"2009百度技术创新大会"在北京中国大饭店举行。在本次大会上,百度董事长兼CEO李彦宏提出了"框计算"(Box Computing)技术理念,并阐述"框计算"对于未来互联网发展格局的影响。在搜索技术趋势论坛上,作为"框计算"技术的重要组成部分,被喻为下一代搜索引擎标志性技术的"阿拉丁"计划亮相。	2009年09期_新闻.pdf	http://sso.cdclib.org/interlibSSO/goto/6/=06190596Z93/kcms/detail/detail.aspx?dbCode=cjfq&filename=ITSJ200909027&dbname=CJFD0910
