title	journal_name	year	issue	author	keywords	summary	pdf_filename	article_url
开源项目	程序员	2009	2009年04期		开源项目 ； 业务逻辑 ； 实践验证 ； 依赖注入 ； 逻辑部分 ； Command ； 微架构 ； 应用程序 ； 数据管理 ； 事件驱动 ；	<正>Cairngorm Framework何处加入:http://opensource.adobe.com/wiki/display/cairngorm/Cairngorm Cairngorm是一个在Flex、AIR上构建的一个轻量级框架。它集合了一系列被实践验证的设计模式,并提倡在开发Flex时使用最佳实践。	2009年04期_开源项目.pdf	http://sso.cdclib.org/interlibSSO/goto/6/=06190596Z93/kcms/detail/detail.aspx?dbCode=cjfq&filename=ITSJ200904075&dbname=CJFD0910
创新项目	程序员	2009	2009年04期		动画短片 ； http ； 专业知识 ； 电子表单 ； 视频短片 ； 互联网视频 ； 访问速度 ； 无缝集成 ； Lotus ； 人说 ；	<正>拼卡通3D动漫桌面工具一句话描述:拼卡通是一款集3D动漫短片制作,分享和聊天功能的桌面工具体验地址:http://www.pktoon.cn/拼卡通能够让用户像搭积木一样,无须专门学习,无须专业知识,非常简单地创作3D动画短片。	2009年04期_创新项目.pdf	http://sso.cdclib.org/interlibSSO/goto/6/=06190596Z93/kcms/detail/detail.aspx?dbCode=cjfq&filename=ITSJ200904076&dbname=CJFD0910
脚本之力——《精通Perl》书评	程序员	2009	2009年04期	【作者】 假洋鬼子 ；	Perl ； 大学课堂 ； 计算机系统软件 ； 面向对象 ； 申农 ； 巴克斯 ； 能指与所指 ； 计算机科学 ； perl ； 图灵奖 ；	<正>说点什么呢,说点关于语言的事吧。空气中已经弥漫了火药味,但这不是战争,这是节日带来的欢庆气氛,央视大楼被点着了,更使这节日的气氛中平添了一点黑色幽默。索绪尔,一百年前,在日内瓦的大学课堂上,提出了他的语言能指理论,据后来人讲,索绪尔是个独来独往、郁郁寡欢的人,他一天	2009年04期_脚本之力——《精通Perl》书评.pdf	http://sso.cdclib.org/interlibSSO/goto/6/=06190596Z93/kcms/detail/detail.aspx?dbCode=cjfq&filename=ITSJ200904077&dbname=CJFD0910
YAGNI……——《卓有成效的程序员》节选	程序员	2009	2009年04期		YAGNI ； 软件功能 ； 软件开发者 ； 代码重用 ； 应用程序 ； 单元测试 ； 面向对象 ； 软件系统 ； 功能代码 ； 数据库接口 ；	<正>YAGNI是"You Ain’t Gonna Need It"(你不会需要它)的缩写,也是敏捷开发对预想开发的战斗宣言。预想开发(speculative development)的例子可谓俯拾皆是。程序员们对自己说:"我肯定以后会需要这项额外的功能,所以现在就提前把它实现了吧。"这是滑向深渊的第一	2009年04期_YAGNI……——《卓有成效的程序员》节选.pdf	http://sso.cdclib.org/interlibSSO/goto/6/=06190596Z93/kcms/detail/detail.aspx?dbCode=cjfq&filename=ITSJ200904078&dbname=CJFD0910
新书上架	程序员	2009	2009年04期		软件开发技术 ； 多处理器 ； 计算机系统 ； 组件化 ； 伟明 ； 命令行 ； 项目代码 ； 功能菜单 ； 多线程 ； 软件安全 ；	<正>多核计算与程序设计作者:周伟明出版社:华中科技大学出版社本书由多核编程资深专家、软件开发技术大会最受欢迎讲师之一周伟明所著。作者在总结多年实践心得基础上,重点围绕多核(或多处理器)计算机系统的算法和程序这一重心,分五个部分展开讲述。书中剖析了多	2009年04期_新书上架.pdf	http://sso.cdclib.org/interlibSSO/goto/6/=06190596Z93/kcms/detail/detail.aspx?dbCode=cjfq&filename=ITSJ200904079&dbname=CJFD0910
Web应用时代的RAD:需求旺盛,市场已死	程序员	2009	2009年04期	【作者】 杨武 ； 【机构】 思科系统中国研发有限公司 ；	RAD ； Web ； 超文本 ； Dreamweaver ； 动态网站 ； 程序开发人员 ； 应用开发平台 ； 组件设计 ； 正面竞争 ； 动态页面 ；	<正>轮子总是一遍又一遍的被重新发明,现在大家都热衷于开发复杂而又花哨的Web应用了。GMail和Google Map点燃了互联网Web 2.0的战火,以至于现在无论客户还是开发商设计系统必然是B/S架构。HTML从当初仅仅用来编写超文本,发展到今天而被用来提供完整的用户	2009年04期_Web应用时代的RAD:需求旺盛,市场已死.pdf	http://sso.cdclib.org/interlibSSO/goto/6/=06190596Z93/kcms/detail/detail.aspx?dbCode=cjfq&filename=ITSJ200904080&dbname=CJFD0910
架构设计的How-to	程序员	2009	2009年04期	【作者】 高焕堂 ； 【机构】 MISOO软件开发与管理顾问公司 ；	How-to ； 软件系统 ； 软件技术 ； 快捷方式 ； 正面回答 ； 李雨 ；	<正>常常有人问我两个关于架构师的问题: 1.程序员如何(How-to)成为好的架构师? 2.资浅架构师如何(How-to)设计出好的架构?这两个问题其实是一体的两面,皆基于同一个观点:如果能找到How-to来喂给程序	2009年04期_架构设计的How-to.pdf	http://sso.cdclib.org/interlibSSO/goto/6/=06190596Z93/kcms/detail/detail.aspx?dbCode=cjfq&filename=ITSJ200904081&dbname=CJFD0910
大事之年	程序员	2009	2009年03期	【作者】 欧阳璟 ；	十一届三中全会 ； 外汇资产 ； 电子产品 ； 大飞机项目 ； 产品竞争 ； 凭什么 ； 国民财富 ； 十年 ； 人力资源成本 ； 本地市场 ；	<正>三十年对于中国来说似乎是一个轮回,每当我们到达这个时候,总有大事发生。三十年前, 1979年的十一届三中全会让中华民族展现在整个世界面前。不用去细数改革开放的丰功伟绩,单是过去发达的泱泱大国,哪个敢不正视中国今天的强大?而另一个三十年前,恰恰是中华	2009年03期_大事之年.pdf	http://sso.cdclib.org/interlibSSO/goto/6/=06190596Z93/kcms/detail/detail.aspx?dbCode=cjfq&filename=ITSJ200903001&dbname=CJFD0910
孤独的“酋长”——Yahoo!创始人杨致远	程序员	2009	2009年03期	【作者】 吕娜 ；	杨致远 ； Yahoo ； 雅虎 ； 美籍华裔 ； 创办人 ； 谷歌 ； 格利佛游记 ； 创业过程 ； 门户网 ； 盖茨 ；	<正>美籍华裔杨致远,Yahoo!的创办人之一,28岁时就成了亿万富翁,被称作华裔"比尔·盖茨"。他创建的雅虎是全球流量最大的综合型网站,世界最知名的互联网品牌之一,被誉为互联网最古老和最持久的传奇。杨致远1967年生于中国台湾,两岁时不幸丧父,母亲是一位英语和戏	2009年03期_孤独的“酋长”——Yahoo!创始人杨致远.pdf	http://sso.cdclib.org/interlibSSO/goto/6/=06190596Z93/kcms/detail/detail.aspx?dbCode=cjfq&filename=ITSJ200903004&dbname=CJFD0910
打造中国科研的“奥运军团”	程序员	2009	2009年03期	【作者】 沈向洋 ； 【机构】 微软公司 ；	奥运军团 ； 中国科技界 ； 地震灾害 ； 汶川 ； 基础研究 ； 国际化人才 ； 国际顶尖 ； 体育竞技 ； 国外专家 ； 知春路 ；	<正>北京奥运的启示2008年,中国表现非凡,着实令世界刮目相看。8月8日,在北京奥运会正式开幕前,国内发生了很多事情。在抗击"5·12"四川汶川特大地震灾害的艰苦战役中,中国人所表现出的万众一心、不畏苦难的恢弘气魄,令世界为之惊叹。然而,在动用大量人力、物力抗震救灾的同时,有	2009年03期_打造中国科研的“奥运军团”.pdf	http://sso.cdclib.org/interlibSSO/goto/6/=06190596Z93/kcms/detail/detail.aspx?dbCode=cjfq&filename=ITSJ200903005&dbname=CJFD0910
亮剑——狭路相逢智勇者胜	程序员	2009	2009年03期	【作者】 周伟焜 ； 【机构】 IBM大中华区 ；	狭路相逢勇者胜 ； 智勇 ； 金融危机 ； 大萧条时期 ； 服务经济 ； 行业竞争力 ； 经济衰退 ； 中国出口企业 ； 沃森 ； 罗斯福政府 ；	<正>《亮剑》中有一句话:"古代剑客与对手狭路相逢时,无论对手有多么强大,也要亮出自己的宝剑,亮剑前剑磨得够锋利,自己的剑术够精湛,亮剑那一刻才能从容不迫。"面对呼啸而至的金融危机,我们需要有亮剑的勇气,正所谓狭路相逢勇者胜;同时要有亮剑的把握,保持平常心,正视危机,	2009年03期_亮剑——狭路相逢智勇者胜.pdf	http://sso.cdclib.org/interlibSSO/goto/6/=06190596Z93/kcms/detail/detail.aspx?dbCode=cjfq&filename=ITSJ200903006&dbname=CJFD0910
游戏开发人员的“两性一心”	程序员	2009	2009年03期	【作者】 王俊博 ； 【机构】 智冠科技股份有限公司 ；	游戏开发 ； 程序开发人员 ； 无可挑剔 ； 游戏运营商 ； 就是你 ；	<正>每一位优秀的游戏程序开发人员,他们都拥有一个共性,我简单的将其总结为"两性一心"。性,是性情的性;心,是心情的心。那"两性一心"是什么呢?首先说"两性":第一个性是耐性,耐性就是你如何能坚持到最后一分钟,如何把自身的产品,做到你已感觉无可挑剔,甚至失败了,自己也没有话说。	2009年03期_游戏开发人员的“两性一心”.pdf	http://sso.cdclib.org/interlibSSO/goto/6/=06190596Z93/kcms/detail/detail.aspx?dbCode=cjfq&filename=ITSJ200903007&dbname=CJFD0910
业界新闻	程序员	2009	2009年03期		业界新闻 ； 游戏行业 ； 第三方 ； Novell ； 鲍尔默 ； 谷歌 ； 多线程 ； 乔图 ； 游戏公司 ； 游戏产品 ；	<正>本月焦点云计算动向IBM拟通过亚马逊云计算服务发布软件IBM近日公布了通过亚马逊Web Services发布软件的计划。将利用亚马逊的EC2云计算服务以"即用即付"方式向客户和第三方开发人员提供软件。根据IBM的计划,用户可以使用DB2数据库、Informix	2009年03期_业界新闻.pdf	http://sso.cdclib.org/interlibSSO/goto/6/=06190596Z93/kcms/detail/detail.aspx?dbCode=cjfq&filename=ITSJ200903008&dbname=CJFD0910
《程序员》百期纪念	程序员	2009	2009年03期		华军软件园 ； 求伯君 ； 架构师 ； Android ； 善念 ； 软件架构设计 ； 扬帆远航 ； 一本 ；	<正>"心怀程序员美丽的心灵和憧憬,想象着您的愿望,真挚地相信它会实现。"程序员的秘密恭贺《程序员》发行100个月了,它一直陪伴着程序员的年轻心灵和美丽憧憬。虽然程序员常常会愁上心头而叹曰:新人长江后浪推前浪、技术日	2009年03期_《程序员》百期纪念.pdf	http://sso.cdclib.org/interlibSSO/goto/6/=06190596Z93/kcms/detail/detail.aspx?dbCode=cjfq&filename=ITSJ200903009&dbname=CJFD0910
主编观察	程序员	2009	2009年03期		大中华区 ； Muller ； 副主席 ； 软件开发人员 ； 开源社区 ； MySQL ； 开源项目 ； 社区网站 ； 教育软件 ； 开源数据库 ；	<正>Frederic Muller(莫海涛) Dexxon集团大中华区总经理、国际自由软件组织副主席、北京Linux用户组副主席推动开源软件事业,你就是"黑客"2009年的开源软件业,或许会持续挑战闭源商业模式和按用户收费软件许可证的企业,或许越来越多公司将把开源软件用于产品里面,或许还会有其他变化。但唯一不变的是,阻挡不	2009年03期_主编观察.pdf	http://sso.cdclib.org/interlibSSO/goto/6/=06190596Z93/kcms/detail/detail.aspx?dbCode=cjfq&filename=ITSJ200903010&dbname=CJFD0910
你单元测试了吗?	程序员	2009	2009年03期	【作者】 涂曙光 ； 【机构】 微软(中国)有限公司 ；	单元测试 ； 测试驱动开发 ； 软件开发 ； 开发模型 ； 开发任务 ； 代码段 ； 博客文章 ； 性态度 ；	<正>这个月说一说单元测试的事儿。JUnit在Java社区火了不短的一段时间之后,NUnit才在.NET社区中慢慢普及开来。当然,连Visual Studio都已经内置了单元测试组件,.NET开发人员也没啥可抱怨或感到遗憾的了。	2009年03期_你单元测试了吗?.pdf	http://sso.cdclib.org/interlibSSO/goto/6/=06190596Z93/kcms/detail/detail.aspx?dbCode=cjfq&filename=ITSJ200903011&dbname=CJFD0910
Sun发力JavaFX	程序员	2009	2009年03期	【作者】 范凯 ；	升级版本 ； 平台技术 ； 编程语言 ； JavaFX ； Sun ； 服务架构 ； 监测软件 ； 应用软件 ； Orange ； 终端市场 ；	<正>作为Sun最近力推的Java消费类脚本编程语言JavaFX,最近动作连连。2月,JavaFX Mobile发布,这是一项运用于UI处理的平台技术。JavaFX Mobile被作为JavaFX 1.1升级版本的一部分发布。JavaFX能够运行在现存Java ME平台之上,使Java开	2009年03期_Sun发力JavaFX.pdf	http://sso.cdclib.org/interlibSSO/goto/6/=06190596Z93/kcms/detail/detail.aspx?dbCode=cjfq&filename=ITSJ200903012&dbname=CJFD0910
Tom DeMarco们的新书	程序员	2009	2009年03期	【作者】 潘加宇 ；	入围名单 ； 三根 ； Tom DeMarco ； 项目管理经验 ； Style ； Lister ； Robertson ； 测试驱动开发 ； 一本 ； 毁坏性 ；	<正>在1月底的慕尼黑OOP 2009大会上,Tom DeMarco作了题为"The other three pillars of IT Performance"的演讲,主题聚焦于IT组织文化, DeMarco认为IT组织往往只注重能力这根支柱,却有意无意忽略另外三根支柱。在已经公布的今年(当然,评的是去年)的Jolt Awards最后入围名单上,	2009年03期_Tom+DeMarco们的新书.pdf	http://sso.cdclib.org/interlibSSO/goto/6/=06190596Z93/kcms/detail/detail.aspx?dbCode=cjfq&filename=ITSJ200903013&dbname=CJFD0910
GlassFish探索开源盈利模式?	程序员	2009	2009年03期	【作者】 叶亮 ；	Novell ； GlassFish ； 嵌套表 ； 定制化 ； 开源项目 ； 多媒体格式 ； 桌面应用 ； 存储过程 ； 技术合作协议 ； 索爱 ；	<正>GlassFish Portfolio于2月10日发布,这是在GlassFish V2.1基础上构建的商业组件。Portfolio由4大产品组成:GlassFish Enterprise Server、GlassFiSh ESB、GlassFish Web Space Server及GlassFish Web Stack。尽管Portfolio基本是由开源软	2009年03期_GlassFish探索开源盈利模式?.pdf	http://sso.cdclib.org/interlibSSO/goto/6/=06190596Z93/kcms/detail/detail.aspx?dbCode=cjfq&filename=ITSJ200903014&dbname=CJFD0910
春天在哪里	程序员	2009	2009年03期	【作者】 马宁 ； 【机构】 微软 ；	鲍尔默 ； 移动世界 ； Store ； 移动领域 ； OMAP ； 中国联通 ； 中国移动 ； 移动应用 ； 新产品发布 ； Nokia ；	<正>本月的大多数新闻都来自巴塞罗那的移动世界大会,之前的名字叫做3GSM大会。微软CEO鲍尔默多年来第一次亲自参加了这次大会,可见Windows Mobile仍然是微软在2009年关注的重点之一。微软宣布Windows Mobile 6.5即将发布,BSQUARE和TI正在开发基于OMAP平台的	2009年03期_春天在哪里.pdf	http://sso.cdclib.org/interlibSSO/goto/6/=06190596Z93/kcms/detail/detail.aspx?dbCode=cjfq&filename=ITSJ200903015&dbname=CJFD0910
厂商裁员少涉数据库领域,数据库厂商纷纷出补丁	程序员	2009	2009年03期	【作者】 王翔 ；	数据库领域 ； ORACLE ； 财务报告 ； MySQL ； 裁员计划 ； 技术人员 ； 移动数据库 ； 客户青睐 ； 功能扩充 ； Sybase ；	<正>随着ORACLE、IBM、微软、SUN纷纷公布自己的财务报告,各厂商也先后公布了裁员计划。SUN从去年5月至今裁员数量已升至5000-6000,但从官方表态中发现主要集中在其传统且已经积累为劣势的领域,对于从事MySQL的技术人员几乎没有提及。ORACLE面对	2009年03期_厂商裁员少涉数据库领域,数据库厂商纷纷出补丁.pdf	http://sso.cdclib.org/interlibSSO/goto/6/=06190596Z93/kcms/detail/detail.aspx?dbCode=cjfq&filename=ITSJ200903016&dbname=CJFD0910
二月龙抬头	程序员	2009	2009年03期	【作者】 钱宏武 ； 【机构】 原搜狐互动产品开发部 ；	龙抬头 ； 不如意 ； 技术人员 ； 算给 ； 垄断问题 ； 特定地点 ； 高分辨率 ； 水冲 ； 不知道 ； 时间轴 ；	<正>对于我们来说,农历新年的开始,才能让我们感觉到新的一年真的到来了,过去的一切不如意,都希望能随着鞭炮的轰鸣而过去,新的一年希望能在红火中开始。作为一名技术人员来说,目前最为关心的应该就是由Windows7所传出的一系列消息。首先是预计在今年推出新的版本——于八月	2009年03期_二月龙抬头.pdf	http://sso.cdclib.org/interlibSSO/goto/6/=06190596Z93/kcms/detail/detail.aspx?dbCode=cjfq&filename=ITSJ200903017&dbname=CJFD0910
产品、人才的争夺	程序员	2009	2009年03期	【作者】 赵青 ； 【机构】 九艺科技 ；	产品运营 ； 运营平台 ； 其他投资 ； 运营公司 ； 整体风险 ； 执行人员 ； 渠道成本 ； 支持平台 ；	<正>美国知名大报《基督教箴言报》报道了在北京的网瘾戒除中心,美国读者的评论如下:"你对游戏上瘾,就像对酒精上瘾一样。这更多是因为他们的想法而不是游戏本身。";"这就好像胖人到麦当劳吃饭,又觉得是麦当劳错让他们胖成那样。"	2009年03期_产品、人才的争夺.pdf	http://sso.cdclib.org/interlibSSO/goto/6/=06190596Z93/kcms/detail/detail.aspx?dbCode=cjfq&filename=ITSJ200903018&dbname=CJFD0910
希望与忧伤	程序员	2009	2009年03期	【作者】 肖新光 ； 【机构】 安天实验室 ；	蠕虫病毒 ； 控制端 ； 互联网管理 ； 病毒作者 ； 恶意行为 ； 应急组织 ； 职能机构 ； 捉放曹 ； 最终用户 ； 攻击目标 ；	<正>新年伊始,无论是安全厂商抑或是躲在暗处的黑客们都没能松懈,伴随着利用MS08-067漏洞大肆传播的Confickr蠕虫不断的升级控制指令,并伪造随机域名进行多重验证以混淆真实的控制端指令下达地址,对抗这一蠕虫病毒也不再是法国空军、海军,微软单独的事情了。当中国、美国的部	2009年03期_希望与忧伤.pdf	http://sso.cdclib.org/interlibSSO/goto/6/=06190596Z93/kcms/detail/detail.aspx?dbCode=cjfq&filename=ITSJ200903019&dbname=CJFD0910
逆市? 逆势?	程序员	2009	2009年03期	【作者】 贾菡 ；	供应链流程 ； 业务流程设计 ； 软件升级 ； 通讯平台 ； 数据挖掘 ； 员工数 ； 业务设计 ； 经济衰退 ； 三年 ； 项目管理 ；	<正>微软的ERP产品Dynamics AX 2009于2月1日开始在中国销售。它试图通过提供新型的多点共享服务,方便用户管理复杂的财务和供应链流程。这对于成长中的公司非常重要,因为它们经常遇到因全球及各地方的不同法规对业务流程设计和管理造成影响的复杂	2009年03期_逆市?+逆势?.pdf	http://sso.cdclib.org/interlibSSO/goto/6/=06190596Z93/kcms/detail/detail.aspx?dbCode=cjfq&filename=ITSJ200903020&dbname=CJFD0910
Django是否在重复制造轮子?	程序员	2009	2009年03期	【作者】 高昂 ； 【机构】 资源与环境信息系统国家重点实验室 ； OSGeo中国 ； InfoQ中文站 ；	版本发布 ； Python ； Django ； 开发者 ； 业务逻辑 ； 测试程序 ； 配置文件 ； 热插拔 ； 底层控制 ； 毫无意义 ；	<正>Python的Web开发框架Django自1.0版本发布后,已经逐步趋向稳定,最新版本为1.0.2,功能方面没有大的改动。五月份即将在捷克首都布拉格举办的Django大会"EuroDjangoCon 2009"正在展开各项准备工作,来自	2009年03期_Django是否在重复制造轮子?.pdf	http://sso.cdclib.org/interlibSSO/goto/6/=06190596Z93/kcms/detail/detail.aspx?dbCode=cjfq&filename=ITSJ200903021&dbname=CJFD0910
抓住经济危机下的机遇	程序员	2009	2009年03期	【作者】 孙天泽 ； 【机构】 华清远见嵌入式培训中心 ；	电子信息 ； 产业深度 ； 产业发展环境 ； 电子行业 ； 国际市场 ； “巨人” ； 中金岭南 ； 拉动内需 ； 全球金融危机 ； 通信设备制造 ；	<正>为了振兴国家经济,国务院不断为各个产业推出振兴规划。据中国政府网18日发布的消息称,国务院原则上通过了电子信息产业调整振兴规划。会议认为,在当前国际市场需求急剧下降、全球电子信息产业深度调整的形势下,振兴我国电子信息产业,必须强化自主创新,完善产业	2009年03期_抓住经济危机下的机遇.pdf	http://sso.cdclib.org/interlibSSO/goto/6/=06190596Z93/kcms/detail/detail.aspx?dbCode=cjfq&filename=ITSJ200903022&dbname=CJFD0910
注重RIA趋势,ERP厂商进军SaaS	程序员	2009	2009年03期	【作者】 胡长城 ； 【机构】 普元软件R&D部门 ；	ERP厂商 ； RIA ； SaaS ； 基础软件 ； 企业应用软件 ； 国内软件 ； 轻量型 ； 可扩展的 ； 业务产品 ； 服务器软件 ；	<正>Oracle最近正式对外推出了Rich Enterprise Application网站,主旨是基于Oracel ADF框架以帮助开发人员构建具有多通道能力的应用。可以说这为RIA的熊熊大火又添了把柴。虽然ADF带给国内众多厂商更多的	2009年03期_注重RIA趋势,ERP厂商进军SaaS.pdf	http://sso.cdclib.org/interlibSSO/goto/6/=06190596Z93/kcms/detail/detail.aspx?dbCode=cjfq&filename=ITSJ200903023&dbname=CJFD0910
前端也应关注安全	程序员	2009	2009年03期	【作者】 吕峰军 ； 【机构】 淘宝UED前端安全组 ；	安全界 ； 开发工程师 ； 工程师们 ； 系统管理员 ； 重装上阵 ； 蠕虫攻击 ； 用户体验 ； 名第 ； 脆弱不堪 ； 兵家必争之地 ；	<正>提到安全问题,首先想到应付这些问题的应是系统管理员及后台开发工程师们,而前端开发工程师似乎离这些问题很遥远。然而,08年安全界发生的一系列事件,已开始改变人们传统的安全观念。	2009年03期_前端也应关注安全.pdf	http://sso.cdclib.org/interlibSSO/goto/6/=06190596Z93/kcms/detail/detail.aspx?dbCode=cjfq&filename=ITSJ200903024&dbname=CJFD0910
和谐共鸣——IBM Lotusphere 2009记	程序员	2009	2009年03期	【作者】 欧阳璟 ；	美国东海岸 ； 迪斯尼世界 ； 副总裁 ； 奥兰多 ； 开发者 ； Lotus ； 智慧地球 ； 产品展示 ； 在线服务 ； 业务开发 ；	<正>IBM Lotusphere 2009大会,于2009年1月19日如期在美国东海岸奥兰多的迪斯尼世界公园举办。此次大会的主题为"共鸣(Resonance)",在大会上,包括IBM Lotus软件总经理Bob Picciano在内的8位IBM副总裁级别的高级管理人员均做以了精彩的主题演讲。与会者为来自世界各地超过7000名的开发者以及IBM的合作伙伴。	2009年03期_和谐共鸣——IBM+Lotusphere+2009记.pdf	http://sso.cdclib.org/interlibSSO/goto/6/=06190596Z93/kcms/detail/detail.aspx?dbCode=cjfq&filename=ITSJ200903025&dbname=CJFD0910
亿元现金,帮你“赢在巨人”	程序员	2009	2009年03期	【作者】 郑柯 ；	实际销售收入 ； 网络游戏产业 ； 产业调查 ； 网络游戏行业 ； 创业团队 ； 史玉柱 ； 网游企业 ； 九城 ； 推广平台 ； 上不封顶 ；	<正>2009年1月14日,在青岛举行的"2008年度中国游戏产业年会"上,《2008年度中国游戏产业调查报告》得以发布。报告显示, 2008年中国网游用户数达到4936万,市场实际销售收入达到183.8亿元,比2007年增长了76.6%。在其他行业一片愁云惨雾的情况下,网络游戏产业以其高增长的势头,继续让诸多旁观	2009年03期_亿元现金,帮你“赢在巨人”.pdf	http://sso.cdclib.org/interlibSSO/goto/6/=06190596Z93/kcms/detail/detail.aspx?dbCode=cjfq&filename=ITSJ200903026&dbname=CJFD0910
开发平台也过冬——专访IBM Rational总经理Daniel Sabbah	程序员	2009	2009年03期	【作者】 欧阳璟 ；	Rational ； Daniel Sabbah ； 敏捷方法 ； 需求工程 ； 嵌入式系统工程 ； 产品交付 ； 计算项目 ； 收购行动 ； 业务联系 ； 次将 ；	<正>2009年对于Rational这个开发平台厂商来说,同样是一个严寒的冬天。客户对于商业软件的选择开始变得越来越谨慎,面对庞大的授权费用,很多软件开发商开始考虑采用更加经济实用的产品来开发软件,从而降低软件的开发成本。对这个问题,Daniel直言不讳,他承认确实有不少用户正	2009年03期_开发平台也过冬——专访IBM+Rational总经理Daniel+Sabbah.pdf	http://sso.cdclib.org/interlibSSO/goto/6/=06190596Z93/kcms/detail/detail.aspx?dbCode=cjfq&filename=ITSJ200903027&dbname=CJFD0910
一个足球,带来一片欢笑——记联众《体育关爱基金》	程序员	2009	2009年03期	【作者】 郑柯 ； 周至 ；	体育关爱基金 ； 中心小学 ； 宝山镇 ； 北京市怀柔区 ； 红十字基金会 ； 一所 ； 网络游戏行业 ； 游戏公司 ； 捐赠者 ； 虚拟物品 ；	<正>2007年的"六一"儿童节,晴空万里,风和日丽。一支上百人的骑行队,一行150公里,来到了风景秀丽的北京市怀柔区。但是,他们没有在任何一个旅游景点停留半分,而是直奔向一所破旧小镇上的小学——宝山镇中心小学。这里十分贫困,孩子们没有一块像样的操场,甚	2009年03期_一个足球,带来一片欢笑——记联众《体育关爱基金》.pdf	http://sso.cdclib.org/interlibSSO/goto/6/=06190596Z93/kcms/detail/detail.aspx?dbCode=cjfq&filename=ITSJ200903028&dbname=CJFD0910
